,Data
0,"Toss: Sri Lanka have won the toss and they have opted to bowl first. They are not playing a second spinner, so Dilshan should bowl his quota. Watson says he would have batted anyway. He will continue to bat at No.3. Forrest returns."
1,"Dilshan to Wade, no run bowls it full straightaway and Warner jams it back to the bowler"
2,"Dilshan to Wade, no run on the backfoot and punched to short cover"
3,"Dilshan to Wade, no run gets forward and defends"
4,"Dilshan to Wade, no run comes forward and drives to short cover again"
5,"Dilshan to Wade, no run 'bowling' yells Sanga as another ball is defended"
6,"Dilshan to Wade, no run bowls it shorter and flatter and he punches it to short cover"
7,"Kulasekara to Warner, 1 run quite a bit of movement away from the left hander after pitching, he punches it wide of point"
8,"Kulasekara to Wade, no run shorter in length and he fends it off to the leftof first slip, Kapugedera is standing a bit wide"
9,"Kulasekara to Wade, no run touch shorter in length again and he punches it to the on side"
10,"Kulasekara to Wade, no run Sanga thinks he's nicked it and he throws the ball in the air but the umpire was unmoved! Wade made room and went down the track, no sign of an edge"
11,"Kulasekara to Wade, no run this time Wade doesn't offer a shot"
12,"Kulasekara to Wade, 1 wide Sanga has done well to stop four certain wides there, too wide down the leg side"
13,"Kulasekara to Wade, no run swings it away late and he steers it towards point"
14,"Dilshan to Warner, no run gets well forward and jams it back to the bowler"
15,"Dilshan to Warner, no run goes back and slaps it straight to cover"
16,"Dilshan to Warner, no run gets forward and steers it square of the wicket"
17,"Dilshan to Warner, 1 run floated on middle and leg and he clips it towards midwicket"
18,"Dilshan to Wade, no run comes forward and pushes it softly towards cover"
19,"Dilshan to Wade, 2 runs Wade decides to use his feet and he ends up clipping wide of square leg, had to really force that away, nice tight start by Dilshan"
20,"Kulasekara to Warner, FOUR runs Sanga goes back to Kula this time, he overpitches and Warner drives through the line, on the up and wide of mid-off, well timed"
21,"Kulasekara to Warner, 1 run drifts on the body and he tucks it wide of midwicket"
22,"Kulasekara to Wade, 1 run clipped away behind square on the on side for a single"
23,"Kulasekara to Warner, no run skids through and hits his thigh as he tries to work it away"
24,"Kulasekara to Warner, FOUR runs that's a classic shot! Pitched up and Warner stays at the crease and scoops it through the line and it lands just short of the straight boundary"
25,"Kulasekara to Warner, 1 leg bye an appeal for an lbw but it's given as runs, it skidded through and he played it close to the pads and the ball rolled to the off side"
26,"Dilshan to Warner, 1 run flighted on middle and clipped to the on side"
27,"Dilshan to Wade, 1 run defended towards short midwicket and they take a quick single"
28,"Dilshan to Warner, no run gets forward and pushes it down to cover, packed off side field there"
29,"Dilshan to Warner, no run defended just wide of the bowler"
30,"Dilshan to Warner, no run rocks back and slaps it hard but once again can't get it past the off side field"
31,"Dilshan to Warner, 1 run gets forward and clips it wide of square leg"
32,"Malinga to Warner, FOUR runs not sure what Warner was trying to do there, he tries to wham it through the on side and ends up getting the inside edge past the stumps, he played it one-handed"
33,"Malinga to Warner, no run gets behind the line and defends to the bowler"
34,"Malinga to Warner, 2 runs drifts on the body and he clips it wide of midwicket"
35,"Malinga to Warner, no run tries to slice it wide of point but Dilshan dives and cuts it off"
36,"Malinga to Warner, no run gets behind the line and knocks it down towards mid-off"
37,"Malinga to Warner, 1 run makes use of the width and steers it well wide of point"
38,"Dilshan to Warner, FOUR runs good shot by Warner! Tossed up and he gets the front leg forward, bends his knee and slogs wide of long-on"
39,"Dilshan to Warner, 2 runs gets forward and drives wide of mid-off"
40,"Dilshan to Warner, no run"
41,"Dilshan to Warner, no run on the front foot and driven down to cover"
42,"Dilshan to Warner, no run drops it short and he can't punch it past cover point"
43,"Dilshan to Warner, SIX runs Warner gives the charge and scoops it long over extra cover, that's 12 off the over"
44,"Malinga to Wade, 1 run drifts on the body and he tucks it to the leg side"
45,"Malinga to Warner, 3 runs nicely punched past extra cover and the fielder does brilliantly to pull the ball back near the rope and relay it to Jayawardene"
46,"Malinga to Wade, no run gets across and punches it down the track"
47,"Malinga to Wade, FOUR runs nicely dabbed away past the keeper, took advantage of the fact that there was no slip, Maharoof does his best to slide and cut it off at third man but there's some doubt if his foot was touching the rope, the third umpire takes a look but it's four"
48,"Malinga to Wade, no run tucks him for room and he steers it to the off side"
49,"Malinga to Wade, 1 run just opens the face and steers it to square third man"
50,"Kulasekara to Wade, 2 runs makes use of the width and steers it past that off side field, well placed"
51,"Kulasekara to Wade, no run fullish on middle and leg and he pushes it down the track"
52,"Kulasekara to Wade, no run stays back and punches it down towards mid-off"
53,"Kulasekara to Wade, no run tucks him up for room and he punches it down towards cover point"
54,"Kulasekara to Wade, 1 run on the pads and he clips it down towards short fine leg and Malinga fumbles"
55,"Kulasekara to Warner, no run drives inside out but can't beat extra cover"
56,"Maharoof to Wade, 1 run drifts on the pads and he tucks it to the on side"
57,"Maharoof to Warner, no run Warner tries to force it away but maharoof cramps him up for room, clips it to the on side"
58,"Maharoof to Warner, 1 leg bye clips it off his thighs to the leg side"
59,"Maharoof to Wade, 2 runs continues on the pads and he works it behind square, not the best effort by Malinga"
60,"Maharoof to Wade, 1 run this time Malinga runs across and manages to stop it properly"
61,"Maharoof to Warner, 1 run bowls it straight again and he works it just wide of mid-on"
62,"Dilshan to Warner, 2 runs works it wide of extra cover for a couple"
63,"Dilshan to Warner, 1 run drifts on the pads and he clips it down to fine leg"
64,"Dilshan to Wade, 1 run gets on his knee and paddles it to the leg side"
65,"Dilshan to Warner, no run gives it a bit more air and he squeezes it back to the bowler"
66,"Dilshan to Warner, 1 run gets forward and drives through the line down to long-off"
67,"Dilshan to Wade, 1 run flatter delivery and he clips it with the turn to the leg side"
68,"Maharoof to Wade, 1 run fullish on middle and off and he drives down towards long-on"
69,"Maharoof to Warner, no run Warner wanted to force that through the on side but he checked his shot and the ball dropped short of the fielder in the region of wide mid-on"
70,"Maharoof to Warner, FOUR runs he really hoicked that across the line and it was always going to test Herath at deep midwicket, all power in that one"
71,"Maharoof to Warner, 1 run drifts on the pads and he clips it behind square on the on side"
72,"Maharoof to Wade, no run drives on the up but straight towards point"
73,"Maharoof to Wade, 1 run Wade gives the charge but he ends up squirting it towards mid-off, challenges the fielder by taking a quick single"
74,"Dilshan to Wade, no run makes room and slices it on the up but short of point"
75,"Dilshan to Wade, no run comes forward and drives towards cover"
76,"Dilshan to Wade, no run drives but can't beat cover point"
77,"Dilshan to Wade, 1 run gently eased away to short square leg"
78,"Dilshan to Warner, no run checks his drive down to cover"
79,"Dilshan to Warner, 1 run the batsman gets well forward and forces it past cover"
80,"Maharoof to Warner, 1 run loosener on the off stump and he steers it wide of point"
81,"Maharoof to Wade, 1 run steers it down to third man and they jog the single"
82,"Maharoof to Warner, 1 run bit of an ugly hoick but he manages to place it wide of square leg"
83,"Maharoof to Wade, 1 run comes down the track and he forces it down to long-on, didn't look in control of that one"
84,"Maharoof to Warner, no run nicely fielded at short cover and Warner decides against the single"
85,"Maharoof to Warner, OUT Sri Lanka will be mighty relieved at that because it's Warner! Things get a little tasty as Maharoof walks past the batsman, Maharoof angles it across the left-hander, the batsman gets a thick outside edge and it's well taken by Sanga falling to his left, Maharoof says something to Warner who"
86,"Dilshan to Wade, no run"
87,"Dilshan to Wade, no run"
88,"Dilshan to Wade, 1 run gets forward and gently tucks it to the on side"
89,"Dilshan to Watson, 1 wide that was too wide down the leg side, poor ball"
90,"Dilshan to Watson, 1 run pushes it down towards cover point"
91,"Dilshan to Wade, no run watchfully leaves it alone to the keeper"
92,"Dilshan to Wade, no run squeezes it down towards point"
93,"Maharoof to Watson, no run fullish on the off stump and he punches it down towards mid-on"
94,"Maharoof to Watson, no run a touch slower and Watson shows the full face and defends towards mid-on"
95,"Maharoof to Watson, 1 run cramps him a bit for room but Watson adjusts well by opening the face and dabbing it down to third man"
96,"Maharoof to Wade, 2 runs short of a length and he cuts well wide of point and Malinga boots it away at third man, he may not be a 100% yet"
97,"Maharoof to Wade, no run gets across and quietly defends down the pitch"
98,"Maharoof to Wade, 1 run uses the angle and deftly steers it down to third man"
99,"Dilshan to Wade, no run bowls it flatter and Wade rocks back and thumps it to extra cover"
100,"Dilshan to Wade, FOUR runs well played by Wade! Bit more flight and Wade gets on his knee quickly and sweeps it hard and wide of square leg"
101,"Dilshan to Wade, 1 run clips it down to short fine leg and sets off, the throw was too wide to the keeper"
102,"Dilshan to Watson, no run flatter and Watson tries to squeeze that past short third man"
103,"Dilshan to Watson, 1 run had to scamper that single there! Clipped to short midwicket and Wade had to rush, the throw from Jayawardene was too high and Sanga did his best to try and back flick that to the stumps but was wide of the woodwork"
104,"Dilshan to Wade, 1 run clipped behind square for a single"
105,"Maharoof to Wade, no run keeps it on the middle and leg line and he clips it to mid-on"
106,"Maharoof to Wade, 1 run gets across and tucks it wide of midwicket for a single"
107,"Maharoof to Watson, SIX runs flat and powerful! Vintage Watson as he picks the length early and with great bat speed pulls that flat just over the midwicket rope, Maharoof bowling too short"
108,"Maharoof to Watson, 1 run bowls it fuller on the pads and Watson clips it in the air down to Kapugedera at deep midwicket"
109,"Maharoof to Wade, 1 run works it through the line down to long-on"
110,"Maharoof to Watson, no run slower ball and he quietly pushes it back to the bowler"
111,"Kulasekara to Wade, no run fullish on the stumps and squeezed back to the bowler"
112,"Kulasekara to Wade, 1 run full again and he pushes it past Kula to long-on"
113,"Kulasekara to Watson, no run touch short of a length and he punches it back to the bowler"
114,"Kulasekara to Watson, 1 run clipped to long-on and that brings up the 100"
115,"Kulasekara to Wade, FOUR runs full outside the off stump and he capitalises on the width and squeezes it past cover, nicely timed"
116,"Kulasekara to Wade, no run punches it back to the bowler"
117,"Malinga to Watson, FOUR runs lazy elegance! Class from Watson as he gets forward and just scoops it over mid-on, at first it looked he was going to spoon it tamely to the fielder but he got a lot more elevation than that"
118,"Malinga to Watson, no run tries to slash this through the off side but misses it"
119,"Malinga to Watson, 1 run clips it in front of midwicket for a single"
120,"Malinga to Wade, 1 run Wade stands in front of the crease, Malinga digs it in a bit shorter and Wade opens the face and dabs it to third man"
121,"Malinga to Watson, 2 runs short and wide and Malinga is lucky it didn't go for four, it cost half of that, Watson cuts on the up wide of point and Herath picks up at the deep"
122,"Malinga to Watson, no run wide again and Malinga's lucky again, Watson chopped it down to extra cover"
123,"Dilshan to Wade, 1 run makes room and cuts it in front of point"
124,"Dilshan to Watson, 1 run glides it wide of short third man"
125,"Dilshan to Wade, 1 run"
126,"Dilshan to Watson, OUT Herath manages to hang on! Dilshan bowls round the wicket and flat, Watson is on his knee and slogs him, the ball travels quickly and flat and Herath runs to his right at deep midwicket, nearly over-runs the ball but manages to hang on on the dive, the ball could easily have bounced off his han"
127,"Dilshan to Hussey, no run gets across and shoulders arms"
128,"Dilshan to Hussey, no run punches it down towards cover"
129,"Kulasekara to Wade, 3 runs Herath is inspired! Clipped towards fine leg and Herath slides and pulls it back before the rope"
130,"Kulasekara to Hussey, 1 run drives inside out towards mid-off and sets off for a quick single"
131,"Kulasekara to Wade, no run fuller delivery and once again he defends inside out"
132,"Kulasekara to Wade, no run tucks him for room and he punches it towards mid-off"
133,"Kulasekara to Wade, no run clips it down to midwicket"
134,"Kulasekara to Wade, OUT direct hit and he's gone! Excellent work by Dilshan there, Wade sliced it down towards short point and wasn't sure about the single, Hussey was off the blocks but Dilshan was too quick for him, picks up and throws flat at the stumps in one motion, just short of his ground and the third umpire"
135,"Dilshan to Wade, no run gets forward and defends"
136,"Dilshan to Wade, no run gets forward and steers it to the off side"
137,"Dilshan to Wade, no run driven towards cover"
138,"Dilshan to Wade, no run Appeal for a stumping! But he's safe, Wade's beaten on the drive outside the off stump but he ensured his back foot was behind the crease, Asad Rauf calls for assistance"
139,"Dilshan to Wade, 1 run stays back and chops it down towards third man"
140,"Dilshan to Hussey, 1 run clips it down towards mid-on and it's another decent effort by Dilshan, just 41 off ten overs, job well done"
141,"Kulasekara to Hussey, no run Kula gets it to skid through and beats the batsman"
142,"Kulasekara to Hussey, no run good length on the stumps and he drives to mid-on"
143,"Kulasekara to Hussey, no run gets across and punches it down to mid-off"
144,"Kulasekara to Hussey, 1 leg bye drifts on the pads and he tucks it towards square leg"
145,"Kulasekara to Wade, no run close call for Wade as he gets an inside edge which hits his pads, could so easily have dribbled onto the stumps, too close to cut as well"
146,"Kulasekara to Wade, 1 run clips it behind square on the on side for a single"
147,"Herath to Wade, OUT can't keep Herath out for too long! Strikes with ball No.1, comes round the wicket, Wade makes room to cut but he ends up getting a thick outside edge, good reflexes nevertheless as he takes it in the second attempt. Good knock by Wade"
148,"Herath to Forrest, 1 run comes forward and drives towards cover"
149,"Herath to Hussey, no run stays back and defends"
150,"Herath to Hussey, no run gets well forward and defends"
151,"Herath to Hussey, no run comes well forward and clips it to midwicket"
152,"Herath to Hussey, 1 run drives him down to long-off"
153,"Malinga to Hussey, 2 runs tucks him up for room and he chops it down to square third man and the batsmen hurry for the second run and the throw was too high"
154,"Malinga to Hussey, FOUR runs gives him width and Hussey bends his knee and slices it wide of backward point, Herath runs across from third man and has it covered but fails to pull it back as the ball rolls back to the rope"
155,"Malinga to Hussey, 1 run gets on the front foot and drives to mid-off"
156,"Malinga to Forrest, no run bowls it straighter and he punches it down the track"
157,"Malinga to Forrest, 2 runs tucked away close to the pads towards long leg and the throw to the keeper is too high"
158,"Malinga to Forrest, no run angles it across the right-hander and he leaves it alone to the keeper"
159,"Herath to Hussey, 1 run"
160,"Herath to Forrest, no run stays back and punches it back to the bowler"
161,"Herath to Forrest, no run gets forward and drives back to the bowler"
162,"Herath to Forrest, OUT Forrest looked quite flummoxed there! Herath got it to grip and Forrest was looking to drive towards mid-off but the ball spun just a bit and hit the off stump, Forrest playing down the wrong line"
163,"Herath to Christian, no run comes well forward and defends"
164,"Herath to Christian, no run driven firmly back to the bowler"
165,"Malinga to Hussey, no run good length on the off stump and he punches it towards point"
166,"Malinga to Hussey, no run Hussey nearly chopped that onto his stumps, he expected that to bounce a bit more"
167,"Malinga to Hussey, 1 run a bit too straight and he clips him down towards fine leg"
168,"Malinga to Christian, no run gets on the backfoot and pushes it towards point"
169,"Malinga to Christian, 1 run fullish on the off stump and he drives to sweeper cover"
170,"Malinga to Hussey, 1 run gives him width and he slices him wide of point"
171,"Herath to Hussey, 1 run floated on middle and off and he drives to the off side"
172,"Herath to Christian, no run gets well forward and defends"
173,"Herath to Christian, no run defends inside out back to the bowler"
174,"Herath to Christian, 1 run forced past the bowler and Malinga does well to slide at mid-on"
175,"Herath to Hussey, no run plonks forward and defends"
176,"Herath to Hussey, 1 run flighted slowly and the batsman has time to rock back and clip it to the leg side"
177,"Maharoof to Hussey, no run slower ball outside the off stump and he steers it softly to the off side"
178,"Maharoof to Hussey, 1 run gets an inside edge on the drive to the on side"
179,"Maharoof to Christian, no run gets forward and pushes it down towards cover"
180,"Maharoof to Christian, no run slower ball and he softly pushes it towards the bowler"
181,"Maharoof to Christian, no run gets on the front foot and pushes it back to the bowler"
182,"Maharoof to Christian, 2 runs pulls towards deep midwicket for a couple but he doesn't quite time it"
183,"Herath to Hussey, 1 run tossed up on the leg stump and he clips it down towards midwicket"
184,"Herath to Christian, no run plonks forward and defends"
185,"Herath to Christian, 1 run gets well forward and drives to the off side"
186,"Herath to Hussey, 1 run tossed up outside off and driven on the up wide of extra cover"
187,"Herath to Christian, 1 run gets across and clips it wide of midwicket"
188,"Herath to Hussey, 1 run punches it off the front foot down towards cover"
189,"Maharoof to Hussey, no run gets on the front foot and drives towards mid-off"
190,"Maharoof to Hussey, no run just short of a length and he chops it down towards point"
191,"Maharoof to Hussey, 1 run gets across and clips it down to deep midwicket"
192,"Maharoof to Christian, no run slower delivery and he gets forward and quietly defends"
193,"Maharoof to Christian, 1 run tries to force it away down to fine leg but the ball hurries on him and hits his body"
194,"Maharoof to Hussey, OUT hits him a touch high but Asad Rauf's convinced! Maharoof gets it to nip back in off the pitch, the ball skids through and hits his thigh but Rauf was convinced with the height, took a few seconds before raising the finger"
195,"Herath to Christian, 1 run gets well forward and tucks it to the on side"
196,"Herath to Lee, no run plonks forward and defends"
197,"Herath to Lee, no run he's happy to defend this one as well"
198,"Herath to Lee, no run defends close to the pads and Sanga's a bit excited"
199,"Herath to Lee, no run flatter delivery and defended"
200,"Herath to Lee, 1 run bowls it flat again and he defends"
201,"Maharoof to Lee, no run gets it to swing in late and he pushes it towards the off side"
202,"Maharoof to Lee, no run"
203,"Maharoof to Lee, no run gets across and drives him towards mid-off"
204,"Maharoof to Lee, no run that sliced him in half and nearly beat the keeper! Gets it to slither inwards off the pitch and beats goes through the gap between bat, pad and sails over the middle stump"
205,"Maharoof to Lee, no run"
206,"Maharoof to Lee, 1 run swings it back in and he clips it towards square leg"
207,"Herath to Lee, 1 run chips down the track and he clips him down towards square leg"
208,"Herath to Christian, no run tossed up on the off stump and he defends"
209,"Herath to Christian, FOUR runs uses his feet and Christian whips it to the on side but Malinga doesn't get across quick enough to stop it at mid-on"
210,"Herath to Christian, FOUR runs Christian chooses to attack, he uses his feet again to a flighted delivery and chips it high over midwicket"
211,"Herath to Christian, no run lunges forward and smothers the spin"
212,"Herath to Christian, 1 run clips it away down towards midwicket"
213,"Maharoof to Christian, no run stays beside the line to point"
214,"Maharoof to Christian, 1 run fullish on middle and leg and pushed down to mid-on"
215,"Maharoof to Lee, no run gets beside the line and steers it to the off side"
216,"Maharoof to Lee, no run slower delivery, Lee gets well forward and has to check his shot"
217,"Maharoof to Lee, no run drifts towards the body and he clips him down towards midwicket"
218,"Maharoof to Lee, 1 run slower ball outside the off stump and he steers it wide of point"
219,"Malinga to Lee, no run good length on middle and off and he defends to the off side"
220,"Malinga to Lee, 2 byes another slower ball and the batsman tries to slash it away but misses, beats the keeper as well"
221,"Malinga to Lee, 2 runs another slower ball and Lee gets a thick leading edge over extra cover, that travelled quite far"
222,"Malinga to Lee, no run makes a bit of room and Lee can only force it down to midwicket"
223,"Malinga to Lee, no run another slower ball and Lee makes room and swings but misses"
224,"Malinga to Lee, 1 wide loses control of that slower delivery and sprays it wide of the off stump"
225,"Malinga to Lee, FOUR runs bowls it short of a length and Lee has a free swing of the arms and pulls wide of midwicket"
226,"Maharoof to Christian, 1 run another slower delivery and he clips it off his hips"
227,"Maharoof to Lee, 1 run good length outside off and he uses the width to steer it towards third man"
228,"Maharoof to Christian, OUT Maharoof strikes again! He continues bowling the slower ball, Christian chips down the track and has to check his shot, ends up spooning it straight to mid-off, Jayawardene takes it"
229,"Maharoof to McKay, no run on the off stump and he pushes it back to the bowler"
230,"Maharoof to McKay, 1 run swings it towards the pads and he clips it off his pads to square leg"
231,"Maharoof to Lee, no run"
232,"Herath to McKay, no run"
233,"Herath to McKay, 1 run flicks it away down to midwicket"
234,"Herath to Lee, no run floated on the pads and he defends to the off side"
235,"Herath to Lee, 1 run Lee flicks it down to midwicket"
236,"Herath to McKay, no run gets on the front foot and defends"
237,"Herath to McKay, 1 run flatter delivery, he flicks it down to midwicket"
238,"Malinga to McKay, no run fires the yorker but it's wide of the off stump, he safely leaves it alone"
239,"Malinga to McKay, FOUR runs gift for Australia as Malinga misdirects the yorker on the pads and McKay gets some bat on it to send it screeching to fine leg"
240,"Malinga to McKay, no run gets forward and pushes it down towards cover"
241,"Malinga to McKay, no run keeps a bit low and McKay chops it down towards the keeper"
242,"Malinga to McKay, no run"
243,"Malinga to McKay, FOUR runs fullish on the off stump and he gets across and lofts it crisply over mid-off, just short of the rope"
244,"Kulasekara to Lee, no run starts off with a full one outside the off stump and he drives on the up down towards short cover"
245,"Kulasekara to Lee, 1 run stays beside the line and steers it towards the off side"
246,"Kulasekara to McKay, no run"
247,"Kulasekara to McKay, 1 run stays beside the line and angles it wide of point for a single"
248,"Kulasekara to Lee, no run that's a good yorker honing in on the leg stump, Lee makes a bit of room and can only squeeze it back to the bowler"
249,"Kulasekara to Lee, no run gets this one to nip back inwards and really squares up the batsman as he tries to cut"
250,"Herath to McKay, no run full on the off stump and driven down towards mid-off"
251,"Herath to McKay, no run"
252,"Herath to McKay, no run gets forward and drives towards mid-on"
253,"Herath to McKay, 1 run floated on middle and leg and he tucks him wide of square leg"
254,"Herath to Lee, no run chips down the track and checks his shot"
255,"Herath to Lee, no run rocks back and chops it down towards point"
256,"Kulasekara to McKay, 2 runs goes back at the crease and steers him down to third man"
257,"Kulasekara to McKay, no run slower delivery on the blockhole and he digs it out to the bowler"
258,"Kulasekara to McKay, no run tries to flick it away but he gets a bottom edge onto the pads"
259,"Kulasekara to McKay, SIX runs take that! Pitched up on the pads and McKay takes Kula downtown over deep midwcket! Lovely follow through and it goes about 6 rows back"
260,"Kulasekara to McKay, no run on the blockhole outside off and he fails to dig it out"
