,Data
202,"Munro to Wade, 1 run full on middle and leg, whipped away through midwicket"
203,"Boult to Wade, 1 run Wade shimmies down the track, the bowler adjusts his length. Short, picked off through the midwicket region"
204,"Boult to Warner, 2 runs full on the stumps, Warner backs away outside leg, and bashes the ball through the covers"
205,"Boult to Warner, 1 run pitched up and outside off, driven firmly to Williamson at extra cover"
206,"Boult to Wade, 2 runs pretty full on off, whipped past midwicket's left"
207,"Boult to Wade, 1 run short and outside off, flat-batted over Boult"
208,"Ferguson to Wade, (no ball) 1 run full-toss outside off, over the waist, Wade leaps and flat-bats it over cover-point"
209,"Ferguson to Warner, SIX runs Warner dispatches the free-hit. Poor length ball outside off, slower too, Warner clears his front leg, and launches it over long-on for a massive six. Smoked"
210,"Ferguson to Warner, 1 run short and outside off, short armed away wide of midwicket"
211,"Ferguson to Wade, 1 run slower short ball on middle, swatted away to long leg"
212,"Ferguson to Warner, 1 run banged in on leg stump, pulled to long leg"
213,"Ferguson to Wade, 1 run leg-stump yorker, nearly 146ks, squeezed out past midwicket"
214,"Ferguson to Warner, no run Warner backs away outside leg, this is speared outside off. Warner knows he has no chance of reaching it. Left alone"
215,"Santner to Wade, no run lobbed up on middle, goes low and paddles the ball to short fine leg"
216,"Santner to Wade, OUT Wade pre-meditates a slog-sweep. Santner is smart with his variations in pace. He held this back, 78ks. Wade gets it high on the bat and holes out to deep midwicket"
217,"Santner to Warner, 1 run whipped from off stump past Santner's left"
218,"Santner to Faulkner, 2 runs tossed up on off, worked through vacant mid-on. Warner hares across for the second"
219,"Santner to Faulkner, no run much slower on off, dabbed to cover with an open face"
220,"Santner to Faulkner, no run speared outside off, 93ks, jabbed to the same fielder"
221,"Southee to Warner, 1 run full and wide outside off, reaches out and carves it over point"
222,"Southee to Faulkner, 1 run slower ball on leg stump, 103.8ks, tickled to short fine leg"
223,"Southee to Warner, 1 wide sprayed wide outside off, Warner reaches out, but can't make contact"
224,"Southee to Warner, 2 runs slower short ball outside off, flat-batted in front of long-on. Warner turns quickly, and hurtles back for the second"
225,"Southee to Warner, FOUR runs Southee cuts his fingers across this slower delivery as well. Warner fetches it from outside off and blasts it in the air to the left of mid-off, who is up"
226,"Southee to Warner, 2 runs 115ks, cutter outside off, short, swatted away over square leg"
227,"Southee to Warner, no run 114ks, banged into the middle of the deck, sails through to the keeper. Warner pulls hard and swings himself off his feet. He is surprised that isn't called a wide"
228,"Boult to Faulkner, no run yorker on middle, dug back to the bowler"
229,"Boult to Faulkner, no run full and just outside off, slapped away to extra cover"
230,"Boult to Faulkner, 1 run back of a length and outside off, just 116ks, chopped away to extra cover"
231,"Boult to Warner, FOUR runs 110.ks slower short ball outside off, Warner, having shuffled away outside leg, waits for the ball to arrive, leaps, adjusts and then carves it over backward point. Reaches 150"
232,"Boult to Warner, no run Warner backs away outside leg, Boult swings a yorker into the left-hander. Beaten"
233,"Boult to Warner, 4 leg byes very full and slanting outside leg, Warner misses the glance, brushes the pad and sneaks away fine past a diving Watling"
234,"Southee to Faulkner, 1 run cutter on off, 103.9ks, stabbed to extra cover"
235,"Southee to Warner, 1 run slower lifter on middle, top-edged pull, does not carry to long leg"
236,"Southee to Faulkner, 1 run another cutter on middle stump, Faulkner picks it up and pulls to deep midwicket"
237,"Southee to Warner, 1 run pretty full and outside off, jabbed down to mid-off"
238,"Southee to Faulkner, 1 run down the track, gets a short slower ball, pulled over midwicket"
239,"Southee to Warner, 2 runs Warner moves away outside leg, this is pushed wide outside off. Reaches out and slices it over the covers. Warner scampers back for the second. Top class running"
240,"Boult to Faulkner, 2 runs Warner hares on for the second, the throw is to the striker's end. Faulkner is in. Low full-toss on middle, hit down to wide long-on. Watling collects the ball in front of the stumps and swipes the bails off, but Faulkner is home"
241,"Boult to Faulkner, FOUR runs full and outside off, Faulkner sizes it up and smites it down the ground with a flat-bat, straight of long-on"
242,"Boult to Faulkner, OUT full and just outside off, Faulkner plonks his front leg forward and swings early, slower delivery from Boult. The batsman skies a catch to long-on"
243,"Boult to Warner, 2 runs yorker on leg or just outside, backs away and carves the ball square through the off side"
244,"Boult to Warner, no run Warner flits outside leg again, this is forced back to the left of the bowler. Boult stretches his left hand out, spins around for a throw at the stumps, but slips over"
245,"Boult to Warner, OUT Boult splatters the stumps at the non-striker's end and catches Warner short from the last delivery of the innings. Pinpoint yorker just outside leg, Warner, having backed away outside leg, jams it towards short extra cover. Boult runs in, then to his right, and throws the stumps down. Excellent work"
246,"David Warner, the man of the moment: It was one of those wickets that was two- paced (Your captain said it was one hell of a knock?). The odd one was skidding through. With a couple of wickets down, we had to knuckle down. The miles in the legs; that is what we do. I am ready to go and defend the target. I think 264 is enough."
247,"The hosts were pinned down to 4 for 73, but Warner rode out the tough phase, and shifted gears in the slog overs. In the process, he raised his seventh ODI century of the year. Only Tendulkar has more centuries in a year than Warner."
248,"5.57pm Warner faced the first ball of the innings. He did not budge until the last ball. He made 156 from 128 balls; the other eight Australian batsmen made 90 from 174 balls. Warner walks off to a standing ovation, he is congratulated by his captain."
249,6.35pm Hello again. Guptill and Latham are out to open for NZ. Starc takes the new ball for the hosts. He is backed up by two slips to add to a backward point and a square point
250,"Starc to Guptill, no run length and angling away outside off, cracked straight to backward point"
251,"Starc to Guptill, no run 140.2ks inswinging yorker, jammed back to the bowler"
252,"Starc to Guptill, no run back of a length and thuds into the thigh as Guptill hops and does not make contact with a flick"
253,"Starc to Guptill, 1 run good length and swings into the leg stump, 142.9ks, Guptill squirts an inside edge onto the pad as the ball sneaks away square on the leg side"
254,"Starc to Latham, 3 runs pitched up on off and middle, Latham leans forward and flicks in the gap at midwicket for three runs"
255,"Starc to Guptill, no run full and angling away outside off, driven on the front foot to mid-off. Mis-hit"
256,"Hazlewood to Latham, no run nice and full, hint of inswing, nibbles back in, tight leave. Narrowly shaved the off stump"
257,"Hazlewood to Latham, no run full and angled across the left-hander, sneaks past the outside edge. Shooter. Rolls through outside off. Wade drops down on one knee to collect the ball"
258,"Hazlewood to Latham, no run full and swings in inside-edged onto the pad"
259,"Hazlewood to Latham, no run full and angling away outside off, left alone"
260,"Hazlewood to Latham, no run full and angling away outside off, presses forward and drives the ball to extra cover"
261,"Hazlewood to Latham, 1 run back of a length and slanting away outside off, guided past slips to third man"
262,"Starc to Latham, 1 wide leg-side wide, swinging down leg"
263,"Starc to Latham, no run full and holds its line outside off, skids on, Latham covers his off stump and ignores it. Wade gloves the ball in front of his boot"
264,"Starc to Latham, 1 wide full and swerving down the leg side, Latham shuffles across and misses the flick. The noise came from the bat hitting front pad"
265,"Starc to Latham, FOUR runs full and outside off, 145.6ks, Latham leans into the drive and sends the ball racing away through the covers"
266,"Starc to Latham, no run left alone outside off"
267,"Starc to Latham, 1 run short on off, worked to midwicket"
268,"Starc to Guptill, no run full on off, swings away a touch, pushed to cover on the front foot"
269,"Starc to Guptill, no run lifting ball on middle, 141.7ks, hops and glides it to point"
270,"Hazlewood to Latham, no run good length and angling away outside off, blocked to midwicket on the front foot"
271,"Hazlewood to Latham, FOUR runs Latham leaves the crease, takes a half-volley and belts a drive straight of mid-off. Shot"
272,"Hazlewood to Latham, 2 runs full and swings in a touch, he plays around his front pad, flicking wide of midwicket"
273,"Hazlewood to Latham, no run back of a length on the stumps, played back to the bowler"
274,"Hazlewood to Latham, no run length and angled across off, left alone"
275,"Hazlewood to Latham, 1 wide slanted down leg, another wide. Wade dives full-length to his right to glove the ball"
276,"Hazlewood to Latham, no run left alone outside off"
277,"Starc to Guptill, no run fuller ball just outside off, defended off the front foot"
278,"Starc to Guptill, 3 runs short of a length, angled across off, Guptill stands tall and punches elegantly off the backfoot through covers. The ball is pulled back before the ropes and they have enough time to complete three"
279,"Starc to Latham, no run fuller ball on the fourth stump channel, Latham presses forward and blocks to covers"
280,"Starc to Latham, 2 runs fuller ball, angling down leg, Latham picks it up off the pads and heaves it through midwicket. The ball is fielded in the deep"
281,"Starc to Latham, FOUR runs fuller ball on the fifth-stump channel and that's a beautiful stroke from Latham. Presses forward and gets right to the pitch of the ball before gently caressing it through extra cover. Just timed it and used the pace on the delivery"
282,"Starc to Latham, 1 run steered to third man with an open bat face"
283,"Hazlewood to Latham, no run good length ball on the stumps, defended back to the bowler"
284,"Hazlewood to Latham, no run length ball, angled across on the fourth-stump line, blocked from the crease"
285,"Hazlewood to Latham, 2 runs width on offer, Latham tries to steer it away but goes at it with hard hands and ends up doing so uppishly before the ball is fielded at third man"
286,"Hazlewood to Latham, 1 run fuller ball on leg and middle, clipped off the pads to midwicket"
287,"Hazlewood to Guptill, no run fuller on the fourth-stump channel, Guptill presses forward and quietly defends towards cover"
288,"Hazlewood to Guptill, 2 runs short of a length ball, Guptill pulls it off the hips and gets his front leg up and across as he rides the bounce, the ball is cut off before the backward square leg boundary by the fielder in the deep"
289,"Cummins to Latham, no run short of a length ball on leg and midde, Latha closes the face of his bat early as he looks to nudge it to the leg side and the ball skews off the leading edge towards point on the bounce"
290,"Cummins to Latham, 1 run back of a length on the leg stump channel, tucked comfortably off the pads to deep fine leg"
291,"Cummins to Guptill, no run short of good length outside off, Guptill blocks from the crease and the ball goes off the inside part of the bat to the right of the bowler"
292,"Cummins to Guptill, no run back of a length outside off, Guptill gets on top of that and punches elegantly off the backfoot but straight to cover"
293,"Cummins to Guptill, 2 runs length ball, angling in on the pads, tucked to midwicket"
294,"Cummins to Guptill, 1 run fuller ball, pushed to mid-on for a sharp single"
295,"Hazlewood to Guptill, 3 runs Guptill uses the angle on that delivery well. It was short of good length and angling in from just outside off. Guptill shifts back slightly to get on top of the bounce before flat-batting it wide of the diving mid-on fielder"
296,"Hazlewood to Latham, no run good length, outside off blocked"
297,"Hazlewood to Latham, no run waits for this length ball outside off before deftly opening his wrists late although he can't beat backward point"
298,"Hazlewood to Latham, no run slightly shorter in length outside off. Latham skips down a step and as a result is late on the pull shot and chops it on to the turf as the ball goes back to the bowler."
299,"Hazlewood to Latham, 1 run back of a length, tucked off the pads behind square on the leg side"
300,"Hazlewood to Guptill, no run good length on off, defended to covers from the crease"
301,"Cummins to Latham, no run short of a length and angled across, Latham's eyes light up on seeing the width on that delivery as he slaps but the ball goes to point"
302,"Cummins to Latham, 1 run fuller ball outside off, Latham pushes it off the front foot and drops it in front of mid-off who is slightly deep"
303,"Cummins to Guptill, 1 run back of a length outside off, Guptill punches off the backfoot just to the right of cover who dives to stop the ball"
304,"Cummins to Latham, no run fuller ball outside off, driven along the carpet to mid-off"
305,"Cummins to Latham, no run well-directed short ball that forces Latham to lean back and drop his wrists as the ball is left alone in the channel just outside off"
306,"Faulkner to Guptill, no run fuller ball, angled in to the right-hander from around the wicket, Guptill closes the face of his bat and gets a leading edge as the ball goes to the off side"
307,"Faulkner to Guptill, no run full and outside off, driven firmly but straight to extra cover"
308,"Faulkner to Guptill, no run good length ball, attacking the stumps, knocked back to the bowler"
309,"Faulkner to Guptill, no run short of a length and angled in, Guptill gets an inside-edge to the pad on the attemped flick"
310,"Faulkner to Guptill, FOUR runs length ball that is angled in on the pads, Guptill glances it to the fine leg boundary"
311,"Faulkner to Guptill, no run good length outside off, blocked into the off side"
312,"Cummins to Williamson, 1 wide short ball, Williamson ducks and it's too high, so called a wide"
313,"Cummins to Williamson, no run short of a length outside off, Williamson punches it square of the wicket off the front foot and what a save at backward point. George bailey flings himself to his left with both hands outstretched"
314,"Cummins to Williamson, FOUR runs beautiful placement. It was full and on the pads. There is enough pace on that delivery and all Williamson has to do is find the gap which he does as he nudges the ball wide of mid-on"
315,"Cummins to Williamson, no run good length on the fourth stump channel, Williamson defends it very late off the front foot, so late that the ball lands right on the crease and goes behind the stumps, to the right of the wicketkeeper"
316,"Cummins to Williamson, no run fuller outside off, driven to cover"
317,"Cummins to Williamson, 1 run good length outside off, steered to third man"
318,"Cummins to Guptill, 1 run jumps back to ride the bounce before trickling it away towards the third man region"
319,"Faulkner to Guptill, no run fuller ball outside off, angled in on off, defended back to the bowler"
320,"Faulkner to Guptill, 1 run fuller and on the pads, tucked away to square leg"
321,"Faulkner to Williamson, 1 run good length and angling in, turned away with the angle behind square"
322,"Faulkner to Guptill, 1 run fuller ball on the fourth or fifth-stump channel, pushed off the front foot past the diving extra cover fielder to long-off"
323,"Faulkner to Williamson, FOUR runs very full ball outside off, Williamson has to reach out for it but does well to drive it square of the wicket, picks the gap between cover-point and backward point"
324,"Faulkner to Williamson, 1 run fuller ball, again defends it very late and drops it at the crease as the ball goes behind the stumps. The wicketkeeper has to move across slightly, towards gully, to collect it and that gives them enough time to take a quick single"
325,"Cummins to Williamson, 1 run width on offer outside off, Williamson waits for it and opens the face of his bat to guide it to third man"
326,"Cummins to Guptill, no run short ball, well-deceived slower ball. Guptill is through with the pull shot much earlier than earlier and the ball goes to the wicketkeeper"
327,"Cummins to Guptill, FOUR runs short of a length and angling in, Guptill tucks off the hips to deep fine leg"
328,"Cummins to Guptill, no run good length on off, Guptill comes on to the front foot and defends late and the ball goes to gully"
329,"Cummins to Guptill, 2 runs back of length outside off, steered to third man with an open face. Guptill calls for the quick second and scampers back to beat the throw which is slightly wayward"
330,"Cummins to Guptill, 1 run short of a length, angling in on the hips, tucked to the leg side"
331,"Faulkner to Guptill, no run fuller ball on the stumps, pushed carefully back to the bowler"
332,"Faulkner to Guptill, 1 run short of a length outside off, punched off the backfoot to long-off"
333,"Faulkner to Williamson, no run full and angling in from outside off, defended with the angle towards mid-on"
334,"Faulkner to Williamson, 1 run back of a length, tucked with the angle to deep square leg"
335,"Faulkner to Guptill, 1 run back of a length ball outside off, punched easily from the crease to sweeper cover"
336,"Faulkner to Williamson, OUT and the on-field decision stays. It was a short of good length ball that was angling. Williamson moved across to get outside the line of the ball and flick it away to the leg side. But he perhaps moved away too much and ended up playing around the pad and the ball hits the front pad. Nigel Llong raised his finger but Williamson reviews it. Only w"
337,"Cummins to Guptill, FOUR runs Smith tries to pull off a repeat of the blinder he snaffled in the previous match but this time does not manage to do it. It was a short ball and Guptill flays it hard past Smith who is diving to his right but can't get his hands to it"
338,"Cummins to Guptill, no run length ball outside off, Guptill knocks it to mid-on"
339,"Cummins to Guptill, 1 run nudged through square leg"
340,"Cummins to Nicholls, no run good length ball, shaping away, left alone in the channel outside off"
341,"Cummins to Nicholls, no run fuller and outside off, defended"
342,"Cummins to Nicholls, no run shifts across to protect his off-stump before blocking this length ball off the backfoot into the off side"
343,"Head to Guptill, OUT oh, what a catch! It's Bailey this time. Didn't fling himself full length like Smith in the previous match, but it was a remarkable catch nonetheless and very tough. It was fuller outside and Guptill could not keep his drive along the ground. The ball lobs over the head of Bailey at short cover and he leaps up to snaffle it. Timed his jump to perfection"
344,"Head to Munro, no run punched off the backfoot straight back to the bowler"
345,"Head to Munro, 1 run good length ball, Munro allows himself some room before slapping it away to sweeper cover"
346,"Head to Nicholls, 2 runs short and wide outside off, slapped away wide of sweeper cover who puts in the dive to cut it off"
347,"Head to Nicholls, 1 run drops it in front of the gap between cover and point and scampers across for a single"
348,"Head to Munro, no run fuller ball, the ball goes towards mid-off after an inside-edge to the pads"
349,"Starc to Nicholls, no run pushes Munro back with a short of a length delivery which the batsman knocks back to the bowler"
350,"Starc to Nicholls, no run fuller and outside off, driven to covers"
351,"Starc to Nicholls, no run very full ball outside off, Nicholls jams his bat down and drills it hard into the turf before the ball goes to the bowler"
352,"Starc to Nicholls, no run short of a length outside off, steered to backward point"
353,"Starc to Nicholls, no run good length ball outside off, defended"
354,"Head to Munro, 1 run darted in, chopped from the stumps to backward point"
355,"Head to Watling, 1 leg bye tossed on middle, paddled away behind square"
356,"Head to Munro, no run full on middle, pushed back to the bowler"
357,"Head to Munro, 1 run shorter and outside off, cut through the covers"
358,"Head to Watling, no run short and hurled on off, played back to Head"
359,"Head to Watling, no run looped up on middle and leg, shuffles across and clips to square leg"
360,"Starc to Munro, no run length and outside off, 142.5ks, Munro is beaten for pace"
361,"Starc to Munro, no run back of a length on off, glides it off the face to backward point"
362,"Starc to Munro, no run back of a length and cuts away outside off, slower one. Munro jabs at it and manages an inside edge onto the pad"
363,"Starc to Munro, no run half-volley outside off, leans forward and drills it away. It seemed destined to race to the boundary... until Head dived full-length to his right to stop the ball at extra cover"
364,"Starc to Munro, no run low full-toss, tails in, jammed out to midwicket"
365,"Starc to Munro, no run slower bouncer, tennis-ball bounce, Munro hunkers down and lets it sail over him"
366,"Head to Watling, 1 run flighted outside off, goes low and sweeps it to long leg"
367,"Head to Munro, 1 run straight ball on the leg stump, driven to long-on on the front foot"
368,"Head to Watling, 1 run tossed-up offbreak, turns in, dabbed with the spin behind square"
369,"Head to Munro, 1 run follows it with a slider heading for middle stump, chopped on the back foot through the cover-point region"
370,"Head to Watling, 1 run turning offbreak, tucked away to deep backward square leg"
371,"Head to Munro, 1 run flatter and fired on middle, drills a drive to long-off"
372,"Starc to Munro, no run back of a length on middle, late-cut to short third man"
373,"Starc to Munro, 1 leg bye rapid yorker, swings in late, Munro is beaten for pace and is smacked on the pads outside leg"
374,"Starc to Watling, no run full and angled in on off, Watling opens the face and dabs the ball to backward point"
375,"Starc to Watling, 1 run very full and holds its line outside off, Watling slices it to the left of backward point"
376,"Starc to Munro, no run half-volley outside off, flat-bats a drive to extra cover. Can't get past Bailey"
377,"Starc to Munro, no run 140.8ks full missile outside off, Munro swishes and misses. Think the batsman was late onto it"
378,"Head to Watling, no run fired across off, back-foot punch back to Head"
379,"Head to Watling, no run short on leg stump, pulled straight to short fine leg"
380,"Head to Watling, no run looped up on middle, Watling plays early, nearly chipped a catch to midwicket"
381,"Head to Watling, FOUR runs this is pushed outside the leg stump, swept fine of short fine leg for four"
382,"Head to Watling, OUT an appeal for lbw, not given. Did it straighten enough? It may have pitched outside leg. Smith and Head converge and challenge the on-field call. RTS does not detect an inside edge. It pitched in line, hitting off stump. Three reds flash on the big screen. Umpire Llong's on-field call is reversed. Watling attempted to sweep again, but made no contact th"
383,"Head to de Grandhomme, 2 runs down the track and whipped fine of long leg"
384,"Hazlewood to Munro, 1 run short and outside off, slapped through cover"
385,"Hazlewood to de Grandhomme, no run nip-backer, back of a length, de Grandhomme is pinned on the thigh. This was bouncing over the stumps"
386,"Hazlewood to de Grandhomme, 1 run back of a length on off, pushed to cover"
387,"Hazlewood to Munro, no run back of a length and outside off, glided to backward point"
388,"Hazlewood to Munro, no run full on middle, patted to the right of extra cover"
389,"Hazlewood to Munro, 1 run short on middle, Munro hops and rides a single to third man"
390,"Head to Munro, no run short on middle, hangs back and whips to midwicket"
391,"Head to Munro, 1 run driven down to long-off from outside off"
392,"Head to de Grandhomme, 1 run full and Head runs this one across the right-hander, hit firmly to long-off running in"
393,"Head to Munro, 1 run short and wide outside off, hammered away to deep cover"
394,"Head to de Grandhomme, SIX runs De Grandhomme races down the track, meets the pitch, and lofts it straight down the ground. Dumps Head over the sightscreen"
395,"Hazlewood to de Grandhomme, no run short on off, quelled to point"
396,"Hazlewood to de Grandhomme, no run back of a length on off, back-foot punch to extra cover"
397,"Hazlewood to de Grandhomme, no run full and angled in on off, front-foot drive back to the bowler"
398,"Hazlewood to de Grandhomme, OUT Head probably was late to pick up the ball. He runs in from deep square leg, dives forward, and pouches it. It jams the fingers under the ball"
399,"Hazlewood to Santner, no run good length and Hazlewood runs this one past the outside edge"
400,"Hazlewood to Santner, no run full and angling away outside off, left alone. Rounds out a wicket-maiden"
401,"Head to Munro, no run slides in quick and takes the pad"
402,"Head to Munro, 1 run short on middle, flat-batted to long-on"
403,"Head to Santner, no run tossed on middle, dabbed to extra cover on the front foot"
404,"Head to Santner, no run opens the face and punches from outside off to Warner at backward point"
405,"Head to Santner, 1 run short and outside off, punched between backward point and cover"
