,Data
0,"Ntini to Clarke, no run pitches short and stays low, Clarke pushes to the off side"
1,"Ntini to Clarke, no run hits a fuller length and Clarke shoulders arms with a stride forward"
2,"Ntini to Clarke, no run brings him onto the front foot and gets Clarke defending"
3,"Ntini to Clarke, FOUR runs this is good bowling by Ntini, pitching on a length to lure Clarke forward, and this time he pushes a thickish edge that flies to the left of a diving gully fielder"
4,"Ntini to Clarke, (no ball) FOUR runs another streaky shot from Clarke, staying in his crease and driving on the up through square, this wasn't in the air and evades the gully fielder again, its a no-ball anyways so all safe"
5,"Ntini to Clarke, 3 runs now thats a shot in control, Clarke pushing forward to a length delivery and middling the drive between two men in the covers, who have a mix-up in the deep"
6,"Ntini to Johnson, no run pitches outside leg, shapes in, Johnson defends off the back foot"
7,"Morkel to Clarke, 1 run strays onto the pads and he clips a single to deep midwicket"
8,"Morkel to Johnson, no run edged and dropped by Kallis at second slip, diving to his right in front of what looked like a catch for Smith at first slip, Johnson pushes at a short and rising delivery and gets a thick outside edge that flies to"
9,"Morkel to Johnson, no run attempted yorker ends up a very low full toss and he defends it"
10,"Morkel to Johnson, FOUR runs too short and Johnson hammers it excellently through midwicket"
11,"Morkel to Johnson, FOUR runs stand and deliver! After the short ball, Morkel overcompensates with a full delivery and Johnson just gets to the pitch and smears it through extra cover, real proper like, before anyone could move"
12,"Morkel to Johnson, no run back of a length, slants in, Johnson defends down past gully"
13,"Ntini to Clarke, no run pitches fullish and Clarke drives the ball straight to cover"
14,"Ntini to Clarke, no run too straight and short and he hits the ball to Amla at midwicket"
15,"Ntini to Clarke, no run brings him forward on the defensive shot to the off side"
16,"Ntini to Clarke, 1 run comes forward and steers the ball wide of a tumbling backward point"
17,"Ntini to Johnson, no run goes across with the natural angle and he pushes the ball to cover"
18,"Ntini to Johnson, no run fractionally short, but not short enough, and he pulls the ball to midwicket"
19,"Morkel to Clarke, no run oh thats beaten him, pitches on a length and Clarke pushes at the ball with a massive gap between bat and pad, very lucky not to get an inside edge"
20,"Morkel to Clarke, no run nips back in, he lunges forward and loosely defends"
21,"Morkel to Clarke, 2 runs better shot, driving a fuller one on the up wide of cover"
22,"Morkel to Clarke, 1 run pinches a single with gentle hands, calling for the run before mid-on runs forward, that was also down to the response from Johnson, who bolted out"
23,"Morkel to Johnson, no run full and wide and he shoulders arms"
24,"Morkel to Johnson, no run and again, too wide so he leaves it be"
25,"Ntini to Clarke, no run onto the front foot, steering the ball to de Villiers at backward point"
26,"Ntini to Clarke, 1 run too full and he pushes to the off, where mid-off gets around in a hurry"
27,"Ntini to Johnson, no run hits a length and Johnson defends off the back foot with ease"
28,"Ntini to Johnson, no run short of a length and he pushes the ball to the off side"
29,"Ntini to Johnson, FOUR runs fetch that! Johnson gets a wee bit of room and carves the ball square of the pitch with a blooming cut shot, no footwork at all but when you can time them that well, who needs to move your feet?"
30,"Ntini to Johnson, no run on the stumps and he defends it back to the bowler"
31,"Morkel to Clarke, 1 run pitches full to him on the front foot, Clarke steers it through gully out to Amla, the man who dropped him last evening, down at third man to move to 96"
32,"Morkel to Johnson, no run big shout for lbw, but thats delivered from very wide of the crease and doesn't swing back after pitching full down the pads, bat misses ball but that would have missed leg stump by a ways"
33,"Morkel to Johnson, no run a much better length and it gets Johnson forward to defend"
34,"Morkel to Johnson, no run hits a length and he defends again"
35,"Morkel to Johnson, no run now thats too wide and so he leaves it be with ease"
36,"Morkel to Johnson, no run 138ks, short of a length and Johnson defends to the off"
37,"Harris to Clarke, no run down he comes first ball, clipping the ball to midwicket"
38,"Harris to Clarke, no run comes out again, driving to the off, where short cover dives well"
39,"Harris to Clarke, no run pitches flatter and straighter and Clarke defends to short leg"
40,"Harris to Clarke, no run tossed up a tad more, Clarke again skips down and drives to midwicket"
41,"Harris to Clarke, 2 runs spins into Clarke off a short length and he does well to expose the stumps and drive off the back foot past cover for a couple more to his score"
42,"Harris to Clarke, 1 run shimmies down and collects on the full, pushing the ball to cover and moving to 99 as the SCG cheers"
43,"Morkel to Clarke, no run nearly, but not quite, the ball hits a length and Clarke pushes it back, Morkel half-stops it with a finger and it rolls down to mid-off"
44,"Morkel to Clarke, 1 run there it is! Clarke gets his first century at the SCG with a manic single pinched to Steyn at midwicket off the front foot, a direct hit draws the referral and it looks very close but Clarke breaks into celebration in"
45,"Morkel to Johnson, no run bangs in short and Johnson misses the pull by a whisker"
46,"Morkel to Johnson, no run pitches on a length and he defends"
47,"Morkel to Johnson, no run pitches full and wide, to suck the drive, but Johnson leaves"
48,"Morkel to Johnson, no run hits a good length and he defends to the off side"
49,"Harris to Clarke, no run tossed up, he uses his feet and drives it to midwicket"
50,"Harris to Clarke, no run tossed up slower and he defends it to Amla at short leg"
51,"Harris to Clarke, 2 runs a tad too straight, he shuffles and works it off the pads wide of Amla"
52,"Harris to Clarke, no run tidy stuff this, drifting in from middle and off and Clarke defends"
53,"Harris to Clarke, FOUR runs gives it a tweak and lures Clarke out of his crease with the width, he connects on the full and drives through the surprisingly yawning gap on the off side, that a pure timed shot"
54,"Harris to Clarke, no run tossed up on the stump and he skips out to flick it away"
55,"Morkel to Johnson, no run 136ks, short of a length and it beats the outer edge as he feels for it"
56,"Morkel to Johnson, no run back of a length and he wisely leaves this one be"
57,"Morkel to Johnson, no run much fuller and Johnson drives to the man placed at cover"
58,"Morkel to Johnson, 1 run drifts down the pads and he swats it off one leg to deep square"
59,"Morkel to Clarke, no run short and seaming and Clarke drops the wrists to allow it pass"
60,"Morkel to Clarke, no run change of pace, fuller and straighter, worked to the man at midwicket"
61,"Harris to Johnson, no run tossed up wide of the sticks and he shoulders arms"
62,"Harris to Johnson, no run low full toss, Johnson drives off the front foot and nearly drags it back"
63,"Harris to Johnson, no run tossed up on a length and he defends like a top-order player"
64,"Harris to Johnson, no run well bowled, some overspin on that one and he pushes it back"
65,"Harris to Johnson, no run flatter delivery on middle and leg and he pats it back watchfully"
66,"Harris to Johnson, no run very good over, the last ball is also tossed up to bring a defensive"
67,"Steyn to Clarke, no run hits a length, middle and leg, and defended to the on side"
68,"Steyn to Clarke, FOUR runs super shot, Clarke gets to the pitch and pulls off a perfect off drive"
69,"Steyn to Clarke, no run comes three-quarters forward and pushes to cover"
70,"Steyn to Clarke, no run better length, middle and off, stops on Clarke who removes the bottom hand"
71,"Steyn to Clarke, no run gets to the pitch and drives with a full face, but mid-on intercepts"
72,"Steyn to Clarke, 1 run holds back the length and Clarke guides it down to deep point"
73,"Harris to Clarke, 2 runs skips down and works the ball wide of midwicket"
74,"Harris to Clarke, no run slows the pace, pitches on a length and he pushes to the off side"
75,"Harris to Clarke, 1 run full and flat, down comes Clarke, driving down wide of Harris"
76,"Harris to Johnson, no run tossed up on a length and he defends it back"
77,"Harris to Johnson, no run tossed up on a good length and Johnson defends it back"
78,"Harris to Johnson, 1 run now Johnson reaches forward and pinches a single past cover"
79,"Steyn to Johnson, no run pitches on a length and he defends watchfully"
80,"Steyn to Johnson, no run wide of the stumps and he shoulders arms"
81,"Steyn to Johnson, FOUR runs crickey, thats a perfectly timed stroke from Johnson with plenty of force, doesn't move an inch but punches and lets the pace of the ball do all the work to the deep cover-point boundary"
82,"Steyn to Johnson, no run pitches on a much better length and gets him defending"
83,"Steyn to Johnson, 2 runs slides down the pads and he clips it away through midwicket, scoring more runs in the series than Hayden and Hussey combined"
84,"Steyn to Johnson, FOUR runs bang, thats four! Sheer brute force from Johnson, cracking his ninth boundary, this one off the back foot through cover before the fielders could react"
85,"Harris to Clarke, no run skips down and miscues the attempted off drive towards cover"
86,"Harris to Clarke, no run slides down leg stump and he now miscues it off the pads"
87,"Harris to Clarke, 1 run uses his feet to meet the ball on the full, steering through cover"
88,"Harris to Johnson, no run tossed up gently and he plays it back to Harris"
89,"Harris to Johnson, no run tidy line and length and Johnson defends solidly"
90,"Harris to Johnson, no run quicker ball, middle and off, Johnson pats it back"
91,"Ntini to Clarke, no run hits a length too wide of off stump and Clarke shoulders arms"
92,"Ntini to Clarke, no run hits a good length and Clarke pushes gently to short catching cover"
93,"Ntini to Clarke, 1 run thats 3000 Test runs and an average of 50.00 for Clarke, reaching out and slapping a wide half-volley wide of cover and point, and the stand moves to 99"
94,"Ntini to Johnson, no run pitches on the stumps and nips back in and Johnson jams it out"
95,"Ntini to Johnson, no run lands on a good length again to keep Johnson quiet"
96,"Ntini to Johnson, no run angles across and now he doesn't offer a shot"
97,"Harris to Clarke, no run tossed up and he comes out and drives to cover"
98,"Harris to Clarke, FOUR runs top shot, that one was spinning away and cramping him for room and he rocks back to wrist the ball away wide of gully for four, thats just pure timing and placement"
99,"Harris to Clarke, no run comes forward and defends"
100,"Harris to Clarke, no run gets a good stride forward and pushes it back to Harris"
101,"Harris to Clarke, no run tossed up and he defends to the off side"
102,"Harris to Clarke, 1 run skips out and steals another single towards mid-off"
103,"Ntini to Clarke, no run gets a short one and punches off the back foot straight to cover"
104,"Ntini to Clarke, no run onto the front foot, pushing on the up but right to cover again"
105,"Ntini to Clarke, FOUR runs pitches straight and Clarke pushes it back ramrod straight past the stumps and bisects mid-off and mid-on, no power in that shot, just wrists and precision"
106,"Ntini to Clarke, no run angles in off a length and this time he drops the head in defence"
107,"Ntini to Clarke, no run angles in again and he gets in line to push the ball back to Ntini"
108,"Ntini to Clarke, no run good length ball to end the over, Clarke drives it to extra cover"
109,"Harris to Johnson, no run tossed up on a length and he drives to the man at cover"
110,"Harris to Johnson, no run tossed up on middle and off and he defends again"
111,"Harris to Johnson, no run gets half-forward and drives the ball back to Harris"
112,"Harris to Johnson, no run leans forward and dead-bats it perfectly back to Harris"
113,"Harris to Johnson, FOUR runs this was a matter of time, Harris tossed it up gently and Johnson was down the pitch, hitting it cleanly, flat and hard over mid-on's head, he's such a powerful hitter in that region, with one of the most cleanes"
114,"Harris to Johnson, no run goes back to defending the last ball of the over"
115,"Ntini to Clarke, no run hits a fullish length and he middles the drive to the off side fielder"
116,"Ntini to Clarke, 1 run steers a wide one past backward point and that raises the 350"
117,"Ntini to Johnson, no run pitches and angles across Johnson, who shoulders arms"
118,"Ntini to Johnson, no run more of the defensive stuff, getting in line and thrusting forward"
119,"Ntini to Johnson, no run gently wobbles across with the angle and he leaves it be"
120,"Ntini to Johnson, no run back of a length and punched to the off side"
121,"Harris to Clarke, no run tossed up and he comes forward to defend"
122,"Harris to Clarke, 1 run skips out and drives into the off side for one more"
123,"Harris to Johnson, no run tossed up real wide and he leaves well enough alone"
124,"Harris to Johnson, 1 wide thats real, real wide and the umpire spreads his wings"
125,"Harris to Johnson, no run still wide of the stumps, and no shot offered"
126,"Harris to Johnson, no run still wide, drifting back in but just too far fro the stumps"
127,"Harris to Johnson, 1 run tossed up wide of the stumps and he pushes it wide of gully and thats now Johnson's highest Test score"
128,"Kallis to Johnson, no run hits a length and seams away and Johnson shoulders arms"
129,"Kallis to Johnson, no run fuller in length and angling away and he leaves it be"
130,"Kallis to Johnson, no run sees width and cracks the ball, but Amla intercepts at short cover"
131,"Kallis to Johnson, no run a much better length and now he defends it back in a hurry"
132,"Kallis to Johnson, no run slower ball, 122.5ks, short of a length and he defends"
133,"Kallis to Johnson, no run short and he miscues the back-foot slap to Amla at short cover"
134,"Harris to Clarke, 1 run comes out and mistimes the on-drive to midwicket"
135,"Harris to Johnson, 3 runs slides down the pads and Clarke turns it wide of short leg"
136,"Harris to Clarke, no run tossed up invitingly outside off stump and Johnson flashes, the thick outside edge runs well wide of Kallis at slip and rolls down to third man"
137,"Harris to Clarke, 1 run spins away and Clarke cuts it out to deep backward point"
138,"Harris to Johnson, no run gently lobbed up outside off stump but Johnson doesn't take the bait"
139,"Harris to Johnson, no run beats the bat this time, Johnson going back to cut but missing"
140,"Kallis to Clarke, no run full and wide outside off stump and Clarke leaves it be for Boucher"
141,"Kallis to Clarke, no run short of a length, no swing, and Clarke leaves it be outside off stump"
142,"Kallis to Clarke, no run firmly onto the front foot, twirling the bat above his head to leave an offcutter"
143,"Kallis to Clarke, no run just pitching outside off stump and he shoulders arms again"
144,"Kallis to Clarke, no run that drifts wider of the sticks and Clarke only has to ignore it"
145,"Kallis to Clarke, no run same stuff, wide of off stump and he leave it for Boucher"
146,"Harris to Johnson, no run and he starts off by drifting the ball wide of off stump, Johnson leaves"
147,"Harris to Johnson, no run even wider, not tempting Johnson anywhere outside off stump"
148,"Harris to Johnson, no run lands it in that wide channel and Johnson leaves"
149,"Harris to Johnson, no run now he leans into a drive and hits it straight to cover"
150,"Harris to Johnson, no run tossed up very invitingly outside off but he leaves it be"
151,"Harris to Johnson, no run tossed up, gets good dip, Johnson drives to cover again"
152,"Kallis to Clarke, no run drives it off the middle and Kallis intercepts in his followthrough"
153,"Kallis to Clarke, 1 run this pitches straighter and Clarke on-drives a single"
154,"Kallis to Johnson, no run comes forward and defends"
155,"Kallis to Johnson, no run minimal foot movement but he drives it back to Kallis sweetly"
156,"Kallis to Johnson, no run drives well again but cannot beat Harris placed at mid-off"
157,"Kallis to Johnson, 1 run muscles a drive back past the stumps and mid-off runs across"
158,"Harris to Johnson, no run tossed up wide and Johnson doesn't offer a stroke"
159,"Harris to Johnson, no run thumps a good-looking cover drive but Duminy reacts at cover to save"
160,"Harris to Johnson, no run gently tossed up wide of the stumps and he leaves"
161,"Harris to Johnson, 1 run starts to dip on Johnson and he drives a single into the covers"
162,"Harris to Clarke, no run stays low off a short length and Clarke dabs it to point"
163,"Harris to Clarke, 1 run skips out and drives down the ground to Smith at mid-on"
164,"Kallis to Clarke, no run lands on a length and miscues the on-drive to midwicket"
165,"Kallis to Clarke, 1 run hits a length and he pushes the ball away to the fielder"
166,"Kallis to Johnson, FOUR runs top shot, standing tall in his crease and punching the ball down the ground"
167,"Kallis to Johnson, no run stays a tad low off a shorter length and he taps it to point"
168,"Kallis to Johnson, 1 run pitches outside leg stump and Johnson works it away for one"
169,"Kallis to Clarke, no run comes forward and leaves one outside off stump"
170,"Duminy to Johnson, no run tossed up on off stump and Johnson pushes it back"
171,"Duminy to Johnson, no run well flighted just outside off stump and Johnson smothers it"
172,"Duminy to Johnson, 1 run tossed up wider and he flashes a drive to cover, who takes some pace of that meaty shot and Amla does the cleaning up"
173,"Duminy to Clarke, OUT oh he's held him! Duminy strikes in his first over, and with a full toss as well, one that Clarke drives back in the air to his left and he pouches it as he falls over"
174,"Duminy to Hauritz, no run tossed up wide and he leaves it be"
175,"Duminy to Hauritz, no run served up full on middle stump and he flicks it to midwicket"
176,"Steyn to Johnson, no run pitches wide and wobbles very low through to Boucher"
177,"Steyn to Johnson, 2 runs gets room to free his arms and he drives past McKenzie at cover"
178,"Steyn to Johnson, no run back of a length and he dabs the ball to point"
179,"Steyn to Johnson, no run no footwork as he chases a wide one and nearly chops it back on"
180,"Steyn to Johnson, OUT soft dismissal, and Steyn strikes quickly into his reappearance! He pitches full and wide, angles it away, and Johnson gets a thick edge into Smith's waiting palms at first slip"
181,"Steyn to Siddle, no run poor ball, slides well down the pads and Boucher collects"
182,"Duminy to Hauritz, no run tossed up on the stump and Hauritz drives to Smith at short cover"
183,"Duminy to Hauritz, no run flighted on the stumps and he defends to the on side"
184,"Duminy to Hauritz, no run lands on middle and off and he watchfully defends"
185,"Duminy to Hauritz, FOUR runs sweeps a flighted delivery off the stumps and beats midwicket"
186,"Duminy to Hauritz, 3 runs short and he cuts the ball through a misfielding McKenzie at point"
187,"Duminy to Siddle, no run slows the pace and beats the drives outside off stump"
188,"Steyn to Hauritz, no run misdirected yorker down the pads to Boucher"
189,"Steyn to Hauritz, no run nips back in off a length and he defends it back to Steyn"
190,"Steyn to Hauritz, no run full ball down leg stump, Hauritz misses the flick but the angle would have taken it down past its mark, it was a good ball though, drifting late through the air"
191,"Steyn to Hauritz, 1 run short of a length and he turns it off the hips for a single"
192,"Steyn to Siddle, no run 142.5ks, full and wide and no need for Siddle to offer a shot"
193,"Steyn to Siddle, FOUR runs frees the arms and steers a thick outside edge wide of a diving gully"
194,"Duminy to Hauritz, no run tossed up and defends it back down the track"
195,"Duminy to Hauritz, 1 run a tad too short and he cuts it into the covers for a single"
196,"Duminy to Siddle, no run tossed up and a good-looking drive back to Duminy"
197,"Duminy to Siddle, no run comes forward and mistimes the drive back to Duminy"
198,"Duminy to Siddle, no run flights it wide of the stumps and he leaves it be"
199,"Duminy to Siddle, no run comes forward and gets in a tangle as he shapes to defend"
200,"Steyn to Hauritz, 2 runs pushes an inside edge towards midwicket"
201,"Steyn to Hauritz, no run drives loosely off the front foot and it almost carries to Amla at short cover"
202,"Steyn to Hauritz, no run short of a length and he hops back to defend"
203,"Steyn to Hauritz, no run much fuller now and Hauritz on-drives to the man on the circle"
204,"Steyn to Hauritz, no run 138.8ks, a snorter and he pulls his bat out of the way"
205,"Steyn to Hauritz, no run short of a length and he defends"
206,"Duminy to Siddle, no run fuller outside the off stump, comes forward and drives to short cover"
207,"Duminy to Siddle, no run a bit more of loop and turn on this one but Siddle is waiting on the back foot for this delivery"
208,"Duminy to Siddle, no run outside the off stump, pulls back the length a bit. Siddle lunges forward and defends it"
209,"Duminy to Siddle, FOUR runs now thats some slog! Siddle comes down the track and goes slogging over long-on for a boundary"
210,"Duminy to Siddle, 1 run pushes it to mid-on for a single"
211,"Duminy to Hauritz, no run fuller delivery comes down the track and pushes it back to the bowler"
212,"Steyn to Siddle, no run bouncer over the stumps and Siddle ducks under it"
213,"Steyn to Siddle, no run another short one and he takes evasive action again"
214,"Steyn to Siddle, no run full down the pads and he gets an inside edge towards square leg"
215,"Steyn to Siddle, no run firm front-foot defensive this time as Steyn hits a length"
216,"Steyn to Siddle, no run another short-pitched ball and he ducks low"
217,"Steyn to Siddle, no run goes for a yorker which is somehow squirted out to midwicket"
218,"Ntini to Hauritz, no run hits a length and Hauritz slices in the air in front of Duminy at point"
219,"Ntini to Hauritz, no run now he shoulders arms to one pitched up wide of the stumps"
220,"Ntini to Hauritz, no run slants back in off the angle and he defends off the back foot"
221,"Ntini to Hauritz, no run thumps a full-blooded drive off the splice of the bat and Duminy fields"
222,"Ntini to Hauritz, no run swish and a miss off the front foot, missing by not much"
223,"Ntini to Hauritz, 3 runs this one pings the gap, Hauritz slaps a shorter ball past cover, Duminy sprints after it and retrieves it in the deep"
224,"Morkel to Hauritz, no run short of a length and he flashes outside off stump, beaten again"
225,"Morkel to Hauritz, FOUR runs but thats connected, and four as well, simply thwacked off the back foot"
226,"Morkel to Hauritz, no run on the stumps this time and he gets in line to defend it"
227,"Morkel to Hauritz, no run 134.3ks, bouncer down the stumps and he ducks under it"
228,"Morkel to Hauritz, FOUR runs flashes at a short, wide one and edges safely over the slips"
229,"Morkel to Hauritz, no run better length and he defends it back to Morkel"
230,"Ntini to Siddle, no run pitches fullish and he miscues the attempted flick back to Ntini"
231,"Ntini to Siddle, no run just too wide and he leaves it be"
232,"Ntini to Siddle, 3 runs full and slanting back in, Siddle shapes to on-drive but ends up chipping the ball back in the air well wide of Ntini and it passes past the weaving umpire"
233,"Ntini to Hauritz, FOUR runs full and wide and he slashes a one-handed shot between gully and slips"
234,"Ntini to Hauritz, no run still full and wide and this time he shoulders arms"
235,"Ntini to Hauritz, FOUR runs hah, nothing is going to hand! Ntini pitches full with the angle, Hauritz pushes at the ball, and edges smack past where Kallis was positioned at wide second slip the ball before"
236,"Morkel to Siddle, no run pitches on a length and he plays the ball to Duminy on the off side"
237,"Morkel to Siddle, FOUR runs confident stroke that, driven through cover and point with panache"
238,"Morkel to Siddle, 2 runs another shot of style as Morkel pitches straighter, just walks across and clips the ball down to deep square leg"
239,"Morkel to Siddle, no run good short delivery with steeping bounce and the batsman sways back"
240,"Morkel to Siddle, 3 runs another squirt down to third man, safely, and thats the 50-run stand"
241,"Morkel to Hauritz, no run hits a length and he defends with soft hands to a diving gully fielder"
242,"Harris to Clarke, no run lands on a length and he pats it back"
243,"Harris to Clarke, no run tossed up and spinning in, Clarke lunges forward"
244,"Harris to Clarke, FOUR runs twinkle-toed brilliance from Clarke, shimmying down and lofting over mid-off"
245,"Harris to Clarke, no run fuller, flatter, drifting in and he defends it back to Harris"
246,"Harris to Clarke, 1 run drifts straighter and he clips it away through midwicket"
247,"Harris to Johnson, 2 runs reaches out and drives the ball away for a couple more"
248,"Kallis to Clarke, no run starts off back of a length and Clarke pushes it to the off side"
249,"Kallis to Clarke, no run fuller and swinging back in and he jabs it back to Kallis"
250,"Kallis to Clarke, no run straightens this time off a length and Clarke eases a drive to mid-off"
251,"Kallis to Clarke, no run drives on the up to a sort of short cover fielder"
