,Data
176,"Clarke to Misbah, 2 runs two more here, working it into the off side from a shortish delivery"
177,"Clarke to Misbah, 1 run Misbah finding his range a little more, pushing it away for a single"
178,"Clarke to Umar Akmal, 1 run Umar still content to watch the ball carefully and nurdle it into the leg side for a single towards deep midwicket"
179,"Clarke to Misbah, FOUR runs what a lovely shot this is, Misbah skips down the wicket and drives, conventionally and beautifully for a boundary"
180,"Smith to Umar Akmal, 2 runs Umar greets him with a delicate sweep, bit of a nothing shot, dabbed away to short fine leg for a couple"
181,"Smith to Umar Akmal, 1 wide another attempted dab shot, to what would have been a full toss, so Umar ends up getting nothing from a loose ball"
182,"Smith to Misbah, 1 run short ball to Misbah, pulls it away for a single to deep midwicket"
183,"Smith to Afridi, 1 run Afridi sweeps his first ball, timing it well enough but straight to the fielder on the midwicket boundary"
184,"Smith to Misbah, no run fullish delivery Misbah can't get much of it and another dot"
185,"Smith to Misbah, 2 runs better connection this time, swiped away towards cow corner for a couple"
186,"Johnson to Afridi, no run Johnson back to Afridi, and he's so excited that he falls over as he delivers, it's still a good ball and beats an attempted defensive shot from Afridi"
187,"Johnson to Afridi, 1 run good ball on a good length, Afridi gets back and defends into the off side, collects a single"
188,"Johnson to Misbah, 1 run fuller this time outside off stump, Misbah drives carefully, but it comes off the edge anyway and goes down to third man"
189,"Johnson to Afridi, (no ball) no ball from Johnson, outside off, which Afridi plays and misses at, but excitingly this means it's a free hit"
190,"Johnson to Afridi, 2 runs looked like a slower ball from Johnson, it was short, Afridi hung back and tried to mow it away through midwicket, couldn't time it at all and collects a couple"
191,"Johnson to Afridi, no run well, if Afridi did connect with this it would have ended up well out the ground, as it was, he swished manically at thin air as a full ball passed through to Haddin"
192,"Johnson to Afridi, 1 run gets more bat on this, but not much more, leading edge loops down to mid off"
193,"Smith to Afridi, FOUR runs touch of turn here but from a very short length, Afridi have himself some room and trashed it through the cover for four"
194,"Smith to Afridi, FOUR runs good shot here, skipping down the track and timing it firmly past long on for four"
195,"Smith to Afridi, SIX runs excellent shot! Gives himself some room and murders it over cover for six, quality shot, looked like he didn't time it but it flew"
196,"Smith to Afridi, 1 run this time more careful, driving along the ground through cover for one"
197,"Smith to Misbah, 1 run Misbah content to work it away, while Afridi is booming he just needs to rotate the strike"
198,"Smith to Afridi, 1 run another big offside flay attempted, but it goes out to the deep cover fielder"
199,"Watson to Afridi, 1 run Watson back and Afridi attempting an ambitious leg-side flick, doesn't time it at all and collects one to deep square"
200,"Watson to Misbah, 1 run Misbah attempting to manufacture a shot, shuffling around his crease, but ends up collecting one"
201,"Watson to Afridi, FOUR runs good stuff from Afridi! Down on one knee and scooping this length ball over his shoulder for a boundary"
202,"Watson to Afridi, 1 run well he's swinging hard at it, but not really timing this length ball, gets it down to mid on for one"
203,"Watson to Misbah, 1 run Misbah rotates the strike calmly here, driving towards deep cover to get his captain back on strike"
204,"Watson to Afridi, 1 leg bye Afridi down on one knee again, this is well outside off stump though, so the leg-side scoop is harder to pull off, as it is, it comes off the boot into the off side where Haddin fields"
205,"Johnson to Afridi, no run Johnson is back, replacing Smith after that expensive last over, Afridi is already in more trouble, swishing wildly and missing outside off"
206,"Johnson to Afridi, 1 run this was much more in Afridi's hitting arc, on a length and outside off, but he could only drive it down to the deep cover fielder"
207,"Johnson to Misbah, 2 runs not great fielding this from Tait, Misbah worked a leg-side ball down to short fine leg where Tait tumbled and fumbled and allowed a couple"
208,"Johnson to Misbah, 1 run good ball again, into the body, Misbah just turns it into the leg side for one, gets Afridi on strike who needs to do some damage off these last two balls"
209,"Johnson to Afridi, no run good from Johnson, slower ball that Afridi didn't spot at all, ends up fencing at it outside off stump and misses"
210,"Johnson to Afridi, 2 runs good end to an excellent over from Johnson, full and straight Afridi drives down to long off and collect a lung-busting couple"
211,"Tait to Misbah, 1 run Misbah is once again content to work the powerhouse Tait down to third man for a single, to set up a manic looking Afridi v Tait clash"
212,"Tait to Afridi, 1 run slower ball from Tait, Afridi hoiks madly at it, swinging himself off his feet, but doesn't time it and collects one to midwicket"
213,"Tait to Misbah, 1 run Misbah walks outside leg, and Tait follows him like a school bully, in the end Misbah can't do much and mistimes it away into the leg side"
214,"Tait to Afridi, no run good bouncer here, very sharp, Afridi threw everything at a pull shot but it was through him in a flash"
215,"Tait to Afridi, 2 runs full toss here from Tait, it looked quite high, Afridi ended up clubbing it down to long on for a couple, Afridi thought it was a no-ball, but the umpire disagreed"
216,"Nannes to Misbah, no run Misbah steadily works this away calmly, Pakistan need more but maybe he's timing his innings well"
217,"Nannes to Misbah, 1 run gets a run this time, full and squeezed into the covers for one"
218,"Nannes to Abdul Razzaq, 1 run Razzaq needs to do something special but at the moment all he can do is push this into covers for one"
219,"Nannes to Misbah, 1 run full again from Nannes, Misbah chips it down to long on, one bounce, for another single"
220,"Nannes to Misbah, 1 run very good ball from Nannes, yorker and Misbah jabs a bat down on it, they collect a sharp single"
221,"Watson to Misbah, 1 run Watson is back and landing this up and around off stump, driven to the cover for a gentle single"
222,"Watson to Fawad Alam, 1 run this will not do Australia any harm, driven carefully into the cover region for a quiet single"
223,"Watson to Misbah, 1 run full toss from Watson, Misbah can't get it away, driving down the ground for a single"
224,"Watson to Fawad Alam, no run slower-ball bouncer that loops up over Fawad Alam, misses the hook shot, and Haddin collects"
225,"Watson to Fawad Alam, 1 run this time it's floated up outside off, Fawad Alam drives at it without timing and can only collect one towards the covers"
226,"Watson to Misbah, 1 run another single from Misbah, he really needs to up the rate a touch, working it away into the off side for one"
227,"Nannes to Misbah, SIX runs That's more like it, full and cleanly struck from Misbah, timed perfectly down the ground for six"
228,"Nannes to Fawad Alam, 1 run not much on offer here, full and straight and driven for one"
229,"Nannes to Amir, 1 run bang on a length and line, Aamer hops back and works it towards cover for a single"
230,"Nannes to Fawad Alam, SIX runs angled into to Fawad Alam's legs, and he just helps it on it's way, timing it very well and it flies all the way for six"
231,"Nannes to Fawad Alam, no run this time it's outside off stump, Fawad Alam attempts an ugly-looking swipe, gets a bottom edge through to Haddin on the bounce"
232,"Hussey to Amir, 1 run David Hussey back and landing this outside off, attempting flay through the off side is not timed very well, and they collect one"
233,"Hussey to Fawad Alam, FOUR runs lovely shot this from Fawad Alam, just placed it through extra cover, didn't look like it had much on it but it raced to the boundary"
234,"Hussey to Fawad Alam, 1 run this time it's worked more gently away into the covers for a single"
235,"Hussey to Fawad Alam, 1 run neatly done from Fawad Alam, who looks a decent bat, working it away for a single"
236,"Hussey to Sami, 1 run Sami negotiates his first ball pushing into the off side for a swift single, good over from Hussey"
237,"Johnson to Sami, 1 run Sami stays very still in his crease and guides this away for a single down to third man"
238,"Johnson to Fawad Alam, 1 run wild wish from Fawad Alam, doesn't time it very well, but gets one to midwicket"
239,"Johnson to Sami, 1 run this is very tame, full and pushed into the covers, simple single for Sami"
240,"Johnson to Sami, 1 run Sami once again working it away for an easy single, good stuff from Johnson"
241,"Johnson to Ajmal, no run good end to a good over, Saeed Ajmal can't get it away"
242,"Tait to Sami, 1 run Tait to finish up here, full and straight, Sami knocks it away for a single into the off side"
243,"Tait to Ajmal, no run short this time, Saeed Ajmal attempts a big hook shot but finds nothing and Haddin collects"
244,"Tait to Ajmal, no run this is through Saeed Ajmal pretty quickly, gets a bottom edge an a leg-side swipe, which Haddin collects very smartly"
245,"Tait to Ajmal, 2 runs fuller this time and Saeed Ajmal gets much more on this, driving down the ground for a couple"
246,"Tait to Ajmal, 2 runs just gets away with this, Saeed Ajmal gives himself plenty of room and leading-edges it just past mid off for a couple`"
247,"Right, that is all from me. I hope you have enjoyed the action. The fun, of course, doesn't stop and tomorrow Sri Lanka face a combative Zimbabwe side and need to win to progress in the tournament, and England play their first game, against the hosts, West Indies. So I do hope you'll join us, and, while you wai"
248,Shane Watson takes the man-of-the-match award for his 81 that really took the game away from Pakistan. He says 175 would have been par today and pays tribute to David Hussey's fifty.
249,Michael Clarke is very chirpy. Predictably he thinks 'all the boys did well' and backs his fast bowlers to do very well in the tournament.
250,Ravi Shastri leads the presentation ceremony and Shahid Afridi said that he thought the spinners could do well early on but Warner and Watson were too strong today and thinks 192 was a very very good total.
251,"Australia came into this tournament with a very poor record but they have outplayed the defending champions in every aspect of the game today. Led by an excellent innings from Shane Watson, supported by the destructive Davids - Warner and Hussey, they made too many for a Pakistan team out of sorts."
252,Australia won by 34 runs
253,"Player of the match is Shane Watson, AUS"
