,Data
235,"Herath to Hussey, 2 runs outside off stump this time and Hussey unfurls the reverse-paddle, placing it into the gap at third man to retain strike"
236,"Herath to Hussey, 1 run Hussey moves forward and clips the ball through square leg for a single"
237,"Herath to Lyon, no run Lyon defends on the front foot on the leg side"
238,"Herath to Lyon, no run Lyon strides forward and defends on the off"
239,"Herath to Lyon, no run Herath tosses it up invitingly outside off, Lyon resists and lets the ball go"
240,"Welegedara to Hussey, 2 runs short ball, Hussey pulls in front of square and calls Lyon through for two"
241,"Welegedara to Hussey, no run full ball outside off, Hussey lets it go"
242,"Welegedara to Hussey, 1 run full delivery outside off stump, driven off the front foot through cover point"
243,"Welegedara to Lyon, no run played off the pads on the leg side"
244,"Welegedara to Lyon, no run Lyon moves forward and pushes the ball towards point"
245,"Welegedara to Lyon, no run Lyon plays a graceful straight drive to a full ball and the bowler sticks out his boot and stops it"
246,"Herath to Hussey, no run Hussey steps out to smother the turn and blocks"
247,"Herath to Hussey, no run Hussey steps out again, gets to the pitch and plays to midwicket"
248,"Herath to Hussey, no run tossed up by Herath, Hussey drives firmly to the bowler's left and Herath dives to cut it off"
249,"Herath to Hussey, no run played back towards the bowler"
250,"Herath to Hussey, no run Hussey tries to sweep a full ball but misses and gets hit on the pad, that pitched outside leg"
251,"Herath to Hussey, FOUR runs Hussey beats the field by playing the reverse-sweep but he's placed and timed it so well that it will go for four to the point boundary, he loses strike but I doubt he will be too fussed"
252,"Eranga to Lyon, no run Lyon strides forward and defends a good length ball with bat and pad close together"
253,"Eranga to Lyon, no run good length and angling into the right-hander, defended on the front foot"
254,"Eranga to Lyon, 1 run short of a length angled into the right-hander's body, Lyon tucks it around the corner and sets off"
255,"Eranga to Hussey, no run defended from the crease on the off side"
256,"Eranga to Hussey, 1 run dropped at third man, but a really tough chance. Hussey charged the fast bowler and threw his bat at it, aiming to hit it through cover. The ball flew off the edge and went flat and quickly towards third man, where Herath ran in and dived forward but couldn't hold on."
257,"Eranga to Lyon, no run Lyon defends on the back foot to give the strike back to Hussey"
258,"Herath to Hussey, no run Hussey comes forward and drives to the fielder at cover"
259,"Herath to Hussey, no run Hussey drives towards long-on but refuses the single"
260,"Herath to Hussey, SIX runs and that's why! Hussey steps out of his crease, gets to the pitch of the ball and hoists it with the turn over the wide long-on boundary. Terrific strike."
261,"Herath to Hussey, 1 run now he takes the single after coming down the pitch and driving to long-on, Lyon has two to face"
262,"Herath to Lyon, 2 runs oops, Lyon attempts the big sweep and doesn't execute it well at all, gets a bottom edge that misses stumps and keeper"
263,"Herath to Lyon, no run that's the one that goes straight through and Lyon didn't pick it, I think he got an inside edge on to the pad else it would have been a good shout for lbw"
264,"Eranga to Hussey, no run good length delivery angling across Hussey, who lets it go"
265,"Eranga to Hussey, no run defended from the crease towards the off side"
266,"Eranga to Hussey, OUT bowled him! Eranga caps a fine performance on debut with a slower ball, Hussey comes forward to push at it but gets an inside edge on to the stumps. Hussey goes after a terrific century - his 15th in Tests - and steering Australia past 300"
267,"11.40 am Lunch is at noon so, with ten minutes for the change of innings, Sri Lanka will have about ten minutes to negotiate before the break. Have Australia got enough? Well they've got the sort of first-innings score that makes for a cracking Test."
268,This will be the last over before lunch.
269,"Watson to Angelo Mathews, no run full, on off, defended from the crease"
270,"Watson to Angelo Mathews, no run short of a length, around off, pushed to cover"
271,"Watson to Angelo Mathews, no run comes forward to defend this to cover"
272,"Watson to Angelo Mathews, no run full, swinging in a touch, driven to mid-off"
273,"Watson to Angelo Mathews, 1 run short of a length, into the pads, worked away for a single wide of midwicket"
274,"Watson to HAPW, 3 runs overpitched outside off, squeezes this past cover, and they run well to take a third"
275,"Siddle to HAPW, no run holds its line outside off, left alone"
276,"Siddle to HAPW, no run another leave outside off"
277,"Siddle to HAPW, no run short of a length, close to off, left alone on length. It bounces over the stumps"
278,"Siddle to HAPW, no run full, swings in late, gets the inside half of the bat, towards midwicket"
279,"Siddle to HAPW, no run slower ball, 119ks, PJ checks the shot and defends this"
280,"Siddle to HAPW, no run full and straight, pushed back, Siddle fields in his follow-through"
281,"Copeland to NT Paranavitana, no run good length angling away from the left-hander, this is an easy one to leave for Paranavitana, the deliveries in the first over were much closer to off stump"
282,"Copeland to NT Paranavitana, no run this one is closer to off stump and Paranavitana defends"
283,"Copeland to NT Paranavitana, no run good length delivery pitching on off and middle and angling across, Paranavitana moves forward and pushes towards the off side"
284,"Copeland to NT Paranavitana, 1 run a touch too straight this time and Paranavitana tucks it off his pads towards square leg"
285,"Copeland to Thirimanne, no run too wide outside off this time, left alone"
286,"Copeland to Thirimanne, no run this one is close to off stump but Thirimanne lets it go through with Haddin, and that will be lunch"
287,"Siddle to NT Paranavitana, 2 runs short of a length around off, the batsman opens the face and steers it behind point"
288,"Siddle to NT Paranavitana, no run full ball outside off, Paranavitana tries to drive and gets beaten, ball passes under the bat"
289,"Siddle to NT Paranavitana, no run short of a length outside off, left alone by the batsman"
290,"Siddle to NT Paranavitana, no run full and straight, played from the crease towards midwicket"
291,"Siddle to NT Paranavitana, FOUR runs Paranavitana reaches out for one outside off and pushes away from his body, the ball flies off the outside edge through point for four"
292,"Johnson to Angelo Mathews, no run length ball, angling across, defended back"
293,"Johnson to Angelo Mathews, no run defended off the front foot again"
294,"Johnson to Angelo Mathews, no run short of a length, middle and off, defended back to Johnson"
295,"Johnson to Angelo Mathews, 2 runs clipped away off the pads, in the gap past midwicket"
296,"Johnson to Angelo Mathews, 2 runs inside edge, a thick one, but it travels well past midwicket"
297,"Johnson to Angelo Mathews, FOUR runs this is an absolute slap to the long-off fence. A wide length ball, but he comes down on it with a slightly closed face, and the timing is superb"
298,"Lyon to HAPW, no run floated outside off, defended to cover"
299,"Lyon to HAPW, no run turning into the pads, defended to short leg"
300,"Lyon to HAPW, no run tossed up outside off, dead-batted"
301,"Lyon to HAPW, no run angling away from him, driven to mid-off"
302,"Lyon to HAPW, no run slower through the air, around off, defended solidly"
303,"Lyon to HAPW, no run another forward-defensive, a slightly open face this time"
304,"Copeland to Thirimanne, no run played back to the bowler"
305,"Copeland to Thirimanne, no run good length outside off once again, left alone by the batsman"
306,"Copeland to Thirimanne, no run Copeland bowls a good length wide outside off, Thirimanne lets the ball go"
307,"Copeland to Thirimanne, 3 runs too full and too straight, Thirimanne leans forward and flicks it through midwicket"
308,"Copeland to NT Paranavitana, no run defended on the front foot towards the bowler"
309,"Copeland to NT Paranavitana, no run fuller length and the length is too wide for the batsman to play at it"
310,"Siddle to Thirimanne, no run the batsman gets behind the line and defends towards the bowler"
311,"Siddle to Thirimanne, no run full and straight from Siddle, Thirimanne stays on his crease and forces the ball on the leg side"
312,"Siddle to Thirimanne, no run good length, pitches outside off and seams away, the batsman lets it go"
313,"Siddle to Thirimanne, no run short ball, well directed too, the batsman sways and lets it go"
314,"Siddle to Thirimanne, no run fuller length angling across the left hander, left alone by the batsman"
315,"Siddle to Thirimanne, no run straighter line from Siddle, the batsman drives off the front foot to mid off"
316,"Johnson to Angelo Mathews, 2 runs worked away off the pads, nicely into the gap past square leg"
317,"Johnson to Angelo Mathews, no run short of a length, angling a touch away, defended off the back foot"
318,"Johnson to Angelo Mathews, no run fuller, around off again, defended to cover"
319,"Johnson to Angelo Mathews, no run not sure Johnson is listening to Dar. Left alone by Mathews only to turn up and see Johnson giving him some more lip"
320,"Johnson to Angelo Mathews, no run defended solidly to silly mid0off, Johnson follows through next to the batsman. I must add that he does have a smile on his face although the chat doesn't seem very pleasant"
321,"Johnson to Angelo Mathews, no run defended solidly off the front foot. No action on the ball, although words have flown this way and that"
322,"Lyon to HAPW, 1 run short of a length, pushed between point and cover, and they charge through for a single"
323,"Lyon to Angelo Mathews, no run angled across, seems like the arm ball, Mathews is beaten on the cut"
324,"Lyon to Angelo Mathews, 1 run comes down the track and pushes this to long-on for one"
325,"Lyon to HAPW, 1 run gives him the charge and pushes this to long-on again"
326,"Lyon to Angelo Mathews, no run stretches well forward to defends this back to the bowler"
327,"Lyon to Angelo Mathews, no run blocked to short leg this time"
328,"Copeland to NT Paranavitana, no run left alone outside off stump, short of a length delivery, angling away"
329,"Copeland to NT Paranavitana, no run left alone once again outside off"
330,"Copeland to NT Paranavitana, no run Copeland continues pitching outside off and seaming it away, Paranavitana continues to leave"
331,"Copeland to NT Paranavitana, no run loud shout for lbw as Paranavitana gets hit on the pad while trying to defend on the front foot. Aleem Dar says not out and Clarke decides to review after thinking about it for a while. It was a good length ball that pitched in line and angled back into the left-hander instead of seaming away. That lo"
332,"Copeland to NT Paranavitana, no run left alone outside off stump"
333,"Copeland to NT Paranavitana, no run left alone once again"
334,"Johnson to Thirimanne, no run defended on the back foot"
335,"Johnson to Thirimanne, no run Thirimanne gets behind the line and blocks"
336,"Johnson to Thirimanne, no run Thirimanne gets beaten by one that lifts from a good length outside off"
337,"Johnson to Thirimanne, no run defended on the back foot towards the bowler"
338,"Johnson to Thirimanne, no run defended on the off side from the crease"
339,"Johnson to Thirimanne, 3 runs width offered outside off stump and Thirimanne cracks it off the back foot through covers"
340,"Johnson to HAPW, no run length ball, starts outside off, angles further away, left alone"
341,"Johnson to HAPW, no run that's well bowled, this is not just the angle, but the off cut on it. Pitches just outside off, PJ plays for the angle, but it seams further away and beats the edge"
342,"Johnson to HAPW, no run this one starts wider, and thus left alone"
343,"Johnson to HAPW, no run another leave outside off, not close enough to bring that doubt into play"
344,"Johnson to HAPW, 3 runs short, doesn't get up high, and is pulled from rib-high, into the ground, past midwicket"
345,"Johnson to Angelo Mathews, no run full ball outside off, defended solidly off the front foot"
346,"Lyon to HAPW, 2 runs overpitched outside off, doesn't try to hit it too hard, just squeezes it between cover and point"
347,"Lyon to HAPW, 1 run short on the pads, worked away for an easy single"
348,"Lyon to Angelo Mathews, no run full outside off, pushed back to the bowler"
349,"Lyon to Angelo Mathews, no run low trajectory, outside off, pushed back"
350,"Lyon to Angelo Mathews, 1 run flighted on middle and leg, driven to long-on"
351,"Lyon to HAPW, no run shorter, easily defended off the back foot"
352,"Copeland to Thirimanne, no run good length angling across the left-hander, left alone by the batsman"
353,"Copeland to Thirimanne, no run defended on the front foot towards the leg side"
354,"Copeland to Thirimanne, no run too wide outside off stump, the batsman lets it go"
355,"Copeland to Thirimanne, no run played off the back foot on the leg side"
356,"Copeland to Thirimanne, no run good length pitching outside off stump, the batsman covers his off stump and lets it go"
357,"Copeland to Thirimanne, no run defended on the front foot towards mid-off"
358,"Johnson to NT Paranavitana, no run good length outside off from over the wicket, left alone by the batsman"
359,"Johnson to NT Paranavitana, no run short of a length and straight, defended on the back foot"
360,"Johnson to NT Paranavitana, no run blocked off the back foot towards the bowler, wear this new ball and Australia's bowlers down is the way to go for Sri Lanka"
361,"Johnson to NT Paranavitana, no run full delivery outside off, driven off the front foot towards mid-off"
362,"Johnson to NT Paranavitana, 1 run nudged behind square from the crease for a single"
363,"Johnson to Thirimanne, no run Haddin gets excited after collecting the ball down leg side but that came off the pad"
364,"Johnson to Angelo Mathews, no run angled across, around off, pushed to cover"
365,"Johnson to Angelo Mathews, 1 run short of a length, opens the face, gets it past cover, brings up the hundred for Johnson"
366,"Johnson to HAPW, no run on a length, middle and leg, defended in front of off"
367,"Johnson to HAPW, no run slower offcutter, 130ks, pitches leg, defended in front of off"
368,"Johnson to HAPW, FOUR runs short, 144ks, sits up rib-high, and this time he has played a cracking pull. Right into the ground, past Tony Hill at square leg, who - I might add - had no chance of fielding it"
369,"Johnson to HAPW, FOUR runs after the short one, catches him on the back foot with a fullish offcutter. The edge, though, is soft, bounces well short of slips, and then bisects them"
370,"Copeland to Angelo Mathews, no run short of a length, pushed to cover"
371,"Copeland to Angelo Mathews, no run length ball into the pads, defended wide of midwicket"
372,"Copeland to Angelo Mathews, 1 run short of a length, steered square on the off side for a single"
373,"Copeland to HAPW, no run on a length, just outside off, driven to mid-off"
374,"Copeland to HAPW, no run swinging in a touch, pushed to mid-on"
375,"Copeland to HAPW, 1 run driven with an open face, past point, for a single"
376,"Copeland to NT Paranavitana, no run this one moves away from the left-hander and the batsman flashes and misses"
377,"Copeland to NT Paranavitana, no run left alone outside off stump"
378,"Copeland to NT Paranavitana, 1 run pushed off the front foot for a single towards cover"
379,"Copeland to Thirimanne, no run short ball, and the batsman gets under it"
380,"Copeland to Thirimanne, no run defended on the off side"
381,"Copeland to Thirimanne, 2 runs too straight on the pads, Thirimanne whips it through square leg"
382,"Johnson to NT Paranavitana, no run Johnson delivers at 142 kph, good length outside off and the batsman plays no shot"
383,"Johnson to NT Paranavitana, no run full ball on off stump, Paranavitana digs it out on the leg side"
384,"Johnson to NT Paranavitana, no run wide outside off stump, too far for the batsman to play"
385,"Johnson to NT Paranavitana, no run played off the back foot towards point"
386,"Johnson to NT Paranavitana, FOUR runs Paranavitana uses the angle down leg side to glance the ball off his hip towards the fine-leg boundary"
387,"Johnson to NT Paranavitana, no run defended on the front foot towards the off side"
388,"Lyon to HAPW, no run pitched up on the pads, blocked"
389,"Lyon to HAPW, no run tossed up outside off, defended back"
390,"Lyon to HAPW, no run leaves the crease, gets too close to the pitch of the ball, drives it back to the bowler"
391,"Lyon to HAPW, 1 run against the run of play, PJ comes down the track and lofts him down the ground. It is not a chip, just that he hasn't hit it well, and it falls short of long-on"
392,"Lyon to Angelo Mathews, no run worked around the corner"
393,"Lyon to Angelo Mathews, no run full and straight, played back to Lyon"
394,"Copeland to HAPW, 2 runs PJ is edgy here. Nothing special with the bowling, but he has lost concentration a bit here. Plays this uppishly without any control, but somehow places this smack between the two short midwickets. Perfectly catchable height"
395,"Copeland to HAPW, no run soft hands and a defensive shot this time"
396,"Copeland to HAPW, no run angled into the pads, pushed back to the bowler"
397,"Copeland to HAPW, 2 runs this time Copeland provides him the width, and he uses Copeland's pace (!) to guide it past point. Opens the bat face late, and plays it along the ground"
398,"Copeland to HAPW, no run closer to off, defended back to the bowler"
399,"Copeland to HAPW, no run slower offcutter, PJ doesn't pick it, is hit on the thigh pad, and the ball is headed down too"
400,"Watson to Thirimanne, no run his first ball from over the wicket is outside off and the batsman lets it go"
401,"Watson to Thirimanne, no run good length delivery angling away from the left-hander, Thirimanne lets it go again"
402,"Watson to Thirimanne, FOUR runs short and wide outside off, Thirimanne stands tall on the back foot and cuts the ball hard through point, that's his first boundary"
403,"Watson to Thirimanne, no run fuller length outside off, Thirimanne lets it go"
404,"Watson to Thirimanne, no run Thirimanne continues to patiently let the better balls go outside off"
405,"Watson to Thirimanne, no run good length but the line is outside off so Thirimanne shoulders arms"
406,"Johnson to NT Paranavitana, no run good length in the channel outside off Paranavitana strides forward and lifts his bat out of the way"
407,"Johnson to NT Paranavitana, no run Paranavitana once again moves forward and across to cover his off stump and then lets the ball pass"
408,"Johnson to NT Paranavitana, FOUR runs Johnson is too straight this time and Paranavitana clips the ball off his pads through midwicket"
409,"Johnson to NT Paranavitana, no run straighter line, on off and middle, defended on the front foot"
410,"Johnson to NT Paranavitana, no run short ball outside off stump, left alone once again"
411,"Johnson to NT Paranavitana, no run fuller and straighter, Paranavitana moves forward and defends with a straight bat"
412,"Lyon to Angelo Mathews, no run turning harmlessly down the leg side"
413,"Lyon to Angelo Mathews, 2 runs turning down leg again, gets a tickle from Mathews"
414,"Lyon to Angelo Mathews, no run full, on off and middle, hit back to the bowler"
415,"Lyon to Angelo Mathews, no run dead-batted back to the bowler"
416,"Lyon to Angelo Mathews, no run slower through the air, defended to leg"
417,"Lyon to Angelo Mathews, 2 runs that's a right long hop, and Mathews pulls this towards deep midwicket and picks two before Marsh runs around from deep square"
418,"Copeland to HAPW, no run on a length, angling in, pushed to square leg"
419,"Copeland to HAPW, no run full outside off, driven to short cover"
420,"Copeland to HAPW, no run length ball on the stumps, pushed back to the bowler"
421,"Copeland to HAPW, no run push-drives this to cover"
422,"Copeland to HAPW, no run defended to midwicket"
423,"Copeland to HAPW, 1 run gets the width, drives with an open face, to point"
424,"Watson to Thirimanne, no run good length slanting across the left-hander, Thirimanne lets it go"
425,"Watson to Thirimanne, no run that's a rare rash shot. Thirimanne goes after one that's wide outside off but not so full, he misses the cover drive"
426,"Watson to Thirimanne, no run pushed off the back foot towards point"
427,"Watson to Thirimanne, no run full ball outside off stump, Thirimanne stays in his crease and watches the ball go past"
428,"Watson to Thirimanne, 2 runs dropped at second slip by Clarke! Thirimanne played an expansive cover drive at a length ball that slanted away from him, the thick edge flew quickly to Clarke at head height, he got his hands up and parried the ball above his head"
429,"Watson to Thirimanne, no run left alone outside off stump"
430,"Lyon to NT Paranavitana, no run defended on the front foot"
431,"Lyon to NT Paranavitana, no run slants on to leg stump, the batsman glances towards short fine leg"
432,"Lyon to NT Paranavitana, 1 run angling into middle stump from round the wicket, played towards midwicket"
433,"Lyon to Thirimanne, no run defended on the front foot towards the off side"
434,"Lyon to Thirimanne, no run played off the back foot towards point"
435,"Lyon to Thirimanne, no run defended on the front foot back down the pitch"
436,"Lyon to HAPW, no run low full toss outside off, pushed back to the diving Lyon"
437,"Lyon to HAPW, no run full, fast, across him, defended to cover"
438,"Lyon to HAPW, SIX runs PJ take SL to 400 with a six! This is low in trajectory again, PJ charges at him, reaches the pitch of the ball, and lofts him over wide long-on. Cow corner, since it is time for cows to come back home"
439,"Lyon to HAPW, SIX runs long hop, real long hop, and he ricks back to pull him over deep midwicket. PJ is looking for quick ones before stumps"
440,"Lyon to HAPW, no run doesn't go for the third, choosing to block this back"
441,"Lyon to HAPW, no run short and wide this time, he late-cuts it, but can't beat point"
442,"Copeland to Angelo Mathews, no run length ball, just outside off, defended back"
443,"Copeland to Angelo Mathews, no run angling in, pushed to midwicket"
444,"Copeland to Angelo Mathews, no run slower ball, 112k, dead-batted"
445,"Copeland to Angelo Mathews, no run angling into the pads again, pushed to short midwicket"
446,"Copeland to Angelo Mathews, no run into the pads again, works this to leg, but can't beat the short midwickets"
447,"Copeland to Angelo Mathews, no run defended to mid-on this time"
448,"Watson to NT Paranavitana, no run good length and a testing line outside off stump, Paranavitana lets it go"
449,"Watson to NT Paranavitana, no run length delivery on off stump, defended on the back foot"
450,"Watson to NT Paranavitana, no run outside the off stump, left alone by the batsman"
451,"Watson to NT Paranavitana, no run too wide outside off stump, easy leave for the batsman"
452,"Watson to NT Paranavitana, no run another one in the channel outside off, another one for the keeper to collect"
453,"Watson to NT Paranavitana, no run Paranavitana lets this one also go through to Haddin"
454,"Lyon to Thirimanne, no run defended on the front foot towards the off side"
455,"Lyon to Thirimanne, 1 run the length is a bit short, allowing the batsman to go back and punch through cover"
456,"Lyon to NT Paranavitana, 1 run tossed up on middle stump, worked towards midwicket from the crease"
457,"Lyon to Thirimanne, no run fired in quick, Thirimanne gets a bit of a leading edge on the off side"
458,"Lyon to Thirimanne, 1 run that's dropped short and Thirimanne cuts off the back foot"
459,"Lyon to NT Paranavitana, no run defended on the front foot towards short leg"
460,"Siddle to HAPW, 1 run starts off with a yorker, which is ill directed, and is picked for easy runs down the leg side"
461,"Siddle to Angelo Mathews, no run defended to midwicket"
462,"Siddle to Angelo Mathews, no run short of a length, angling in towards off, defended to cover"
463,"Siddle to Angelo Mathews, no run another solid defensive - Mathews has shut shop here, but PJ is going strong. The clear plan is to have Mathews bat tomorrow too"
464,"Siddle to Angelo Mathews, 1 run angling into the pads, clipped away"
465,"Siddle to HAPW, no run on a length, just outside off, defended back to the bowler"
466,"Copeland to Angelo Mathews, no run misses out on a length ball on the pads"
467,"Copeland to Angelo Mathews, no run length ball outside off, defended off the front foot"
468,"Copeland to Angelo Mathews, 1 run worked away off the pads for a single"
469,"Copeland to HAPW, no run another dead-bat defensive back to the bowler"
470,"Copeland to HAPW, no run short of a length, just outside off, pushed to cover"
471,"Copeland to HAPW, no run full, driven straight to short extra cover"
472,"Watson to Thirimanne, no run short of a length outside off stump, the batsman lets it pass, far too wide for a patient stroke"
473,"Watson to Thirimanne, no run closer to off stump this time, bringing Thirimanne forward to play the defensive shot"
474,"Watson to Thirimanne, no run defended off the back foot towards the leg side"
475,"Watson to Thirimanne, no run good length delivery outside off, Haddin collects after the batsman lets it go"
476,"Watson to Thirimanne, no run the batsman takes a stride forward, covers his off stump, and shoulders arms to a good length ball angling across him"
477,"Watson to Thirimanne, no run closer to the left-hander this time, forcing the batsman to defend from his crease towards the off side"
