,Data
478,"Lyon to NT Paranavitana, no run pushed from the crease towards mid-off"
479,"Lyon to NT Paranavitana, no run defended on the front foot towards the bowler"
480,"Lyon to NT Paranavitana, no run played towards the fielder at silly point"
481,"Lyon to NT Paranavitana, no run tries to defend but gets an inside edge towards short fine leg, Thirimanne sets off from the bowler's end but gets sent back"
482,"Lyon to NT Paranavitana, 1 run played towards midwicket for a single"
483,"Lyon to Thirimanne, no run the batsman steps out of his crease and drives firmly to the fielder at mid-off"
484,"Siddle to Angelo Mathews, 1 run punched away outside off, gets a single to deep cover"
485,"Siddle to HAPW, 1 run tries the bouncer, but it is not coming up at all, dragged from well outside off, waist-high, and he pulls it down it into the ground, and through to deep midwicket"
486,"Siddle to Angelo Mathews, no run length ball on middle and leg, push-driven to mid-on"
487,"Siddle to Angelo Mathews, no run full outside off, driven handsomely, but straight to mid-off"
488,"Siddle to Angelo Mathews, no run length, outside off, pushed to mid-off"
489,"Siddle to Angelo Mathews, no run punched outside off, can"
490,"Copeland to Eranga, no run short of a length, gets behind the line, defends it back"
491,"Copeland to Eranga, no run on a length, middle and leg, stands tall to defend"
492,"Copeland to Eranga, no run wide outside off, left alone"
493,"Copeland to Eranga, no run another defensive stroke off middle and leg"
494,"Copeland to Eranga, no run short of a length, pushed with an open face, towards point"
495,"Watson to NT Paranavitana, no run Watson bowls a bouncer, Paranavitana ducks under it"
496,"Watson to NT Paranavitana, no run left alone outside off stump"
497,"Watson to NT Paranavitana, no run played towards cover point with an open face from the crease"
498,"Watson to NT Paranavitana, no run gets behind the line and defends towards the bowler"
499,"Watson to NT Paranavitana, no run driven from the crease towards cover, but Ponting at short cover ensures it doesn't get past him"
500,"Watson to NT Paranavitana, no run defended on the front foot with bat and pad close together"
501,"Siddle to Thirimanne, no run length delivery from over the wicket, Thirimanne punches from the crease towards cover"
502,"Siddle to Thirimanne, no run defended from the crease towards the off"
503,"Siddle to Thirimanne, 2 runs fuller length just outside off, Thirimanne drives the ball between short cover and mid-off"
504,"Siddle to Thirimanne, no run left alone outside off stump"
505,"Siddle to Thirimanne, no run defended on the front foot towards the bowler"
506,"Siddle to Thirimanne, no run defended on the off side once again"
507,"Siddle to Angelo Mathews, 3 runs Mathews jumps out of the crease, Siddle drops it short, Mathews glides it past point, Siddle grunts in frustration"
508,"Siddle to Eranga, no run full ball, drives at it, gets an inside into the foot, and then the ball lobs to safety"
509,"Siddle to Eranga, no run left alone outside off this time"
510,"Siddle to Eranga, no run short outside off again, left alone again"
511,"Siddle to Eranga, no run length ball, on off, pushed to cover-point"
512,"Siddle to Eranga, 1 run Eranga is off the mark, driving this wide of cover, and the lead is 100"
513,"Copeland to Eranga, no run dropped, just what you need at the end of a long hard day! Length ball, gets a fain edge, but Haddin is up too early, the gloves are too high, and the ball has hit the thigh even before he realises it. What would Dilshan be thinking now?"
514,"Copeland to Eranga, no run pushed to mid-on, a nice front-foot defensive"
515,"Copeland to Eranga, no run left alone outside off"
516,"Copeland to Eranga, no run drives this one, straight to mid-off"
517,"Copeland to Eranga, no run another slower ball! 111ks, defended towards mid-off"
518,"Copeland to Eranga, no run short of a length, into the pads, defended to midwicket"
519,"Watson to NT Paranavitana, no run Watson pitches on a great length just outside off, the batsman strides forward and shoulders arms"
520,"Watson to NT Paranavitana, no run good length and this time Paranavitana moves forward to punch the ball as it angles across him, hits it to short cover"
521,"Watson to NT Paranavitana, no run defended on the front foot towards the off"
522,"Watson to NT Paranavitana, no run played from the crease towards short cover"
523,"Watson to NT Paranavitana, no run full and straight, played off the front foot towards mid-on"
524,"Watson to NT Paranavitana, no run and the batsman moves forward and pushes the ball into the ground right at the fielder"
525,"Siddle to Thirimanne, no run Siddle tests Thirimanne with a bouncer, the batsman sways out of the line"
526,"Siddle to Thirimanne, no run played with an open face off the back foot towards point"
527,"Siddle to Thirimanne, no run defended from the crease towards the off side"
528,"Siddle to Thirimanne, no run good length outside off stump, defended towards cover"
529,"Siddle to Thirimanne, no run pushed towards the off from the crease once again"
530,"Siddle to Thirimanne, no run good length close to off stump, the batsman stays in his crease and square drives to point"
531,"Johnson to Angelo Mathews, no run length ball, angling towards off, pushed back to the bowler"
532,"Johnson to Angelo Mathews, no run full outside off, angling away, left alone"
533,"Johnson to Angelo Mathews, no run He turns down the single now! Pulled away from well outside off, and refuses the easy single on offer"
534,"Johnson to Angelo Mathews, 1 run takes the single now, the fourth ball, clipping this away off the pads"
535,"Johnson to Eranga, FOUR runs Johnson goes for the bouncer, Eranga is a touch hurried into it, but pulls it right into the ground, and gets it through to the midwicket fence"
536,"Johnson to Eranga, no run back of a length, middle and off, defended off the back foot"
537,"Copeland to Angelo Mathews, no run short of a length, middle and off, defended back"
538,"Copeland to Angelo Mathews, no run slower ball, 110ks, defended from the crease"
539,"Copeland to Angelo Mathews, no run short of a length, into the pads, defended to short midwicket"
540,"Copeland to Angelo Mathews, 1 run full on the pads, clipped away for one, leaves Eranga two balls to negotiate"
541,"Copeland to Eranga, no run length ball, middle and leg, watchfully played to mid-on"
542,"Copeland to Eranga, no run fuller, middle and off, pushed off the front foot"
543,"Lyon to NT Paranavitana, 1 run nudged towards mid-off for a quick single, Johnson fails to pick up cleanly"
544,"Lyon to Thirimanne, FOUR runs Thirimanne moves out of his crease and plays a hard drive along the ground past mid-on, he didn't hit it cleanly but hit it well enough"
545,"Lyon to Thirimanne, no run defended on the front foot towards the off side"
546,"Lyon to Thirimanne, no run punched off the back foot towards point"
547,"Lyon to Thirimanne, no run defended once again off the front foot"
548,"Lyon to Thirimanne, 1 run a touch short and the batsman moves back to punch through cover point"
549,"Siddle to Thirimanne, 2 runs Siddle pitches leg and angles into the pads, flicked through square leg"
550,"Siddle to Thirimanne, 2 runs Thirimanne moves across to force the ball on towards mid-on or midwicket but gets an inside edge behind square leg"
551,"Siddle to Thirimanne, no run good length rather close to off stump, Thirimanne lets it go through to Haddin"
552,"Siddle to Thirimanne, OUT bowled him! Thirimanne's off stump has taken a beating. Siddle pitches the ball full just outside off stump and brings it back in just a little, enough to find the gap between the batsman's attempted drive and pad. There might have been a faint inside edge too"
553,"Siddle to Sangakkara, no run full ball outside off, Sangakkara drives from his crease towards mid-off's right, the fielder moves quickly to field"
554,"Siddle to Sangakkara, no run played back to the bowler"
555,"Johnson to Angelo Mathews, no run well outside off, straightening too, left alone"
556,"Johnson to Angelo Mathews, no run full outside off, defended to mid-off"
557,"Johnson to Angelo Mathews, no run full outside off, pushed to mid-off"
558,"Johnson to Angelo Mathews, 1 run well forward and then in front of his body to defend this, and also place it wide of cover"
559,"Johnson to Eranga, no run short of a length, around off, defended"
560,"Johnson to Eranga, no run length ball wide of off, angling away, left alone"
561,"Lyon to Angelo Mathews, 2 runs flat across him, Mathews opens the face, gets into the vacant third man area for a couple"
562,"Lyon to Angelo Mathews, no run stays back to defend this one"
563,"Lyon to Angelo Mathews, no run flighted on middle and leg, pushed back to the bowler"
564,"Lyon to Angelo Mathews, no run flatter, quicker, defended to leg"
565,"Lyon to Angelo Mathews, 1 run near run-out, an unnecessary risk here, Eranga hasn't quite disgraced himself with the bat, so perhaps a bit too much of a risk to manoeuvre strike. He has defended this straight to square leg and shoots off. Ponting is the fielder on top of that. Mathews puts a full-length dive in, and would still have b"
566,"Lyon to Eranga, no run defended solidly outside off"
567,"Lyon to NT Paranavitana, no run defended on the front foot towards silly point"
568,"Lyon to NT Paranavitana, 1 run played towards extra cover for a single"
569,"Lyon to Sangakkara, no run Sangakkara moves back and watches the ball as it passes into Haddin's gloves outside off stump"
570,"Lyon to Sangakkara, no run defended on the front foot, the fielder at silly point dives in vain"
571,"Lyon to Sangakkara, no run Sangakkara comes a long way out of his crease and plays to short leg, Hughes fields and can't release the ball quickly enough, Sanga was a long way out. Hughes actually tried to dive towards the stumps with the ball in hand but then dropped it mid-dive."
572,"Lyon to Sangakkara, no run played off the back foot square on the off side"
573,"Siddle to NT Paranavitana, no run defended from the crease"
574,"Siddle to NT Paranavitana, 1 run full ball outside off, Paranavitana drives hard of the front foot towards point"
575,"Siddle to Sangakkara, no run good length around off stump, Sangakkara glides forward and defends on the off side"
576,"Siddle to Sangakkara, no run played off the front foot towards midwicket"
577,"Siddle to Sangakkara, no run good length and straight, Sangakkara stays in his crease and plays to midwicket"
578,"Siddle to Sangakkara, no run good length just outside off stump, Sangakkara lets it go"
579,"Johnson to Angelo Mathews, no run short, and well down the leg side"
580,"Johnson to Angelo Mathews, no run this time it is wide outside off stump. Just what you want in the dying minutes of the day. Especially when you are on 80 and have been dismissed just short of 100 twice in your career"
581,"Johnson to Angelo Mathews, no run opens the face on this one, turns the single down"
582,"Johnson to Angelo Mathews, no run left alone outside off"
583,"Johnson to Angelo Mathews, 2 runs He does take a risk, this time to try and squeeze a boundary through the close field, but he hits it uppishly past point. They think they can take three, but have to settle for two, and Mathews is stuck at the striker's end for the last ball of the over"
584,"Johnson to Angelo Mathews, no run short of a length, around off, defended off the back foot"
585,"Lyon to Eranga, no run tossed up around off, defended solidly"
586,"Lyon to Eranga, no run full on off, defended back to the bowler"
587,"Lyon to Eranga, no run flat, around off, pushed back to the bowler"
588,"Lyon to Eranga, no run dead-bats this flat delivery back to him"
589,"Lyon to Eranga, no run has a drive at this overpitched one, straight to mid-on"
590,"Lyon to Eranga, no run Lyon is done for the day as Eranga defends this off the front foot"
591,"Lyon to NT Paranavitana, 1 run played off the back foot towards cover point for a single"
592,"Lyon to Sangakkara, no run punched off the back foot to Ponting at silly point"
593,"Lyon to Sangakkara, no run left alone outside off stump"
594,"Lyon to Sangakkara, no run tossed up on middle, defended with bat and pad close together"
595,"Lyon to Sangakkara, 1 run Sangakkara gets off the mark by nudging one behind square on the leg side"
596,"Lyon to NT Paranavitana, no run defended from the crease towards silly point"
597,"Johnson to Sangakkara, FOUR runs short ball and Sangakkara hooks towards fine leg, where Lyon didn't pick up the ball at first and then by the time he did it was too late"
598,"Johnson to Sangakkara, no run defended from the crease towards the bowler"
599,"Johnson to Sangakkara, no run width offered outside off and Sangakkara cuts towards point"
600,"Johnson to Sangakkara, FOUR runs edged and wide of gully! Johnson fired it in full and quick around off stump, Sangakkara pushed hard at it, wanting to play towards mid-on perhaps, and got a thick outside edge to the third-man boundary"
601,"Johnson to Sangakkara, no run defended from the crease towards the bowler"
602,"Johnson to Sangakkara, no run good length outside off stump, Sangakkara shoulders arms"
603,"Johnson to Angelo Mathews, no run Johnson continues round the stumps, firing this well down the leg side"
604,"Johnson to Angelo Mathews, no run wide outside off, Mathews shoulders arms - some real gifts from Johnson in this spell"
605,"Johnson to Angelo Mathews, no run closer to off, Mathews is solid in defending this to mid-off"
606,"Johnson to Angelo Mathews, no run Mathews goes chasing after a wide delivery, drives it but keeps it down"
607,"Johnson to Angelo Mathews, no run angling in from wide outside off, meets the dead bat of Mathews"
608,"Johnson to Angelo Mathews, no run this is close to off, Mathews plays tentatively but with soft hands. On the bounce to gully. Goes and shakes Eranga's hand on the way back"
609,"Siddle to Eranga, no run good length outside off stump from Siddle, Eranga stays in his crease and lets it go"
610,"Siddle to Eranga, 2 runs width outside off stump and Eranga drives hard at it, didn't time it well but found the gap in the infield"
611,"Siddle to Eranga, 1 run driven towards point of the front foot, Marsh dives to his left at point to save runs"
612,"Siddle to Angelo Mathews, no run short ball first up, Mathews bends his knees and sways out of the way"
613,"Siddle to Angelo Mathews, no run good length delivery outside off, Mathews lets it pass"
614,"Siddle to Angelo Mathews, no run good length angling into the right-hander, defended towards short cover"
615,"Lyon to NT Paranavitana, 3 runs that was eventful. That ball drifted into the left-hander and the inside edge went between the batsman's legs towards the fine-leg boundary"
616,"Lyon to Sangakkara, 1 run played off the back foot towards point"
617,"Lyon to NT Paranavitana, 2 runs he's cut that off the back foot from close to off stump towards deep point"
618,"Lyon to NT Paranavitana, no run defended back to the bowler"
619,"Lyon to NT Paranavitana, no run wide outside off stump, the batsman lets it go"
620,"Lyon to NT Paranavitana, no run bowled quicker through the air and straight, defended on the front foot"
621,"Johnson to Sangakkara, FOUR runs short and wide outside off, Sangakkara flashes and goes hard at it, slicing it over Hussey's head at gully"
622,"Johnson to Sangakkara, FOUR runs that's a poor ball, full on leg stump, Sangakkara leans across and glances it to the fine-leg boundary"
623,"Johnson to Sangakkara, no run defended on the leg side"
624,"Johnson to Sangakkara, no run full and straight from Johnson, Sangakkara gets behind the line and blocks"
625,"Johnson to Sangakkara, no run good length outside off, defended towards over"
626,"Johnson to Sangakkara, no run punched from the crease towards cover"
627,"Copeland to Eranga, no run good length on off and middle stump, Eranga stays in his crease and plays towards midwicket"
628,"Copeland to Eranga, no run played to the man who is squarer at short midwicket"
629,"Copeland to Eranga, FOUR runs short and wide outside off, Eranga waits on the back foot and cuts hard towards the vacant third-man boundary"
630,"Copeland to Eranga, no run great line and length just outside off, Eranga prodded and was beaten, the ball nearly shaved off stump"
631,"Copeland to Eranga, no run defended on the front foot"
632,"Copeland to Eranga, no run defended back to the bowler from the crease"
633,"Siddle to Angelo Mathews, no run good length just outside off, defended on the front foot, Mathews hasn't scored yet today"
634,"Siddle to Angelo Mathews, no run Siddle angles the ball into the right-hander, Mathews stays on his crease and plays on the leg side"
635,"Siddle to Angelo Mathews, no run pushed off the front foot towards mid-on"
636,"Siddle to Angelo Mathews, no run the slower ball bowled full outside off, Mathews reaches forward and then waits a touch before defending"
637,"Siddle to Angelo Mathews, 1 run Mathews is away today, playing one off his hips towards deep square"
638,"Lyon to NT Paranavitana, no run defended towards cover"
639,"Lyon to NT Paranavitana, no run played from the crease towards slip"
640,"Lyon to NT Paranavitana, 2 runs a bit too full and the batsman drives through cover off the front foot"
641,"Lyon to NT Paranavitana, no run defended on the front foot towards short leg"
642,"Lyon to NT Paranavitana, no run wide outside off stump, some spin and bounce away from the left-hander, the batsman lets it go"
643,"Lyon to NT Paranavitana, 2 runs tossed up outside off stump, driven off the front foot towards deep cover"
644,"Johnson to Sangakkara, no run length delivery outside off stump, Sangakkara stays in his crease and plays towards cover"
645,"Johnson to Sangakkara, no run pushed off the front foot towards the off side"
646,"Johnson to Sangakkara, FOUR runs a full toss just outside leg stump, Sangakkara glances it to the fine-leg boundary. He'll hit those in his sleep"
647,"Johnson to Sangakkara, no run pushed from the crease towards midwicket"
648,"Johnson to Sangakkara, no run defended from the crease towards the off"
649,"Johnson to Sangakkara, no run good line and length, Sangakkara gets behind the line and defends towards the bowler"
650,"Copeland to Angelo Mathews, 1 run Mathews stays in his crease and pushes through cover"
651,"Copeland to Herath, no run Herath moves forward to a good length ball that angles across him and opens the face to play towards point"
652,"Copeland to Herath, no run he stays in his crease this time and plays towards point"
653,"Copeland to Herath, no run defended on the front foot towards the off side"
654,"Copeland to Herath, no run wider outside off stump from Copeland, Herath strides forward and lets it go"
655,"Copeland to Herath, no run he lets another one pass through to Haddin"
656,"Siddle to Angelo Mathews, no run Siddle gives Mathews a short one, he ducks under it"
657,"Siddle to Angelo Mathews, no run Siddle bangs in another bouncer and it's a good one, Mathews is late to duck and turns his head away, leaving his bat up in the air"
658,"Siddle to Angelo Mathews, no run fuller length outside off, Mathews punches towards cover"
659,"Siddle to Angelo Mathews, no run defended on the front foot towards the bowler"
660,"Siddle to Angelo Mathews, no run driven firmly off the front foot, but Ponting is in the way at short cover"
661,"Siddle to Angelo Mathews, no run short of a length angling into the right-hander, Mathews moves back and tries to turn it on the leg side but gets an edge on the off"
662,"Copeland to NT Paranavitana, no run good length outside off from Copeland, Paranavitana lets it go"
663,"Copeland to NT Paranavitana, FOUR runs short and wide outside off, Paranavitana uses the width and cuts hard, finding the gap at point"
664,"Copeland to NT Paranavitana, no run defended from the crease with a straight bat"
665,"Copeland to NT Paranavitana, no run pushed off the front foot towards the off side"
666,"Copeland to NT Paranavitana, no run good length and straight, defended with bat and pad close together"
667,"Copeland to NT Paranavitana, no run Paranavitana moves forward and plays the ball towards cover"
668,"Johnson to Sangakkara, 1 run short of a length outside off, Sangakkara stays in his crease and punches towards cover point"
669,"Johnson to NT Paranavitana, no run the short ball gets into Paranavitana's ribs, he stands up and fends it down. There's a leg slip in place."
670,"Johnson to NT Paranavitana, no run another short ball but this one is outside off and easy to leave"
671,"Johnson to NT Paranavitana, no run that's a better short ball, I bet Paranavitana could smell that as it fizzed past his face"
672,"Johnson to NT Paranavitana, 2 runs a full ball to follow those short ones and Paranavitana clips it off his pads through square"
673,"Johnson to NT Paranavitana, OUT caught at short cover by Ponting, whose reflexes I covet. The ball was ordinary, full and outside off, there to be driven. Paranavitana went hard at it, and made proper contact, smashing the drive out of the middle. His only fault was that he hit it in the air just above Ponting's head. Up went those han"
674,"Copeland to Herath, no run defended on the front foot towards the off side"
675,"Copeland to Herath, 1 run full ball outside leg stump, Herath nudges it towards fine leg"
676,"Copeland to Angelo Mathews, no run good length and straight, defended on the front foot"
677,"Copeland to Angelo Mathews, no run Mathews defends on the front foot towards the off side, tight line and length on off stump"
678,"Copeland to Angelo Mathews, 1 run pushed behind point with an open face for a single"
679,"Copeland to Herath, 2 runs poor line, on leg stump after pitching outside, Herath glances it off the pad towards fine leg"
680,"Siddle to Angelo Mathews, 1 run full ball on middle and leg, flicked through square to the fielder on the boundary"
681,"Siddle to Herath, no run good length and length on middle and off, Herath defends on the front foot"
682,"Siddle to Herath, no run blocked off the front foot towards the off side"
683,"Siddle to Herath, no run Herath moves back and across to try and leave a superb ball from Siddle, he pulled his bat inside the line of the ball just it time as it whizzed across him"
684,"Siddle to Herath, no run defended from the crease towards the bowler"
685,"Siddle to Herath, no run Herath opens the face and plays the ball along the ground towards gully, where the fielder doesn't try too hard to stop it. Australia want Herath on strike but they don't take the single to third man"
686,"Copeland to Sangakkara, no run defended on the front foot towards the bowler"
687,"Copeland to Sangakkara, no run good length angling across the left-hander, left alone by the batsman"
688,"Copeland to Sangakkara, no run defended on the back foot on the leg side"
689,"Copeland to Sangakkara, no run left alone outside off again"
690,"Copeland to Sangakkara, no run good length just outside of, Sangakkara covers his off stump and shoulders arms"
691,"Copeland to Sangakkara, FOUR runs too full on leg stump, Sangakkara clips it firmly past short midwicket and to the boundary"
692,"Johnson to Mahela Jayawardene, no run defended on the off side"
693,"Johnson to Mahela Jayawardene, 1 run length delivery with width outside off stump, Jayawardene guides it behind point"
694,"Johnson to Sangakkara, no run defended on the front foot towards the off side"
695,"Johnson to Sangakkara, no run short and wide outside off, a hit-me ball, and Sangakkara cuts it hard into the ground towards point"
696,"Johnson to Sangakkara, 2 runs too full on the pads once again, this time the fielder at short midwicket gets a hand on Sangakkara's flick to take some pace off it"
697,"Johnson to Sangakkara, no run short of a length down leg side, the batsman lets it go"
698,"Copeland to Angelo Mathews, no run defended on the front foot towards the off side"
699,"Copeland to Angelo Mathews, no run defended on the leg side from the crease"
700,"Copeland to Angelo Mathews, 1 run Mathews dabs the ball towards cover and runs"
701,"Copeland to Herath, no run good length delivery angling outside off stump, Herath lets it go through to Haddin"
702,"Copeland to Herath, no run Herath steers the ball from the crease towards point"
703,"Copeland to Herath, no run full and straight, Herath plays it back to the bowler"
704,"Siddle to Angelo Mathews, no run good length on off stump, Mathews gets behind the line and defends solidly"
705,"Siddle to Angelo Mathews, no run Siddle swings a full ball into the right-hander and induces a thick inside edge towards short midwicket"
706,"Siddle to Angelo Mathews, 1 run that's in the blockhole and Mathews jams his bat down on it, playing the ball through square leg"
707,"Siddle to Herath, OUT lbw! Tony Hill gives Herath out but the batsman asks for the review. The ball was full from Siddle, it pitched in line with the stumps and crashed into the pad before it hit the bat as Herath tried to play on the leg side after moving across his crease. That's plumb, hitting middle and off. The decision stays. Ma"
708,"Siddle to Welegedara, no run good length and straight, Welegedara plays it back to the bowler"
709,"Siddle to Welegedara, (no ball) good length and dead straight, Welegedara defends from the crease and gives the strike back to Mathews. Or not. Siddle's over-stepped"
710,"Siddle to Welegedara, no run Siddle bowls a yorker which Welegedara manages to play on the off side"
711,"Copeland to Mahela Jayawardene, no run good length and straight, defended on the front foot"
712,"Copeland to Mahela Jayawardene, no run left alone outside off"
713,"Copeland to Mahela Jayawardene, no run Jayawardene lets it go again outside off"
714,"Copeland to Mahela Jayawardene, no run played off the back foot with an open face towards point"
