,Data
497,"McDonald to Morkel, no run swings down the pads and he plays it in the air to square leg"
498,"McDonald to Morkel, no run full on middle and off and he drives to the off side"
499,"McDonald to Morkel, no run holds back the length a touch and he defends it back"
500,"McDonald to Morkel, no run kneels down and drives with too much bottom hand to cover"
501,"McDonald to Morkel, no run full again and he drives the ball into the off side"
502,"McDonald to Morkel, no run much fuller and he can only drive the ball back to McDonald"
503,"Johnson to Boucher, 1 run full on middle and leg and clipped wide of Hauritz at mid-on"
504,"Johnson to Morkel, no run 137.8ks, short and steeping bounce, Morkel weaves"
505,"Johnson to Morkel, no run this pitches on a length and nips back in sharply to cramp Morkel, stuck in his crease and trying to dab it fine, the ball takes an inside edge back onto pad"
506,"Johnson to Morkel, no run swings into leg stump and he does well to defend to midwicket"
507,"Johnson to Morkel, no run on the stumps and he drives towards Ponting"
508,"Johnson to Morkel, no run slides down the pads and an acrobatic dive from Haddin saves four"
509,"McDonald to Boucher, 1 run angled down the pads, Boucher turns it down to square leg"
510,"McDonald to Morkel, no run fuller outside off stump and Morkel pushes the ball to point"
511,"McDonald to Morkel, no run leans into a drive but cannot beat Ponting at cover"
512,"McDonald to Morkel, no run looks to run the ball down to third man but narrowly misses"
513,"McDonald to Morkel, no run fullish outside off stump and Morkel drives to point"
514,"McDonald to Morkel, no run hits that nagging length again and Morkel defends unyieldingly"
515,"Johnson to Boucher, no run very full, Johnson searching for swing, and Boucher resists"
516,"Johnson to Boucher, 1 leg bye pitches outside leg stump and he brushes it off his pads"
517,"Johnson to Morkel, no run short but it stays rather low to beat Morkel's attempted cut"
518,"Johnson to Morkel, no run 146ks, short of a length and he defends off the back foot"
519,"Johnson to Morkel, no run short again and this time he forces it to Hussey at gully"
520,"Johnson to Morkel, no run fuller and straightening, Morkel pushes forward, it rolls it to the on side"
521,"McDonald to Boucher, 3 runs onto the front foot, driving firmly past Morkel and mid-on for three"
522,"McDonald to Morkel, no run full outside off stump and he defends to the off side"
523,"McDonald to Morkel, no run swings down the pads and he shapes to flick but can't connect"
524,"McDonald to Morkel, no run hits a length and he defends it to midwicket"
525,"McDonald to Morkel, no run leans into a full ball and drives to Ponting at short cover"
526,"McDonald to Morkel, no run gets another cover-drive in but just doesn't beat the field"
527,"Hauritz to Boucher, 1 run tossed up down the pads and he deflects it to fine leg"
528,"Hauritz to Morkel, 2 runs well flighted from around the stumps, hits a length and sucks him forward, Morkel drives and gets a thick edge wide of Hayden at slip and moves to a Test best"
529,"Hauritz to Morkel, no run tossed up on the stumps and he defends"
530,"Hauritz to Morkel, 1 run gets room and drives in the air wide of the covers"
531,"Hauritz to Boucher, 2 runs flighted up on middle and leg and he flicks it fine for a couple"
532,"Hauritz to Boucher, no run slows the pace, gets some dip and Boucher jams it back out"
533,"McDonald to Morkel, no run full on middle and off and he pushes back to the bowler"
534,"McDonald to Morkel, no run full on off stump, mistimed drive, mid-on does the fielding"
535,"McDonald to Morkel, 1 run now he tries to swing one away and gets an inside-edge towards the square leg umpire, Katich flings himself to his left and saves runs"
536,"McDonald to Boucher, no run cramped cut, nearly carries down to Hayden at slip"
537,"McDonald to Boucher, 1 run overpitched on the stumps and flicked out to Hauritz at sweeper"
538,"McDonald to Morkel, no run short of a length outside stump and he punches it to cover"
539,"Hauritz to Boucher, no run well flighted, starts to dip and Boucher drives to the off side"
540,"Hauritz to Boucher, FOUR runs overpitched on the stumps and thats a top-class flick past midwicket, where on the ropes Siddle runs across in vain and cannot prevent the ball trickling over"
541,"Hauritz to Boucher, no run tossed up on off stump and he defends it back"
542,"Hauritz to Boucher, 1 run fraction too short and Boucher cuts wide of Clarke at point"
543,"Hauritz to Morkel, no run tossed up outside off and he defends to silly point"
544,"Hauritz to Morkel, no run thats a too wide and no shot offered"
545,"McDonald to Boucher, 1 run 118.8ks, nips back in off the seam but Boucher shuffles across his stumps and works the ball away into the spaces behind square leg"
546,"McDonald to Morkel, no run 125.6ks, fuller length brings him forward to defend"
547,"McDonald to Morkel, no run full on middle and off and he defends with an inside edge"
548,"McDonald to Morkel, no run firmly pitched up and another inside edge as Morkel defends"
549,"McDonald to Morkel, no run pitches wider and angles away and Morkel leaves it be"
550,"McDonald to Morkel, no run seams back in off a length and Morkel defends rigidly"
551,"Siddle to Boucher, no run short of a length just outside off stump and he defends"
552,"Siddle to Boucher, no run stays low off a length, nipping back, but well defended"
553,"Siddle to Boucher, 1 run overpitched on the stumps and he miscues the on-drive to midwicket, scampers off, Johnson runs in from wide mid-on and nails another direct hit to take out middle stump but this time the batsman is home safe"
554,"Siddle to Morkel, no run overpitched and Morke drives handsomely to Johnson"
555,"Siddle to Morkel, no run gets to the pitch and drives another good-looking shot to Johnson"
556,"Siddle to Morkel, no run change of pace, full and wobbling and it beats the off drive"
557,"Hauritz to Boucher, no run tossed up on leg stump and Boucher plays it to midwicket"
558,"Hauritz to Boucher, no run this one's well wide of leg stump and deflected wider"
559,"Hauritz to Boucher, no run comes forward and defends solidly"
560,"Hauritz to Boucher, 1 run drives the wide one to cover, who does the fielding"
561,"Hauritz to Morkel, 1 run tossed up on the stumps and he turns it towards midwicket"
562,"Hauritz to Boucher, no run tossed up and he nudges the ball away"
563,"Siddle to Morkel, no run short of a length on the stumps, 144ks, pushed to cover"
564,"Siddle to Morkel, no run overpitched on off stump and Morkel drives hard to mid-off"
565,"Siddle to Morkel, no run gets to the pitch and mistimes the drive to mid-off again"
566,"Siddle to Morkel, no run 141.7ks, short of a length and he works it to midwicket"
567,"Siddle to Morkel, no run full on leg stump and an inside edge saves Morkel that time"
568,"Siddle to Morkel, no run hits a length and he defends to the off side"
569,"Hauritz to Boucher, no run tossed up wide, no turn, Boucher pushes the ball to cover"
570,"Hauritz to Boucher, no run tossed up straighter and he pushes it back"
571,"Hauritz to Boucher, no run flighted on leg stump and he flicks the ball to midwicket"
572,"Hauritz to Boucher, 1 run more dip on that one and Boucher clips an inside edge to square leg"
573,"Hauritz to Morkel, 1 run reaches out to a wide one and sweeps out to deep square leg"
574,"Hauritz to Boucher, no run comes well forward and drives back past the stumps"
575,"Siddle to Morkel, no run slants back in and hits the wrist, then the thigh pad"
576,"Siddle to Harris, no run full and just wide to encourage the drive and Harris leaves"
577,"Siddle to Harris, no run wobbles back in and he shoulders arms, that was close to off stump"
578,"Siddle to Harris, no run takes his eyes off a short one, 145.7ks, turns out of the way and the ball hits the handle of the bat and rolls to the off side, could have gone anywhere"
579,"Siddle to Harris, 1 run slides down the pads off a short length and he paddles to fine leg"
580,"Hauritz to Harris, no run slowly tossed up, he comes forward and defends it back"
581,"Hauritz to Harris, no run well flighted, hint of turn, Harris pushes loosely to the off side"
582,"Hauritz to Harris, no run comes forward and defends with hard hands, the ball rolls to leg"
583,"Hauritz to Harris, no run tossed up and he defends the ball back"
584,"Hauritz to Harris, no run some turn there, beating him as he pushes down the wrong line"
585,"Hauritz to Harris, 1 run paddles one from off stump and so narrowly gives a diving Katich at short leg a catch, but he can't get fingertips on it as he tumbles to his right"
586,"Siddle to Harris, OUT simple decision, Siddle strikes again with a fullish delivery angling back in to catch Harris hopping about his crease, it stays low and ramrod straight and he's a sitting duck"
587,"Siddle to Steyn, no run short ball, 143.7ks, Steyn turns it in a hurry to midwicket"
588,"Siddle to Steyn, no run pitches full and Steyn drives to the man at cover"
589,"Siddle to Steyn, no run a loose forward prod, no footwork, draws an inside edge to midwicket"
590,"Siddle to Steyn, no run change of pace, pitches back of a length just outside off stump and wobbles off the seam, Steyn backs away and then doesn't offer a shot and the ball stays very low and somehow misses the mark"
591,"Siddle to Steyn, no run back of a length and rather wide and Steyn leaves it be"
592,"Hauritz to Boucher, no run pitches outside leg, Boucher shuffles, ball stays low and he defends"
593,"Hauritz to Boucher, no run lures him forward this time and he defends uneasily"
594,"Hauritz to Boucher, no run gets across and works the ball to the on side"
595,"Hauritz to Boucher, no run flighted up on middle and leg and he turns it to midwicket"
596,"Hauritz to Boucher, no run shuffles and flicks off the back foot, Ponting dives at midwicket"
597,"Hauritz to Boucher, no run tossed up, again he flicks but cannot beat midwicket"
598,"Siddle to Steyn, FOUR runs no footwork as he reaches out and forces a wide one past gully for four"
599,"Siddle to Steyn, 2 runs another leaden-footed square-drive, this one in front of point"
600,"Siddle to Steyn, no run 138.6ks, steeping lifter gets Steyn weaving out of harm's way"
601,"Siddle to Steyn, no run short ball and he lets it pass by confidently"
602,"Siddle to Ntini, no run pitched up outside off stump and Ntini wants nothing doing"
603,"Hauritz to Boucher, no run oh thats a shooter, pitches and rolls along the ground, beats bat and hits Haddin on the boot ... aye, there are plenty of cracks around"
604,"Hauritz to Boucher, no run tossed up and he comes forward and defends"
605,"Hauritz to Boucher, no run short and wide and cut away"
606,"Hauritz to Boucher, 2 runs stays a fraction short and Boucher keeps it out"
607,"Hauritz to Boucher, SIX runs good shot, use of the feet from Boucher and he tees off to deposit that ever so cleanly over long-on for half a dozen"
608,"Hauritz to Boucher, 3 runs makes room and biffs this one over mid-off now, the ball drops safely and trickles towards the ropes and McDonald does the retrieving, Boucher moves to 89"
609,"Siddle to Boucher, no run pitches back of a length and stays low again, and somehow Boucher gets bat on it, inside-edging towards short fine leg but he resists the single to expose Ntini"
610,"Siddle to Boucher, no run short of a length and he goes for the pull, inside-edging onto thigh"
611,"Siddle to Boucher, no run gets a wee bit of room and he cuts a cramped shot to gully"
612,"Siddle to Boucher, no run well bowled, a late inswinging yorker and he does superbly to dig it out"
613,"Siddle to Boucher, OUT the sound of timber! Siddle gets five at the SCG, his first such effort at this level, once more succeeding with the full and fast delivery, Boucher clips across the line and middle stumps is flattened"
614,""" target=""_blank"">Cricinfo Daily."
615,"If you're the sort who likes cricket news to be delivered to you, check out the"
616,"Siddle is mobbed by his team-mates. He raises the ball to the crowd and leads his team off. A great spell from him and he will cherish this moment. Australia have bowled kept South Africa to 327, thereby securing a lead of 118. Boucher played well f"
617,Innings Start
618,Siddle comes around the stumps
