,Data
452,"Hazlewood to Miller, no run fuller on the stumps, Miller pushes it back and sets off, Hazlewood stops with is left hand, switches the ball to right and throws it back, the ball hits Miller on the way who dives in"
453,"Hazlewood to Miller, 1 run fuller this time and it's whipped on the leg side for one"
454,"Starc to Miller, 1 run short of length outside off, sliced off the back foot on the off side"
455,"Starc to Behardien, 1 run fullish and well outside off, driven through the covers for one"
456,"Starc to Miller, OUT inswinging yorker does it, the finger goes up! Miller was struck on the crease as the yorker dipped and swung in, hit him on the front shoe in front of leg stump, was it going down leg? The umpire says it's out and Miller has a few words with the huddle that'"
457,"Starc to Philander, no run angled in from round the wicket, he defends it back"
458,"Starc to Philander, no run length delivery angled in towards the stumps, pushes it back again"
459,"Starc to Philander, 1 run wider outside the off stump, steered to deep point for one"
460,"Hazlewood to Philander, no run cuts it in from outside off, Philander defends it back"
461,"Hazlewood to Philander, 1 wide bangs in the bouncer outside off and it's too short, called a wide"
462,"Hazlewood to Philander, no run back of length outside off, pushes it on off and gets an inside edge onto his pads"
463,"Hazlewood to Philander, no run on length outside the off stump, pushes it down to mid off"
464,"Hazlewood to Philander, no run fuller on the stumps, tucked straight to midwicket"
465,"Hazlewood to Philander, no run full on the stumps, defends it back to the bowler"
466,"Hazlewood to Philander, no run shorter outside off, pulled to midwicket and not a single run off the bat in this over"
467,"Starc to Behardien, FOUR runs that's beautifully driven in the air and over the covers for four! It was pretty wide and he stretched out for the ball to drive it firmly"
468,"Starc to Behardien, no run angled in this time and defends it back to Starc"
469,"Starc to Behardien, 1 run low full toss well outside off, thick edge rolls down to third man for one"
470,"Starc to Philander, no run makes some room and drives the full delivery down to mid off"
471,"Starc to Philander, no run bangs i the bouncer towards the leg side, not given a wide"
472,"Hazlewood to Behardien, 1 run hops back in the crease for the incoming delivery and pushes it to mid on for one"
473,"Hazlewood to Steyn, no run slightly full and wide, Steyn swings his arms to drive it to mid off"
474,"Hazlewood to Steyn, no run makes room to pull the short ball but sways out of the line"
475,"Hazlewood to Steyn, FOUR runs makes room again for the short delivery and slaps it down the ground over mid on for four"
476,"Hazlewood to Steyn, SIX runs another one, no that goes all the way! Made room on the leg side, it was a straight delivery and he smacked it down the ground for a clean six"
477,"Hazlewood to Steyn, 2 runs full on the pads, driven down wide of long on in the gap for two. There's a direct hit at the bowler's end, it's gone to the third umpire and he's home easily"
478,"Starc to Behardien, 1 leg bye shuffles across to the off side to scoop the ball behind square on leg and gets an inside edge on the pads. Umpire says it's a leg bye"
479,"Starc to Morkel, no run inswinging yorker towards middle and leg, the bat comes down just in time to block and the ball misses the stumps by a whisker!"
480,"Starc to Morkel, no run outside the off stump on length, Morkel swings and misses"
481,"Starc to Morkel, no run fuller and wider, pushed to point off the front foot"
482,"Starc to Morkel, no run inswinging low full toss just outside off, steered to deep cover for one"
483,"Hazlewood to Behardien, FOUR runs slogged on the leg side for four! It was fullish on the leg side and Behardien smacked it wide of deep midwicket for four"
484,"Hazlewood to Behardien, no run short ball outside off, he waits for it for the ramp shot but misses"
485,"10pm Looks like Imran Tahir is not coming out to bat, he has an injury, and Australia have won by 73 runs, series lead 2-1. Their bowlers started very well, both Hazlewood and Starc. Amla was fighting for South Africa with a hundred, they had a chance till de Villiers was there, but Aus"
486,Australia won by 73 runs
487,"Player of the match is Steven Smith, AUS"
