,Data
205,"Coulter-Nile to Khalid Latif, no run back of a length and rushes on at 139ks, shapes to pull again. He can only skewer it in front of point"
206,"Zampa to Afridi, SIX runs Massive, massive six! Looped up on middle, Afridi likes it. He dances out and sends it soaring straight down the ground"
207,"Zampa to Afridi, OUT Six and out, sums up Afridi! He ventures down the track again. The legspinner retorts. He darts it flatter and wider outside off. Turns away with bounce. Afridi can't reach and connect. Nevill does the rest. Is that Afridi's final inni"
208,"Zampa to Malik, 1 run short on off, slapped to long-on"
209,"Zampa to Khalid Latif, 1 run down the track, adjusts, and guides it to point"
210,"Zampa to Malik, 1 run chopped from off stump to point"
211,"Zampa to Khalid Latif, 1 run Latif steps out and yorks himself. This is dug out to cover"
212,"Hazlewood to Khalid Latif, 2 runs low full toss outside off, which is squeezed to deep cover"
213,"Hazlewood to Khalid Latif, FOUR runs full and wide outside off, Latif reaches out and carves it in the air. Up and over cover"
214,"Hazlewood to Khalid Latif, 1 run length ball on off, Latif is deep in the crease, as he drags to deep midwicket. Off the inside half"
215,"Hazlewood to Malik, 2 runs short and on top of middle and off, Malik smartly late-cuts to third man"
216,"Hazlewood to Malik, 1 run off-stump yorker, top ball, dug out to long-on"
217,"Hazlewood to Khalid Latif, 1 run back of a length on off, slogged off the back foot to deep midwicket. Din't look pretty"
218,"Zampa to Khalid Latif, 1 run Latif dances out, gets a full toss, and shovels it in front of Warner at long-on"
219,"Zampa to Malik, SIX runs Malik smokes it over long-off. He flies down the track to this flighted delivery and launches it down the ground"
220,"Zampa to Malik, 1 run Malik steps out, yorks himself, and jabs to long-on"
221,"Zampa to Khalid Latif, no run Latif comes down the track, this full toss is smeared to cover"
222,"Zampa to Khalid Latif, 1 run down the track again, Zampa drags his length back and fires it. Check pushed to the off side"
223,"Zampa to Malik, 1 run Malik uses his feet again, this is speared at just under 100ks, played back to the bowler"
224,"Watson to Malik, 1 run yorker on off, Malik hangs back and belts it to long-off"
225,"Watson to Khalid Latif, 1 run overpitched on off, slammed to long-on"
226,"Watson to Malik, 2 runs yorker aimed at the base of middle, squeezed to midwicket. They hare across for two"
227,"Watson to Malik, FOUR runs banged in short and outside off, hooks and top-edges it over vacant slips. Watto has a wry smile"
228,"Watson to Malik, 1 run pretty full on off, slogged to long-on"
229,"Watson to Khalid Latif, 1 run yorker on middle and off, clipped out to deep midwicket"
230,"Faulkner to Khalid Latif, 1 run back of the hand slower ball on the hips, pulled to Finch who is manning the square leg boundary"
231,"Faulkner to Malik, 1 run another slower one from the back of the hand, sliced to short third man from a fourth-stump line"
232,"Faulkner to Imad Wasim, OUT The back-of-the-hand slower ball does the damage again. Back of a length and turning away outside off, Imad Wasim throws his bat at it and skews it in the air. NCN runs across from cover and pouches it"
233,"Faulkner to Malik, 2 runs short and on the hips, pulled away to deep square leg for two"
234,"Faulkner to Malik, 1 run Malik uses his feet, Faulkner slips in another of those slower balls. This is wide outside off. The batsman reaches out and cuts to sweeper cover"
235,"Coulter-Nile to Malik, 1 run short and outside off, flat batted to long-off"
236,"Coulter-Nile to Sarfaraz, 1 run full toss following the batsman, who was backing away. Hacked to cover"
237,"Coulter-Nile to Malik, 1 run too full and outside off, Malik lofts it in the air... Smith sprints from long-off, plunges forward, but the ball drops just in front of him"
238,"Coulter-Nile to Sarfaraz, 1 run"
239,"Coulter-Nile to Malik, SIX runs full length on middle, misses the yorker. Lifted straight down the ground for six"
240,"Coulter-Nile to Malik, FOUR runs off-stump full toss, which is sliced away to the deep point boundary"
241,"Faulkner to Sarfaraz, OUT Faulkner gets his fourth! Sarfraz attempts a reverse sweep against a back of the hand slower ball. He can only spoon a catch to backward point (or square leg if you'd like?"
242,"Faulkner to Wahab Riaz, OUT Make that a five-for, the first in this tournament! Afridi can't watch this in the dug out. He has his head down with his eyes closed. Wahab swings and sends a top edge to short third man"
243,"Faulkner to Malik, 1 run picked away off the hips behind square on the leg side"
244,"Faulkner to Sami, FOUR runs length and outside off, Sami clouts it over cow corner. Warner hurtles to his right from long-on, slides, but the ball eludes his reach"
245,"Faulkner to Sami, 1 run short on the hips, deflected to the leg side"
246,"Faulkner to Malik, 2 runs Look at Warner's commitment. He sprints to his right again from long-on. He dives full length and parries the ball to the man running to his left from deep midwicket. Length ball as Malik steps out and bashes it. Pakistan are out"
247,"Sharjeel hurtled off the blocks quickly, Latif and Malik made contrasting forties. But Zampa and Faulkner handed the knockout blow. Pakistan were never really in control of the asking rate throughout the chase of 194. There was no Afridi miracle. They ultimately"
248,Australia won by 21 runs
249,"Player of the match is James Faulkner, AUS"
