,Data
404,"Aponso to Bailey, 1 run fuller outside off, there's the reverse sweep towards short third man who gets a hand but can't stop the single"
405,"Aponso to Warner, 2 runs short and flat, Warner goes back to open up and slaps it towards wide long-on"
406,"Aponso to Warner, no run this one turned a bit after the flight, Warner doesn't connect"
407,"Aponso to Warner, 1 run much fuller around off, this one's driven down to long-on now"
408,"Lakmal to Warner, FOUR runs too full and wide, and Warner slams it back by going down on a knee! Straight as a bullet and over the bowler's head for four as mid-off is in"
409,"Lakmal to Warner, 1 run outside the leg stump on length, jabbed towards midwicket for one"
410,"Lakmal to Bailey, 1 run middles the drive to sweeper cover for a single"
411,"Lakmal to Warner, 1 run short of length outide off, Warner punches that off the back foot now"
412,"Lakmal to Bailey, no run bangs in the bouncer at 136kmh, Bailey gets out of the way"
413,"Lakmal to Bailey, no run on length and angling in around off, he pushes it to point and the fielder almost flies to his right to stop that"
414,"Aponso to Warner, 2 runs reverse sweep again from Warner to sweep that away against the turn to third man, almost beating the fielder"
415,"Aponso to Warner, 1 run bunts that fuller delivery down to long-on now"
416,"Aponso to Bailey, 2 runs short and turning away, Bailey goes back and cuts to sweeper cover"
417,"Aponso to Bailey, no run much fuller now and it's reverse swept straight to short third man"
418,"Aponso to Bailey, no run full outside off, driven hard and straight to cover"
419,"Aponso to Bailey, FOUR runs the third reverse sweep of the over and this one finds the gap, wide of short third man, to go for four!"
420,"Lakmal to Warner, FOUR runs short delivery, it's the slower offcutter and Warner spots it early to slap it to the leg side, to the wide long on boundary for four!"
421,"Lakmal to Warner, no run on the off stump, steered to point where a dive saves at least one"
422,"Lakmal to Warner, no run fullish on off stump, pushed into the covers"
423,"Lakmal to Warner, no run right in the block hole, he digs it out and back to Lakmal"
424,"Lakmal to Warner, 3 runs that's gone high in the air, he pulled a not-so-short delivery a bit too high towards wide long-on and in the gap. Pathirana in the chase and did well to slide and keep it in"
425,"Lakmal to Bailey, no run a bit of late swing for the yorker, Bailey blocks it back"
426,"Pathirana to Warner, no run fullish towards middle, Warner goes back to block it"
427,"Pathirana to Warner, no run nicely bowled around off stump, Warner gives it respect and blocks again"
428,"Pathirana to Warner, 1 run much wider outside off and it's nudged to point for a quick single"
429,"Pathirana to Bailey, 1 run slow and angling in towards middle stump, he stays back and punches the ball down to long-on"
430,"Pathirana to Warner, no run shuffles down the track to negate the turn and blocks"
431,"Pathirana to Warner, 1 run slower on middle, he goes back to let it turn and slaps it behind square"
432,"Perera to Warner, FOUR runs it's almost as if the length did not matter to him, and sometimes it doesn't! Bit of flight outisde off, Warner went down on a knee with a forward stretch and slapt-swept that to the wide long-on boundary"
433,"Perera to Warner, 2 runs cuts off the back foot now to deep point and quickly comes back for two"
434,"Perera to Warner, 1 run much slower and it's steered easily to deep point"
435,"Perera to Bailey, 1 run well outside off and Bailey has no troubles in reverse-sweeping that to deep point"
436,"Perera to Warner, 1 run short and turning away from outside off, he goes back and slams it into the covers"
437,"Perera to Bailey, 1 run a gentle reverse sweep now towards short third man for one"
438,"Pathirana to Bailey, no run tossed up outside off, he reaches out to push it on off"
439,"Pathirana to Bailey, no run more towards middle and leg now, he blocks with a forward lean"
440,"Pathirana to Bailey, no run shuffles down this time and doesn't middle the drive he was looking for to leg"
441,"Pathirana to Bailey, no run sharp turn beats Bailey as he goes back to defend but the ball turns away after pitching, beating the outside edge"
442,"Pathirana to Bailey, 1 run middles this one to sweeper cover easily for a single"
443,"Pathirana to Warner, no run turns it into Warner, he goes deep in the crease and pushes the ball into the covers"
444,"Perera to Bailey, 1 run pitched up and Bailey on-drives it down to long on"
445,"Perera to Warner, no run angling in from around the wicket, pushed into the covers"
446,"Perera to Warner, 1 run gets room this time and cuts that fiercely to sweeper cover"
447,"Perera to Bailey, OUT a strong appeal, the finger goes up and the crowd has been shaken alive. But hang on, Bailey has reviewed it! It was pretty full around leg, Bailey swept and missed and took it low on his front pad. Looks like there's no edge, all depends on where the ball pitched. Here comes ball-tracking - it has pitched in line, hit in line and 'umpire's call' for hitting the stumps. So umpire Palliyaguruge's decision stays"
448,"Perera to Head, no run overpitched outside off, mis-timed badly to cover"
449,"Perera to Head, 1 run flight outside off, a hint of turn, driven away towards cover"
450,"Pathirana to Head, no run flight outside off, driven back to the bowler"
451,"Pathirana to Head, 1 run uses his feet, gets to the pitch and clips to midwicket. Warner set off late, but no issues"
452,"Pathirana to Warner, 1 run short and slow on leg, Warner backs away but the bowler follows him, pulled to backward square leg"
453,"Pathirana to Head, 1 run turned towards that same fielder, easily played with the spin"
454,"Pathirana to Warner, no run flatter on leg, Warner misses his flick, struck on the pads."
455,"Pathirana to Warner, 1 run too short, too straight. Warner ticks over to 98 with a neat whip to deep square leg"
456,"Dhananjaya to Warner, 1 run tossed up outside off, overpitched. Driven to long-off"
457,"Dhananjaya to Head, no run the slider on middle, short. Head goes back and drives to mid-on."
458,"Dhananjaya to Head, 1 run flatter on middle, 90 kph. Punched to mid-off from the back foot"
459,"Dhananjaya to Warner, no run tossed up outside off, nice loop. Driven to cover"
460,"Dhananjaya to Warner, no run shortish and wide outside off, slapped to cover. Another dot"
461,"Dhananjaya to Warner, 1 run there is Warner's seventh ODI ton, the first by an Australian in Sri Lanka. Off comes the helmet, and a muted acknowledgement of the applause. Played, cap'n. Just worked a leg side delivery towards square leg to get there. Made sure he didn't let go of a strong start"
462,"Pathirana to Warner, 2 byes ripping turn. Warner is standing on leg, Pathirana pitches this on middle, Warner is beaten as he tries to cut, the ball goes through"
463,"Pathirana to Warner, 1 run nudged to backward square leg"
464,"Pathirana to Head, no run flight on middle, driven back"
465,"Pathirana to Head, 1 run Head doing it nicely, nudging it around. Straighter line and worked to fine leg"
466,"Pathirana to Warner, 1 run width, short and wide. Warner makes it look worse than it is with his merciless slap to deep point"
467,"Pathirana to Head, no run keeps low, flat outside off at 86 kph. The ball sneaks underneath"
468,"Dhananjaya to Warner, 1 run shortish and wide outside off, smashed down to long-off"
469,"Dhananjaya to Head, no run 86 kph, full on off, defended"
470,"Dhananjaya to Head, FOUR runs hammered for four. head gets down and drills the drive past his captain's head. With mid-off and mid-on in, the ball makes the boundary easily"
471,"Dhananjaya to Head, no run tossed up on off, pushed back"
472,"Dhananjaya to Head, 1 run flat on off, a thick outside edge towards third man for one"
473,"Dhananjaya to Warner, no run a long-hop on middle and off, pummelled but straight to midwicket"
474,"Pathirana to Head, no run 83 kph, flight outside off, full toss. Smashed to mid-off"
475,"Pathirana to Head, no run another short delivery on middle, shovelled to midwicket"
476,"Pathirana to Head, no run keeps low, straight. Jammed out late"
477,"Pathirana to Head, 2 runs two more. Through leg slip. Slow through the air on middle, worked to the left of leg slip. Bounced in front of him"
478,"Pathirana to Head, 1 run short and flat, Head goes back and punches to long-on"
479,"Pathirana to Warner, no run flat and straight, solidly blocked"
480,"Dhananjaya to Faulkner, 1 run whipped away to deep midwicket"
481,"Dhananjaya to Warner, no run tossed up on off, no turn. Driven back"
482,"Dhananjaya to Warner, 1 run too much flight, a half-volley outside off. Hammered to deep cover"
483,"Dhananjaya to Faulkner, 1 run nudged to midwicket for another"
484,"Dhananjaya to Warner, no run nice delivery. Flat on middle, Warner is solidly behind the line, no intentions in throwing this away"
485,"Pathirana to Faulkner, no run tossed up on off, kept out"
486,"Pathirana to Faulkner, 1 wide flat delivery that strays down leg, wide called"
487,"Pathirana to Faulkner, 2 runs short and wide outside off, Faulkner rocks back and slaps it in front of cover for a couple. Long-off gets around"
488,"Pathirana to Faulkner, 1 run flat outside off, drilled to long-off"
489,"Pathirana to Warner, 1 run flat again on off, 88 kph. Scythed to cover, one more"
490,"Pathirana to Faulkner, no run tossed up on off, solidly kept out"
491,"Pathirana to Faulkner, no run 83 ks, darted in from wide of the crease. Smeared to midwicket"
492,"Dhananjaya to Warner, no run flight outside off, driven to cover with the spin"
493,"Dhananjaya to Warner, no run flight outside off, carved to point. Warner wants one, Faulkner doesn't"
494,"Dhananjaya to Warner, 1 run too straight, clipped to deep square leg"
495,"Dhananjaya to Faulkner, 1 run driven to long-on"
496,"Dhananjaya to Warner, no run another quick, fired in delivery on off. Warner goes back and pats to point. Loud call of no"
497,"Aponso to Faulkner, no run tossed up outside off, Faulkner lunges forward to defend, gets a thick inside edge"
498,"Aponso to Faulkner, no run flat delivery on middle, hit back"
499,"Aponso to Faulkner, no run worked away into the leg side, nice straight line"
500,"Aponso to Faulkner, no run terrible ball but he gets away with it as Faulkner goes back and pulls the long hop to midwicket"
501,"Aponso to Faulkner, 1 run flat on middle, driven to long-on"
502,"Aponso to Hastings, no run flight on middle, blocked back"
503,"Dhananjaya to Faulkner, 1 run too straight, Faulkner goes back and works it towards square leg for one"
504,"Dhananjaya to Hastings, no run loads of flight on leg, Hastings is happy to defend. hit on the pad"
505,"Dhananjaya to Hastings, FOUR runs smashed down the ground for four to get level with Sri Lanka's score. overpitched on middle with plenty of air, Hastings hammers it to the long-on boundary"
506,"Dhananjaya to Hastings, no run carved to point"
507,"Dhananjaya to Hastings, no run flight on middle and leg, kept out"
508,"Dhananjaya to Hastings, FOUR runs flicked away to the square leg boundary as Australia complete a 4-1 series win, with seven overs to spare. Handshakes all around."
509,Presentation time.
510,"9.10pm Clinical chase from Australia to finish out the series positively, led by captain David Warner who returned to form with a superb century, his seventh in ODIs, and the first by an Australian in Sri Lanka in this format. Dilruwan injected some excitement into the match with two early wickets, but Bailey and Warner first stabilised the innings, before getting into their own. A comfortable chase in the end as Australia close out the seri"
511,"9.30pm Wide grins on the Australia players' faces, and with that we'll sign off from the ODI series. Thanks for your feedback, time and opinions. The T20s aren't far away. See you then."
512,Australia won by 5 wickets (with 42 balls remaining)
513,"Player of the match is David Warner, AUS"
