,Data
0,"119.2;1;Ashwin to Clarke, 1 run whips a tossed up delivery down to long on;"
1,"Yadav to Ponting, no run starts off with one angled down the leg side, off the thigh pad to Saha"
2,"Yadav to Ponting, 1 run moves forward and onto 199 with a single to deep point off a fuller and straighter one"
3,"Yadav to Clarke, OUT bowled 'em, India have a wicket at last, Clarke gone right after lunch, Umesh bends it in with the angle, it moves in after pitching on a length, past Clarke"
4,"Yadav to Hussey, no run lets the length ball angle across him outside off"
5,"Yadav to Hussey, no run pats a pitched up ball away on the off side"
6,"Yadav to Hussey, no run tight line close to the off stump, good bounce as well, Hussey leaves"
7,"Ashwin to Ponting, no run almost carried to leg slip, was that off the bat"
8,"Ashwin to Ponting, no run pats a tossed up ball down the track"
9,"Ashwin to Ponting, no run nudges one on leg stump towards square leg"
10,"Ashwin to Ponting, no run nudged towards one of the numerous men around square leg"
11,"Ashwin to Ponting, no run floated across full, smothered off the front foot"
12,"Ashwin to Ponting, no run plays out a quiet over, defends off the front foot"
13,"Yadav to Hussey, no run defended off the back foot"
14,"Yadav to Hussey, 1 run angled delivery driven off the front foot and Hussey is off the mark after mid off parries the ball away with a clumsy slide"
15,"Yadav to Ponting, FOUR runs smack! Ponting gets to his 6th Test double ton with a pull off the front foot in front of square leg to a short ball, lots of applause all around, Pon"
16,"Yadav to Ponting, no run defended down the track"
17,"Yadav to Ponting, 1 run flicked off the pads, straight out of the late 90s Ponting, to deep square leg"
18,"Yadav to Hussey, no run has him ducking to a bouncer"
19,"Ashwin to Ponting, 1 run turns miles down leg from short of a length, helped away past leg slip"
20,"Ashwin to Hussey, no run pushes forward and smothers this flighted one"
21,"Ashwin to Hussey, no run angled in on off from wide of the crease, defended"
22,"Ashwin to Hussey, no run goes back and blocks a length ball"
23,"Ashwin to Hussey, no run sees some width and drives this one to extra cover"
24,"Ashwin to Hussey, no run pushed off the back foot to extra cover again"
25,"Yadav to Ponting, no run pitched up ball pushed down the track"
26,"Yadav to Ponting, no run back and across and solidly blocks a shortish one"
27,"Yadav to Ponting, no run angles the bouncer in as Ponting ducks"
28,"Yadav to Ponting, no run pushes a shortish one on the off side"
29,"Yadav to Ponting, no run slower one but too far outside off to bother Ponting"
30,"Yadav to Ponting, no run goes underneath another bouncer, too short to make the batsman do anything else"
31,"Ashwin to Hussey, no run defends one coming in with the angle from around the stumps"
32,"Ashwin to Hussey, 1 run skips down the track and takes on mid on for a quick run, Ashwin trods on to his bat as he backs up for the throw, Hussey loses his balance after making t"
33,"Ashwin to Ponting, no run nudged towards square leg, harmless line on leg stump"
34,"Ashwin to Ponting, no run full on middle now, defended off the front foot"
35,"Ashwin to Ponting, 1 run guided towards deep point for one"
36,"Ashwin to Hussey, no run tapped towards midwicket off the front foot"
37,"Yadav to Ponting, no run some inswing for Umesh as he hurls it in full towards middle, pushed towards a diving midwicket"
38,"Yadav to Ponting, no run moves forward to a length ball and pushes towards the bowler"
39,"Yadav to Ponting, no run solid punch to extra cover off the back foot"
40,"Yadav to Ponting, no run thinks about the pull for an instant but decides the ball is way too short for that shot and lets it go"
41,"Yadav to Ponting, no run moves across and pushes back to the bowler"
42,"Yadav to Ponting, 1 run another pull from Ponting, as this time the short ball is in his slot, there is deep midwicket in place"
43,"Ashwin to Ponting, no run tossed up full on middle and leg, defended solidly"
44,"Ashwin to Ponting, 2 runs doesn't quite get hold of the pull as he sees it dropped too short, ends up playing it in the air over midwicket"
45,"Ashwin to Ponting, no run patted down the track off the back foot"
46,"Ashwin to Ponting, no run Ponting tries the reverse paddle from outside leg stump, underedges it on to the boot"
47,"Ashwin to Ponting, 1 run shortish again, outside leg and helped down to deep backward square leg"
48,"Ashwin to Hussey, no run some spin, zip and bounce from off stump, Hussey adjusts, opens the face and defends"
49,"Yadav to Ponting, no run he is getting some inswing into the right-hander, comes in from a length, pushed off the front foot"
50,"Yadav to Ponting, no run slightly shorter, forced down to mid on"
51,"Yadav to Ponting, 2 runs stands back and punches through the off side to sweeper cover"
52,"Yadav to Ponting, no run checks the punch off the back foot, the ball rolls towards extra cover"
53,"Yadav to Ponting, no run inswinging yorker headed for middle and leg, Ponting jabs it away"
54,"Yadav to Ponting, 1 run follows up with the short ball, Ponting is ready for it as he smashes the pull to deep midwicket"
55,"Ashwin to Ponting, 2 leg byes loops off the pad over leg gully as he misses the pull off a short one"
56,"Ashwin to Ponting, 1 run works a shortish one past a clumsy dive from midwicket"
57,"Ashwin to Hussey, no run quicker and flatter from around the stumps, pushed away"
58,"Ashwin to Hussey, no run drives to extra cover off the front foot"
59,"Ashwin to Hussey, no run skips down the track and pushes to extra cover"
60,"Ashwin to Hussey, 1 run coming in with the angle, he goes back and across and works towards midwicket"
61,"Khan to Hussey, no run hits him on the pad right away with a full delivery and appeals but Hussey was a mile down the track, he had walked outside his crease looking for the clip"
62,"Khan to Hussey, 3 runs watchfully watches this pitched up ball and squeezes it past point for a couple"
63,"Khan to Ponting, no run comes forward and pushes with an open face to covers"
64,"Khan to Ponting, no run slightly wider outside off and he takes a step out to let it go"
65,"Khan to Ponting, 1 run drops it short and Ponting plays a crunching pull, swivelling on a leg as he goes through the shot, to Sachin at deep midwicket"
66,"Khan to Hussey, no run a rare sight today, a batsman is beaten, Hussey tentatively pushing forward as this length ball zips past the outside edge"
67,"Ashwin to Ponting, 1 run Ponting is dropped again, takeable high catch at midwicket as Ponting steps out and clips in the air, Laxman hops and parries it back in the air"
68,"Ashwin to Hussey, no run cut to point"
69,"Ashwin to Hussey, 2 runs worked through midwicket"
70,"Ashwin to Hussey, 1 run down the track and works it down to long on"
71,"Ashwin to Ponting, 1 run pushed down to long on"
72,"Ashwin to Hussey, FOUR runs 500 is up with a flowing drive through extra cover, Ishant ends up chasing it into the boundary"
73,"Khan to Ponting, 1 run nicely forward to meet a pitched up ball angling across him, and gets the single to the right of mid off"
74,"Khan to Hussey, FOUR runs thick edge as Hussey pokes at a pitched up delivery outside off, between slip and gully"
75,"Khan to Hussey, 1 run slower one holding its line just outside off, pushed towards cover"
76,"Khan to Ponting, 1 run Ponting slips as he completes the run after working one square off the pads, and they won't get the second"
77,"Khan to Hussey, 2 wide way too short, called a wide for height, Saha saves the byes with a big leap to get one glove to the ball, he's been good behind the stumps"
78,"Khan to Ponting, no run driven towards mid off"
79,"Khan to Ponting, no run moves across and works a length ball towards midwicket"
80,"Ashwin to Hussey, 1 run length ball coming in, whipped square on the leg side"
81,"Ashwin to Ponting, 1 run belts a high full toss outside leg, just past the man at square leg"
82,"Ashwin to Hussey, 2 runs down the track and pushes past the bowler and mid on for a couple"
83,"Ashwin to Hussey, no run forced off the back foot on the leg side"
84,"Ashwin to Hussey, FOUR runs smack! Ashwin gives it lots of air outside off, Hussey gets to the pitch neatly and slams it past extra cover"
85,"Ashwin to Hussey, OUT brilliant work from Gautam at silly point means Hussey has to go back, Hussey had pushed the flatter one firmly past silly point on the bounce, but he stret"
86,"Khan to Ponting, no run left alone with the angle a foot outside off"
87,"Khan to Ponting, no run moves across and pushes to mid on"
88,"Khan to Ponting, 1 run trying to bend it back in but sends it on to the pad and is flicked to fine leg"
89,"Khan to Haddin, no run leaves alone one angled across him on a length"
90,"Khan to Haddin, no run takes a step across and allows another one to zip past him outside off"
91,"Khan to Haddin, no run goes for the yorker, ends up as a low dipping full toss, patted away to mid on"
92,"Ashwin to Ponting, no run clips a tossed up ball on leg to midwicket"
93,"Ashwin to Ponting, 3 byes these will be the first byes he has conceded, in the 136th over, tossed up outside leg and turning about three to four feet down leg, no chance for Sah"
94,"Ashwin to Haddin, no run nudged with the turn on the leg side"
95,"Ashwin to Haddin, no run pushed away from the crease on the off side"
96,"Ashwin to Haddin, SIX runs Haddin gets off the mark with six, tossed up full in the slot and he swings it cleanly over mid on"
97,"Ashwin to Haddin, no run carrom ball beats Haddin on the front foot push as it turns away, Ashwin appeals for caught behind in vain"
98,"Khan to Ponting, OUT the man lives and dies by the pull, taken by Tendulkar at deep midwicket, Zaheer pings it in short, Ponting does not hold back on the pull, gives it a good t"
99,"Khan to Siddle, no run bouncer first up to siddle, who ducks under it"
100,"Khan to Siddle, no run length ball defended off the front foot"
101,"Khan to Siddle, no run angles it in towards off stump, Siddle eagerly gets forward to block"
102,"Khan to Siddle, no run carefully gets across and pats away a shortish one"
103,"Khan to Siddle, no run play and a miss as he looks to cut a wide one"
104,"Ashwin to Haddin, no run gets across and pushes a length ball back to the bowler"
105,"Ashwin to Haddin, 1 run pushes a flighted one for an easy single to long on"
106,"Ashwin to Siddle, no run covers off stump and defends a turning length ball"
107,"Ashwin to Siddle, no run quicker one angled in, he gets forward and pushes to point"
108,"Ashwin to Siddle, no run worked away in the air but falls short of short midwicket"
109,"Ashwin to Siddle, no run fuller delivery smothered down the track"
110,"Khan to Haddin, no run walks outside off and tries to pull a short ball angled in, misses as the ball goes over leg"
111,"Khan to Haddin, no run tentatively pushes off the inside edge on the leg side, Zaheer stares"
112,"Khan to Haddin, no run he is shuffling way across, exposes middle and leg stump as he flicks to midwicket"
113,"Khan to Haddin, no run now he goes for the pull to a short ball angled in, and is beaten again"
114,"Khan to Haddin, no run moves across, covers the line of the good length ball and blocks"
115,"Khan to Haddin, no run appeal for lbw as Haddin is rapped high on the pad after again moving too far across, misses the work on the leg side, looked headed down leg that one"
116,"Ashwin to Siddle, no run pushes a tossed up ball to short midwicket off the inner part of the bat"
117,"Ashwin to Siddle, no run beaten by the carrom ball, he plays well inside the line as it leaves him just outside off"
118,"Ashwin to Siddle, 2 runs gets a thick edge as he charges out looking to go over extra cover, finds some runs behind point"
119,"Ashwin to Siddle, no run defended off the front foot"
120,"Ashwin to Siddle, no run tossed up ball driven to a diving extra cover"
121,"Ashwin to Siddle, OUT Ashwin strikes with the carrom ball, thin edge through to Saha as Siddle pushes forward"
122,"Khan to Haddin, FOUR runs Haddin has been struggling against Zaheer, this time he gets to a pitched up delivery and opens the face to drive through cover for four"
123,"Khan to Haddin, no run almost holes out to mid on as he looks to tee off out of the ground, just falls short, barely"
124,"Khan to Haddin, no run lets a bouncer fly past high outside off"
125,"Khan to Haddin, 1 run clipped off the pad to deep square leg"
126,"Khan to Harris, no run bit of pad and bat as he pushes forward to smother this one outside off"
127,"Khan to Harris, no run lets this length delivery outside off go"
128,"Ashwin to Haddin, no run worked to a not-so-short short leg"
129,"Ashwin to Haddin, no run worked again to that man at shortish leg"
130,"Ashwin to Haddin, 2 runs inside edge behind square leg for a couple"
131,"Ashwin to Haddin, no run blocks a full delivery on middle and leg"
132,"Ashwin to Haddin, no run"
133,"Ashwin to Haddin, no run"
134,"Khan to Harris, no run"
135,"Khan to Harris, 1 run works with the angle from around the stumps past midwicket"
136,"Khan to Haddin, no run short ball that ends up being banged way down the leg side"
137,"Khan to Haddin, no run mistimes the attempted big stroke down the ground to mid off"
138,"Khan to Haddin, no run lets a slower short ball carry on with the angle past off"
139,"Khan to Haddin, 1 run short ball pulled hard down to deep square leg"
140,"Ashwin to Haddin, 3 runs opens the face and runs it towards third man, work for Sachin running across from deep point"
141,"Ashwin to Harris, no run pushes a length ball outside off towards covers"
142,"Ashwin to Harris, FOUR runs shot! tossed up too full and Harris reaches out and strokes it past extra cover"
143,"Ashwin to Harris, no run pushed away to midwicket"
144,"Ashwin to Harris, no run moves outside off and defends a length ball"
145,"Ashwin to Harris, no run fires it in flatter, Harris defends without fuss"
146,"Sharma to Haddin, no run starts off with a very wide delivery outside off, moves further away, he tries to reach out and cut but cannot get to it"
147,"Sharma to Haddin, no run pushed away to cover"
148,"Sharma to Haddin, no run lets this back of a length ball go outside off"
149,"Sharma to Haddin, 1 run inside edge to fine leg takes Australia to 550, Ishant finding slight inward movement"
150,"Sharma to Harris, 4 runs thick edge runs past slip off a pitched up ball, Laxman goes after it and pulls it back but they have run four"
151,"Sharma to Harris, no run wayward bouncer miles outside off"
152,"Ashwin to Haddin, 1 run tries to slog-sweep but mistimes the stroke to deep midwicket"
153,"Ashwin to Harris, no run defended down the track"
154,"Ashwin to Harris, FOUR runs he floats it up too full again, and Harris puts it away through cover this time"
155,"Ashwin to Harris, 3 runs opens the face and runs the flighted ball towards third man, Dravid goes after it this time"
156,"Ashwin to Haddin, no run pushed down the track"
157,"Ashwin to Haddin, no run smothered off the front foot, bit of turn for ashwin"
158,"Sharma to Harris, no run excellent take from Saha, this short ball was flying to his left but he went leaping to take it one-handed"
159,"Sharma to Harris, 1 run pushed away from the crease to deep point"
160,"Sharma to Haddin, no run moves well across to one that comes in a tad and defends"
161,"Sharma to Haddin, no run this one holds its line on a length outside off, pushed away"
162,"Sharma to Haddin, no run slower one but too far outside off to get anything more than a leave"
163,"Sharma to Haddin, no run nips back in from a good length, left alone"
164,"Ashwin to Harris, no run pushed off the front foot"
165,"Ashwin to Harris, no run tosses it up slowly, blocked"
166,"Ashwin to Harris, no run punched off the back foot to extra cover"
167,"Ashwin to Harris, 1 run angled in towards the pads, worked square for one"
168,"Ashwin to Haddin, no run carrom ball on a good length on middle, defended tightly"
169,"Ashwin to Haddin, no run pads away a tossed up ball outside off stump"
170,"Sharma to Harris, 1 leg bye worked in front of square leg off the pad"
171,"Sharma to Haddin, no run too far down the leg side with the angle, good bounce though"
172,"Sharma to Haddin, 3 runs thick edge runs towards third man as Ishant gets one to hold its line outside off"
173,"Sharma to Harris, no run came in from a good length, played back to the bowler with an angled bat"
174,"Sharma to Harris, 1 run full, into the pads, whipped to deep square leg"
175,"Sharma to Haddin, no run straight and very wide outside off stump"
176,"Ashwin to Harris, no run pitching outside leg, padded away"
177,"Ashwin to Harris, no run on middle from short of a length, defended off the back foot"
178,"Ashwin to Harris, no run blocked off the back foot easily"
179,"Ashwin to Harris, no run hit on the pad as he pushes well forward"
180,"Ashwin to Harris, no run short carrom ball, pushed away on the off side"
181,"Ashwin to Harris, no run defended safely off the front foot and that will be tea"
182,"Yadav to Haddin, no run goes for the yorker first up, not quite full enough, patted away on the leg side"
183,"Yadav to Haddin, 1 run swings a pitched up delivery hard, to deep midwicket"
184,"Yadav to Harris, 1 run pushes a back of a length ball to sweeper cover"
185,"Yadav to Haddin, no run moving in a shade in the air, pushed back solidly to the bowler"
186,"Yadav to Haddin, no run looks to pull one going down leg, misses"
187,"Yadav to Haddin, no run shuffles across and gets an inside edge off pad towards point"
188,"Ashwin to Harris, no run goes for the cut to a flat delivery and is beaten"
189,"Ashwin to Harris, no run defended tightly bat and pad together"
190,"Ashwin to Harris, 1 run slogged in the air from outside off down to deep square leg, on the bounce"
191,"Ashwin to Haddin, no run tries to mow one from leg stump over midwicket, it pops up on the leg side"
192,"Ashwin to Haddin, no run quicker one defended off the front foot"
193,"Ashwin to Haddin, SIX runs this time he succeeds, gets a full delivery angled in on leg, and launches it over midwicket"
194,"Sehwag to Clarke, no run Clarke steps out and drives to the fielder at cover"
195,"Sehwag to Clarke, no run defended on the back foot towards the leg side"
196,"Sehwag to Clarke, 1 run Clarke stays in his crease and closes the face to play the ball from round the wicket towards square"
197,"Sehwag to Ponting, no run defended on the on side"
198,"Sehwag to Ponting, no run Ponting moves forward and blocks towards midwicket"
199,"Sehwag to Ponting, no run driven on the front foot towards mid-off"
200,"Yadav to Clarke, no run splendid effort from Kohli, dives to his left at cover to stop a blistering drive from Clarke with one hand"
201,"Yadav to Clarke, 1 run that's short and wide outside off stump, Clarke stands tall and cuts the ball through point, Tendulkar is on the boundary"
202,"Yadav to Ponting, 1 run short of a length on middle and leg, Ponting pulls towards deep backward square where Ishant fumbles, tumbles and then hobbles after throwing the ball back"
203,"Yadav to Clarke, FOUR runs that's a long hop and Clarke slaps it off the front foot over midwicket for four more, terrible length on a flat pitch"
204,"Yadav to Clarke, FOUR runs Clarke's got to his century as well, off goes the helmet and he kisses the crest. A wonderful, momentum-wresting innings from the captain. He got to his"
205,"Yadav to Clarke, 4 leg byes Yadav has produced a vicious delivery out of nowhere. He banged it in short at impressive speed and Clarke did not get out of the way, it clipped him"
206,"Yadav to Harris, no run clipped off the pads to midwicket"
207,"Yadav to Harris, no run length ball rolls off the pad on the leg side"
208,"Yadav to Harris, no run opens the face and guides this one to the right of gully, who does well to stop it"
209,"Yadav to Harris, no run cannot connect with one going down the leg side"
210,"Yadav to Harris, 1 run eased off the front foot past extra cover"
211,"Yadav to Haddin, 1 run short, wide, slapped away to deep point"
212,"Ashwin to Haddin, no run worked past short leg"
213,"Ashwin to Haddin, 1 run tries to go for the slog-sweep but mistimes it along the ground to deep square leg"
214,"Ashwin to Harris, no run fired in on a length on the pads, rolls away to short leg"
215,"Ashwin to Harris, no run down the track and pushed back to the bowler"
216,"Ashwin to Harris, 1 run Ashwin fails to pick up the ball cleanly to his left and concedes a single"
217,"Ashwin to Haddin, 1 run opens up and works this one past midwicket"
218,"Yadav to Haddin, no run shortish one forced from the crease on the off side"
219,"Yadav to Haddin, 1 run pushed to extra cover for one"
220,"Yadav to Harris, 1 run pacy short ball pulled awkwardly down to fine leg"
221,"Yadav to Haddin, 2 runs clipped off the pad behind square leg and they take Tendulkar's throw on and complete the second"
222,"Yadav to Haddin, 2 runs pushed out to deep point for an easy single, and Yadav cannot collect the throw cleanly to give one more run"
223,"Yadav to Haddin, no run pushed away on the off side"
224,"Ashwin to Harris, 1 run pushed down to long on for one"
225,"Ashwin to Haddin, no run quicker one patted away on the off side"
226,"Ashwin to Haddin, 1 run slower through the air, pushed towards point"
227,"Ashwin to Harris, 2 runs full delivery clipped through midwicket for two more"
228,"Ashwin to Harris, no run tries to slog-sweep but misses and is hit on the pad down leg"
229,"Ashwin to Harris, 1 run flat and quick ball worked through midwicket"
230,"Yadav to Harris, 1 run high full toss pushed wide of mid on"
231,"Yadav to Haddin, 3 runs well done, guides a back of a length ball between slip and gully"
232,"Yadav to Harris, no run backs away and has a big swing, misses the ball just outside off"
233,"Yadav to Harris, no run pushed hard down the track and right into the bowler's boot"
234,"Yadav to Harris, SIX runs Australia get to 600 with a six, Harris pulls over deep square leg and the ball just sails over the rope past Ishant"
235,"Yadav to Harris, no run pushed away off the front foot to mid off"
236,"That is the declaration then. India have 21 overs to negotiate. Ponting and Clarke racking up double tons, Ashwin falling short of his by six"
237,"Lyon to Kohli, no run presses well forward in defence"
238,"Lyon to Kohli, 1 run turns in from outside off and is worked away through square leg"
239,"Lyon to Laxman, no run comes forward and drives towards extra cover"
240,"Lyon to Laxman, 1 run moves across as he sees the line closer to off and works behind square on the leg side"
241,"Lyon to Kohli, no run turns in from just outside off, defended to short leg"
242,"Lyon to Kohli, 1 run worked towards square leg from the crease"
243,"Harris to Kohli, no run bounces from short of a length but too far outside off"
244,"Harris to Kohli, no run reaches out to a low full toss and pats it away to short extra cover"
245,"Harris to Kohli, no run beaten on the drive as Harris pitches it up full"
246,"Harris to Kohli, no run gets across and pats away a near-yorker outside off"
247,"Harris to Kohli, no run leans forward and pushes to extra cover"
248,"Harris to Kohli, no run left alone outside off"
249,"Lyon to Laxman, 2 runs slightly short and cut away through point"
250,"Lyon to Laxman, no run pushes forward in defence to a tossed up ball"
251,"Lyon to Laxman, no run pushed to silly point off the front foot"
252,"Lyon to Laxman, no run superb bowling, making him reach forward to a tossed up ball outside off, gets the inside edge past short leg as it spins in"
253,"Lyon to Laxman, no run nudged to short leg"
254,"Lyon to Laxman, no run digs back a very full delivery"
255,"Hussey to Kohli, 2 runs starts off with a wide and full one that is driven wide of sweeper cover"
256,"Hussey to Kohli, no run gets the line closer to off, pushed back to the bowler"
257,"Hussey to Kohli, no run pushes off the front foot to short extra cover"
258,"Hussey to Kohli, no run fine stop by Ponting at short extra cover, Virat had slapped the full delivery very hard but Ponting got his left hand out immediately to stop it"
259,"Hussey to Kohli, no run bit of a leading edge as he looks to push on the leg side"
260,"Hussey to Kohli, no run pushed towards midwicket"
261,"Lyon to Laxman, OUT Nathan Lyon has deserved this wicket, Laxman looks to dab one spinning in outside off and edges it through to Haddin, extremely ordinary shot"
262,"Lyon to Saha, no run appeal for lbw but he was struck outside the line of off as he pushed forward"
263,"Lyon to Saha, no run nudged off the front foot to short leg"
264,"Lyon to Saha, no run"
265,"Lyon to Saha, no run low full toss smacked in to Ponting at silly point"
266,"Lyon to Saha, no run consistently outside off stump, defended off the front foot"
267,"Hussey to Kohli, 1 run squeezes a full delivery on the off side for one"
268,"Hussey to Saha, no run some away movement but far outside off"
269,"Hussey to Saha, no run pushed towards backward point off the front foot"
270,"Hussey to Saha, no run full ball driven hard to cover"
271,"Hussey to Saha, no run wide outside off and left alone"
272,"Hussey to Saha, no run driven to cover again"
273,"Lyon to Kohli, no run some bounce from outside off stump, pushed on the leg side"
274,"Lyon to Kohli, no run slapped off the back foot to extra cover"
275,"Lyon to Kohli, no run back and across and defends to silly point"
276,"Lyon to Kohli, no run whip-driven right into Ponting at silly point"
277,"Lyon to Kohli, no run goes on the back foot and plays with the turn to mid on"
278,"Lyon to Kohli, 1 run quicker one pushed past extra cover"
279,"Hussey to Kohli, 1 run whipped to deep square from the crease"
