,Data
225,"Starc to de Kock, 3 runs width on the off side and WDK caresses it along the ground through covers. They ran two easily and there was a mix up for the third, but they reached eventually"
226,"Starc to Amla, no run length delivery outside the off stump, driven to cover point"
227,"Starc to Amla, 1 run cuts it uppishly form outside off, the ball flies away to third man after a couple of bounces"
228,"Hazlewood to Amla, no run stays a bit low as it swings away from length outside off and goes under Amla's bat as he pushed at it"
229,"Hazlewood to Amla, FOUR runs too wide this time, was short too and Amla punched it off the back foot through the point region for a cracking four"
230,"Hazlewood to Amla, no run length delivery on off stump this time, Amla defends it back"
231,"Hazlewood to Amla, no run fuller on the off stump, no room at all and Amla pushes it back again"
232,"Hazlewood to Amla, FOUR runs bit too wide again and Amla is not going to let it go, drives it beautifully through the covers this time for four"
233,"Hazlewood to Amla, no run fullish close to off stump, pushed on the off side"
234,"Starc to de Kock, no run brings it in towards off stump, QDK defends it back"
235,"Starc to de Kock, no run 145kph, straight delivery on the stumps, QDK defends to short midwicket"
236,"Starc to de Kock, FOUR runs too short and QDK pulls it late to send it fine down the leg side for four. Fine leg in the circle and QDK does well to beat him"
237,"Starc to de Kock, (no ball) fullish outside off and it's pushed into the covers. No ball for overstepping"
238,"Starc to de Kock, no run 147.3kph, right in the block hole, the stumps have gone all over as QDK made room to slog. Starc smiles and goes back to his run up"
239,"Starc to de Kock, no run angled in towards middle and leg, tucked to the leg side"
240,"Hazlewood to Amla, FOUR runs full and angled into the pads, Amla absolutely middles that and sends it crashing on the leg side with a flick for four"
241,"Hazlewood to Amla, 2 runs short this time, Amla pulls and it goes over midwicket for two runs, could have been three"
242,"Hazlewood to Amla, no run on length outside off, Amla swings and misses as the ball nipped in after pitching"
243,"Hazlewood to Amla, no run back of length outside off, Amla goes back to defend it on off"
244,"Hazlewood to Amla, no run fuller outside off, punched off the back foot to point"
245,"Hazlewood to Amla, no run 141kph, brings in the back of length delivery and Amla defends again"
246,"Starc to de Kock, no run length delivery outside off, slices it to cover point"
247,"Starc to de Kock, no run on length on the off stump, QDK defends it back to the bowler"
248,"Starc to de Kock, no run 145.3kph, full and swinging in from outside off, blocked back to the bowler"
249,"Starc to de Kock, no run full on the stumps this time, pushed down gently towards mid on"
250,"Starc to de Kock, 1 run further towards the leg side, flicked to deep midwicket off the pads"
251,"Starc to Amla, FOUR runs too full on the pads and that's flicked in the air for four to the midwicket boundary"
252,"Hazlewood to de Kock, no run angled across outside off, QDK leans forward and blocks it"
253,"Hazlewood to de Kock, no run touch fuller outside off, pushed down to mid off"
254,"Hazlewood to de Kock, no run 139.6kph, outside off with the angle again, driven into the covers"
255,"Hazlewood to de Kock, no run bangs in the short ball with cross seam, QDK looked to pull initially but it bounced too much and beat him by pace"
256,"Hazlewood to de Kock, 1 run on length around off with the angle, tucked to midwicket and there's an unnecessary overthrow to give them one"
257,"Hazlewood to Amla, FOUR runs too full on the pads, that's a poor delivery and Amla flicks it again with his wrists for four. This time to the fine leg boundary"
258,"Watson to de Kock, 1 run 124kph, length delivery outside off chopped to third man for one"
259,"Watson to Amla, 1 run back of length just outside off, worked off the back foot with the wrists to the leg side"
260,"Watson to de Kock, 2 runs 120.5kph, towards the off stump, QDK has enough time to go back and whip it on the leg side for two"
261,"Watson to de Kock, 1 run fuller outside off, pushed down softly towards mid off for one"
262,"Watson to Amla, no run back of length outside the off stump, dabs it to point off the back foot"
263,"Watson to Amla, no run appeal for lbw as the ball came in from outside off but it hit him pretty high in front of the stumps"
264,"Kane Richardson to de Kock, 2 runs back of length and coming in, worked on the leg side off the back foot in the gap"
265,"Kane Richardson to de Kock, no run fuller on the stumps, drives it down to mid on"
266,"Kane Richardson to de Kock, 2 runs goes shorter again, QDK stays back and works it past midwicket for two more"
267,"Kane Richardson to de Kock, FOUR runs he's been bowling too short, this time QDK waits for it and flicked it from around off to the fine leg boundary for four"
268,"Kane Richardson to de Kock, 1 run touch wider of off, similar length and QDK works it to deep square leg again"
269,"Kane Richardson to Amla, 1 run shortish outside off, Amla taps it off the back foot wide of point for one"
270,"Watson to Amla, 1 run on length towards off and middle, flicked to deep midwicket for an easy one"
271,"Watson to de Kock, 1 run just over short cover! It was angled across a bit from off, QDK wants to work it to leg but played it early and a leading edge went over short cover for one"
272,"Watson to Amla, no run outside off and it's pushed down to mid off"
273,"Watson to Amla, no run short ball, it's pulled and falls well short of short fine leg"
274,"Watson to Amla, FOUR runs he gets room and punches it off the back foot through the off side for four! Stayed on the back foot and caressed it between point and cover point"
275,"Watson to Amla, 1 run short of length outside off, dabbed towards point"
276,"Kane Richardson to Amla, no run back of length outside the off stump, he defends it off the back foot"
277,"Kane Richardson to Amla, no run 138.7kph, touch fuller outside off, pushed into the covers"
278,"Kane Richardson to Amla, 2 runs length delivery coming in from outside off, he drives and a thick inside edge goes to deep midwicket for two"
279,"Kane Richardson to Amla, no run back to back of length, square-drives it late to point"
280,"Kane Richardson to Amla, FOUR runs width on offer and Amla drives it beautifully through the covers. It was not a powerful drive, but he timed it so well it went all the way for four"
281,"Kane Richardson to Amla, no run edged and doesn't carry! Outside off, Amla pushes but it keeps low and takes a bottom edge"
282,"Doherty to de Kock, no run fullish on off stump, worked with the turn to midwicket"
283,"Doherty to de Kock, no run touch shorter and it's pushed to the leg side again"
284,"Doherty to de Kock, no run outside off and it's reverse swept to backward point"
285,"Doherty to de Kock, 1 run shorter delivery outside off, chopped off the back foot to sweeper cover"
286,"Doherty to Amla, 1 run flighted on middle, driven down to long off for one"
287,"Doherty to de Kock, 1 run full and flighted on the off stump, driven down to long on"
288,"Kane Richardson to de Kock, no run slightly short and angled across, pulled to midwicket"
289,"Kane Richardson to de Kock, FOUR runs charges down this time and smacks it in the air on the leg side by taking it on the full. Four runs as there's nobody in the deep"
290,"Kane Richardson to de Kock, 1 run on the pads now and flicked to deep backward square leg for one"
291,"Kane Richardson to Amla, no run short of length outside off, punched off the back foot to cover"
292,"Kane Richardson to Amla, 1 run fuller outside the off stump and it's driven through the covers for one"
293,"Kane Richardson to de Kock, SIX runs too short and QDK picks the short boundary at fine leg for six! Short outside the leg stump, QDK rocked back and smacked it high over fine leg"
294,"Doherty to Amla, no run touch short outside off, chopped to point"
295,"Doherty to Amla, 1 run full on the pads, eased to deep midwicket for one"
296,"Doherty to de Kock, 1 run on length outside off and turning in, QDK leans forward and works it to leg with the spin"
297,"Doherty to Amla, FOUR runs shorter and flatter outside off, enough room and time for Amla to cut it past point for four! Great timing to beat the off side fielders"
298,"Doherty to Amla, 1 run fuller on the stumps, pushed down to long on for one"
299,"Doherty to de Kock, no run turns it in nicely from well outside off, QDK goes on the back foot and cuts it towards point"
300,"Marsh to Amla, no run full on the stumps, driven down to mid on"
301,"Marsh to Amla, 1 run full on the pads, clipped in the air to deep midwicket with the wrists"
302,"Marsh to de Kock, no run full outside the off stump, pushed down to mid off"
303,"Marsh to de Kock, 1 run makes room by going to the leg side and swishes at the ball to clear cover, but he got a hand to it"
304,"Marsh to Amla, no run swings and misses! Didn't move his feet much for the widish delivery outside off, he chased and didn't connect"
305,"Marsh to Amla, 1 run short ball outside off, pulled with some power to deep midwicket for one"
306,"Doherty to Amla, 1 run flighted on the off stump, drives it down to long off"
307,"Doherty to de Kock, 1 run takes a step down and works the ball to long on"
308,"Doherty to Amla, no run loopy and full on middle again, pushed to short cover this time"
309,"Doherty to Amla, 1 run bit of flight outside off, Amla frees his arms with a drive to sweeper cover and that's his fifty"
310,"Doherty to de Kock, no run flighted and full well outside off, tries the reverse sweep and is hit on the back foot"
311,"Doherty to de Kock, FOUR runs the orthodox sweep is much better and he gets for four that. Went down on a knee and played it with the spin to beat a running fine leg fielder in the deep"
312,"Marsh to Amla, 2 leg byes short ball angled in towards Amla, pulls it off the back foot to fine leg"
313,"Marsh to Amla, 1 run full toss on the pads, clipped to deep midwicket for one"
314,"Marsh to de Kock, 1 run full on the stumps, taps it close to the pitch on off for a quick single"
315,"Marsh to Amla, no run drives it outside off without much footwork and the inside edge rolls down to leg"
316,"Marsh to Amla, no run slower and fuller at 119.2kph, he taps it to point"
317,"Marsh to Amla, 1 run angled in towards the batsman, worked to deep midwicket for one"
318,"Doherty to Amla, 1 run comes down the track and pushes the ball to long on, and that's SA's 100"
319,"Doherty to de Kock, 1 run turning in from outside off, takes a step down to work it to leg and a fumble at midwicket from Smith concedes a single"
320,"Doherty to Amla, no run straight on middle, Amla defends it back"
321,"Doherty to Amla, 1 run touch shorter outside off, whipped off the back foot to leg"
322,"Doherty to de Kock, no run flatter and quicker outside off, he gets an inside edge while trying to cut it"
323,"Doherty to de Kock, no run comes down and takes it on the full to drive it to cover"
324,"Watson to Amla, 1 run angled into the pads, clipped to deep midwicket for one"
325,"Watson to de Kock, 1 run slower at 125kph outside off, taps it towards short cover point for one"
326,"Watson to Amla, 1 run 127.3kph, eased to deep midwicket with the angle for one"
327,"Watson to de Kock, 1 run 113kph, slower and lower from the leg side, QDK pulls it to the leg side"
328,"Watson to Amla, 1 run 118kph, angled towards the stump, worked to the leg side for one more"
329,"Watson to de Kock, no run 130kph, fuller on the off stump, pushed back uppishly to the bowler. Time for some drinks"
330,"Hazlewood to Amla, 1 run length delivery outside the off stump, tapped towards third man for one"
331,"Hazlewood to de Kock, OUT doesn't connect the pull well and a leading edge goes high, caught around short third man! QDK pulled the short delivery from leg but got a top edge which went very high and Marsh had to run back from backward point for the catch"
332,"Hazlewood to Amla, no run cutting in from outside off, Amla blocks it back"
333,"Hazlewood to Amla, no run shorter outside off, dabs it late to point"
334,"Hazlewood to Amla, no run on length wider outside off, punched off the back foot to point"
335,"Hazlewood to Amla, 1 run goes back and works it on the leg side for one"
336,"Watson to Amla, 1 run angled in from off, worked off the pads behind square on the leg side"
337,"Watson to du Plessis, 1 run back of length outside off, square driven to deep point for one"
338,"Watson to Amla, 1 run waits in the crease and flicks the ball to deep square leg for one"
339,"Watson to du Plessis, no run on length now outside off, Faf defends it on the off side"
340,"Watson to du Plessis, 1 run slower at 120.5kph and full on the stumps, driven to mid on for one"
341,"Watson to Amla, 1 run 112.6kph, fullish and wide, driven away from the body to sweeper cover"
342,"Doherty to Amla, 1 run fullish outside off, driven down to long off for one"
343,"Doherty to du Plessis, no run angled in towards middle and leg, worked to midwicket"
344,"Doherty to du Plessis, 1 run takes a step down and flicks the delivery on leg"
345,"Doherty to Amla, no run flatter on the stumps, pushes it back to the bowler"
346,"Doherty to Amla, 1 run slower on length around off stump, punched off the back foot to sweeper cover"
347,"Doherty to du Plessis, no run bit shorter outside off, pushed to cover"
348,"Marsh to Amla, 1 run back of length outside off, steered off the back foot to deep backward point"
349,"Marsh to du Plessis, FOUR runs takes a step down, Marsh tries a yorker but it's a low full toss on the pads and he flicks it away behind square on the leg side for four"
350,"Marsh to du Plessis, no run 130koh, that keeps low after pitching on length outside off as Faf tried to slice it"
351,"Marsh to du Plessis, 1 run 117.6kph, cuts in the slower ball from around off, clipped to the leg side for one"
352,"Marsh to Amla, no run slow offcutter again, Amla defends it off the back foot"
353,"Marsh to Amla, no run firm drive off the low full toss on off, Marsh gets a hand to it and saves a few"
354,"Doherty to du Plessis, FOUR runs comes down the track, takes it on the full and whips it from middle stump to find the gap between deep midwicket and long on for four"
355,"Doherty to du Plessis, no run fuller on the stumps, pushes it back to Doherty"
356,"Doherty to du Plessis, 1 run shorter on the stumps, worked off the back foot to leg"
357,"Doherty to Amla, no run comes down and pushes the length delivery to cover"
358,"Doherty to Amla, 2 runs shorter and much wider, punched off the back foot and Finch runs to his left fro sweeper cover to cut it to two"
359,"Doherty to Amla, 1 run back in the crease and works the ball to leg for one"
360,"Kane Richardson to Amla, no run fullish outside off, driven straight to short cover"
361,"Kane Richardson to Amla, 1 run cuts it in a bit from outside off, pushed down to mid off for a quick single"
362,"Kane Richardson to du Plessis, 1 run short delivery just outside off, pulled to deep midwicket for one"
363,"Kane Richardson to Amla, no run too full and outside off, driven firmly, but straight to short cover"
364,"Kane Richardson to Amla, 1 run touch wider outside off, driven nicely along the ground to sweeper cover for one"
365,"Kane Richardson to du Plessis, 1 run shorter and outside off, pushed down to long off for one"
366,"Marsh to du Plessis, no run keeps low after pitching on short of length, pushed to cover"
367,"Marsh to du Plessis, 1 run angled into the batsman, worked to fine leg off the pads for one"
368,"Marsh to Amla, no run fullish outside off, Amla drives it off the front foot to mid off"
369,"Marsh to Amla, 1 run much shorter towards off stump, pulled to square leg for one"
370,"Marsh to du Plessis, 1 run tries to work the ball to leg off the back foot and gets an inside edge onto the front thigh pad for one"
371,"Marsh to Amla, 1 run touch fuller and it's steered to the leg side for one more"
372,"Kane Richardson to Amla, no run short of length outside off, taps it to backward point"
373,"Kane Richardson to Amla, no run stifled appeal as Amla is struck towards the leg side but it's going down"
374,"Kane Richardson to Amla, 1 run shorter outside off, slices it off the back foot to deep backward point for one"
375,"Kane Richardson to du Plessis, 1 leg bye another lbw appeal, the umpire says no again! It came in sharply from outside off, Faf went back and on his toes and the ball was mising leg for sure"
376,"Kane Richardson to Amla, 1 run short ball outside off, runs it down to third man for an easy single"
377,"Kane Richardson to du Plessis, no run he looks to pull the ball from off, but misses"
378,"Marsh to Amla, no run shortish outside off, pushed off the back foot to cover"
379,"Marsh to Amla, 1 run fuller on the stumps, it's flicked to deep square leg for one"
380,"Marsh to du Plessis, no run keeps a bit low, it was well wide outside off and Faf pushes it to cover point"
381,"Marsh to Amla, 1 wide full and down leg past the batsman for a wide"
382,"Marsh to Amla, no run length delivery on middle stump, steered to midwicket"
383,"Marsh to Amla, 1 run full toss on the pads, flicked to deep backward square for one. No time for the second"
384,"Starc to Amla, 1 run angled in towards the stumps, flicked to leg for one"
385,"Starc to Rossouw, no run full outside off, pushed down to mid on"
386,"Starc to Rossouw, no run hint of inswing as the ball comes in, he defends it back"
387,"Starc to Rossouw, no run fullish outside the off stump, pushed into the covers"
388,"Starc to Rossouw, 2 runs inside edge off the drive goes past the stumps to fine leg"
389,"Hazlewood to Amla, no run cuts it in from back of length outside off, Amla defends it on off"
390,"Hazlewood to Amla, 1 run much fuller and wider outside off, driven firmly through the covers for one"
391,"Hazlewood to de Villiers, no run stifled appeal first ball as the ball comes in shsrply from just outside off but it struck him outside leg and was going down further"
392,"Hazlewood to de Villiers, 2 runs well outside off now and that's swished to sweeper cover to get off the mark"
393,"Hazlewood to de Villiers, no run back of length outside off, chops it late to short cover"
394,"Hazlewood to de Villiers, 1 run angled in this time towards middle and leg, pushed down the ground on the leg side"
395,"Starc to de Villiers, no run comes down the track and swings his arms to drive it to cover"
396,"Starc to de Villiers, FOUR runs he charges down again, mid off is in, and he clears the fielder with a powerful hit down the ground for four"
397,"Starc to de Villiers, no run shuffles across and drives the length delivery to cover"
398,"Starc to de Villiers, 1 run shorter outside the off stump, pushed off the back foot to off for one"
399,"Starc to Amla, 1 run angled in and it's worked off the pads towards midwicket"
400,"Starc to de Villiers, no run length delivery outside off, AB can't clear cover"
401,"Watson to Amla, FOUR runs slow and well outside off, Amla has enough time to drive it beautifully through the covers for four"
402,"Watson to Amla, 2 runs goes on the back foot and works it towards deep backward square leg for two"
403,"Watson to Amla, no run outside off and it's punched to cover"
404,"Watson to Amla, no run 116kph, slow and straight on the stumps, he defends it back"
405,"Watson to Amla, 3 runs chips it down the ground, doesn't middle it but he connects well to clear mid on and Doherty slides near the boundary to save a run"
406,"Watson to de Villiers, no run length delivery is straight on the stumps and he defends it back"
407,"Marsh to Amla, no run shapes it in from outside off towards the stumps, Amla defends it back"
408,"Marsh to Amla, no run falls short of mid off! Amla drove it down the ground, but it was a slower one. Starc came in but it was out of his reach"
409,"Marsh to Amla, 2 runs bit too full outside off, driven firmly through the covers and Warner runs fro sweeper cover to slide and save it"
410,"Marsh to Amla, 2 runs fullish towards leg now and it's lofted to the wide long on boundary in the gap for two more"
411,"Marsh to Amla, 1 run touch short of length around off, worked off the back foot to fine leg for one"
412,"Marsh to de Villiers, 1 run AB moves across to sweep the pace bowler, misses, and is struck outside off as the bowler appeals. There was an inside edge too"
413,"Watson to de Villiers, FOUR runs 113kph, slower and pretty full outside off, AB drives it in the air through the covers for four!"
414,"Watson to de Villiers, 1 run charges down and smacks the delivery to long off"
415,"Watson to Amla, 1 run full outside off, driven down towards mid off for one"
416,"Watson to de Villiers, no run angles it in towards middle and leg, clipped to midwicket"
417,"Watson to de Villiers, FOUR runs shuffles across and whips it away to the wide long on boundary for four! It was on back of length, he went back in the crease and used his wrists to turn it to leg"
418,"Watson to de Villiers, SIX runs that's a six to end the over! He went down on a knee and swept the delivery to the fine leg region for six! Time for drinks"
419,"Kane Richardson to Amla, 1 run back of length outside off, taps it to backward point"
420,"Kane Richardson to de Villiers, no run short of length outside off, pushed down the ground to mid on"
421,"Kane Richardson to de Villiers, no run goes back and across a bit and pushes the ball down to mid on"
422,"Kane Richardson to de Villiers, 1 run comes down this time and drives it down to long on for one"
423,"Kane Richardson to Amla, 1 run back of length and cutting in towards the stumps, inside edge gets him a single"
424,"Kane Richardson to de Villiers, 1 run shorter and coming in, pulled to square leg for one"
425,"Marsh to de Villiers, 1 run makes room for the short delivery and slaps it down the ground to long off"
426,"Marsh to Amla, 1 run length delivery outside off, Amla doesn't move much and swishes it to deep cover"
427,"Marsh to de Villiers, FOUR runs full and outside off, AB goes for a full swing of his arms and gets a leading edge over point and gets four. Nobody in the deep there"
428,"Marsh to de Villiers, FOUR runs shuffles across this time, goes down on a knee for the shorter delivery and paddles it fine down the leg side for another four!"
429,"Marsh to de Villiers, FOUR runs three in a row! Drives the length delivery outside off and he guides the ball uppishly between shortf third man and backward point for four"
430,"Marsh to de Villiers, 2 runs straighter delivery and whips it this time wide of fine leg for two in the gap"
431,"Kane Richardson to Amla, 1 run outside off, Amla slices it to short third man and if Hazlewood got a direct hit at the keeper's end, AB might have been in danger, very close!"
432,"Kane Richardson to de Villiers, 2 runs angled into AB who clips it in the gap towards fine leg for an easy two"
433,"Kane Richardson to de Villiers, 1 run charges down the track, Richardson pitches it short and AB slaps it to deep midwicket"
434,"Kane Richardson to Amla, 1 run full outside off, Amla smacks it down to mid off for another quick single. Starc tried a run out at bowler's end but Amla made it"
435,"Kane Richardson to de Villiers, 2 runs full toss on the pads, steered to the leg side for two more"
436,"Kane Richardson to de Villiers, 1 run whips the full ball with the wrists wide of deep midwicket but Smith runs quickly and gets there to keep it to one"
437,"Hazlewood to de Villiers, 2 runs short ball around off, slapped powerfully to deep midwicket again and they come back for the second quickly"
438,"Hazlewood to de Villiers, no run full and wide, he makes room and drives it to cover point at the edge of the circle"
439,"Hazlewood to de Villiers, 1 run stays back for the back of length ball and pulls it to the leg side. 50 for AB off just 32 deliveries"
440,"Hazlewood to Amla, no run swing and a miss! Amla drove well outside off without any footwork and just missed the outside edge!"
441,"Hazlewood to Amla, 1 run short ball and that's pulled to deep midwicket. That's his hundred, he takes the helmet off, acknowledges the crowd and gets a hug from AB"
442,"Hazlewood to de Villiers, 2 runs dropped, but it was a very tough chance! AB pulled the ball again, it was dipping on mid on where Marsh came in to catch but it was very low on his right side"
443,"Kane Richardson to Amla, 1 run back of length outside the off stump, tapped to backward point for one"
444,"Kane Richardson to de Villiers, OUT that's a loud appeal for lbw, umpire says it's out and AB reviews it! Bowden says there's nothing on Hot Spot, it's hitting him in line and is hitting the stumps too, AB has to go. AB had moved across a long way to the off side to slog the deli"
445,"Kane Richardson to Behardien, no run back of length outside off, pushed off the back foot to cover"
446,"Kane Richardson to Behardien, 1 run angled in this time towards leg, clipped to backward square leg for one"
447,"Kane Richardson to Amla, no run outside the off stump on length, steered to backward point"
448,"Kane Richardson to Amla, 1 run slogs it on the leg side in the air with the angle and it falls well short of deep midwicket"
449,"Hazlewood to Miller, no run beaten first ball! Short of length outside off with the angle, Miller is struck to his crease and pokes, and misses"
450,"Hazlewood to Miller, 1 run pitched up on the pads now, clipped away to leg for one"
451,"Hazlewood to Behardien, 1 leg bye angled in towards the pads, tucked to backward square leg for one"
