,Data
544,"Harris to Sharma, no run sharp thick edge flies to Ponting on the bounce at second slip, and the former captain's palms are hurt with the take"
545,"Hilfenhaus to Kohli, FOUR runs he's pulled well, and does so again, lines up the short delivery, he is half-forward when he plays that shot, the ball disappears through midwicket"
546,"Hilfenhaus to Kohli, no run defends a slower one down the track"
547,"Hilfenhaus to Kohli, no run checks the push to covers"
548,"Hilfenhaus to Kohli, 1 run takes the single to widish mid on"
549,"Hilfenhaus to Sharma, (no ball) Ishant fends at another short ball, dies on its way to point off the bat handle"
550,"Hilfenhaus to Sharma, FOUR runs gets some more runs, short and widish ball, he cuts it hard in the air over gully"
551,"Hilfenhaus to Sharma, OUT the slower one gets Ishant, superb delivery, pitches on a length around off and foxes Ishant as he looks to defend, off stump is rattled"
552,"Harris to Kohli, no run slams a pitched up delivery and it almost carries to deep mid off"
553,"Harris to Kohli, no run carries down leg with the angle"
554,"Harris to Kohli, FOUR runs smack! he's throwing his bat around now, swings a full delivery from outside off stump to the midwicket boundary"
555,"Harris to Kohli, no run"
556,"Harris to Kohli, FOUR runs glorious! down the track, picks up the length delivery and clatters it over extra cover"
557,"Harris to Kohli, 1 run shuffles across, and deftly picks the gap between the two short midwickets"
558,"Hilfenhaus to Kohli, OUT gone this time, looks to swing an in-swinging full toss on the leg side, the ball dips on him and strikes him in front of leg, Aleem Dar raises his finger"
559,"VVS Laxman got his 167 in the third Test of that 1999-2000 tour of Australia, Rahul Dravid his 148 in the third Test of the 1996-97 tour of South Africa. After being denied in Perth, Vir"
560,"Peter Siddle leads Australia off the field. They won't enforce the follow-on it seems, with Clarke having asked for the heavy roller. Another top effort from this well-oiled attack, gett"
561,Innings Start
562,"9.50 am So will a glorious and long Test career or two be ended today with a formal announcement? It might, it might not. Australia have four wickets to take before that, and inflict ano"
