,Data
0,"Dilshan to Marsh, no run nicely bowled, slows this down, Marsh has time to think what to do, he ends up playing at it, and the turn beats his bat"
1,"Dilshan to Marsh, no run and follows it up with a rubbish short ball, Marsh finds extra cover, though"
2,"Dilshan to Marsh, no run full and straight, pushed back to the bowler"
3,"Dilshan to Marsh, no run"
4,"Dilshan to Marsh, 2 runs short, flat, quick, punched away for a couple"
5,"Dilshan to Marsh, no run"
6,"Herath to Hussey, no run low trajectory, turning into the pads, defended back"
7,"Herath to Hussey, no run pushed to silly mid-on"
8,"Herath to Hussey, 1 run flat into the pads, swept away along the ground"
9,"Herath to Marsh, no run defended off the front foot"
10,"Herath to Marsh, no run shout for lbw as he misses on the sweep, but he has got the front leg outside the line of off"
11,"Herath to Marsh, no run turning into the pads, defended to midwicket"
12,"Lakmal to Hussey, no run short of a length, angling across him, left alone"
13,"Lakmal to Hussey, 1 run length ball outside off, drops it wide of cover and charges through for a single"
14,"Lakmal to Marsh, no run starts outside off, angles further away, left alone"
15,"Lakmal to Marsh, no run looks to cut, not enough room, ends up paying it into the ground"
16,"Lakmal to Marsh, no run good bouncer, over the stumps, not too short, marsh wanted to pull, but pulled out late"
17,"Lakmal to Marsh, no run another good accurate bouncer, over the stumps, Marsh sways out of the line"
18,"Herath to Hussey, no run length ball, turning in towards off, defended off the back foot"
19,"Herath to Hussey, 2 runs no slip or short third man, and he opens the face on a fullish delivery, and steals a couple"
20,"Herath to Hussey, no run full on off, pushed back to the bowler"
21,"Herath to Hussey, no run flights this one, Hussey is forward to cover the turn and defend"
22,"Herath to Hussey, no run shimmies down, pushes this to silly mid-on"
23,"Herath to Hussey, 1 run full on the pads, places this between the two midwickets"
24,"Lakmal to Hussey, 1 run short, doesn't bounce high, pulled away from waist-high, all along the ground"
25,"Lakmal to Marsh, 2 leg byes short of a length, on the pads, guided to fine leg"
26,"Lakmal to Marsh, no run bouncer, this time too short, easy to duck under"
27,"Lakmal to Marsh, no run length ball angling away, driven away to mid-off"
28,"Lakmal to Marsh, no run short again, down the leg side, he stays away from it"
29,"Lakmal to Marsh, FOUR runs Marsh has been suffering under the sun, asking for replenishing drinks for the second time in two overs, but before that he has enough energy to crash this short delivery into the point boundary. Dismissed in front of point"
30,"Herath to Hussey, no run flat, on off, defended from deep inside the crease"
31,"Herath to Hussey, no run chips down the track, pushes this to midwicket"
32,"Herath to Hussey, no run lower trajectory again, defends from the crease"
33,"Herath to Hussey, SIX runs Hussey beats the leg-side field. I mean you can't place fielders in the stands! Comes down the track again, to the pitch of it, and then lefts it over midwicket"
34,"Herath to Hussey, no run defended off the front foot"
35,"Herath to Hussey, no run turning into the pads, pushed t square leg"
36,"Dilshan to Marsh, no run slightly short, rocks back and punches this to cover"
37,"Dilshan to Marsh, 2 runs finds the gap with this punch shot, wide of cover"
38,"Dilshan to Marsh, no run flighted on middle and leg, blocked back to him"
39,"Dilshan to Marsh, no run overpitched, pushed to deepish mid-off"
40,"Dilshan to Marsh, 1 run on the pads, deflected to fine leg"
41,"Dilshan to Hussey, no run full, on off, defended to extra cover"
42,"Herath to Marsh, no run full, flat, defended back"
43,"Herath to Marsh, no run swept away fine, but can't beat short fine leg"
44,"Herath to Marsh, OUT Bowled'im! His average falls to 111! A potential nelson has struck. Is this a break in concentration or a natural variation? It's a regulation offbreak from Herath, Marsh defends, but it doesn't turn in as much as he expects it to. The off stumps is left exposed, and pegged back"
45,"Herath to Haddin, no run pitches leg, straightens,defended off the back foot"
46,"Herath to Haddin, no run flighted outside off, left alone"
47,"Herath to Haddin, no run pushed to cover off the front foot"
48,"Eranga to Hussey, no run pitches well outside off, angles further away, left alone"
49,"Eranga to Hussey, 2 runs length ball on the pads, clipped away wide of deep square leg for a couple"
50,"Eranga to Hussey, no run length ball, starts middle and off, angling away, defended to cover"
51,"Eranga to Hussey, no run wide outside off, left alone"
52,"Eranga to Hussey, no run on middle and off now, driven to mid-off"
53,"Eranga to Hussey, no run wide outside off, Hussey doesn't play at it"
54,"Herath to Haddin, no run full on the pads, defended to mid-on"
55,"Herath to Haddin, no run dead-bats this one to silly point"
56,"Herath to Haddin, no run smothers the turn on this one"
57,"Herath to Haddin, 1 run full on the pads, clipped away to get off the mark"
58,"Herath to Hussey, 1 run Hussey sweeps this square, along the ground, gets a single"
59,"Herath to Haddin, no run flighted outside off, left alone"
60,"Eranga to Hussey, 2 runs on the pads, Hussey plays with soft hands, wide of square leg, rushes back for two"
61,"Eranga to Hussey, no run angled well across him, left alone"
62,"Eranga to Hussey, no run left alone outside off again, Hussey has been very good with what he wants to play and what he doesn't"
63,"Eranga to Hussey, no run length ball, middle and leg, holds its line a touch, defended back to the bowler"
64,"Eranga to Hussey, no run this literally the fifth-stump line, but he leaves it alone"
65,"Eranga to Hussey, 2 runs even closer to off, this time he steers it to the left of third man, and steals a second"
66,"Herath to Haddin, no run turns sharply, Haddin gets a bottom edge into the ground and then kicks the ball away to safeguard his stumps"
67,"Herath to Haddin, FOUR runs beautiful... I don't think many play the straight loft better than Haddin in today's cricket. Lovely extension of the arms, smooth swing, and it is flying over long-on"
68,"Herath to Haddin, no run lower trajectory, goes deep into the crease and defends"
69,"Herath to Haddin, 1 run fired into the pads, in the inside edge gets them a single"
70,"Herath to Hussey, no run Hussey chips down the track and pushes this to midwicket"
71,"Herath to Hussey, 1 run this one he drives to long-on for a single"
72,"Eranga to Hussey, no run starts outside off, angling away, which is a waste of energy when Hussey is batting"
73,"Eranga to Hussey, no run well wide of off stump, PJ does the rest"
74,"Eranga to Hussey, no run makes him play this time, ending just outside off despite the angle, pushed to mid-off"
75,"Eranga to Hussey, no run wide again, left alone again"
76,"Eranga to Hussey, no run slower ball, on middle and leg, Hussey is early in the shot, hits it uppishly, but it falls well short of mid-on"
77,"Eranga to Hussey, no run length ball, driven on the up, can't beat extra cover"
78,"Herath to Haddin, no run full, around off, defended"
79,"Herath to Haddin, FOUR runs another beautiful straight loft from Haddin. Lovely arc, dead straight, mid-off has no chance"
80,"Herath to Haddin, no run flighted outside off, no need to play at it"
81,"Herath to Haddin, no run flatter, quicker, pushed back to him"
82,"Herath to Haddin, no run slightly higher trajectory, dead-batted off the front foot"
83,"Herath to Haddin, 1 run full, driven to sweeper-cover for one"
84,"Eranga to Haddin, no run nips back in a touch, Haddin stays back to defend this back"
85,"Eranga to Haddin, no run this one holds its lien, takes a thick edges, which dies on its way to the diving Jayawardene at gully"
86,"Eranga to Haddin, no run nicely punched away, can't beat point"
87,"Eranga to Haddin, no run short of a length, outside off, defended back to the bowler"
88,"Eranga to Haddin, 3 runs Haddin is playing some gorgeous shots here. This is wide and short of a length, and he smoothly punches this square, past point. Thirimanne gives chase, slides, and manages to get a finger between the ball and the boundary skirting"
89,"Eranga to Hussey, 2 runs a good change-up delivery, full, near yorker, the inside edge evades the stumps"
90,"Welegedara to Haddin, 1 run this one holds its line in front of the stumps, Haddin gets into a bit of a tangle, but clips this to long leg for one"
91,"Welegedara to Hussey, no run shapes in towards Hussey, who defends this with an open face"
92,"Welegedara to Hussey, 1 run slower ball, he plays in front of his body, but there is no cover in place to catch this. Yet again Hussey crosses fifty, well on his way to a possible Man-of-the-Series award. Acknowledges the applause from the balcony"
93,"Welegedara to Haddin, FOUR runs Oof, Haddin can play! Lovely lovely straight-driving today. Length ball, meets it with a full face, sweetly follows through its line, and places it between the bowler and mid-off. All along the ground. Hussey is impressed"
94,"Welegedara to Haddin, no run left alone outside off this time"
95,"Welegedara to Haddin, no run short of a length, goes back and across to defend this"
96,"Herath to Hussey, 1 run comes down the track, takes the single midwicket"
97,"Herath to Haddin, no run tossed up outside off, left alone"
98,"Herath to Haddin, no run this one doesn't turn away, takes the inside half of the Haddin bat"
99,"Herath to Haddin, no run another straighter delivery, but this time Haddin has it covered"
100,"Herath to Haddin, no run turning across him, defended off the back foot"
101,"Herath to Haddin, no run low trajectory, turning towards middle and leg, defended from the crease"
102,"Dilshan to Hussey, no run floated ball on the off stump. Hussey comes forward and pushes it to cover point"
103,"Dilshan to Hussey, no run an action replay from the previous ball. Hussey comes forward to negate the turn and pushes it to cover point"
104,"Dilshan to Hussey, no run this time Dilshan pulls the length back a bit and Hussey offers a flat face of the bat"
105,"Dilshan to Hussey, 1 run flighted delivery this time as Hussey comes down the track and drives it to long-on for a single"
106,"Dilshan to Haddin, no run short ball on the off and middle. HAddin pushes it back to the bowler"
107,"Dilshan to Haddin, no run comes forward and plays it with a straight bat"
108,"Herath to Hussey, 1 run pushes it faster this time as Hussey pushes it to point for a single"
109,"Herath to Haddin, no run outside the off stump. Haddin comes forward and defends it yet again. He wants to be there when the new ball is taken"
110,"Herath to Haddin, 2 runs wrong line as he bowls it on the leg stump. Haddin turns it to fine-leg for a couple"
111,"Herath to Haddin, no run comes forward and pushes it to backward point"
112,"Herath to Haddin, no run defends it to the off side"
113,"Herath to Haddin, no run tossed up delivery. Haddin comes forward and defends it back to the bowler"
114,"Dilshan to Hussey, no run outside the off stump and left all alone"
115,"Dilshan to Hussey, no run comes forward and defends it to the off side"
116,"Dilshan to Hussey, FOUR runs now that's short! Hussey rocks back and places it in between cover and extra-cover for a boundary"
117,"Dilshan to Hussey, no run comes forward and defends it to extra-cover"
118,"Dilshan to Hussey, 1 run flighted ball as Hussey drives it to sweeper cover for a single"
119,"Dilshan to Haddin, no run comes forward and drives it back to the bowler"
120,"Welegedara to Hussey, FOUR runs and Hussey attacks the new ball with a cracking pull through midwicket"
121,"Welegedara to Hussey, no run defended to the off side"
122,"Welegedara to Hussey, no run left alone outside off"
123,"Welegedara to Hussey, 1 run steered away wide of gully for a run"
124,"Welegedara to Haddin, no run Haddin defends to the leg side"
125,"Welegedara to Haddin, no run pushed away to gully along the ground"
126,"Lakmal to Hussey, no run starts just outside off, angling away, left alone by Hussey"
127,"Lakmal to Hussey, no run length ball on middle and leg, defended back to the bowler"
128,"Lakmal to Hussey, no run full ball just outside off stump, Hussey stays in his crease and lets it go through to the keeper"
129,"Lakmal to Hussey, no run good length and the line is a fraction closer to the left-hander outside off stump, Hussey thinks about playing it and then decides against it"
130,"Lakmal to Hussey, 3 runs full length and this time the line is too close to off stump to leave, Hussey moves forward and drives through cover point"
131,"Lakmal to Haddin, no run that would have been a good ball to Hussey, but Haddin is a right-hander, so Jayawardene has to move towards his left to collect down leg side"
132,"Welegedara to Hussey, no run good length outside off, Hussey plants a foot forward and lets the ball go"
133,"Welegedara to Hussey, no run good length and closer to the batsman, Hussey stays in his crease and defends on the off side"
134,"Welegedara to Hussey, 2 runs that's too short and Hussey swivels and pulls towards deep square leg, where Eranga runs to his right, covers good ground and picks up the ball with one hand"
135,"Welegedara to Hussey, no run defended on the front foot towards the bowler"
136,"Welegedara to Hussey, no run goog length but the line is too wide for Hussey to play a shot"
137,"Welegedara to Hussey, 2 runs short of a length outside off, Hussey moves back and pushes the ball into the gap at cover point"
138,"Lakmal to Haddin, 1 run Haddin gets going this morning by clipping one off his pads behind square"
139,"Lakmal to Hussey, no run good length but the ball angles across Hussey from over the wicket and he lets it pass"
140,"Lakmal to Hussey, no run too wide outside off from Lakmal, Hussey doesn't bother with it"
141,"Lakmal to Hussey, 1 run he pitches slightly short and angles the ball into Hussey, who swivels and pulls towards deep square. He didn't time that well"
142,"Lakmal to Haddin, FOUR runs edged but short of gully! Lakmal went over the wicket to the right-hander and bowled a full ball just outside off, which moved away a touch. Haddin drove hard from his crease and sliced the ball hard and low towards gully"
143,"Lakmal to Haddin, 1 run full length and on the pads, Haddin tries to flick but doesn't make proper contact"
144,"Welegedara to Haddin, FOUR runs sublime cover drive. Haddin moves forward to a full ball outside off and punches it superbly through the gap in the infield. High elbow and he held that pose for the cameras."
145,"Welegedara to Haddin, no run defended on the back foot towards the off"
146,"Welegedara to Haddin, no run played off the back foot towards point"
147,"Welegedara to Haddin, no run short of a length and straight, Haddin gets behind the line and blocks"
148,"Welegedara to Haddin, no run Haddin moves back and pushes a length delivery towards the off side"
149,"Welegedara to Haddin, FOUR runs edged wide of second slip and there's no third slip! Haddin reached out for one and tried to drive it through cover though the length wasn't that full. He got a thick edge that flew safely past the diving Jayawardene at second slip"
150,"Lakmal to Hussey, no run left alone outside off stump"
151,"Lakmal to Hussey, FOUR runs another terrific drive, from Hussey this time. He leans forward to a full ball outside off and drives fluently all along the ground through extra cover"
152,"Lakmal to Hussey, no run Lakmal pitches outside off from round the wicket and angles the ball in, Hussey moves forward and lifts his bat out of the way"
153,"Lakmal to Hussey, FOUR runs that's awfully short, and Hussey is so quick to judge the length that he could have played two pull shots. He moved back and thumped it in front of square, all along the ground"
154,"Lakmal to Hussey, no run full ball outside off, Hussey drives the ball in the air and it goes quickly to the fielder at short cover, he yells as the ball hit his hand, it fell just short I think"
155,"Lakmal to Hussey, no run defended on the front foot towards the bowler"
156,"Eranga to Haddin, no run good length and wide outside off, Haddin lets it go"
157,"Eranga to Haddin, no run short of a length and wide outside off, Haddin chases it and misses the square cut"
158,"Eranga to Haddin, no run fuller length and the line is closer to off stump, Haddin prods and gets beaten"
159,"Eranga to Haddin, no run another good ball just outside off, Haddin defends"
160,"Eranga to Haddin, OUT loud appeal for caught behind and Haddin's been given, he isn't happy with the decision and asks for a review. The ball pitched on a good length outside off and seamed away a touch, Haddin did not come forward and pushed at it. There was a noise as it passed the bat and there's no conclusive evidence to suggest th"
161,"Eranga to Johnson, no run Johnson lets one go as the ball angles across his off stump from over the wicket"
162,"Lakmal to Hussey, no run full length but much too wide outside off, Hussey lets it go"
163,"Lakmal to Hussey, no run wide outside off once again, Hussey lets it go again"
164,"Lakmal to Hussey, 1 run short of a length around off stump, Hussey moves back and opens the face to guide the ball behind point"
165,"Lakmal to Johnson, no run good length outside off, Johnson stays in his crease and lets it go"
166,"Lakmal to Johnson, no run that defence was solid, got behind the line nicely and blocked it with the middle of his straight bat"
167,"Lakmal to Johnson, no run a bouncer and Johnson ducks under it, saw it early and let it easily"
168,"Eranga to Hussey, no run defended on the front foot towards the bowler"
169,"Eranga to Hussey, 1 run Hussey moves smoothly on to the front foot and drives the ball towards the left of mid-off for a single"
170,"Eranga to Johnson, no run good length on off stump, Johnson takes a small stride forward and punches the ball firmly towards the off where it is intercepted by the fielder at short cover"
171,"Eranga to Johnson, no run he had the width to free his arms there and he tried, perhaps a little half-heartedly, and mis-timed the drive towards short cover"
172,"Eranga to Johnson, no run interesting one this. Johnson got hit high on the pad after the ball pitched outside leg stump. Eranga, the bowler, began to appeal for the lbw (which wasn't out) and then the fielders in the cordon went up for the catch after the ball lobbed towards second slip and was caught by Sangakkara diving forward. Did"
173,"Eranga to Johnson, no run defended on the back foot"
174,"Lakmal to Hussey, 1 run driven on the front foot toward the off side where a fumble allows the single"
175,"Lakmal to Johnson, no run Johnson lets the ball go outside off"
176,"Lakmal to Johnson, no run good length and straight, Johnson stays in his crease, gets behind the line and defends, he hasn't scored as yet"
177,"Lakmal to Johnson, 1 run he's off the mark now, nudging a length ball off his pads through square leg"
178,"Lakmal to Hussey, no run full ball around off stump, played from the crease towards cover"
179,"Lakmal to Hussey, no run a sharp short ball, Hussey shapes up to pull and then decides to drop his wrists and let the ball go"
180,"Eranga to Johnson, no run good length delivery outside off, Johnson shoulders arms"
181,"Eranga to Johnson, FOUR runs Johnson's hammered this. He had the width to drive and the length was full too. Johnson freed those arms and drilled the ball through cover"
182,"Eranga to Johnson, no run much closer to the off stump, Eranga pitches in line and angles it across from over the wicket, Johnson lets it go. He's a different batsman when he has the freedom to swing, and when he doesn't"
183,"Eranga to Johnson, no run the bouncer, Johnson attempts the hook and gets beaten, the keeper leaps to collect it"
184,"Eranga to Johnson, no run the slower ball, the length is fuller too, Johnson spots it and defends"
185,"Eranga to Johnson, no run Johnson tries to drive but gets an inside edge on the leg side"
186,"Dilshan to Hussey, no run left alone outside off"
187,"Dilshan to Hussey, no run Hussey strides forward and defends one angled into him from round the wicket"
188,"Dilshan to Hussey, 1 run pushed off the back foot through cover"
189,"Dilshan to Johnson, 1 run full ball and straight, Johnson drives to mid-on and takes the single"
190,"Dilshan to Hussey, 1 run Hussey pushes towards cover and runs"
191,"Dilshan to Johnson, no run Johnson moves forward and blocks"
192,"Eranga to Hussey, no run full ball around off, Hussey moves forward and defends"
193,"Eranga to Hussey, no run good length close to off stump, left alone by the batsman"
194,"Eranga to Hussey, FOUR runs short of a length just outside off, Hussey waits and opens the face of the bat late to thread the ball through the cordon with supreme control. There's no third man"
195,"Eranga to Hussey, 1 run the slower ball is a touch straight and Hussey nudges off his pads for one"
196,"Eranga to Johnson, no run Johnson gets behind the line of a good length delivery and defends"
197,"Eranga to Johnson, 1 run Johnson drives straight but doesn't time it well, mid-off runs to his left and fields"
198,"Dilshan to Johnson, no run Johnson goes back to a short ball and hits it hard but straight to the fielder at cover"
199,"Dilshan to Johnson, no run played back to the bowler"
200,"Dilshan to Johnson, no run Johnson moves forward and defends on the off"
201,"Dilshan to Johnson, no run Johnson comes on to the front foot and blocks"
202,"Dilshan to Johnson, 1 run pushed towards mid-off for a single, the fielder is deep"
203,"Dilshan to Hussey, 1 run tossed up, Hussey takes it on the full and clips towards midwicket"
204,"Welegedara to Hussey, no run short of a length outside off, Hussey strides forward and lets it go"
205,"Welegedara to Hussey, FOUR runs make that 4996. A short, wide, hit-me-please ball. Hussey obliged with a fierce square cut that raced to the boundary"
206,"Welegedara to Hussey, FOUR runs 5000 Test runs for Hussey! This time the ball is not that wide but Hussey cuts it late and through the cordon for another boundary"
207,"Welegedara to Hussey, no run left alone outside off stump"
208,"Welegedara to Hussey, 1 run Hussey moves forward and pushes the ball wide of the fielder at mid-on to move to 99"
209,"Welegedara to Johnson, no run Johnson decides to leave one that angles into him from round the wicket and goes over his stumps. Brave decision!"
210,"Herath to Hussey, no run Hussey comes forward and plays to midwicket"
211,"Herath to Hussey, no run Hussey comes out of his crease and hits the ball on to his boot"
212,"Herath to Hussey, no run defended on the back foot on the off side"
213,"Herath to Hussey, no run played off the back foot towards the off"
214,"Herath to Hussey, no run ah that was a touch shorter and Hussey played it to midwicket"
215,"Herath to Hussey, no run defended solidly on the front foot, Herath bowls a maiden over to Hussey on 99, over to Johnson"
216,"Welegedara to Johnson, no run short of a length angling into the left-hander from over the wicket, Johnson plays off the back foot towards the bowler"
217,"Welegedara to Johnson, OUT caught at point! The ball from Welegedara is short of a length and rather wide outside off, Johnson could have hit that hard through cover but he just opened the face and spooned it gently towards point instead, an easy catch for Herath"
218,"Welegedara to Siddle, OUT caught at first slip! Welegedara angles a good length ball across the right-hander, Siddle pokes tentatively at it and edges to first slip. Another easy catch. Siddle looks back at Hussey, who's at the other end on 99, before walking off."
219,"Welegedara to Copeland, no run length delivery that pitches in line with the stumps, Copeland gets behind the line and blocks"
220,"Welegedara to Copeland, no run Copeland plays a fluent cover drive to a fuller ball outside off, Mathews stops it at short cover"
221,"Welegedara to Copeland, no run a bouncer to end the over, Copeland lets it go over his head"
222,"Herath to Hussey, no run Hussey sweeps and that would have been his century if the ball hadn't crashed into the fielder at short leg"
223,"Herath to Hussey, no run Hussey comes down the track to get to the pitch of the ball and hits it towards midwicket, can't find the gap"
224,"Herath to Hussey, no run comes down the pitch again and plays it to short midwicket"
225,"Herath to Hussey, 1 run there is it! Test century No. 15 for Michael Hussey. He gets there with a nudge off his pads behind square. His team-mates applaud as he takes off his helmet to celebrate, and cool down a touch."
226,"Herath to Copeland, no run left alone outside off stump"
227,"Herath to Copeland, 1 run Copeland nudges the ball towards square and runs"
228,"Welegedara to Copeland, no run fuller length outside off, Copeland lets it go through to the keeper"
229,"Welegedara to Copeland, no run defended on the front foot on the leg side"
230,"Welegedara to Copeland, OUT caught at second slip! Copeland has a flash at one that angles across him from over the wicket. He edges it hard but straight to Mahela Jayawardene at second slip and he's taken far harder catches than this. That was a low catch though, Jayawardene got his fingers under the ball just in time. Copeland seemed"
231,"Welegedara to Lyon, no run defended towards the off side"
232,"Welegedara to Lyon, no run Lyon keeps another one out"
233,"Welegedara to Lyon, no run wide outside off stump, Lyon survives by not chasing it"
234,"Herath to Hussey, no run full ball on leg and middle from over the wicket, Hussey plays on the leg side and refuses the single"
