,Data
193,"Faulkner to Pathirana, no run overpitched on off, driven to mid-on"
194,"Faulkner to Pathirana, no run another slower ball on off, getting lots of rip from his cutters. Blocked into the off side"
195,"Head to Shanaka, 1 run flatter, worked to deep backward square leg"
196,"Head to Pathirana, no run nah, poor delivery. Short and wide, keeps a bit low. Chopped towards point"
197,"Head to Pathirana, no run better, but too straight. Worked to fine leg, good captaincy not to allow easy singles"
198,"Head to Pathirana, 2 runs shortish and wide, too wide. Slapped to deep cover for a couple."
199,"Head to Pathirana, 2 runs good batting. Quick through the air, short, wide. Pathirana gets low and just taps his late cut towards third man for a couple"
200,"Faulkner to Shanaka, 1 run coming in from outside off, Shanaka chops it on the off side"
201,"Faulkner to Pathirana, 1 run just wide of wide slip! That ball squared Pathirana up a bit as he looked to defend, got an outside edge and flew towards the slip where Warner went to his right but the ball fell just short of him"
202,"Faulkner to Shanaka, 1 run coming into the right-hander again, he tucks it to leg this time"
203,"Faulkner to Pathirana, no run back of length outside off now, no movement and he lets it go"
204,"Faulkner to Pathirana, 2 runs he has to scramble back for the second he guides the ball from outside off to third man. He ran the first one with the intent of taking two and just made it back"
205,"Faulkner to Pathirana, 2 runs drives this one away from the body outside off, it falls short of point and goes wide of him"
206,"Zampa to Shanaka, no run nicely flighted on middle stump, he blocks it back"
207,"Zampa to Shanaka, no run shorter and flatter on off with some turn, he punches it to cover"
208,"Zampa to Shanaka, 1 wide flatter one down the leg side for a wide now"
209,"Zampa to Shanaka, 1 run lots of flight, some drift and dip as Shanaka comes down and drives it down to long-off"
210,"Zampa to Pathirana, 1 run slightly flat on leg, he sweeps with the turn to deep backward square leg"
211,"Zampa to Shanaka, OUT that's the straighter one and Shanaka is bowled! The batsman made a tiny bit of room, playing for the turn as the ball pitched on off, he stayed back to cut it but missed as the ball zipped through to hit off"
212,"Zampa to Perera, FOUR runs really short ball on the stumps, it's quick too but Dilruwan rocks back on the back foot, opens up and slams it through the midwicket region to collect four on first ball"
213,"Faulkner to Pathirana, 1 run leans across to off and flicks the ball to leg with his wrists"
214,"Faulkner to Perera, 1 wide short ball at 134kmh outside off, it's too short and he lets it go for a wide"
215,"Faulkner to Perera, no run brings it in with the angle, Dilruwan defends by covering the stumps"
216,"Faulkner to Perera, 1 run well outside off now and it's driven through the covers for one"
217,"Faulkner to Pathirana, 1 run shorter and wider outside off, he cuts off the back foot to deep point"
218,"Faulkner to Perera, no run angles it in slightly from outside off, he pokes and misses"
219,"Faulkner to Perera, no run right towards the off stump now, Dilruwan blocks with a straight bat"
220,"Zampa to Pathirana, FOUR runs just clears mid-off! He came down the ground and didn't middle the full toss at all, chipping it just over Starc running backwards. Starc even put in a slide near the boundary to keep the ball in but the third umpire wants to be sure. Looks like he was in contact with the ball and rope at the same time, according to the third umpire"
221,"Zampa to Pathirana, FOUR runs middles it this time for four more! Danced down the track and smacked the full toss straight down the ground"
222,"Zampa to Pathirana, no run goes back as Zampa pitches it shorter, he tucks it off the pads for two more"
223,"Zampa to Pathirana, no run straighter one on off stump, he works it to midwicket"
224,"Zampa to Pathirana, 1 run lots of flight outside leg, he sweeps it away behind square for one"
225,"Zampa to Perera, no run flight and drift towards the batsman's toes, he blocks it back"
226,"Starc to Pathirana, no run back of length on off stump, he defends it towards the covers"
227,"Starc to Pathirana, no run Starc brings this one into the batsman, Pathirana works it towards leg now"
228,"Starc to Pathirana, 1 wide this one has gone a bit too far down the leg side for a wide and they run one too"
229,"Starc to Pathirana, 1 run angling into the batsman again, he works it off the hips towards long leg"
230,"Starc to Perera, OUT the angle does it again, off stump knocked over! That one zipped through the defence as Dilruwan looked to defend it in front of off, the ball nipped in sharply from outside off and beat the outside edge to hit the stump"
231,"Starc to Lakmal, OUT that's a yorker at 147kmh and whams into the middle stump! The angle, the speed, the length...all come together to push Lakmal on the back foot, he tries to block the ball but it beats him completely to disturb the bottom of middle stump"
232,"Starc to Aponso, no run Aponso gets a quick delivery too towards the off stump, just back of length and not a yorker, he covers his stumps and defends a solidly to draw a cheer from the crowd"
233,"Boland to Pathirana, no run offers some width outside off, Pathirana swings big outside off and finds short cover"
234,"Boland to Pathirana, no run bangs it in shorter around off now, he stays back to defend it"
235,"Boland to Pathirana, no run gives some room on the off side with the angle, Pathirana cuts it late but the point fielder goes to his right to stop it"
236,"Boland to Pathirana, FOUR runs that's a Sanga-style drive over the covers - get some width and unleash an elegant swing by going down on a knee. Khawaja chased and put in a dive but the ball beat him"
237,"Boland to Pathirana, 1 run a bit of room now, not much, and he helps it to third man"
238,"Boland to Aponso, no run right towards off and middle stump, Aponso stays back and defends with a straight bat"
239,"Starc to Pathirana, no run gets a full delivery outside off and drives on the up to deep point. He says no for the single to get those extra runs"
240,"Starc to Pathirana, no run delivers a full toss while attempting a yorker, he drives it to deep point again"
241,"Starc to Pathirana, no run in the block hole on middle stump now, he digs it out to the leg side"
242,"Starc to Pathirana, (no ball) FOUR runs is the ball wet? That was a swinging beamer towards the chest around off stump, and Pathirana adjusts very well to go down a bit and guide that fine on the off side for four. That's a no ball"
243,"Starc to Pathirana, no run in the block hole now outside off, he steers it to third man but they don't run"
244,"Starc to Pathirana, no run stays back and defends the quick ball from middle and leg to the leg side"
245,"Starc to Pathirana, 1 run drives the ball away from the body, thick edge it to third man and he keeps strike"
246,"Boland to Pathirana, no run length delivery to target the stumps, he defends with a straight bat"
247,"Boland to Pathirana, OUT can't clear mid-off and SL are bowled out for 195! Pitched up, he lofts the ball on the off side but doesn't get enough and Faulkner takes a couple of steps back to catch that easily"
248,"5.32pm Sri Lanka must be distraught with their efoorts here. De Silva and Gunathilaka didn't give Starc a wicket in the opening spell and started picking boundaries too in their half-century stand but once Faulkner broke the stand, wickets kept tumbling and lack of partnerships led to their downfall. No batsman reached the forties as all bowlers except Zampa kept the scoring rate under check, picked wickets (which Zampa did too) and SL never"
249,"Welcome back to the chase. An all too familiar story for Sri Lanka, but can their spinners set up something? Either way this ain't going to be a 50-overs innings. The drizzle before the break won't really help them either. Warner and Wade, Finch isn't fit enough to open. Wade has opened in ODI cricket before, I think. Seam to start, Suranga Lakmal."
250,"Lakmal to Warner, 1 run ooh, lots of movement to start. Good length on middle, the ball darts back prodigiously. Inside edge to fine leg for a run"
251,"Lakmal to Wade, no run full and wide outside off, 131 kph. Nicely driven to cover off the back foot"
252,"Lakmal to Wade, no run good length outside off, some inward movement. Blocked"
253,"Lakmal to Wade, 1 wide strays down leg this time, lots of swing though. Started too straight, deviates down leg for an extra"
254,"Lakmal to Wade, no run oh beauty. Back of a length outside off, the ball comes back in. Wade is cut in half"
255,"Lakmal to Wade, 1 run good run. Overpitched on off, drilled back to the bowler, who fumbles and ricochets it towards midwicket. Calls his partner through"
256,"Lakmal to Warner, no run full and straight, good stuff this. Warner can block."
257,"Perera to Wade, no run flight outside off, Wade comes down and angles his bat to point"
258,"Perera to Wade, 1 run good shot, Wade clears his front leg to avoid the ball hitting the pad. Driven to long-off with the spin"
259,"Perera to Warner, no run beauty. Superb length, draws Warner forward but the ball spins away late and beats the bat"
260,"Perera to Warner, no run this one is the slider. Full and straight, quick. Driven to cover. No turn this time"
261,"Perera to Warner, FOUR runs the reverse lap for four. Quick on off, slides on. Warner gets down and calmly collects four with a fine reverse sweep to the third man boundary"
262,"Perera to Warner, no run slightly quicker and flatter on off, blocked watchfully"
263,"Lakmal to Wade, no run back of a length on off and middle, 138 kph. Wade wants to pull but the ball hurries onto him, he ends up inside-edging this onto his body"
264,"Lakmal to Wade, no run big appeal, but lots of doubt. Full and straight, Wade doesn't pick the length. Thinks of pulling but has to drive late. Thick inside edge onto the body"
265,"Lakmal to Wade, no run full and straight again, blocked. A decent amount of swing"
266,"Lakmal to Wade, no run full and straight, inward movement. Hit back to the bowler"
267,"Lakmal to Wade, 1 run back of a length outside off, Wade stands tall and punches to mid-off. Despite him being deep in the crease, he still gets one"
268,"Lakmal to Warner, 2 runs squirted through midwicket for a couple. Full and straight, the ball comes back in and takes the inside half. Not in control"
269,"Perera to Wade, no run quick outside off, skids on with the arm. Wade comes down but pads it away into the leg side"
270,"Perera to Khawaja, 1 run flat on off, no spin. Khawaja gets forward and inside edges this towards square leg"
271,"Perera to Warner, no run shortish this time, slightly erring in length. Warner hurries back and punches to cover"
272,"Perera to Warner, no run overpitched, quick. Hastily driven to mid-on"
273,"Perera to Warner, 1 run back of a length on off, Warner goes back and punches to long-off"
274,"Lakmal to Warner, no run short and wide, too much width but extracts some extra bounce too which is responsible for the ball going over Warner's flaying bat"
275,"Lakmal to Warner, 2 runs squirted away over point. Full and wide outside off, Warner goes after it. The ball skews off the outside half, over point. Third man gets around"
276,"Lakmal to Warner, no run slower ball on middle, Warner solid behind the line"
277,"Lakmal to Warner, 1 run too much width outside off, full, wide. Slashed away to cover point for a run, the fielder got across to stop the run"
278,"Lakmal to Khawaja, no run nice stroke. Back of a length outside off, Khawaja times his drive towards cover point, where Mendis dives again to prevent the boundary"
279,"Lakmal to Khawaja, no run tight channel just outside off, Khawaja strides forward to defend"
280,"Perera to Warner, 3 runs slides on but short. Warner picks the length early, goes back and cuts to deep point for three. Great running from Khawaja to get back"
281,"Perera to Khawaja, FOUR runs Khawaja gets across and paddle sweeps a boundary to fine leg. Let the ball come to him and used the pace, batting"
282,"Perera to Khawaja, 1 run flat on off, Khawaja gets down and connects with his sweep to backward square leg"
283,"Perera to Warner, 1 run flat on leg, worked into the leg side for one"
284,"Perera to Bailey, 1 run flat on leg, worked to midwicket to get off and running"
285,"Lakmal to Bailey, no run 132 kph, a muted appeal. Fuller than a good length on leg, Bailey misses his flick. Beaten for pace"
286,"Lakmal to Bailey, 1 wide strays down leg this time, wide"
287,"Lakmal to Bailey, no run beautiful lines. Tight around off stump, Bailey gets behind the line to defend"
288,"Lakmal to Bailey, 1 run back of a length on leg, Bailey nurdles one into the leg side for a run"
289,"Lakmal to Warner, no run wafts and the ball goes past! Not a good shot. Good length outside off, the ball moves away and beats the bat. No feet movement"
290,"Lakmal to Warner, 1 leg bye back of a length down leg, 136 kph. Off the pad to fine leg as Warner is beaten for pace"
291,"Lakmal to Bailey, no run beautiful delivery. Full and straight, the ball moves away late as Bailey defends into the off side"
292,"Perera to Warner, no run ooh, almost dragged on! Flat delivery outside off, skids back in. Warner looks to cut, the ball just misses the stumps"
293,"Perera to Warner, 1 run short and flat on middle, pulled to deep midwicket"
294,"Perera to Bailey, no run fullish outside off, patted back to the bowler"
295,"Perera to Bailey, 1 run there is Bailey's reverse sweep. Finds short third man. Warner hurtles across for the run"
296,"Perera to Warner, no run ooh, almost goes through again. Shorter length, so Warner thinks he can cut but the ball skids on. Chopped to point"
297,"Perera to Warner, no run down leg this time, off the pad"
298,"Lakmal to Bailey, no run 134 kph, clipped to midwicket. The ball is throws towards the stumps at the bowlers end. Warner's bat gets in the way, the run is available on the ricochet but they don't take it"
299,"Lakmal to Bailey, no run full and straight, comes back in this time. Solidly blocked"
300,"Lakmal to Bailey, no run full and straight, tight lines. Blocked into the off side"
301,"Lakmal to Bailey, no run nice and straight again, 136 kph. Bailey is behind the line, head over the ball, eyes on it"
302,"Lakmal to Bailey, no run drifts down leg at 136 kph, Bailey misses his flick and is hit on the pad"
303,"Lakmal to Bailey, no run lovely over that. Maiden. Full and straight again, Bailey blocks"
304,"Perera to Warner, no run strays down leg again, absolutely no turn. Warner is beaten for pace again as the ball skids on to his pad"
305,"Perera to Warner, no run slow this time, loop and flight on off, blocked"
306,"Perera to Warner, no run gets down to reverse sweep but the ball is quick again and beats the stroke. Really skidding off this pitch"
307,"Perera to Warner, no run beautiful stuff, drift towards middle, then pitches and rips past Warner's bat. Unplayable"
308,"Perera to Warner, no run 96 kph, full and straight, hit back to the bowler"
309,"Perera to Warner, no run worked into the off side, superb over. Another maiden"
310,"Lakmal to Bailey, 1 run back of a length on off, Bailey pulls all along the ground to deep square leg for one"
311,"Lakmal to Warner, no run miscommunication! Almost results in his dismissal. Played off the pad to short midwicket, he calls for one, but Bailey doesn't want it. Warner makes it in with a full-length dive as the bowler was quick on it, the throw missed the stumps anyway"
312,"Lakmal to Warner, 1 run back of a length on leg, 132 kph. Worked to deep square leg"
313,"Lakmal to Bailey, no run good length outside off, pushed towards cover"
314,"Lakmal to Bailey, 1 run good length outside off, steered down to third man for a single"
315,"Lakmal to Warner, 1 wide way down leg for a wide"
316,"Lakmal to Warner, 1 run good length on middle and leg, nudged away to deep square leg for a single"
317,"Pathirana to Warner, 1 run poor delivery. Short on off, and slow. Warner can easily help it along to deep fine leg"
318,"Pathirana to Bailey, 2 runs short and wide outside off, some extra bounce. Scythed to deep backward point for a couple."
319,"Pathirana to Bailey, 1 run shortish outside off, comes back in. Carved to deep point for one"
320,"Pathirana to Warner, 1 run flatter on middle and leg, pulled away to deep midwicket. Runs coming easily now"
321,"Pathirana to Bailey, 1 run too short, too wide, easily slapped to deep cover"
322,"Pathirana to Warner, 1 run good single. Flight outside off, Warner wanted to sweep but had to improvise a guide to point."
323,"Shanaka to Warner, no run poor start, full and wide outside off to Warner. Drilled to long-off, lucky to get away with that"
324,"Shanaka to Warner, no run gentle inswinging yorker on middle, 126 kph. Warner jams it out back to the bowler"
325,"Shanaka to Warner, 1 run nice drive to long-off. Full face of the bat"
326,"Shanaka to Bailey, no run tight channel around off, Bailey is solid behind the line"
327,"Shanaka to Bailey, no run 129 kph, full and wide outside off, steered towards point"
328,"Shanaka to Bailey, no run gentle away swing, full and wide outside off, glided to point. Another tidy over from SL"
329,"Pathirana to Warner, no run big appeal, no says umpire Dar. Tossed up outside off, Warner gets low and tries to sweep, straight to leg slip. Was there some glove there? Mighty close to it, may have been the top edge in fact. Sri Lanka do not review."
330,"Pathirana to Warner, 1 run"
331,"Pathirana to Bailey, 1 run comes down and drives to long-off with the spin"
332,"Pathirana to Warner, no run 74 kph, slow on off and middle. Blocked"
333,"Pathirana to Warner, no run very flat on middle and leg, 75 kph. Warner hits his sweep to leg slip"
334,"Pathirana to Warner, 1 run flight outside off, smashed to long-on"
335,"Shanaka to Warner, no run full and straight, Warner plays all around his front pad, works to midwicket"
336,"Shanaka to Warner, 1 run full but not wide enough to throw his arms at that. Thick inside edge to square leg"
337,"Shanaka to Bailey, FOUR runs clipped just wide of deep square leg. May have surprised himself with the timing on that. Full but on the pads. Bailey picks it off in the air, Mendis runs around from square leg but can't get there"
338,"Shanaka to Bailey, no run full and wide outside off, 126 kph. Steered to point"
339,"Shanaka to Bailey, 3 runs 126 kph, ooh, a double mis-field. Overpitched outside off, smashed to cover who parries it to mid-off, who is wrong footed, he gets down but the ball goes through his hands as well. Three the result"
340,"Shanaka to Warner, 1 run short and wide, poor delivery. Hammered to deep cover"
341,"Pathirana to Warner, 1 leg bye plenty of purchase on that. Slow through the air on off, prodigious spin. Warner inside-edges it towards fine leg"
342,"Pathirana to Bailey, no run flat outside off, left alone. No spin"
343,"Pathirana to Bailey, no run short and wide outside off, slow but no turn. The cut is there to be played but Bailey misses"
344,"Pathirana to Bailey, no run gets low and reverse sweeps to third man"
345,"Pathirana to Bailey, 1 run shortish again outside off, carved out to deep cover off the back foot"
346,"Pathirana to Warner, 1 run slow on off, too full. Driven with the spin to long-on"
347,"Perera to Warner, no run pretty straight on the stumps, Warner defends off the back foot"
348,"Perera to Warner, 1 run goes back in the crease and punches the ball to sweeper cover for one"
349,"Perera to Bailey, no run the straighter one outside off, Bailey defends off the back foot"
350,"Perera to Bailey, 1 run little bit more flight and Bailey sweeps with the turn to fine leg for one"
351,"Perera to Warner, 2 runs pitched up for Warner and he chips it over the covers in the gap, with the turn, for two"
352,"Perera to Warner, no run appeal for lbw from Dilruwan as Warner sweeps against the turn to short fine leg"
353,"Pathirana to Bailey, 1 run nicely flighted on the middle stump by Pathirana, Bailey drives with the turn to long-off"
354,"Pathirana to Warner, 2 runs stretches out and makes it a full toss to sweep it to the deep square-leg boundary for two. Kusal Mendis doing some good work in the deep"
355,"Pathirana to Warner, no run optimistic appeal as Warner sweeps and takes the ball on the pad, but it was going down leg"
356,"Pathirana to Warner, no run shuffles down to work the ball to long-on, Pathirana runs to his left to stop the ball"
357,"Pathirana to Warner, 1 run slaps this one with the turn from off to deep square leg again"
358,"Pathirana to Bailey, 1 run low and flighted full toss on middle, pushed down to long-off easily"
359,"Perera to Bailey, 1 run slightly slow outside off, Bailey leans forward to nudge it to long-on"
360,"Perera to Warner, 3 runs outside off and Warner reverse sweeps this one to just beat the slip fielder for three runs"
361,"Perera to Bailey, 1 run quicker and pitched up towards off, pushed down to long-on easily"
362,"Perera to Warner, no run flighted delivery and it dips into the block hole, Warner digs it out"
363,"Perera to Warner, 1 run flatter on the stumps, Warner clips it to deep square leg"
364,"Perera to Bailey, 3 wide turns this one a fair bit from off and just past the pads down the leg side, signalled wide as they run two too"
365,"Perera to Bailey, no run flighted well outside off, Bailey reaches out to push it to cover"
366,"Aponso to Warner, 1 run straight on the pads and Warner tucks it square for one"
367,"Aponso to Bailey, no run some flight outside off, he drives and gets a thick inner edge to leg"
368,"Aponso to Bailey, no run towards the middle stump now, Bailey leans forward and blocks"
369,"Aponso to Bailey, no run jut outside off now and he reverse sweeps it to point now"
370,"Aponso to Bailey, no run that was the slider towards the stumps from outside off, came in with the angle, Bailey went back to cut and just managed an inner edge in time"
371,"Aponso to Bailey, no run that was slightly slower and going down leg as Bailey took it on the pad"
372,"Perera to Warner, FOUR runs some room and Warner has slammed that through the covers, all along the ground for four! A bit of width and he swung hard at it"
373,"Perera to Warner, no run bit slower outside off, blocked off the front foot"
374,"Perera to Warner, 1 run fullish again, he drives it hard to long off now"
375,"Perera to Bailey, 1 run bit of flight from middle to leg, Bailey had made up his mind to reverse sweep it to deep point"
376,"Perera to Warner, no run touch slower and Warner gets an inside edge onto his pad"
377,"Perera to Warner, no run some flight again, without any room, and Warner blocks again"
378,"Aponso to Bailey, 1 run flighted on off, Bailey shuffles down to drive it to long-off"
379,"Aponso to Warner, no run turns it in from length just outside off, Warner goes back to defend"
380,"Aponso to Warner, FOUR runs pretty flat on middle and leg, Warner cashes in on the extra bit of pace and reverse sweeps it just behind square to find the boundary"
381,"Aponso to Warner, no run goes back this time to steer the ball from off to point after it turned"
382,"Aponso to Warner, no run towards the middle stump now, leans a bit to work it to midwicket by closing the face of the bat"
383,"Aponso to Warner, no run flat and straight outside off, he goes back to block"
384,"Dhananjaya to Bailey, 2 runs paddles it fine with the turn towards fine leg"
385,"Dhananjaya to Bailey, 1 run prett short on leg with hardly any turn, worked away easily to deep midwicket"
386,"Dhananjaya to Warner, no run pretty slow towards off stump, leans forward and blocked"
387,"Dhananjaya to Warner, 1 run angling in a bit now and it's worked to leg off the back foot"
388,"Dhananjaya to Bailey, no run this one goes away with the angle and beats Bailey's outside edge"
389,"Dhananjaya to Bailey, no run leans forward a bit and nudges the ball to midwicket"
390,"Aponso to Warner, 2 runs it turns in, he goes back to cut and gets a thick outside edge to third man and that's his half-century, the first of this series and second of the tour"
391,"Aponso to Warner, FOUR runs goes just past the keeper! Now Warner has some luck too - he leaned forward and played for the turn to push the ball down, but it didn't turn as much and the ball kissed the outside edge to go past Kusal's gloves for four!"
392,"Aponso to Warner, 1 run he goes back and jabs this one towards point for one"
393,"Aponso to Bailey, no run easy forward lean to block the straightish ball"
394,"Aponso to Bailey, 1 run goes back to cut, the ball angles in and he cuts successfully to deep point"
395,"Aponso to Warner, FOUR runs tossed up, Warner lunges out and drives that with some power through the covers to beat sweeper cover for four! He's bossing things around now!"
396,"Dhananjaya to Bailey, 1 run on the leg stump from around the wicket, reverse-swept to the off side for one"
397,"Dhananjaya to Warner, 1 run waits for the ball to come to him and nudges it to midwicket for one"
398,"Dhananjaya to Bailey, 1 run bit of flight on the off stump now, clipped to deep midwicket easily"
399,"Dhananjaya to Warner, FOUR runs that's short and flat, Warner eyes it and rocks back to pull it away with some power, right in the gap for a one-bounce four"
400,"Dhananjaya to Warner, 1 run nicely flighted outside off now, and he drives it down to long-off"
401,"Dhananjaya to Bailey, no run closes the face of the bat early towards leg and gets a leading edge towards the cover"
402,"Aponso to Warner, 1 run goes back a bit and works the ball to leg for a quick single"
403,"Aponso to Bailey, no run shuffles down to take the ball on the pad well outside the crease and outside off"
