,Data
406,"Head to Munro, no run chopped from off stump to Smith at extra cover"
407,"Hazlewood to Santner, no run short on off, hangs back and fends it to cover"
408,"Hazlewood to Santner, 1 run full and angling away outside off, driven to mid-off"
409,"Hazlewood to Munro, no run back of a length and outside off, punched to backward point"
410,"Hazlewood to Munro, 1 run short on middle, cramps him for room. Stabs an inside edge to square leg"
411,"Hazlewood to Santner, no run full on off, pushed down the ground"
412,"Hazlewood to Santner, no run"
413,"Head to Munro, no run speared on middle, punched to extra cover"
414,"Head to Munro, FOUR runs Munro sees flight, he likes it, takes it from middle stump and smears it over the bowler's head"
415,"Head to Munro, 1 run shorter and outside forced on the back foot to sweeper cover"
416,"Head to Santner, 1 run chopped from outside off through the cover-point region"
417,"Head to Munro, no run"
418,"Head to Munro, 1 run speared on leg, punched on the back foot through the covers"
419,"Starc to Munro, 2 runs very full, slants in on leg, flicked away through midwicket"
420,"Starc to Munro, OUT rip-roaring reverse-swinging yorker. Late inward shape for the fast bowler. Clatters into the leg stump. Every time Smith wants to break the stand, he turns to Starc, and his bowler delivers. Munro attempts a whip or a drive, and is beaten for pace. The ball shot through even before the left-hander could bring his bat down"
421,"Starc to Southee, no run edged, but does not carry to Wade. Full, angled in, swings away, opens Southee up. He wafts and nicks it. Wade dives to his right, but the ball drops in front of him"
422,"Starc to Southee, no run"
423,"Starc to Southee, no run very full and angled in on middle, Southee, having cut down his backlift, keeps it out"
424,"Starc to Southee, no run low full-toss, angled in, and curves away. Pushed to cover"
425,"Faulkner to Santner, no run back of a length and outside off, guided to backward point"
426,"Faulkner to Santner, no run swish and a miss outside off"
427,"Faulkner to Santner, no run good length on off, played back to the bowler"
428,"Faulkner to Santner, no run dabbed to backward point"
429,"Faulkner to Santner, FOUR runs glanced off the pads, deflected fine on the leg side four four"
430,"Faulkner to Santner, no run length and outside off, pushed to cover"
431,"Starc to Southee, 1 run full awayswinger outside off, poked down to third man off an outside edge"
432,"Starc to Santner, no run middle-stump yorker, 145ks, reverses in, kept out"
433,"Starc to Santner, no run Santner backs away outside leg, Starc shortens his length and goes outside off. Santner swings hard and does not connect"
434,"Starc to Santner, FOUR runs very full on the pads, Starc overshoots it, chipped in the air over square leg"
435,"Starc to Santner, FOUR runs Santner moves away outside leg, Starc follows him, the batsman pushes and outside-edges it through the vacant cordon"
436,"Faulkner to Southee, no run good length, angling in from outside off, Southee skips down a step and knocks it back to the bowler"
437,"Faulkner to Southee, no run fuller ball outside off, driven into the covers region"
438,"Faulkner to Southee, no run comes down the track early and the bowler adjusts by shortening his length. Southee is forced to steer it to point"
439,"Faulkner to Southee, no run comes down the track again and goes for a wild slog but it's a length ball and the back-of-the-hand slower one which Southee does not pick and he gets beaten"
440,"Faulkner to Southee, no run short of a length, defended into the leg side"
441,"Faulkner to Southee, 2 runs comes down the track early again and the ball follows him which aids Southee as he lofts it over the on side with the angle. Does not get enough on it though and the ball is fielded at deep midwicket"
442,"Starc to Ferguson, no run fuller ball, angling in on the stumps from outside off, defended"
443,"Starc to Ferguson, no run Smith claims a catch at slips and it's not given. It certainly carried to Smith at second slip who dives forward and takes it. It was a short ball and Southee was trying to drop his wrists and back away. But the ball goes off the back glove, on to the forearm and lobs towards Smith. Australia review it and replays show that the back hand had come o"
444,"Starc to Ferguson, no run full and wide, Ferguson backed away and took himself well outside the line of the ball. Can't make any contact"
445,"Starc to Ferguson, no run low full toss just inches outside off. Ferguson uncomfortably shifts back in his crease and the ball shoots past the outside edge"
446,"Starc to Ferguson, no run fullish ball outside off. Ferguson awkwardly shuffles across and keeps it out off the backfoot"
447,"Starc to Ferguson, no run fuller ball outside off, swing and a miss from the batsman"
448,"Faulkner to Southee, no run comes down the track and looks to slog but the bowler follows him by firing it on leg stump channel and Southee ends up getting cramped for room as he makes no contact"
449,"Faulkner to Southee, 1 run fetches it awkwardly from outside off and swats it to long-on"
450,"Faulkner to Ferguson, 1 run short of a length ball, back-of-the-hand slower variation. Ferguson dabs it uppishly into the vacant region around forward short leg"
451,"Faulkner to Southee, OUT Southee's chancy stay comes to and end with a miscue to extra cover. It was the slower ball and Southee was forward looking for a big hit over long-off. The lack of pace means he does not get the timing right and he skews it off the high end of the bat to Warner who settles under it at extra cover"
452,"Faulkner to Ferguson, 1 run runs it down to third man with an open face"
453,"Faulkner to Boult, no run very full ball outside off, squeezed out to cover"
454,"Starc to Ferguson, no run fuller ball, chips the drive to cover-point where Cummins dives forward and takes it on the bounce"
455,"Starc to Ferguson, no run fuller ball, angled in on middle from around the wicket, pushed to mid-on"
456,"Starc to Ferguson, 1 run sprayed down leg, clipped away to fine leg"
457,"Starc to Boult, no run fuller ball outside off, sticks his bat out without feet and knocks it to the off side"
458,"Starc to Boult, no run yorker on the stumps, Boult jams his bat down and squeezes it out. The bat face opens as it makes contact with the ball and it goes to the off side"
459,"Starc to Boult, no run fuller ball, Boult awkwardly keeps it out to covers. Again, no feet"
460,"Faulkner to Ferguson, no run back-of-the-hand slower ball that's angled across on a length outside off, Ferguson tries to cut and misses"
461,"Faulkner to Ferguson, no run similar delivery and this time Ferguson skips down the track and tries to cut, again misses"
462,"Faulkner to Ferguson, no run fuller ball, driven uppishly to covers and it drops short of the fielder there"
463,"Faulkner to Ferguson, 1 run short of a length, tucked with the inward angle to fine leg"
464,"Faulkner to Boult, no run good length outside off, comes forward and defends it to point"
465,"Faulkner to Boult, 1 run full and on the pads, Boult backs away and whips it to midwicket"
466,"Cummins to Boult, OUT oh, what a way to finish! It's Smith again. Took a stunner in the previous game. This one's as good if not better than the one in the previous ODI. He dived to his left on that occasion"
467,"Travis Head - Fantastic. Great opportunity, the last three games. We've played fantastically, especially after the last couple of months we've had, it feels great to win. I feel in good touch. Probably did not sum up the conditions as well as I would have liked to. It was a slow wicket. Happy that I was able to help win the game with the ball as well."
468,"Pat Cummins - Absolutely, it was actually a little tougher today. David Warner played an unbelievable innings and it feels great to finish 3-0. Can't wait to get out there and bowl a few deliveries. I think on a wicket like this, it's a bit slow and there is not going to be much boundaries, so we had to stop the singles, which is something we pride ourselves in doing. It seems lik"
469,"So the final assessment reads like this - David Warner - 156; New Zealand - 147. Little else needs to be said. Australia complete a 3-0 sweep, and given how rough the last few months have been, this win must taste especially sweet. David Warner made all the difference between the two sides. On a pitch where the rest of Australia and all of New Zealand's batsmen struggled, Warner w"
470,David Warner is the Man of the Match and the Man of the Series.
471,"Warner - It's a team performance. Credit to the bowlers for coming out and executing the plans. Us as batsmen, we had to relay the message and they did extremely well. My first coach of cricket until I was about 16 or 17 passed away, my condolences to his family. I would like to hope my form is getting better, but I need to keep hitting the nets and work harder."
472,"Kane Williamson - There has been a player in the Aussie side who has contributed in every game. Pretty disappointing. We did want to show signs of improvement, which is why today's performance was especially disappointing. We would have had to bat well to chase down 264, but it was pretty gettable. I don't think we were smart enough with the bat today. Australia thoroughly deserve"
473,Steven Smith - The catch wasn't a bad one. It was a nice way to finish. We have put up a pretty complete performance in all three games. We needed to improve after South Africa. The bowlers put in good performances. The guys from the top four going and getting hundreds and bowers sticking to plans has helped us turn it around. All three quicks bowled beautifully throughout the ser
474,"That's it from us for this game then. Australia have been clinical with bat and ball throughout the series and deservedly end with a 3-0 scoreline that is a fairly accurate representation of the teams' performances. Meanwhile, India are going strong in their reply to England's 400 in the fourth Test in Mumbai. Just about half an hour left in the day, so stay tuned. Until next time"
475,Australia won by 117 runs
476,"Player of the match is David Warner, AUS"
