,Data
261,"Kulasekara to McKay, 1 run squeezed out to deep cover"
262,"Herath to McKay, no run goes back to cut but mis-times it and hits it into the ground near his shoe"
263,"Herath to McKay, 1 run chipped in the air but short of the fielder at long-off"
264,"Herath to Lee, no run defended back to the bowler"
265,"Herath to Lee, 1 run charges the bowler and hits the ball past him towards long off"
266,"Herath to McKay, 1 run tries to hit inside out over the off side but gets an inside edge that lobs on the leg"
267,"Herath to Lee, 1 run played off the front foot through midwicket"
268,"Malinga to Lee, 2 runs fullish in length outside off and he makes room and crashes it to deep extra cover"
269,"Malinga to Lee, FOUR runs crashes this one as well off the front foot, Kulasekara dives at the boundary at wide long-off but it was too quick for him, raw power, Malinga not getting the yorker right"
270,"Malinga to Lee, no run makes room and swishes at thin air, wide of the off stump"
271,"Malinga to Lee, no run gets beside the line and cuts hard but can't beat backward point"
272,"Malinga to Lee, 2 runs makes room and crashes it off the front foot but Kulasekara's able to get across and cut it off"
273,"Malinga to Lee, no run slower delivery outside off, he swings and misses"
274,"Herath to McKay, no run"
275,"Herath to McKay, FOUR runs This partnership starting to annoy SL a bit, McKay chips down the track and chips Herath inside out over extra cover, in fact it was more than a chip, clean hit"
276,"Herath to McKay, no run drives to the man at cover"
277,"Herath to McKay, no run makes room and he gets the ball to drift inwards and he ends up chopping it to the off side"
278,"Herath to McKay, OUT McKay perishes trying to go over the top on the on side, he gets on his knee for the slog and he ends up hitting it flat to Maharoof at deep midwicket, he falls forward and takes it"
279,"Herath to Lee, 1 run tossed up on middle and leg and he whips it towards midwicket"
280,"Malinga to Lee, 2 runs makes room and tries to scoop it over the bowler's head but ends up miscuing it to mid-off"
281,"Malinga to Lee, no run slower ball outside the off stump and he misses and Sanga nearly falls over trying to stop it!"
282,"Malinga to Lee, 1 run Lee makes room and biffs a full delivery down to long-off, once again Malinga not getting his yorkers through properly, he's not 100% fit they say"
283,"Malinga to Doherty, 2 runs opens the face of the bat and steers him down to deep point, a fumble allows a second run"
284,"Malinga to Doherty, 1 run runs it down to third man for a single"
285,"Malinga to Lee, 1 run Dropped Maharoof thre culprit, the batsman made room and sliced a length delivery down to deep extra cover, it was flat and Maharoof didn't time his dive well"
286,"Kulasekara to Lee, no run squeezes out a yorker on the leg stump and Kula runs across and flings it back towards the stumps"
287,"Kulasekara to Lee, no run good yorker again, outside the off stump and he makes room and fails to squeeze it out"
288,"Kulasekara to Lee, 1 run makes room and squirts out a yorker to deep point"
289,"Kulasekara to Doherty, no run on the blockhole angling wide of the left-hander and it's too good for Doherty"
290,"Kulasekara to Doherty, 1 run full on the off stump and he squeezes it out to the off side"
291,"Kulasekara to Lee, 1 run lofts over mid-off but not timed as well and it's short of the fielder in the deep"
292,"Malinga to Lee, 1 run yorker on the pads and he squeezes it out to deep midwicket"
293,"Malinga to Doherty, no run another yorker on the pads and he can only squirt it straight to midwicket"
294,"Malinga to Doherty, no run squeezes out a yorker to backward point and Dilshan charges at the ball and prevents a single"
295,"Malinga to Doherty, no run that's more like it from Malinga, fast yorker outside off and swinging away, can't get bat on ball"
296,"Malinga to Doherty, 1 run squeezes out a yorker to Dilshan at backward point and he has a shy at the bowler's end though Malinga wasn't behind the stumps"
297,"Malinga to Lee, 1 run swings it to midwicket and risks another single but the throw is wide"
298,"Kulasekara to Lee, no run Kula bowls it wide of the off stump on seeing Lee make room, slower ball too, Lee misses"
299,"Kulasekara to Lee, OUT knocks off the leg bail! Kula bowls another yorker on the leg stump, Lee makes room to flay that anywhere but the ball hits his boot and shaves the leg stump"
300,"Kulasekara to Lyon, OUT not the best start to Lyon's ODI career with the bat! Kulasekara bowls it full on the pads and Lyon makes room and chips it high over midwicket and Senanayake the substitute times the dive well and takes the catch"
301,"Still, such is the nature of these teams that even 231 might turn out to be competitive. Don't count Australia out yet. They will come out charging. Whatever it is, we should expect another absorbing chase. Join us in 30 minutes."
302,"There was some debate whether SL gambled by not taking the extra spinner, but Maharoof responded well and justified his inclusion. It could have been a lot worse for Australia, if not for their lower order."
303,"That ends a very satisfying bowling performance by Sri Lanka and let's mention the fielding as well. They made up for their lapses from the second final. There was the odd misfield/drop, but their energy in the field helped them come back after Warner blazed away as usual."
304,Welcome back. Jayawardene and Dilshan take position. Stage set for an interesting chase no doubt
305,"Lee to Mahela Jayawardene, no run makes him play straightaway, Jayawardene gets across and softly taps it to the on side"
306,"Lee to Mahela Jayawardene, 2 runs Jayawardene cannot resist on seeing the width, reaches out and flashes over backward point and Doherty slides at square third man and his foot was close to the rope as he pulled it back"
307,"Lee to Mahela Jayawardene, 4 leg byes no chance at cutting this off, strays on the leg stump and he clips it off his pads down to fine leg"
308,"Lee to Mahela Jayawardene, no run nicely punched off the meat of the bat down to mid-on, Dilshan has to hurry back"
309,"Lee to Mahela Jayawardene, no run stays back at the crease and defends down the track"
310,"Lee to Mahela Jayawardene, 2 runs classic flick but unlucky not to get a boundary, pitched up on the pads and he easily clips it over midwicket, the fielder gives the chase"
311,"Doherty to Dilshan, no run one slip in place, he rocks back and punches it to the off side"
312,"Doherty to Dilshan, FOUR runs drops it short and wide and Dilshan gives it a thrash past backward point"
313,"Doherty to Dilshan, no run gives the charge and pushes it to the off side"
314,"Doherty to Dilshan, no run gets beside the line and steers it to the off side"
315,"Doherty to Dilshan, no run chips down the track and tries to mow that past mid-off but can't beat the fielder"
316,"Doherty to Dilshan, FOUR runs forced away, Doherty drifts on middle and leg and Dilshan gets on his knee quickly and hammers it along the ground down to fine leg"
317,"Lee to Mahela Jayawardene, FOUR runs Jayawardene shows a lot of intent there by stepping down the pitch and hammering a length ball in front of square, past cover"
318,"Lee to Mahela Jayawardene, no run Jayawardene stays back at the crease and defends, Lee mumbles something to him but Mahela laughs it off"
319,"Lee to Mahela Jayawardene, 2 runs he goes for the chip over midwicket again and he clears the fielder comfortably, turns the face of the bat a bit too much and hence didn't time it as well"
320,"Lee to Mahela Jayawardene, 1 run full on the pads and he elegantly works it straight to to the deep midwicket fielder"
321,"Lee to Dilshan, no run shows the full face of the bat and neatly pushes it to mid-on"
322,"Doherty to Mahela Jayawardene, no run gets forward and pushes it to the off side"
323,"Doherty to Mahela Jayawardene, no run this one beats him! Nearly takes the outside edge, bit of turn there"
324,"Doherty to Mahela Jayawardene, 1 run floated on the pads and he clips it behind square"
325,"Doherty to Sangakkara, 1 wide sprays it down the leg side as he tries to flick it away"
326,"Doherty to Sangakkara, FOUR runs crisply timed cover drive, Doherty tosses it up outside off and he drives well wide of the close-in fielder"
327,"Doherty to Sangakkara, no run turns the face of the bat and clips it to the leg side"
328,"Doherty to Sangakkara, FOUR runs almost an action replay of the previous boundary, full and tossed up, he drives past the covers and it speeds away"
329,"Lee to Mahela Jayawardene, no run gets behind the line and defends solidly again"
330,"Lee to Mahela Jayawardene, 1 wide Lee bangs it in short and it sails over the batsman who doesn't offer a shot, he's penalised for it though"
331,"Lee to Mahela Jayawardene, no run hits a good length on the off stump and he defends down the track"
332,"Lee to Mahela Jayawardene, 1 run fullish on the pads and he clips it down to square leg"
333,"Lee to Sangakkara, 3 runs another pleasing straight drive, shows the full face and beats mid-off, the straight boundaries are long"
334,"Lee to Mahela Jayawardene, 1 run gets beside the line and steers him wide of backward point"
335,"Lee to Sangakkara, 1 run slower ball on a full length outside the off stump and he pushes it wide of mid-off"
336,"McKay to Sangakkara, no run fullish in length on the off stump and he pushes it to mid-on"
337,"McKay to Sangakkara, 3 runs on the pads and elegantly clipped in front of square on the on side, i think it was Forrest who picked it up at the edge of deep midwicket and relayed it to Mike Hussey"
338,"McKay to Mahela Jayawardene, no run slightly slower in pace and he gently tucks it to midwicket"
339,"McKay to Mahela Jayawardene, no run good length outside off and he gets across and pushes it cover"
340,"McKay to Mahela Jayawardene, no run gets across and checks his shot to midwicket"
341,"McKay to Mahela Jayawardene, no run shuffles across and defends with soft hands to the off side"
342,"Lee to Sangakkara, FOUR runs Lee drops it short and Sanga makes him pay for that length, it was quick on the body and he swiveled and clubbed that behind square on the on side"
343,"Lee to Chandimal, no run gets him on the backfoot straight away to defend"
344,"Lee to Chandimal, FOUR runs brings up the fifty with a booming cut! Short and wide and it appeared as it third man would mop that up but it was too quick for him, down to deep point"
345,"Lee to Chandimal, no run Lee pitches it up and has Chandimal poking forward and the ball sneaks past the face of the bat"
346,"Lee to Chandimal, 1 run cut away again but third man is square enough to cut that off"
347,"McKay to Chandimal, no run and now there is a spring in the step. The ball pitches outside the off stump and Chandimal is hit outside the line too. Every fielder in the circle appeals"
348,"McKay to Chandimal, no run comes forward and defends it to cover"
349,"McKay to Chandimal, OUT and there is no escaping the dreaded finger this time around! Fuller ball on the off and middle line. Chandimal leans across and looks to flick it. He misjudges the length and is struck on the pads.The umpire doesn't waste a second in raising the index finger. Sri Lanka does need the batting de"
350,"McKay to Thirimanne, no run comes forward and pushes it to the off side"
351,"McKay to Thirimanne, no run on the leg stump. Thirimanne turns it to short fine-leg"
352,"McKay to Thirimanne, no run comes forward and pushes it to the cover fielder. A maiden over"
353,"Watson to Mahela Jayawardene, no run comes forward and defends a good length ball to cover"
354,"Watson to Mahela Jayawardene, no run fuller ball on the off stump. Jayawardene leans forward and pushes it to mid-on. Exactly the kind of the shot that Chandimal was looking to play"
355,"Watson to Mahela Jayawardene, 1 run turns it to the leg side for a single"
356,"Watson to Thirimanne, no run fuller ball outside the off stump. Thirimanne defends it back onto the pitch"
357,"Watson to Thirimanne, no run fuller ball outside the off stump. Thirimanne drives it to the short cover fielder"
358,"Watson to Thirimanne, no run good length ball outside the off stump. Thirimanne comes forward and pushes it back to the bowler. A good first over by the captain then"
359,"McKay to Mahela Jayawardene, no run gets across and defends this solidly down the track"
360,"McKay to Mahela Jayawardene, no run drifts on the pads and McKay is lucky the flick didn't beat short fine leg"
361,"McKay to Upul Tharanga, no run full and swinging away and he pushes it softly to the off side"
362,"McKay to Upul Tharanga, 1 run drifts on the pads and he gently clips that down to square leg"
363,"McKay to Thirimanne, 1 run drifts on the pads again and he easily works it wide of midwicket"
364,"Watson to Thirimanne, no run"
365,"Watson to Thirimanne, no run he reaches out to drive a full delivery but checks his chot"
366,"Watson to Thirimanne, 1 run he opens the face of the bat and steers him down to point"
367,"Watson to Upul Tharanga, no run bangs it in short and he it's a very quick bouncer which he ducks to evade"
368,"Watson to Upul Tharanga, 1 run nicely cut away past backward point, third man picks up"
369,"Watson to Thirimanne, no run gets across and solidly pushes this one down to short cover"
370,"Lyon to Upul Tharanga, no run bowls it quick and Tharanga defends solidly"
371,"Lyon to Upul Tharanga, no run Tharanga gives the charge and luckily for him the ball lands in front of mid-on, not the smartest move"
372,"Lyon to Upul Tharanga, 1 run gets forward and tucks it to the on side"
373,"Lyon to Thirimanne, no run drives towards cover and tells his partner to wait"
374,"Lyon to Thirimanne, no run gets his front foot across and defends solidly"
375,"Lyon to Thirimanne, 1 run flatter this time and he rocks back and punches it wide of extra cover"
376,"Christian to Thirimanne, no run comes round the wicket and he lands it on a good length, pushes it to the off side"
377,"Christian to Thirimanne, 1 run tries to steer it wide of point but Hussey dives and stops it"
378,"Christian to Upul Tharanga, no run nips back in off the seam from round the wicket and slices him in half and Wade does well to stop it"
379,"Christian to Upul Tharanga, no run close call again as he gets an inside edge on the drive and onto his body"
380,"Christian to Upul Tharanga, no run goes back at the crease and defends down the track"
381,"Christian to Upul Tharanga, no run angles it on the pads and he closes the face of the bat and works it to midwicket"
382,"Lyon to Thirimanne, 1 run comes forward and knocks it just wide of short cover"
383,"Lyon to Upul Tharanga, no run quicker through the air and defended to the off side"
384,"Lyon to Upul Tharanga, no run can't resist giving the charge but he checks his shot, slower in pace"
385,"Lyon to Upul Tharanga, no run gets a bit of turn but he stays back and defends"
386,"Lyon to Upul Tharanga, 1 run drops it wide of cover but they scamper a single"
387,"Lyon to Thirimanne, 1 run gets well forward and defends to the off side"
388,"Christian to Thirimanne, 2 runs full and wide and he flashes at it and clears point, Lyon mops up"
389,"Christian to Thirimanne, no run stays back and defends to the off side"
390,"Christian to Thirimanne, 1 run gets beside the line and steers it to the off side"
391,"Christian to Upul Tharanga, 1 leg bye drifts on the pads and he clips it off his legs to the on side"
392,"Christian to Thirimanne, no run gets across and softly taps it to the off side"
393,"Christian to Thirimanne, no run gets across and pushes it firmly towards mid-on"
394,"Lyon to Upul Tharanga, 1 run goes back at the crease and cuts him wide of backward point"
395,"Lyon to Thirimanne, no run just about manages to cover the line, the ball rolls the off side"
396,"Lyon to Thirimanne, 1 run waits for the turn and then stabs it down to point"
397,"Lyon to Upul Tharanga, no run short and wide and he cuts but the old fox Brett Lee dives at point"
398,"Lyon to Upul Tharanga, 1 run gets well forward and drives wide of cover"
399,"Lyon to Thirimanne, 1 run pushes it just wide of cover point for a single"
400,"McKay to Thirimanne, 1 run short and wide outside off and he gets beside the line and places it to third man"
401,"McKay to Upul Tharanga, no run fullish in length and he mistimes the drive to the on side"
402,"McKay to Upul Tharanga, no run nips back in and he somehow manages to defend it away"
403,"McKay to Upul Tharanga, no run steers it towards point and they decide not to take the single"
404,"McKay to Upul Tharanga, no run nicely punched on the walk down towards short cover"
405,"McKay to Upul Tharanga, no run a touch shorter and a bit wide but he can't squeeze it past the gap at the covers"
406,"Lyon to Thirimanne, no run gets well forward and defends"
407,"Lyon to Thirimanne, no run the leading edge and it just lands short of Lyon!"
408,"Lyon to Thirimanne, 1 run clips it away close to his pads down to deep square leg"
409,"Lyon to Upul Tharanga, 1 run gets forward and paddles it to the on side"
410,"Lyon to Thirimanne, no run comes well forward and drives to the off side"
411,"Lyon to Thirimanne, 1 run Thirimanne gets on his knee early and sweeps it away to the on side"
412,"McKay to Thirimanne, no run chops it straight towards point, he tries to bisect that gap"
413,"McKay to Thirimanne, no run McKay gets him to drive square of the wicket on the off side and he misses it completely, that just missed the edge"
414,"McKay to Thirimanne, 1 run on the pads and it runs down to deep square leg"
415,"McKay to Upul Tharanga, 4 runs nicely driven on the front foot to beat the diving mid-off fielder, he picks the longer boundary and that allows them to run all four"
416,"McKay to Upul Tharanga, no run goes back and pushes it towards extra cover"
417,"McKay to Upul Tharanga, no run stays behind the line and defends solidly"
418,"Lyon to Thirimanne, FOUR runs been a while coming, he bowls it a fraction short and the batsman rocked back at the crease, made room and cut past point and gully"
419,"Lyon to Thirimanne, no run uses his feet and checks his drive back to the bowler"
420,"Lyon to Thirimanne, no run gets forward and pushes it to the off side"
421,"Lyon to Thirimanne, 1 run stays back and clips it against the turn to the on side"
422,"Lyon to Upul Tharanga, 1 run comes forward and drives on the up but it was well wide of extra cover, Wade thought there may have been a chance of a catch"
423,"Lyon to Thirimanne, 1 run gets forward and squeezes it past a diving cover"
424,"Lee to Thirimanne, 1 run Lee comes round the wicket and drifts on the body, gently tucked to the on side for a quick single"
425,"Lee to Upul Tharanga, 1 run stays beside the line and taps it in front of square on the off side"
426,"Lee to Thirimanne, no run Lee bangs it in short and Thirimanne has to fend that off really high on the bat, Lee comes over and has a word with him"
427,"Lee to Thirimanne, 2 runs just checked his on drive but it was good enough to beat a diving mid-on, mid-off runs across and cuts it off"
428,"Lee to Thirimanne, 1 run full outside off and he plays a neat square drive down to sweeper cover"
429,"Lee to Upul Tharanga, 1 run Tharanga ensures he shows the full face of the bat to drive to sweeper cover"
430,"Lyon to Upul Tharanga, 1 run drops it down towards short midwicket and takes a quick single"
431,"Lyon to Thirimanne, 1 run floated on the pads and he clips it down to midwicket"
432,"Lyon to Upul Tharanga, 3 runs cuts but wide of first slip! Rocks back and there's extra bounce, catches the outside edge and flies past Watson"
433,"Lyon to Thirimanne, 1 run comes well forward and works it across the line to midwicket"
434,"Lyon to Upul Tharanga, no run stays back and chops it to the off side"
435,"Lyon to Upul Tharanga, no run clips it to the left of Lyon who stops it"
436,"Lee to Thirimanne, 1 run shuffles and clips it towards midwicket and it brings up the 100, perhaps a lot more laborious than we all expected"
437,"Lee to Upul Tharanga, no run reaches out to cut and he gets an inside edge which rolls to the keeper"
438,"Lee to Upul Tharanga, 1 wide he ducks under that quick bouncer and the umpire penalises him"
439,"Lee to Upul Tharanga, no run nicely punched off the front foot but straight to mid-off"
440,"Lee to Upul Tharanga, no run Lee comes from over the wicket and the batsman places it to point, Warner has a shy at the bowler's end but Christian's there to back the throw"
441,"Lee to Upul Tharanga, no run stays back at the crease and chops it to the off side"
442,"Lee to Upul Tharanga, 1 run drifts on the pads and he clips it down to deep square leg"
443,"Doherty to Upul Tharanga, 4 wide slides it down the leg side and it beats the keeper"
444,"Doherty to Thirimanne, no run this one goes through straight and beats the outside edge!"
445,"Doherty to Thirimanne, no run comes forward and smothers the spin"
446,"Doherty to Thirimanne, no run waits for it and pushes it to midwicket"
447,"Doherty to Thirimanne, no run comes forward and plays it wit soft hands"
448,"Doherty to Thirimanne, no run pushed through quicker and he gets well forward and defends"
449,"Doherty to Thirimanne, no run he clips it down towards midwicket"
450,"Watson to Upul Tharanga, no run loosener on the off stump and he gets across and knocks it to the on side"
451,"Watson to Upul Tharanga, 1 run angles it on the pads and he clips it to the on side"
452,"Watson to Thirimanne, 1 run chips down the track, haven't seen that in a while, he steers it down to third man"
453,"Watson to Upul Tharanga, no run stays behind the line and defends down the track"
454,"Watson to Upul Tharanga, no run tries to squeeze that past the off side field but can't beat Warner at point"
455,"Watson to Upul Tharanga, 1 run short delivery and he's not afraid to pull, importantly he keeps it along the ground and down to deep midwicket"
456,"Doherty to Upul Tharanga, 1 run comes well forward and drives him down to long-on"
457,"Doherty to Thirimanne, 1 run gets right across his stumps and paddles it to the leg side"
458,"Doherty to Upul Tharanga, no run close call for Tharanga as he gives the charge and nearly scoops it on the full to Watson at mid-off!"
459,"Doherty to Upul Tharanga, no run turn this time, he sticks his leg out and pads it away"
460,"Doherty to Upul Tharanga, no run comes well forward and clips it to the on side"
461,"Doherty to Upul Tharanga, 1 run drives to sweeper cover and escapes Nelson"
462,"Watson to Upul Tharanga, no run full on the pads and clipped to the on side"
463,"Watson to Upul Tharanga, 1 leg bye full on the pads and he clips it with his legs to deep square leg"
464,"Watson to Thirimanne, no run fullish on the off stump and he drives him down to mid-off"
465,"Watson to Kapugedera, no run good length on the off stump and Kapugedera leaves it alone"
466,"Watson to Kapugedera, no run gives him width and he chops it down hard towards point"
467,"Doherty to Upul Tharanga, no run driven hard down the track straight to the bowler"
468,"Doherty to Upul Tharanga, no run stays back and clips it back to the bowler"
469,"Doherty to Upul Tharanga, no run turns it back in and he works it to the on side"
470,"Doherty to Upul Tharanga, 1 run places it to midwicket and takes a single"
471,"Doherty to Kapugedera, 1 run gets well forward and drives towards cover"
472,"Doherty to Upul Tharanga, no run clips it straight to midwicket"
473,"Watson to Kapugedera, 1 run fullish on the off stump and he steers it down to point"
474,"Watson to Upul Tharanga, no run fullish on the off stump and he drives him down to mid-off"
475,"Watson to Upul Tharanga, no run gets across and clips him down towards midwicket"
476,"Watson to Upul Tharanga, no run stays beside the line and chops it straight towards Warner at point"
477,"Watson to Upul Tharanga, 1 run fullish outside the off stump and he drives him down to sweeper cover"
478,"Watson to Kapugedera, no run bangs it in short and he bends his knee and evades it"
479,"Doherty to Upul Tharanga, FOUR runs that's a pleasing shot, Tharanga comes down the track and ensured he hit it hard enough to beat extra cover and Hussey has no chance of cutting it off"
480,"Doherty to Upul Tharanga, no run defends back to the bowler"
481,"Doherty to Upul Tharanga, no run comes down the track and squirts it back to the bowler"
482,"Doherty to Upul Tharanga, 1 run run-out appeal! They take a quick single towards square leg and Kapugedera's dive saved him, Wade whipped off the bails and the 3rd umpire had a look"
483,"Doherty to Kapugedera, no run gets on the front foot and defends back to the bowler"
484,"Doherty to Kapugedera, 1 run he sweeps but a trifle late, manages to get bat on it"
485,"Christian to Kapugedera, 1 run short outside the off stump and he opens the face and runs it down to third man"
486,"Christian to Upul Tharanga, no run gets on the front foot and drives towards cover"
487,"Christian to Upul Tharanga, 1 run the slower ball and he places it just wide of cover"
488,"Christian to Kapugedera, 1 run opens the face of the bat and steers it down to backward point"
489,"Christian to Upul Tharanga, no run"
490,"Christian to Upul Tharanga, 1 run nicely placed, just opened the face of the bat and steered it wide of point"
491,"Lyon to Upul Tharanga, FOUR runs Lyon makes the mistake of dropping short again, Tharanga rocks back and cuts wide of cover point, squeezed it past quite a narrow gap, well placed"
492,"Lyon to Upul Tharanga, no run gets well forward and defends"
493,"Lyon to Upul Tharanga, 2 runs gets forward and drives just wide of the diving short cover fielder, SL need less than 100 now"
494,"Lyon to Upul Tharanga, 1 run gets on the front foot and drives to long-off"
