,Data
495,"Lyon to Kapugedera, no run some turn for Lyon, he gets forward and defends to the on side"
496,"Lyon to Kapugedera, no run gets on the front foot and defends"
497,"Christian to Upul Tharanga, no run sharp bouncer from Christian, had Tharanga ducking under that one"
498,"Christian to Upul Tharanga, no run gets on the front foot and drives him to cover"
499,"Christian to Upul Tharanga, no run angles it on the pads and he clips it down towards midwicket"
500,"Christian to Upul Tharanga, no run sliced towards point and a slight blooper from Warner as he slips after collecting the ball"
501,"Christian to Upul Tharanga, no run stays beside the line and slices it down to cover point"
502,"Christian to Upul Tharanga, no run tries to force the pace after five dot balls and he ends up slicing it to Warner again"
503,"Lyon to Kapugedera, no run gets well forward and defends to the off side"
504,"Lyon to Kapugedera, 1 run chips down the track and drives to long-off"
505,"Lyon to Upul Tharanga, 1 run flighted on middle and he drives him down to long-off"
506,"Lyon to Kapugedera, 1 run Kapugedera doesn't mind using his feet, he forces this down to long-on"
507,"Lyon to Upul Tharanga, 1 run worked wide of mid-on for a quick single"
508,"Lyon to Kapugedera, no run gets well forward and knocks it to the leg side"
509,"Christian to Upul Tharanga, no run gets across and clips it with soft hands to the on side"
510,"Christian to Upul Tharanga, no run"
511,"Christian to Upul Tharanga, no run plays it late and cuts quite close to the body, places it straight to point"
512,"Christian to Upul Tharanga, 1 run Tharanga's doing the right thing by keeping it along the ground, he squirts it out to deep cover"
513,"Christian to Kapugedera, no run that's a very good yorker from Christian and he had Kapugedera in a tangle as he squirted that out"
514,"Christian to Kapugedera, no run squeezes out a tight yorker outside off and it was well fielded by point"
515,"McKay to Upul Tharanga, no run nips back in and skids off the pitch and he gets an inside edge"
516,"McKay to Upul Tharanga, no run McKay really tucks him up for room, on middle stump and all he can do is knock it down the pitch"
517,"McKay to Upul Tharanga, no run this time he beats him outside the off stump, Tharanga tries to run it down to third man"
518,"McKay to Upul Tharanga, 3 leg byes SL will want more of those, half volley on the pads and the ball clipped his pads and raced past short fine leg"
519,"McKay to Kulasekara, 1 run Kula gets across the stumps and clips it to the on side for a single"
520,"Lee to Kulasekara, no run fullish on middle and leg and he digs it out to mid-on"
521,"Lee to Kulasekara, FOUR runs Kula's not going to waste too much time, the ball it pitched up on middle and off and he has the room to bash that down the pitch and past mid-on"
522,"Lee to Kulasekara, 3 runs tries to repeat that through the off side and this time mid-on runs across and gets a hand to it and parries it to the deep on the off side"
523,"Lee to Upul Tharanga, no run squeezes out a full down towards point"
524,"Lee to Upul Tharanga, FOUR runs Tharanga goes over the infield! Pitched up on middle and off and he clips over midwicket, pretty effortless, the field is up"
525,"Lee to Upul Tharanga, 1 run forces a full delivery wide of mid-off for a single, 12 from the over"
526,"McKay to Upul Tharanga, 2 runs drifts on the pads and he works him behind square on the on side and they race through for a couple"
527,"McKay to Upul Tharanga, 1 run fired in on the pads and Tharanga gets to his fifty with a single to the leg side, it's been a very hardworking knock. Rewarding? Let's wait and see"
528,"McKay to Kulasekara, 1 run good slower ball and Kula wisely keeps it out by clipping it to the on side for a single"
529,"McKay to Upul Tharanga, no run well bowled by McKay, round the wicket and he doesn't give him the space to hit, all he can do is quiet"
530,"McKay to Upul Tharanga, 1 run full on middle and leg and he mows it along the ground to square leg"
531,"McKay to Kulasekara, 1 run looked like another slower one which had Kula is a moment of anxiety, he wanted to force it down the ground but checked his shot and ended up spooning it to safety at cover"
532,"Lee to Kulasekara, FOUR runs shots like this will get that dug out on their feet! He fearlessly makes room outside off and biffs a square drive that bisects the gap between cover point and cover"
533,"Lee to Kulasekara, 5 wide big lapse from Lee as he sprays this one wide down the leg side and beats the diving Wade, can't blame the keeper at all"
534,"Lee to Kulasekara, 1 run good yorker by Lee and well dug out by Kula to the on side, they scamper the single"
535,"Lee to Upul Tharanga, 1 run Tharanga gets some awkward bounce there, he wasn't quick enough to get his arm out of the way as the ball dribbled to the leg side"
536,"Lee to Kulasekara, no run makes room and plays another spanking square drive but straight to extra cover"
537,"Lee to Maharoof, no run full on middle and leg and he forces it down to midwicket"
538,"McKay to Upul Tharanga, no run chance for Tharanga to send that down to fine leg but he ends up hitting it with his glove, the keeper collects it"
539,"McKay to Upul Tharanga, no run good length on the stumps and he knocks it to the off side"
540,"McKay to Upul Tharanga, no run once again he's cramped for room as he stays back and knocks it back to the bowler"
541,"McKay to Upul Tharanga, 1 run gets behind the line and clips it to mid-on, the Powerplay's coming to an end"
542,"McKay to Maharoof, 1 run stays beside the line and steers it to the off side"
543,"McKay to Upul Tharanga, no run cramps him for room and all he can do is knock it back to the bowler"
544,"Christian to Maharoof, 1 run gets beside the line and he punches it towards sweeper cover"
545,"Christian to Upul Tharanga, no run Christian does well to cramp him up again, knocked back to the bowler"
546,"Christian to Upul Tharanga, no run"
547,"Christian to Upul Tharanga, no run bangs it in short and Tharanga waits in hope for the wide call but the umpire doesn't budge"
548,"Christian to Upul Tharanga, 2 runs steers it to the sweeper square on the off side and they push the second run, the throw was wide"
549,"Christian to Upul Tharanga, 1 run he opens the face and runs it down to third man"
550,"Doherty to Upul Tharanga, 2 runs excellent running as it puts pressure on the fielder, he softly knocks it towards long-on and takes the first run quickly"
551,"Doherty to Upul Tharanga, SIX runs well well! Tharanga gives him the charge and lofts him crisply over extra cover, just clears the rope"
552,"Doherty to Upul Tharanga, no run pushes it firmly to the off side"
553,"Doherty to Upul Tharanga, no run run-out chance! He makes room and chops it to the off side, the fielder at cover point fires the throw at the bowler's end on seeing Maharoof struggle, Doherty fails to cover it"
554,"Doherty to Upul Tharanga, 1 run clips it down towards midwicket for a single"
555,"Doherty to Maharoof, no run"
556,"Christian to Upul Tharanga, no run Tharanga gets a bit of width outside the off stump and he ends up chopping it to the off side"
557,"Christian to Upul Tharanga, 1 run slices it just wide of cover point for a single"
558,"Christian to Maharoof, no run half volley on the pads and he clips it straight to midwicket"
559,"Christian to Maharoof, 1 run fullish on the pads and he clips it down to mid-on and a fumble allows a single"
560,"Christian to Upul Tharanga, 1 run Tharanga chops it down to sweeper cover"
561,"Christian to Maharoof, 1 run nicely clipped off the pads and Maharoof takes a single to wide long-on"
562,"Doherty to Maharoof, 1 run makes room and chops it towards cover point and Hussey fumbles, the nerves are getting to everyone"
563,"Doherty to Upul Tharanga, 1 run full and wide outside off and driven safely to sweeper cover"
564,"Doherty to Maharoof, FOUR runs and shots like that make it easier....floated on middle and leg and he sweeps hard and along the turf behind square on the on side, the fielder had no chance"
565,"Doherty to Maharoof, no run driven firmly but well stopped by Mike Hussey at cover"
566,"Doherty to Maharoof, no run driven down the track and the bowler shows good commitment by stopping it"
567,"Doherty to Maharoof, 1 run he drills this one wide of the bowler, down to long-on"
568,"Christian to Maharoof, 1 run it's short of a length and Maharoof pulls and he times it well but Lyon does well at deep square leg to cut it off"
569,"Christian to Upul Tharanga, 1 run good running! He drops it with soft hands down to cover and sets off, fielders on their toes"
570,"Christian to Maharoof, 1 run Maharoof also does the sensible thing by dropping it to the off side for a quick single, good backing up for the throw"
571,"Christian to Upul Tharanga, no run a dot ball! Christian fires a yorker outside off and Tharanga can't squeeze it out"
572,"Christian to Upul Tharanga, 1 run full on middle and leg and he clips it to square leg"
573,"Christian to Maharoof, no run crisp straight drive but Christian takes some miles off the ball, saved at least two there"
574,"Watson to Upul Tharanga, no run nice punchy drive off the front foot but straight to short cover"
575,"Watson to Upul Tharanga, 1 run stays beside the line and squirts it wide of sweeper cover"
576,"Watson to Maharoof, no run Maharoof misses a boundary opportunity! Drifts on the pads and the ball clips his pads and dribbles to the keeper"
577,"Watson to Maharoof, no run swing and a miss and Maharoof plays out another dot ball"
578,"Watson to Maharoof, 1 run doesn't try anything brave this time, decides to punch this down the ground to long-on"
579,"McKay to Maharoof, 1 run slower ball and a touch short and Maharoof thinks of clubbing it away and ends up flat batting it down the track"
580,"McKay to Herath, no run Herath shuffles across his stumps to work that away but the ball clips his pads and dribbles down the track"
581,"McKay to Malinga, no run the slower ball and Malinga nearly spoons it to the keeper! We've seen so many slower ones today"
582,"McKay to Malinga, 1 run chipped in the air as he tries to work it to the on side, Sri Lanka live to fight another delivery"
583,"McKay to Maharoof, 1 run short and pulled and there are two fielders patrolling the deep on the on side to pick that up, Australia really applying the choke"
584,"Watson to Maharoof, no run Maharoof takes a bit off his bat, literally! He tries to dig out a full delivery and jams the ball on the pitch, a big chunk off the toe of the bat goes flying"
585,"Watson to Maharoof, 1 run makes room to slam that away and he ends up mowing it along the ground to long-on"
586,"Watson to Malinga, no run the yorker outside the off stump is too good for Malinga to dig out"
587,"Watson to Malinga, 1 run steps down the track and tries to hoick it over the on side and he ends up mistiming it"
588,"Watson to Maharoof, 1 run another desperate heave and Maharoof can only just beats the bowler"
589,"Watson to Malinga, no run pounced down towards long-on but Maharoof refuses the single"
590,"McKay to Maharoof, 1 run Maharoof makes room and slams a length delivery straight to sweeper cover, not much pace on the ball to work with"
591,"McKay to Malinga, no run Malinga's chopping wood but making no contact, these slower balls are annoying the batsmen no end"
592,"McKay to Malinga, FOUR runs he made contact this time and good one too! Swings this one past square leg and it beats the man in the deep, raw power"
593,"McKay to Malinga, no run that slower ball again! Ever considered walking down the track? Swish and yet another miss"
594,"There will be an extended presentation today, given it's the final. It's these middling totals that make ODI cricket more watchable. Sri Lanka's resurgence has also made this tournament more watchable, and of course Kohli's blinder, which gave the final league game some context."
595,"McKay's showing has added to the depth to Australia's bowling attack, with Pattinson and Cummins around. In the final analysis, it brings to an end a very rewarding home season after the Ashes drubbing last year."
596,"So Australia go to Windies, Sri Lanka go to Bangladesh. And the rest of us go home. Thanks for joining us today. Sri Lanka, don't despair. You did great getting to the finals despite all the off-field tension about payments. Continue the good work. Cheers!"
597,Australia pose with the trophy. That ends the Australia home season. Will they revert to the tri-series concept? Nobody knows.
598,Presentation time:
599,Australia won by 16 runs
600,"Player of the match is Clint McKay, AUS"
