,Data
252,"Kallis to Clarke, 1 run change of pace, 121ks, lands on a length and Clarke defends with soft hands, then calls Johnson through immediately as the ball trickles to the off side"
253,"Kallis to Johnson, 2 runs another firm shot of the back foot, played away just wide of Amla in the covers and he sprints back for the second that raises a second Test half-century, well played"
254,"Ntini to Siddle, no run a good delivery, pitching and straightening and Siddle edges off the back foot but the ball drops well short of a tumbling Boucher, so the frustration continues"
255,"Ntini to Siddle, 1 run now its a fuller length and he defends it back past the stumps"
256,"Ntini to Hauritz, no run overpitched and he drives on the up to mid-off, a firm stroke there"
257,"Ntini to Hauritz, no run goes back and across and dabs the ball to midwicket"
258,"Ntini to Hauritz, FOUR runs uff, look at that shot! Ntini drops fractionally short and Hauritz pulls him to the midwicket boundary, isn't he enjoying himself?"
259,"Ntini to Hauritz, 2 runs slants in with the angle and he nudges it wide of midwicket now"
260,"Morkel to Siddle, no run pitches on a length and thats a more conservative approach, defending"
261,"Morkel to Siddle, no run better length, sucking him into a drive outside off and beating the bat"
262,"Morkel to Siddle, no run flirts with a rising short delivery, looking to uppercut, but misses out"
263,"Morkel to Siddle, 1 run onto the front foot to pinch a single into the off side"
264,"Morkel to Hauritz, no run pins him on the back foot but he defends with confidence to the off side"
265,"Morkel to Hauritz, no run swing and a miss to one pitched fractionally fuller"
266,"Harris to Siddle, no run drifts in and beats the bat, ball balloons up to forward short leg"
267,"Harris to Siddle, no run slides down the pads and some nifty glovework from Boucher there"
268,"Harris to Siddle, OUT the fun ends as Harris gets into the action, flighting one on about middle stump, straightening it , and catching Siddle in front after he misses a big heave"
269,"Harris to Bollinger, no run flighted outside off, spins in and Bollinger offers no shot"
270,"Harris to Bollinger, no run tossed up on middle and off and he turns it to short leg"
271,"Harris to Bollinger, no run flashes at a shorter one and cannot connect"
272,"Morkel to Hauritz, no run 132ks, well-directed short ball and he ducks under it"
273,"Morkel to Hauritz, FOUR runs smacked! Hauritz exposes his sticks and flat-bats that past extra cover"
274,"Morkel to Hauritz, no run now its a full toss, he again clears the left leg and slashes to mid-off"
275,"Morkel to Hauritz, 1 run backs away to leg stump and then takes his eyes off a short ball, copping it on the back end of the middle of the bat and the edge runs away fine"
276,"Morkel to Bollinger, no run from around the stumps, on a length and he defends watchfully"
277,"Morkel to Bollinger, no run short ball down leg stump and Bollinger flinches as it passes by"
278,"Harris to Hauritz, no run dances down and drives to a fumbling short cover"
279,"Harris to Hauritz, OUT and he's gone, skipping down and swiping across the line to midwicket"
280,""" target=""_blank"">quotes from the series for you to peruse."
281,"By the way, we've assembled a selection of"
282,"""According to the ABC radio commentators out here at the SCG, Steyn has a badly bruised left heel. Trouble for their second innings?"" says Ed McGregor."
283,"2.35pm. A good innings from Hauritz, his personal best, gets Australia to 445. The tail wagged, and how, after a 142-run stand between centurion Clarke and half-centurion Johnson put Australia on top. Don't go very far because South Africa will come"
284,Should be the last over of the session.
285,"Johnson to Boucher, no run loose delivery, very full past off stump and Boucher leaves"
286,"Johnson to Boucher, 1 run hops up and turns a shorter one down to fine leg for a single"
287,"Johnson to Duminy, no run nips back in from a full length and Duminy pushes it back"
288,"Johnson to Duminy, no run sits up from a crack at 142.3ks and surprises Duminy, who gets rapped on the knuckles"
289,"Johnson to Duminy, no run short of a length again and he turns it to square leg"
290,"Johnson to Duminy, 2 runs slips in the attempted yorker but Duminy turns it away for a couple"
291,"Siddle to Boucher, no run hits a good length to bring Boucher forward and defending"
292,"Siddle to Boucher, no run some shape back in and Boucher gets in line to defend"
293,"Siddle to Boucher, no run good bowling this, subtle movement back in and Boucher has to defend"
294,"Siddle to Boucher, no run slants back in off a length, staying low, and Boucher keeps it out"
295,"Siddle to Boucher, no run swings in a full delivery and Boucher inside-edges the attempted flick"
296,"Siddle to Boucher, no run comes onto the front foot and defends to cover, rounding off a maiden"
297,"Johnson to Duminy, no run full and nipping back into Duminy, who turns it to midwicket"
298,"Johnson to Duminy, no run pitches on middle and reverses back and Duminy defends to leg"
299,"Johnson to Duminy, no run full and wide and moving the other way, so Duminy shoulders arms"
300,"Johnson to Duminy, no run back of a length and straightening and Duminy sticks to defending"
301,"Johnson to Duminy, no run pitches two feet outside off stump so Duminy raises the arms"
302,"Johnson to Duminy, no run leans into an off drive but inside-edges the other side of the pitch"
303,"Siddle to Boucher, no run nips back in off a length and Boucher gets another inside edge"
304,"Siddle to Boucher, no run short of a length and slanting in with the angle, Boucher defends"
305,"Siddle to Boucher, no run fuller, just a tad, and Boucher defends off the front foot"
306,"Siddle to Boucher, no run makes sure to cover off stump before he defends a length delivery"
307,"Siddle to Boucher, no run fuller and tailing back in from wide but Boucher raises the bat to leave"
308,"Siddle to Boucher, FOUR runs attempted yorker swings too much and Boucher clips it through midwicket for the first boundary after the luncheon interval"
309,"Johnson to Duminy, no run pitches on a good length and Duminy pushes it back with a full face"
310,"Johnson to Duminy, no run holds back the length and Duminy jumps up to defend"
311,"Johnson to Duminy, no run 143ks, short and lifting rapidly but Duminy leaves it alone"
312,"Johnson to Duminy, no run short again, doesn't sit up as much and Duminy keeps it out"
313,"Johnson to Duminy, 1 run clips a full and swinging delivery off his pads through square leg"
314,"Johnson to Boucher, no run full outside leg stump and Boucher turns it to midwicket"
315,"Siddle to Duminy, no run hits a length to bring a committed Duminy onto the front foot in defence"
316,"Siddle to Duminy, no run again a fullish length to bring him forward on the drive to cover"
317,"Siddle to Duminy, no run bowled from wide of the crease, slants in and Duminy defends"
318,"Siddle to Duminy, no run 145.3ks, pitches full and wide and Duminy shoulders arms"
319,"Siddle to Duminy, no run back to short of a length and Duminy hops back to defend"
320,"Siddle to Duminy, no run some zip on that one and its strikes Duminy, inching forward, awkwardly"
321,"Johnson to Boucher, no run full in the blockhole and Boucher pushes it to the off side"
322,"Johnson to Boucher, no run pitches one short to follow-up and Boucher defends down to point"
323,"Johnson to Boucher, no run bowls one wide and Boucher chases only to get beaten by swing"
324,"Johnson to Boucher, no run short outside leg stump and he shuffles to defend to midwicket"
325,"Johnson to Boucher, no run starts off with a full toss, which Boucher pats down to mid-on"
326,"Johnson to Boucher, 1 run full on the stumps and he plays it away to the on side"
327,"Hauritz to Boucher, no run pushes forward to a tossed up delivery on off stump"
328,"Hauritz to Boucher, no run too full and he reaches forward to chip the ball towards midwicket"
329,"Hauritz to Boucher, 1 run turns down leg stump, turned fine and Hussey slides to collect"
330,"Hauritz to Duminy, no run tossed up and it drifts into Duminy, who defends watchfully"
331,"Hauritz to Duminy, no run this one turns away and he shoulders arms against the turn"
332,"Hauritz to Duminy, 2 runs drifts down leg stump so Duminy clips if off the pads"
333,"Johnson to Boucher, no run angles in from wide of the crease and Boucher covers off before defending"
334,"Johnson to Boucher, no run short of a length and he gets back in the crease to defend"
335,"Johnson to Boucher, no run short of a length again and Boucher defends"
336,"Johnson to Boucher, 3 runs gets a shorter one and he pulls from outside off stump through square"
337,"Johnson to Duminy, 5 wide thats a short delivery that hits a crack and swings down very wide of leg stump and Haddin hadn't a chance of stopping that ... Johnson knows its not his fault"
338,"Johnson to Duminy, OUT good delivery to get Duminy! After the short ball comes the fuller delivery, swinging in quite late from outside off stump and raps him on the back leg in line with the sticks"
339,"Johnson to Morkel, no run pitches full and wide and Morkel allows it pass"
340,"Hauritz to Boucher, no run flighted up on the stumps and he defends it back"
341,"Hauritz to Boucher, 1 run comes across and turns the ball away for a single"
342,"Hauritz to Morkel, no run some turn to lure Morkel forward and then beat the bat"
343,"Hauritz to Morkel, no run slips in a quicker, flatter one in the blockhole and he jams it out"
344,"Hauritz to Morkel, no run tossed up full and Morkel smothers any turn he was anticipating"
345,"Hauritz to Morkel, no run another tossed up, tidy delivery which Morkel defends back"
346,"Johnson to Boucher, no run slides in a slower ball, full and wide but Boucher isn't interested"
347,"Johnson to Boucher, 2 runs swings into the pads and Boucher collects a brace through midwicket"
348,"Johnson to Boucher, 2 runs dragged down short and Boucher works it wide of Siddle at midwicket"
349,"Johnson to Boucher, 1 run short of a length outside leg stump, he shuffles and turns it away"
350,"Johnson to Morkel, no run pitches on a length and he defends it back"
351,"Johnson to Morkel, no run on the stumps and he defends to the on side"
352,"Hauritz to Boucher, no run tossed up outside off stump and Boucher defends to the on side"
353,"Hauritz to Boucher, no run gets a long way forward to defend"
354,"Hauritz to Boucher, no run turns back in from outside off, Boucher gets well across the stumps in an attempt to work the ball to the leg side but gets an inside edge instead"
355,"Hauritz to Boucher, no run tossed up and defended"
356,"Hauritz to Boucher, no run a fraction shorter and wider and he pushes the ball to cover"
357,"Hauritz to Boucher, no run hops across to outside off stump and defends this one back"
358,"Johnson to Morkel, no run short and wide and rising and Morkel doesn't offer a shot"
359,"Johnson to Morkel, no run gets back in the crease to defend solidly to Clarke in the off side"
360,"Johnson to Morkel, no run short of a length and Morkel defends off the back foot"
361,"Johnson to Morkel, no run shorter and he hops up and defends watchfully"
362,"Johnson to Morkel, no run pitches fuller now and its wide enough for Morkel to leave"
363,"Johnson to Morkel, no run pushes off the front foot and inside-edges back past leg stump"
364,"Hauritz to Boucher, 2 runs pushes forward and gets an edge that slips wide of Hayden at slip and that raises the 200 for South Africa"
365,"Hauritz to Boucher, FOUR runs now thats a long hop that Boucher hammers over midwicket's head"
366,"Hauritz to Boucher, 1 run tossed up much fuller and slower, Boucher clips wide of midwicket"
367,"Hauritz to Morkel, no run tosses it up and turns it past Morkel's attempt at a cover drive"
368,"Hauritz to Morkel, no run drifts this one back into Morkel, who presses forward and defends"
369,"Hauritz to Morkel, 1 run gets off the mark with a controlled sweep shot through square"
370,"Johnson to Morkel, no run pitches and deviates so late that it beats Morkel's back-foot drive"
371,"Johnson to Morkel, no run short of a length and he gets behind the ball to defend"
372,"Johnson to Morkel, 1 run a bit too straight and he tickles it off the pads behind square"
373,"Johnson to Boucher, no run pitches full and he comes onto the front foot and defends"
374,"Johnson to Boucher, no run hits a better length and he again defends to the off side"
375,"Johnson to Boucher, no run comes forward and defends to cover"
376,"Hauritz to Morkel, no run tossed up and he defends tightly back to Hauritz"
377,"Hauritz to Morkel, no run once more Morkel marries bat and pad and defends it back"
378,"Hauritz to Morkel, no run he leaves that one be because its tossed up much wider"
379,"Hauritz to Morkel, no run tossed up on leg stump and Morkel defends"
380,"Hauritz to Morkel, no run strides well forward and defends to the off side"
381,"Hauritz to Morkel, no run good drift into leg stump and he defends it watchfully"
382,"Johnson to Boucher, no run 142.8ks, lands back of a length and he defends to the off side"
383,"Johnson to Boucher, no run fuller to bring him forward this time, defending very solidly"
384,"Johnson to Boucher, no run overpitched outside off stump and he steers the ball to Clarke at point"
385,"Johnson to Boucher, no run full and wide and he shoulders arms this time"
386,"Johnson to Boucher, no run full on about off stump and Boucher punches the ball to cover"
387,"Johnson to Boucher, 1 run pitches short of a length and Boucher turns it sharply to midwicket"
388,"Hauritz to Boucher, no run pitches short and Boucher turns the ball to the man at midwicket"
389,"Hauritz to Boucher, no run thats much wider and so he doesn't offer a shot"
390,"Hauritz to Boucher, no run pushes Boucher on the back foot and he defends resolutely"
391,"Hauritz to Boucher, no run slows the pace and gives it a tweak, it dips and Boucher defends"
392,"Hauritz to Boucher, no run how did that one not dislodge the bails? Hauritz tosses it up, Boucher shuffles to clip towards midwicket, the ball sneaks back in and cannons into the base of leg stump but the bails do not come off, instead one wo"
393,"Hauritz to Boucher, no run comes well forward to conservatively defend this time"
394,"Bollinger to Morkel, no run pitches wide and deviates away and Morkel leaves it be"
395,"Bollinger to Morkel, no run even wider, swinging late, and Morkel chases it loosely to be beat"
396,"Bollinger to Morkel, no run fuller in length and Morkel drives towards midwicket"
397,"Bollinger to Morkel, 2 runs much shorter and Morkel hops up, getting a leading edge past cover"
398,"Bollinger to Morkel, 2 leg byes a bouncer now, which Morkel goes to pull but he takes his eyes off it and the ball clips his helmet and runs wide of backward point and they scamper leg byes"
399,"Bollinger to Morkel, no run fuller in length and Morkel does well to push it back to Bollinger"
400,"Siddle to Boucher, no run overpitched but Boucher miscues the off drive to the man at cover"
401,"Siddle to Boucher, no run goes for a pull shot but the ball wasn't short enough and Boucher cops it in the midriff, that'll sting"
402,"Siddle to Boucher, FOUR runs now he connects, and well too, reaching out to a rank wide long hop and slashing up and over gully to third man"
403,"Siddle to Boucher, no run better delivery, forcing a defensive shot off the back foot to Hussey at gully"
404,"Siddle to Boucher, no run pitches fuller outside off stump and Boucher leaves it be"
405,"Siddle to Boucher, no run reaches out to pull a short ball but ends up chopping to mid-on"
406,"Bollinger to Morkel, FOUR runs a loose drive outside the off stump, away from the body, results in a thick outside edge that flies between third slip and gully"
407,"Bollinger to Morkel, no run goes back and defends the ball off the back foot to gully this time"
408,"Bollinger to Morkel, no run full on middle and leg and nicely clipped to midwicket for no runs"
409,"Bollinger to Morkel, no run now a short-pitched delivery, 136ks, to try and unsettle Morkel"
410,"Bollinger to Morkel, (no ball) oversteps, drops it a touch short and Morkel punches off the back foot"
411,"Bollinger to Morkel, no run fuller ball and he drives on the rise to Johnson at mid-off"
412,"Bollinger to Morkel, 1 run that sneaks past a leaden-footed drive and foxes Haddin behind the stumps, it pitched on a good length to lure Morkel forward but then didn't bounce much, narrowly missing off"
413,"Siddle to Morkel, no run angles it across Morkel, who plays and misses from the crease"
414,"Siddle to Morkel, no run pitches outside leg stump and turned to Katich at midwicket"
415,"Siddle to Morkel, no run hits a decent length and Morkel goes back to defend"
416,"Siddle to Morkel, no run short of a length and Morkel drives off the back foot to point"
417,"Siddle to Morkel, no run more low carry to Haddin after the ball beats Morkel's loose swish"
418,"Siddle to Morkel, no run fractionally fuller outside off and Morkel drives to the man at cover"
419,"Bollinger to Boucher, no run chases a full one in the zone but inside-edges back onto his boot"
420,"Bollinger to Boucher, no run an utterly miscued pull shot from Boucher, who reaches out to a short one well outside off stump but toe-ends it flat down the track wide of the nonstriker"
421,"Bollinger to Boucher, no run errant delivery, pitched up rather wide in search of movement"
422,"Bollinger to Boucher, no run short of a length and Boucher is unyielding in defence"
423,"Bollinger to Boucher, 2 leg byes pitches well down leg stump to get Boucher hopping to try and nudge it to fine leg but he doesn't manage to get bat on it so Billy Bowden gets up on one leg to signal leg byes"
424,"Bollinger to Boucher, no run pitches full to tempt the drive but a watchful Boucher shoulders arms"
425,"Siddle to Morkel, no run pitches outside leg and comes in, Morkel checks the line and defends"
426,"Siddle to Morkel, 1 run shorter and he swats it around the corner to deep fine leg"
427,"Siddle to Boucher, no run thats a ripper! Fast and short and rearing up from a big crack outside off stump, tailing into a shell-shocked Boucher, airborne and doing splendidly to weave out of harm's way before he crashes to the floor"
428,"Siddle to Boucher, FOUR runs short of a length and a squared-up Boucher edges past gully"
429,"Siddle to Boucher, no run 143.7ks, short of a length and some better defence this time"
430,"Siddle to Boucher, no run sees a short one and cracks it off the back foot, but can't beat cover"
431,"Bollinger to Morkel, no run pitched up fuller and it sucks him forward and he defends loosely"
432,"Bollinger to Morkel, no run thats better from Morkel, onto the front foot and rock-solid in defence"
433,"Bollinger to Morkel, no run slants back in off a good length and Morkel is once more rigid"
434,"Bollinger to Morkel, FOUR runs now he rides the bounce of a short-pitched delivery outside off stump, collecting on the rise and short-arm-jabbing between midwicket and mid-on, quality shot that"
435,"Bollinger to Morkel, no run thats loose however, as he chases a very wide one and misses"
436,"Bollinger to Morkel, 1 run change of pace, fuller on middle and leg and clipped to Katich"
437,"Siddle to Morkel, no run serves up full and wide and he succeeds in beating a weak drive"
438,"Siddle to Morkel, no run 146ks, full and wide in search of swing and Morkel leaves"
439,"Siddle to Morkel, FOUR runs thats full and wide and now he squirts a drive wide of Clarke at point"
440,"Siddle to Morkel, no run attempted yorker, pretty well bowled, and equally well dug out"
441,"Siddle to Morkel, no run holds back the length and Morkel punches it down to mid-on"
442,"Siddle to Morkel, 1 run no foot work as he reaches out and drives, with too much bottom hand, the ball rolls down the ground and Boucher sets off, he is struggling but Haddin doesn't collect the throw too well and Boucher survives"
443,"Bollinger to Morkel, 1 run drives a swinging delivery and clips towards Katich at midwicket"
444,"Bollinger to Boucher, no run full and wide outside off stump and Boucher shoulders arms"
445,"Bollinger to Boucher, 1 run thats streaky, Boucher pushing at shortish one and getting an inside edge back past his pads and down to square leg"
446,"Bollinger to Morkel, 4 leg byes swings down the pads, Morkel misses and so does Haddin, so thats leg byes to raise a very handy 50-run association between these two batsmen"
447,"Bollinger to Morkel, no run pitches on a length to lure Morkel forward on a leaden-footed drive, the ball takes the under edge but doesn't carry to Haddin and so Bollinger remains luckless"
448,"Bollinger to Morkel, no run a big shout but still no luck for Bollinger, pitches full and swings back in to hit Morkel on the front pad as he strides forward to try and on-drive the ball, its a good shout from all but not convincing enough fo"
449,"Hauritz to Boucher, 3 runs short and wide and cut into the covers for more runs"
450,"Hauritz to Morkel, 2 runs tossed up down leg and he clips it over midwicket to raise the 250"
451,"Hauritz to Morkel, no run strides forward and defends this one"
452,"Hauritz to Morkel, no run tossed up, it slides in but Morkel is fixed in technique"
453,"Hauritz to Morkel, no run plenty of flight and dip and Morkel smothers the turn"
454,"Hauritz to Morkel, no run comes well forward and defends and thats tea"
455,"Bollinger to Boucher, 1 run fuller on the stumps and he drives the ball to midwicket"
456,"Bollinger to Morkel, no run pitches outside off stump and he pushes the ball to cover"
457,"Bollinger to Morkel, no run pitches full and hits the pad down leg stump, another luckless appeal from Bollinger, the ball would have missed the mark reckons Billy Bowden"
458,"Bollinger to Morkel, no run full down the pads and clipped to midwicket"
459,"Bollinger to Morkel, no run pitches on the stumps and Morkel defends"
460,"Bollinger to Morkel, no run goes for a drive outside off stump and misses, now thats the line"
461,"McDonald to Boucher, FOUR runs short, wide and duly cut out past cover and point for a boundary"
462,"McDonald to Boucher, FOUR runs slides down the pads, stays low but Boucher does well to shuffle and bring the bat down, just clipping it past square leg"
463,"McDonald to Boucher, no run hits a much better length to get Boucher defending"
464,"McDonald to Boucher, FOUR runs too straight and thats more wonderful timing and placement from Boucher, clipping it wide of square leg and midwicket and the sweeper cannot cut it off, so thats a deserved half-century and his first at the SCG"
465,"McDonald to Boucher, no run pitches on a good length and he defends to the off side"
466,"McDonald to Boucher, 2 runs again down leg stump and turned out to Bollinger at fine leg"
467,"Bollinger to Morkel, no run short of a length and Morkel stands tall to defend it back firmly"
468,"Bollinger to Morkel, 1 run well bowled yorker, honing in on leg stump and Morkel jams it out and manages a single towards square leg"
469,"Bollinger to Boucher, 1 run pitches full, Boucher pushes and inside-edges, then scampers one"
470,"Bollinger to Morkel, no run miscues an attempted short-arm jab to a length ball, mid-on fields"
471,"Bollinger to Morkel, 2 runs overpitched in search of swing and he drives into the covers"
472,"Bollinger to Morkel, FOUR runs there's a firm stroke, Morkel cuts a short ball superbly past point"
473,"McDonald to Boucher, no run sharp bounce surprises Boucher who attempts to cut one not really there for the shot, the ball hits a crack and leaps up"
474,"McDonald to Boucher, no run back of a length and he defends this one more conservatively"
475,"McDonald to Boucher, no run stays low and swings down leg stump, Boucher cannot connect"
476,"McDonald to Boucher, 2 runs on the pads and he effortlessly clips past midwicket"
477,"McDonald to Boucher, no run gets some room and cuts a cramped shot to backward point"
478,"McDonald to Boucher, 1 run too straight and nicely flicked out to deep square leg"
479,"Johnson to Boucher, no run back of a length on the stumps, turned straight to midwicket"
480,"Johnson to Boucher, no run pitches full on off stump and Boucher drives to Hauritz at mid-on"
481,"Johnson to Boucher, 1 run full again and he jams it over Johnson, Hauritz runs across and collects, throws it back towards Haddin's end but he misses by some distance"
482,"Johnson to Morkel, FOUR runs short and wide and his cut draws a bottom edge wide of gully"
483,"Johnson to Morkel, no run another wide delivery but this time no shot offered"
484,"Johnson to Morkel, no run better delivery, on the stumps and Morkel defends to the on side"
485,"McDonald to Boucher, no run hits a length and the ball stops on Boucher, who pushes at it"
486,"McDonald to Boucher, no run short of a length and he gets up and defends"
487,"McDonald to Boucher, no run fuller and he drives the ball straight to cover"
488,"McDonald to Boucher, 1 run short and wide, cut hard, Clarke dives to his left at point and saves"
489,"McDonald to Morkel, no run pitches on off stump and Morkel defends watchfully"
490,"McDonald to Morkel, no run hits a length and he pushes the ball to the off side"
491,"Johnson to Boucher, no run pitches on a length and Boucher defends it to the off side"
492,"Johnson to Boucher, no run full and he drives well but straight to mid-off"
493,"Johnson to Boucher, no run full and wide, Boucher chases and nearly edges it to Haddin"
494,"Johnson to Boucher, no run brings him onto the front foot and Boucher pushes to the off side"
495,"Johnson to Boucher, no run too wide and he leaves it be for Haddin"
496,"Johnson to Boucher, no run pitches on with the angle and he shoulders arms"
