,Data
439,"Agar to Rahul, FOUR runs too short, too wide, too sweetly timed a cut shot by Rahul past backward point, cover sweeper is too wide to cut it off."
440,"Agar to Rahul, 1 run good length but tighter on off stump, taps this through the covers."
441,"Agar to Kohli, no run flighted again on a full length on off stump at 81 kph, defended into the off side."
442,"Kane Richardson to Rahul, 1 run full on the legs, flicked to deep square leg."
443,"Kane Richardson to Kohli, no run missed runout opportunity! Slower ball on off stump guided to Smith at backward point. Rahul took off from the non-striker's end, Smith tried to guide a throw back to Richardson over the stumps instead of firing for a direct hit. Too gentle and allowed"
444,"Kane Richardson to Kohli, 1 run good length on fifth stump, cut to the sweeper."
445,"Kane Richardson to Rahul, 1 run good length on fourth stump, goes back to create room to cut to the sweeper."
446,"Kane Richardson to Kohli, 1 run fullish length on middle, flicked to deep midwicket."
447,"Kane Richardson to Rahul, FOUR runs good length on middle, shuffles across to paddle pull fine behind square, super shot and beats the leg side sweeper to the rope."
448,"Zampa to Kohli, 1 run a bit of flight, flicked to wide long-on. Kohli's still in canter mode"
449,"Zampa to Rahul, no run stopped in the pitch a little, and nearly went through Rahul's bat-pad gap"
450,"Zampa to Rahul, 1 run another close call, but the batsman's inside edge gets him off strike"
451,"Zampa to Kohli, FOUR runs cross-batted slog sweep - what a shot that is! Bottom hand sweep that Kohli somehow managed to keep along the ground without getting down on one knee, and pierces the gap between deep midwicket and long on"
452,"Zampa to Kohli, 1 run worked away for one"
453,"Zampa to Rahul, 1 run back down the ground and Rahul keeps the strike"
454,"Agar to Rahul, 1 run nudged square on the leg side"
455,"Agar to Kohli, 1 run good length from Agar. Not allowing Kohli to come down the track or rock back. Takes a single down long-on instead"
456,"Agar to Rahul, SIX runs overpitches it, and pays the price! Full flighted ball, and there's no turn. Rahaul lofts it back over the bowler's head and it cannons into the sightscreen. Gorgeous shot"
457,"Agar to Rahul, 2 runs rocks back and carves it behind third man. 10 off the over already"
458,"Agar to Rahul, 1 run crunches it down to long-on"
459,"Agar to Kohli, 2 runs dinked into the onside, and the lack of pace means the two can come back for a couple. Excellent batting by India. They appear to be scoring big runs without taking risks"
460,"Kane Richardson to Rahul, 1 run slower ball. No pace to work it, but Rahul smears it down to the sweeper for one"
461,"Kane Richardson to Kohli, 1 run takes the pace off again. Cross-batted down the ground"
462,"Kane Richardson to Rahul, no run nearly dragged it onto his stumps. Cannoned into his pads and Rahul frantically searched around for the ball to ensure it didn't trickle onto his stumps"
463,"Kane Richardson to Rahul, 2 runs thumped over cover. No timing once more, but plenty of muscle on it"
464,"Kane Richardson to Rahul, 1 run sweetly timed to midwicket. Fielder does well to keep it to one"
465,"Kane Richardson to Kohli, 1 run slower ball, nudged into the offside. Good over from Australia at this stage"
466,"Zampa to Kohli, OUT he's gone! Zampa's got Kohli again! What a catch that is! Kohli lofted him straight back over his head, looked for all the world it would go for six but for some incredible work on the boundary. Agar takes a clean catch about six inches from the rope, feels himself"
467,"Zampa to Rahul, 1 run paddled away to the leg side"
468,"Zampa to Pandey, no run brave enough to give it more flight now. Defended to the covers"
469,"Zampa to Pandey, 1 run driven to long-off"
470,"Zampa to Rahul, 1 run chipped to deep midwicket"
471,"Zampa to Pandey, 1 run this one darted through. Thick inside edge and he keeps the strike"
472,"Kane Richardson to Jadeja, 2 runs slower ball again. Jadeja works it away to the onside, and absolutely races back for two. He might have been running quicker than Richardson's bowling right now"
473,"Kane Richardson to Jadeja, 1 run smashes it down the ground, runs well clear of the pitch this time"
474,"Kane Richardson to Rahul, 1 run tonked down to cow corner. Rahul is timing the ball so sweetly right now"
475,"Kane Richardson to Jadeja, 1 run slower bouncer, nudged away to deep midwicket"
476,"Kane Richardson to Rahul, 1 run runs it down to backward point"
477,"Kane Richardson to Jadeja, 2 runs clever running once more. Chipped into the vacant space on the legside and Jadeja hares back for two more. 8 off that over"
478,"Starc to Rahul, FOUR runs backfoot punch, gorgeous shot again. What can you do about that? Bowling at 145, but Rahul still slices it away past third man for four"
479,"Starc to Rahul, 1 run run down to third man"
480,"Starc to Jadeja, 2 runs full, reverse swinging yorker, but Jadeja smears it down to the onside and scampers back once more"
481,"Starc to Jadeja, 1 wide dragged down. Big wide. So big KL Rahul toyed with the idea of coming through for a bye"
482,"Starc to Jadeja, 1 run low full toss, thwacked to deep midwicket"
483,"Starc to Rahul, 1 run helped down to the fine leg fielder"
484,"Starc to Jadeja, 1 run full toss on leg stump. Very, very fortunate Jadeja's sent this right down to fine leg. That had four written all over it"
485,"Kane Richardson to Pandey, OUT top edged from Pandey, no timing on it and Agar completes a much easier catch this time. Was banged in short and Pandey went for the short arm jab, failing to find the middle of the bat"
486,"Kane Richardson to Rahul, 1 run ungainly hoick that's nowhere near the middle. Jadeja on strike"
487,"Kane Richardson to Jadeja, FOUR runs four first delivery. You couldn't ask for a better one to be eased in. Down legside at pace, and all he needed to do was get a feather on it and watch it race away"
488,"Kane Richardson to Jadeja, no run guided to backward point. Thinks about a run, thinks again"
489,"Kane Richardson to Jadeja, 1 run carved to sweeper cover"
490,"Kane Richardson to Rahul, 1 run smart running. Just timed to mid-off and he's on his way"
491,"Starc to Rahul, 1 run crunched to cover-point. Beautiful timing on it"
492,"Starc to Jadeja, 1 run short delivery, looking to pepper Jadeja, I suspect. He gets off strike"
493,"Starc to Rahul, FOUR runs low full toss"
494,"Starc to Rahul, SIX runs is that the shot of the day? I'd venture to say so. Starc at full tilt, and he's lifted him over extra cover for six as if he was Chris Harris on sedatives. Rahul has so much time right now"
495,"Starc to Rahul, 1 wide dragged down. This is a costly over, and 300 is up for India"
496,"Starc to Rahul, 1 run short ball, helped away to the leg side"
497,"Starc to Jadeja, 1 run sensibly keeps it short once more. But expensive over. Australia would have been counting on Starc, and his next two overs may be crucial to the game's outcome"
498,"Cummins to Jadeja, 1 run slower short delivery. Struck to extra cover. They still scamper through"
499,"Cummins to Rahul, 2 runs slower bouncer. Rahul turns his bat into a periscope and sort of tennis-smashes it to midwicket. Sharp running by the duo again, they have been superb"
500,"Cummins to Rahul, no run full pace, shorter delivery. Rahul swings, but for once, doesn't connect"
501,"Cummins to Rahul, SIX runs Cummins has tried to be too clever by half. This short ball Rahul was lying in wait for. Just opened the face of the bat and helped it away over third man all the way for six. Incredible shot."
502,"Cummins to Rahul, FOUR runs attempted yorker, but Rahul moved back in his crease, and flicked it to fine leg for four. A diving Labuschagne can't prevent it"
503,"Cummins to Rahul, 1 run keeps the strike for the last over"
504,"Starc to Rahul, 1 run no timing from the batsman. Went straight up but into a gap."
505,"Starc to Jadeja, 1 run pull shot gets Rahul back on strike. He's on 80 with 4 balls to go. Any chance of a 100?"
506,"Starc to Rahul, 1 bye misses it completely. Slower ball and a wild hoick that goes through to the keeper. They run a bye Australia aren't too concerned with preventing"
507,"Starc to Jadeja, OUT and that's Rahul gone. Well done for being so unselfish, to be fair. Went through to the keeper and Rahul as desperate to get back on strike. Carey got the direct hit"
508,"Starc to Shami, 1 run yorker. Shami does well to get enough bat on it to get Jadeja on strike"
509,"Starc to Jadeja, 1 run smashed straight to the cover fielder, and they run one. That gets India to 340."
510,Scorers at the ground have clarified that five penalty runs were not awarded for running on the pitch.
511,"Meanwhile, India and Australia will also come face-to-face at the men's hockey Pro League this season. A big tournament, it assumes added significance this year because of the Tokyo Olympics in July-August. India begin with two home matches against the Netherlands this weekend. Here are four"
512,5:10 pm A magnificent last 10 overs have got them slightly above what they'd have looked at around the 30-over mark. Can Australia make a fist of this? Join Peter in about 40 minutes to find out
513,The players are out. Bumrah has the ball. Warner on strike.
514,"Bumrah to Warner, no run good length ball on off, defended back to Bumrah."
515,"Bumrah to Warner, no run good length ball swinging into the legs, defended tentatively on the back foot back to Bumrah again."
516,"Bumrah to Warner, no run beauty on a good length angled across fifth stump, fishes at this away from his body without any footwork and is beaten."
517,"Bumrah to Warner, 1 run good length straying on the legs, goes back to tip and run behind square."
518,"Bumrah to Finch, no run fullish length on sixth stump and swinging away, left alone."
519,"Bumrah to Finch, no run good length ball swinging away again, drives at this and is beaten."
520,"Shami to Warner, 2 runs full on the legs, flicked through backward square."
521,"Shami to Warner, FOUR runs fullish length swinging in a touch on fourth stump, firm forward press and this flies off the bat through extra cover. What timing."
522,"Shami to Warner, no run short of a length ball on off stump, defended into short mid-off, chased down by Shami."
523,"Shami to Warner, no run short on the legs, tapped off the back foot into short midwicket."
524,"Shami to Warner, 3 runs short of a length outside off, short arm jab pull over wide mid-on, didn't complete the flourish and it is tracked down by Saini short of the rope. Saini is now clutching his left ankle. He's down for a minute but gets back up now. He's come off for a sub."
525,"Shami to Finch, no run short on the stumps, defended into the off side."
526,"Bumrah to Warner, 1 run short on the legs, flicked behind square to deep fine leg where Kedar Jadhav fields, on as a sub for Saini."
527,"Bumrah to Finch, 5 wide full and swinging down leg big time, Rahul dives left but it keeps on swinging all the way to the rope. 5 freebies to the Aussies."
528,"Bumrah to Finch, no run another hooping inswinger pitches on off on a good length and slams Finch into the pads, missing leg, can't get it away."
529,"Bumrah to Finch, no run no swing this time as the ball holds its line on fifth stump on a fullish length, Finch beaten driving away from his body."
530,"Bumrah to Finch, no run good length ball tailing into fourth stump, prods forward and inside edges into the leg side."
531,"Bumrah to Finch, no run in the slot on sixth stump, square drives this straight to backward point."
532,"Bumrah to Finch, no run gem! Back of a length ball on fourth stump, Finch goes to punch through cover off the back foot, beaten by extra bounce."
533,"Shami to Warner, FOUR runs short on sixth stump, Warner goes for the full pull shot instead of the short arm jab this time, drags this high over midwicket with a lot of wrist power and it bounces away to the rope."
534,"Shami to Warner, OUT Pandey! The Barracuda! Length ball angled across fifth stump, Warner spanks this flat toward cover, didn't look like he wanted to keep it down but didn't get the elevation either. Pandey on the ring times his leap perfectly to intercept it with his right hand reach"
535,"Shami to Smith, 1 wide bouncer goes down leg."
536,"Shami to Smith, no run good length ball on the stumps, defended."
537,"Shami to Smith, no run short ball on the stumps, sways back to leave."
538,"Shami to Smith, 1 run good length ball flicked off the pads behind square."
539,"Shami to Finch, 1 run good length ball on fourth stump, goes back to flick across the line through wide mid-on."
540,"Bumrah to Finch, no run full on off, driven to the infield."
541,"Bumrah to Finch, no run good length ball angled into off stump, defended."
542,"Bumrah to Finch, no run good length seams back beating the bat and zips into his thigh guard to carom to slip."
543,"Bumrah to Finch, no run short and wide, cut straight to backward point."
544,"Bumrah to Finch, no run good length on fifth stump angling in, tries to cut but cramped for room, chops it down past off stump into the ground to the keeper."
545,"Bumrah to Finch, no run good length on off, punched off the back foot to extra cover. Maiden for Bumrah."
546,"Shami to Smith, 1 run short on the legs, pulled flat just wide of Rohit at short fine leg. Would've been a stunner had he been able to get a hand to it diving right."
547,"Shami to Finch, 2 runs back of a length outside off, floats the bat to chip this behind point, slack fielding at deep third man by Kuldeep to relay in and they alertly take a second."
548,"Shami to Finch, 3 runs in the slot on off, shovels this high over extra cover, chased down before the rope by Pandey."
549,"Shami to Smith, no run huge lbw shout! This looked very close with Smith shuffling across defending down the wrong line. Given not out. Kohli opts against the review. Was touch and go whether he was hit in line with the stumps, replays show he was hit just outside off"
550,"Shami to Smith, 1 leg bye short of a length ball on off, out in front of a pull, hit on the ribs and they pinch a run into short midwicket."
551,"Shami to Finch, no run short of a length on off, defended into midwicket."
552,"Bumrah to Smith, no run back of a length on fifth stump, goes back to defend to cover."
553,"Bumrah to Smith, no run fullish length ball, punched not very cleanly to extra cover."
554,"Bumrah to Smith, no run short of a length on the stumps, punched back to the bowler."
555,"Bumrah to Smith, no run good length ball on fifth stump, punched to backward point."
556,"Bumrah to Smith, no run bouncer on off stump, pulls out of the hook shot, one short ball signaled for the over."
557,"Bumrah to Smith, no run good length ball on off, punched off the back foot to extra cover. Bumrah cannot be touched right now. Another maiden."
558,"Saini to Finch, no run short on sixth stump, goes to cut and lot of extra bounce takes this past the edge."
559,"Saini to Finch, no run good length ball on fourth stump, punched off the back foot to cover."
560,"Saini to Finch, 1 run fullish length ball on off stump, soft hands playing a tap and run into gully."
561,"Saini to Smith, no run good length ball at 143 kph on fourth stump, jags in a touch and keeps low to beat Smith's attempted back foot punch."
562,"Saini to Smith, 1 run good length on middle stump, walks across a long way to flick behind square."
563,"Saini to Finch, 1 run good length ball on fourth stump, goes back to punch softly enough toward mid-off to scamper a run."
564,"Shami to Finch, FOUR runs short of a length on fourth stump, Finch leans back to crunch a square drive behind point. Elegant."
565,"Shami to Finch, no run short of a length on off stump, tries to create room to cut but mistimes this into the ground back down the pitch to Shami."
566,"Shami to Finch, FOUR runs short on the body, garbage ball pulled fine and beats the deep fine leg fielder easily."
567,"Shami to Finch, no run back of a length on fourth stump, hops back to punch to mid-off."
568,"Shami to Finch, 1 run good length ball tailing into middle and leg, hops back to clip behind square."
569,"Shami to Smith, 1 leg bye short on the hips, tries to flick behind square but can't get bat on it. Carom goes short enough of short fine leg to allow a tight run."
570,"Saini to Smith, no run fullish length on off stump, Smith goes back and across to punch to mid-on."
571,"Saini to Smith, FOUR runs bread and butter for Smith. Buttah! Fullish length ball on off stump, shuffles well across to flick this through midwicket and it races away."
572,"Saini to Smith, FOUR runs Bumrah with a matador effort on the deep square leg rope. Full on middle stump, whips this with a touch of Dhoni helicopter behind square, should've been held to one but Bumrah let it go through his imaginary red cape reaching down."
573,"Saini to Smith, no run good length ball, defended."
574,"Saini to Smith, FOUR runs puuuuurrrrrrrfect drive! Full length on off, drives this exquisitely past a vain diving effort at mid-off."
575,"Saini to Smith, no run full on fourth stump, whips this firmly but straight to mid-on."
576,"Jadeja to Finch, 1 run begins with flight outside off stump, expansive drive to deep extra"
577,"Jadeja to Smith, 1 run smartly flicked down the ground"
578,"Jadeja to Finch, 1 run worked away down the ground"
579,"Jadeja to Smith, 1 run happy to milk Jadeja for singles for now"
580,"Jadeja to Finch, no run defended into the covers"
581,"Jadeja to Finch, 1 run keeps the strike with one through the covers"
582,"Saini to Finch, no run full, wicket-to-wicket line. Finch thought about running, but thought better of it"
583,"Saini to Finch, no run nice line. Doesn't give him enough room to open up the offside - not far away from taking his edge"
584,"Saini to Finch, 1 run driven to mid-on and the pair swap ends"
585,"Saini to Smith, 1 run big runout chance. Smith bloacked and ran, and a diving Rohit Sharma simply needed to hit the stumps. Suicidal running, gets away with it"
586,"Saini to Finch, no run short ball, swing and a miss"
587,"Saini to Finch, 1 run full and straight, mistimed to mid-on and they scamper through. Eventful over"
588,"Jadeja to Finch, no run defended"
589,"Jadeja to Finch, no run big appeal, but appeared to hit him outside leg stump and was carrying on with the line"
590,"Jadeja to Finch, 1 run full on leg stump, worked down to long-on"
591,"Jadeja to Smith, 2 runs helped down to square leg"
592,"Jadeja to Smith, no run driven back to the bowler"
593,"Jadeja to Smith, no run eased away to midwicket. Another tight over from India"
594,"Saini to Finch, no run did the pitch misbehave there? Finch thought it was nicely set up for a cracking square cut, but the ball kept well low"
595,"Saini to Finch, no run dragged down the onside, gets a tickle on the pad. Kohli thought there was an edge"
596,"Saini to Finch, 1 run blocks and runs. Finch isn't quite finding the timing at the moment"
597,"Saini to Smith, 1 run short and wide, Smith moves across and leans into it to nudge the ball to third man"
598,"Saini to Finch, FOUR runs a gimme ball that Finch gratefully accepts. Pace onto his pad, allowing Finch to hop across and put it away behind square leg. Big pressure reliever, that"
599,"Saini to Finch, 2 runs prods it into the onside and hares back for two. Could Finch finally be on his way to a big score?"
600,"Kuldeep to Smith, 2 runs starts off with a loosener outside leg, which Smith easily guides to square leg"
601,"Kuldeep to Smith, 1 run paddled away to fine leg. Smith is continuing to find ways of keeping the asking rate in check"
602,"Kuldeep to Finch, no run wrong-un. Finch didn't seem to pick it, and went for a sweep that would have made more sense with the turn. Beaten, but has his foot planted, so the stumping isn't a threat"
603,"Kuldeep to Finch, 2 runs heaveed over to cow corner. No real timing, but gets two"
604,"Kuldeep to Finch, 1 run helped to the onside"
605,"Kuldeep to Smith, 2 runs another wrong-un, Smith lobs this into the air with the turn. The in-fielder on the offside thought he was in with a chance but it's well out of his grasp. Eight off that over"
606,"Jadeja to Finch, OUT have they got their man? Yes, they have! Finch opened his body up to smash it over extra cover, but was beaten by the turn. Excellent glovework by KL Rahul, who whips the bails off while Finch's foot is on the line. Incredibly tight call, but I think giving it out"
607,"Jadeja to Labuschagne, 1 run turn and flight, drives it down to long-off"
608,"Jadeja to Smith, 1 run same shot, different batsman"
609,"Jadeja to Labuschagne, 1 run guides it down to long-off"
610,"Jadeja to Smith, 1 run nearly a catch, that! The ball stopped and flew up in the air, agonisingly out of the reach of a valiantly diving Jadeja."
611,"Jadeja to Labuschagne, no run sliced to cover. Successful over for India"
612,"Kuldeep to Smith, 1 run nicely flighted, opens the face of the bat to guide it to backward point"
613,"Kuldeep to Labuschagne, 1 run helps it to midwicket"
614,"Kuldeep to Smith, 1 run another wrong-un, but slightly short and Smith has enough time to rock back and ease it to the onside"
615,"Kuldeep to Labuschagne, no run shap fielding from Virat, a dive prevents the single"
616,"Kuldeep to Labuschagne, FOUR runs he's on his way! Mid-off was in the circle, and Kuldeep bowled a wrong-un, but he takes it on anyway and smashes him over the fielder"
617,"Kuldeep to Labuschagne, 2 runs paddled down to fine leg. Could Labuschagne, in his first ODI, be the man who guides Australia home? That's me getting carried away"
618,"Jadeja to Smith, 1 run worked away to the onside"
619,"Jadeja to Labuschagne, 2 runs sliced to backward point and the two scamper back for a couple"
620,"Jadeja to Labuschagne, 1 run sloppy fielding. Good delivery, but of flight and turn, but the bowler and mid-off get into a bit of a tangle, presenting the opportunity to steal a run"
621,"Jadeja to Smith, FOUR runs brilliant shot. Rocks back and punches it to the left of extra cover, and it's placed nicely enough to evade a diving sweeper cover"
622,"Jadeja to Smith, 1 run runs it down to long-on"
623,"Jadeja to Labuschagne, no run stayed slightly low. 9 off the over. Australia clawing back a bit of momentum"
624,"Kuldeep to Smith, 1 run short of a length, worked comfortably away for one"
625,"Kuldeep to Labuschagne, 1 run hunches low, and sweeps it to square leg"
626,"Kuldeep to Smith, no run flight, and stopped on the batsman slightly"
627,"Kuldeep to Smith, 1 run another wrong'un, but starts it outside leg stump. Flicked down to fine leg"
628,"Kuldeep to Labuschagne, 1 run cross batted shot down to off stumo"
629,"Kuldeep to Smith, FOUR runs How good is that shot? Pretty darn good, I'd say. Picks the line and length early, moves across, and absolutely bludgeons a slog-sweep for four. This is a nice little spell for Australia"
630,"Shami to Labuschagne, 1 run opens the face of the blade and eases it to third man. The pace is back because these two looked so settled against spin"
631,"Shami to Smith, 1 run short of a length, moves across and nurdles it to fine leg"
632,"Shami to Labuschagne, 1 run uses the pace of the bowler to work it to third man. Wasn't middled, but had enough on it to go through to Kuldeep on the bounce"
633,"Shami to Smith, 1 run comfortably flicked down to the onside"
634,"Shami to Labuschagne, 1 run run down to third man once more"
635,"Shami to Smith, FOUR runs thick outside edge, might have been deliberate, and it beats Kuldeep at third man! Nine from that over."
636,"Kuldeep to Labuschagne, 2 runs flighted full on the legs, paddle sweep to deep fine leg for a sharply run two."
637,"Kuldeep to Labuschagne, no run flighted onto off stump, misses a sweep and is struck on the pads but ball didn't straighten, would've carried past off stump. LBW shout denied."
638,"Kuldeep to Labuschagne, 1 run flighted full on fifth stump, driven to long-off."
639,"Kuldeep to Smith, 1 run full on middle, whipped to deep square leg."
640,"Kuldeep to Labuschagne, 1 run good length ball on the legs, clipped behind square."
641,"Kuldeep to Smith, 1 run flighted on a fullish length on middle and off, goes very deep in the crease to flick behind square. 50 up for Smith off just 47 balls."
642,"Shami to Smith, 1 run short on off stump, pulls this off somewhat of a top edge toward deep square leg but falls well short."
643,"Shami to Labuschagne, no run fullish length on off stump, punched straight to extra cover."
644,"Shami to Labuschagne, 1 run good length on the stumps, flicked behind square."
645,"Shami to Smith, no run full on the stumps, flicked straight to midwicket."
646,"Shami to Smith, 1 wide bouncer high outside off, called wide. Spoiled for choice, could've been given on line or height."
647,"Shami to Smith, 1 run full on fourth stump, shuffles back and across to flick through to deep midwicket."
648,"Shami to Labuschagne, 1 run good length ball on off at 121 kph, flicked through square leg."
649,"Kuldeep to Labuschagne, no run flighted on a good length on middle, backs away to punch straight back to Kuldeep."
650,"Kuldeep to Labuschagne, no run flighted on a fullish length on fourth stump, goes back to punch but straight to cover."
651,"Kuldeep to Labuschagne, no run flighted very full on fourth stump, driven firmly but straight to extra cover."
652,"Kuldeep to Labuschagne, 2 runs flighted on a good length on middle and leg, premeditates a paddle scoop over Rahul, not timed well and goes just outside the ring for two."
653,"Kuldeep to Labuschagne, FOUR runs flighted full on fourth stump, slog sweep through midwicket and screams along the ground through wide long-on. Super shot."
