,Data
211,"Hopes to Hopkins, no run this one really takes off and beats Hopkins, the bowler and keeper go up but there's no edge or deviation"
212,"Hopes to Hopkins, no run good length and Hopkins plays off the inside half of the bat to the on side"
213,"Hauritz to Franklin, no run tossed up on leg stump and played towards mid on but Hauritz moves quickly to field"
214,"Hauritz to Franklin, 1 run short into the pads and whipped through square leg"
215,"Hauritz to Hopkins, 2 runs tossed up and Hopkins uses his feet and drives strongly to Hussey at deep point and they have enough time to complete two"
216,"Hauritz to Hopkins, 1 run flatter and Hopkins punches off the back foot through point to the man on the fence"
217,"Hauritz to Franklin, 1 run quicker and angled down leg and Franklin rolls with it, playing to fine leg"
218,"Hauritz to Hopkins, 1 run good length outside off turning back into the batsman and he squeezes it into the off side for a quick single to short fine leg"
219,"Hopes to Hopkins, 1 run back of a length and he uses the pace and plays to third man"
220,"Hopes to Franklin, 1 run good length and driven to mid off for a quick single"
221,"Hopes to Hopkins, no run good length again and Hopkins pushes back along the pitch"
222,"Hopes to Hopkins, 1 wide bumper from Hopes and it's too high and just down the leg side so called wide"
223,"Hopes to Hopkins, 1 run good length narrowing into off stump and Hopkins pushes through cover point to the sweeper"
224,"Hopes to Franklin, 1 leg bye angled into leg stick and Franklin misses, it takes him on the pad and they take a leg bye into the leg side"
225,"Hopes to Hopkins, no run Hopes bowls back of a length and Hopkins pushes into the off side but can't pick the gap"
226,"Hauritz to Franklin, 1 run tossed up on off and pushed into the off side for a single"
227,"Hauritz to Hopkins, 1 run tossed up outside off and this one bites, takes the inside edge of the bat and rolls into the leg side"
228,"Hauritz to Franklin, OUT Franklin goes down on one knee and tries to sweep a ball that is down the leg side, he gets a glove on it and drags it back onto the stumps. That is unlucky but when things aren't goin so well those things tend to go against you"
229,"Hauritz to Tuffey, 1 run full and swept through forward square leg for a single to the man in the deep"
230,"Hauritz to Hopkins, 1 run tossed up and driven to long on"
231,"Hauritz to Tuffey, no run nicely flighted and Tuffey defends back to the bowler"
232,"Watson to Hopkins, FOUR runs back of a length and Hopkins gets underneath it and ramps it over backward point for four"
233,"Watson to Hopkins, no run good length and Hopkins pushes to point"
234,"Watson to Hopkins, 1 run slightly fuller and straighter and Hopkins plays nicely into the leg side through mid wicket to the man on the rope"
235,"Watson to Tuffey, no run good length on middle and off and played into the off side"
236,"Watson to Tuffey, SIX runs back of a length from Watson and Tuffey sits back and pullspwerfully over id wicket for six! That is an amazing stroke from a decent length delivery. I think everyone at the ground is as surprised as me"
237,"Watson to Tuffey, 1 run fuller this time and Tuffey pushes into mid wicket to retain the strike"
238,"Hauritz to Tuffey, 1 run short and cut backward of point to the man on the fence"
239,"Hauritz to Hopkins, 1 run tossed up and driven through the off side to long off"
240,"Hauritz to Tuffey, 2 runs flatter again and Tuffey moves back and drvies off the back foot through cover for a couple to Hussey on the boundary"
241,"Hauritz to Tuffey, SIX runs fuller again from Hauritz, Tuffey goes down on one knee and sweeps over deep backward square for six"
242,"Hauritz to Tuffey, SIX runs shorter and flatter from Hauritz and Tuffey is seeing is so clearly he moves back and pulls over the same region for six more"
243,"Hauritz to Tuffey, SIX runs full and wide of off stump, Tuffey goes down on one knee and slog sweeps straight down the ground fro six more. That's three in a row for the big fella! Sensational stuff"
244,"Watson to Hopkins, OUT back of a length and Hopkins tries to play square into the off side but it takes the outside edge and through to Haddin. Crucial breakthrough as it's the first ball of the Batting Power Play"
245,"Watson to Bond, no run good length and Bond tries to play square into the off side with an open face and he misses"
246,"Watson to Bond, 1 run fullish and Bond plays into the leg side to get underway"
247,"Watson to Tuffey, no run yorker and Tuffey drives to cover"
248,"Watson to Tuffey, no run yorker dug out into the on side"
249,"Watson to Tuffey, FOUR runs low full toss and Tuffey clips him backward of square on the leg side for four, super stroke and great timing"
250,"Hauritz to Vettori, 1 run Vettori leans forward and sweeps from middle and off through the leg side to Hopes on the boundary at square leg"
251,"Hauritz to Styris, 1 run shortish and Styris moves back and cuts to short third man for a quick single"
252,"Hauritz to Vettori, 1 run good length outside off and he plays inside out through backward point to the sweeper Bollinger who does well with White to keep the scoring to one"
253,"Hauritz to Styris, 1 run pitched up and dips quickly but Styris plays nicely through square leg for a single"
254,"Hauritz to Vettori, no run flatter and Vettori cuts off the inside edge past Haddin into the leg side"
255,"Hauritz to Vettori, 1 run uses his feet this time and is half-defeated in flight as he drives back past the bowler"
256,"Hopes to Vettori, 1 run Vettori walks across his stumps and clips to fine leg"
257,"Hopes to Styris, 1 run full and driven to White at cover and he struggles to get a hand on it and misfields allowing a single"
258,"Hopes to Vettori, 1 run good length and Vettori waits for it and punches through the off side to the sweeper"
259,"Hopes to Styris, no run back of a length and Styris moves back and punches into the off side"
260,"Hopes to Styris, 1 run too straight and clipped to fine leg"
261,"Hopes to Vettori, 1 run short ball pulled ot to deep backward square, they look for two but aren't prepared to take any risks"
262,"Johnson to Bond, FOUR runs full outside off from Johnson and Bond pushes the bat at it, it comes off the middle and runs backward of point for four"
263,"Johnson to Bond, 1 run fullish length and he pushes through the off side to the man on the fence at point"
264,"Johnson to Tuffey, no run back of a length outside off and he plays and misses"
265,"Johnson to Tuffey, 1 run fullish length on middle and he works it through mid wicket for one"
266,"Johnson to Bond, 5 runs Bond pushes back into the leg side, Johson runs to retrieve it, he picks it up and throws at the non-strikers stumps but misses and goes for five"
267,"Johnson to Tuffey, no run good bumper and Tuffey tries to pull, gets it high on the blade, it loops into the leg side and Haddin can't quite make enough ground to get under the catch"
268,"Harris to Bond, SIX runs good length ball, Bond leans back and clubs it straight over the bowlers' head for half a dozen. What a stroke!"
269,"Harris to Bond, 1 run full on off and he pushes into the off side for an easy single with the men inside the circle back on the edge"
270,"Harris to Tuffey, OUT half volley and Tuffey cracks it back at Harris and he twists in his follow through to take a superb grab and Tuffey's cameo is over. That is a superb cacth from Harris, you just can't keep him out of the action, nor the wickets"
271,"Harris to Southee, 1 run goes for the yorker, just misses his length and Southee clips it through mid wicket to the man on the fence"
272,"Harris to Bond, 1 run yorker dug out to third man"
273,"Harris to Southee, no run short ball and Southee sees it early and pulls but he misses"
274,"Johnson to Bond, OUT pitched up on off stump, Bond tries to hit it over mid on but gets it low on the bat and Hauritz moves forward and takes a good catch at ground level and New Zealand are bowled out for the third consecutive match"
275,"7.40pm The players are on their way back out onto the field with Australia needing 200 to win from just 34 overs. Power Play 1 is 7 overs, Power Play 2 (bowling) is 4 overs and Power Play 3 (batting) is 3 overs long. Bond to begin to Watson"
276,"7.05pm With the amount of moisture in the outfield, the umpires have decided to have another look in 15 minutes time and with clear skies above, it should be positive news at that."
277,"The clouds are clearing and it looks as though we are only a matter of time away from getting a start. The match will be reduced, however, it is not yet certain as to how many overs will be bowled this evening."
278,"Being a rugby venue, the drainage here is very good and, as long as there is no more rain, we should see some more play within the next hour at the worst."
279,6.55pm The rain has stopped and the ground staff are out in the middle trying to dry the ground which is quite damp without having any areas of the ground clogged with surface water.
280,"6.05pm It is still raining here and while it is not heavy it has been a consistent downpour. There is enough moisture out there to keep the players from the field for a time yet. If we are able to get play before 6.30pm there will be no loss of overs, however, from that time on we will be losing time and overs. I will keep"
281,Welcome back. We have some bad news from Auckland as it has started to rain during the innings break. The covers are on the pitch and play will not start at the scheduled time.
282,Join us in 40 minutes when Australia chase 239 to win and to take the series. See you soon
283,"Nathan Hauritz was the pick of the bowlers for the visitors, taking three for 46, with his only blip being hit for three consecutive sixes by Daryl Tuffey. Shane Watson continues to take crucial wickets at vital moments, dismissing Guptill just when New Zealand were starting to gain the upper hand and then Hopkins from the"
284,"New Zealand have collapsed from 120 for one to be 238 all out. Some soft dismissals were the cause, it must be said, however Australia were able to create enough pressure, especially from Hauritz at a crucial time. The crucial loss was McCullum for 61 off 75 balls just as he was looking to accumulate through the middle and"
285,New Zealand take the Bowling Power Play
286,"Bond to Watson, 1 wide Bond starts up fo New Zealand and there's a hint of inswing and he started it too straight and it goes down the leg side"
287,"Bond to Watson, no run good length from Bond and it hurries Watson up as he tries to guide it to third man, it seams back and hits the end of the handle"
288,"Bond to Watson, 1 leg bye a fraction shorter and Watson tries to pull but misses, it takes him on the body and rolls into the off side towards third man"
289,"Bond to Ponting, no run good length outside off and Ponting is back and leaving it alone, good carry through to the keeper"
290,"Bond to Ponting, no run he draws Ponting forward and he shows good intent, defending into the off side"
291,"Bond to Ponting, no run Bond gets this one to hoop back into Ponting and he makes an early decision to leave it alone and it flies past the off stump. The crowd are really up for this!"
292,"Southee to Watson, no run good start from Southee as he hits a good length, just full enough to drive and Watson crunches it to mid off on the up"
293,"Southee to Watson, no run better length this time and a fraction straighter has Watson defending solidly into the on side"
294,"Southee to Watson, 1 run Southee throws this one up there and it swings nicely away, taking the outside edge and racing away to third man"
295,"Southee to Ponting, 3 runs back of a length and Ponting moves back and punches through mid wicket for three, superb stroke"
296,"Southee to Watson, no run Southee hits a good length and shapes it away nicely, getting Watson to play but it beats the outside edge"
297,"Southee to Watson, 1 run full again from Southee and Watson tries to drive but it takes the inside edge and rolls out through square leg to the sweeper who comes in off the fence to collect"
298,"Bond to Watson, no run 146 kph, Bond charges in with the crowd behind him and hits a good channel and Watson leaves it alone outside off"
299,"Bond to Watson, no run this one is fuller and tails back into the right hander and Watson is solid in defence"
300,"Bond to Watson, FOUR runs good channel and Watson plays it nicely, defending off the face of the bat and it beats third man for four"
301,"Bond to Watson, no run back of a length and hitting the deck hard and Watson is happy to let it go through to the keeper"
302,"Bond to Watson, no run slightly fuller this time but still on a good length along the same channel outside off and Watson leaves it alone"
303,"Bond to Watson, no run good channel from Bond but he doesn't get Watson to play, as he leaves it through to the keeper once again, good batting"
304,"Southee to Ponting, FOUR runs fullish delivery and swinging away Ponting lunges forward and pushes through the covers for four, immaculate timing from the skipper"
305,"Southee to Ponting, no run back of a length and it beats Ponting on the inside of his bat just wide of off stump"
306,"Southee to Ponting, no run good length and Ponting moves back and punches to cover off the back foot"
307,"Southee to Ponting, no run impeccable length from Southee and Ponting lunges forward, with adrenaline pumping through his veins, and defends back to the bowler off the inside edge"
308,"Southee to Ponting, no run good length again, splices Ponting on the drive and he collects the ball on the off side"
309,"Southee to Ponting, FOUR runs Southee drops a fraction short and Ponting is onto it in a flash and pulling backward of square for four, classy stroke and you just can't afford to drop short to this man"
310,"Bond to Watson, no run good channel wide of off stump and Watson leaves it alone"
311,"Bond to Watson, no run full in length closer to off and Watson pushes into the off side field"
312,"Bond to Watson, 1 run good length and Watson plays nicely to third man"
313,"Bond to Ponting, no run good fullish length outside off and he pushes into the covers"
314,"Bond to Ponting, FOUR runs back of a length outside off and Ponting moves back and drives off the inside edge just past the off stump and through to fine leg for four"
315,"Bond to Ponting, no run fullish length and Ponting is forward and playing into the off side"
316,"Tuffey to Watson, no run Tuffey hits his length straight away and Watson punches to short cover off the back foot"
317,"Tuffey to Watson, 1 run good length but the lack of pace gives Watson time to use the pace and play to third man"
318,"Tuffey to Ponting, FOUR runs back of a length but the lack of pace allows Ponting to rock back and pull gloriously backward of square for four more, just so elegant to watch"
319,"Tuffey to Ponting, no run slower ball from Tuffey hits a good length and Ponting allows it through to the keeper"
320,"Tuffey to Ponting, no run back of a length it nips back into him and beats the bat, hits him on the pads dead in front and the whole stadium goes up but Umpire Rauf says not out"
321,"Tuffey to Ponting, 1 wide the frustration shows as Tuffey loses his line and bowls down leg"
322,"Tuffey to Ponting, 2 runs good length on off and Ponting works it into the leg side through mid wicket and he's waited it well enough to take two, well played"
323,"Bond to Watson, no run back of a length and Watson waits for it and pushes into the gully"
324,"Bond to Watson, no run good length agan jst wide of off stump and Watson plays to Styris in the gully"
325,"Bond to Watson, 1 run in the channel wide of off and Watson uses the pace to play to third man"
326,"Bond to Ponting, FOUR runs a fraction fuller and wide of off, Ponting comes forward and punches on the up superbly through point for four, that just a remarkable cricket shot"
327,"Bond to Ponting, no run Bond goes for the yorker and Ponting digs it out to Vettori at mid off"
328,"Bond to Ponting, no run slower ball from Bond, Ponting doesn't pick it, tries to pull and misses"
329,"Tuffey to Watson, no run full and driven sweetly to mid off"
330,"Tuffey to Watson, 1 run fullish length at middle stump and Watson pushes off the inside edge to mid on for a quick single"
331,"Tuffey to Ponting, no run back of a length and Ponting plays on the up to point"
332,"Tuffey to Ponting, 2 runs good length but too straight and clipped through the leg side to Stewart on the mid wicket boundary"
333,"Tuffey to Ponting, SIX runs Ponting advances and hits Tuffey straight back over his head for six. He didn't time it perfectly but he got it well enough to drop just over the rope. Tuffey must be finding this hard to handle after it looked as though he had him LBW just two overs back"
334,"Tuffey to Ponting, no run good length and Ponting drives on the up to mid off"
335,"Southee to Watson, FOUR runs too full from Southee and Watson makes him pay by gapping it perfectly through the covers for four, that's just all class"
336,"Southee to Watson, no run shortish delivery and Watson moves back quickly and pulls off the bottom edge back onto his pad"
337,"Southee to Watson, FOUR runs good length and wide and Watson square drives beautifully through backward point for four"
338,"Southee to Watson, FOUR runs good length and Watson pulls off the bottom edge, it just misses his stumps and runs away for four"
339,"Southee to Watson, FOUR runs god length but just enough width for Watson to guide it fine of third man for four"
340,"Southee to Watson, no run better channel this time draws Watson forward and he defends into the off side"
341,"Tuffey to Ponting, FOUR runs angled down the leg side and he clips it fine for four past short fine leg"
342,"Tuffey to Ponting, FOUR runs back of a length and Ponting pushes back and punches through the off side field for four, that is just outstanding batting from the Austalian captain. New Zealand being taught a lesson tonight. This is a batting master class"
343,"Tuffey to Ponting, 1 run good channel and Ponting plays late to third man"
344,"Tuffey to Watson, FOUR runs slower ball from Tuffey and Watson adjusts nicely, pulling past the man on the 45 for four"
345,"Tuffey to Watson, 1 run good length and he defends into the on side and steals a quick single to mid on"
346,"Tuffey to Ponting, no run good length on middle stump and Ponting gets an inside edge back onto his pad as he takes his bottom hand off the blade trying to play into the leg side"
347,"Vettori to Watson, no run angled bak into Watson from arod he wicket, it hits pad then bat and rolls into the leg side. Hopkins appeals but no answer given"
348,"Vettori to Watson, no run tossed up and defended back along the pitch"
349,"Vettori to Watson, no run full in length, it hits Watson pn the toe then he plays into the off side"
350,"Vettori to Watson, no run slower this time and well flighted and he pushes into the on side"
351,"Vettori to Watson, no run slighter flatter and quicker and Watson tries to cut, it slides on this wet surface and he plays to short third man"
352,"Vettori to Watson, no run tossed up nd this delivery grips a fraction beating the bat and taking Watson on the body"
353,"Styris to Ponting, 1 run full on middle and leg and Ponting clips it through the leg side to the sweeper"
354,"Styris to Watson, 1 run low full toss and Watson plays nicely through mid wicket to Tuffey on the fence"
355,"Styris to Ponting, FOUR runs too short from Styris at his pace and Ponting moves back and swivells, playing the pull for four through long leg"
356,"Styris to Ponting, 1 run rolls his fingers across this one and Ponting waits and then pulls to fine leg"
357,"Styris to Watson, no run god channel and Watson uses the pace to play to short third man"
358,"Styris to Watson, no run back of a length, it draws Watson forward into a defensive shot into the on side"
359,"Vettori to Ponting, 1 run tossed up and Ponting pushes to mid on and gets one"
360,"Vettori to White, no run well flighted, it draws White into a solid defensive shot into the on side"
361,"Vettori to White, no run nicely flighted on off stump and White is forward and defending into the off side field"
362,"Vettori to White, no run tossed up and pushed into the off side"
363,"Vettori to White, no run slightly quicker in a middle and leg and White pushes with hard hands back past the bowler to mid on"
364,"Styris to Ponting, no run full on middle and Ponting walks across his stumps and plays to mid wicket"
365,"Styris to Ponting, 1 run good length and Ponting pushes back and drives off the back shoe to long on"
366,"Styris to White, no run good length n off and White plays back to the bowler"
367,"Styris to White, no run good channel and White defends off the inside half of the blade to mid on"
368,"Styris to White, no run decent length, a fraction short, White plays off the back foot to mid off, nice stroke"
369,"Styris to White, no run Styris rolls his fingers across it and White pushes to mid on looking for a single"
370,"Vettori to Voges, no run the arm ball straight away and Voges doesn't pick it as he tries to cut but it beats the bat"
371,"Vettori to Voges, no run slower this time and he draws Voges forward and he pushes into the off side"
372,"Vettori to Voges, no run much slower and Voges comes forward and plays back along the pitch"
373,"Vettori to Voges, no run tossed up and driven to McCullum at cover"
374,"Vettori to Voges, FOUR runs Voges uses his feet and hits Vettori back over his hed for four. That's a super stroke to get off the mark. The Australian's only know one form of defence... and that's attack"
375,"Styris to White, no run back of a length and White punches back to the bowler and he puts his foot in the way to stop the single and it takes him on the shin and he's in some discomfort"
376,"Styris to White, no run rolls his fingers across it and yorks White as he plays to Taylor straight mid wicket"
377,"Styris to White, no run good length and White plays to Taylor again at straght mid wicket"
378,"Styris to White, no run fuller and straighter and quicker, Whites moves forward and pushes to Taylor... yet again"
379,"Styris to White, 1 run White walks away to leg and clips it off his hip to long leg, Bond moves around nicely to prevent the second"
380,"Styris to Voges, no run heavier this time from Styris has Voges defending strongly back to the bowler, good over"
381,"Vettori to White, no run flatter and shorter and White is back and pushing back to Vettori"
382,"Vettori to White, 2 runs nicely flighted and White takes on mid on, hitting just over the top for a couple"
383,"Vettori to White, no run flatter in at off stump and Whits plays into the off side"
384,"Vettori to White, SIX runs White steps away to leg, gives himself room and launches it over mid off for six. Super shot"
385,"Vettori to White, 1 run shorter and flatter and White cuts to deep point"
386,"Vettori to Voges, 1 run well flighted and Voges comes forward and pushes towards point for a quick single with McCullum hunting in close. Time for a drink"
387,"Styris to Voges, no run back of a length and defended into the off side"
388,"Styris to Voges, 1 run angled into the pads and played down to fine leg"
389,"Styris to White, 1 run rolls his finger across it and played through mid wicket to the sweeper"
390,"Styris to Voges, no run bowls the off spinner again and Voges pushes to cover"
391,"Styris to Voges, 1 run slower ball again and it's fuller allowing Voges to drive to long on"
392,"Styris to White, 1 run full on middle and leg and he punches to long on"
393,"Tuffey to White, 2 runs fullish in length and White drives nicely back at the bowler, Tuffey gets his foot to it which slows it down and Vettori chases after it and the batsmen take two"
394,"Tuffey to White, no run full again and White moves forward and drives to Guptill at cover"
395,"Tuffey to White, no run better length this time has White hanging on the crease and defending into the off side"
396,"Tuffey to White, 2 runs back of a length and White hits on the up through extra cover for a couple to Bond who does well down on the long off boundary to keep the scoring to just two"
397,"Tuffey to White, no run good length and White plays away from his body, gets an inside edge back into his pads"
398,"Tuffey to White, no run even better delivery from Tuffey as White hangs on the crease and defends, using the pace, backward of point, but the fieldsman does well to prevent the single"
399,"Styris to Voges, 1 run angled into the pads and clipped to fine leg"
400,"Styris to White, no run straight and worked to mid wicket"
401,"Styris to White, 1 run back of a length and cross-batted to long off, well struck"
402,"Styris to Voges, FOUR runs rolls his fingers across it and it's not even that short but Voges stays low and pulls powerfully through square leg for four, great timing"
403,"Styris to Voges, no run good length on off stump and he guides to short third man, McCullum moves well to save the single"
404,"Styris to Voges, 1 run full and moving in towards middle and leg and Voges clips uppishly through mid wicket to the sweeper"
405,"Tuffey to Voges, 1 run good length and Voges pushes to mid on on the up, Vettori picks up and throws the stumps down but Voges is just home safe"
406,"Tuffey to White, no run good length on middle and off and played back to the bowler"
407,"Tuffey to White, no run back of a length and White comes forward and drives into the off side, Guptill moves nicely at cover to save the single"
408,"Tuffey to White, no run goo channel again from Tuffey and White punches to cover from the crease"
409,"Tuffey to White, 1 run slightly shorter outside off and White gives himself room and punches to cover where Guptill does well to get a hand to it but can't stop the single"
