,Data
545,"Bollinger to Bravo, FOUR runs pitched up outside the off stump and Bravo in good position drives it down the ground through to long off fence."
546,"Bollinger to Bravo, OUT lovely delivery angled across and Bravo caught in the crease pushes at it and gets the edge to Haddin behind the stumps, a big wicket that, wonderful bowling."
547,"Hauritz to Nash, no run tossed up outside the off stump and left alone."
548,"Hauritz to Nash, no run moves back and defends to the off side."
549,"Hauritz to Nash, 3 runs a touch short, edges and goes past Clarke at first slip, he was bit late to move, goes down to third man. It surely is a drop."
550,"Hauritz to Ramdin, no run moves back and defends."
551,"Hauritz to Ramdin, no run moves back and cuts to cover, Bollinger does well."
552,"Hauritz to Ramdin, no run comes forward and pushes to the onside."
553,"Bollinger to Nash, no run cuts and misses outside the off stump."
554,"Bollinger to Nash, 2 runs pushes through midwicket to pick up couple of runs."
555,"Bollinger to Nash, no run short outside the off stump and Nash lets it go through."
556,"Bollinger to Nash, no run pitched right up outside the off stump and Nash goes for the big booming drive and misses it, through to Haddin."
557,"Bollinger to Nash, 1 run on the legs and turned off his pads to deep backward square leg for a single."
558,"Bollinger to Ramdin, no run drives and gets a thickish outside edge to backward point, good save by Hauritz."
559,"Hauritz to Nash, no run cuts off the back foot to cover."
560,"Hauritz to Nash, no run comes forward and defends."
561,"Hauritz to Nash, FOUR runs tossed up outside the off stump, Nash puts his right foot forward and drives well through cover point and to the fence, good shot."
562,"Hauritz to Nash, OUT lovely catch at first slip by Clarke. Tossed up outside the off stump and Nash plays forward and gets the edge to Clarke, who dives to his left and takes the catch inches off the groun"
563,"Hauritz to Benn, no run comes forward and defends to the onside."
564,"Hauritz to Benn, no run defended watchfully to the off side."
565,"Bollinger to Ramdin, no run good ball on a length and angled across, skews off the outside edge to gully."
566,"Bollinger to Ramdin, FOUR runs short of a length delivery and the ball takes the outside edge past the diving Ponting to his right and to the fence for a boundary."
567,"Bollinger to Ramdin, no run this time on top of it and plays behind point."
568,"Bollinger to Ramdin, 2 leg byes full and hits the pad as Ramdin was trying to play to the onside, loud appeal, turned down."
569,"Bollinger to Ramdin, FOUR runs in the slot for Ramdin outside the off stump and he puts his left foot forward and drives well through covers to the fence."
570,"Bollinger to Ramdin, no run played to the off side to mid-off."
571,"Hauritz to Benn, no run comes forward and defends down the track."
572,"Hauritz to Benn, no run a touch short and Benn cuts hard to covers and Hussey does well."
573,"Hauritz to Benn, no run cuts and misses outside the off stump, taken by Haddin."
574,"Hauritz to Benn, no run drives on the front foot to short cover."
575,"Hauritz to Benn, no run comes forward and defends on the track."
576,"Hauritz to Benn, 1 run plays to the right of Hussey at cover for a single."
577,"Bollinger to Benn, no run full and down the leg side and taken by Haddin."
578,"Bollinger to Benn, no run full delivery and driven back at Bollinger, who fails to field the ball cleanly."
579,"Bollinger to Benn, 1 wide a bouncer and Benn gets under it, signalled a wide."
580,"Bollinger to Benn, no run another bouncer and Benn gets under it once again."
581,"Bollinger to Benn, no run short of a length outside the off stump, cuts and misses."
582,"Bollinger to Benn, no run fuller this time and Benn pushes forward and gets beaten, good stuff from Bollinger."
583,"Bollinger to Benn, 1 leg bye down the leg side this time and off the pad, Haddin fails to gather as he dives to his right, they get a leg bye."
584,"Hauritz to Benn, no run keeps a touch low outside the off stump, Benn cuts and misses."
585,"Hauritz to Benn, 2 runs sweeps from outside the off stump to forward of square leg to the deep, Bollinger fields and fires in a throw at the non-strikers end and hits Ramdin on his fingers as he got in the"
586,"Hauritz to Benn, OUT tossed up wide and Benn once again looking to drag it from way outside the off stump, gets a faint edge and Haddin behind the stumps takes the catch."
587,"Hauritz to Rampaul, no run comes forward and pads it away, appeal and turned down, no referral."
588,"Hauritz to Rampaul, OUT lovely delivery pitches and extra bounce, goes straight on and the ball takes the edge as he plays at it and Haddin takes the second catch in the over. Rampaul was rooted to the cre"
589,"Hauritz to Roach, no run defended watchfully to silly-point. Finishes a good over."
590,"Bollinger to Ramdin, no run outside the off stump and Ramdin mistimes the drive to the off side."
591,"Bollinger to Ramdin, OUT bowled him! Pitches and takes the leg stump as Ramdin moves across to play to the onside, misses it completely and the stump is rattled."
592,"Bollinger to Tonge, no run full outside the off stump and Tonge drives and gets beaten, Bollinger has his hands on his head."
593,"Bollinger to Tonge, no run short of a length delivery angled across, Tonge stands in the crease and swishes at it and gets beaten."
594,"Bollinger to Tonge, 2 runs full on the legs and Tonge plays it through square leg to the deep and gets off the mark."
595,"Bollinger to Tonge, OUT edge and taken by Haddin diving to his right. Bollinger picks up his fifth wicket, well done. It was a fuller delivery outside the off stump and Tonge goes for the drive and gets th"
596,Innings Start
597,Slip and short leg in place.
