,Data
172,"Krejza to McCullum, 5 wide Krejza slips one down leg side, McCullum gets inside the line and tries to glance the ball. He misses but the ball beats Haddin as well"
173,"Krejza to McCullum, 1 run pushed through cover point for a single"
174,"Krejza to How, FOUR runs edged this time for four to third man. How pushed forward at one outside off and got a thick edge that ran past the fielder at short third man"
175,"Krejza to How, no run worked off the pads towards square leg"
176,"Krejza to How, no run How tries to cut the ball but it's a bit quicker and beats the outside edge"
177,"Smith to McCullum, no run tossed up on off and Nathan leans out to defend to the off side"
178,"Smith to McCullum, 1 run skids across on off stump, Nathan gets half forward and opens the face to dab it square for a single"
179,"Smith to How, no run fuller on off stump, How drives strongly but straight to the fielder in the covers"
180,"Smith to How, 1 run this time he gets the gap between cover and mid off. Singles galore."
181,"Smith to McCullum, 1 run Nathan whips him off the pads wide of mid-on to turn the strike over again"
182,"Smith to How, OUT How reviews an lbw call that looked plumb at the outset. Tossed up on middle from a touch wide of the crease, grips and straightens as How looks to defend it in front of front pad. The bat came across from its backlift, that began with the bat pointing at gully, a little late. The ball thudded into the pad in front of middle and was headed towards the stumps too. A review wasted, How is gone."
183,"Krejza to McCullum, 1 run back of a length and holding its line around off stump, Nathan works it off the back foot through midwicket for a single"
184,"Krejza to Vettori, no run flighted on off, Dan leans forward and defends carefully as he smothers the spin"
185,"Krejza to Vettori, 1 run and turn, from leg stump, almost squares up Vettori and gets a leading edge. Thankfully, it was too thick to carry to slip. Pops up into the covers for one"
186,"Krejza to McCullum, 1 run Nathan shuffles across and nurdles off the pads through square leg for a single"
187,"Krejza to Vettori, 1 run tossed up on leg, Vettori reaches out to the line and turns the wrists for a single in front of square"
188,"Krejza to McCullum, no run sharp bounce from Krejza from middle and leg, gets big on Nathan as he tries to glance, and balloons up off the thigh to the leg side. Haddin collects and they let out a stifled appeal in hope."
189,"Smith to Vettori, no run this time Vettori tries the reverse sweep and misses."
190,"Smith to Vettori, 1 run tossed up on off stump, Vettori reaches out and drives efficiently down the grounf"
191,"Smith to McCullum, 1 run extra turn from Smith, gets the outside edge but Nathan plays it softly so it doesn't carry anywhere. Single towards cover. Fifty runs added."
192,"Smith to Vettori, 1 run Vettori stays back and plays to the off side for a single"
193,"Smith to McCullum, 1 run Nathan forces a short of length ball from off stump towards deep cover for another single"
194,"Smith to Vettori, 1 run on Vettori's pads and sliding further down, he glances it fine and gets a single"
195,"Johnson to Vettori, 1 run angles into the pads first up, at 139.2 kph, but no worries for Vettori as he gets the pads inside the line and helps it along to fine leg"
196,"Johnson to McCullum, OUT Nathan reviews an lbw decision. Another interesting one, as Mitch landed on middleand leg. The ball was doing nothing, just carried on with the line. Nathan, for some reason, was looking to get across to the off stump and nurdle to the leg side. A fine plan that, but not if you miss the plan. He did. Hit in the front of middle, and it was carrying on to hit off. Both reviews done for New Zealand, and an important wicket for Aus."
197,"Johnson to Southee, no run yorker on off stump, dug out down the track. Southee is the new man in by the way."
198,"Johnson to Southee, no run edged but White is standing too deep at lone slip to hold it. Pitched up and asking to be driven, Southee goes for it and gets a thick edge. Straight to White, on the bounce"
199,"Johnson to Southee, 1 run very straight, on middle and leg as Southee hops away and works it to the leg side."
200,"Johnson to Vettori, 1 run Vettori chips across to off stump an tucks him square for one. Will he take the batting Powerplay now?"
201,"Smith to Vettori, 1 run Smith offers Vettori generous width outside off, and he hangs back and across to steer backward of point for one"
202,"Smith to McCullum, 1 run Nathan reaches out and drives into the covers for another single. Uppish, but he was in control all the time"
203,"Smith to Vettori, no run flatter, Vettori plays back and taps it off the pads to the leg side"
204,"Smith to Vettori, no run tossed up on off stump, Vettori leans out and defends to the off side"
205,"Smith to Vettori, no run turning into the pads, Vettori nurdles to the leg side. Can't get a single"
206,"Smith to Vettori, no run Vettori jumps a mile outside the crease, converts it into a low full toss and drives, but can't beat mid off"
207,"Tait to McCullum, no run full length ball outside off, Nathan backs away and looks to carve through the off side, but misses"
208,"Tait to McCullum, no run over-pitched on off stump, Nathan shuffles across and looks for the off drive, but can't get it past Tait on his follow through"
209,"Tait to McCullum, no run short of a length this time and very close to off stump, Nathan hangs back in the crease and looks to dab it with an open face towards backward point"
210,"Tait to McCullum, 2 runs finally Nathan gets it away for four. Not. Brett Lee is all over the place with his athleticism today. Short of a length on off stump, and Nathan under-edges a steer that runs very fine towards third man. Lee comes across, dives and prevents the boundary"
211,"Tait to McCullum, no run short ball again, Nathan invokes his inner Brendon and looks for the heaved upper cut. He's not quite quick enough with the hands, and misses, though."
212,"Tait to McCullum, 1 leg bye this one is speared into the pads. A touch of reverse, may be? Nathan plays all around it, and it runs away off the pads into the off side for a leg bye"
213,"Smith to Vettori, 2 runs tossed up outside off, Vettori drives expansively to deep cover for two"
214,"Smith to Vettori, no run tossed up on off, skidding along, and Vettori tries to play another reverse slap. Misses this time"
215,"Smith to Vettori, FOUR runs and Vettori makes contact with the reverse sweep now. Such a good looking shot when it comes off. Smith tosses it up outside off, Vettori reverses the grip and sends it packing through third man"
216,"Smith to Vettori, FOUR runs horror delivery, full toss on leg and took everyone by surprise. Vettori was so shocked, he fell down as he made contact with a powerful pull-sweep. Made good contact though, and picked up four more."
217,"Smith to Vettori, 1 run plays down the ground for a single. Good batting from the captain here."
218,"Smith to Southee, no run Southee looks to cut a short ball, but finds point. Vettori has strike"
219,"Johnson to Vettori, no run back of a length and very straight, Vettori begins with anti-climactic defence down the track"
220,"Johnson to Vettori, 1 run just outside off this time, Vettori stays on the crease and chops it behind square for a single."
221,"Johnson to Southee, no run he misses the first ball, back of a length and angling across as he looks to poke to the off side from the crease"
222,"Johnson to Southee, 1 leg bye a stolen legbye to change strike. Mitch lands this on the pads, following Southee as he hops away, and they squeeze a single towards backward point"
223,"Johnson to Vettori, FOUR runs Vettori is playing a really good innings here. Again. Jumps away to leg stump to open up the off side, and Mitch tries to cramp him by landing it on middle and leg, but Vettori had enough room to force an off drive and get it to the right of mid off"
224,"Johnson to Vettori, 1 wide there's more shuffling here than happens before the dealing of a Poker hand. Vettori skips across to off stump, Mitch has no idea where he is going and lands this outside leg stump. It's a wide, and Vettori feels he missed out on the flick"
225,"Johnson to Vettori, 1 run again, Vettori trots across to well outside off, Mitch follows him correctly and Vettori can't do much except work it to the leg side for one"
226,"Lee to Vettori, FOUR runs slow bouncer, 121 kph and Vettori says Thank You very much! That sat up like a dolly and Vettori slapped it happily through midwicket"
227,"Lee to Vettori, 1 run more improvisation. Vettori again hustles across to off stump and gets one on the pads. He clips it away with ominous timing towards deep backward square leg, and Tait does well to cover it"
228,"Lee to Southee, 2 runs more runs, Southee gets a thick edge that nearly runs away for four towards third man, but Tait again does well"
229,"Lee to Southee, no run Southee jumps away, Lee follows him like a guided missile and Southee ends up completely cramped, jumping away in clumsy fashion as it squeezed in towards him"
230,"Lee to Southee, 3 runs they are hurting Australia here. Southee, in the manner of all defiant tail-enders, is just staying rooted to the crease and waving at them outside off. This one is back of a length and he gets it to deep cover for three."
231,"Lee to Vettori, OUT after seven brilliant wicket-less overs, Lee picks one in his shoddiest over of the day. Vettori has run more at the crease today than between them, and again motors away to well outside off. Lee does well to stick to his guns and keep it outside off, back of a length. Vettori goes for the pull and gets an inside edge, through to Haddin."
232,"Johnson to Southee, OUT Ponting is saved a hefty fine for slow over rates as Australia manage to bowl New Zealand out, just five minutes over time. Poor, poor shot from Southee. Looks to launch a straight length ball without getting forward, and just tonks it up in the air. It goes up into the Nagpur sky and when it comes down, Ponting is ready, despite the fact that the midday sun would have blinded him."
233,"A complete stop-start effort from NZ. The top-order under-achieved, the bottom half over-achieved, Australia's fast bowlers fired a statement of intent that will leave all the other teams wary. Net effect - Australia need 207 to win, a target that I think won't trouble them, given the lack of teeth in New Zealand's bowling. How they'd have liked to have Shane Bond around."
234,Things have been rather predictable so far in the World Cup. Think you can predict who will make the quarters and beyond? Play our bracket game and do some crystal gazing.
235,"Right, George Binoy will return to comms when we resume at 13.40 local time. I will head across to the over-by-over chat when we resume, so keep the comments flowing there."
236,"Watson and Haddin are at their respective ends. Watson to face ... and the new ball is in Tim Southee's hands. More sight screen issues, what a nuisance."
237,"A few minutes away from the start of Australia's chase. It's unlikely that they'll be challenged too much on this pitch, but stranger things have happened. Will New Zealand open with Nathan McCullum?"
238,"Southee to Watson, 1 wide short ball to begin with, but the line is down leg side and that's a wide"
239,"Southee to Watson, no run good length outside off stump, Watson comes forward to drive with power but mis-times the ball towards the bowler"
240,"Southee to Watson, 1 run Watson waits on the ball and opens the face to dab down to third man"
241,"Southee to Haddin, 1 wide another wayward ball down leg side, poor control from Southee"
242,"Southee to Haddin, no run good length outside off stump again, considerable pace and bounce to the wicketkeeper after the batsman shoulders arms"
243,"Southee to Haddin, 1 run a hint of shape away from the right-hander from a good length, Haddin pushes towards mid-off to get going"
244,"Southee to Watson, 1 run fuller ball on middle, Watson comes forward and flicks towards midwicket"
245,"Southee to Haddin, FOUR runs terrific footwork, Haddin jumps forward and towards leg to create room and drills the ball through extra cover with a powerful drive. It was a length delivery and Haddin simply hit through the line"
246,"Vettori to Watson, no run defended on the front foot towards the off"
247,"Vettori to Watson, no run Watson strides forward and blocks with bat and pad close together"
248,"Vettori to Watson, 1 run Watson pushes the ball off the front foot from middle stump towards wide mid-on for one"
249,"Vettori to Haddin, 1 run Haddin flicks the ball from a full length on middle towards midwicket"
250,"Vettori to Watson, no run pushed off the front foot towards point"
251,"Vettori to Watson, 1 run Watson moves deep into the crease and forces the ball towards wide mid-on off the back foot"
252,"Southee to Watson, 1 run Southee strays on to the pads again and Watson plays the good length ball towards midwicket"
253,"Southee to Haddin, FOUR runs that didn't quite go where Haddin wanted it to but he's got the same result. He was aiming to go through midwicket with the flick but got a very thick inside edge through square leg, good timing on the shot"
254,"Southee to Haddin, no run played on the off side from the crease"
255,"Southee to Haddin, no run Haddin steps down and makes room once again to drive inside out through extra cover, this time he doesn't time it as well or find the gap"
256,"Southee to Haddin, 1 run the slower ball pushed off the back foot towards mid-on for one"
257,"Southee to Watson, no run good length ball angling into the right-hander, Watson stays in his crease and defends on the leg side"
258,"Vettori to Haddin, 1 run Haddin stays in his crease and plays a square drive towards deep point"
259,"Vettori to Watson, no run defended on the leg side from deep in the crease"
260,"Vettori to Watson, 2 runs a bit of room from Vettori and Watson plays a powerful square cut off the back foot towards deep point where Franklin can't prevent the second"
261,"Vettori to Watson, 1 run the sweep this time and a single to deep square leg"
262,"Vettori to Haddin, FOUR runs superb shot, Haddin didn't try to hit it too hard. He just looked to make contact and place it over the head of the fielder at mid-off, the timing's good enough to take the ball to the boundary"
263,"Vettori to Haddin, 1 run played on the leg side off the front foot"
264,"Southee to Haddin, no run Haddin tries to make room to hit Southee through the off again but ends up having to play it back to the bowler"
265,"Southee to Haddin, FOUR runs short and wide, Haddin begins to create room and then realises he doesn't need to. He simply swats the ball through cover with perfect timing and placement"
266,"Southee to Haddin, 1 run strays on to the pads this time and there's an easy single on offer after pushing the ball towards midwicket"
267,"Southee to Watson, 2 runs Watson nudges the ball towards square leg for a risky double, Haddin was struggling at the non-striker's end had there been a direct hit"
268,"Southee to Watson, no run Southee pitched the ball outside off and seamed it into Watson, who tried to flick but missed. The ball struck the pad and Southee's appeal was upheld by the umpire. Watson asked for a review right away and replays show the ball going down leg side and over the stumps"
269,"Southee to Watson, no run Watson gets tucked up by a short of a length delivery that rises a touch sharply into the mid-section. Watson wanted to work the ball through square but ended up defending it"
270,"Bennett to Haddin, 2 runs the first ball is full and on leg stump, Haddin picks it off his pads with a flick towards deep midwicket"
271,"Bennett to Haddin, no run Bennett cramps Haddin for room with one that pitches around off and jags into the right-hander. Haddin fends the ball towards short fine leg"
272,"Bennett to Haddin, 1 wide McCullum dives superbly to his left to prevent the wide down leg side from running to the boundary"
273,"Bennett to Haddin, no run short of a length and straight. Haddin stays on the back foot and defends"
274,"Bennett to Haddin, no run defended from the crease once again towards the on side"
275,"Bennett to Haddin, no run full ball and down leg side, ripe for flicking, but Haddin can't make contact and gets hit on the pad"
276,"Bennett to Haddin, no run Haddin jumps back and across and flicks the ball firmly off his pads towards short fine leg"
277,"Southee to Watson, 1 run Watson gets on to the front foot and drives a length delivery with power towards mid-off"
278,"Southee to Haddin, 1 run Haddin hints at making room again, but then stays rather motionless, and chops a short of a length ball towards third man"
279,"Southee to Watson, no run fuller ball angling into the right-hander. Watson moves forward and drives towards mid-on"
280,"Southee to Watson, no run a loud appeal from Southee but the umpire, Kumar Dharmasena, says not out this time. Watson got hit in front while defending but there was a big inside edge"
281,"Southee to Watson, no run defended on the back foot towards the bowler"
282,"Southee to Watson, no run Watson stays in his crease and opens the face to guide a good length delivery angling towards him to the fielder at point"
283,"Bennett to Haddin, no run Bennett pins Haddin to the crease with pace from a good length. Haddin gets behind the line on off stump and blocks"
284,"Bennett to Haddin, 3 runs strays on to leg this time and Haddin clips it off his pads towards deep midwicket. Williamson has to run around from deep square to field. Williamson is on the field for Styris."
285,"Bennett to Watson, 5 wide poor ball, too full and too far down leg side. McCullum's dive can't prevent the five wides this time"
286,"Bennett to Watson, no run full ball outside off stump, Watson tries to drive and mis-times it towards point"
287,"Bennett to Watson, FOUR runs a slower ball but it's also a lovely full toss on leg stump at knee height. Watson waits and swats it to the long leg boundary"
288,"Bennett to Watson, 3 runs Watson punches the ball firmly down the ground and beats the fielder diving across from mid-on. Nathan McCullum tears after the ball from mid-off and dives full length, arms flailing in front of him, and pulls the ball back in just before the boundary"
289,"Bennett to Haddin, FOUR runs poor line and length, full on leg stump. Haddin glances it off his pads past a diving McCullum"
290,"Southee to Watson, 1 run full ball swinging into the pads and Watson flicks with power towards deep midwicket where Franklin does the fielding"
291,"Southee to Haddin, FOUR runs Haddin makes room for a short of a length delivery and carves it in the air and over point, there's no one in the deep so Australia pick up steam with another boundary"
292,"Southee to Haddin, no run good length delivery outside off, Haddin stands his ground this time and drives to cover"
293,"Southee to Haddin, FOUR runs fuller length on middle stump. Haddin opens up his stance and lofts the ball cleanly over wide mid-on for four more"
294,"Southee to Haddin, no run slightly slower from Southee and Haddin swings and misses. The ball thuds into McCullum's pads and goes towards short fine leg"
295,"Southee to Haddin, no run Haddin swings again and gets a bottom edge towards short fine leg"
296,"McCullum to Watson, no run flat delivery on middle stump, defended on the back foot"
297,"McCullum to Watson, 1 run cut off the back foot towards deep point"
298,"McCullum to Haddin, 2 runs played late off the back foot and the batsman places the drive in front of point"
299,"McCullum to Haddin, FOUR runs sublime shot, all timing and placement. Haddin made a bit of room and simply eased the drive through the gap between cover and mid-off. Vettori gave chase but the ball kept gaining ground"
300,"McCullum to Haddin, no run played on the off side from the crease"
301,"McCullum to Haddin, no run played back to the bowler"
302,"Ryder to Watson, no run good length and rather straight. Played back to the bowler."
303,"Ryder to Watson, no run driven off the front foot towards the bowler again."
304,"Ryder to Watson, no run driven from the crease towards cover. McCullum is standing up to the stumps"
305,"Ryder to Watson, no run defended with a straight bat towards the bowler"
306,"Ryder to Watson, no run played back to the bowler once again"
307,"Ryder to Watson, 5 wide Ryder's ruined a good over with a shocking ball down leg side. With McCullum standing up, he has no chance."
308,"Ryder to Watson, 1 run Watson hammers the drive towards long-on"
309,"McCullum to Watson, no run punched on the back foot towards the bowler"
310,"McCullum to Watson, 1 run width offered outside off and Watson cuts hard off the back foot towards cover. Vettori scored a direct hit but Watson was home"
311,"McCullum to Haddin, no run forced off the back foot towards cover point"
312,"McCullum to Haddin, no run pushed back towards the bowler once again"
313,"McCullum to Haddin, 1 run Watson drives off the front foot towards mid-off where Vettori fumbles. Guptill backs up from extra cover"
314,"McCullum to Watson, no run played towards midwicket"
315,"Ryder to Haddin, 2 runs played towards short fine leg for a single"
316,"Ryder to Haddin, no run pushed off the front foot towards point"
317,"Ryder to Haddin, 1 run full ball on middle and leg, Haddin drives towards long on to reach his half-century"
318,"Ryder to Watson, 1 wide full ball down leg side. McCullum collects as Watson misses the flick and whips off the bails in a flash. Watson had overbalanced but managed to keep his back foot grounded"
319,"Ryder to Watson, 1 run length ball on of stump and Watson sends it screaming own the ground with a powerful drive towards long-on"
320,"Ryder to Haddin, no run nudged towards midwicket front the crease"
321,"Ryder to Haddin, no run a slow delivery from Ryder, Haddin plays it towards cover"
322,"McCullum to Watson, FOUR runs width offered outside off stump and Watson moves on to the back foot and plays the square cut with power to the deep point boundary"
323,"McCullum to Watson, no run driven off the front foot towards cover, McCullum is bowling rather quick"
324,"McCullum to Watson, 1 run muscled towards deep midwicket this time. Hit hard and flat and it reaches the fielder on the bounce"
325,"McCullum to Haddin, 1 run Haddin taps the ball gently towards mid-off and sprints the single"
326,"McCullum to Watson, SIX runs short ball and Watson heaves the ball off the back foot. He spotted the length early and absolutely hammered it over the deep midwicket boundary"
327,"McCullum to Watson, 1 run played towards midwicket"
328,"Bennett to Watson, 2 leg byes poor line, down leg side and Watson glances the ball towards fine leg"
329,"Bennett to Watson, 1 wide extremely wide outside off stump"
330,"Bennett to Watson, 2 runs driven though cover point off the front foot"
331,"Bennett to Watson, 2 runs a touch short and Watson pulls the ball towards deep midwicket"
332,"Bennett to Watson, no run the bouncer and the batsman lets it go"
333,"Bennett to Watson, no run Watson strides forward and plays the cut towards point"
334,"Bennett to Watson, 1 run played towards deep midwicket for a single to end the over"
335,"Vettori to Watson, FOUR runs Watson lunges forward and plays a powerful slow seep towards deep midwicket. It's flat but in the air so the fielder at deep midwicket tries desperately to catch it, in vain."
336,"Vettori to Watson, no run"
337,"Vettori to Watson, FOUR runs Watson swats this, bludgeons this with unbelievable power to the wide long-on boundary. He hit that on one knee and extremely hard and flat"
338,"Vettori to Watson, FOUR runs a slower ball from Vettori and Watson hits the ball hard through the off side this time"
339,"Vettori to Watson, 1 run cut hard off the back foot towards deep point"
340,"Vettori to Haddin, no run Haddin moves back and blocks"
341,"Bennett to Watson, 1 run short delivery, bowled with no intent, Watto picks the slower ball and smashes a pull to deep midwicket"
342,"Bennett to Haddin, no run another short one, but this time had pace behind it. Haddin pulls but can't time the shot"
343,"Bennett to Haddin, no run back of the hand slower delivery, 104.9 kph and well executed. Haddin was no where near picking that, and played all over it as it hit the pads, outside the line of off"
344,"Bennett to Haddin, 1 run another bouncer, 138 kph and steep lift, Haddin gets over it and rolls the wrists over it for a single to deep square leg"
345,"Bennett to Watson, FOUR runs such a poor short ball, even the lack of bounce on it did not prevent Watto from pulling for four. It did not bounce at all, and he seemed in some trouble as he adjusted the shot with the ball headed for his midriff. Still puts it away for four"
346,"Bennett to Watson, 1 wide and now one well outside off, Watto can't reach it."
347,"Bennett to Watson, no run another wide delivery, close to being called too, as Watto has a biff and misses"
348,"Vettori to Haddin, 1 run tossed up on the pads, Haddin politely pushes it towards long on and picks one"
349,"Vettori to Watson, 1 run big spin for Vettori, but so late in the day. Lands back of a length outside off and spits away past Watto's backfoot prod. Outside edge goes towards the slips.. which are vacant."
350,"Vettori to Haddin, 1 run tossed up on leg stump again, Haddin again works it against the spin for a single to mid on"
351,"Vettori to Watson, 1 run Bad to worse to shambles for NZ. Williamson drops a catch in the deep as Watto looks to mow a short ball, and plays it straight at Williamson who was slow moving forward and tumbling ahead. Should have been taken"
352,"Vettori to Haddin, 1 run Haddin chips him off the pads through midwicket for one more"
