,Data
251,"Powell to Symonds, 1 wide spears down leg and Ramdin dives to collect"
252,"Powell to Symonds, 2 runs slower one, full and just outside leg, shoveled to deep backward square leg"
253,"Powell to Symonds, FOUR runs banged in short of length, coming into Symonds who arches back to play a neat short-arm pull to wide midwicket boundary."
254,"Bravo to Hussey, 1 run moves outside the leg stump and crashes a full delivery on the off stump to deep cover"
255,"Bravo to Symonds, 1 run full and on the legs, nudged to the on side"
256,"Bravo to Hussey, SIX runs David Hussey, who sparkled in the IPL, joins in the fun. The left leg is cleared, the bat comes across and the short-of-length delivery disappears into the grassy banks at midwicket"
257,"Bravo to Hussey, 1 run fuller, whipped through the on side for a single"
258,"Bravo to Symonds, 1 run almost yorker length on the off and middle, pushed to long-off"
259,"Bravo to Hussey, 1 run full pitched just outside off, driven to deep cover"
260,"Miller to Hussey, no run short in length, outside off, dabbed to backward point"
261,"Miller to Hussey, 1 run comes down the track, Miller drags back the length again and Hussey has to be contend with a single with a tap to cover point"
262,"Miller to Symonds, FOUR runs Hammered to deep extra cover boundary. This is wonderful batting. Not too many risks but he is upping the ante at will. He rocks back to force a short-of-length delivery through the off side."
263,"Miller to Symonds, FOUR runs Oh the reverse sweep but played back of the bat! He didn't bother to switch to the front side and paddled a length delivery on the middle to third man boundary."
264,"Miller to Symonds, 1 run leans forward to work through midwicket"
265,"Miller to Hussey, 1 run goes back to push a delivery outside off to covers"
266,"Bravo to Hussey, 1 run full pitched on the middle and leg, turned to deep midwicket"
267,"Bravo to Symonds, 1 wide yorker length delivery but slips down leg"
268,"Bravo to Symonds, no run well-directed yorker on the middle, stabbed to the on side, Bravo cuts across the pitch and dives to prevent the single"
269,"Bravo to Symonds, 1 run yorker length again, on the off stump line, jabbed to point"
270,"Bravo to Hussey, 1 run clears the front foot and drags the really full delivery to square leg"
271,"Bravo to Symonds, no run the yorkers keep coming from Bravo. This one is jabbed out to the on side, Bravo rushes across and fires in a throw at the striker's end where Symonds dives to get back. But had Bravo hit the stumps, Symonds would have been"
272,"Bravo to Symonds, 1 run comes down the track, moves outside leg and drills a full pitched delivery on the stumps to long-off"
273,"Powell to Symonds, SIX runs Brutal. Super clean swing of the bat and the ball has disappeared over long-on. He moved outside leg. The bat came down. Met the ball flush in the middle. The white ball soared into the orbit."
274,"Powell to Symonds, FOUR runs low full toss on the pads as he tried to follow Symonds who had stepped outside leg and Symonds swings it to deep backward square leg boundary."
275,"Powell to Symonds, no run moves outside the leg, has a big swing towards wide long-on, inside edges to short fine-leg. He then practices hitting into the V"
276,"Powell to Symonds, 1 run low full toss on the leg stump, Symonds was outside leg and flashes it to long leg"
277,"Powell to Hussey, 2 runs Hussey follows Symonds. He steps down leg, the bowler follows him and he swings the full delivery to left of long leg where its kicked away into play"
278,"Powell to Hussey, SIX runs he threatens to moves towards off before going outside leg and slices a full delivery in the slot over long-off. The carnage continues."
279,"Edwards to Symonds, OUT steps down the track, clears the front foot in an effort to the get the bat swing going but Edwards fires it short of length and on the off stump. Symonds tries to flat-bat it over the off side but couldn't clear the fielder"
280,"Edwards to Hopes, OUT Short delivery, Hopes tries to whip pull it but top edges a dolly to midwicket."
281,"Edwards to Hussey, (no ball) 1 run full delivery, driven to long-off."
282,"Edwards to Ronchi, 1 run moves outside leg and drives hard and straight to covers where Gayle takes the 'catch'"
283,"Edwards to Hussey, 1 run yorker on the middle, he can't get under the ball and digs it out to the on side"
284,"Edwards to Ronchi, 1 run back of length, cutting in to off and middle, pushed to cover point"
285,"Edwards to Hussey, 1 run another yorker on the middle, manages to dig it out to slips. Very good over this"
286,"Gayle to Hussey, 1 run driven past the diving bowler to long-off"
287,"Gayle to Ronchi, 2 runs floated full outside off, square driven to left of deep cover"
288,"Gayle to Ronchi, 1 run leans forward to work a full delivery through midwicket"
289,"Gayle to Hussey, OUT The low full toss does the trick. David skipped down the track and swung a dipping delivery to the substitute fielder at deepmidwicket"
290,"Gayle to Ronchi, 1 run"
291,"Gayle to Lee, 1 leg bye short in length, on the middle, tucked to square leg"
292,"Edwards to Lee, 1 run bangs it short of length and it cuts back in at Lee who had moved outside leg. Lee was cramped up, took his eyes off the ball but manages to dab it to the off side"
293,"Edwards to Ronchi, 1 run clears his front leg and slices a full delivery on middle and off to sweeper cover."
294,"Edwards to Lee, (no ball) short in length and rushing through the off stump channel, Lee is outside leg, tries to cut but misses. But a free hit coming up"
295,"Edwards to Lee, no run digs it short, Lee is outside leg again, hops to cut but is beaten by the extra bounce and edges it to the 'keeper."
296,"Edwards to Lee, 1 run another short--pitched delivery, mistimes a pull between midwicket and deep square leg. Sarwan runs back, Findlay runs in and both stop and assume the other will take the catch and it drops right in middle of them"
297,"Edwards to Ronchi, 1 run full delivery, jabbed away for a single"
298,"Edwards to Lee, 1 run moves away and mistimes a cut to covers"
299,"Bravo to Lee, 1 run a tad slower, full, driven to long-off."
300,"Bravo to Ronchi, FOUR runs full and swinging away from the off stump, Ronchi was moving outside leg, stopped his movement, crouched, reached out to slice it through backward point"
301,"Bravo to Ronchi, OUT full in length, swung straight to long-off. The average first-innings score on this ground is 284"
302,"Bravo to Lee, 2 runs steps down leg side, Bravo follows him with a low dipping full toss, scooped to front of square leg and Chanderpaul rushes from short fine leg, dives and almost gets under the ball."
303,"Bravo to Lee, 1 run yorker, stabbed to covers. Bravo has bowled very well in the end overs"
304,"Bravo to Johnson, no run finishes things off with a dot ball. He moved outside leg, Bravo fired in a low full toss outside off. Swing and a miss."
305,"Australia end up on 282, just two short of the average first-innings score on this ground. Can West Indies chase it? Join us in a short while to find out."
306,All ready for the chase
307,"Lee to Gayle, 1 run full delivery, hint of swing, on the off stump, squeezed to point"
308,"Lee to Marshall, no run Two slips in place and they watch as Xavier Marshall shoulders arms to a delivery outside off"
309,"Lee to Marshall, OUT Plumb. Lee didn't even appeal initially as he ran on straight before turning to query Bucknor. Full, fast, tailing into middle and leg and the tentative Xavier is caught on the shuffle. Gone."
310,"Lee to Sarwan, FOUR runs lovely straight drive to start off. He stayed beside the line of a full and straight delivery on the middle and presented the full face of the blade. Mere push and it raced away."
311,"Lee to Sarwan, FOUR runs shifts his line to outside off and Sarwan creams the full delivery though covers. Sweetly timed."
312,"Lee to Sarwan, 1 run on a length, just outside off, Sarwan stays back, hops and punches it to covers"
313,"Bracken to Sarwan, 1 wide swings down leg. Slip and short midwicket in place. It did curve back in. If he gets it to start from off and middle, it could get interesting"
314,"Bracken to Sarwan, no run pushes this one across Sarwan, with the angle, left alone"
315,"Bracken to Sarwan, no run full, slanting away from Sarwan who drives to covers"
316,"Bracken to Sarwan, no run cuts away off the length, across Sarwan who is squared-up and pushes it to point"
317,"Bracken to Sarwan, no run length delivery angling towards off, pushed down the track and Bracken fields"
318,"Bracken to Sarwan, no run slanted across Sarwan who lets it go through to Ronchi"
319,"Bracken to Sarwan, 1 run turns a full delivery to long leg"
320,"Lee to Sarwan, no run full and straight on the off and middle, driven to mid-off. Sarwan is looking to be positive here"
321,"Lee to Sarwan, no run short of length, outside off, Sarwan goes hard at the cut shot and bottom edges it to the off side."
322,"Lee to Sarwan, FOUR runs blasted to deep point boundary. More width than the previous delivery, similar short of length and Sarwan goes back and across to cut it hard."
323,"Lee to Sarwan, no run fuller, closer to the off stump, no swing, driven to mid-off"
324,"Lee to Sarwan, no run back of length, outside off, tapped to covers"
325,"Lee to Sarwan, no run short in length and outside off, Sarwan goes for his cut shot but mistimes it to right of Clarke at backward point"
326,"Bracken to Gayle, no run outside the off stump line, steered to backward point."
327,"Bracken to Gayle, no run pushes a length delivery to short mid-off"
328,"Bracken to Gayle, 1 run fuller, coming in towards middle, tucked behind square leg"
329,"Bracken to Sarwan, 1 run back of length, on the middle, turned to backward square leg region for a single"
330,"Bracken to Gayle, FOUR runs edged past the first slip. It held its line after landing on a length around off stump, Gayle played inside the line, tried to withdraw his bat but it ran off the outer edge past the diving Watson"
331,"Bracken to Gayle, FOUR runs The Gayle pull. Short of length, coming into him and he lifts his right leg and fists the ball through front of square"
332,"Lee to Sarwan, no run shuffles across to steer a full delivery to point"
333,"Lee to Sarwan, 1 run short in length, outside off stump, dabbed to third man for a single."
334,"Lee to Gayle, 1 run digs it short on middle and leg, Gayle short-arm jabs it to long leg"
335,"Lee to Sarwan, no run banged in short and it whizzes past Sarwan who withdraws the bat away from the line and lets it fly past him"
336,"Lee to Sarwan, 1 wide well outside off stump, Sarwan can't connect with the cut shot."
337,"Lee to Sarwan, no run stands on his toes to punch a back-of-length delivery just outside off to Symonds at covers"
338,"Lee to Sarwan, no run lets this one go through to Ronchi"
339,"Johnson to Gayle, no run full and on the leg and middle, turned straight to short midwicket"
340,"Johnson to Gayle, no run shifts his line to outside off, Gayle thinks about driving before lifting the bat above his head and Ronchi comes into play"
341,"Johnson to Gayle, 2 runs kicks up from short of length outside off stump, Gayle cuts to deep backward point"
342,"Johnson to Gayle, no run slings a full delivery from almost round-arm action on the middle and off , defended down the track."
343,"Johnson to Gayle, 1 run pushes another full delivery to extra cover"
344,"Johnson to Sarwan, no run outside off, left alone"
345,"Lee to Gayle, FOUR runs And Lee bangs a short one on the leg stump line. Up goes the front leg, down comes the bat and he laps it around the corner to fine leg"
346,"Lee to Gayle, SIX runs Wallop. He cleared the front foot and killed a full delivery over wide long-on."
347,"Lee to Gayle, no run shifts his line to outside off and is guided to backward point"
348,"Lee to Gayle, 1 run full pitched outside off stump, Gayle goes hard at his drive, the bat-face shuts and the ball rolls to left of mid-off"
349,"Lee to Sarwan, no run short of length, holding its line outside off, defended down the track"
350,"Lee to Sarwan, no run leans across to push a full length delivery to Clarke at backward point who fields and runs to his left and to his right as he shouts words of encouragement to his team-mates. Nervous energy."
351,"Johnson to Gayle, no run on the off stump line, off a length, defended down the track. Slip and short straightish midwicket in"
352,"Johnson to Gayle, 1 run back of length, coming in to Gayle who nudges it toward square leg"
353,"Johnson to Sarwan, 1 run overpitched outside off, driven to right of extra cover where Symonds makes a diving stop"
354,"Johnson to Gayle, 1 run short in length, outside the off stump, tapped to right of backward point"
355,"Johnson to Sarwan, 1 run length delivery pushed across Sarwan who taps it close on the off side and rushes across for a single"
356,"Johnson to Gayle, no run short in length, outside the off stump, pushed to the off side"
357,"Hopes to Sarwan, no run full delivery on the middle, driven to Lee at mid-on"
358,"Hopes to Sarwan, no run"
359,"Hopes to Sarwan, no run coming in towards the middle and off, defended to covers"
360,"Hopes to Sarwan, no run on the middle, tailing towards middle and leg, turned to short midwicket"
361,"Hopes to Sarwan, 1 run outside the off stump, steered to third man"
362,"Hopes to Gayle, 1 run full delivery on the middle, pushed to long-on"
363,"Johnson to Gayle, no run leans forward to drive to covers"
364,"Johnson to Gayle, no run on the leg and middle, kicking up back of length, dabbed to midwicket"
365,"Johnson to Gayle, 1 run run down to third man. 50 up."
366,"Johnson to Sarwan, no run full pitched outside off, driven to extra cover"
367,"Johnson to Sarwan, 1 run short in length, outside off, cut to third man"
368,"Johnson to Gayle, no run down the leg side, doesn't connect with the flick shot"
369,"Hopes to Sarwan, no run on a length, coming in, pushed to the on side"
370,"Hopes to Sarwan, 1 run back of length, on the middle, tickled behind square leg"
371,"Hopes to Gayle, 1 run full and around the leg stump line, nudged to square leg"
372,"Hopes to Sarwan, 1 run gets forward to push towards mid-on"
373,"Hopes to Gayle, 1 run fullish outside off stump, driven to long-off"
374,"Hopes to Sarwan, no run full pitched outside off, mistimes a drive to covers"
375,"Johnson to Gayle, no run almost yorker length on the middle and off, driven to mid-off"
376,"Johnson to Gayle, no run similar length again, on the middle, jabbed down the track"
377,"Johnson to Gayle, 1 run short of length, steered to third man"
378,"Johnson to Sarwan, no run leans forward to push to point"
379,"Johnson to Sarwan, 1 run kicks up from back of length, at the body, fended behind square leg"
380,"Johnson to Gayle, no run length delivery outside off, guided to point"
381,"Hopes to Sarwan, 1 run on the middle and leg, turned past square leg"
382,"Hopes to Gayle, no run cutting across Gayle who tries to run it through vacant slip region and is beaten. Ronchi is standing up to the stumps"
383,"Hopes to Gayle, 1 run low full toss, driven to long-off. I thought he was trying to drive through on side. Yep, the replays confirm that "
384,"Hopes to Sarwan, no run tailing into pads, misses to connect with his waft across the line and it rolls away to the on side off the pad"
385,"Hopes to Sarwan, no run leans forward to steer a seam-up delivery outside off to short third man"
386,"Hopes to Sarwan, no run on the middle, coming in, nurdled to square leg"
387,"Johnson to Gayle, no run full and outside off stump, left alone"
388,"Johnson to Gayle, no run fullish, on the off and middle, pushed to the off side"
389,"Johnson to Gayle, 5 wide bangs in a bouncer but it's too high and Ronchi is no superman to bring it back down to earth"
390,"Johnson to Gayle, 1 run leans forward to push to extra cover"
391,"Johnson to Sarwan, no run"
392,"Johnson to Sarwan, no run full pitched, driven to extra cover"
393,"Johnson to Sarwan, no run on the middle and leg, nudged to the on side"
394,"Hopes to Gayle, SIX runs breaks free with a lovely caressed straight drive. Er no. Wallops a full delivery to the straight boundary. What bat speed."
395,"Hopes to Gayle, FOUR runs More violence. The front foot was cleared and he swung a low full toss to wide midwicket boundary."
396,"Hopes to Gayle, 1 run reaches out for a full delivery outside off, the bottom-hand comes off the handle as he shapes to drive and he drags it to long-on"
397,"Hopes to Sarwan, no run back of length, skids on towards middle, stabbed to the off side"
398,"Hopes to Sarwan, 1 run outside the off stump, dabbed to third man"
399,"Hopes to Gayle, 2 runs short in length, moves towards leg stump, clipped off the pads for couple of runs"
400,"Johnson to Sarwan, no run full and angling away from Sarwan who fails to connect with a cover drive."
401,"Johnson to Sarwan, no run on the off stump line, Sarwan shuffles across, tries to work it to the on side but can only send it back to the bowler."
402,"Johnson to Sarwan, no run how does a top-order batsman like Sarwan gets squared up so often? It's a wonder. Again squared-up, to a delivery on the off and middle and gets a leading edge down the track"
403,"Johnson to Sarwan, 1 run short of length outside off, cut to covers"
404,"Johnson to Gayle, 1 run short in length, coming in to Gayle who turns it past square leg"
405,"Johnson to Sarwan, 1 run on the middle and off, this time he stays adjacent to the line and runs it down to third man"
406,"Hopes to Sarwan, 1 run on the middle and leg, turned to square leg"
407,"Hopes to Gayle, no run short in length, cutting away from Gayle who is squared-up and adjusts to jab it to the point region"
408,"Hopes to Gayle, no run outside off, left alone."
409,"Hopes to Gayle, 1 run well outside the off stump, full, Gayle reaches out to slice it to deep cover"
410,"Hopes to Sarwan, 1 run leans forward to work a length delivery through midwicket"
411,"Hopes to Gayle, 1 run short of length, short-arms it towads deep midwicket. 50 for the skipper."
412,"Johnson to Gayle, no run leans forward to push a full delivery to mid-on"
413,"Johnson to Gayle, no run short in length, outside off stump, punched to point"
414,"Johnson to Gayle, no run full and just outside the off stump, pushed to covers"
415,"Johnson to Gayle, 1 run outside the off stump, squeezed to wide third man"
416,"Johnson to Sarwan, 2 runs full pitched outside off, driven to left of sweeper cover"
417,"Johnson to Sarwan, 1 run back of length, on the middle and leg, clipped to long leg"
418,"Hussey to Sarwan, FOUR runs Sarwan welcomes him with a well-timed and even better, well-placed cover drive ,. well to the right of the sweeper cover"
419,"Hussey to Sarwan, 1 run stretches across to get a single to point region"
420,"Hussey to Gayle, 1 run from round the stumps, full and on the middle, driven to long-off"
421,"Hussey to Sarwan, no run goes back to turn a delivery turning into him to Hopes at square leg"
422,"Hussey to Sarwan, 2 runs short of length, outside off, cut to deep point"
423,"Hussey to Sarwan, 1 run"
424,"Watson to Sarwan, no run fullish, on the off stump line, driven back down the track"
425,"Watson to Sarwan, 1 run short in length, lapped around the corner behind square leg"
426,"Watson to Gayle, 1 run dabbed to third man for yet another single"
427,"Watson to Sarwan, 1 run leans forward to work it to the on side"
428,"Watson to Gayle, 1 run low full toss outside off stump, slashed to deep cover"
429,"Watson to Sarwan, 4 leg byes slips down leg side, misses the glance and it runs off the pad to fine leg boundary"
430,"Hussey to Gayle, 1 wide down the leg side"
431,"Hussey to Gayle, 1 run driven powerfully to long-on"
432,"Hussey to Sarwan, 1 run leans forward to ease a full delivery to long-on"
433,"Hussey to Gayle, no run really full delivery outside off, jabbed to David"
434,"Hussey to Gayle, 1 run gets forward to tap a delivery outside off to backward point"
435,"Hussey to Sarwan, SIX runs Shot boss. He waltzed down the track, reached the pitch and lifted a flighted delivery straight over the bowler's head."
436,"Hussey to Sarwan, 1 run skips down to drive to long-off. 50 for Sarwan"
437,"Watson to Sarwan, 1 run on the pads, turned to long leg"
438,"Watson to Gayle, no run back of length, outside off stump, skids on to Gayle who chops it to backward point"
439,"Watson to Gayle, 1 run slower one, full, square drive through cover point"
440,"Watson to Sarwan, 1 run full length delivery outside off, guided to Lee at third man"
441,"Watson to Gayle, FOUR runs Low full toss. The bat comes down. Blink. The ball is picked up from extra cover boundary"
442,"Watson to Gayle, no run leans forward to defend down the track"
443,"Bracken to Sarwan, 1 run outside the off stump, cut down to third man"
444,"Bracken to Gayle, 1 run back of length, coming in, punched to long-on"
445,"Bracken to Sarwan, no run pushes a length delivery to the off side"
446,"Bracken to Sarwan, 1 run short in length, sits up outside off and Sarwan flat-bats it to long-off."
447,"Bracken to Gayle, 1 run short in length, forced to long-on"
448,"Bracken to Sarwan, 1 run on the leg and middle, worked past square leg. Three Aussies converge on the ball."
449,"Lee to Sarwan, FOUR runs Oh ho Sarwan has creamed that. He backed to the legside and slapped a short-of-length delivery just outside off stump. Talk about intent."
450,"Lee to Sarwan, FOUR runs And now a delicate late cut. He waited for the ball to come to him, opened the bat-face and glided it through vacant slip region"
451,"Lee to Sarwan, no run The bouncer. Sarwan pulls but bottom edges it to the ground and Ronchi dives. The battle is on"
452,"Lee to Sarwan, OUT Lee takes out Sarwan. It kicked up from short of length and came in from outside off, Sarwan wanted to punch it square off the back foot, the bat went outside the line and he feathered a inner edge. Enter Chanders."
453,"Lee to Chanderpaul, no run short in length, outside off, dabbed to point"
454,"Lee to Chanderpaul, no run gets behind the line of a short-of-length delivery and turns it to the on side."
455,"Bracken to Gayle, 1 run on the middle and leg, turned to deep midwicket"
456,"Bracken to Chanderpaul, no run short of length outside off stump, nudged to the on side."
457,"Bracken to Chanderpaul, no run full length outside off stump, steered to backward point"
458,"Bracken to Chanderpaul, no run kicks up from a length, Chanderpaul looks to defend, is surprised at the extra bounce, takes the bottom-hand off the handle and jabs the ball to the on side"
459,"Bracken to Chanderpaul, 1 run leans forward to turn a full length delivery behind square leg"
460,"Bracken to Gayle, no run slips to the pads, turned straight to Lee at short fine leg."
461,"Lee to Chanderpaul, no run"
462,"Lee to Chanderpaul, FOUR runs short in length and outside off stump, Chanderpaul gets up and running with a cut shot."
463,"Lee to Chanderpaul, no run swing and a miss. Full, outside off stump, Chanderpaul slashed hard but no wood on leather"
464,"Lee to Chanderpaul, FOUR runs Chanders pings the extra cover boundary. He went down on his knee to scoop a full delivery - a slower one - outside off over the off side field"
465,"Lee to Chanderpaul, no run short in length and outside off, cut to backward point"
466,"Lee to Chanderpaul, 1 run fuller, driven towards mid-off for a quick single."
467,"Bracken to Chanderpaul, 1 run on the middle stump line, wristed to deep square leg region for a single"
468,"Bracken to Gayle, 1 run short in length, outside off stump, pushed down to long-on for a single"
469,"Bracken to Chanderpaul, 1 run short in length and Chanderpaul fetches it from outside off and drags his pull to long leg"
470,"Bracken to Gayle, 1 run on the middle and leg, nudged to midwicket region for a quick single. The bearded Symonds with the throw but he misses and Gayle survives"
471,"Bracken to Chanderpaul, no run leans forward to turn a full length delivery to Symonds. They don't attempt a run now"
472,"Bracken to Chanderpaul, 1 run on the middle and off, turned around the corner to the right of Lee at short fine leg"
473,"Lee to Chanderpaul, 1 wide The high bouncer. It sails well above Chanderpaul"
474,"Lee to Chanderpaul, 1 run fuller, on the middle and leg, tries to turn it to square leg and gets a leading edge t o third man"
475,"Lee to Gayle, (no ball) the yorker ends up as a low full toss, pushed down the track. Free hit coming up folks"
476,"Lee to Gayle, SIX runs The slow bouncer, Gayle waits before pulling it to deep midwicket boundary. Tragi comedy there. Marsh has his eyes fixed on the ball which sails over him and he trips over the boundary hoardings."
477,"Lee to Gayle, no run pushed to the off side"
478,"Lee to Gayle, no run leans forward to push a full delivery back to Lee"
479,"Lee to Gayle, no run length delivery on the off and middle, squeezed to cover point"
480,"Lee to Gayle, 1 run tip and run. Pushed to mid-off and Gayle retains the strike with a quick dash across"
481,"Bracken to Gayle, no run leans forward to jab a length delivery coming in to the middle. Scrambled seam and Gayle was early into the drive and edges it to his pad"
482,"Bracken to Gayle, no run back of length, just outside off, punched back to the bowler."
483,"Bracken to Gayle, 1 run on the hips, tucked to left of midwicket."
484,"Bracken to Chanderpaul, no run cut and a miss. Short of length delivery outside off and Chanderpaul goes for the shot"
485,"Bracken to Chanderpaul, 1 run steered to the off side"
486,"Bracken to Gayle, 1 run punched to long-on for a single"
487,"Clarke to Gayle, FOUR runs floated outside off stump, full and Gayle murders it to long-on boundary. Wham."
488,"Clarke to Gayle, no run driven back to the bowler"
