,Data
196,"Coulter-Nile to Bresnan, FOUR runs length ball struck frimly wide of long-on and Finch simply can't be bothered running to his right, a lazy one hand and he misses the ball completely"
197,"Coulter-Nile to Bresnan, 1 run huge swing and a thick inside edge to long leg"
198,"Coulter-Nile to Bopara, OUT huge swing at a full ball, gets a huge inside edge into his pad and it trickles slowly into leg stump and that is a very unfortunate way to go. The ball cannoned of the inside of his pad and agonisingly rolled steadily towards the stumps, glanced the base of the leg stick and off dropped the bail"
199,"Coulter-Nile to Jordan, no run blocked on the back foot in front of off stump"
200,"Muirhead to Bresnan, no run tossed up, Bresnan ends up trying to late cut off the stumps and almost misses, gets a bottom edge to slip on the bounce"
201,"Muirhead to Bresnan, SIX runs nice stride down the wicket and hammered down the ground, strong shot"
202,"Muirhead to Bresnan, OUT swing outside off, misses courtesy of the turn, Wade has the bails off and there's a strong appeal for a stumping and Wade was sharp to remove the bails as Bresnan dragged his bag foot a good two inches out of his ground and fails to get back in time"
203,"Muirhead to Broad, no run tries to paddle sweep from outside off and misses"
204,"Muirhead to Broad, 1 run shorter, flicked around the corner to deep-backward square who's very fine"
205,"Muirhead to Jordan, no run floated up on off stump, driven off a thick outside edge to backward point"
206,"Coulter-Nile to Broad, 1 run back of a length, angled to backward point and they get a sharp single"
207,"Coulter-Nile to Jordan, no run bumper, well-directed, Jordan misses with a hook"
208,"Coulter-Nile to Jordan, no run full angled in, Jordan gets struck on the pad squared up"
209,"Coulter-Nile to Jordan, no run full and swung, missed completely, it goes past leg stump"
210,"Coulter-Nile to Jordan, FOUR runs short and gets a bat on this, manages to get it backward of square and finds the gap"
211,"Coulter-Nile to Jordan, no run swing and a miss at a full ball again, it grazes leg stump again"
212,"Muirhead to Dernbach, no run back to cut or pull or smash it anywhere, he missed"
213,"Muirhead to Dernbach, 1 run full toss outside off, smashed almost to mid-on, it just doesn't carry"
214,"Muirhead to Jordan, FOUR runs floated up outside off, driven nicely on the up and gets it wide of mid-off, well timed"
215,"Muirhead to Jordan, no run turn away from off stump, swung at, hit on the toe into the covers"
216,"Muirhead to Jordan, 1 run swung from off stump, it whirls off a thick outside edge towards deep point"
217,"Starc to Jordan, no run full at the stumps, aims leg side and gets a thick edge into his pad"
218,"Starc to Jordan, 1 run, OUT short outside off, pulled into midwicket, Dernbach wants to come back for two, whoopsie! It's never on and he's run out by a street trying to scramble back to the striker's end and that's a calamitous end to a truly horrendous tour for England"
219,"All over, it had been all over for a long time really, Australia win by 84 runs which is a colossal margin in a T20. It wraps up a 3-0 victory in this series and completes a 12-1 annihilation for England on this trip which has been as miserable as a grey afternoon in Barnsley. Oh goodness have England been pathetic but at least it's al"
220,"Today, England were doing quite well with a run of wickets but not for the first time the decent position was whipped from them. George Bailey did the damage in a final over spanking of Jade Dernbach and England were never going to chase 196 and never got in the game second innings."
221,"Right, at long last this series is over and may Australia and England not play each other for a very long time! We've had enough fixtures to last a lifetime in this past eight months. But both teams are in action again pretty soon with Australia travelling to South Africa for a mouthwatering Test series and England back in action at th"
222,Australia won by 84 runs
223,"Player of the match is George Bailey, AUS"
