,Data
246,"Australia made New Zealand work hard for what seemed like a paltry 181 in the first ODI, so getting 226 will not be all that easy. The visitors will hope for a better display from their top order, particularly McCullum, who hasn't scored a fifty in nine innings."
247,"Welcome back to the run chase. Kanishkaa has returned to his desk, and it's Siddhartha Talya taking over."
248,"Bracken to McCullum, no run good length on middle and leg, defended off the front foot back to the bowler"
249,"Bracken to McCullum, no run short of a length on middle and off, defended watchfully on the off side"
250,"Bracken to McCullum, 1 leg bye straying on the pads, he tries to turn it down fine, gets a leg bye as it clips his pads"
251,"Bracken to Guptill, no run short of a length outside off, waits for it and opens the face to guide it to point"
252,"Bracken to Guptill, no run short of a good length on middle and leg, defended towards midwicket"
253,"Bracken to Guptill, no run short of a good length on the off stump, defended on the front foot to cover"
254,"Hilfenhaus to McCullum, 1 run shaping away from the right hander, bowled on a good length outside off, McCullum opens the face to guide it to third man"
255,"Hilfenhaus to Guptill, no run good movement away from the batsman, fuller outside off, Guptill lets it go"
256,"Hilfenhaus to Guptill, no run bang on target, a testing line just marginally outside off, there's some late movement away as well, defended solidly on the off side"
257,"Hilfenhaus to Guptill, no run held it back a touch this time, in the channel outside off, left alone"
258,"Hilfenhaus to Guptill, no run beaten! Short of a good length outside off, hitting the pitch hard and then swinging away, Guptill prods at it away from his body, is done in by the movement and the extra bounce"
259,"Hilfenhaus to Guptill, no run much straighter and plays it well this time, gets forward and defends it confidently towards mid-off"
260,"Bracken to McCullum, no run pitched outside leg and struck him on the pads as he tried to work it away fine"
261,"Bracken to McCullum, 1 wide down the leg side, McCullum fails to glance it down fine, given a wide anyway"
262,"Bracken to McCullum, no run full on middle and moving into the right hander, driven firmly to mid-on"
263,"Bracken to McCullum, no run almost! Short of a length on the off, spat off the pitch but McCullum played it with soft hands, it took the outside edge and fell short of a diving Cameron White at slip"
264,"Bracken to McCullum, 2 runs short on middle and leg, pushed away into the leg side towards square leg for a couple"
265,"Bracken to McCullum, 2 runs full on the pads, shuffles just a touch and flicks it away wide of short fine for two more"
266,"Bracken to McCullum, no run good length on middle and leg, pushed off the front foot to mid-on"
267,"Hilfenhaus to Guptill, no run fielded well off his own bowling, driven firmly back to him, he sticks out his left hand to prevent a couple of runs"
268,"Hilfenhaus to Guptill, 1 run dropped short of cover for a quick single"
269,"Hilfenhaus to McCullum, FOUR runs full outside off, and in the zone for McCullum, he makes a bit of room and carts it over the covers for a boundary"
270,"Hilfenhaus to McCullum, 2 wide misdirected slower ball bowled short outside leg stump, he tries to help it on its way to the fine-leg boundary, misses, but it's given a wide"
271,"Hilfenhaus to Guptill, FOUR runs dropped, short and wide, Guptill cuts it away powerfully over Clarke at point, the ball clips Michale Clarke's fingers on its way to the boundary. He was slow to react there, perhaps still recovering from the sore toe"
272,"Hilfenhaus to Guptill, 3 runs shot! Fractionally short outside off and Guptill eases that through the covers off the back foot fot three runs"
273,"Hilfenhaus to McCullum, no run almost chopped it on, short of a length on the off stump, not enough room there to cut, he tries to do just that, gets an inside edge that doesn't miss the off stump by much"
274,"Bracken to Guptill, no run beaten! Short of a good length outside off, anging away with the angle, he tries to defend it off the back foot, misses"
275,"Bracken to Fulton, 2 runs full on middle and leg, driven wide of midwicket off the front foot for a couple"
276,"Bracken to Fulton, no run held its line this time, good length outside off, he gets outside the line to defend it back to the bowler"
277,"Bracken to Fulton, no run pitched outside leg and moved into Fulton who tried to work that away on the leg side, got an inside edge onto his pads"
278,"Bracken to Fulton, no run a good testing line outside off stump, going away with the angle, Fulton shoulders arms to that one"
279,"Hilfenhaus to McCullum, no run short on middle and leg, turned away off his hips towards square leg"
280,"Hilfenhaus to McCullum, no run short on middle, McCullum senses a chance and goes for a mighty pull over square leg, the ball brushes his trousers on the way to the keeper. Haddin goes up, so does the bowler, but the umpire Paul Reiffel is unmoved"
281,"Hilfenhaus to McCullum, no run short of a length on middle and leg, played away to square leg"
282,"Hilfenhaus to McCullum, no run bouncer banged in short on middle, McCullum ducks under it, one for the over"
283,"Hilfenhaus to McCullum, no run short of a good length on leg stump, tries to turn it away fine, is struck on the thighs"
284,"Hilfenhaus to McCullum, no run similar ball, similar result, the ball drops on the leg side, they decide against the single"
285,"Bracken to Fulton, 1 run good length outside off, pushed firmly off the front foot wide of mid-off for a single"
286,"Bracken to McCullum, 1 run full outside off, opens the face to run it down to third man"
287,"Bracken to Fulton, no run pitching on a good length on middle and off, defended off the front foot to the bowler"
288,"Bracken to Fulton, no run fuller on the off stump, lunges forward to push it to cover"
289,"Bracken to Fulton, no run short of a length on the off stump, defended off the back foot to cover"
290,"Bracken to Fulton, no run good length outside off, left alone to the keeper"
291,"Hilfenhaus to McCullum, 3 runs straying in line this time, its full on the pads, flicked away through square leg for three runs"
292,"Hilfenhaus to Fulton, no run on a good length on middle and leg, driven off the front foot to mid-on"
293,"Hilfenhaus to Fulton, 2 runs pushed off the front foot wide of a diving cover, Clarke gives chase but returns a rather wayward throw to the non-strikers end, the batsmen run an easy two"
294,"Hilfenhaus to Fulton, no run ouch! Short on middle, Fulton attempts to duck, it hits him on his back, but he's fine, no show of pain there"
295,"Hilfenhaus to Fulton, no run missed run out, short of a length on middle, turned away to midwicket and McCullum is halfway down the pitch, the fielder takes aim but misses the stumps at the non-strikers end by a whisker. McCullum was miles outside the crease"
296,"Hilfenhaus to Fulton, no run on middle and leg, played away to square leg"
297,"Bracken to McCullum, no run back of a length on the off stump, struck firmly to cover"
298,"Bracken to McCullum, no run he needs to bowl much fuller here it's short again outside the off stump, guided to point off the back foot"
299,"Bracken to McCullum, no run cramped him for room there, opens the face to play it to point once again"
300,"Bracken to McCullum, FOUR runs shot! Good length outside off, edges it deliberately just at the last moment wide of a diving third man for a boundary"
301,"Bracken to McCullum, no run in the channel outside off, defended into the off side"
302,"Bracken to McCullum, no run beaten this time, angling away from the right hander after it's bowled wide the crease, McCullum walks across and tries to run it down to third man, fails to make contact"
303,"Hilfenhaus to Fulton, FOUR runs poor ball and gets the treatment, full on middle and leg, Fulton gets under it and flicks it away over midwicket"
304,"Hilfenhaus to Fulton, no run held it back, its short of a length on the off stump, defended off the back foot towards cover"
305,"Hilfenhaus to Fulton, no run punched off the back foot towards point, bowled on a good length this time"
306,"Hilfenhaus to Fulton, FOUR runs begging to be hit there, banged in short on middle, its a rank long hop and Fulton rocks onto the back foot to pull it away over square leg"
307,"Hilfenhaus to Fulton, no run short of a good length on middle, defended back to the bowler"
308,"Hilfenhaus to Fulton, no run tries to cut it away towards point this time, gets a thick inside edge towards midwicket instead"
309,"Johnson to McCullum, 2 runs Almost produces a wicket, slower ball bowled full outside off, McCullum chases it, ends up slicing it really high but in a safe zone between third man and deep cover, failed to pick the slower one there"
310,"Johnson to McCullum, no run zipped away off the pitch, short of a good length outside off and cut away as McCullum tried to defend it off the back foot"
311,"Johnson to McCullum, no run short of a length on middle and off, guided off the back foot to point"
312,"Johnson to McCullum, 1 run full outside off, driven firmly but straight to mid-off, who's on the circle, and they manage to sneak a single"
313,"Johnson to Fulton, 1 run short on middle and leg, turned away off the back foot wide of square leg for a single"
314,"Johnson to McCullum, 1 run pushed through the covers off the back foot for a single"
315,"Clarke to McCullum, no run tossed up on middle and off, driven back to the bowler"
316,"Clarke to McCullum, 1 run drifting into the batsman, tries to drive it back past Clarke, gets an inside edge towards short fine"
317,"Clarke to Fulton, 1 run full on middle and leg, driven to mid-on for a single"
318,"Clarke to McCullum, no run flighted on middle and leg, angling into the batsman from round the wicket, gets forward and defends"
319,"Clarke to McCullum, no run full on the pads, angling down leg, tries to work it away, is hit on the pads"
320,"Clarke to McCullum, 1 run shorter on middle and leg, flicked away wide of square leg for a single"
321,"Johnson to McCullum, 1 run slower ball bowled on a good length outside off, square driven to deep cover for a single"
322,"Johnson to Fulton, no run on middle and leg, pushed off the front foot to mid-on"
323,"Johnson to Fulton, no run short of a good length outside off, goes for it, its a touch too wide, but he fails to reach"
324,"Johnson to Fulton, 1 run gets forward and pushes it firmly wide of mid-off for a single"
325,"Johnson to McCullum, no run short of a good length on middle and off, defended off the back foot to the bowler"
326,"Johnson to McCullum, 1 run pushed off the back foot to deep cover for an easy single"
327,"Clarke to McCullum, 1 run tossed up on middle and leg, pushed wide of midwicket for a single"
328,"Clarke to Fulton, no run flighted on middle, tries to driven it to long-off, gets an inside edge onto his pads"
329,"Clarke to Fulton, 1 run flighted on leg stump, driven down the ground to long-on"
330,"Clarke to McCullum, no run turned away straight to square leg, just a fraction short on leg stump"
331,"Clarke to McCullum, 2 runs flighted on middle, driven firmly back past the bowler, its racing to the long-on boundary but Mitchell Johnson pulls off an excellent save to keep the batsmen to two"
332,"Clarke to McCullum, no run struck to cover off the back foot"
333,"Johnson to Fulton, no run short of a good length outside off, struck firmly to cover"
334,"Johnson to Fulton, FOUR runs overpitched outside off and gets the treatment, driven crisply off the front foot wide of mid-off all the way to the boundary. Easily done"
335,"Johnson to Fulton, no run similar delivery, but not as full, attempts an identical shot but is beaten by the late away movement"
336,"Johnson to Fulton, no run short of a good length on middle and off, defended back to the bowler"
337,"Johnson to Fulton, no run much straighter this time, played away into the leg side"
338,"Johnson to Fulton, no run short on the off stump, presents the full face to defend to cover"
339,"Hopes to McCullum, no run good length on middle and leg, defended off the front foot towards midwicket"
340,"Hopes to McCullum, no run short of a length outside off, goes for a cut, but there's hardly any foot movement there, misses. Perhaps it didn't bounce as much as he expected"
341,"Hopes to McCullum, 1 run turned away off the front foot wide of midwicket"
342,"Hopes to Taylor, 1 run short outside off, cut away fiercely towards third man"
343,"Hopes to McCullum, no run slower ball bowled full outside off, driven firmly off the front foot towards extra cover"
344,"Johnson to Taylor, no run a touch too wide outside off, held its line, left alone by Taylor"
345,"Johnson to Taylor, no run good ball, full on middle and off, it seemed as if Taylor was initially playing inside the line to that one, managed to get his bat down in time and defend it towards mid-off"
346,"Johnson to Taylor, 1 run full on the off stump and swinging into the right hander, driven firmly to deep cover"
347,"Johnson to McCullum, no run slower ball bowled on a good length on the off stump, defended watchfully towards extra cover"
348,"Johnson to McCullum, no run in the corridor outside off, swinging away after pitching, left alone to the keeper"
349,"Johnson to McCullum, 1 run short of a good length on the off stump, dropped on the off side and they set off for a quick single"
350,"Hopes to McCullum, no run a probing line outside off stump, McCullum has been quite sedate today, left alone to the keeper"
351,"Hopes to McCullum, no run an attempted bouncer outside off, but the pitch is really slow, took a while to reach the keeper who took it on his knees"
352,"Hopes to McCullum, 1 run pushed wide of cover and they steal a quick single"
353,"Hopes to Taylor, no run good length outside off and some inward movement on its way to the keeper"
354,"Hopes to Taylor, no run fuller on middle and leg, defended off the front foot to mid-on"
355,"Hopes to Taylor, 1 run good length outside off, driven firmly but straight to deep cover"
356,"Johnson to Taylor, no run full outside off and angling away from the right hander, left alone"
357,"Johnson to Taylor, no run short of a good length outside off, left alone yet again"
358,"Johnson to Taylor, no run tries to push it away on the leg side, gets a thick outside edge off a good length ball on the off as it rolls towards Clarke at point"
359,"Johnson to Taylor, no run slower ball bowled full on the off stump and angling away, drew Taylor forward and deceives him completely as he tries to defend it towards cover"
360,"Johnson to Taylor, 3 runs poor fielding, pushed to midwicket off the back foot, David Hussey needlessly attempts a direct hit at the non-striker's end, it's wayward and concedes two more on overthrows"
361,"Johnson to McCullum, FOUR runs full outside off stump, driven back firmly past the bowler to evade a diving mid-off for a boundary"
362,"Hopes to Taylor, no run rank long hop outside off, missed opportunity, pulled away straight to midwicket"
363,"Hopes to Taylor, no run full outside off stump, driven well on the front foot to mid-off"
364,"Hopes to Taylor, 1 run kept a touch low but played well in the end, short of a good length outside off, pushed off the front foot towards deep cover for a single"
365,"Hopes to McCullum, no run good length on the off stump, defended to extra cover"
366,"Hopes to McCullum, no run banged in short outside off, McCullum backs away from it after giving the bowler the charge even before the ball is delivered"
367,"Hopes to McCullum, no run fuller on the off stump, driven crisply but straight to mid-off"
368,"Johnson to Taylor, no run short of a good length outside off and moving away with the angle, left alone"
369,"Johnson to Taylor, 1 run struck on the pads as he tries to turn it away towards square leg, they scramble a run"
370,"Johnson to McCullum, 2 runs full on middle and leg, driven wide of midwicket off the front foot for a couple"
371,"Johnson to McCullum, no run full outside off and swinging away just a touch, caught him walking as he attempted a drive"
372,"Johnson to McCullum, 1 run short of a length outside off, edged away towards third man, that wasn't entirely deliberate, was probably trying to guide it towards point"
373,"Johnson to Taylor, no run full outside off and square driven powerfully to Clarke at point who does well to get his hands to it, would have gone for a four otherwise"
374,"Hopes to McCullum, no run on middle and off, defended off the front foot to cover"
375,"Hopes to McCullum, no run much fuller this time, presents the full face to drive it to cover"
376,"Hopes to McCullum, no run defended watchfully this time, it's slightly overpitched by McCullum's taking no chances here"
377,"Hopes to McCullum, 4 leg byes straying on the pads and pays the price, he tries to glance it down fine, but it brushes his pads on the way to the fine-leg boundary"
378,"Hopes to McCullum, 1 run full on the pads, pushed to mid-on for a single"
379,"Hopes to Taylor, 1 run short outside off, pulled all along the ground towards deep midwicket for a single"
380,"Clarke to Taylor, 2 runs full outside off, driven firmly wide of deep cover for a couple"
381,"Clarke to Taylor, no run tossed up on middle and off, pushed off the front foot wide of midwicket"
382,"Clarke to Taylor, no run turned away to square leg this time, maintaining a stump-to-stump line"
383,"Clarke to Taylor, no run drifting into the pads, tries to play it fine, is struck high on the pads"
384,"Clarke to Taylor, 1 run whipped away off the back foot wide of square leg for a single"
385,"Clarke to McCullum, no run slightly short outside off, cut away to point"
386,"Hopes to Taylor, no run short of a length outside off, pushed off the back foot to cover"
387,"Hopes to Taylor, no run opens the face to guide it to point"
388,"Hopes to Taylor, no run full outside off, driven firmly, but straight to extra cover"
389,"Hopes to Taylor, no run good over so far, dropped off the back foot into the off side, looks for a single, but is sent back"
390,"Hopes to Taylor, no run good length on middle and leg, pushed off the front foot to mid-on"
391,"Hopes to Taylor, 1 run finally a run, but an excellent over nevertheless, chopped down wide of cover for a quick single"
392,"Clarke to Taylor, no run slightly short on leg stump, turned away to square leg"
393,"Clarke to Taylor, 1 run tossed up on leg stump, driven down the ground to long-on"
394,"Clarke to McCullum, 2 wide Hahaa, Haddin takes off the bails with his gloves again, its fired down the leg side and his gloves flick the bails as he tries to collect"
395,"Clarke to Taylor, no run short of a length on middle, pushed off the front foot to midwicket"
396,"Clarke to Taylor, 1 run flighted on middle and leg, tries to drive it down the ground, gets an inside edge down to fine leg"
397,"Clarke to McCullum, no run pushed off the back foot into the off side"
398,"Clarke to McCullum, no run cramped for room, tries to cut, is only able to chop it down towards point"
399,"Hopes to Taylor, 2 runs full on middle and leg, chipped over midwicket for a couple, he's trying to get a move-on now"
400,"Hopes to Taylor, no run short of a good length outside off and some late away movement, Taylor tries o cut that past point but it's a touch too quick for him"
401,"Hopes to Taylor, 1 run full on the pads, driven to long-on"
402,"Hopes to McCullum, no run short of a length outside off, misses out on a pull, ends up mistiming it to midwicket"
403,"Hopes to McCullum, no run much fuller on the off stump, defended solidly on the off side"
404,"Hopes to McCullum, 1 run short on middle and leg,walks across and helps it on its way to fine leg"
405,"Clarke to McCullum, 2 runs on middle and off, paddled away really fine wide of Hilfenhaus in the deep for a couple"
406,"Clarke to McCullum, no run tossed up on middle and off, defended off the front foot back to the bowler"
407,"Clarke to McCullum, 1 run makes room and drives that down the ground to long-on, didn"
408,"Clarke to Taylor, no run short on middle and leg, pushed off the back foot to mid-on"
409,"Clarke to Taylor, no run pushed in quicker on middle and off, defended on the off side"
410,"Clarke to Taylor, FOUR runs errs in length ever so slightly and pays the price, that was coming, flighted outside off and lands really full, Taylor stays his ground and lofts it between long-off and deep cover for a pressure-relieving boundary"
411,"Hopes to Elliott, no run short of a good length outside off, pushed off the back foot towards point"
412,"Hopes to Elliott, no run and again, is nicely behind it, and opens the face to play it to point"
413,"Hopes to Elliott, no run swinging in this time, good length on middle and off, defended off the back foot on the leg side"
414,"Hopes to Elliott, no run a touch fuller there, tries to play an off drive, gets a thick inside edge to mid-on"
415,"Hopes to Elliott, no run bouncer banged in short on middle, Elliot has nothing to do with it"
416,"White to Taylor, 2 runs tossed up outside leg stump, turns it away wide of fine leg for a couple"
417,"White to Taylor, 1 run some spin there for White, good length on leg stump, pushed wide of midwicket for a single"
418,"White to Elliott, 2 runs flighted outside off, driven towards deep cover who has to run in a few paces to pick that up, by the time he's returned a throw to the non-striker's end, the batsmen have come back for the second"
419,"White to Elliott, 1 leg bye tossed up on middle, takes it on the full and paddles it down to fine leg"
420,"White to Taylor, no run lands full outside off, driven off the front foot to cover"
421,"White to Taylor, 1 run really slow through the air there, pushed towards square leg"
422,"Hopes to Taylor, 1 wide too wide outside off, lands full but the batsman rightly lets it go"
423,"Hopes to Taylor, no run short of a good length on the off stump, pushed back to the bowler"
424,"Hopes to Taylor, 1 run short of a length outside off, chopped away to deep cover"
425,"Hopes to Elliott, 1 run fuller on the off stump, steered to third man"
426,"Hopes to Taylor, 1 run played away to cover off the front foot and sets off for a quick single, Taylor stretches to make it to the other end as Clarke fires in a throw"
427,"Hopes to Elliott, no run full on the off stump, driven off the front foot to mid-off"
428,"Hopes to Elliott, no run guided to point off the front foot, bowled on a good length outside off"
429,"White to Taylor, 1 run tossed up outside off, lands full, driven all along the ground to long-off"
430,"White to Elliott, 2 runs flighted outside off, driven firmly to cover where a fumble allows them to come back for the second, Taylor again in the firing line as a throw from Bracken to the non-strikers end almost had him struggling"
431,"White to Elliott, 1 run pushed off the back foot towards square leg"
432,"White to Taylor, 1 run on middle and leg, worked away to fine leg"
433,"White to Elliott, 2 runs shot! Filghted outside off and its overpitched, leans into the drive and places it between long-off and deep cover for a couple"
434,"White to Elliott, 1 leg bye good length outside leg stump, flicked away fine for a single"
435,"Johnson to Elliott, no run edged straight away, full on middle and off, tries to defend it back to the bowler, the ball lands well short of White, who's standing really wide, and really deep at slip"
436,"Johnson to Elliott, no run beaten this time, full outside off and he goes for the drive, fails to reach it"
437,"Johnson to Elliott, 1 wide full down the leg side, tries to glance it down fine, misses"
438,"Johnson to Elliott, no run almost yorker length outside off, dug out to cover"
439,"Johnson to Elliott, 1 run good length outside of stump, eased through the covers for a single"
440,"Johnson to Taylor, 1 run swinging into Ross Taylor after landing on a good length on the off stump, tries to play it on the leg side, gets a thick outside edge towards deep cover for a single"
441,"Johnson to Elliott, no run tries to open the face off the front foot to run it down to the third man, is beaten as the ball swings away after pitching"
442,"White to Taylor, 1 run flighted outside off, struck off the front foot to deep cover"
443,"White to Elliott, 1 run full toss outside off, the deep cover fielder is made busy again"
444,"White to Taylor, 1 run and again, low full toss that is driven into the vacant off side field"
445,"White to Elliott, 1 run tossed up outside off, paddled down towards square leg for a single"
446,"White to Taylor, no run on middle and leg, thrown up this time, pushed back to the bowler"
447,"White to Taylor, 1 run struck firmly to extra cover who dives but fails to prevent the single"
448,"Johnson to Taylor, 1 run full outside off, squeezed through to deep cover"
449,"Johnson to Elliott, no run short of a good length on middle and leg, defended off the back foot"
450,"Johnson to Elliott, no run good length outside off, he chases it, looks to square drive it towards point, missed it"
451,"Johnson to Elliott, 2 runs short of a length on middle and leg, turned away wide of square leg off the back foot for a single"
452,"Johnson to Elliott, no run short on middle, pushed to midwicket off the back foot"
453,"Johnson to Elliott, no run steered to point off the front foot, full outside off"
454,"Hussey to Taylor, 1 run tossed up on middle and leg, flicked away wide of square leg for a single"
455,"Hussey to Elliott, no run flighted on middle and off, driven to midwicket"
456,"Hussey to Elliott, no run on the off stump, pushed back to the bowler"
457,"Hussey to Elliott, 1 run steps out and drives it down the ground to long-on"
