,Data
0,"Deonarine to Katich, no run defends into the cover"
1,"Deonarine to Katich, no run plays off the back foot towards mid off"
2,"Deonarine to Katich, no run cuts to Bravo at backward point"
3,"Deonarine to Katich, no run drives to extra cover, Benn there fields it"
4,"Deonarine to Katich, no run comes forward in defence to short leg"
5,"Deonarine to Katich, no run defends to short cover"
6,"Benn to Hussey, no run defends into the off side"
7,"Benn to Hussey, no run plays forward and is hit on the pad, an appeal but appears to be struck outside off stump"
8,"Benn to Hussey, no run plays back in defence to short leg"
9,"Benn to Hussey, no run comes forward in defence"
10,"Benn to Hussey, no run leg side, tries to glance and misses"
11,"Benn to Hussey, no run defends to the on side - a tidy maiden"
12,"Deonarine to Katich, 2 runs drives out to deep cover, easy couple there"
13,"Deonarine to Katich, 1 run comes forward and pushes to square leg"
14,"Deonarine to Hussey, no run drives to mid off"
15,"Deonarine to Hussey, no run short, pushes to mid off"
16,"Deonarine to Hussey, no run short, pulls to mid wicket"
17,"Deonarine to Hussey, no run cuts to Benn at backward point, over again bowled in about 2 mins"
18,"Benn to Katich, no run defends to silly point"
19,"Benn to Katich, no run tries to turn to leg, hit on the pad and there is an appeal, knocked back by Bowden and there will be a referral"
20,"Benn to Katich, no run comes forward in defence, neatly played"
21,"Benn to Katich, no run defends off the back foot to point"
22,"Benn to Katich, no run defends to the on side"
23,"Benn to Katich, no run defends to silly point again"
24,"Deonarine to Hussey, no run pushes to point, no single there"
25,"Deonarine to Hussey, no run drives to Dowlin at mid off"
26,"Deonarine to Hussey, no run defends to short cover"
27,"Deonarine to Hussey, no run quicker ball, defends to silly point"
28,"Deonarine to Hussey, no run back a length, defends off the back foot"
29,"Deonarine to Hussey, no run drives to mid off, should be another over there"
30,"Benn to Katich, 3 runs advances and tries to work to mid wicket, ball goes in error behind square leg"
31,"Benn to Hussey, no run"
32,"Benn to Hussey, 2 runs works off his pads to deep square leg"
33,"Benn to Hussey, no run defends off his pads to leg slip, Bravo does well"
34,"Benn to Hussey, 1 run drives to mid on, Rampaul a little on the deep side there - an easy single"
35,"Benn to Katich, 1 run leg side and it is worked to deep square leg and that's Tea"
36,"Deonarine to Katich, 1 run Katich cuts off the back foot to deep point"
37,"Deonarine to Hussey, 1 run flat and shortish ball, Hussey plays towards point for one"
38,"Deonarine to Katich, no run Katich waits and cuts another one from outside off to point"
39,"Deonarine to Katich, 1 run placed wide of Nash at point once again for a single"
40,"Deonarine to Hussey, 1 run another run out missed! Hussey played the ball straight to midwicket and called Katich for a risky run, Katich would have been out by a metre at least but the throw from Roach wa"
41,"Deonarine to Katich, no run defended on the leg side, Hussey wants one but gets sent back"
42,"Benn to Hussey, 1 run nudged towards point for a single"
43,"Benn to Katich, no run Katich strides forward and drives a full ball towards cover"
44,"Benn to Katich, no run Katich moves back and across and plays the ball on the leg side"
45,"Benn to Katich, FOUR runs tossed up outside off, Katich reaches out for it, gets to the pitch of the ball, and drives the ball along the ground through cover, he moves into the 80s"
46,"Benn to Katich, no run played to mid-on off the front foot"
47,"Benn to Katich, no run dropped, but a hard chance, Katich reaches out and fends at the ball, the fielder at short leg dives to his right and gets hand to it, he then fumbles and tries to catch the ball wit"
48,"Deonarine to Hussey, no run Hussey defends on the off side"
49,"Deonarine to Hussey, no run defended on the front foot"
50,"Deonarine to Hussey, no run played towards cover"
51,"Deonarine to Hussey, 1 run pushed to mid off for one"
52,"Deonarine to Katich, no run played on the off side on the front foot"
53,"Deonarine to Katich, no run padded away from outside off towards first slip"
54,"Benn to Hussey, no run played towards short leg, Hussey was out of his crease and had to hurry back"
55,"Benn to Hussey, no run strides forward and blocks"
56,"Benn to Hussey, 1 run defended on the front foot towards cover"
57,"Benn to Katich, no run bowled flat and straight, Katich defends once again"
58,"Benn to Katich, no run defended on the front foot by Katich"
59,"Benn to Katich, no run Katich moves back and across to play the ball to forward short leg"
60,"Deonarine to Hussey, no run Hussey moves back and cuts the offspinner to point"
61,"Deonarine to Hussey, FOUR runs Hussey skips down the track, gets to the pitch of the ball and lofts Deonarine straight over his head, that bounced just inside the boundary, long-on drops back now"
62,"Deonarine to Hussey, no run driven off the front foot to cover"
63,"Deonarine to Hussey, no run played back to the bowler"
64,"Deonarine to Hussey, 2 runs Hussey stays back and cuts the ball through cover"
65,"Deonarine to Hussey, 1 run played towards mid-on for a single"
66,"Benn to Hussey, 1 run short ball and down leg side, Hussey gets down on one knee and pulls to long leg"
67,"Benn to Katich, no run Katich steps forward, a little hesitantly, and blocks"
68,"Benn to Katich, FOUR runs shot! Katich uses his feet, doesn't get to the pitch of the ball, but still hits straight through the line over the bowler's head"
69,"Benn to Katich, no run now he moves right across his stumps and plays the ball behind square leg"
70,"Benn to Katich, no run defended towards the bowler"
71,"Benn to Katich, no run Katich defends with bat close to front pad"
72,"Deonarine to Hussey, 1 run pushed off the front foot towards cover"
73,"Deonarine to Katich, no run Katich guides the ball towards backward point"
74,"Deonarine to Katich, FOUR runs width offered outside off stump, Katich is back in a flash and cuts the ball deftly but firmly past Nash at backward point, he moves into the 90s"
75,"Deonarine to Katich, no run defended on the leg side"
76,"Deonarine to Katich, no run pushed off the front foot, a bit in the air, but it falls short of Gayle at short cover"
77,"Deonarine to Katich, 2 runs cut towards point for another single, but a fumble allows the second"
78,"Benn to Hussey, no run Hussey strides forward and blocks towards the bowler"
79,"Benn to Hussey, 1 run Hussey moves forward to defend but then opens the face to guide the ball towards short third man"
80,"Benn to Katich, 1 run back and across and worked off the pads behind square, business as usual for Katich"
81,"Benn to Hussey, no run defended on the front foot"
82,"Benn to Hussey, no run Hussey moves forward and defends on the off side"
83,"Benn to Hussey, no run Hussey comes forward and turns the ball off his pads towards midwicket"
84,"Deonarine to Katich, no run Katich moves back and cuts but can't beat backward point"
85,"Deonarine to Katich, no run Katich moves outside the line of off stump and defends towards the bowler"
86,"Deonarine to Katich, no run defended on the front foot towards the off side"
87,"Deonarine to Katich, no run shorter in length so Katich goes back and punches firmly towards short cover where Gayle dives and fields"
88,"Deonarine to Katich, no run defended on the back foot towards the off"
89,"Deonarine to Katich, no run Katich leans forward and closes the face to play the ball towards midwicket"
90,"Benn to Hussey, FOUR runs graceful shot, Hussey eases on to the front foot, gets right to the pitch of the ball and plays a flowing drive through extra cover"
91,"Benn to Hussey, no run played off the back foot towards cover"
92,"Benn to Hussey, no run Hussey stays back and pushes the ball towards cover"
93,"Benn to Hussey, 1 run the line is a bit straight and Hussey nudges the ball past leg gully"
94,"Benn to Katich, 1 run tossed up on middle stump, Katich takes one step forward and taps the ball wide of mid on"
95,"Benn to Hussey, no run defended on the front foot"
96,"Deonarine to Katich, no run cut off the back foot towards backward point"
97,"Deonarine to Katich, no run defended on the front foot"
98,"Deonarine to Katich, no run Katich strides forward, covers the line, and blocks"
99,"Deonarine to Katich, no run Katich goes right back to a flat ball and plays to the bowler"
100,"Deonarine to Katich, no run Katich sort of yorks himself while stepping out and plays the ball on the leg side"
101,"Deonarine to Katich, 1 run pushed down the ground towards long on for a single"
102,"Benn to Katich, FOUR runs Katich goes deep into his crease and glances the ball off his pads to the fine leg boundary, that four takes Katich past 1000 runs in 2009, and he's now on 99"
103,"Benn to Katich, OUT caught! Katich goes on 99! He stretches forward, gets down on one knee to play the sweep and connects firmly, but he's hit it in the air, and Roach sees the ball swerving towards him at"
104,"Benn to Clarke, no run defended on the front foot"
105,"Benn to Clarke, no run played off the back foot on the off side"
106,"Benn to Clarke, no run Clarke steps out to get to the pitch of the ball and defends on the leg side"
107,"Benn to Clarke, no run Clarke closes the face of the bat and plays the ball to midwicket"
108,"Deonarine to Hussey, no run defended on the front foot"
109,"Deonarine to Hussey, 1 run Hussey pulls the ball towards long leg"
110,"Deonarine to Clarke, 1 run played off the pads towards short fine leg"
111,"Deonarine to Hussey, 1 run driven down the ground for a single to long-on"
112,"Deonarine to Clarke, no run quicker ball angling into Clarke, who goes back and forces it on the off side"
113,"Deonarine to Clarke, no run flicked off the pads towards midwicket"
114,"Benn to Hussey, no run driven off the front foot through the off side"
115,"Benn to Hussey, no run turned off the pads towards square leg"
116,"Benn to Hussey, no run Hussey leans forward and defends towards Benn"
117,"Benn to Hussey, 1 run just a bit short and Hussey goes back and pulls, sending Bravo to the floor in a hurry at leg gully"
118,"Benn to Clarke, FOUR runs Clarke waits in his crease and cuts firmly into the gap at point, Roach pursues but can't reach it"
119,"Benn to Clarke, no run Clarke comes out of his crease and defend to mid-off"
120,"Deonarine to Hussey, 1 run pushed down the ground for one"
121,"Deonarine to Clarke, no run Clarke steps out to drives the ball on the leg side, Deonarine dives to his right and stops the ball"
122,"Deonarine to Clarke, 2 runs short ball, pulled towards deep backward square leg"
123,"Deonarine to Clarke, no run defended on the back foot back down the pitch, that was quick, nearly 100ks"
124,"Deonarine to Clarke, no run defended on the front foot"
125,"Deonarine to Clarke, no run Clarke strides forward and blocks"
126,"Benn to Hussey, 1 run down the pads and turned out to the man on the ropes"
127,"Benn to Clarke, no run flighted on a length and he stretches forward to defend"
128,"Benn to Clarke, no run uses his feet and comes out to defend again"
129,"Benn to Clarke, no run gets a good ways forward and defends to silly point"
130,"Benn to Clarke, no run more of the same, tossed up on the stumps and Clarke blocks"
131,"Benn to Clarke, FOUR runs ah, fine! Clarke backs away to the leg side to a shorter ball that turns in and steers it very fine past the lone slip, who dives"
132,"Deonarine to Hussey, 1 run tossed up and he comes forward, clipping the ball to midwicket"
133,"Deonarine to Clarke, no run tossed up and defended"
134,"Deonarine to Clarke, OUT gone! Clarke can't control himself, tries to come out and take the ball on the full but miscues the aerial shot and picks out Gayle stationed at short midwicket, who steps to his r"
135,"Deonarine to North, no run tossed up and stretches forward to defend"
136,"Deonarine to North, no run gets a ways forward and smothers the turn, well bowled"
137,"Deonarine to North, no run flighted up outside off and he pats the ball to point"
138,"Benn to Hussey, no run tossed up outside off and he gets forward to block it"
139,"Benn to Hussey, no run goes back to try and bunt the ball to the leg side"
140,"Benn to Hussey, no run slower ball, tossed, he comes forward to defend"
141,"Benn to Hussey, no run gets over it and punches the ball to mid-on"
142,"Benn to Hussey, 1 run some turn there, Hussey works it past short leg for a single"
143,"Benn to North, no run spins in, North glances it off his pads and leg slip dives to stop it"
144,"Deonarine to Hussey, 1 run too short and wide, no turn so Hussey cuts and bisects cover and point"
145,"Deonarine to North, no run lobbed up outside off, North gets back and pushes it down the track, Deonarine dives full length to his right and stops it, getting tangled up with Hussey"
146,"Deonarine to North, no run tosses it wider outside off and he defends"
147,"Deonarine to North, no run tossed up again, North gets over it nicely and defends"
148,"Deonarine to North, no run more air, drawing a drive from North straight to cover"
149,"Deonarine to North, no run tossed up and defended to silly point"
150,"Benn to Hussey, 2 runs Hussey gets to 50 by pulling the ball towards midwicket, well played Huss! His is the 13th half-century scored by an Australian in the series, will he be the first to make 100?"
151,"Benn to Hussey, 1 run defended on the back foot but he's placed it in a gap and take sone"
152,"Benn to North, no run North strides forward and defends"
153,"Benn to North, 1 run driven through cover for a single"
154,"Benn to Hussey, no run loud appeal for lbw but the impact was probably outside off"
155,"Benn to Hussey, 1 run nudged off the pads behind square for one"
156,"Rampaul to Hussey, FOUR runs short ball and Hussey rocks back and pulls the ball through midwicket for four"
157,"Rampaul to Hussey, no run he tries to pull again but this time the length is fuller and the ball passes under his bat"
158,"Rampaul to Hussey, no run short of a length outside off, Hussey bottom-edges the cut into the ground"
159,"Rampaul to Hussey, (no ball) 1 run short ball and Hussey pulls hard along the ground to deep midwicket, Rampaul had overstepped as well"
160,"Rampaul to North, no run defended on the back foot towards the leg side"
161,"Rampaul to North, no run North defends towards mid-off"
162,"Rampaul to North, FOUR runs shot! North gets on top of a short one around off stump and swats it into the gap between midwicket and mid-on, lovely timing too"
163,"Benn to Hussey, 2 runs and he bowls a short one which Hussey pulls along the ground to deep square leg, Roach is the fielder, the new ball is available soon so roach might be bowling soon"
164,"Benn to Hussey, no run tossed up wide outside off, Hussey lets it go"
165,"Benn to Hussey, no run Hussey stretches forward and blocks"
166,"Benn to Hussey, no run driven firmly off the front foot towards the bowler"
167,"Benn to Hussey, no run"
168,"Benn to Hussey, no run padded away from outside off stump"
169,"Deonarine to North, no run leaves outside off"
170,"Deonarine to North, 1 run plays off the back foot to long off"
171,"Deonarine to Hussey, no run comes forward and defends to short cover"
172,"Deonarine to Hussey, 1 run drives to long on, easy single there as he moves to 61"
173,"Deonarine to North, no run thumps a drive to mid off, hit it too hard to take a single"
174,"Deonarine to North, no run plays off the back foot to mid off"
175,"Rampaul to Hussey, no run short, tries to cut one a bit close to his body, underedging on the bounce to the keeper"
176,"Rampaul to Hussey, 2 runs cuts to deep point, Nash does very well keeping it to two, the 300 raised by Australia"
177,"Rampaul to Hussey, no run leaves outside off, shortish outside off"
178,"Rampaul to Hussey, no run defends off the back foot, hard into the ground"
179,"Rampaul to Hussey, no run leaves outside off, again left alone"
180,"Rampaul to Hussey, no run defends off the back foot to Gayle at cover, will he ask for the new ball?"
181,"Deonarine to North, no run leaves outside off, no real turn there on the first day pitch"
182,"Deonarine to North, no run drives a full ball to mid off"
183,"Deonarine to North, 1 run plays off the back foot to deep cover point"
184,"Deonarine to Hussey, no run comes forward in defence"
185,"Deonarine to Hussey, 1 run drives to long on"
186,"Deonarine to North, no run defends into the off side, 9 overs left today it will be interesting to see when the new ball will taken, if at all this evening"
187,"Rampaul to Hussey, no run drives to mid on"
188,"Rampaul to Hussey, no run drives to mid off, firmly struck finding the fielder"
189,"Rampaul to Hussey, no run leaves a good length ball outside off"
190,"Rampaul to Hussey, no run defends off the back foot towards mid on"
191,"Rampaul to Hussey, no run comes forward and defends out to cover, where the skipper Gayle does the fielding"
192,"Rampaul to Hussey, no run pushes to mid wicket, nice over with the old ball"
193,"Deonarine to North, no run drives to short cover, Bravo fields copping it in the midships"
194,"Deonarine to North, 3 runs shorter this time and he cuts it away nicely behind point, good shot"
195,"Deonarine to Hussey, 1 run short and cuts it to deep cover point"
196,"Deonarine to North, 2 runs short and a quicker one, cuts behind point, the bowler might be getting a bit tired here"
197,"Deonarine to North, FOUR runs plays a cheeky lap shot to a low full toss, runs away to the long leg boundary"
198,"Deonarine to North, no run looks to turn to leg, getting a leading edge which falls just short of the bowler"
199,"Rampaul to Hussey, no run comes forward in defence into the cover area"
200,"Rampaul to Hussey, no run pushes forward and is beaten by one that might have moved a fraction off the pitch"
201,"Rampaul to Hussey, no run digs a full ball out to cover"
202,"Rampaul to Hussey, 2 runs drives a full ball wide of Benn at mid on who chases it - didn't quite get it away as he would have liked"
203,"Rampaul to Hussey, no run leaves outside off"
204,"Rampaul to Hussey, no run comes forward in defence, played back to the bowler"
205,"Roach to North, 1 run plays to long leg, easy single"
206,"Roach to Hussey, FOUR runs short, a bit of a loosener really and it is pulled away with ease behind square leg"
207,"Roach to Hussey, FOUR runs edges a defensive shot between 2nd slip and gully, runs away to the fence, good delivery that one"
208,"Roach to Hussey, FOUR runs full and drives with great power through the covers, 50 partnership raised between these two"
209,"Roach to Hussey, no run drives a full ball to mid off this time"
210,"Roach to Hussey, no run drives to mid off, ending a handy over for Australia"
211,"Rampaul to North, 1 run plays back and works to backward square leg, Benn chases and fields well, preventing any thoughts of a second run"
212,"Rampaul to Hussey, no run leaves outside off, no reason to play at that one"
213,"Rampaul to Hussey, no run leaves one outside off that is fractionally wider than the last one"
214,"Rampaul to Hussey, no run comes forward in defence, plays to Nash at cover"
215,"Rampaul to Hussey, no run defends into the cover area"
216,"Rampaul to Hussey, no run drives a yorker to cover"
217,"Tonge to North, no run tried to work to leg, hit on the thigh guard"
218,"Tonge to North, (no ball) leaves a no-ball outside off"
219,"Tonge to North, no run leaves a length ball outside off"
220,"Tonge to North, no run tries to pull one outside off and misses it by a decent margin"
221,"Tonge to North, no run leaves again outside off"
222,"Tonge to North, no run defends off the back foot, goes up to mid off"
223,"Tonge to North, no run thumps a short one to Nash at point, 3 overs to go here"
224,"Rampaul to Hussey, no run leaves a short one go outside off"
225,"Rampaul to Hussey, no run pushes forward and is beaten outside off, good ball that"
226,"Rampaul to Hussey, no run wide of the off stump, no need to play it"
227,"Rampaul to Hussey, no run short and he tries to guide it away, just short of Dowlin at gully - nice fielding"
228,"Rampaul to Hussey, no run drives a half volley hard into the covers, finds the fielder"
229,"Rampaul to Hussey, no run leaves outside, coming forward and again doesn't need to play at it"
230,"Tonge to North, (no ball) short and defends a no-ball back to the bowler"
231,"Tonge to North, no run comes forward and defends to cover"
232,"Tonge to North, 2 runs short and it is pulled to deep square leg for an easy couple of runs"
233,"Tonge to North, (no ball) 2 runs another no-ball which is pulled away behind square leg"
234,"Tonge to North, no run works off his pads to mid wicket"
235,"Tonge to North, 1 run works off the hip to a gap at square leg"
236,"Tonge to Hussey, no run defends off the back foot into the off side"
237,"Tonge to Hussey, 1 run works off his pads to deep square leg and keeps the strike"
238,"Rampaul to Hussey, no run comes forward in defence, playing towards cover"
239,"Rampaul to Hussey, no run leaves one outside off that had a bit of lift for the bowler"
240,"Rampaul to Hussey, no run leaves again outside off - 3 ball left for Day 1"
241,"Rampaul to Hussey, no run elects to leave another one outside off, two balls to go for today"
242,"Rampaul to Hussey, 1 wide short and is ducked, silly Billy calls a wide, dunno about that so there is still two left today"
243,"Rampaul to Hussey, 1 run tries to work to leg, inside edging onto his pad, the ball rolls to square leg - right, one left for the day"
244,"Rampaul to North, no run tries to play a leg side ball to long and makes no contact and that's it for the day - Australia 3/339"
245,"Bravo to Hauritz, no run defended to mid-off."
246,"Bravo to Hauritz, no run short of a length delivery outside the off stump and Hauritz pushes to mid-off."
247,"Bravo to Hauritz, no run lovely delivery in the corridor outside the off stump and Hauritz looking to play but then withdraws his bat."
248,"Bravo to Hauritz, no run on the middle and leg, turned to midwicket."
249,"Bravo to Hauritz, no run moves forward and drives to extra cover."
250,"Bravo to Hauritz, no run length delivery swinging away outside the off stump, left alone, was too wide."
251,"Roach to Johnson, no run fuller outside the off stump and left alone through to Ramdin."
252,"Roach to Johnson, no run short of a length and bit wide outside the off stump, punches to extra cover."
253,"Roach to Johnson, 1 run moves forward and drives to the right of Sammy who dives and saves three runs."
254,"Roach to Hauritz, no run gets behind the delivery and defends with a straight bat down the track."
255,"Roach to Hauritz, no run lovely delivery short of a length and coming in, Hauritz is beaten between bat and pad through to Ramdin."
256,"Roach to Hauritz, no run moves back and pushes to the onside to mid-on."
257,"Roach to Hussey, no run full toss on the off stump and Hussey pushes to mid-off."
258,"Roach to Hussey, no run gets behind the delivery and defends down the track."
259,"Roach to Hussey, no run 143.3 kmph, back of a length delivery outside the off stump and left alone."
260,"Roach to Hussey, no run lovely line from Roach on the middle and leg and goes through Hussey as he plays forward, wonderful delivery."
261,"Roach to Hussey, no run fuller delivery and Hussey pushes to mid-off."
262,"Roach to Hussey, no run yorker length delivery bit outside the off stump and Hussey blocks it to the off side."
263,"Rampaul to North, no run back of a length delivery keeps a bit low outside the off stump, left alone."
264,"Rampaul to North, no run in line with the delivery and pushes to the onside."
265,"Rampaul to North, no run plays on the back foot to the off side."
266,"Rampaul to North, no run defends with a straight bat and down to mid-on."
267,"Rampaul to North, no run defended."
268,"Rampaul to North, no run loud shout for an lbw turned down as the ball strikes the pad, was there an inside edge or did it pitch outside the leg stump, turned down."
269,"Bravo to Johnson, 1 run hits in the air down the ground to wide long off for a single."
270,"Bravo to Hauritz, no run short of a length delivery outside the off stump and left alone."
271,"Bravo to Hauritz, no run edges and the ball does not carry to Sarwan at wide first slip."
272,"Bravo to Hauritz, no run left alone through to Ramdin."
273,"Bravo to Hauritz, no run punches to mid-off."
274,"Bravo to Hauritz, no run stands in the crease and punches to mid-on to Benn."
275,"Roach to Johnson, 1 run 142.9 kmph, thickish outside edge to deep backward point as Johnson drives."
276,"Roach to Hauritz, no run short of a length delivery and Hauritz on the back foot lets it go through to Ramdin, coming in slightly."
277,"Roach to Hauritz, no run pushes it back to the bowler on the front foot."
278,"Roach to Hauritz, no run moves back and pushes to mid-off."
279,"Roach to Hauritz, no run plays to extra cover, Bravo fields the ball."
280,"Roach to Hauritz, no run 145.8 kmph, right in the block-hole and Hauritz digs it out with the toe of the bat to the onside."
281,"Bravo to Johnson, 1 run makes room and mishits in front of point, the ball was full and wide outside the off stump, was reaching out to the delivery."
282,"Bravo to Hauritz, 1 run looking to make room and go through the off side, misses and they scamper through for a leg bye, Ramdin misses the stumps at non-strikers end, would have been gone if the throw was"
283,"Bravo to Johnson, no run short of a length delivery and goes for a all mighty swing and misses."
284,"Bravo to Johnson, OUT short of a length delivery and Johnson hits in the air down the ground to long off and Benn takes a good catch."
