,Data
410,"Tuffey to Voges, 1 run fullish and just enough width for Voges to square drive to third man"
411,"Southee to Voges, 2 runs fullish in length and he offers width and Voges cuts off the front foot to deep point"
412,"Southee to Voges, 1 run back of a length just outside off and Voges cuts to third man"
413,"Southee to White, no run full delivery and White drives but mistimes it into the ground and back to the bowler"
414,"Southee to White, 1 run length delivery and White thrashes it through the off side field to the cover sweeper"
415,"Southee to Voges, 1 run length ball and Voges cuts from middle stump, playing it late, to third man"
416,"Southee to White, FOUR runs backs away to the leg side and he crunches it through the covers for four to the short boundary all the way along the carpet, great cricket stroke"
417,"Vettori to Voges, no run tossed up and drvien nicely back to the bowler"
418,"Vettori to Voges, no run back of a length and punched into the on side"
419,"Vettori to Voges, no run flatter in at leg stump and it yorks him and he pushes back down the pitch"
420,"Vettori to Voges, 1 run quicker in at middle and leg and Voges soehow cuts to backward point for a single"
421,"Vettori to White, 1 run tossed up and drvien sweetly to long on"
422,"Vettori to Voges, 1 run quicker again outside off and Voges square drives to the cover sweeper"
423,"Franklin to Voges, 1 run full outside off and Voges drives and drags it back through mid on to the man on the rope"
424,"Franklin to White, no run fullish delivery well outside off and he crunches it to McCullum at cover"
425,"Franklin to White, 1 run full again and White drives nicely to long off"
426,"Franklin to Voges, no run good length and drvien on the up to cover who is hunting that single"
427,"Franklin to Voges, SIX runs full and he provides some width and Voges drives over long off for six, superb timing!"
428,"Franklin to Voges, 1 run angled into the pads and Voges paddles it to Bond at short fine leg"
429,"Vettori to Voges, no run 77 kph, tossed up and Voges uses his feet and plays down the line back to Vettori"
430,"Vettori to Voges, no run 74 kph, Voges sits on the back foot and tries to work it into the leg side but he can't get enough on it"
431,"Vettori to Voges, no run flatter in at off stump and Voges pushes to cover"
432,"Vettori to Voges, 1 run tossed up on middle stump and he drives nicely past the bowler to long on"
433,"Vettori to White, 4 leg byes angled down leg and Hopkins can't get to it as it glances the pad and runs away for four leg byes"
434,"Vettori to White, 1 run quicker in a leg stump and White manoevers it nicely into the off side"
435,"Franklin to White, 1 run full and driven to long off"
436,"Franklin to Voges, no run good length and he defends into the off side"
437,"Franklin to Voges, FOUR runs good length, a fraction straight and Voges heaves it through backward square for four, Southee's dive in the deep can't stop it crossing th rope"
438,"Franklin to Hussey, 1 run full on off stump and Hussey drives to McCullum at cover, he picks up and fires at the non-strikers end and misses and they get an overthrow. White was only just back into his crease"
439,"Franklin to White, no run good length has White playing back to the bowler"
440,"Bond to Hussey, 3 runs Bond goes full straight away and Hussey punches back past the bowler for three runs, great running from Mr Cricket"
441,"Bond to White, no run back of a length and wide of off stump and White punches strongly off the back foot to McCullum who does well to field at cover"
442,"Bond to White, 1 run yorker length wide of off and it's edge down to third man"
443,"Bond to Hussey, 1 leg bye back of a length in at the hip and Hussey gets his thigh pad on it and takes the leg bye to fine leg"
444,"Bond to White, no run full in at off stump and White defends to cover"
445,"Bond to White, no run good length and White moves back and plays to backward point"
446,"Franklin to Hussey, 1 run half volley on middle and Hussey drives strongly to long on"
447,"Franklin to White, FOUR runs Whites moves away to leg and tries to hit in the air over the off side, it takes the outside edge and runs fine through third man for four"
448,"Franklin to White, 2 runs Franklin follows him away to the leg side and White clips it fine for a couple to long leg"
449,"Franklin to White, no run White backs away again and Franklin follows him again and White plays to mid wicket"
450,"Franklin to White, FOUR runs full as White gives himself room and he drives over point off the outside edge for four"
451,"Franklin to White, no run slower ball back of a length and White drives off the back foot to cover"
452,"Bond to Hussey, 1 run bumper from Bond and Hussey pulls it to fine leg"
453,"Bond to White, 1 run back of a length, hits the pitch hard and White guides it to Styris at third man"
454,"Bond to Hussey, 1 run good length on off stump and he pushes into the covers for a quick single"
455,"Bond to White, 1 run good length ball pushes White back and he defends with soft hands into the off side and they take a well judged single"
456,"Bond to Hussey, FOUR runs bumper from Bond hurries Hussey on the pull but he gets enough of it to the short boundary for four"
457,"Bond to Hussey, 1 run good length angled across the left hander and he plays late off the front foot to Guptill at backward point who fields well but can't prevent the single"
458,"Southee to Hussey, 2 runs low full toss and Hussey drives in the air to Taylor at long off, he can't quite get underneath it in time and the batsmen take two, Southee is visibly disappointed"
459,"Southee to Hussey, 1 run yorker driven to long off"
460,"Southee to White, 1 run full again and played to cover for a quick single"
461,"Southee to Hussey, 1 run yorker driven to long off, Hussey just looks at ease"
462,"Southee to White, FOUR runs full and clubbed over mid wicket, Vettori runs back and tries to keep it inside the rope but can't pull it back in time"
463,"Southee to White, FOUR runs low full toss and White gets low and underneath it and hits it over mid wicket for four"
464,"Vettori to Hussey, 1 run around the wicket to Hussey and he sweeps through forward square leg to the sweeper"
465,"Vettori to White, 1 run low full toss driven to mid on to bring up his half-century, well played Cameron White"
466,"Vettori to Hussey, 2 runs shorter and flatter and pulled through square leg to Bond, the sweeper, who can"
467,"Vettori to Hussey, FOUR runs arm ball defeats Hussey, it takes the outside edge and runs fine through third man for four"
468,"Vettori to Hussey, no run slower and Hussey goes back and plays into the leg side"
469,"Vettori to Hussey, 1 run quicker down leg and Hussey clips it fine to long leg"
470,"Southee to Hussey, FOUR runs full delivery on middle and Hussey drives powerfull past mid off for four and Australia win the match by six wickets and the series!"
471,"On behalf of the crew here at Cricinfo, this is Marc Ellison signing off. Bye for now, see you in two days time."
472,"The fifth and final ODI is in Wellington on Saturday March 13 at 2pm local time, that's 1am GMT. Join us in a couple of days time as New Zealand look to salvage some pride, while Australia will look to finish the series in style."
473,Cam White is named Man of the Match and he's happy to see it through to the end for the second game in a row. His game plan is to hit long and straight and it's obviously working pretty well for him. It's his first Chappell-Hadlee series victory in New Zealand so he is a very happy man.
474,Ponting is rapt with the team effort and heaps praise on most of his players.
475,"New Zealand captain Daniel Vettori is disappointed in both the batting and bowling. His batsmen didn't socre enough runs, being 120 for one before collapsing to be all out for 238, and his bowlers weren't consistent enough to create enough pressure."
476,"Nathan Hauritz made the important breakthroughs, nabbing McCullum, Stewart and Franklin in a spell that squeezed the life out of the New Zealand innings. Watson, again, provided the crucial partnership-breaking wickets and finished with for two for 24."
477,McCullum struck the ball cleanly for 61 but he didn't receive enough support at the top of the innings to allow New Zealand to build a sunstantial score.
478,"New Zealand simply did not score enough runs, once again, and the Duckworth/Lewis system actually gave them a greater chance of winning, unlike five days ago during the second ODI."
479,Cameron Whites deserves a lot of praise for bringing the game home with 50 not out and his amazing summer continues. Hussey and Voges played important innings too.
480,"Ponting played a great innings under pressure and basically counter-attacked the New Zealand attack when Bond was fired up at the top of the innings, with 50 off just 35 deliveries."
481,Australia take the series 3-1 with one game remaining with another comprehensive win here in Auckland.
482,Australia won by 6 wickets (with 17 balls remaining) (D/L method)
483,"Player of the match is Cameron White, AUS"
