,Data
458,"Hussey to Taylor, 1 run held it back a touch, pitched short of a good length on the off stump, turned to Warner at midwicket who concedes a single by way of a misfield"
459,"Hussey to Elliott, 1 run short on middle and leg, worked away off the back foot to deep square leg"
460,"Hilfenhaus to Elliott, no run short of a length outside off, pushed off the back foot into the off side"
461,"Hilfenhaus to Elliott, FOUR runs poor ball, straying on the pads, on the leg stump and Elliot walks across to glance it down towards the fine-leg boundary"
462,"Hilfenhaus to Elliott, no run good length on middle and off, defended back to the bowler"
463,"Hilfenhaus to Elliott, 1 run short on middle and off, closes the face to turn it wide of square leg"
464,"Hilfenhaus to Taylor, no run slower offcutter outside off stump, bowled at 123 kmph, left alone to the keeper"
465,"Hilfenhaus to Taylor, no run defended off the front foot to short cover"
466,"Hussey to Elliott, 1 run flighted outside off, driven off the front foot to long-off"
467,"Hussey to Taylor, FOUR runs dropped, tossed up on middle and leg, comes down the track and lofts it high towards deep midwicket, Michale Hussey runs well to his left and slides but fails to hold on, and deflects the ball to the boundary"
468,"Hussey to Taylor, no run pushed through quicker, defended on the off side"
469,"Hussey to Taylor, 5 wide poor bowling, the frustratio probably getting to him there, fired in on the leg side, it's too wide and Haddin had absolutely to pluck that"
470,"Hussey to Taylor, no run short on the off stump, cut away to point"
471,"Hussey to Taylor, no run flighted on middle and leg, turned away to midwicket"
472,"Hussey to Taylor, no run on the off stump, pushed into the off side"
473,"Hilfenhaus to Elliott, no run played into the off side off the back foot"
474,"Hilfenhaus to Elliott, no run short of a good length o the off stump, pushed to cover"
475,"Hilfenhaus to Elliott, no run banged in short on middle, tries to pull it away towards square leg, is struck on the thighs"
476,"Hilfenhaus to Elliott, FOUR runs wayward delivery and gets the treatment, pitched short outside leg stump and Elliot pulls it away to the fine-leg boundary"
477,"Hilfenhaus to Elliott, FOUR runs deliberately played, short outside off, he cuts it away uppishly wide of slip to the boundary at the third man, Hilfenhaus has struggled today"
478,"Hilfenhaus to Elliott, no run short of a good length on the off stump, opens the face to defend it to point off the front foot"
479,"Bracken to Taylor, no run short of a good length outside off, defended off the back foot towards mid-off"
480,"Bracken to Taylor, FOUR runs shot! Fractionally short outside off, Taylor makes room and slashes it away wide of Clarke at point for a boundary"
481,"Bracken to Taylor, no run on the stumps this time, good length on middle and off, defended back to the bowler"
482,"Bracken to Taylor, 1 leg bye pitched full outside leg and swung into the right hander, struck him on the pads as he tried to flick it away towards square leg"
483,"Bracken to Elliott, no run slower ball that Elliot failed to pick, pitched short on the off stump, he made room to guide that to third man, missed it completely"
484,"Bracken to Elliott, 1 run short of a good length outside off, steered to third man for a single"
485,"Hilfenhaus to Elliott, 1 run on the off stump, dropped short of cover and they steal a quick single"
486,"Hilfenhaus to Taylor, no run short of a length on middle and leg, defended towards midwicket"
487,"Hilfenhaus to Taylor, 1 run good length on middle and leg, tries to defend it off the back foot, gets a thick inside edge wide of square leg for a single"
488,"Hilfenhaus to Elliott, 1 run easily done, moves across and just closes the face to drop it on the leg side for a quick single"
489,"Hilfenhaus to Taylor, no run attempted bouncer, short outside off, Taylor lets it go"
490,"Hilfenhaus to Taylor, no run good delivery, right on target, bowled on a good length on middle and off, defended off the back foot to the bowler"
491,"Bracken to Elliott, no run short outside off, makes room and guides it straight to point"
492,"Bracken to Elliott, no run slower ball bowled on a good length outside off, bowled at 111.6 kmph, steered to point once again"
493,"Bracken to Elliott, 1 run punched off the back foot wide of mid-off for a single"
494,"Bracken to Taylor, 1 run good length on the off stump, pushed off the front foot to a slightly deepish mid-off for a quick single"
495,"Bracken to Elliott, no run slower ball bowled on a good length on middle and off, makes room and runs it straight to point"
496,"Bracken to Elliott, 1 run short of a good length outside off, pushed off the back foot wide of cover for a single"
497,"Johnson to Elliott, 2 runs short of a good length outside off, guided down to third man for a single"
498,"Johnson to Elliott, 1 run full outside off, driven firmly through the off side but deep cover runs in to keep the batsmen to a single"
499,"Johnson to Taylor, OUT momentary loss in concentration and Taylor pays the price!! Short outside off and he slashes at it blindly, played away from his body, gets a thin edge and Haddin makes no mistake. There was no need for that shot, and it's cost him his wicket."
500,"Johnson to Broom, no run full outside off, he's taking no risks here, left alone to the keeper"
501,"Johnson to Broom, no run good length outside off stump, angling away from the right hander, left alone to the keeper"
502,"Johnson to Broom, no run bowled fuller outside off, defended off the front foot towards point"
503,"Bracken to Elliott, no run shot and well fielded, short of a good length outside off, cut away powerfully to point where Clarke stays alert as ever"
504,"Bracken to Elliott, 1 run full on the off stump, mid-off is right at the edge of the circle so the batsmen easily manage a single"
505,"Bracken to Broom, 1 run slower ball bowled full on middle and off, pushes at it off the front foot, gets a thick edge towards third man as the ball cuts away"
506,"Bracken to Elliott, 1 run slower ball bowled short outside off, he picked it to heave it towards deep midwicket"
507,"Bracken to Broom, no run zipped off the pitch this time, landed on a good length on middle and swung in, Elliot failed to bring his bat down in time and it went just over the stumps to Haddin"
508,"Bracken to Broom, FOUR runs important boundary, marginally short outside off, comes down the track and slices it away past point"
509,"Johnson to Elliott, FOUR runs poor ball this time, its overpitched this time, makes room and steers it wide of Clarke and point for another four"
510,"Johnson to Elliott, no run slower ball, played to point again but just a push this time"
511,"Johnson to Elliott, 1 run short on middle and leg, pulled away down to fine leg"
512,"Johnson to Broom, no run makes room to attempt a simliar shot but it's a touch too wide and he fails to reach"
513,"Johnson to Broom, FOUR runs full on middle, stands his ground at swings it away over Ferguson at midwicket for a boundary. Just managed to evade him there"
514,"Johnson to Broom, no run full on middle and off, driven to him again, but for no run"
515,"Bracken to Elliott, 1 run slower ball bowled on a good length outside off, dropped short of point for a quick single"
516,"Bracken to Broom, 1 run slower ball again, he made room there and Bracken spotted him, bowled it outside leg stump, pushed to cover for another single"
517,"Bracken to Elliott, no run slower offcutter, on a good length on the off, driven straight to short cover"
518,"Bracken to Elliott, FOUR runs and again, almost had him lbw there but that was brilliantly played in the end, slower one landing on middle, he shuffled across and glanced it well wide of short fine for a boundary"
519,"Bracken to Elliott, no run makes room and force it through the off side, the ball doesn't come onto fast enough, he checks his shot and plays it to cover"
520,"Bracken to Elliott, no run good length on middle and leg, pushed off the front foot to midwicket"
521,"Hopes to Broom, 1 run short of a length on middle, Broom mistimes a pull to mid-on but manages a quick single"
522,"Hopes to Elliott, 1 run fifty for Elliot, full outside off and squeezed through to third man. Excellent knock, played well with Taylor, and is now heading this partnership with Broom"
523,"Hopes to Broom, 1 run short on middle, tries to swing it away over midwicket, gets a faint inside edge short of Haddin and they get a single as he fumbles"
524,"Hopes to Elliott, no run pushed off the back foot to mid-on"
525,"Hopes to Elliott, 1 run missed opportunity there, slapped to mid-off where Hilfenhaus misfields, had he picked that up cleanly and hit the stumps, Elliot may well have been short at the non-striker's end"
526,"Hopes to Broom, 1 run short of a length on middle, pulled away towards deep midwicket for a single"
527,"Hilfenhaus to Broom, FOUR runs lucky but effective, short of a length on the off stump, he charges down the wicket to swat it over mid-on, got a thick outside edge that flew off the bat to the third-man boundary"
528,"Hilfenhaus to Broom, 1 run short on middle and leg, gets a single towards midwicket"
529,"Hilfenhaus to Elliott, 2 runs full on middle and leg, worked away between midwicket and square leg for a couple more"
530,"Hilfenhaus to Elliott, no run full on the off stump, pushed back to the bowler"
531,"Hilfenhaus to Elliott, 1 run gets on the front foot and drives that to mid-on for a quick single"
532,"Hilfenhaus to Broom, no run full outside off, makes room and digs it out to short cover"
533,"Hopes to Elliott, 1 run short of a length outside off, comes down the track and cuts it away to deep point"
534,"Hopes to Broom, no run short on middle, misses out on a pull, is struck on the thighs"
535,"Hopes to Broom, 3 runs excellent fielding but they still get there, bowled full outside leg stump, he's already made some room, gets under it and drives it wide of Mitchell Johnson at mid-on, he gives his chase and dives full length to drag it back inside the ropes"
536,"Hopes to Elliott, no run bouncer banged in short on middle, Elliot ducks and thinks it deserves to be called a wide as its a touch too high, the umpires don't think so"
537,"Hopes to Elliott, 1 run short of a good length outside off, pushed wide of cover for a quick single"
538,"Hopes to Broom, FOUR runs Australia are on their way to being down 2-0 here, short on middle and off, he steps out and slogs that over mid-on for a boundary"
539,"Hilfenhaus to Elliott, 1 run full outside off, tries to drive through the line, gets an inside edge onto his pads and they take a quick single"
540,"Hilfenhaus to Broom, no run yorker on middle, well bowled, dug out back to the bowler"
541,"Hilfenhaus to Broom, 1 run low full toss on middle, he tries to drag it away wide of square leg but James Hopes fields well there to keep the batsmen down to a single"
542,"Hilfenhaus to Elliott, no run bouncer on middle, goes for the pull, misses"
543,"Hilfenhaus to Elliott, FOUR runs That's it, all over! Short on middle and thats dismissed to the deep square-leg boundary"
544,"I know its Broom and not Warner. Sorry for the typo there, and thanks for pointing it out. Anyway, its been an exciting match and hopefully the next one in Sydney, on February 8, will be just as good. Australia have to win that to stay in the series. Until then, it's goodbye from all of us here at Cricinfo."
545,Michael Clarke is the Man of the Match for his 98.
546,"Australia have slid to their fifth consecutive defeat, that too at home. 226 was a competitive target on a slow pitch but New Zealand paced their innings brilliantly. They started patiently and McCullum was involved in two 40-plus partnerships with Fulton and Taylor to ensure his team didn;t lose early wicke"
547,New Zealand won by 6 wickets (with 7 balls remaining)
548,"Player of the match is Michael Clarke, AUS"
