,Data
0,"Ricky Ponting has won the toss and Australia will bowl first. Ponting is happy with the formula they used during the last match in Hamilton and he sees that as the best way to win the game and the series. Amazingly, it's his fourth straight correct call with the toss."
1,"Harris to McCullum, no run angled into the pads and McCullum missed out as it takes him on the front pad and rolls to square leg"
2,"Harris to McCullum, 1 wide angled into leg stump again and it carries on down leg and called wide"
3,"Harris to McCullum, 1 run full in at the pads and McCullum clips it to Bollinger at fine leg"
4,"Harris to Guptill, no run better channel from Harris and he draws Guptill forward into a defensive shot and he drops it just beside the stumps"
5,"Harris to Guptill, 5 runs back of a length in at Guptill's hip and he clips it behind square, he calls wait then yes and McCullum would've been short of his ground had the throw hit. The backing up isn't in place and it goes for four overthrows"
6,"Harris to McCullum, no run fuller this time and McCullum drives back to the bowler"
7,"Harris to McCullum, no run back of a length outside off and McCullum pushes off the outside half of the blade to point"
8,"Bollinger to Guptill, FOUR runs Bollinger goes full to test the swing and it's a half volley ouside off and Guptil cracks it through the covers for four"
9,"Bollinger to Guptill, no run full on leg and Guptill whips it to square leg"
10,"Bollinger to Guptill, no run good channel outside off and Guptill allows it through to the keeper"
11,"Bollinger to Guptill, no run back of a length and Guptill moves back and defends with soft hands to point"
12,"Bollinger to Guptill, no run fuller and wider of off stump again and Guptill shoulders' arms"
13,"Bollinger to Guptill, no run good channel from Bollinger again and Guptill is happy to let it go"
14,"Harris to McCullum, no run cracking delivery from Harris as he angles into off stump and then beats McCullum as it nips away from the bat"
15,"Harris to McCullum, no run identical again from Harris hitting the corridor of uncertainty and McCullum is beaten again"
16,"Harris to McCullum, no run back of a length closer to off stump and McCullum is back and defending back along the pitch"
17,"Harris to McCullum, no run good length outside off and McCullum tries to push into the off side but it takes the inside half of the bat and back along the pitch to the bowler"
18,"Harris to McCullum, no run back of a length of off and McCullum plays back and a touch too early and squirts it back to the bowler trying to play into the on side"
19,"Harris to McCullum, no run great channel again to finish and McCullum sees it clearly and plays with the fuller face of the bat into the off side field"
20,"Bollinger to Guptill, FOUR runs great delivery from Bollinger has Guptill hanging on the crease and playing away from his body, it takes the outside edge and flies through the vacant second slip region for four"
21,"Bollinger to Guptill, no run back of a length and Guptill plays strongly to short cover"
22,"Bollinger to Guptill, 3 runs full on leg stump and Guptill whips it through forward square leg in the air just past Hopes at square leg and they get three to the long boundary"
23,"Bollinger to McCullum, no run back of a length and outside off, McCullum chops it down into the ground and nearly back onto his stumps as we've already seen him do twice in the series"
24,"Bollinger to McCullum, FOUR runs around the wicket and just too short as McCullum pulls through square leg, beating Hopes in the deep who had just moved back to the fence"
25,"Bollinger to McCullum, 1 run back of a length and into McCullum's hip, he moves back and works it into the leg side for an easy single"
26,"Harris to McCullum, FOUR runs McCullum advances down the track and hammers it straight out of the middle through cover for four"
27,"Harris to McCullum, SIX runs Harris drops short and McCullum is back and pulling over the short boundary at fine leg for six into the construction site"
28,"Harris to McCullum, no run Harris is back into the channel and McCullum is back and across and playing into the off side with a straight bat"
29,"Harris to McCullum, no run back of a length on off and McCullum moves back and defends back along the pitch"
30,"Harris to McCullum, 3 runs Harris loses his line and angles into the pads and McCullum clips him through mid wicket for three"
31,"Harris to Guptill, no run good channel and Guptill defends with a slightly open face to cover"
32,"Bollinger to McCullum, (no ball) Bollinger oversteps and hits a good channel as McCullum pushes back to the bowler. Free-hit coming up..."
33,"Bollinger to McCullum, (no ball) SIX runs another foot fault from Bollinger and McCullum picks it up and deposits it over fine leg for six"
34,"Bollinger to McCullum, 1 run better length and McCullum tries to muscle it over the off side, he gets it high on the blade and Ponting takes the catch at mid off as they take the single from the free-hit"
35,"Bollinger to Guptill, no run good length and Guptill drives back at the bowler"
36,"Bollinger to Guptill, FOUR runs Bollinger provides Guptill with a juicy half volley and he pumps it over cover for four"
37,"Bollinger to Guptill, no run better length outside off and Guptill plays to short cover"
38,"Bollinger to Guptill, no run half volley on off stump and Guptill drives to mid off without the usual ping off the bat"
39,"Bollinger to Guptill, 1 run half volley on off stump and Guptill drives wide of Ponting at mid off for a quick single"
40,"Johnson to Guptill, 1 run full outside off stump and Guptill drives through the covers and Hussey tidies up to keep the scoring to one"
41,"Johnson to McCullum, FOUR runs full and wide again but McCullum makes him pay as he hits underneath the ball and over cover point for four"
42,"Johnson to McCullum, no run half volley just outside off and McCullum drives to Voges at backward point"
43,"Johnson to McCullum, no run Johnson hits his length and beats McCullum who pushes at it outside off, super delivery"
44,"Johnson to McCullum, no run shorter this time and McCullum moves back and tries to work it into the leg side but he gets a leading edge into the on side and it drops just in front of Johnson in his follow through"
45,"Johnson to McCullum, no run good length on off stump and McCullum is back and defending into the off side, taking one hand off the bat"
46,"Watson to Guptill, no run Watson immediately hits his length drawing Guptill forward and defending into the off side"
47,"Watson to Guptill, FOUR runs fuller this time and Guptill stands tall and drives strongly through extra cover for four, glorious from the man with two toes on one foot"
48,"Watson to Guptill, FOUR runs full and angled into leg stump and Guptill clips it over mid wicket for four runs, good stroke"
49,"Watson to Guptill, OUT Watson is full again and Guptill isn't totally in control of the drive, nonetheless he hits it pretty cleanly but just off the carpet and Ponting swoops at short cover and collects a good catch low down, big wicket for Australia"
50,"Watson to Taylor, no run good channel wide of off stump and Taylor allows it through to the keeper"
51,"Watson to Taylor, no run good length and Taylor moves forward and plays to point"
52,"Johnson to McCullum, no run back of a length and McCullum plays into the on side"
53,"Johnson to McCullum, no run good length, McCullum hops back and plays to mid on from the back foot"
54,"Johnson to McCullum, no run good corridor from Johnson and McCullum is back and leaving"
55,"Johnson to McCullum, 1 wide full and some genuine away swing to the right hander and McCullum watches it go by and it's called wide"
56,"Johnson to McCullum, no run back of a length and outside off and he pushes into the point region"
57,"Johnson to McCullum, no run fuller on middle stump and he punches firmly to mid on"
58,"Johnson to McCullum, no run great channel to finish from Johnson and McCullum allows it through to Haddin"
59,"Watson to Taylor, no run good channel and Taylor is happy to leave well outside off"
60,"Watson to Taylor, 1 run good length on middle and Taylor pushes into the leg side to get off the mark"
61,"Watson to McCullum, no run good length well outside off and McCullum plays and misses. It seems as though he's now ion two minds as to whether to play his natural game or not, knowing that the debutante Stewart is next in"
62,"Watson to McCullum, no run McCullum advances and Watson bowls a wide slower ball and he leaves it alone"
63,"Watson to McCullum, no run Watson bends his back and hits the wicket hard forcing McCullum into a back foot defensive stroke into the off side"
64,"Watson to McCullum, no run good length but full enough to bring McCullum forward and he defends to short cover"
65,"Johnson to Taylor, 1 wide Johnson errs on line and he strays down leg"
66,"Johnson to Taylor, no run fuller this time and Taylor drives and misses. Well bowled from Johnson as he gets the ball to shape away from Taylor"
67,"Johnson to Taylor, 5 wide great bumper from Johnson and Taylor just sways inside the line and it really takes off and flies over Haddin for four and it's called too high. Harsh decision going against Johnson there"
68,"Johnson to Taylor, no run fuller on leg stump and Taylor is beaten, it takes him on the front pad and there is a stifled appeal but it's given not out"
69,"Johnson to Taylor, no run fuller and Taylor drives into the on side"
70,"Johnson to Taylor, no run half volley outside off stump and he drive to mid off"
71,"Johnson to Taylor, 1 wide pitched up and far too wide of off stump"
72,"Johnson to Taylor, 1 run full and wide again and Taylor square drives to the off side sweeper"
73,"Johnson to McCullum, no run good channel to finish outside off stump and McCullum leaves it alone"
74,"Watson to Taylor, no run back of a length and Taylor plays into the off side"
75,"Watson to Taylor, no run half volley outside off and Taylor drives to Ponting at short cover"
76,"Watson to Taylor, no run back of a length and Taylor pushes back to the bowler"
77,"Watson to Taylor, no run good length again and Taylor plays from the crease into the off side"
78,"Watson to Taylor, no run half volley on middle and Taylor drives firmly to White at mid wicket"
79,"Watson to Taylor, no run back of a length and Taylor is nicely in behind it and defending into the off side. Taylor looks as though he really wants to get after it but Australia are doing a good job"
80,"Johnson to McCullum, 1 run good length but too straight and McCullum whips it to deep backward square"
81,"Johnson to Taylor, 1 leg bye Johnson misses his line again and it takes Taylor on the thigh and falls into the leg side"
82,"Johnson to McCullum, SIX runs short from Johnson and McCullum is into position early and pulls over deep square leg for half a dozen"
83,"Johnson to McCullum, no run better length and McCullum is in behind the line and playing to mid on"
84,"Johnson to McCullum, 1 run short and in at the body and McCullum fends off his rib cage from his right hand glove and into the leg side for an easy single"
85,"Johnson to Taylor, 1 run good length and it tails away from the right handed Taylor and takes the outside edge down to third man"
86,"Watson to Taylor, 1 leg bye good channel nips back and Taylor tries to square cut but misses, it takes him on the back pad but he's hit outside the line of off and Asad Rauf says not out"
87,"Watson to McCullum, no run back of a length and McCullum plays back down the pitch"
88,"Watson to McCullum, no run slower ball is shorter and wider and McCullum cuts backward of point but can't get enough on it to beat the point fieldsman"
89,"Watson to McCullum, 1 run Watson hits the deck hard and defends into the off side, Voges picks it up and hits at the bowlers end but it was a well judged run and McCullum is home safe"
90,"Watson to Taylor, 1 run slower ball and Taylor works it through the leg side to the sweeper"
91,"Watson to McCullum, SIX runs McCullum advances and seizes the moment by hammering a good length ball over cover to the short boundary for six. He hit that like a tracer bullet. Just so clean. He will need to bat for a long period today if New Zealand are to post a competitive score"
92,"Harris to Taylor, 1 run fullish length and Taylor drives sweetly to Ponting at mid off, he throws it towards the stumps but wide of Haddin and they get an overthrow to fine leg"
93,"Harris to McCullum, no run good length and McCullum plays a fraction too early and gets a leading edge into the off side"
94,"Harris to McCullum, 1 run back of a length and McCullum pushes into the gap at point to the sweeper"
95,"Harris to Taylor, no run good channel again from Harris and Taylor plays into the off side"
96,"Harris to Taylor, 1 run good length and Taylor plays with soft hands into the off side for a quick single"
97,"Harris to McCullum, no run bends his back again and McCullum pushes to Voges at point"
98,"Hopes to Taylor, no run slower ball to start from 'Catfish' Hopes and Taylor drives to point"
99,"Hopes to Taylor, 1 run full and outside off and Taylor square drives to deep point"
100,"Hopes to McCullum, 1 run good length and McCullum comes forward and pushes slightly uppishly through mid off to the man on the fence"
101,"Hopes to Taylor, 1 run back of a length and Taylor pushes to mid off and steals a quick single to the man on the 30m ring"
102,"Hopes to McCullum, 1 run good length and McCullum uses the width to guide it to third man"
103,"Hopes to Taylor, no run fuller on middle stump and driven back to the bowler. Let's have a drink"
104,"Harris to McCullum, 1 run good length on off stump and McCullum plays into the off side for an easy single"
105,"Harris to Taylor, 1 run Harris hits the corridor and Taylor moves back and defends off the outside half of the bat behind point for one"
106,"Harris to McCullum, no run cracking delivery beats McCullum outside off. It seems as though there's a bit in the track if you really bend your back as Harris does every ball"
107,"Harris to McCullum, 1 run too straight this time and McCullum clips it to fine leg to bring up his half-century well played"
108,"Harris to Taylor, 1 run drawn forward and played to mid off for a quick single, well run"
109,"Harris to McCullum, 1 leg bye angled towards leg stump and McCullum misses, it takes him on the pad and they take a run into the leg side. Harris is adamant it deserves a closer look but the umpire isn't interested"
110,"Hopes to McCullum, 1 run back of a length and cut to third man"
111,"Hopes to Taylor, FOUR runs slower ball is full and Taylor tries to make something out of nothing, hitting in the air just past cover for four"
112,"Hopes to Taylor, no run full on middle and worked into the leg side"
113,"Hopes to Taylor, no run back of a length, gets Taylor high on the blade as he looks to play through the off side"
114,"Hopes to Taylor, no run fuller again and Taylor drives to White at cover"
115,"Hopes to Taylor, no run pitched up and Taylor plays to Ponting at mid wicket"
116,"Hauritz to McCullum, no run tossed up on the yorker length and driven back to the bowler"
117,"Hauritz to McCullum, 1 run full on leg stump and whipped through the leg side to deep forward square leg"
118,"Hauritz to Taylor, no run fuller again and Taylor clips to mid wicket"
119,"Hauritz to Taylor, no run Taylor showing a lot of frustration here as he hits straight to cover"
120,"Hauritz to Taylor, 1 run Taylor uses softer hands this time and gets one into the off side"
121,"Hauritz to McCullum, 1 run flatter and cut to deep point"
122,"Hopes to McCullum, 2 runs shortish and it at the hip and clipped backward of square on the leg side for a couple to the sweeper. It was tight but well run"
123,"Hopes to McCullum, 3 wide angled down the leg side and Haddin misses the ball and removes the bails without the ball and they get a couple to fine leg"
124,"Hopes to McCullum, 2 leg byes too straight again and it takes McCullum on the hip and runs fine to fine leg"
125,"Hopes to McCullum, no run back of a length outside off and McCullum pushes into the off side"
126,"Hopes to McCullum, 1 run good length and McCullum plays it to third man"
127,"Hopes to Taylor, OUT full on leg stick and Taylor clips it from the middle of the bat out to deep square leg where Hussey moves quickly and takes a good diving catch low down"
128,"Hopes to McCullum, no run good length and played into the off side, McCullum calls yes then immediately no"
129,"Hauritz to Stewart, no run tossed up outside off and Stewart square drives to backward point"
130,"Hauritz to Stewart, no run slightly shorter this time and played to backward point again"
131,"Hauritz to Stewart, no run fuller and straighter and played back to the bowler"
132,"Hauritz to Stewart, 2 runs good length, spinning back into him and he pushes off the outside edge, just past the outstretched hand of first slip for a couple"
133,"Hauritz to Stewart, 1 leg bye straighter and he moves across his stumps and tries to play into the leg side, it takes him on the pad and runs down to fine leg"
134,"Hauritz to McCullum, no run tossed up on middle and McCullum defends into the leg side"
135,"Hopes to Stewart, 1 run good channel but just enough width to use the pace and play to third man"
136,"Hopes to McCullum, no run slower ball back of a length and McCullum pushes towards mid on but can't beat Ponting at mid wicket"
137,"Hopes to McCullum, 1 run back of a length and pushed back past the bowler to long on"
138,"Hopes to Stewart, 1 run too straight and whipped down to fine leg"
139,"Hopes to McCullum, 1 run short outside off and cut hard to deep point"
140,"Hopes to Stewart, no run back of a length, Stewart drives on the up but drags it to Ponting at mid wicket"
141,"Hauritz to McCullum, 1 run tossed up on middle and it's full enough to drive firmly to long on"
142,"Hauritz to Stewart, OUT Stewart comes down the track, looks to hit it straight down the ground in the air but drags it towards Watson at long on who takes the simplest of catches"
143,"Hauritz to McCullum, 1 run short and cut nicely to deep point"
144,"Hauritz to Styris, no run tossed up and defended into the off side"
145,"Hauritz to Styris, no run fuller and Styris drives to Ponting at mid wicket"
146,"Hauritz to Styris, no run shorter this time and Styris moves back and punches towards mid on but he can't beat Johnson wh hustles well from mid wicket to save the single"
147,"Bollinger to McCullum, no run good length adn McCullum pushes into the off side"
148,"Bollinger to McCullum, no run good length and McCullum is nicely in behind it and defending into the off side"
149,"Bollinger to McCullum, 1 run fuller from Bollinger and the slower ball has McCullum playing too early and hits in the air but just short of Johnson at mid off"
150,"Bollinger to Styris, no run back of a length angling across the right hander and Styris square drives to cover point"
151,"Bollinger to Styris, no run good length and Styris has found his timing immediately playing to cover point"
152,"Bollinger to Styris, no run back of a length on middle stump and Styris plays to mid on off the back foot"
153,"Hauritz to McCullum, no run full and driven to mid wicket"
154,"Hauritz to McCullum, no run better length and McCullum tries to play into the leg side with soft hands but can't find the gap"
155,"Hauritz to McCullum, OUT uses his feet and chips it straight to White at mid wicket. Poor dismissal as the pressure told and Australia are extremely happy to remove the dangerman"
156,"Hauritz to Vettori, 1 leg bye Vettori tries to sweep immediately and it hits him on the body and runs past Haddin on the off side"
157,"Hauritz to Styris, 1 run Styris gets the front foot down the track and laps it fine"
158,"Hauritz to Vettori, 1 run Hauritz comes wide on the crease and angles into the pads and Vettori plays through the leg side"
159,"Bollinger to Vettori, 1 run good length on off stump and Vettori still has enough width to guide it to third man"
160,"Bollinger to Styris, 1 run bac of a length in at the hip and Styris takes a quick single into the leg side"
161,"Bollinger to Vettori, 1 run good length and Vettori drives on the up from the outside half of the bat to third man"
162,"Bollinger to Styris, no run great length and Styris moves back and punches to mid off"
163,"Bollinger to Styris, no run Bollinger continues to bend his back and hits the bat hard as Styris is back and defending into the off side"
164,"Bollinger to Styris, no run great corridor again from Bollinger and Styris pushes off the back foot into the off side"
165,"Johnson to Vettori, 1 run Vettori shuffles across his stumps and clips a full ball outside off to fine leg"
166,"Johnson to Styris, 1 run good length and Styris plays nicely into the leg side to rotate the strike"
167,"Johnson to Vettori, no run full inswinging delivery and Vettori misses as he tries to play to leg, Johnson appeals but it's going well down leg"
168,"Johnson to Vettori, 1 leg bye full inswinger again and it takes Vettori on the pads and rolls into the leg side"
169,"Johnson to Styris, 1 run fullish on middle and Styris whips it through the leg side to the sweeper"
170,"Johnson to Vettori, 1 run good channel outside off and Vettori drives off the inside half of the bat to fine leg"
171,"Hopes to Vettori, 1 run walks across his stumps again and gets an inside edge onto his pad and takes a single into the leg side"
172,"Hopes to Styris, OUT Hopes hits a good fullish length and Styris plays a fraction early, it takes a leading edge and floats back to Hopes who takes a good catch low down in his follow through"
173,"Hopes to Hopkins, no run back of a length and it really flies through quickly and Hopkins is beaten outside off"
174,"Hopes to Hopkins, no run bumper from Hopes and Hopkins ducks underneath it"
175,"Hopes to Hopkins, no run good length draws Hopkins forward, he defends with bat and pad close together, Hopes appeals but there's too much doubt to give it out"
176,"Hopes to Hopkins, 1 run fuller outside off and Hopkins pushes off the outside half of the blade past point for a single"
177,"Johnson to Hopkins, no run good length in at the body and Hopkins is tightly in behind it and playing into the leg side"
178,"Johnson to Hopkins, 1 run in at the body again but too straight and he whips it off his hip to fine leg"
179,"Johnson to Vettori, no run inswinging yorker and Vettori walks across his stumps and clips it to backward square"
180,"Johnson to Vettori, OUT full and swings into Vettori who stays on the crease and is trapped dea in front, no problems giving that out for umpire Baxter, that was very adjacent"
181,"Johnson to Franklin, no run Johnson bends his back and forces Franklin back immediately and defending into the off side"
182,"Johnson to Franklin, no run fuller this time and driven to mid off"
183,"Hopes to Hopkins, no run good length, Hopkins comes forward and plays to cover"
184,"Hopes to Hopkins, 1 run full and driven through the gap at point to the sweeper. New Zealand need a partnership here because in the last 10-15 overs they have folded faster than Superman on laundry day"
185,"Hopes to Franklin, 2 runs full outside off and Franklin drives firmly through the covers for a couple"
186,"Hopes to Franklin, 1 run better length this time and Franklin pushes through the covers to the sweeper"
187,"Hopes to Hopkins, 1 run short and at the body and Hopkins plays it around the corner to fine leg"
188,"Hopes to Franklin, no run back of a length and Franklin stands tall and punches to mid wicket"
189,"Johnson to Hopkins, no run half volley on off and Hopkins plays nicely to mid off"
190,"Johnson to Hopkins, no run fuller again outside off and Hopkinds drives without any timing to mid off"
191,"Johnson to Hopkins, no run full again and wider of off stump and Hopkins drives but misses, well bowled"
192,"Johnson to Hopkins, 1 run pitched up again and Hopkins drives off the outside half of the bat to third man"
193,"Johnson to Franklin, no run bumper angled down leg but it's just close enough to Franklin not to be called wide"
194,"Johnson to Franklin, no run half volley crunched straight to mid off"
195,"Hopes to Hopkins, no run good length outside off and Hopkins pushes into the off side"
196,"Hopes to Hopkins, no run back of a length and played back to the bowler"
197,"Hopes to Hopkins, 1 run good length draws Hopkins forward and he uses the pace to play to third man"
198,"Hopes to Franklin, no run fullish length and Franklin pushes his hands at the ball and plays to point"
199,"Hopes to Franklin, no run Hopes hits the wicket hard and Franklin is solid and punching to mid off"
200,"Hopes to Franklin, 1 run fraction too straight and Franklin works it through the leg side"
201,"Harris to Franklin, no run good length outside off and Franklin drives on the up to cover"
202,"Harris to Franklin, no run back of a length and Franklin drives off the inside edge back to the bowler"
203,"Harris to Franklin, no run full and driven sweetly to mid off"
204,"Harris to Franklin, no run good length and Franklin drags the drive into the leg side"
205,"Harris to Franklin, no run back of a length on off stump and Franklin plays back to the bowler"
206,"Harris to Franklin, 1 run good length to finish and Franklin moves back and punches through mid wicket for a single"
207,"Hopes to Franklin, no run angled into middle stump and clipped to mid wicket"
208,"Hopes to Franklin, no run good delivery angled back into middle stump, Franklin drives but misses and is taken high on the back leg"
209,"Hopes to Franklin, no run good channel and he beats Franklin outside off stump, great delivery"
210,"Hopes to Franklin, 1 run fuller this time and driven to long on"
