,Data
0,"7.10pm Australia have won the toss and will bat, George Bailey is grinning again, as he does. Australia have made two changes, with Chris Lynn, er, rested and Josh Hazlewood dropping out for Daniel Christian and Ben Cutting. England also make two changes, Jordan replacing James Tredwell and Ben Stokes in for Michael Lumb, with Luke Wri"
1,"Broad to White, no run slightly back of a length, around the line of off, White goes back and across and defends with a straight bat"
2,"Broad to White, no run shortish, touch more width, White jabs at it and squirts the ball in front of point, Morgan stops it well to prevent one"
3,"Broad to White, 1 run cross-seam delivery from Broad, Finch pushes it on the full wide of short extra cover for a single"
4,"Broad to Finch, 1 run on the stumps, worked back past the bowler, mid-on moves across to his left"
5,"Broad to White, 1 run on the stumps, worked off the legs through square"
6,"Broad to Finch, no run good length, outside the line and Finch guides it into the covers"
7,"Jordan to White, 1 wide and he starts with a wide, firing this narrowly down the leg side"
8,"Jordan to White, no run pitched up, wide enough to get White's dander up, but he miscues and thick inside edge into his pads"
9,"Jordan to White, no run angled in, slightly full again, clipped firmly to leg where Bresnan makes a diving stop at midwicket"
10,"Jordan to White, 2 runs on the stumps and flicked behind square this time, Dernbach makes a bit of a meal of stopping it at fine leg"
11,"Jordan to White, 1 run digs this in short and White takes it on, pulling aerially down towards Dernbach, who can't make up the ground and settles for making a goalie stop on the bounce"
12,"Jordan to Finch, no run length ball, nips back a touch and rattles into the pads, might have been some bat involved, height an issue too"
13,"Jordan to Finch, no run Finch backs away and Jordan follows him, sends a length ball zipping through past a swing and a miss - decent first over from Jordan"
14,"Broad to White, no run length ball, tight line around off, tapped short on the off side"
15,"Broad to White, FOUR runs you beauty! That's a shot from White, driven crisply, furiously even, on the up and straight back past Broad for the first boundary. Wasn't overpitched but took some punishment"
16,"Broad to White, FOUR runs goes again, this time on the pull, Broad dropping short and being carted high over midwicket - he's up and running now"
17,"Broad to White, 1 run length in the channel, stays back and opens the face to run one to third man"
18,"Broad to Finch, 1 run punches a length ball down the ground, just one as mid-on and mid-off converge"
19,"Broad to White, no run ripper from Broad, beats the batsman for pace as the ball zips through off the pitch"
20,"Jordan to Finch, FOUR runs Jordan tries the chin music on Finch, whose swats it away at chest height, loopy pull shot but it bounces away to the rope"
21,"Jordan to Finch, no run this was slightly more ungainly (less gainly?), as Finch makes room and swings wildly at a short ball that bounces over the stumps"
22,"Jordan to Finch, 1 run short and at the batsman, pulled flat through midwicket, there's a fielder out there now"
23,"Jordan to White, no run down the leg side, there's a scrape of something - most likely pad - and Buttler then takes a terrific low catch diving to his left. Saved a leg bye, he did"
24,"Jordan to White, 1 leg bye fires the ball in full at White's feet as he wanders to leg, deflects away square"
25,"Jordan to Finch, 1 run full, attempted yorker, nearly catches Finch out, he swipes an inside edge to deep square leg"
26,"Bresnan to Finch, no run good length on the stumps, blocked watchfully"
27,"Bresnan to Finch, 1 run pulled, not out of the middle, straight to midwicket but dropped by Jordan! Maybe I spoke too soon... It flew fairly quickly, such is Finch's power, but should have been taken, around head height"
28,"Bresnan to White, no run seams back a touch and cramps Whites for room, hitting him near the bread basket"
29,"Bresnan to White, no run on the stumps, worked back on the leg side, Jordan scampers in to field"
30,"Bresnan to White, 1 run tight line outside off from Bresnan, an inside edge bobbles short on the off side and they get one"
31,"Bresnan to Finch, 1 run opens the face and runs a single to short third man"
32,"Stokes to Finch, no run starts well, length ball on off stump, tapped into the off side"
33,"Stokes to Finch, SIX runs clubbed over deep backward square, that's a monstrous flick from Finch, the first six of the innings! He came forward out of the crease, made the delivery a half-volley on his pads, but the nonchalance with which he launched the ball over the rope was astounding"
34,"Stokes to Finch, 2 runs on leg stump, worked through square leg for a couple more"
35,"Stokes to Finch, no run good pace, around off stump, Finch has a big old ballyhoo and fails to connect"
36,"Stokes to Finch, SIX runs six more, into the crowd at long-on! Overptiched from Stokes and he's taken downtown by the little big man again, crrrrrrrrrrrrunched back over his head"
37,"Stokes to Finch, no run shortens his length wisely, outside off, guides the ball straight to short third man"
38,"Bresnan to White, 1 run length outside off, White attacks but can't replicate Finch's hitting, skewing a thick edge to third man on the bounce"
39,"Bresnan to Finch, SIX runs here goes Finch again - he loves playing against England - carting a slightly fill ball out towards wide long-on, Hales gets round to it but appeared uncertain where the boundary was and compounds his drop but sending it beyond the rope. Tough but takeable"
40,"Bresnan to Finch, no run on the stumps, played respectfully back this time"
41,"Bresnan to Finch, OUT on the attack, doesn't get hold of a pull and plops the ball to mid-on! England have got their aggressor, Bresnan winkles him out with a half-tracker, miscalculation from Finch, who tried to pull from outside off, maybe wasn't quite short enough either and spooned to the fielder"
42,"Bresnan to Maxwell, 1 run full and down the leg side, squirts it through square leg to get off the mark"
43,"Bresnan to White, 1 run tight stuff from Bresnan, on off stump and tickled down the ground for one more"
44,"Stokes to White, no run good length outside off, White swings and misses"
45,"Stokes to White, 1 run low full toss on the stumps, clipped low through the leg side to deep midwicket"
46,"Stokes to Maxwell, no run pitched up wide of the wicket, Maxwell fiddles at it and fails to connect"
47,"Stokes to Maxwell, 1 wide spears this down the leg side - wide"
48,"Stokes to Maxwell, SIX runs brutal, Maxwell smears a flat six over wide long-off! Maybe a touch full from Stokes and Maxwell backed away to smoke it into the crowd"
49,"Stokes to Maxwell, no run takes the pace off and the ball bounces over the stumps as Maxwell walks across and attempts a cute dab behind square"
50,"Stokes to Maxwell, 1 run back of a length, outside off, smacked down the ground with a baseball slug but straight to long-on"
51,"Broad to Maxwell, SIX runs boom, six more! Broad goes short and follows Maxwell, who simply roundhouses it on its way over deep backward square"
52,"Broad to Maxwell, OUT swings again but Maxwell has holed out to long-on! The ball was back of a length, Maxwell tried to cross-batter it again, came high off the bat and straight to the man running in from the fence. Another frenzied failure from Maxwell"
53,"Broad to White, 1 run leg-stump line, closes the face and works one to backward square leg"
54,"Broad to Cutting, 2 runs goes back and runs a couple down to third man"
55,"Broad to Cutting, no run tries to dab the ball to the same part of the ground and it's cut off on the edge of the ring, Lumb the substitute, he has a shy with Cutting stranded but fails to hit!"
56,"Broad to Cutting, SIX runs launches into a length ball and sends it high, high, high and just beyond the boundary at long-on. Told you"
57,"Dernbach to White, no run starts with a length ball on the stumps, White gets behind the line"
58,"Dernbach to White, 2 runs fuller, in the channel, driven through the covers for a couple into the deep"
59,"Dernbach to White, no run good line, White pushes into the off side, cut off in the circle"
60,"Dernbach to White, 1 run now the slower ball from Dernbach, out the back of the hand, White watches it on to the bat around leg stump and steers one through square"
61,"Dernbach to Cutting, 1 run length ball outside the line of off, opens the face and guides one to third man"
62,"Dernbach to White, 1 run full and straight, right up in the blockhole, White bunts one to long-on - not bad, Jade, not bad"
63,"Bresnan to White, FOUR runs full ball on the stumps, swung into the leg side, powerful strike and runs to the fence"
64,"Bresnan to White, FOUR runs slower ball on leg stump, flicked very fine and it skips away for four more"
65,"Bresnan to White, 1 run Bresnan drags his length back and gets punched down to long-on"
66,"Bresnan to Cutting, SIX runs length ball and heaved over the longest part of the ground, big smash right across the line and nailed it into the stands"
67,"Bresnan to Cutting, 2 runs lovely timed straight drive but it cannons the bowler's end stumps and ricochets into midwicket for a couple"
68,"Bresnan to Cutting, 1 run excellent yorker, dug out down to long-off"
69,"Dernbach to Cutting, 1 run short ball pulled out to deep midwicket"
70,"Dernbach to White, 1 run length delivery, slower ball on the stumps, turned carefully to the leg side 45 and they get a quick single"
71,"Dernbach to Cutting, 1 wide full but well wide of off stump, 100 up"
72,"Dernbach to Cutting, no run excellent quick yorker and Cutting is hurried into digging out the toe-crusher"
73,"Dernbach to Cutting, FOUR runs full length swung hard down the ground, Root sliding to his left at long-on misses, perhaps could have done better there"
74,"Dernbach to Cutting, no run slower ball on leg stump and Cutting seems to nudge around the corner but ends up shovelling it off his elbow to the 45"
75,"Dernbach to Cutting, no run full outside off, big swing and a miss"
76,"Jordan to Bailey, 1 run short ball, swatted down into midwicket and it's just a single, exactly what England wanted"
77,"Jordan to Wade, 1 run full on leg stump, flicked down to long leg"
78,"Jordan to Bailey, 2 runs turned into square leg, they sprint hard for two and the throw from Stokes is miles off line so they get home safe as houses"
79,"Jordan to Bailey, 1 run full on off stump, knocked into the covers and they get an easy run"
80,"Jordan to Wade, 1 run full on the stumps, turned into the leg side and there's another easy single"
81,"Jordan to Bailey, 1 run very full, excellent delivery, turned down to long leg for an easy single"
82,"Dernbach to Bailey, 1 run bumper, gets up well over Bailey's head, he uppercuts it down to third man on the bounce"
83,"Dernbach to Wade, 1 run good length, Wade is forward and knocks it into point"
84,"Dernbach to Bailey, 1 run full angled in, Bailey steps to leg and pushes into the covers"
85,"Dernbach to Wade, 1 wide wide, well down leg"
86,"Dernbach to Wade, 2 runs slower ball on the stumps, slogged straight up in the air, it goes miles up and Bopara is the man running in from deep midwicket, he makes the ground but drops the catch with the ball swirling to his right at the last moment, very tough chance"
87,"Dernbach to Wade, FOUR runs short at the body and hammered behind square, nailed the pull"
88,"Dernbach to Wade, 1 run another pull, this straight to Bopara again but on the bounce"
89,"Stokes to White, SIX runs length on the stumps, White clears the front leg and extends the arms through the shot, creaming it over long-off"
90,"Stokes to White, no run forward and angling to short third man, too quickly for a single"
91,"Stokes to White, 1 run full length angled in, pushed firmly down to long-off"
92,"Stokes to Cutting, no run length ball, Cutting opens up to swing it to leg but misses"
93,"Stokes to Cutting, SIX runs full on the stumps, another lovely swing down the ground, clears long-off this time, managed to play it inside out against the angle, sweetly timed"
94,"Stokes to Cutting, no run back of a length, goes to uppercut but misses completely"
95,"Root to White, 1 run around the wicket, flicked out to deep midwicket for an easy single"
96,"Root to Cutting, OUT down the track, punches firmly back towards the bowler but Root reaches out to his left and clings onto a rifling chance that was struck very well but evidently too straight and Root intervened to perfect effect"
97,"Root to Bailey, no run down the track, goes to flick to leg but gets struck on the thigh pad"
98,"Root to Bailey, FOUR runs another step down the wicket, this time picks it up over the leg side and places it perfectly in between deep midwicket and long-on"
99,"Root to Bailey, 2 runs now smashes off side and Jordan has to run to his left to field, does well"
100,"Root to Bailey, SIX runs another step down and hits this off a length over long-on, cracking timing again"
101,"Bresnan to Wade, SIX runs length ball, slower ball, long ball over midwicket, flat and hard, smashed"
102,"Bresnan to Wade, 1 run much fuller and angled to backward point"
103,"Bresnan to Bailey, 2 runs full on leg stump, clubbed leg side, Bopara comes in to field but can't save two"
104,"Bresnan to Bailey, 1 run short ball, pulled without timing, deep-square is in quickly and saves the second"
105,"Bresnan to Wade, no run short and pulled from outside off, except he misses completely"
106,"Bresnan to Wade, 2 runs full at leg stump, swung towards deep midwicket and they race back for two"
107,"Dernbach to Bailey, FOUR runs short ball outside off and Bailey swings wildly at it, gets it off the toe and finds wide long-on"
108,"Dernbach to Bailey, SIX runs slower ball bouncer, Bailey steps back and whacks it mid-off and it clears the rope! Amazing shot, what power"
109,"Dernbach to Bailey, SIX runs slower on the stumps, Bailey swings it hard over the leg side and clears the rope again! Slower ball picked up and it has enough length to carry wide long-on"
110,"Dernbach to Bailey, FOUR runs full and wide of off stump, Bailey reaches out and hammers this wide of deep cover, that almost carried for six as well"
111,"Dernbach to Bailey, FOUR runs length outside off, Bailey swings it away again, this past extra cover and there's enough pace to find the fence again!"
112,"Dernbach to Bailey, 2 runs full and wide, Bailey has to almost dive across for it, gets a thick outside edge to third man, Wright saves with super dive and throws back to Buttler who manages to miss the stumps with a flick of the hands meaning Bailey got back for the second"
113,"What a final over from Bailey and has taken Australia from what was only a par score to a very good total, England would not have been expecting to chase above 190 when they took a flurry of wickets to reduce Australia to 139 for 6 with four overs to go. But Bailey's blinder puts Australia in the box seat for another win and Monty will"
114,"Howdy, back again. That final over may have put a cork in the tour for England. Oh Jade... This will again be a record chase, though it's not above 200, despite George Bailey's best efforts."
115,"Luke Wright is going to face the first ball, he's had a good BBL opening the batting for the Stars. Mitchell Starc has the ball"
116,"Starc to Wright, 1 run over the wicket, on a length and there's a hint of inswing as Wright closes the face, works one past midwicket"
117,"Starc to Hales, no run again this comes back, Hales is a little stuck in the crease and gets an inside edge on to his pads, the ball just dropping past leg stump"
118,"Starc to Hales, no run pitched up in the channel, swings the arms and chops a bump ball into the hands of cover point"
119,"Starc to Hales, 1 run full and wide again, steered this time down to third man"
120,"Starc to Wright, 2 runs short of a length, on the hips and nurdled behind square for a couple"
121,"Starc to Wright, 1 run pitched up around off stump, big backlift from Wright but he doesn't connect cleanly and gets just a single wide of mid-on"
122,"Coulter-Nile to Wright, no run length ball in the channel outside off, Wright plays a watchful leave. Lovely"
123,"Coulter-Nile to Wright, no run fuller, around off stump, comes forward and taps into the covers"
124,"Coulter-Nile to Wright, no run NCN is up at 88mph, tight line in the corridor, Wright steers straight to point from the crease"
125,"Coulter-Nile to Wright, no run bit of width, Wright swings hard but fails to connect, might have bounced a tad more than expected"
126,"Coulter-Nile to Wright, no run is that a drop? Replays suggest it might have been, Coulter-Nile certainly thinks so, Wade fumbling a low take to his left as Wright got a thin edge down the leg side trying to glance off his hips"
127,"Coulter-Nile to Wright, FOUR runs and he cashes that cheque, denying the bowler a maiden with a scooped four down the leg side from a short delivery on the stumps"
128,"Starc to Hales, 1 wide fired full and wide of the stumps... too wide"
129,"Starc to Hales, no run pitched up, outside the line of off, squeezed to point as Hales chops down on it"
130,"Starc to Hales, 1 run goes for the inswinging yorker, gets enough bat on it to squeeze one through backward point"
131,"Starc to Wright, no run quick and in the channel outside off, another swing and a miss from Wright"
132,"Starc to Wright, no run gets away with a full toss, on the stumps and hacked back down the track, Starc collects in his follow through and the scorers mark a dot"
133,"Starc to Wright, OUT drops short, pulled... straight to deep square leg! So Wright gets another single-figure score, despite moving up the order, he was in position to play the shot, went aerial but can't have been looking at the field. Cutting did a two-step to his right and then settled for the take"
134,"Starc to Stokes, 4 leg byes full, attempted yorker, I think, slides down the leg side, flick of pad and it beats Wade's dive"
135,"Coulter-Nile to Hales, no run slightly short of a length, follows the batsman, who plays it on to his body aiming to leg"
136,"Coulter-Nile to Hales, FOUR runs driven on the up just over extra cover, first boundary for Hales, got enough on it and cleared the infield"
137,"Coulter-Nile to Hales, OUT now Hales has picked out deep square leg, this time on the run! Sweetly timed, a little pick-up swivel pull, but not enough to clear the boundary, there is only one man out there but he made good ground and England lose both openers in similar fashion"
138,"Coulter-Nile to Root, no run shuffles across and plays a length ball into the off side"
139,"Coulter-Nile to Root, no run off-stump line from Coulter-Nile, Root again plays watchfully with a straight bat"
140,"Coulter-Nile to Root, no run gets across and defends a length ball square on the off side - another cracking over from Coulter-Nile, keeping the pressure on"
141,"Maxwell to Stokes, FOUR runs pushed through flat outside off from round the wicket, Stokes makes room to swing a cross-batted drive through the covers for four"
142,"Maxwell to Stokes, 1 run angled in, worked wide of mid-on for one"
143,"Maxwell to Root, no run flat, on the stumps, turned to midwicket"
144,"Maxwell to Root, no run tossed up, pushed back to the bowler's right, Maxwell doesn't completely stop it but mid-on prevents a run"
145,"Maxwell to Root, 1 run full and wide of the stumps, Root mows across the line, gets a bottom edge that bounces over the stumps, past Wade for one"
146,"Maxwell to Stokes, OUT heave ho, off he goes, a loopy leading edge caught on the edge of the ring! Stokes laid the dynamite but only succeeded in blowing himself up, swinging hard and falling harder, the ball looped towards point and Cutting took an excellent catch back-pedalling"
147,"Cutting to Root, no run pitched up outside the line of off, Root chops into the ground towards point"
148,"Cutting to Root, no run on the stumps, pushed back on the up to mid-on"
149,"Cutting to Root, FOUR runs drags this short and Root plays a orthodox pull, flat and in front of deep midwicket, where Muirhead gets to it on the slide but only manages to flip the ball beyond the rope for four"
150,"Cutting to Root, 1 run bit of width, opens the face and steers one to third man"
151,"Cutting to Morgan, 1 run length ball on off stump, pushes at it and in inside edge runs short and square on the leg side for one"
152,"Cutting to Root, no run goes back and cuts hard, it's stopped well at backward point and then Morgan has to throw himself back to regain his ground at the other end"
153,"Maxwell to Morgan, 2 runs darted outside off, comes forward and chips a couple over the infield towards deep extra cover"
154,"Maxwell to Morgan, 1 run tossed up and punched down the ground on the front foot"
155,"Maxwell to Root, no run floated up on the stumps, Root tries reverse-sweep and is hit on the pad, possibly a little glove saves him, as the umpire turns down Maxwell's appeal"
156,"Maxwell to Root, 2 byes full on the stumps, conventional slog-sweep attempted this time and the ball misses everything, they run a couple"
157,"Maxwell to Root, 1 run pushed across from round the wicket, runs a single to short third man"
158,"Maxwell to Morgan, SIX runs skips forward to a full ball and boings it over wide long-off! Such power in those wrists, the bottom hand coming through as a mere punch soars beyond the boundary for England's first maximum"
159,"Christian to Root, no run on the stumps, dabbed into the off side"
160,"Christian to Root, 1 run gets forward and pushes this through the covers for a single"
161,"Christian to Morgan, SIX runs goes round the wicket, Morgan moves outside the line and plays an audacious scoop over fine leg! Clever batting and that's six more"
162,"Christian to Morgan, 1 run goes fuller, still outside off, squeezes one in front of square"
163,"Christian to Root, 1 run touch short, Root swats it aggressively down the ground for one"
164,"Christian to Morgan, 1 run Morgan leaves the crease and clumps one to long-on for another single"
165,"Maxwell to Morgan, FOUR runs oh dear, Cutting has had a mare here, moving round the boundary at deep cover to stop a drive, he slides past it, makes the pick up and then somehow manages to toss it on to the rope, unable to pull it back in slow motion with a groping hand"
166,"Maxwell to Morgan, 1 run comes forward again and drills one to long-off"
167,"Maxwell to Root, 2 runs pushed through on leg stump, nurdles a couple through backward square"
168,"Maxwell to Root, no run on the stumps, sweeps flat but picks out midwicket"
169,"Maxwell to Root, no run opens the shoulders, can't force the ball into a gap on the leg side"
170,"Cutting to Buttler, no run full and worked to leg, midwicket cuts it off"
171,"Cutting to Buttler, no run gets forward and punches a full delivery towards mid-off, turns down a tight single"
172,"Cutting to Buttler, 1 run short and at the batsman, who top-edges a pull, into a gap at square leg for one to get Buttler off the mark"
173,"Cutting to Morgan, 1 wide short and wide down the leg side as Morgan swings and misses"
174,"Cutting to Morgan, 1 run stays back in the crease, settles for a a dabbed single through square"
175,"Cutting to Buttler, FOUR runs adroitly done by Buttler, a legcutter from Cutting and he waits on it before flicking a ramped four over the head of Wade. England need a few several lots more of those"
176,"Cutting to Buttler, no run tries again, this time scoops and misses"
177,"Maxwell to Morgan, FOUR runs tossed up and slapped over the covers for another boundary, Morgan moving smoothly through the gears"
178,"Maxwell to Morgan, no run Maxwell scampers to the leg side to field off his own bowling"
179,"Maxwell to Morgan, no run on the stumps, played back to the bowler"
180,"Maxwell to Morgan, 1 run on the charge, swings and edges but it bounces in front of short third man and Morgan lives"
181,"Maxwell to Buttler, 1 run comes forward and punches a single to long-off"
182,"Maxwell to Morgan, 2 runs flat, worked into the leg side and they want two, Maxwell again chases after it but Morgan makes it home, good running"
183,"Christian to Buttler, 1 run length on off stump, worked into midwicket, just for a single"
184,"Christian to Morgan, 1 run length outside off, slapped down to long-off"
185,"Christian to Buttler, 1 run slower ball, back of a length on off stump, Buttler heaves it down to long-off"
186,"Christian to Morgan, no run full, angled in, Morgan tucked up and struck on the pad which runs towards cover and the bowler fields"
187,"Christian to Morgan, 1 run Morgan steps to leg, Christian follows him and Morgan flicks it around the corner for a single"
188,"Cutting to Bopara, 1 run length on the stumps, flicked through square leg and the fielder races in to save the second"
189,"Cutting to Morgan, 1 run pulled without timing down to long leg"
190,"Cutting to Bopara, 1 run Bapara steps back and flicks from off stump to short third man"
191,"Cutting to Morgan, OUT length ball swung to leg, Morgan doesn't get all of this, in comes Starc from deep square leg, dives forward and takes the catch but of course when it's close, which this is, they will go upstairs to have a check and there's every chance this could be overturned but thankfully not because the catch looked"
192,"Cutting to Bresnan, 1 run short and pulled off the splice of the bat, no-one at square leg so gets away with this for a single"
193,"Cutting to Bopara, 1 run short again, better pull but straight to deep-square"
194,"Coulter-Nile to Bopara, 1 run excellent yorker dug out into the covers"
195,"Coulter-Nile to Bresnan, 2 runs clears the front leg and swings backward of square, there's a fumble and they get back for two"
