,Data
499,"Agar to Morgan, FOUR runs paddy-whacked through backward point! He's so quick and effective on that shot, reversing the hands and just pulling the lone fielder hither and thither"
500,"Agar to Morgan, 2 runs punched in front of square this time, on the back foot"
501,"Agar to Morgan, FOUR runs plants the front foot, and boshes one over the top. Not quite timed but impressive intent from the captain"
502,"Agar to Morgan, 2 runs nailed in front of square once again"
503,"Jhye Richardson to Hales, 1 run back of a length and punched through point from the crease"
504,"Jhye Richardson to Buttler, 1 run touch short outside off and Buttler gets off the mark first ball with a steer square"
505,"Jhye Richardson to Hales, no run comes across and taps into the covers"
506,"Jhye Richardson to Hales, 1 run fullish outside off, Hales runs the ball behind point for a single"
507,"Jhye Richardson to Buttler, no run pitched up, Buttler taps into the covers"
508,"Jhye Richardson to Buttler, 2 runs back of a length, bit if width and he throws the hands through a slice behind deep point for two"
509,"Agar to Hales, no run angled in and tapped back to the bowler"
510,"Agar to Hales, no run tossed up, Hales drives along the ground back into Agar's hands"
511,"Agar to Buttler, no run pushed through and tapped to extra cover"
512,"Agar to Buttler, no run flat on the stumps, Buttler nurdles to midwicket"
513,"Agar to Buttler, FOUR runs ouch, that's some wristy power, crunched off the back foot past midwicket and the man in the deep can't get around the rope to cut it off... First boundary for Buttler"
514,"Stanlake to Hales, 1 run short outside off and sliced down to third man"
515,"Stanlake to Buttler, 2 runs stops a touch in the pitch, Hales chips in the air but clears cover and gets away with it again!"
516,"Stanlake to Buttler, 1 run length, driven hard on the up through the off side"
517,"Stanlake to Hales, 1 run dug in short and Hales pulls through square leg"
518,"Stanlake to Buttler, 1 run Buttler swats the ball for one more"
519,"Stanlake to Hales, no run pitched up and this skips through low underneath the bat"
520,"Jhye Richardson to Buttler, 1 run shortish outside off and chopped into the covers"
521,"Jhye Richardson to Hales, 1 run full in the channel, Hales clamps down and gets a toe-end towards third man"
522,"Jhye Richardson to Buttler, FOUR runs short ball, Buttler latches on and hammers a pull way through backwards square"
523,"Jhye Richardson to Buttler, FOUR runs short of a length in the channel and Buttler blitzes a cut, uppish but clears the dive of backward point and races for four more"
524,"Jhye Richardson to Buttler, no run comes across and pushes into the covers"
525,"Jhye Richardson to Buttler, FOUR runs Richardson drops short and Hales collars him this time, smote through in front of midwicket and the fielder hasn't a hope!"
526,"Stanlake to Hales, no run back of a length and defended to leg"
527,"Stanlake to Hales, no run good nut from Stanlake, seaming back in as Hales hangs back, gets an inside edge on to his pads"
528,"Stanlake to Hales, no run short and wide, goes to cut but rather plops it towards backward point"
529,"Stanlake to Hales, 1 run chopped into the off side, Buttler calls him through for a tight single"
530,"Stanlake to Buttler, FOUR runs woof! Pick that out... Buttler stand still on off, waits on the overpitched delivery and then blaps it through the covers! The equivalent of sticking a free-kick right in the top corner"
531,"Stanlake to Buttler, 1 run full and dabbed through the off side for one more to keep the strike"
532,"Neser to Buttler, no run full, slips this one under the bat as Buttler swings and misses"
533,"Neser to Buttler, FOUR runs wristy power, full in the channel and slashed away behind point, opening the face and finding the gap"
534,"Neser to Buttler, FOUR runs ah, that's a genuine half-volley, Buttler steps on to the front foot and hoofs it over mid-off, bounces just in front of the rope"
535,"Neser to Buttler, 1 run comes down and prods into a gap"
536,"Neser to Hales, FOUR runs bit of width, Hales flashes hard and squirts a third boundary in the over through backward point"
537,"Neser to Hales, 1 run on the stumps, turned into the leg side for one"
538,"Lyon to Hales, 1 run tossed up on the stumps, clipped through mid-on"
539,"Lyon to Buttler, no run nudged with the spin to square leg"
540,"Lyon to Buttler, no run pushed through outside off and Buttler pings it to point"
541,"Lyon to Buttler, no run pushed through and Buttler again finds the infield on the off side"
542,"Lyon to Buttler, 1 bye tossed up and spinning through the gate, Buttler plays around it but it beats Paine, too, and they nick a bye"
543,"Lyon to Hales, no run comes across on off and prods away"
544,"Neser to Buttler, 1 wide sliding down the leg side"
545,"Neser to Buttler, FOUR runs power from Buttler again, a low full toss and that bottom hand comes through to club four more through cover"
546,"Neser to Buttler, no run length, poked into the off side"
547,"Neser to Buttler, (no ball) SIX runs high full toss, Buttler sees it big and slugs a home run into the crowd at deep midwicket! That's a no-ball on height, but didn't stop him smashing six!"
548,"Neser to Buttler, 2 runs spooned straight up, this will be caught coming in from long-on... but they run two while it's in the air, bringing up Buttler's fifty from 28 balls! Phew"
549,"Neser to Buttler, FOUR runs overpitched, Buttler fires one final bottom-handed blast over cover, seals a six-wicket win for England!"
550,England won by 6 wickets (with 32 balls remaining)
551,"Player of the match is Jason Roy, ENG"
