,Data
0,"1.49pm Tim Paine won the toss to lift Australian spirits... has the mood change made it all the way to Samara? I think it might have, you know..."
1,"Wood to Finch, FOUR runs short, and dismissively hoicked through backward square leg! Decent pace, but that was nailed!"
2,"Wood to Finch, no run wider line, 86mph, might have been given as wide but for a toe-ended thump to point"
3,"Wood to Finch, no run climbing through to the keeper, swinging away"
4,"Wood to Finch, 1 run jabbed through third man, nip away from the bat but well enough connected"
5,"Wood to Head, no run solidly into line and defended back down the pitch"
6,"Wood to Head, no run tapped into the leg side, that's a good recovery from that first-ball four"
7,"Willey to Finch, no run back of a length, and sure enough, this one tails back a touch and cracks Finch high on the pads"
8,"Willey to Finch, 1 leg bye curling into the pads, a bit of an ambitious single but Buttler's shy from behind the stumps is about as hopeless as you'll ever see in international cricket"
9,"Willey to Head, no run curling away from the left-hander, two slips in place as Head leans forward to defend"
10,"Willey to Head, 1 run width, more swing, driven off a fat under-edge, out through square leg"
11,"Willey to Finch, 3 runs lovely strike, meeting the full length with a compact drive, perfectly bissecting the two cover fielders"
12,"Willey to Head, no run tight line outside off, poked out to the off side"
13,"Wood to Finch, no run back of a length, lifting sharply as FInch misses out on a cramped pull"
14,"Wood to Finch, no run wicket to wicket line, blocked solidly back down the pitch"
15,"Wood to Finch, no run tight to the off stump, pushed into the covers"
16,"Wood to Finch, no run defended back down the wicket"
17,"Wood to Finch, no run dropped but what an effort! Hales at short midwicket, stuck out his right hand with the ball almost behind him, Ben Stokes at Trent Bridge fashion, but he couldn't claw it in as he fell to the ground!"
18,"Wood to Finch, no run defended back down the pitch"
19,"Willey to Head, FOUR runs too wide, and slapped firmly through the covers"
20,"Willey to Head, no run swinging late, half driven down to the man at mid-off"
21,"Willey to Head, no run swing once more, wide of off stump, but Head can't line it up with a back-foot slap"
22,"Willey to Head, no run through to the keeper on a wide line once more"
23,"Willey to Head, no run half an appeal, and England think seriously about the review, Head was deep in the crease, but that was down the leg side"
24,"Willey to Head, no run solidly forward to block on a middle and leg line"
25,"Wood to Finch, 1 wide banged in short, over the shoulder"
26,"Wood to Finch, 1 run on the pads, worked to backward square leg"
27,"Wood to Head, 2 runs nudged off the hip, into space on the leg side"
28,"Wood to Head, 1 run deflected round the corner once more"
29,"Wood to Finch, no run tight line on a full length, Finch defends firmly off the back foot"
30,"Wood to Finch, no run very full, and Wood is almost up for the lbw appeal, but reckons rightly that that was heading down leg"
31,"Wood to Finch, no run full and straight, no way through there, pushed to cover"
32,"Willey to Head, no run slashed to the leg side, no great foot movement as Head plays the swing off the pitch"
33,"Willey to Head, FOUR runs fenced into the gap clean down the ground, that's superb timing! Met the ball on the top of the bounce and eased it through long-on"
34,"Willey to Head, 1 run chiselled in the air, out to deep midwicket"
35,"Willey to Finch, FOUR runs crunching drive! This is better intent from Australia, striding out to meet the ball and flogging it clean through the covers"
36,"Willey to Finch, no run back of a length, glided out to point where it is gathered on the run to prevent the single"
37,"Willey to Finch, no run tucked to the leg side"
38,"Wood to Head, no run back of a length, Wood falls over in his followthrough, but he's delivered the ball nicely into the channel. Poked to point"
39,"Wood to Head, FOUR runs sweetly on-driven! Just a touch over-pitched from Wood, right under the eyeline and launched back through the bowler's grasp"
40,"Wood to Head, no run flicked to leg, looking for the single, but Buttler swoops"
41,"Wood to Head, no run banged in short, Head ducks"
42,"Wood to Head, 2 runs much wider on the crease, Head reads the revised angle and flicks urgently out through square leg"
43,"Wood to Head, FOUR runs whipped through backward square leg. The runs are starting to flow now"
44,"Willey to Finch, no run defended off the back foot, gathered in the followthrough"
45,"Willey to Finch, no run tapped to the leg side, gathered at short midwicket"
46,"Willey to Finch, no run fuller length, hovering around the off stump, and blocked back down the pitch"
47,"Willey to Finch, 1 run back of a length once again, on a middle and leg line, Finch tries to work it square but can't connect properly"
48,"Willey to Head, FOUR runs another lovely drive, clean through extra cover with a big stride and a full face"
49,"Willey to Head, no run pushed onto the back foot, blocked out to point"
50,"Root to Finch, no run round the wicket, on the pads, tucked to short square"
51,"Root to Finch, 1 leg bye full length, strikes the pad as well as bat, but the line from round the wicket makes the sweep a safe option"
52,"Root to Head, no run faster through the air, punched uppishly to short midwicket"
53,"Root to Head, no run whittled into the leg side, short midwicket is in action again"
54,"Root to Head, FOUR runs that's well played, lots more air from Root, and Head skips down the pitch to drill through wide long-off"
55,"Root to Head, 1 run flipped through the leg side to complete the over"
56,"Overton to Head, FOUR runs outside off, slammed through point. A bit of a nervy sighter"
57,"Overton to Head, no run wide line once again but a sharper pace, climbs over another attempted cut/carve"
58,"Overton to Head, no run on the back foot, punched back down the pitch without much conviction"
59,"Overton to Head, FOUR runs chopped down into the crease, and so nearly onto the stumps! Misses the timbers by a whisker, and Buttler is wrong-footed too"
60,"Overton to Head, no run firmly onto the front foot to block this time"
61,"Overton to Head, FOUR runs beautiful drive. Too wide from Overton, in the slot for a tonk, and battered through the covers"
62,"Root to Finch, 1 run round the wicket, nudged to the leg side"
63,"Root to Head, no run tweaking into the left-hander, met with a full face on the back foot"
64,"Root to Head, no run whoops! An attempt at violence from Head, but he loses his shape as he skips down the pitch and is lucky to get enough bat on the ball to spare him the stumping"
65,"Root to Head, 1 run worked to leg"
66,"Root to Finch, 1 run tapped into the covers"
67,"Root to Head, 1 run advancing down the track, and worked to the leg side"
68,"Overton to Head, no run well bowled! That's better from Overton, a yard fuller, and tighter to the off stump. Angled across and lifting past the left-hander's edge"
69,"Overton to Head, 1 run shorter and wider, slapped to cover for the single"
70,"Overton to Finch, 2 runs flipped into the leg side"
71,"Overton to Finch, no run tight line on off stump, and pushed back down the pitch"
72,"Overton to Finch, 1 run tip and run, and through they gallop, a single to mid-on"
73,"Overton to Head, 1 run blocked back down the pitch"
74,"Root to Head, 1 run thumped down to long-off"
75,"Root to Finch, 1 run nurdled into the off side"
76,"Root to Head, 1 run cracked into the covers, and up comes Head's fifty. A well-compiled knock, from 43 balls. He's dominated this opening stand"
77,"Root to Finch, 1 run tapped to the leg side"
78,"Root to Head, no run advancing down the wicket, crashed to cover"
79,"Root to Head, 1 run on the back foot, fenced into the covers"
80,"Overton to Head, no run thumped on the up to short cover, tighter lines from Overton"
81,"Overton to Head, 2 runs clipped out to deep midwicket, a long chase for the sweeper"
82,"Overton to Head, 2 runs a swishing pull, out to deep square leg. Good connection and two more to the total"
83,"Overton to Head, no run punched firmly to mid-off"
84,"Overton to Head, no run a cramped cut to backward point"
85,"Overton to Head, no run punched to the off side"
86,"Root to Finch, 1 run round the wicket once more, cramping the right-hander for room on the pads, and tucked square"
87,"Root to Head, 1 run advancing the bowler, but can't rifle the drive through the gap"
88,"Root to Finch, no run flipped to short midwicket"
89,"Root to Finch, 1 run looped up, onto the legs, clipped to the leg side once more"
90,"Root to Head, no run solid block on the front foot"
91,"Root to Head, no run faster and flatter, nearly wheedles its way through"
92,"Overton to Finch, no run outside off, good lift from back of a length, jabbed down into the pitch"
93,"Overton to Finch, no run wider line, patted to short cover"
94,"Overton to Finch, 1 run advancing down the pitch, worked to the leg side for another single"
95,"Overton to Head, no run drilled to wide mid-off, but with no great timing"
96,"Overton to Head, 1 run clipped out to the leg side"
97,"Overton to Finch, 1 run fuller length, attacking the top of off, deflected behind point"
98,"Root to Finch, no run round the wicket again, punched to mid-off"
99,"Root to Finch, no run down on the sweep, could have been a wide if he'd left it, but instead merely tapped to the man on the 45"
100,"Root to Finch, 1 run worked to the leg side again"
101,"Root to Head, no run crashing drive, advancing down the pitch, but well intercepted in the covers"
102,"Root to Head, 1 run nudged to the leg side, can't get him away"
103,"Root to Finch, 1 run Finch was advancing, but Root saw him coming, held it back in the flight. That's a tremendous over"
104,"Rashid to Finch, 1 run googly to start, punched off the back foot, through long-on"
105,"Rashid to Head, 1 run looping onto a good length outside off, tapped off the back foot to mid-off"
106,"Rashid to Finch, 1 run wider line, cracked with decent timing to wide long-off"
107,"Rashid to Head, 1 run spanked out to wide long-off"
108,"Rashid to Finch, no run turned off the pads, and this could be trouble! Thoughts of a chaotic single, but wisely turned down as square leg swooped"
109,"Rashid to Finch, no run firmly blotted back down the track"
110,"Root to Head, 1 run wide outside off, urgently cut through point"
111,"Root to Finch, 1 run on the pads, nurdled to the midwicket sweeper"
112,"Root to Head, 1 run advancing down the track but just another single, clipped to the leg side"
113,"Root to Finch, FOUR runs tossed up, way down the leg side, Finch smashes it behind the keeper. A rare poor ball, perhaps anticipated a stumping chance, but it was too telegraphed"
114,"Root to Finch, 1 run flicked to leg once more to bring up the 100"
115,"Root to Head, 1 run keeps low as it slides in from outside off, chopped through point"
116,"Rashid to Head, OUT a dirty half-tracker, and tanked straight to the man at deep midwicket! Head is aghast, what a gruesome way to give it away. The long-hop lures him out of his cautious mindset, he seeks to clear the rope, and England have their opening!"
117,"Rashid to Marsh, no run stays over the wicket, tossed up and tapped back down the track"
118,"Rashid to Marsh, no run flighted, chipped to the left of the bowler, bump ball"
119,"Rashid to Marsh, 2 runs googly, spinning away and sliced, but gully can't get a hand on it! Superb diving effort but it loops out of reach, don't think he quite got to the ball"
120,"Rashid to Marsh, 1 run worked into the leg side off the pads"
121,"Rashid to Finch, 1 run tossed up and nudged for one"
122,"Root to Finch, 1 run lobbed up leg side and worked off the pads"
123,"Root to Marsh, no run stays round the wicket, Marsh taps the ball back"
124,"Root to Marsh, no run tossed up, no width and Marsh defends"
125,"Root to Marsh, 1 run comes across, dabs the ball down square on the off side for a single in front of point"
126,"Root to Finch, no run pushed through flat on the pads, Finch tickles it fine but the man on the edge of the ring prevents one"
127,"Root to Finch, no run full and straight, tapped gently away"
128,"Rashid to Marsh, no run pushed through and chopped back down the track"
129,"Rashid to Marsh, 1 run punched into the ground to the left of Rashid, who gets a hand on it but can't prevent one"
130,"Rashid to Finch, 1 run floated up and driven through the covers for one"
131,"Rashid to Marsh, no run pushed through, can't get this one away"
132,"Rashid to Marsh, FOUR runs full, outside leg stump, possibly the googly but Marsh is to the pitch and sweeps forcefully past short fine leg, Moeen sprawls but can't prevent four"
133,"Rashid to Marsh, no run worked off the legs to midwicket"
134,"Root to Finch, 1 run flat on the pads and Finch is happy to nurdle away"
135,"Root to Marsh, 1 run tossed up and stroked through the covers on the front foot"
136,"Root to Finch, 1 run flat and on leg stump, tickled into a gap at midwicket"
137,"Root to Marsh, 1 run flighted a bit more, Marsh drives and it comes off the inside half of the bat"
138,"Root to Finch, 1 run dobbed on the stumps, worked away"
139,"Root to Marsh, 1 wide pushes this one down the leg side"
140,"Root to Marsh, 1 run floated up full and Marsh prods one more into the covers"
141,"Rashid to Marsh, 1 run comes down and works a single down the ground"
142,"Rashid to Finch, no run flighted, Finch blocks to leg"
143,"Rashid to Finch, SIX runs hi ho Silver! That's gone all the way over long-on, picked the googly and slugged it powerfully beyond the ropes"
144,"Rashid to Finch, 1 run flatter, outside off and steered away off the back foot"
145,"Rashid to Marsh, no run pushed through and whipped to short midwicket"
146,"Rashid to Marsh, no run nicely bowled, slips in the googly and Marsh is beaten as the ball thuds into the gloves"
147,"Root to Finch, no run flat on the stumps, can't do much with it"
148,"Root to Finch, 1 run floated up on leg stump, flicked for one more"
149,"Root to Marsh, no run Marsh taps into the covers"
150,"Root to Marsh, no run angled in with the arm and Marsh shows this a straight bat"
151,"Root to Marsh, 1 run floated up full and Marsh dinks one into a gap out towards deep cover"
152,"Root to Finch, 1 run on the stumps and nudged off the pads again - that's fifty for Finch, a sedate innings so far but we know he can go big"
153,"Rashid to Finch, 1 run floated up and driven into a gap coming forwards"
154,"Rashid to Marsh, no run goes for the sweep but picks out the fielder on the edge of the ring"
155,"Rashid to Marsh, no run flighted, pushed back down the track to the bowler"
156,"Rashid to Marsh, no run slips in the Bosie again, this time Marsh misses flicking across the line and is hit on the pad, pitched outside leg"
157,"Rashid to Marsh, 1 run comes forward and drives this through mid-on for a single"
158,"Rashid to Finch, no run gives this some air, Finch reaches forward and blocks"
159,"Root to Marsh, 2 runs short of a length and worked off the hip behind deep backward square for a couple"
160,"Root to Marsh, no run tossed up and defended on off"
161,"Root to Marsh, no run flat, pushed into the covers... another dot ball"
162,"Root to Marsh, no run angled in and Marsh flicks against the spin to midwicket"
163,"Root to Marsh, 1 run flighted, this time Marsh manages to pick a gap coming forwards"
164,"Root to Finch, no run dobbed on the stumps one last time and Finch blocks - that is Root bowled out, 10 overs for 44, only the second time he has completed his allocation in ODIs"
165,"Rashid to Marsh, no run Rashid tosses the ball up and Marsh prods it back"
166,"Rashid to Marsh, 1 run full on the stumps, paddled away to leg for a single"
167,"Rashid to Finch, no run lobs up the googly, hits the inside edge as Finch presses forwards"
168,"Rashid to Finch, 1 run flighted, comes across on off and drives for one"
169,"Rashid to Marsh, 1 run floated up full on leg stump, March whips one down the ground"
170,"Rashid to Finch, SIX runs full and juicy, gets it a bit too straight, Finch whumps it back over long-on again! Second six, a meaty blow down the ground, turns that into a decent over for Australia"
171,"Ali to Marsh, 2 runs tossed up and driven firmly, placed in front of deep cover but Billings does well to haul it in"
172,"Ali to Marsh, 2 runs round the wicket, full and punched in front of the sweeper again"
173,"Ali to Marsh, no run flatter and tapped towards point"
174,"Ali to Marsh, 1 run worked down the ground"
175,"Ali to Finch, 1 run tossed up, Finch turns the ball into the leg side with the spin - fifty stand between these two"
176,"Ali to Marsh, no run pushed through on off, Marsh taps it to the fielder"
177,"Rashid to Finch, 1 run legbreak, spinning away outside off, Finch drops back and cuts"
178,"Rashid to Marsh, no run flighted, drifting across as Marsh comes down, defended"
179,"Rashid to Marsh, no run floated up and clipped to mid-on"
180,"Rashid to Marsh, no run can't get this one away"
181,"Rashid to Marsh, 1 run stays back and plays with the spin through square leg for one"
182,"Rashid to Finch, no run gives this some air, Finch defends watchfully"
183,"Ali to Marsh, 1 run pushed through from round the wicket, Marsh dabs into a gap"
184,"Ali to Finch, no run fired in straight, Finch blocks it back down the track"
185,"Ali to Finch, 2 runs flatter, worked through square leg and they come hustling back for two"
186,"Ali to Finch, no run on the stumps, Finch taps it down"
187,"Ali to Finch, no run flighted, outside off and met with a forward block"
188,"Ali to Finch, 1 run touch short and Finch can stay in the crease and clip a single behind square"
189,"Overton to Finch, 2 runs short of a length, Finch helps it down towards deep backward square leg, Marsh has to hurry and put in a dive at the bowler's end... but he's fine, after a check with the TV umpire"
190,"Overton to Finch, 1 run length ball, 80mph and Finch blocks, gets an inside edge between his legs and they scamper through"
191,"Overton to Marsh, 1 run pitched up and clipped off the pads"
192,"Overton to Finch, 2 runs shortish, 81mph and Finch runs it away off his pads, fine leg has to run across and they get comfortably back this time"
193,"Overton to Finch, 1 run length in the channel, met on the front foot and blunted through the covers for one"
194,"Overton to Marsh, 1 run angled across, Marsh drops back and dabs into the ground behind backward point"
195,"Ali to Marsh, no run gives it a bit of air, drifting leg side and Marsh swings across the line... maybe just flicked the pad on its way through"
196,"Ali to Marsh, 1 run flat outside off, Marsh drops back to cut for a single"
197,"Ali to Finch, 1 run tossed up and tickled back down the ground to long-on"
198,"Ali to Marsh, 1 run flat, Marsh stays in the crease and punches though mid-on"
199,"Ali to Finch, no run pushed through outside off, not much turn and Finch dabs it to short third man"
200,"Ali to Finch, no run angled in flat and Finch defends back to the bowler"
201,"Overton to Marsh, 2 runs length on the pads, Marsh clips through midwicket and comes back for a second... a direct hit from the deep and he would have been struggling!"
202,"Overton to Marsh, 1 run short ball, Marsh pulls and gets a swirling top edge... but it lands well in front of fine leg and they trot through"
203,"Overton to Finch, FOUR runs here we go, Finch takes a bite out of Overton - clumps a lofted drive high over mid-off, there's no man back and it bounces away to the rope"
204,"Overton to Finch, no run back of a length, defended into the off side"
205,"Overton to Finch, 2 runs shortish and worked off the legs, two more there"
206,"Overton to Finch, 1 run pitched up, around off stump and Finch toe-ends a drive to mid-off, they hurry through for the single"
207,"Ali to Finch, no run fired down on off stump, blocked back to the bowler"
208,"Ali to Finch, 1 run little bit of turn this time and Finch works the ball through square for a single"
209,"Ali to Marsh, FOUR runs Marsh gets this away, the sweep has been his preferred outlet for aggression against spin and he sends this skimming through backward square leg for four"
210,"Ali to Marsh, 1 run tossed up and clipped down the ground"
211,"Ali to Finch, 1 run flat outside off, Finch drops back and dabs another single"
212,"Ali to Marsh, 1 run on the stumps, clipped down the ground for one more"
213,"Overton to Marsh, no run short of a length, Marsh hit on the pads playing back"
214,"Overton to Marsh, 1 run dug in, Marsh swivels on the pull for one through midwicket"
215,"Overton to Finch, FOUR runs crrrrrrrrrrrrrrunched! That's a bit more like it, Finch bullies this off a length, a forearm jab through mdiwicket for four"
216,"Overton to Finch, 1 run on the stumps, worked for one"
217,"Overton to Marsh, 1 run short of a length, Marsh continues to tick over with a leg glance"
218,"Overton to Finch, SIX runs dug in, but that's a powder-puff half-tracker and Finch wallops it handsomely over deep square leg for six! Finch into the 90s, they're kicking up a gear"
219,"Ali to Marsh, 1 run angled in and tucked for a single"
220,"Ali to Finch, no run flat on the stumps, defended to the on side"
221,"Ali to Finch, no run no width and Finch tucks it back to the bowler"
222,"Ali to Finch, 1 run on the stumps, Finch gets right back and works this French cricket style square of midwicket to bring up the Australia 200"
223,"Ali to Marsh, 1 run dragged short, Marsh is off balance cutting and only gets one to deep point"
224,"Ali to Finch, 1 run pushed through, Finch chops another single through backward point"
225,"Wood to Finch, 1 run length, 84mph and sliding into the pads, Finch clips to mid-on who is back a little and they take one"
226,"Wood to Marsh, 2 runs touch full, worked into the leg side, there's a couple more as the man hares in off the rope"
227,"Wood to Marsh, no run short of a length, 84mph and forced to mid-on off the back foot"
228,"Wood to Marsh, 1 run angled across, Marsh reaches for the cut and gets one through the covers"
229,"Wood to Finch, FOUR runs pitched up, goes for the yorker but it drifts leg side and Finch gets a tickle on the ball, sending it wide of Buttler for four"
230,"Wood to Finch, no run better line, Finch blocks on off"
231,"Ali to Marsh, SIX runs tossed up, Marsh goes down town... launched into the bleachers at long-on! Takes him to his half-century, a clean, crisp swing and fetched well back beyond the rope"
232,"Ali to Marsh, 1 run comes down and drills this for one"
233,"Ali to Finch, 2 runs pushed through, Finch goes back and dabs late for a couple"
234,"Ali to Finch, 1 run tossed up, Finch sits on it for a single into the covers... that's his hundred, sixth against England in ODIs. Off comes the helmet, taking in the applause. Time to unleash?"
235,"Ali to Marsh, no run pushed through and defended"
236,"Ali to Marsh, FOUR runs swatted away over midwicket! Moeen drops short and Marsh rocks back to heave it over the infield for four more"
237,"Wood to Finch, OUT oh, pinned him in front! Finch is plumb lbw playing across the line, Wood has the breakthrough out of nothing! It was all very placid out there, and now Finch has missed a straight one"
238,"Wood to Stoinis, 1 run outside off, a thick outside edge, through to third man"
239,"Wood to Marsh, no run solidly onto the front foot, and walloped to mid-off. There's been a lot of that today, technically correct drives straight to the fielder. Oodles of respect for the bowling"
240,"Wood to Marsh, 1 run flipped to the leg side"
241,"Wood to Stoinis, OUT bowled him! That is a beauty from Wood, shaping in, just a hint of reverse maybe, skidding through Stoinis's half-cocked defences. Had he got forward he might have had more chance ... of lbw"
242,"Wood to Agar, 1 run stabbed through third man to get off the mark"
243,"Ali to Agar, 1 run round the wicket, back of a length, chopped out to deep cover"
244,"Ali to Marsh, no run a high-elbowed drive, straight to cover"
245,"Ali to Marsh, 1 run width outside off, stabbed to point. Marsh is hobbling somewhat now, but no runners allowed"
246,"Ali to Agar, no run lines up the big drive, but merely nudged to cover"
247,"Ali to Agar, 1 run tucked off the pads to the leg side"
248,"Ali to Marsh, 1 run roll of the wrists, eased down to long-on"
249,"Wood to Marsh, no run round the wicket, punched from an upright stance to short midwicket"
250,"Wood to Marsh, no run outside off, dabbed to point for another single"
251,"Wood to Marsh, 1 run dabbed out to point"
252,"Wood to Agar, no run pushed to cover, looking for the single but sent back"
253,"Wood to Agar, 1 run guided into the covers once more"
254,"Wood to Marsh, 1 run hauled round the corner to the sweeper at deep midwicket"
255,"Rashid to Marsh, 1 wide googly, starts wide, spins wider"
256,"Rashid to Marsh, SIX runs absolutely battered! He picked that googly with no problems, a massive wipe across the line and deep into the stands at cow corner"
257,"Rashid to Marsh, FOUR runs shorter, wider, pushed out of the front of the hand, and just helped behind square"
258,"Rashid to Marsh, 2 runs fuller length, smeared along the deck to deep midwicket"
259,"Rashid to Marsh, FOUR runs hooned through the covers, this is a terrific turn of pace from the hobbling Marsh. Cracking it on the up to ruin Rashid's figures"
260,"Rashid to Marsh, 2 runs thumped out to the deep"
261,"Rashid to Marsh, SIX runs smashed high over the leg side, and up comes Shaun Marsh's second hundred of the series! Absolutely brilliant acceleration in the later stages of his innings, and it's a 91-ball hundred, which is useful in any context"
