,Data
188,"Raza Hasan to White, 2 runs flighted on middle stump, paddled for a couple"
189,"Raza Hasan to White, OUT a run-out, a direct hit from Umar Akmal, Australia lose one more, pushed that towards backward point and White wanted one, took a few paces down the track, there was no run in that as White belatedly realises, he looks to hasten back, by then Umar Akmal has fired in a throw that catches White short, two wickets in two overs for Pakistan, the crowd is loving it, Pakistan's fielding"
190,"Raza Hasan to Bailey, no run spins away sharply, and the birthday boy can't get bat on it"
191,"Raza Hasan to Bailey, 1 run could have been another wicket there, Bailey went for the sweep, which seems to be Australia's tactic against spin, that was a top edge which looped in the air but didn't go all the way to deep backward square leg"
192,"Raza Hasan to Hussey, 1 run punched towards long-on for a single"
193,"Raza Hasan to Bailey, no run way outside off stump, it was flat and quick, Bailey looked to cut that but missed"
194,"Hafeez to Hussey, 1 run Hafeez from round the wicket, reverse-swept fine by Hussey"
195,"Hafeez to Bailey, 1 run on the pads, worked to backward square leg for a quick single"
196,"Hafeez to Hussey, 1 run length ball sliding on, worked towards midwicket for one more"
197,"Hafeez to Bailey, 1 run on the pads, spinning in, helped along to deep square leg"
198,"Hafeez to Hussey, no run defended back towards the bowler"
199,"Hafeez to Hussey, 1 run clipped off the back foot towards midwicket for one more"
200,"Raza Hasan to Hussey, 1 run worked off the back foot towards wide mid-on"
201,"Raza Hasan to Bailey, 2 runs full and wide, muscled towards wide long-on, deep midwicket does the fielding"
202,"Raza Hasan to Bailey, no run looks for the cut, that's the third time in his short innings that Bailey has missed the stroke"
203,"Raza Hasan to Bailey, SIX runs this time Bailey gets hold of it, a length ball is deposited over long-on for a big six, powerfully struck"
204,"Raza Hasan to Bailey, no run spinning away after pitching on a length outside off, again Bailey misses the cut"
205,"Raza Hasan to Bailey, FOUR runs goes for the reverse-sweep this time and connects well, that goes through short third man's legs, it is Ajmal who made the mistake, first mistake of the day"
206,"Ajmal to Hussey, 1 run worked to sweeper cover for a single"
207,"Ajmal to Bailey, 1 run too short from Ajmal, swept to deep backward square leg"
208,"Ajmal to Hussey, no run spinning away from a length, pushed towards cover, good stop from Hafeez at short cover"
209,"Ajmal to Hussey, 1 run quicker one from Ajmal, bounces extra, tapped towards square leg by Hussey"
210,"Ajmal to Bailey, 1 run turns in sharply, a touch short from Ajmal, lot of bounce there, Bailey nudges that towards square leg"
211,"Ajmal to Hussey, 1 run Hussey waits on the back foot and pushes the ball to sweeper cover, an over from Ajmal without a wicket, believe it"
212,"Umar Gul to Bailey, 1 run shortish once more, looks to pull that powerfully, mistimes it towards mid-on"
213,"Umar Gul to Hussey, 1 run a full ball slanting into the pads, David Hussey is a terrific T20 player, he gets going with a whip behind square leg"
214,"Umar Gul to Bailey, FOUR runs short ball outside off, powerfully pulled by Bailey, an authoritative hit from him"
215,"Umar Gul to Bailey, no run short of length and outside off, guided towards short third man"
216,"Umar Gul to Bailey, 1 run short of length ball, pushed towards cover for a single, Bailey retains strike"
217,"Tanvir to Bailey, 1 run Tanvir starts with a short of length ball from round the wicket, towards point for a single"
218,"Tanvir to Wade, 1 run Tanvir over the wicket, full and wide, pushed towards cover for a single"
219,"Tanvir to Bailey, 1 run Bailey looking good here, slams that towards deep square leg for a single"
220,"Tanvir to Wade, 1 run full ball heading for off stump, punched back past the bowler, will they come back for the second, no they don't have the time"
221,"Tanvir to Bailey, 1 leg bye worked behind square leg for a single"
222,"Ajmal to Bailey, 1 run slams the first towards long-on, just a single"
223,"Ajmal to Wade, 1 run sliding on towards off stump, slapped towards backward point for a single"
224,"Ajmal to Bailey, 1 run goes for the reverse-sweep, gets it towards point to get a single"
225,"Ajmal to Wade, 1 run quicker from Ajmal, on middle and off, poked behind point for a single"
226,"Ajmal to Bailey, no run beaten outside off, that one bounces more than Bailey expects and doesn't turn in either"
227,"Ajmal to Bailey, SIX runs Bailey finishes off Ajmal's spell with a muscular hit for six, superb hit that from the Australian captain, and a much-needed one too, that was too short from Ajmal, a doosra which Bailey read"
228,"Umar Gul to Wade, 1 run starts with a yorker, driven towards long-off for a single"
229,"Umar Gul to Bailey, FOUR runs Gul looking to hit the base of off stump, an inside-edge, a thick one sends it past short fine leg for four, 16 off 10 needed now, Bailey playing a gem here"
230,"Umar Gul to Bailey, FOUR runs poor from Gul, that was a knee-high full toss from Gul, Bailey sends that past short fine leg for four more, Australia surely ahead now"
231,"Umar Gul to Bailey, 1 run ooh, another time when the batsman could have been dismissed twice, a shortish ball is hammered back by Bailey, Gul stretches out his right hand but can't hang on to that one, then there's even more disappointment for him as he sees the ball just loop over the stumps at the non-striker's end"
232,"Umar Gul to Christian, no run length ball outside off, Christian is beaten, there is an appeal for a caught-behind"
233,"Abdul Razzaq to Bailey, OUT Razzaq strikes first ball, the birthday boy can't finish it, a slower short ball outside off, Bailey goes for the pull, a top edge and that sails towards midwicket, the substitute Arafat is everywhere, he takes the catch, Australia's bowlers will have to do the job with the bat now, you wouldn't believe the noise levels in Dubai"
234,"Abdul Razzaq to Christian, 1 run a full toss is whipped towards midwivcket for a single"
235,"Abdul Razzaq to Cummins, 1 run a slower full ball on middle and leg, once again it is Arafat who fields after Cummins sweeps to deep square leg"
236,"Abdul Razzaq to Christian, 1 run short ball heading for the helmet, Christian can only get a single as he pulls it towards midwicket, that put plenty on pressure on young Cummins, who was nerveless on Test debut with the bat"
237,"Abdul Razzaq to Cummins, SIX runs oh my! he is nerveless with the bat here as well, a massive hit , a short of length ball heading down leg stump, that is a monster hit from Cukmmins that sends it over the wide long-on boundary, the scores are level, Australia coach Mickey Arthur loves that shot"
238,"Abdul Razzaq to Cummins, OUT it's a Superover, it wasn't the best final ball form Razzaq but it was good enough, a full toss on the pads, Cummins was looking to work that to the leg side, a leading edge that ballons towards mid-off, Imran Nazir and Umar Akmal both went for it, Nazir called for it, Umar backed away, Nazir takes it, Cummins wrings his hands in disappointment, this has been some game"
239,"Warner, Watson and Bailey are Australia's chosen batsmen. The Pakistan team has a long discussion over who will bowl. It will be Umar Gul. Ajmal was off the field for the final two overs or so, which I think means he can't bowl now, which explains the long discussion over who to choose."
240,Australia will bat first in the Superover.
241,Match tied (Pakistan won the one-over eliminator)
242,"Player of the match is Saeed Ajmal, PAK"
