,Data
230,"Hilfenhaus to Taylor, 1 run overpitches on the leg stump.Taylor, turns it away to fine-leg for a single"
231,"Bracken to Taylor, 1 wide and begins with a wide delivery outside the off stump. He laughs it off but bet Ponting wont see the funnier side in it"
232,"Bracken to Taylor, 1 run slower delivery outside the off stump, Taylor pushes it to long-off for a single"
233,"Bracken to Broom, 1 run outside the off stump and a touch faster as Broom is beaten by the pace as he bottom edges a defensive push and runs across but not before Ponting comes running in and throws the stumps down at the bowler's end"
234,"Bracken to Taylor, 1 run"
235,"Bracken to Broom, no run outside the off stump, Broom looks to run it down to third man but gets an outside edge. Haddin, dives across and takes the ball brilliantly and top it off he does a backhand flick too"
236,"Bracken to Broom, no run pushes it to point"
237,"Bracken to Broom, 1 run short outside the off stump.Broom cuts it to deep point for a single"
238,"Hilfenhaus to Broom, no run short outside the off stump. Broom, stands tall and looks to pull it away - his first attacking stroke- and is beaten"
239,"Hilfenhaus to Broom, 1 run good length delivery on the middle stump. Broom pushes it on the leg side and runs across for a single"
240,"Hilfenhaus to Taylor, no run fuller on the middle stump. Taylor, comes forward and gets his bat down in time to defend the ball back onto the pitch"
241,"Hilfenhaus to Taylor, no run fuller on the off stump, Taylor, drives it back to the bowler"
242,"Hilfenhaus to Taylor, SIX runs short on the middle stump. Taylor, spots it early and lets go of the pull shot and clears the deep square leg fielder easily as he sends the ball five rows into the crowd"
243,"Hilfenhaus to Taylor, no run fuller on the middle stump. Taylor, pushes it back to the bowler"
244,"Bracken to Broom, 1 run outside the off stump, Broom pushes it to cover and runs across for a quick single"
245,"Bracken to Taylor, 1 run good length delivery outside the off stump. Taylor, drives but does not time it as he runs across for a single"
246,"Bracken to Broom, no run on the middle stump, Broom pushes it to midwicket"
247,"Bracken to Broom, no run outside the off stump. Broom looks to play it with soft hands but is unable to as the ball goes to cover"
248,"Bracken to Broom, 1 run outside the off stump and on a good length. Broom drives it to long-off for a single"
249,"Bracken to Taylor, 2 runs good length delivery outside the off stump. Taylor walks across and drives it to the right of sweeper cover for a couple"
250,"Hilfenhaus to Broom, no run on the middle stump. Broom moves across and pushes it to midwicket"
251,"Hilfenhaus to Broom, no run outside the off stump and left alone"
252,"Hilfenhaus to Broom, 1 wide short and wide down the leg side and rightly called so"
253,"Hilfenhaus to Broom, FOUR runs fuller on the middle stump. Broom, brings the bat down to jam the ball down as he gets a thick inside edge to the fine-leg boundary"
254,"Hilfenhaus to Broom, OUT it's all over for Broom. Hilfenhaus, pitches it short and Broom, spontaneously goes for the pull and ends up top edging it to Hopes, stationed at cover. Just when it looked like a partnership was coming on, a wicket falls"
255,"Hilfenhaus to Mills, no run and has to face the chin music first up"
256,"Hilfenhaus to Mills, no run fuller length delivery on the middle stump. Mills defends it off the backfoot"
257,"Johnson to Taylor, 1 run on the leg stump. Taylor turns it away to fine-leg for a single"
258,"Johnson to Mills, no run outside the off stump and coming in. Mills defends it of the backfoot"
259,"Johnson to Mills, 1 run outside the off stump. Mills runs it down to third man for a single"
260,"Johnson to Taylor, 1 run ! Taylor looks to work it away on the leg side but is early into the shot as he gets a leading edge to a diving Ponting, who gets his left hand to the ball but can't take the catch. Taylor gets a single and moves on to his half-century"
261,"Johnson to Mills, no run outside the off stump, Mills defends it back onto the pitch"
262,"Johnson to Mills, no run a repeat of the defensive stroke from the last ball"
263,"Hilfenhaus to Taylor, FOUR runs short outside the off stump. Hilfenhaus, sledge-hammers it to sweeper cover for a boundary"
264,"Hilfenhaus to Taylor, 1 run on the leg stump. Taylor works it away on the leg side for a single"
265,"Hilfenhaus to Mills, no run outside the off stump, Mills, comes forward and defends it"
266,"Hilfenhaus to Mills, no run short outside the off stump. Mills looks to cut it away but draws his bat back in and lets it pass"
267,"Hilfenhaus to Mills, no run short on the middle stump. Mills, this time ducks under it"
268,"Hilfenhaus to Mills, 1 run fuller outside the off stump, Mills, pushes it to mid-off and sets off for a quick single"
269,"Bracken to Taylor, 2 runs fuller outside the off stump. Taylor, comes down the track and chips it to the left of the fielder at long-off for a couple"
270,"Bracken to Taylor, no run outside the off stump and cutting away. Taylor, is looking to go for the slog-sweep but the ball cutting away beats the purpose"
271,"Bracken to Taylor, 2 runs fuller outside the off stump, Taylor leans across and flat-bats it to midwicket for a couple"
272,"Bracken to Taylor, FOUR runs full-toss outside the off stump. Taylor, moves across and slogs it to cow corner for a boundary"
273,"Bracken to Taylor, 5 wide wide, far too wide outside the off stump. And what adds to Bracken's misery is the fine-leg fielder being inside the circle . He ends up conceding five wides"
274,"Bracken to Taylor, 1 run on the leg stump. Bracken turns it away to fine-leg for a single"
275,"Bracken to Mills, 1 run on the leg stump, Mills pushes it to midwicket for a single"
276,"Johnson to Mills, no run good length delivery outside the off stump. Mills is looking to go downtown but is beaten by the away movement"
277,"Johnson to Mills, no run on the leg stump. Mills is moving away once again and Johnson follows him as Mills pushes it back to the bowler"
278,"Johnson to Mills, SIX runs up, up and away! Mills backs away to the short delivery and it had six written all over it from the moment it left the bat. The ball is sent onto the roof-top at fine-leg"
279,"Johnson to Mills, 1 leg bye on the leg stump, Mills looks to work it away but is struck on the pads. Nevertheless, he runs across for a leg-bye"
280,"Johnson to Taylor, OUT gone! Full-toss on the off stump. Taylor, moves across and looks to get cheeky as he wants to paddle it to fine-leg but the ball comes in faster than he expects. Taylor, manages to get a top edge which flies high. Haddin is calling for it right from the moment it"
281,"Johnson to Mills, 1 run slower delivery outside the off stump. Mills pushes it to mid-off for a quick single"
282,"Johnson to Mills, 2 runs and Mills enjoys the freedom as he cuts it away to third man for a couple"
283,"Johnson to Mills, no run short on the middle stump. Mills, hops around and defends it back onto the pitch"
284,"Johnson to Mills, no run good length delivery outside the off stump. Mills, looks to heave it away to long-on but is quick into the shot as he is beaten"
285,"Johnson to Mills, 1 run fuller outside the off stump. Only good fielding by Clarke at mid-off denies Mills a boundary as he has to be happy with a single for now"
286,"Johnson to Taylor, 1 run fuller outside the off stump. Taylor, lets go off the drive and sees David Hussey, bring off a full-length dive to stop a boundary"
287,"Johnson to Mills, 2 runs short delivery on the middle stump and forces Mills into the pull stroke. The top-edged pull just falls short of a diving Hilfenhaus and they run across for a couple"
288,"Hilfenhaus to Taylor, 1 wide wide outside the off stump to begin the over"
289,"Hilfenhaus to Taylor, no run fuller outside the off stump. Taylor drives it extra-cover, who is standing on the edge of the circle"
290,"Hilfenhaus to Taylor, FOUR runs this time Taylor splits the gap between cover and extra-cover as he helps himself for a boundary"
291,"Hilfenhaus to Taylor, FOUR runs now he goes inside-out and lofts it over the infield for another boundary"
292,"Hilfenhaus to Taylor, 3 runs fuller on the leg stump. Taylor, beats the short fine-leg fielder- Bracken - and gets three runs for his efforts"
293,"Hilfenhaus to Mills, FOUR runs short on the middle stump. Mills moves away and lets go with a cut shot. A boundary is the result"
294,"Hilfenhaus to Mills, no run Mills looks to repeat the dose but moves away a little bit more this time. Hilfenhaus follows him and beats the attempted cut shot"
295,"Bracken to Mills, 2 runs fuller on the off stump. Mills moves away and drives it to long-off for a couple"
296,"Bracken to Mills, 1 run on the leg stump, Mills pushes it to midwicket for a single"
297,"Bracken to Vettori, 1 run short on the leg stump. Vettori, the new batsman pulls it to square leg for a single"
298,"Bracken to Mills, 1 run fuller on the middle stump. Mills, chips it to deep midwicket for a single"
299,"Bracken to Vettori, 3 runs full-toss angled onto the pads. Vettori, guides it to deep square leg for three runs"
300,"Bracken to Mills, OUT timber! Mills is backing away even before the ball is bowled. Bracken notices it and bowls a yorker on the middle stump. Mills has a swing and there is only place where the ball can go- stumps- if he misses and it does go there"
301,"Hopes to Vettori, 1 run drifts onto the pads as Vettori pushes it to midwicket for a single"
302,"Hopes to Southee, 1 run full-toss on the middle stump. Southee, moves across and slogs it to deep midwicket for a single"
303,"Hopes to Vettori, 1 run outside the off stump, Vettori guides it to third man for a single"
304,"Hopes to Southee, 2 runs yorker on the off stump. Southee jams it to long-on and runs across for a quick couple"
305,"Hopes to Southee, 2 runs yorker on the middle stump, Southee pushes it to deep square leg for a couple"
306,"Hopes to Southee, 2 runs fuller on the leg stump. Southee, comes down the track and plays it to deep midwicket and takes the couple"
307,It will all depend on the start that the Australian top-order can get. Join us in about thirty-five minutes for the start of the Australian innings
308,"New Zealand end up with a competitive score of 244. Australia, looked like restricting them to a total much lesser than that, especially when Clarke was bowling but Taylor's batting in the final 10 overs ensured that the effect was neutralized."
309,Welcome back to the Australian chase. We will have the successful opening pair of Sydney back today. It will be Mills to start off
310,"Mills to Haddin, 1 run Mills bowls a fuller delivery and Haddin looks to work it away on the leg side. Haddin gets a leading edge and gets the scorecard moving"
311,"Mills to Clarke, 2 runs outside the off stump, Clarke, gets to the pitch of the delivery and drives it to sweeper cover for a couple"
312,"Mills to Clarke, 1 run fuller on the middle stump, Clarke, works it away to deep square leg for a single"
313,"Mills to Haddin, 1 run bowls on the pads once again as Haddin works it away to deep square leg for a single"
314,"Mills to Clarke, no run good length delivery outside the off stump. Clarke, gets his foot to the pitch of the delivery and lets it pass to the keeper"
315,"Mills to Clarke, no run outside the off stump. Clarke, once again gets to the pitch of the delivery and shoulders arms"
316,"Southee to Haddin, no run outside the off stump and Haddin is not interested"
317,"Southee to Haddin, no run good length delivery outside the off stump. Haddin, moves across and pushes the delivery to cover"
318,"Southee to Haddin, 1 wide wide down the leg side"
319,"Southee to Haddin, no run good length delivery outside the off stump, devoid of any movement. Haddin gets behind the line of the delivery and lets it pass to the keeper"
320,"Southee to Haddin, FOUR runs thats the Haddin we got to know from Sydney as he moves away a touch and smashes a short length delivery in the gap between cover and point for a boundary"
321,"Southee to Haddin, no run outside the off stump. Haddin, gets solidly behind the line of the delivery and defends it"
322,"Southee to Haddin, no run fuller on the off stump. Haddin, does not connect with the intended drive as it just falls short of Elliot at mid-on"
323,"Mills to Clarke, no run good length delivery on the off stump. Clarke, leans across and pushes it to mid-on"
324,"Mills to Clarke, no run short outside the off stump. Clarke, stands tall and pushes it to cover"
325,"Mills to Clarke, no run short outside the off stump. Clarke, is looking to play it with soft hands but gets an inside edge back onto the pitch"
326,"Mills to Clarke, no run good length delivery outside the off stump, Clarke drives it to mid-off"
327,"Mills to Clarke, no run fuller length delivery outside the off stump. Clarke, drives but good fielding by Fulton at short cover prevents not only a boundary but a run too"
328,"Mills to Clarke, 1 run full delivery on the off stump, Clarke, drives it to the right of mid-off fielder for a single"
329,"Southee to Clarke, 3 runs sheer timing there as Southee, bowls a full delivery outside the off stump. Clarke drives it past Southee, who does well to get some hand onto it and prevents an extra run"
330,"Southee to Haddin, no run good length delivery outside the off stump. Haddin, gets behind the line of the delivery and defends"
331,"Southee to Haddin, no run outside the off stump and short in length. Haddin looks to cut it away and gets a bottom edge back to the keeper"
332,"Southee to Haddin, FOUR runs rank bad ball as Haddin gets behind the short delivery easily and pulls it away to deep square-leg for a boundary"
333,"Southee to Haddin, no run good length delivery outside the off stump. Haddin, comes forward and pushes it to cover"
334,"Southee to Haddin, FOUR runs bad bowling again by Southee as he pitches it short and Haddin, is happy to pull it away to deep square leg for another boundary"
335,"Mills to Clarke, FOUR runs fuller on the off stump. Clarke, does amazingly well to move his frontfoot across and chips it over the infield on the leg-side for a boundary. Top shot that"
336,"Mills to Clarke, no run short outside the off stump. Clarke, drives it to cover off the backfoot"
337,"Mills to Clarke, no run short outside the off stump, Clarke, is putting the cover fielder under severe test as he cuts it to him and the fielder does pass the test"
338,"Mills to Clarke, 1 run off the inside edge onto the pads as they run across for a single"
339,"Mills to Haddin, no run outside the off stump and short in length. Haddin, gets behind the line of the delivery and defends it"
340,"Mills to Haddin, no run outside the off stump. Haddin, comes forward and drives it to mid-off"
341,"O'Brien to Clarke, 2 runs and immediately has a sniff at wicket as he manages to entice Clarke into playing a drive which just manages to beat the outstretched fingers of Elliot at mid-on"
342,"O'Brien to Clarke, no run defends on the frontfoot"
343,"O'Brien to Clarke, no run outside the off stump, defends on the backfoot"
344,"O'Brien to Ponting, no run outside the off stump, Ponting, comes forward and pushes it back to the bowler"
345,"O'Brien to Ponting, no run on the pads. Ponting, looks to work it away and is rapped on the pads"
346,"Mills to Haddin, no run outside the off stump and on a good length. Haddin, gets behind the line of the delivery and defends it"
347,"Mills to Haddin, no run fuller in length outside the off stump. Haddin, comes forward and drives it to mid-off"
348,"Mills to Haddin, no run good length delivery on the middle stump. Haddin, pushes it to the leg-side off the backfoot"
349,"Mills to Haddin, no run good length delivery outside the off stump. Haddin treats it with utmost respect as he defends on the frontfoot"
350,"Mills to Haddin, no run outside the off stump, Haddin, gets behind the line of the delivery and defends it"
351,"Mills to Haddin, no run outside the off stump, Haddin, pushes it to point"
352,"O'Brien to Ponting, no run"
353,"O'Brien to Ponting, no run bowls it full and straight on the off stump, he"
354,"O'Brien to Ponting, 1 run just opens the face of the bat and steers this one wide of gully"
355,"O'Brien to Haddin, no run just holds the length back a bit, he gets across on the backfoot and defends"
356,"O'Brien to Haddin, no run sticks to the same line and length and he defends solidly on the backfoot again"
357,"O'Brien to Haddin, 1 run this time he defends with an angled bat and steers it down the vacant backward point region"
358,"Mills to Haddin, no run good length delivery on the middle and off stump line, Haddin makes room and looks to go inside-out through extra cover but the shot is not timed well enough and the ball rolls down to mid-on"
359,"Mills to Haddin, no run punched away on the off side"
360,"Mills to Haddin, 1 run quicker delivery, Haddin goes hard at it and the ball races away to third man, more edge than middle"
361,"Mills to Ponting, no run that's plumb but not given. Good length delivery, pitched outside the off stump and this one jagged back in. Ponting pushes forward to drive and is beaten by the angle. Looked out but umpire Davis was not impressed."
362,"Mills to Ponting, no run wide outside the off stump and Ponting is beaten on the drive"
363,"Mills to Ponting, no run this one came back in but is wide outside the off stump"
364,"O'Brien to Haddin, no run line and length delivery outside the off stump, worked away towards cover"
365,"O'Brien to Haddin, FOUR runs take that! short and wide outside the off stump, Haddin quickly gets into position and slams it past the fielder at point"
366,"O'Brien to Haddin, FOUR runs four more. This one is pitched up and O'Brien finds out why that is not the length to bowl. Haddin gets right behind the line and hammers it straight back down the ground long-on fence"
367,"O'Brien to Haddin, no run follows it up with a good yorker and Haddin defends it watchfully"
368,"O'Brien to Haddin, no run pushed away on the off side, no room for a single there"
369,"O'Brien to Haddin, no run good length delivery and this one kept bit low. Haddin reads it well and taps it away on the off side"
370,"Mills to Ponting, no run short and wide outside the off stump, cut straight to the fielder at point. Missed out there on an easy boundary"
371,"Mills to Ponting, no run good length delivery on the middle and off stump line, this one kept going straight after hitting the deck and Ponting has no problems defending it down the track"
372,"Mills to Ponting, 1 wide wayward delivery down the leg side"
373,"Mills to Ponting, no run short of a good length delivery outside the off stump, Ponting stands tall on the back-foot and punches it hard toward cover and a full length diving stop there from Broom cuts for a certain boundary"
374,"Mills to Ponting, no run forced away off the back-foot to covers"
375,"Mills to Ponting, 1 run pushed towards extra cover and Ponting takes on Guptill there, direct hit at the bowler's end would have been interesting"
376,"Mills to Haddin, no run good length and rising, Haddin stands tall and defends it down"
377,"O'Brien to Ponting, no run line and length delivery, Ponting walks across as usual and defends it back to the bowler"
378,"O'Brien to Ponting, 1 run driven through the gap between point and cover. width was on offer and Ponting nicely opened the face to get the placement right"
379,"O'Brien to Haddin, 1 run good length delivery, pitched outside the off stump and cutting in. Haddin punches it off the back-foot to mid-off and they scamper through for a well judged single."
380,"O'Brien to Ponting, no run worked away with no real intention"
381,"O'Brien to Ponting, FOUR runs good length delivery, Ponting steps forward and across and creams it through the gap between the cover fielders"
382,"O'Brien to Ponting, no run pushed back to the bowler"
383,"Mills to Haddin, no run outside the off stump, comes forward and defends it to the off side"
384,"Mills to Haddin, no run good length delivery outside the off stump. Haddin, comes forward and defends it back onto the pitch"
385,"Mills to Haddin, 1 run outside the off stump, Haddin, pushes it to mid-on for a single"
386,"Mills to Ponting, 1 run on the leg stump, Ponting, pushes it to fine leg for a single"
387,"Mills to Haddin, no run outside the off stump. Haddin, gets onto the frontfoot and defends it to cover"
388,"O'Brien to Ponting, FOUR runs fuller delivery outside the off stump and how much more lucky can Ponting get? He drives and finds that the outside edge flies past the place, exactly where the first slip would have been and to top it all off he gets a boundary"
389,"O'Brien to Ponting, no run comes forward and defends"
390,"O'Brien to Ponting, 1 run"
391,"O'Brien to Haddin, no run comes down the track and pushes it to point"
392,"O'Brien to Haddin, no run good length delivery outside the off stump. Haddin, pushes it to point off the backfoot"
393,"O'Brien to Haddin, no run fuller length delivery outside the off stump. Haddin, comes forward and drives it to mid-off"
394,"Southee to Ponting, no run outside the off stump, comes forward and defends"
395,"Southee to Ponting, no run width outside the off stump, Ponting, drives it straight to the point fielder"
396,"Southee to Ponting, 2 runs good length outside the off stump. Ponting cuts it to third man and ambles across for a couple"
397,"Southee to Ponting, no run full outside the off stump, Ponting, drives it to mid-off"
398,"Southee to Ponting, OUT and for the umpteenth time this summer we see Ponting top-edging a pull shot. Only difference this time being he does it to the cover fielder as Guptill takes it comfortably. Ever heard of a strength turning into a weakness"
399,"Southee to Hussey, no run outside the off stump. Hussey, comes forward and pushes it to mid-on"
400,"O'Brien to Haddin, no run outside the off stump and coming in. Haddin, gets behind the line of the delivery and defends it. The dismissal of Ponting will certainly stifle him"
401,"O'Brien to Haddin, no run outside the off stump. Haddin, stands tall and cuts it to point"
402,"O'Brien to Haddin, 1 run outside the off stump, Haddin, runs it down to third man for a single"
403,"O'Brien to Hussey, no run outside the off stump and left all alone"
404,"O'Brien to Hussey, FOUR runs take that! Hussey pulls the short ball with some power to the deep midwicket fence and gets a boundary for his efforts"
405,"O'Brien to Hussey, no run outside the off stump, Hussey, drives it to mid-off"
406,"Southee to Haddin, no run outside the off stump, Haddin, lets it go to the keeper"
407,"Southee to Haddin, 2 runs outside the off stump and short in length. A terrible misfield by Broom allows Haddin to take an extra run"
408,"Southee to Haddin, (no ball) 1 run oversteps and bowls one on the leg stump. Haddin, pushes it to leg side for a single"
409,"Southee to Hussey, 2 runs fuller outside the off stump, Hussey, drives it straight down the ground for a couple"
410,"Southee to Hussey, 2 runs outside the off stump, Hussey looks to cut it away and it misses the stumps by a whisker as he gets an inside edge"
411,"Southee to Hussey, no run"
412,"Southee to Hussey, no run short outside the off stump. Hussey, looks to cut it away and is beaten"
413,"Vettori to Haddin, no run top ball! beats Haddin with the drift and we should enjoy the contest from now on"
414,"Vettori to Haddin, no run outside the off stump, Haddin, comes forward and pushes it to the off side"
415,"Vettori to Haddin, 2 runs short outside the off stump, Haddin, cuts it off the keepers gloves to third man for a couple"
416,"Vettori to Haddin, SIX runs fuller on the off stump. Haddin, slog sweeps it and the ball lands bang on the boundary rope. Vettori needs to settle down into restrictive line now"
417,"Vettori to Haddin, no run outside off, Haddin, comes forward and defends it"
418,"Vettori to Haddin, 1 run fuller outside the off stump, Haddin, comes forward and plays it with soft hands to cover for a single"
419,"Southee to Haddin, 1 run short outside the off stump. Haddin, cuts it to third man for a single"
420,"Southee to Hussey, no run outside the off stump and left alone"
421,"Southee to Hussey, 2 runs short outside the off stump, Hussey gets onto the backfoot and pulls it to deep midwicket for a couple"
422,"Southee to Hussey, 2 runs short and wide outside the off stump. Hussey, cuts it past a diving point fielder to sweeper cover for a couple"
423,"Southee to Hussey, no run fuller and slower outside the off stump. Hussey, comes forward and pushes it to mid-off"
424,"Southee to Hussey, 1 run on the leg stump, Hussey, turns it to deep midwicket for a single"
425,"Vettori to Hussey, no run fuller on the middle stump, Hussey, drives it back to the bowler"
426,"Vettori to Hussey, no run outside the off stump, Hussey, comes forward and defends"
427,"Vettori to Hussey, no run outside the off stump, Hussey, comes forward and inside-edges an intended drive back onto the pitch"
428,"Vettori to Hussey, no run outside the off stump, Hussey comes forward and pushes it to cover"
429,"Vettori to Hussey, 1 run fuller on the off stump, Hussey, takes the frontfoot out of the way and drives it to mid-off for a single"
430,"Vettori to Haddin, no run on the pads, Haddin, looks to play it away on the leg side but gets rapped on the pads"
431,"Southee to Hussey, no run outside the off stump, Hussey, slices it to mid-off and refuses a call for a single"
432,"Southee to Hussey, FOUR runs short outside the off stump. Hussey, makes room for himself and cuts it past the diving point fielder for a boundary. Poor line from Southee once again"
433,"Southee to Hussey, no run fuller outside the off stump, Hussey, drives it back to the bowler"
