,Data
448,"Yadav to Maxwell, no run hit firmly to Shikhar at mid-off"
449,"Yadav to Maxwell, no run closer to the stumps this time, length ball, played back down the pitch with soft hands"
450,"Yadav to Maxwell, 1 run appeal for lbw, Maxi is struck on the pad as he looks to run it down to third man, was perhaps struck outside the line"
451,"Yadav to Marsh, no run length ball on off, pushed to cover"
452,"Yadav to Marsh, no run appeal for lbw as the ball tails back in to hit him on leg. Mitch Marsh was rushed into that attempted flick, umpire reckons it was sliding down. Good call"
453,"Yadav to Marsh, 2 runs shows the full face of the bat and plays it down to Ishant, who makes a mess of that at mid-on, what was meant to be a dot ball is two instead. He took his eyes off the ball. Very, very poor. Kohli is livid and he has every right to be."
454,"Barinder Sran to Maxwell, 2 runs, OUT steps out and crunches that wide of mid-off, Umesh gives it chase, turns around and fires a throw towards Dhoni's end. Mitch Marsh was strolling back casually as the stumps are broken down by the Indian captain, who didn't give any hint of rushing in to take the throw at all. Within the bat of an eye lid, the next thing Mitch Marsh kn"
455,"Barinder Sran to Wade, 1 run angled down leg, turned it down to square leg, easy ball to get off the mark"
456,"Barinder Sran to Maxwell, 1 run pulled towards Gurkeerat at deep midwicket"
457,"Barinder Sran to Wade, no run tails back in slightly from off stump, carefully defended to the on side"
458,"Barinder Sran to Wade, no run nips back in from the length area on off, defended to the off side"
459,"Barinder Sran to Wade, no run tapped towards point with soft hands"
460,"Sharma to Maxwell, 1 run pushes him onto the back foot by digging one short on off, dropped towards cover with soft hands for a quick single"
461,"Sharma to Wade, 1 run wrong line, pulled away but straight to deep midwicket"
462,"Sharma to Maxwell, 1 run good line once again, in and around off, pats it towards Jadeja at point and scoots across for a single, brilliant effort to fire a direct hit at the non-striker's end"
463,"Sharma to Wade, 1 run too full this time, driven nicely towards deep cover"
464,"Sharma to Maxwell, no run angles it ahead of good length on off from wide of the crease, defended to midwicket, he was overbalanced as he made contact"
465,"Sharma to Maxwell, no run accurate stuff, lands it on off, played back down the pitch"
466,"Barinder Sran to Wade, 1 run angles a length ball on middle and leg, thuds into the thigh pad as he looks to work it past square leg"
467,"Barinder Sran to Maxwell, no run looks to step out and slap that over the off side, cramped for room, beaten"
468,"Barinder Sran to Maxwell, 1 run gets a thick edge down to Ishant at third man, big cheer from the crowd as he fields it. Ishant waves back to the crowd"
469,"Barinder Sran to Wade, 1 run nearly chopped back onto the stumps, Dhoni runs in and then uses his football skills to kick it onto the stumps at the striker's end, misses but Maxwell may have been in"
470,"Barinder Sran to Maxwell, 1 run pulled but straight to Gurkeerat at deep midwicket"
471,"Barinder Sran to Wade, 1 run mistimes the pull to Rohit at mid-on"
472,"Sharma to Wade, OUT short ball angling away, Wade looks to fetch the pull from outside off, only manages to top edge the pull, Dhawan comes running in from mid-on, settles underneath it and completes a simple catch. Wade didn't look comfortable at all. Was overbalanced too, and the pressure has consumed him when all he had to do was bunt one and give strike to Maxwell. Th"
473,"Sharma to Maxwell, 1 run angles one down to third man, excellent work by Rishi Dhawan to keep it down to a single"
474,"Sharma to Faulkner, no run nice and full around off, shows the full face and plays it with soft hands"
475,"Sharma to Faulkner, 1 run nearly chopped it back onto the stumps. Dhoni does superbly to move to his left, dive and keep that down to a single. On another night, he would have been walking back to the pavillion"
476,"Sharma to Maxwell, no run gets an inside edge as he prods outside the line, the point fielder Jadeja comes running in quickly to cut that off"
477,"Sharma to Maxwell, 1 run tucked away towards midwicket"
478,"Barinder Sran to Maxwell, FOUR runs short ball on off, he clears the front leg and slaps that over cover, couple of bounces into the boundary. Sitting up nicely because there was no pace on it. He will feast on those all day"
479,"Barinder Sran to Maxwell, 2 runs slower one on middle and leg, nurdled into the gap at midwicket, excellent running there, just got it in between the two fielders there"
480,"Barinder Sran to Maxwell, no run appeal for caught behind. Maxwell backed away to go over point, the swing seemed to have missed the outside edge, or did it? Faint deviation on snicko"
481,"Barinder Sran to Maxwell, 1 wide slower delivery down leg, Maxwell avoids it at the last moment, right call in the end"
482,"Barinder Sran to Maxwell, SIX runs how much power does he generate! Backs away once again, the short ball was coming in, but backed himself to slap that over the infield and managed to get it all the way over the boundary. So what if the square boundaries are huge? He can still muscle them"
483,"Barinder Sran to Maxwell, no run Jadeja has single-handedly saved two runs at least, clubs the pull, he throws himself to his left to stop that and then recover quickly to fire a rocket throw"
484,"Barinder Sran to Maxwell, no run slower one on middle, plyed back down the pitch"
485,"Yadav to Faulkner, no run length ball on off, bunted to cover"
486,"Yadav to Faulkner, 1 run turned away off his pad towards square leg"
487,"Yadav to Maxwell, no run punched to Rohit at point"
488,"Yadav to Maxwell, no run fetches the whip from outside off, straight to Ishant at square leg"
489,"Yadav to Maxwell, no run length ball on off, hustled for pace, he hops back and taps it back down the pitch"
490,"Yadav to Maxwell, no run shapes to pull, ball kept low and hurried on to hit him on the right thigh. Looks to scamper through but Umesh gets across quickly"
491,"Jadeja to Faulkner, 1 run into the pads, tucked to midwicket for an easy single"
492,"Jadeja to Maxwell, 1 run fired into middle, backs away and drives it to long-off"
493,"Jadeja to Faulkner, 1 run misfield at cover by Rishi, Jadeja hares across to keep it down to a single"
494,"Jadeja to Maxwell, 1 run backs away to cut, cramped for room, still gets some bat on it, rolls to point"
495,"Jadeja to Faulkner, no run pushed through quicker on middle, squeezed back down the pitch"
496,"Jadeja to Faulkner, 1 run eased wide of the bowler to long-on"
497,"Yadav to Faulkner, no run superb delivery. Lands it at length on off, the ball cuts back in sharply, Faulkner pushes outside the line and is cut into half, just goes over the stumps. Cracking stuff"
498,"Yadav to Faulkner, no run hit back down the ground to mid-off, went hard at it, only managed to toe end it"
499,"Yadav to Faulkner, 1 run full on middle, turned away to midwicket, Faulkner called for two, but Gurkeerat was in quickly, fired the throw"
500,"Yadav to Maxwell, SIX runs clears the front leg and tonks one over long-off. Cross-court fore hand, anybody? He sure can try that at the Rod Laver Arena tomorrow."
501,"Yadav to Maxwell, 2 runs too full on the pads, gets across and works it into the gap between deep midwicket and long-on"
502,"Yadav to Maxwell, (no ball) FOUR runs high full toss outside off, he backs away and slaps it over cover, didn't get hold of it but still managed to clear the in-field quite astonishingly. Free hit time"
503,"Yadav to Maxwell, 1 run excellent stop by Kohli at cover, saved three there."
504,"Jadeja to Maxwell, no run backs away to hit over cover, changes his mind and taps it back to the bowler"
505,"Jadeja to Maxwell, 2 runs steps out and works it towards square leg, excellent running, Umesh caught napping"
506,"Jadeja to Maxwell, 1 run punched wide of cover"
507,"Jadeja to Faulkner, 1 run turns away, he opens the face of the bat and gets it down to deep cover"
508,"Jadeja to Maxwell, no run played with the spin to Kohli at cover"
509,"Jadeja to Maxwell, 1 run fired into middle and leg, worked towards square leg, Shikhar is alert to the possibility of the second"
510,"Sharma to Maxwell, 1 run floats it full on off, driven to long-off"
511,"Sharma to Faulkner, 1 run tip and run, like well all do at street cricket. Plays it with soft hands towards Gurkeerat at cover"
512,"Sharma to Maxwell, no run backs away to slap that over cover, no room to work with, beaten. Excellent change of pace from Ishant, it was the leg-cutter"
513,"Sharma to Maxwell, no run slower one again on middle and leg, turned to Umesh at square leg, Maxwell was miles outside the crease, not sure why Umesh didn't throw. There was no one backing up alright, but he should have taken the chance and fired the throw"
514,"Sharma to Maxwell, 1 run tucked round the corner towards fine leg"
515,"Sharma to Faulkner, 1 run shows the full face of the bat and eases it down to long on"
516,"Jadeja to Faulkner, FOUR runs draws an outside edge that races away past short third man. No slip, no one at 45, the pace on the ball was enough"
517,"Jadeja to Faulkner, 1 run worked across the line to long on"
518,"Jadeja to Maxwell, FOUR runs steps out and chips it inside-out into the cover boundary. They had the fielder in the deep for a reverse sweep, this time he got to the pitch and placed it superbly into the gap"
519,"Jadeja to Maxwell, no run steps out, Jadeja fires it into middle and leg, deflects off the pad to the off side, Jadeja got to it quickly and fired a throw at the bowler's end. Direct hit and Faulkner was struggling"
520,"Jadeja to Maxwell, no run gets away this time, the reverse sweep finds Ishant at short third man"
521,"Jadeja to Maxwell, 1 run sliding into middle, worked to mid-on"
522,"Sharma to Maxwell, FOUR runs buffet bowling, as Geoff Boycott would say. Short and angling down leg, tickled into the fine leg boundary. Pressure's off."
523,"Sharma to Maxwell, 1 run worked across the line towards square leg"
524,"Sharma to Faulkner, no run can't pierce the gap on the off side, straight to Kohli at cover"
525,"Sharma to Faulkner, 2 runs steps out and eases it into the gap at square third man, back easily for the second run. Just backed away, made room and chopped it nicely"
526,"Sharma to Faulkner, no run crunched but straight to Rohit at cover this time"
527,"Sharma to Faulkner, 2 runs gets a thick inside edge but the long-on fielder had to come in a long way, back for the second without a fuss"
528,"Jadeja to Maxwell, 1 run slices it wide of point, didn't get to the pitch of the ball as he looked to go over cover"
529,"Jadeja to Faulkner, no run drifts in and spins away, played back to the bowler"
530,"Jadeja to Faulkner, no run fired into middle, dabbed back down the pitch"
531,"Jadeja to Faulkner, 2 runs excellent stop by Shikhar at deep square, it was a fierce sweep shot, covered ground, dived to cover the line"
532,"Jadeja to Faulkner, 1 leg bye deflects off the pad, but there is short fine leg"
533,"Jadeja to Maxwell, 1 run low full toss outside off, squeezed to cover and they scamper through for a single. That's the end of Jadeja's spell. Quite brilliant"
534,"Yadav to Maxwell, no run backs away to slap it over the infield, hits it well, one bounce to Shikhar at mid-off, doesn't take the run despite one being easily available"
535,"Yadav to Maxwell, SIX runs he's hit that 15 rows back into the long boundary at long-on. Umesh floats it full on middle and leg, Maxwell backs away and swings cleanly down the ground. What elevation, pinged the middle of the bat"
536,"Yadav to Maxwell, FOUR runs short, wide and he cracks that up and over backward point, huge gap there, deep cover fielder did a 200-metre sprint but couldn't get anywhere near the ball. Maxi one hit away from a century"
537,"Yadav to Maxwell, OUT looks for the glory hit, the length ball gets a little big on him, can't get any power behind that attempted slap over cover, Dhawan, running back from mid-off, keeps his eye on the ball and takes it well. It was swirling in the air but he kept his composure. Has come a little too late for India. Maxwell walks off to a huge round of applause. What a"
538,"Yadav to Faulkner, 1 run dabbed wide of point for an easy run as Australia take an unassailable lead in the five-match series"
539,Didn't someone say the other night that it's written in Faulkner's contract to hit the winning runs? He's done it again
540,"Two Rohit tons, and now a Kohli century in vain. A better performance from the bowlers and the fielders, but was still not enough to stop the Australians. Could have been a lot closer, but Maxwell was the difference between the sides on the night. A terrific exhibition of uninhibited hitting took the game away from India at a time when the game was on a knife's edge. Ishant bowl"
541,"Thanks for joining us. Hope you enjoyed the coverage. Until next time, it's goodbye from the commentary desk. Cheers!"
542,Australia won by 3 wickets (with 7 balls remaining)
543,"Player of the match is Glenn Maxwell, AUS"
