,Data
352,"Pattinson to Dravid, no run full pitched on the stumps, near yorker, but Dravid comes down on it and plays to mid-on."
353,"Pattinson to Dravid, FOUR runs vintage Dravid to get off the mark. Pitched up on the toes and he caresses it motoring through midwicket."
354,"Pattinson to Dravid, 1 run on the pads again, this time Dravid's nudge is fielded by short leg, who then under-arms towards the bowler's end. An overthrow results."
355,"Pattinson to Sehwag, no run angling in from a length, Sehwag is cramped for room and defends quietly."
356,"Pattinson to Sehwag, no run pitched up wide of off stump, Sehwag lets it go to the keeper."
357,"Hilfenhaus to Dravid, 1 run back of a length outside off, Dravid dabs to cover and sets off for one."
358,"Hilfenhaus to Sehwag, no run bumper from Hilfenhaus, Sehwag ducks almost immediately."
359,"Hilfenhaus to Sehwag, no run back of a length on the hips, nudged with the angle to midwicket. Sehwag consciously keeps it down."
360,"Hilfenhaus to Sehwag, no run Hilfy again cuts it into Sehwag off the seam, no room for the man to work with. He defends to the leg side from the crease."
361,"Hilfenhaus to Sehwag, no run this one holds its line outside off, Sehwag hops in the crease and defends to the off side."
362,"Hilfenhaus to Sehwag, no run bumper outside off now, not the fastest, but the packed cordon behind square on the off side prevents Sehwag from thoughts of the upper cut. He lets it go."
363,"Siddle to Dravid, no run brisk start, full length ball at pace outside off. Dravid leans across and shoulders arms."
364,"Siddle to Dravid, no run operates on a good length again, not much seam or swing so far from Siddle. Another leave from Dravid."
365,"Siddle to Dravid, no run pitched further up on off stump, gets Dravid forward and he defends to the covers."
366,"Siddle to Dravid, no run that seamed away a touch. Needs to be closer to off stump to trouble Dravid, though. He lets this go."
367,"Siddle to Dravid, 3 runs Dravid flows into that one. Siddle goes a shade fuller, enough for Dravid to reach across and get right up to the pitch and swirl it through point. Didn't time it very well, but enough to get three."
368,"Siddle to Sehwag, 1 run Sehwag has 8000. Short ball aimed at the ribs - perfect angle to Sehwag - he hops and fends behind square and gets a single to fine leg."
369,"Hilfenhaus to Sehwag, 2 runs good length ball, Sehwag drives down the ground but didn't middle it. The ball didn't seem to come on. Dravid had to get out of the way and hence started late for the first, but they should have still got three. Siddle and Lyon tag it together and both dive to stop the four"
370,"Hilfenhaus to Sehwag, no run back of a length on off stump, Sehwag defends to the off side."
371,"Hilfenhaus to Sehwag, 2 runs the outfield is heavy? Full ball straying onto the pads, and Sehwag literally swats it over square leg. The ball slows up on the boundary and he gets two."
372,"Hilfenhaus to Sehwag, 1 run on the pads yet again, Hilfy's away seam movement has subsided a touch. Worked behind square for a single."
373,"Hilfenhaus to Dravid, no run"
374,"Hilfenhaus to Dravid, no run Dravid safely negotiates a length wobbler outside off stump."
375,"Siddle to Sehwag, no run good stuff from Siddle! Thunders down a real quick bouncer - he is generally even quicker than Pattinson - at Sehwag's ribs. Sehwag hops and fends to the leg side. Where is short leg?"
376,"Siddle to Sehwag, no run that got big on him. 143 kph and just short of a length, but that ascended steeply there after. Sehwag was sucked into a steer through the off side, and was beaten by the bounce."
377,"Siddle to Sehwag, FOUR runs and Sehwag's gone after it as soon as he gets the chance, when third man isn't around. Short and much wider than the last over, Sehwag carves it over the slips and the ball lands close to the boundary."
378,"Siddle to Sehwag, no run cuts the angle, that's got to be the idea against Sehwag. Defends from the crease."
379,"Siddle to Sehwag, no run over-pitched at pace on the stumps. Looking for the pad or the stumps, but it meets the middle of Sehwag's bat as he on-drives to mid-on."
380,"Siddle to Sehwag, no run short of a length on off stump, Sehwag stays back and defends."
381,"Lyon to Dravid, no run tossed up outside off, Dravid on-drives with the turn to mid-on."
382,"Lyon to Dravid, no run flighted outside off, Dravid reaches forward and defends."
383,"Lyon to Dravid, no run hint of drift for Lyon, very full so tough to say how much he's spinning it. Dravid smothers."
384,"Lyon to Dravid, no run a polite touch of spin on a length ball well wide of off stump, Dravid lets go."
385,"Lyon to Dravid, no run flighted wide of off stump, Dravid lunges out long to get to the flight and drives to cover."
386,"Lyon to Dravid, no run Dravid once again reaches out to the flight and gets there to drive fluently to mid-off. Lovely intent from Dravid, and a good start from Lyon. Gets a maiden."
387,"Siddle to Sehwag, 2 runs leading edge from Sehwag not for the first time today. This is strange, since he isn't playing across the line. Just seems to be closing the face early a touch. This was on leg stump, and skimmed in the air towards gully."
388,"Siddle to Sehwag, no run pitched up, Sehwag has been playing back mostly but he's ready for the drive the moment it is in his half. Doesn't move the feet one jot, mind you, but cracks the drive straight to mid-off."
389,"Siddle to Sehwag, FOUR runs and the gap this time. It was almost as full, a foot wider of off stump, and Sehwag opened the face as he drove on the up. The ball bursts between cover and mid-off. Sehwag ran the first one away from the pitch to avoid Siddle, but bumped into him - completely unintentionall"
390,"Siddle to Sehwag, FOUR runs classy from Sehwag. Back of a length just outside off, no room for the cut and no length for the drive. Sehwag thinks, no problem, and opens the face to steer it through the cordon for four."
391,"Siddle to Sehwag, no run short ball on the hips, Sehwag works it square carefully."
392,"Siddle to Sehwag, no run stays back on the crease and defends to the off side. Sehwag's batting quite slow today. He's laboured through 50 balls to score 39."
393,"Lyon to Dravid, no run Dravid presses forward and steers a full ball to point. He wants a single, but they decide against it in the end."
394,"Lyon to Dravid, 2 runs tossed up, Dravid flicks it straight through Ponting, who plays Hollow Man at midwicket."
395,"Lyon to Dravid, no run good stuff. Drops it short of full length, and Dravid defends the line. He can't get to the flight this time."
396,"Lyon to Dravid, 1 run this time he does, opening the face as he leans out and drives wide of extra cover for one."
397,"Lyon to Sehwag, 1 run he's not going after him yet. Turning from middle towards leg, Sehwag nurdles a single behind square."
398,"Lyon to Dravid, no run shorter length, Dravid stays back and nudges with the turn behind square."
399,"Siddle to Sehwag, no run quick bouncer angled towards the body, but short enough for Sehwag to duck under."
400,"Siddle to Sehwag, no run back of a length, Sehwag is behind the line and defends with soft hands."
401,"Siddle to Sehwag, 1 run in the air but safe. A couple of strange shots from Sehwag today, but he's mostly restrained himself. Scoops a full ball from middle and leg almost inside out into the cover. The ball pops up perilously but lands safe."
402,"Siddle to Dravid, no run full length on the stumps, Dravid defends super solidly to the off side."
403,"Siddle to Dravid, no run textbook defensive stroke from the man who has the textbook in his back pocket at all times. Leans out to the line and defends with the high elbow."
404,"Siddle to Dravid, no run good ball, that seamed in from short of a length. Dravid chose to leave, the ball hurtled over the stumps at pace."
405,"Lyon to Sehwag, 1 run sharp spin for Lyon, that gripped and burst into Sehwag who'd have expected room. He ended up dabbing to the leg side."
406,"Lyon to Dravid, 2 runs Dravid jumps back to an offbreak turning in and cuts against the turn in front of point. Classy."
407,"Lyon to Dravid, 2 runs turns down the leg side, Dravid gets a faint tickle on it down to fine leg."
408,"Lyon to Dravid, no run turns in gently from wide of off stump, Dravid leans out and shoulders arms."
409,"Lyon to Dravid, no run flighted outside off, Dravid drives against the turn to mid-off."
410,"Lyon to Dravid, no run tossed up on the stumps, defended back down the track."
411,"Siddle to Sehwag, 1 run length ball on off stump, mid on and mid off are standing in an entirely different zip code. Sehwag is happy to push a single to mid-on."
412,"Siddle to Dravid, no run full and just outside off to Dravid, who shoulders arms."
413,"Siddle to Dravid, FOUR runs edged, but controlled. Dravid leans out to cover the line, but the ball seamed away marginally and took the edge. Dravid softened the grip well to let it run down to the ground for a couple past the cordon."
414,"Siddle to Dravid, no run middles the forward press this time. Full ball outside off, played to cover."
415,"Siddle to Dravid, no run short ball, hustles Dravid back but he's up to it. Defended from the crease with soft hands."
416,"Siddle to Dravid, no run back of a length outside off and seaming away, Dravid lets it go."
417,"Lyon to Sehwag, 2 runs Lyon again cuts out room outside off for Sehwag, who works a back of length ball behind square for a couple."
418,"Lyon to Sehwag, 2 runs there he's done just that. Pitched up outside off, Sehwag drives on the up with an inside-out flourish for a couple."
419,"Lyon to Sehwag, FOUR runs fifty to Sehwag. One of his slower ones, it has taken all off 59 balls. Pitched up outside off, Sehwag tees off straight enough to elude the very straight, very deep mid-off. Well played."
420,"Lyon to Sehwag, FOUR runs goes with the turn now. Lyon might as well be tossing up golf balls at him, since Sehwag's teeing off. Beats the deepish mid-on now easily as the ball rolls past the straight boundary."
421,"Lyon to Sehwag, 1 run did that land short? Sehwag skips out to the flight and whiplashes from wide of off stump airily towards mid-on, where his protege, Warner, is lurking. One of the best fielders in the world, mind you. He dived forward and seemed to get his hands under it, but couldn't quite scoop"
422,"Lyon to Dravid, no run sanity at Dravid's end. Defends a full ball immaculately."
423,"Pattinson to Sehwag, no run bumper to start off the new spell, Sehwag ducks under it happily."
424,"Pattinson to Sehwag, 2 runs short of a length and hustling Sehwag back, but he neatly skips inside the line and tucks it behind square for two."
425,"Pattinson to Sehwag, no run back of a length on off stump, Sehwag stays back on the crease and defends to mid-off."
426,"Pattinson to Sehwag, no run beaten by a hint of seam. Sehwag drives on the up from his crease to a length ball that went away. And misses."
427,"Pattinson to Sehwag, no run Sehwag stays behind a length ball and defends to the off side."
428,"Lyon to Dravid, no run tossed up on off stump, works it with the turn to the leg side."
429,"Lyon to Dravid, no run that bounced a lot more than Dravid expected as he went back and looked to play towards midwicket. Defends it in the end."
430,"Lyon to Dravid, no run drifts wider outside off and spins in, Dravid pads it away."
431,"Lyon to Dravid, no run fired in a touch faster, Dravid stays back in the crease and soft-bats it at the last moment."
432,"Lyon to Dravid, no run loopy on the middle and off line, Dravid leans out to smother it towards the mid-on area."
433,"Lyon to Dravid, no run edged but there's no backward square leg. Lovely delivery, drifted in, dipped and turned to take the inside edge as Dravid looked to nudge square. Safe once it eluded short leg."
434,"Pattinson to Sehwag, no run back of a length on off stump, Sehwag hangs back and defends to the off side."
435,"Pattinson to Sehwag, 1 run third man is back now, so Sehwag gets only a single. Short and marginally wide of off stump. Sehwag sits beside the line and cracks it over gully."
436,"Pattinson to Dravid, no run Dravid gets forward and defends solidly to mid-off."
437,"Pattinson to Dravid, no run short ball angles in at pace and Dravid arches back to sway out of harm's way."
438,"Pattinson to Dravid, no run good attacking length coming in from wide of the crease, on a length. Meets the middle of the middle of Dravid's bat as he presses forward to defend."
439,"Pattinson to Dravid, no run full length ball wide of off stump, enough to allow Dravid to shoulder arms."
440,"Hilfenhaus to Sehwag, no run short of a length on off stump, Sehwag calmly defends from the crease to the off side."
441,"Hilfenhaus to Sehwag, FOUR runs carved. With all the grace of a butcher. A foot or so outside off at no extra pace, and at a good height. Sehwag's bat swings an arc after the ball passes him, and it disappears past gully."
442,"Hilfenhaus to Sehwag, 2 runs over-compensation. On the pads now, and Sehwag deflects it towards fine-leg for two more."
443,"Hilfenhaus to Sehwag, no run short ball outside off, Sehwag bends to avoid."
444,"Hilfenhaus to Sehwag, no run that comes in with the angle, Sehwag gets forward and defends to the leg side."
445,"Hilfenhaus to Sehwag, no run back of a length, Sehwag gets back and across to cover the line and defend it."
446,"Pattinson to Dravid, no run back of a length outside off stump, Dravid drops the wrists and lets it go. These two are batting beautifully."
447,"Pattinson to Dravid, no run that came in with the seam, Dravid shoulders arms. Came close to off stump, that."
448,"Pattinson to Dravid, 1 wide over-cooked bouncer, too short as Dravid ducks under, and it is called a wide."
449,"Pattinson to Dravid, no run fuller length, Dravid leans out to defend to the off side."
450,"Pattinson to Dravid, no run length ball too wide outside off to trouble Dravid, who lets it go."
451,"Pattinson to Dravid, no run lovely stuff from Pattinson, and exemplary leaving from Dravid. This one came in as well, late and sharp as Dravid shouldered arms."
452,"Pattinson to Dravid, no run beaten by a peach. What a follow-up to a big indipper! This one darted away off the seam, opened up Dravid who had to play but he escapes without a nick as he tries to cover the line."
453,"Hilfenhaus to Sehwag, no run short ball on off stump, Sehwag arches back to manufacture room but can't create enough. Defends it to the off side."
454,"Hilfenhaus to Sehwag, 1 run short ball on the hips, Sehwag fends it away off the glove for a single."
455,"Hilfenhaus to Dravid, no run back of a length outside off and holding its line. Dravid watches closely and lets it go to the keeper."
456,"Hilfenhaus to Dravid, no run shorter length, extra lift from outside off. Dravid rides it and steers to point."
457,"Hilfenhaus to Dravid, 2 runs pitched up and Dravid takes up the challenge to lean forward and drive through the line. Threads the covers for a couple."
458,"Hilfenhaus to Dravid, no run Dravid undone again by away seam. He looked infallible until the last over, but twice in a short span, he's been left befuddled by balls that have left him. Almost a repeat of what Pattinson did, this too hit the seam on a length and darted away past the searching outside e"
459,"Pattinson to Sehwag, no run over-pitched on off stump, Sehwag looks to blaze it through the covers but doesn't get the gap."
460,"Pattinson to Sehwag, no run appeal for a catch at short leg and it is given not out! Did Sehwag nick that onto his hip? Short ball angling in, he tries to fend it to the leg side, and it pops up off the thigh. Everyone goes up the moment it is held at square leg. No edge. HotSpot says so too, or whatev"
461,"Pattinson to Sehwag, 1 run pitched up outside off, Sehwag drives to cover for one."
462,"Pattinson to Dravid, no run Dravid beaten again and looking a little iffy now. That wasn't close enough to the stumps for him to play it but he still went feeling for it as it nipped away."
463,"Pattinson to Dravid, 1 run angled into the pads, Dravid works it square for one."
464,"Pattinson to Sehwag, no run this is impressive from Pattinson, thuds in a short ball at good pace and Sehwag barely controls the defensive dab to the off side."
465,"Hilfenhaus to Dravid, no run Dravid's beaten for the fourth time in 10 minutes. This time the ball misses the inside edge as Hilfy cuts one in. Clearly Dravid was thinking of the many outside edges he escaped, and the ball slid through the bat-pad gap. Missed the stumps, though. Big caught behind appea"
466,"Hilfenhaus to Dravid, no run more organised now, lets a wobbler outside off go through to the keeper."
467,"Hilfenhaus to Dravid, no run short of a length, Dravid cuts without timing towards the covers."
468,"Hilfenhaus to Dravid, 2 runs another one short and wide, Dravid cuts it past a diving Warner at point and gets some release."
469,"Hilfenhaus to Dravid, no run cuts the room now, on off stump and forcing Dravid to defend with a straight bat."
470,"Hilfenhaus to Dravid, no run fuller, Dravid pulls out the copy book forward defensive."
471,"Pattinson to Sehwag, no run short of a length ball, negotiated safely from the crease."
472,"Pattinson to Sehwag, OUT a very good spell of fast bowling in the last 20 minutes of so has produced a wicket. The trouble was at the other end, with Dravid, but Sehwag is the man who has gone. He's livid with himself. It was on a length and a touch wide of off stump, Sehwag went for the blazing cover"
473,"Pattinson to Tendulkar, no run short of a length outside off and holding its line. Tendulkar leaves."
474,"Pattinson to Tendulkar, 1 run inside edge safe. Full length ball outside off, Sachin isn't forward soon enough as he looks to drive, and the edge bursts through his legs."
475,"Pattinson to Dravid, no run Dravid stays behind the line and lets a length ball go."
476,"Pattinson to Dravid, no run Dravid hangs on the crease and defends watchfully to the leg side to end the over."
477,"Hussey to Tendulkar, no run sharp away swing from a length as Haddin stands up to the stumps. Sachin leaves."
478,"Hussey to Tendulkar, no run much wider outside off, Sachin happily leaves it. Four balls to go."
479,"Hussey to Tendulkar, no run slow and full yorker on the off stump, Tendulkar jams down on it attentively. Good fun, this!"
480,"Hussey to Tendulkar, no run length ball angled onto the pads, worked cautiously to the leg side."
481,"Hussey to Tendulkar, no run nearly gone! Hussey swings it in sharply from outside off, Tendulkar looked to on-drive and the inside edge hit the pad and looped up perilously before lading just short of silly mid-on. What a moment that!"
482,"Hussey to Tendulkar, 1 run Tendulkar survives until tea. Length ball on the pads, nudged with the angle through square leg for a single."
483,"Siddle to Tendulkar, SIX runs Tendulkar has upper-cut him for six first ball after tea! He did this a lot the last time he was in Aus, especially in the CB series finals. Short and wide outside off, not much width, Sachin stays under it and opens the face upwards to slap it over the slips. And all the"
484,"Siddle to Tendulkar, 3 runs over-pitched on the pads, Sachin whips fluently for three more. Roaring start this."
485,"Siddle to Dravid, no run back of a length to Dravid, who shuffles back and across to let it go to the keeper."
486,"Siddle to Dravid, no run fuller length, Dravid is solidly behind the defensive push down the track."
487,"Siddle to Dravid, no run leans out to a wider ball outside off and defends into the covers."
488,"Siddle to Dravid, no run seams away from a length, not close enough to Dravid to force a shot out of him. He leaves."
489,"Hussey to Tendulkar, no run aha, slips the first ball down the leg side, no doubt looking for a stumping. He accounted for Jesse Ryder in similar style recently. Sachin misses the glance, but doesn't take the back foot out of the crease."
490,"Hussey to Tendulkar, no run angling in, Sachin defends to the leg side with the angle."
491,"Hussey to Tendulkar, no run gets behind a length ball and defends it softly."
492,"Hussey to Tendulkar, 1 run fuller length, draws him forward and he defends to the off side."
493,"Hussey to Dravid, 1 run opens the face now as he leans out and steers through cover for a single."
494,"Hussey to Tendulkar, no run short of a length, Tendulkar gets across and laboriously turns it to the leg side."
495,"Siddle to Dravid, no run back of a length from Siddle, Dravid stays on the crease and defends to the leg side."
496,"Siddle to Dravid, no run stays solidly behind the line and defends to the off side. Early signs are that Dravid looks more settled than he did in the lead-up to tea."
497,"Siddle to Dravid, no run back of a length and wide of off, Dravid rises on the toes and steers square. Can't beat point and asks Sachin to wait."
498,"Siddle to Dravid, no run fuller and attacking the stumps, Dravid stays solid in defence."
499,"Siddle to Dravid, 1 run angling into the pads now, Dravid is on the crease, but the bat turns at the right moment to get a single behind square."
500,"Siddle to Tendulkar, no run full length on off and middle, defended off the front foot down the track."
501,"Hussey to Dravid, FOUR runs Hussey strays onto Dravid's pads, and he generates impressive bat speed with a vicious twirl of the wrists on the back foot. The ball bounds along between square leg and midwicket for four."
502,"Hussey to Dravid, no run fuller length on off stump, defended off the front foot to the off side."
503,"Hussey to Dravid, no run stays on the crease and opens the face to defend to the off side."
504,"Hussey to Dravid, no run length ball outside off, Dravid lets it go. The Hussey experiment must be close to an end now."
505,"Hussey to Dravid, no run better line, attacks the stumps with a straight delivery. Dravid defends off the front foot."
506,"Hussey to Dravid, 1 run short and wide, Dravid creams it through point for a single to the man at deep point."
507,"Siddle to Dravid, no run short ball outside the off stump, Dravid weaves out of harms way."
508,"Siddle to Dravid, no run pitched up at pace on the stumps, Dravid gets forward and covers the line to defend down the track."
509,"Siddle to Dravid, 1 run short ball, Dravid hops back and punches through the covers to get a single."
510,"Siddle to Tendulkar, no run back of a length outside off stump, SRT lets it go through to the keeper."
511,"Siddle to Tendulkar, FOUR runs four more in cheeky fashion! Tendulkar sees a short ball, barely outside off, he waits on it to come beside him and then slaps it with an opened face. Was he trying to go over the slips? He went between the slips and gully at catchable height, but it looked like he picked"
512,"Siddle to Tendulkar, FOUR runs oh gorgeous! The people in MCG have got their money's worth for coming in today! Tendulkar plays the best cover drive you'll ever see. Over-pitched outside off, he waltzes forward and creams it on a bent knee, and ends up with a bent elbow. The ball shoots through the cov"
513,"Hilfenhaus to Dravid, no run nips in off the seam onto the pads, and Dravid works it square."
514,"Hilfenhaus to Dravid, 1 run again on the pads, Dravid nudges it with the angle through square leg for a single."
515,"Hilfenhaus to Tendulkar, no run back of a length on off stump, defended solidly down the track."
516,"Hilfenhaus to Tendulkar, FOUR runs poor stuff from Hilfy. A gift for Tendulkar who is anyway scoring in a massive hurry. Angled into the pads on a full length, and Tendulkar glances it down to fine leg for four."
517,"Hilfenhaus to Tendulkar, no run back of a length, Tendulkar cracks it square now. Boy, is he timing the ball today ..."
518,"Hilfenhaus to Tendulkar, no run back of a length on the stumps, Tendulkar covers the line and blocks down the track."
519,"Siddle to Dravid, no run full length ball wide of off stump, Dravid lets it go."
520,"Siddle to Dravid, no run similar ball, doesn't draw Dravid forward as he shoulders arms."
521,"Siddle to Dravid, no run goes fuller, Dravid seems over-eager to drive off the front foot and ends up inside-edging towards mid-on."
522,"Siddle to Dravid, no run short of a length on the stumps, Dravid hops and defends it down the track."
523,"Siddle to Dravid, no run good bouncer, forces Dravid to arch back quickly and drop his wrists."
524,"Siddle to Dravid, no run pitched up now, despite the bouncer last ball Dravid's footwork and balance are ready for the forward press and drive. He can't beat mid-off, though."
525,"Hilfenhaus to Tendulkar, no run short of a length outside off and holding its line. Tendulkar shuffles across and leaves."
526,"Hilfenhaus to Tendulkar, no run keeps him on the crease with a back of a length ball, defended from the crease to the off side."
527,"Hilfenhaus to Tendulkar, FOUR runs another masterly cover drive from the master. Not quite as 'perfect' as the previous one, since this wasn't on a driving length. But the imperfection makes the shot even more special. Sachin half-trots towards the line and then the hands and eyes take over as he cares"
528,"Hilfenhaus to Tendulkar, no run stays on the crease and defends a length ball down the track."
529,"Hilfenhaus to Tendulkar, no run stays back again and blocks a length ball to the off side."
530,"Hilfenhaus to Tendulkar, FOUR runs MCG roars. The buzz is reaching maddening proportions. Tendulkar is putting a show. Pitched up on the stumps, the ball doesn't deviate from the straight and thuds ominously into the middle of the broadest bat in the business. Easily beats mid-on and speeds away."
531,"Siddle to Dravid, no run Dravid leaves a length offering outside the stumps go alone."
