,Data
236,"Hastings to Dhoni, OUT four, six, and out! Dhoni spanks it, Maxi takes it, he feels the heat. Wrings his hands. Dhoni danced out again, Hastings banged it onto the middle of the pitch at 140ks. Pulled to deep midwicket, where Maxi hangs onto the catch"
237,"Hastings to Jadeja, 1 run low full toss outside off, cracked to deep cover"
238,"Faulkner to Jadeja, 2 wide slash and a miss outside off, wide called. I suspect that was the slower one. Wade fumbles"
239,"Faulkner to R Dhawan, no run full on off, slower at 116ks, weak drive back to Faulkner"
240,"Faulkner to R Dhawan, 2 runs another slower ball, this one at 111ks, down the track and slogged to long-on"
241,"Faulkner to R Dhawan, 1 run slower full ball, Rishi goes deep in the crease, slog-sweeping over to Smith at long-on"
242,"Faulkner to Jadeja, 1 run pitched up and outside off, drilled to deep cover. Richardson keeps it to just one"
243,"Faulkner to R Dhawan, no run slower one again, slanted across off, Rishi goes low, slogs and fails to connect"
244,"Faulkner to R Dhawan, no run Faulkner closes the innings with his assortment of slower balls. Rishi swings wildly, but can't lay bat on it"
245,"Kohli: I love to bat with Rahane. MS was charged up today. He wanted to smack a few today. On a slowish wicket, he has done a tremendous job. The guys are excited to make it 2-1. It is not an easier track to bat on."
246,Shashank will call the chase. Ciao
247,"Australia's bowlers, however, impressed, and were ably backed up by their fielders. Hastings pounded the deck and claimed his career-best ODI figures. Richardson too hurried batsmen and they tied down Dhawan. The opener scratched his way to a fifty, Rahane's was more fluent, Kohli struck 117, and Dhoni produced a cameo. But India could not cross 300. The visitors managed only 46"
248,"5:51pm: India finish with 295 for 6. It doesn't look enough, again. Their bowlers have another tough task ahead, with their batsmen not connecting with enough blows in the death."
249,"6:10pm Interesting thoughts from Wasim Akram. He reckons 295 at the MCG is worth more than it actually is, considering the dimensions of the ground. Will the Indian bowlers prove him right? The series is on the line. MS Dhoni will need a big performance from Ishant and Umesh, especially in Ashwin's absence."
250,Our stats man Bharath Seervi with another interesting nugget: Teams have posted 265+ eight times against Australia at 'The G'. The hosts have chased them down successfully on five occasions.
251,6:30pm Players are making their way out. Will MS try something different and hand the new ball to Umesh? Will he hold Sran back as the first change bowler. We'll find out very soon.
252,"Yes, Umesh it will be. Shaun Marsh on strike. Fasten your seat belts"
253,Ishant into the attack
254,"Yadav to Marsh, no run moves away from off stump, squeezed towards cover point"
255,"Yadav to Marsh, no run good delivery, length ball, closer to the stumps, Marsh hops back and plays it with soft hands"
256,"Yadav to Marsh, 1 run looks to crash it through cover, ends up slicing it behind point towards third man"
257,"Yadav to Finch, 3 runs stands tall and punches it between the two cover fielders, good chase by Rahane but a weak throw. Once again a back of length delivery, good bat flow from Finch as he came down on it"
258,"Yadav to Marsh, no run turned towards mid-on this time, Marsh was hurried for pace on that occasion"
259,"Yadav to Marsh, FOUR runs beautiful flow of the bat once again. Pitched up, not much movement, Marsh plants his front foot forward and essays a classic cover drive past the diving Virat Kohli at wide mid-off"
260,"Barinder Sran to Finch, no run floats it full and across Finch, left alone"
261,"Barinder Sran to Finch, 2 runs hops back and plays the Natraja shot, gets it into the gap at deep backward square leg"
262,"Barinder Sran to Finch, no run excellent stop by Jadeja at backward point, it was crunched but he threw himself to his left to stop that"
263,"Barinder Sran to Finch, 1 run gets a thick inside edge towards fine leg, lucky"
264,"Barinder Sran to Marsh, no run good delivery this time, more effort into the delivery, lands it ahead of good length around off, left alone"
265,"Barinder Sran to Marsh, FOUR runs wow! simply, wow. Half volley outside off, simply leans into the drive and eases it into the gap at cover. Sourav Ganguly would have been proud of that stroke. Nice high elbow as ball met bat, enough power. Once he found the gap, there was no stopping that"
266,"Sharma to Finch, no run another half volley outside off, this one's hit hard to Rohit at cover. Finch will be kicking himself, a boundary missed."
267,"Sharma to Finch, 1 wide nips away from outside off, Finch watches it through to Dhoni. He was flirting with the wide line, umpire thinks it was wide enough"
268,"Sharma to Finch, 1 run angled it full on middle from wide of the crease, tucked to short midwicket for a quick single"
269,"Sharma to Marsh, 3 runs sliding into the pads, easy pickings, flicked into the gap at square leg, they're back for the third quite easily, can be tough to throw on the turn here. The throw from Rohit had no power whatsoever"
270,"Sharma to Finch, no run that's closer to the stumps, just a touch around off, held its line, left alone"
271,"Sharma to Finch, no run back of length delivery on off, tapped to short cover"
272,"Sharma to Finch, no run punched to Rohit at cover, no boundary of the over. Better one for India"
273,"Barinder Sran to Marsh, 3 runs gentle half volley on the pads, superbly flicked away, long boundary there at deep midwicket, they missed an opportunity to get back for the fourth. Poor bowling"
274,"Barinder Sran to Finch, FOUR runs short, wide and four! Sitting up nicely for Finch to use the width and put that away into the gap behind point. Easy pickings at any level of cricket really"
275,"Barinder Sran to Finch, FOUR runs gentle full toss this time on off, Finch says 'thank you very much'. Leans forward, goes through the line and beats cover. No chance of stopping that"
276,"Barinder Sran to Finch, no run straight in and straight out. Gurkeerat puts down a sitter at mid-off. It was right in the slot to drive, he hit it hard, he looked like grabbing that, popped out."
277,"Barinder Sran to Finch, no run back of length delivery on off, left alone"
278,"Barinder Sran to Finch, no run excellent stop by Rohit, throwing himself to his right, deflected to Gurkeerat at mid-off. Saved a certain boundary"
279,"Sharma to Marsh, 1 run gentle tap to mid-off as they scamper through for a quick single. Umesh was caught napping at mid-on, shouldn't have been a run"
280,"Sharma to Finch, no run good ball, angled in on off from wide of the crease at length, left alone"
281,"Sharma to Finch, no run hits the deck hard, extra bounce, hurries onto Finch's bat as he looks to defend off the back foot"
282,"Sharma to Finch, 1 run back of length delivery on middle, tucked wide of square leg"
283,"Sharma to Marsh, FOUR runs short ball at 137 kph, enough time for Marsh to swivel and pull that one behind square. Picked the bones out of that one. Rolled his wrists to keep it down, raced away into the boundary"
284,"Sharma to Marsh, no run nips away from length area outside off, left alone"
285,"Yadav to Finch, OUT a wicket finally. The outside edge has been found courtesy some late movement. Good length, drew him forward, Finch went for the drive, but the foot was nowhere to the pitch of the ball, gets a thin edge which MS accepts gleefully. The manner in which he threw the ball up after pouching that had relief written all over it. He doesn't generally get very"
286,"Yadav to Smith, 1 wide this one is directed down leg side, some work for the umpire"
287,"Yadav to Smith, 2 runs too straight this time, tucked away wide of midwicket, off the mark with two easy runs"
288,"Yadav to Smith, no run full on middle, driven to mid-on"
289,"Yadav to Smith, no run late movement again, full on middle, Smith is slightly squared up as he defends it to mid-on"
290,"Yadav to Smith, 1 run punched to point where Jadeja dives to his right to save a certain boundary, they get through for the single though"
291,"Yadav to Marsh, no run shapes away from outside off, left alone"
292,"Sharma to Smith, no run back of length delivery on off, defended to the off side"
293,"Sharma to Smith, no run punched through the line, straight to Shikhar D at cover point"
294,"Sharma to Smith, no run another punch, another stop by Shikhar"
295,"Sharma to Smith, FOUR runs short ball, Smith manages to get enough bat on it as he fetches the pull from outside off, beats the gap between midwicket and mid-on"
296,"Sharma to Smith, FOUR runs not all that short this time, but another pull that has split the gap on the on side. Went like a rocket. Only a batsman in the form of his life can think of playing that stroke. That Smith is in the form of his life would be an understatement"
297,"Sharma to Smith, no run prods forward half-heartedly, gets an inside edge onto the pad"
298,"Yadav to Marsh, no run beaten on the drive, played outside the line, doesn't carry to Dhoni"
299,"Yadav to Marsh, 1 leg bye beaten for pace, thuds into the thigh pad, rolls to the on side as they steal a bye"
300,"Yadav to Smith, no run full and swinging in on middle and off, Smith gets a thick inside edge towards midwicket"
301,"Yadav to Smith, no run peach of a delivery. Lands it a touch ahead of the length area on off, this one nips away just a touch, Smith is beaten as he looks to hit through the line"
302,"Yadav to Smith, FOUR runs beats the diving Jadeja at backward point. Right line, but wrong length. Too short, he unfurls his wrists superbly to beat the infield"
303,"Yadav to Smith, no run full on off, carefully defended to the off side"
304,"R Dhawan to Marsh, no run bowls a cutter to start off, short around off, kept a little low, Marsh is beaten on the pull"
305,"R Dhawan to Marsh, no run nice and full on off, driven to mid-off. Kohli effects a direct hit at the bowler's end but Smith's bat is well inside the crease. Third umpire was called for a mere formality"
306,"R Dhawan to Marsh, no run tight line, just in and around the off stump, he gets forward and plays it with soft hands"
307,"R Dhawan to Marsh, no run good chance of pace, well disguised, Marsh shaped to drive but checked his shot at the last moment, defended to the cover fielder"
308,"R Dhawan to Marsh, 2 runs width on offer this time, squeezed away behind point, Sran covers good ground from third man, dishes in a dive to pull that back in"
309,"R Dhawan to Marsh, 2 runs once again eased behind point towards Sran, excellent running between the wickets. Not a bad first over from Rishi D"
310,"Yadav to Smith, 1 run just short of Rahane at midwicket. Slice of luck for Smith. Looked to flick that past the fielder, didn't get enough bat on that. Few words exchanged between Smith and Umesh"
311,"Yadav to Marsh, 1 run hurried for pace, still manages to awkwardly whip that towards square leg"
312,"Yadav to Smith, 2 runs excellent punch again, width on offer, eased into the gap at cover point, third man had to run in to stop that"
313,"Yadav to Smith, 3 runs width on offer, eased towards third man where Sran runs around, does all the hard work but can't time his dive, parries the ball further but recovers well enough to save a run"
314,"Yadav to Marsh, 2 runs pulled handsomely in front of square this time, but there is protection in the deep"
315,"Yadav to Marsh, no run better length, a touch fuller and just around off, carefully defended off the back foot"
316,"R Dhawan to Smith, 1 run slow leg cutter on off, pushed to deep cover"
317,"R Dhawan to Marsh, no run floats it full and across Marsh, angling away, left alone"
318,"R Dhawan to Marsh, no run tight line on middle, pushed to mid-on. Not much swing but he's been accurate largely"
319,"R Dhawan to Marsh, 2 runs the slower one is bowled full and wide this time, Marsh goes after that one, slices it over the infield, deep cover comes around to stop that"
320,"R Dhawan to Marsh, 1 run nice drive down to Kohli at long-off"
321,"R Dhawan to Smith, 1 run full ball on middle, eased down the ground to mid-on"
322,"Gurkeerat to Smith, 1 run tossed up on middle, played to long on"
323,"Gurkeerat to Marsh, 1 run eased wide of cover"
324,"Gurkeerat to Smith, no run spins back in from outside off, gets a thick inside edge towards square leg"
325,"Gurkeerat to Smith, no run played to midwicket this time. Shouts of 'badiya' from MSD"
326,"Gurkeerat to Smith, 1 run half-stop by Rahane at midwicket gives them the single"
327,"Gurkeerat to Marsh, FOUR runs too short this time, cut away into the gap. Cry of anguish from Dhoni this time. Got into position early and executed that cut shot to perfection"
328,"R Dhawan to Smith, no run slower and fuller on off, played back to the bowler"
329,"R Dhawan to Smith, no run authoritative drive, but a diving Rohit took the pace off the ball, it deflected towards mid-off"
330,"R Dhawan to Smith, FOUR runs that will definitely frustrate Dhoni, who was standing up to the stumps. Drifting down leg, tickled easily into the fine leg boundary"
331,"R Dhawan to Smith, no run defended back down the pitch"
332,"R Dhawan to Smith, no run pushed to short cover again"
333,"R Dhawan to Smith, 1 run slower and fuller, eased to deep cover"
334,"Gurkeerat to Smith, no run tossed up on off, pushed back to the bowler"
335,"Gurkeerat to Smith, no run gets forward and pats it with soft hands"
336,"Gurkeerat to Smith, FOUR runs tossed up on off, gets to the pitch and crashes that into the cover boundary. Rohit dived across but it was hit really hard"
337,"Gurkeerat to Smith, no run steps out and plays it back to the bowler"
338,"Gurkeerat to Smith, 1 run turns back in, tucked to short fine to bring the 100 up. India were 34 behind at the same point"
339,"Gurkeerat to Marsh, no run gets forward and smothers the spin"
340,"R Dhawan to Smith, no run angles it full on middle from wide of the crease, pushed to mid-on"
341,"R Dhawan to Smith, no run driven straight to Rahane at cover, accurate stuff"
342,"R Dhawan to Smith, no run excellent stop by Jadeja at point again, timed well once again by Smith"
343,"R Dhawan to Smith, no run bowls it full on middle, Rishi puts his hand out to stop that firm drive back down the ground"
344,"R Dhawan to Smith, 2 runs slower one on off stump, eased into the gap at cover where Ishant misfields"
345,"R Dhawan to Smith, 1 run shows the full face of the bat and eases it down to long on"
346,"Gurkeerat to Smith, 1 run steps out and turns the low full toss into the midwicket region"
347,"Gurkeerat to Marsh, no run gets forward and eases it with soft hands to cover"
348,"Gurkeerat to Marsh, no run steps out but doesn't get underneath it, squeezed back to the bowler"
349,"Gurkeerat to Marsh, no run slow turn from off, cuts to point"
350,"Gurkeerat to Marsh, 3 runs gets a thick edge that flies behind point, Jadeja dives across and pulls one back in"
351,"Gurkeerat to Smith, 1 run steps out and whips it to midwicket"
352,"Jadeja to Smith, no run tossed up on middle, driven impressively, Kohli throws himself to his right at short cover and makes a smart save"
353,"Jadeja to Smith, 1 run fired on middle, whipped to long on"
354,"Jadeja to Marsh, 2 runs drifting into the pads, neat little glance to long leg"
355,"Jadeja to Marsh, 1 run another non-turning ball, this is flicked past midwicket"
356,"Jadeja to Bailey, 1 run looped up on middle, front-foot drive to long-off"
357,"Gurkeerat to Bailey, 1 run steps out and turns it to square leg, a direct hit at the bowler's end from Jadeja and Bailey would have been struggling. In fact gone"
358,"Gurkeerat to Marsh, no run dabbed with soft hands to the off side"
359,"Gurkeerat to Marsh, 1 run steps out and turns it to long on"
360,"Gurkeerat to Bailey, 1 run nicely tossed up outside off, driven firmly to wide long-off"
361,"Gurkeerat to Marsh, 1 run makes room and eases that one to deep cover"
362,"Gurkeerat to Bailey, 1 run steps out and whips it wide of midwicket"
363,"Jadeja to Bailey, FOUR runs chips down the track and hits it down the ground over mid-on, safe shot given the fielder was in"
364,"Jadeja to Bailey, 1 run sliding into middle and leg, tucked wide of midwicket"
365,"Jadeja to Marsh, no run turned with the spin to midwicket"
366,"Jadeja to Marsh, no run fires it into the stumps, Marsh stays inside the crease and defends it down the pitch"
367,"Jadeja to Marsh, 1 run turned wide of Kohli at mid-on for a quick single"
368,"Jadeja to Bailey, no run good stop off his own bowling, it was a firm drive"
369,"R Dhawan to Marsh, no run chops one towards backward point"
370,"R Dhawan to Marsh, 2 runs full outside off, squeezed into the gap behind point, back for the second to get to a fifty. Soaks in the applause of the crowd, but knows the job is just half done. 12th fifty for him"
371,"R Dhawan to Marsh, no run beaten as he looks to ease that behind point, this one was too full, cramped for room"
372,"R Dhawan to Marsh, 1 run slower and fuller on off, mistimes that one back past the bowler"
373,"R Dhawan to Bailey, no run pushed firmly to mid-off"
374,"R Dhawan to Bailey, FOUR runs too short, sitting up nicely for him to play the pull, Dhawan comes around, does all the hard work and then falls over, in trying to push it back in, he manages to push it into the boundary instead. Surely the crowd behind him will keep buzzing in his ears. Can be massively embarrassing"
375,"Jadeja to Marsh, no run pushed to Rohit at cover"
376,"Jadeja to Marsh, no run spins back in, looks to whip that one, hit on the thigh pad"
377,"Jadeja to Marsh, 1 run this time, he manages to get it into the gap at midwicket"
378,"Jadeja to Bailey, no run drifts in and spins away, tapped back to the bowler"
379,"Jadeja to Bailey, 1 run driven with the spin to long off"
380,"Jadeja to Marsh, no run quicker one on middle from wide of the crease, played back to the bowler"
381,"R Dhawan to Bailey, FOUR runs pierces the gap between cover and mid-off. Not all that bad a delivery but he simply put the front foot forward and hit through the line. Perfect balance, super timing"
382,"R Dhawan to Bailey, no run sliding down leg, tickles the pad as Dhoni stops that down leg. Stifled appeal, but more out of hope than anything else"
383,"R Dhawan to Bailey, 1 run tucked down to fine leg, Umesh was quick to get off the blocks"
384,"R Dhawan to Marsh, no run full on middle, turned to mid-on"
385,"R Dhawan to Marsh, FOUR runs crunching cover drive. Juicy half volley this time, leans forward and crunches that into the gap. Second boundary of the over. What flow"
386,"R Dhawan to Marsh, no run outstanding stop by Jadeja at point again. Would have saved at least 10 runs on the field today, yet India find themselves well behind in the piece"
387,"Jadeja to Bailey, no run pushed to cover"
388,"Jadeja to Bailey, 1 run turns away, eased wide of cover for an easy single"
389,"Jadeja to Marsh, no run round-armish this time, lands it on middle, turned to midwicket"
390,"Jadeja to Marsh, no run hurries onto him, defended"
391,"Jadeja to Marsh, 2 runs sliding down leg, tickled towards the fine leg region, easily done"
392,"Jadeja to Marsh, no run tucked to square leg"
393,"Gurkeerat to Bailey, 1 run swept with the spin to deep backward square"
394,"Gurkeerat to Marsh, 1 run played with soft hands to short midwicket, quick single taken again"
395,"Gurkeerat to Bailey, 1 run hit to mid-on, they get across for a risky single"
396,"Gurkeerat to Marsh, 1 run steps out and eases it with the spin to long off"
397,"Gurkeerat to Bailey, no run steps out, looks to turn it with the spin, hit straight to Kohli"
398,"Gurkeerat to Bailey, 1 run tossed up nicely, bit of spin on that one, driven inside-out to long off"
399,"Jadeja to Bailey, OUT beautifully bowled. Ball drifts back in, rips off the surface, turns square, ball zips past Bailey's half-hearted prod, his back foot was in the air as Dhoni collected it cleanly and whipped the bails off in a split second. He made it look so easy. His back foot was on the line. That will definitely even the scales once again. Dhoni knew immediately"
400,"Jadeja to Maxwell, no run gets forward and defends"
401,"Jadeja to Maxwell, no run beats the outside edge this time, square turn for Jadeja again. Dhoni whips the bails off again. He's on fire. This time, the back foot was inside the crease"
402,"Jadeja to Maxwell, no run pushed to Kohli at cover"
403,"Jadeja to Maxwell, no run pushed through quicker, gets some fizz again from middle, Maxi gets back and pushes it back with a straight bat"
404,"Jadeja to Maxwell, 1 run eases it with the spin to long-off, gets off the mark"
405,"Sharma to Maxwell, no run played back to the bowler"
406,"Sharma to Maxwell, no run pitched up outside off, driven well but Kohli throws himself to his left to stop that"
407,"Sharma to Maxwell, 2 runs floats it full on middle and off, doesn't get enough timing but there's still enough to squeeze that past midwicket"
408,"Sharma to Maxwell, 1 run chops it behind point for an easy single"
409,"Sharma to Marsh, no run full and sliding across the batsman, left alone"
410,"Sharma to Marsh, no run driven well, Ishant manages to stop that on his followthrough, nearly deflected it back onto the stumps at the bowler's end"
411,"Jadeja to Maxwell, FOUR runs doesn't take long for him to unfurl the reverse sweep. Hit fiercely over point. Quick change of grip and boom!"
412,"Jadeja to Maxwell, no run played to midwicket, this one was pushed through quicker on middle again"
413,"Jadeja to Maxwell, no run makes room and punches it to Kohli at cover"
414,"Jadeja to Maxwell, 1 wide round-arm action again, this one's sliding down leg, excellent take by Dhoni"
415,"Jadeja to Maxwell, 2 runs makes room and chips it inside-out over extra cover, lot of work for the boundary rider"
416,"Jadeja to Maxwell, no run gets back and defends it to cover this time"
417,"Jadeja to Maxwell, 1 run sharp turn again from off, bunted behind point for an easy single"
418,"Sharma to Maxwell, 1 run angling into middle and leg, flicked behind square to deep fine leg"
419,"Sharma to Marsh, no run driven firmly but can't pierce cover, straight to Kohli who has a glare at Maxwell at the non-striker's end"
420,"Sharma to Marsh, 1 run excellent square drive, straight to Rohit in the deep"
421,"Sharma to Maxwell, 2 runs short on middle and leg, pulled away into the gap, Umesh does well to come around from deep fine again"
422,"Sharma to Maxwell, 1 run short and wide outside off, punched to deep point"
423,"Sharma to Marsh, OUT huge roar from Ishant, and that tells you how much it means to him! Coming back to the delivery, it was a length ball that was angling across, good seam position, the ball held its line, Marsh nibbled at that one without any conviction, got a thin edge, straightforward catch for MS Dhoni. India back into this big time"
424,"Barinder Sran to Maxwell, 1 run length ball on off, punched to deep cover"
425,"Barinder Sran to Marsh, no run gets back into the crease and bunts it to the off side, loud call of no as soon as he hit it"
426,"Barinder Sran to Marsh, 1 run gets to the pitch and drives that one to deep cover, off the mark"
427,"Barinder Sran to Maxwell, FOUR runs good clean strike down the ground. Nice juicy half volley on off, Marsh shows the full face of the bat and lofts him nice and clean, one bounce into the long-on boundary"
428,"Barinder Sran to Maxwell, 1 run bunts it down to third man, sensible stuff"
429,"Barinder Sran to Marsh, FOUR runs beautifully struck down the ground. Poor ball and that has been easily hit back past the mid-on fielder. Lovely timing. Straight bat down to generate the power and timing"
430,"Sharma to Maxwell, FOUR runs improvisation at its best. Short ball on middle, Maxwell arches back and directs it over Dhoni's head. You can't seat a fielder for that stroke"
431,"Sharma to Maxwell, no run stands tall and punches it to mid-off"
432,"Sharma to Maxwell, 1 run plays that down to Sran at third man, quickly off the blocks on that occasion"
433,"Sharma to Marsh, no run gets half-forward and bunts it to point"
434,"Sharma to Marsh, 1 leg bye extra bounce this time, hits him high on the right thigh, and they take a leg-bye. A direct hit from Jadeja at the bowler's end would have been interesting"
435,"Sharma to Maxwell, 1 run angled into middle and leg, tucked to fine leg"
436,"Yadav to Maxwell, no run back of length delivery on off, punched to Kohli at cover"
437,"Yadav to Maxwell, 1 run forced off the back foot to deep point"
438,"Yadav to Marsh, no run closer to the stumps this time, length ball, played back to the bowler"
439,"Yadav to Marsh, no run looks to play a pull off the front foot, toe ends it to mid on"
440,"Yadav to Marsh, FOUR runs that's what annoys Dhoni the most about Umesh. Short and angling down leg, he helps it on its way into the fine leg boundary. Long hop that deserved to be put away"
441,"Yadav to Marsh, FOUR runs another poor ball. Result the same. Down leg side, tickled into the fine leg boundary. Umesh quickly looks away even as a helpless Dhoni gestures towards him"
442,"Barinder Sran to Maxwell, no run sliding into middle, looks to tuck it past square leg, misses"
443,"Barinder Sran to Maxwell, no run full on off from wide of the crease, nips away a touch, Maxwell's squared up as he defends"
444,"Barinder Sran to Maxwell, 2 runs plays a half-pull down to Dhawan at fine leg, was cramped for room but went through with the stroke"
445,"Barinder Sran to Maxwell, 1 run runs it down to third man"
446,"Barinder Sran to Marsh, no run angles it full once again, touch of movement as well, played back down the pitch"
447,"Barinder Sran to Marsh, 2 runs flays that one to deep cover, excellent running between the wickets"
