,Data
189,"Nurse to Smith, 1 run short of a length on off, backs away to cut behind point."
190,"Nurse to Carey, no run short outside off and spinning away, Carey tried to swat that wide of midwicket but Russell dives to turn four into one."
191,"Nurse to Carey, 1 run full on leg stump, driven to long-on."
192,"Nurse to Smith, 1 run full on off, quicker ball at 57 mph, Smith nudges in front of point for a quick run."
193,"Russell to Smith, no run 129kph, full, driven back to the bowler"
194,"Russell to Smith, no run 129kph, good length, nipping back, he's covering up in defence"
195,"Russell to Smith, 1 run 132kph, good length on off, he pushes this slowly to mid on who is back on the circle and they take an easy one"
196,"Russell to Carey, OUT caught behind! Dre Russ does the trick! 132kph, good length, angled across and running away off the seam, Carey caught on the crease, pushes away from the body and gets a thin edge through to Hope! Huge breakthrough that for West Indies."
197,"Russell to Coulter-Nile, no run 139kph, good length tailing he leaves and it nearly lights up off stump! So close to hitting!"
198,"Russell to Coulter-Nile, 1 run attempted pull pops up but falls safe! Like Maxwell he takes on the short ball second ball, gets onto him way too quickly, pops up off the top edge but it lands safely behind square as the keeper and forward square converge"
199,"Thomas to Coulter-Nile, no run full toss on leg, he clips it to forward square"
200,"Thomas to Coulter-Nile, no run full and tailing in, he drives towards mid off"
201,"Thomas to Coulter-Nile, no run 131kph, shorter into the hip, he's tied up, trying to work to leg, he gets a leading edge, it pops up but lands safely again"
202,"Thomas to Coulter-Nile, no run 130kph, bouncer, seemed quicker, he ducks underneath it well enough"
203,"Thomas to Coulter-Nile, 1 run 133kph, full and tailing into off, his head falls a touch, he squeezes it off the inside edge onto pad and rolls away, Smith is aware and calls him through"
204,"Thomas to Smith, no run back of a length, climbs and blows his glove off the bat handle! He reacted theatrically as that reared from a length. He knocked it down OK"
205,"Russell to Coulter-Nile, no run 133kph, good length, top of off, he drives on the up to point but it's well cut off by Pooran to keep Coulter-Nile on strike"
206,"Russell to Coulter-Nile, 1 run full, a half-volley, he drives wide of mid off and goes with the stroke, Holder makes a good diving stop to save multiple runs"
207,"Russell to Smith, no run very full, he sits back and whips it to wide mid on but can't beat the man"
208,"Russell to Smith, no run bouncer, not as much bounce as earlier, he ducks under it easily"
209,"Russell to Smith, no run 132kph, back of a length, some extra bounce, he's back and across and defending"
210,"Russell to Smith, 3 runs 132kph, back of a length, some width offered, he caresses a lovely back foot drive through the vacant cover region, it runs over the practice pitches and they get three"
211,"Thomas to Smith, 1 run 138kph, good length, angled down leg, he closes the face early, gets a leading edge that runs through gully"
212,"Thomas to Coulter-Nile, FOUR runs incredible squeeze down the ground! It was almost a yorker, he jammed the bat down and timed the pants off it, it raced past the stumps, straight of mid on and ran away"
213,"Thomas to Coulter-Nile, 2 runs shorter length, he pulls in the air but well enough over midwicket for a couple"
214,"Thomas to Coulter-Nile, 1 wide 138kph, sprayed way down the leg side"
215,"Thomas to Coulter-Nile, no run good length, off stump line, he pushes on the front foot to mid off"
216,"Thomas to Coulter-Nile, FOUR runs flicked in the air just fine of deep backward square! 140kph, half volley angled down leg, he flicked it high in the air but it was in the gap between fine leg and deep square and found the rope"
217,"Thomas to Coulter-Nile, 1 run shorter into the hip, he pulls well with control wide of fine leg"
218,"Russell to Coulter-Nile, no run good length, fifth stump line, he tries to cut but is too close to it and plays over the top of it"
219,"Russell to Coulter-Nile, no run 111kph short slower ball outside off, he sits and waits and waits and misses the cut shot"
220,"Russell to Coulter-Nile, FOUR runs hooked fine! 137kph well directed bouncer, he takes it on and gets the hook off the top edge and it flies fine of fine leg for four"
221,"Russell to Coulter-Nile, 1 wide high bouncer, 132kph, and rightly called wide. Way too high"
222,"Russell to Coulter-Nile, 1 wide another bouncer that is way too high"
223,"Russell to Coulter-Nile, 2 runs launched high over mid on, miles in the air but he didn't time it well enough to find the rope, it pitched well short and he gets two"
224,"Russell to Coulter-Nile, no run 140kph, cracking yorker, tailing into middle, equally well dug out"
225,"Russell to Coulter-Nile, 1 run 138kph, back of a length on off, he chops it off inside edge onto pad and it rolls away into the off side, Smith is awake and he pinches one"
226,"Cottrell to Coulter-Nile, 1 run 130kph, attempted yorker, on off, hint of shape, he chops down on it and runs it behind point for a single"
227,"Cottrell to Smith, no run nearly caught down leg but it just fell short! Shorter length down leg, he gloved it trying to glance fine but it just bounced short of the diving Hope"
228,"Cottrell to Smith, no run good length, 127kph angled across, he leans back and flays a back foot drive straight to cover"
229,"Cottrell to Smith, FOUR runs short and wide, he late cuts off the bottom edge fine of third man and a horrible misfield allows four!"
230,"Cottrell to Smith, no run Shorter length, he's back and defending into the off side"
231,"Cottrell to Smith, 1 run 133kph, good length, he pushes on the up to mid on on the circle, takes on Brathwaite's throw, he hits but Smith was nearly past the stumps"
232,"Russell to Smith, no run 136kph, back of a length, extra bounce, he's surprised a touch driving off the back foot to mid off"
233,"Russell to Smith, 1 run slower ball, wide of off, 123kph, he's back and working this with supple wrists behind square"
234,"Russell to Coulter-Nile, no run An LBW appeal but he might have got an inside edge. Not out is the call. It was angling down and might have been too high"
235,"Russell to Coulter-Nile, FOUR runs hooked in the air but into the gap between fine leg and deep square! It wasn't controlled but it found the gap again"
236,"Russell to Coulter-Nile, 2 runs slower ball outside off, he swings hard, dragging a mistimed strike through midwicket for a couple"
237,"Russell to Coulter-Nile, 1 run short ball, he swivels inside the line, rolls the wrists and controls this down to fine leg"
238,"Cottrell to Coulter-Nile, 1 run 137kph, full outside off, he swings hard and gets a thick inside edge past the stumps and it flies down to fine leg"
239,"Cottrell to Smith, no run good length, angled into off, he pushes from the crease to cover"
240,"Cottrell to Smith, no run 136kph, shorter length, angled down leg, he steps inside and tries to pull fine but misses. It's not a wide. Good call. Almost over leg"
241,"Cottrell to Smith, 2 runs back of a length outside off, he forces off the back foot through cover-point and they get an easy two"
242,"Cottrell to Smith, 1 run shorter length, into the chest, he's inside the line, tucking it behind square for a single"
243,"Cottrell to Coulter-Nile, 1 wide 136kph, angled down the leg side and called a wide"
244,"Cottrell to Coulter-Nile, 1 run good length, angled into off, he defends with soft hands into the off side and they pinch one"
245,"Russell to Coulter-Nile, no run 138kph, back of a length, he pushes off the back foot to backward point"
246,"Russell to Coulter-Nile, no run slower ball, 116kph, he defends from the crease"
247,"Russell to Coulter-Nile, no run high bouncer, he tries to hook fine but is beaten by the bounce. Not called wide"
248,"Russell to Coulter-Nile, SIX runs flicked over square leg! A gift. Length ball on the pads and he picks it up and flicks this over deep square into the crowd!"
249,"Russell to Coulter-Nile, no run 135kph, angled into the pads, he's taken on the pad and it rolls away"
250,"Russell to Coulter-Nile, 1 run 135kph, high bouncer, he pulls, not in control but he didn't thrash at it, and the lack of power ensure it dropped well short of deep square"
251,"Nurse to Coulter-Nile, 1 run full on leg, he's back and knocking this behind square"
252,"Nurse to Smith, 1 run drifting across, shorter, he's back and late cutting to short third man"
253,"Nurse to Coulter-Nile, 1 run drifting outside off, he pushes off the front foot with an open face to short third man. Gayle wanders across to field and gets a huge cheer"
254,"Nurse to Smith, no run full on middle, he drives back to the bowler"
255,"Nurse to Smith, no run tossed up, he drives powerfully but Nurse fields well in his follow through"
256,"Nurse to Smith, 1 run driven firmly to long on"
257,"Brathwaite to Smith, 1 run very full on middle, flicked to long-on."
258,"Brathwaite to Coulter-Nile, FOUR runs low full toss on the pads, wristily flicked over midwicket, beats deep square leg trying to cut it off."
259,"Brathwaite to Coulter-Nile, 1 run slower ball lands full on fourth stump, keeps the hands back to slice this fine to third man on the rope."
260,"Brathwaite to Smith, no run fullish length on off, pushed to point."
261,"Brathwaite to Smith, 1 run fullish length angled in on fourth stump, guided with an open face to third man."
262,"Brathwaite to Coulter-Nile, 1 run full on leg stump, clipped square to deep fine leg."
263,"Nurse to Coulter-Nile, 1 run fullish length on fourth stump, pushed through the covers."
264,"Nurse to Smith, 1 run full on leg stump, whipped through midwicket."
265,"Nurse to Coulter-Nile, 1 run nearly a runout! Good length ball on the legs tucked off the pads to the man at 45 on the ring, Smith called for a single immediately. Coulter-Nile was ball-watching before setting off, barely beats the relay as Nurse fumbles the collection."
266,"Nurse to Smith, no run full and driven to extra cover."
267,"Nurse to Smith, no run quicker ball full on middle stump, defended."
268,"Nurse to Smith, 1 run flighted on off at 58 mph, driven to long-off."
269,"Brathwaite to Smith, no run good length ball on middle, slower delivery at 111 kph/69 mph, flicked straight to midwicket."
270,"Brathwaite to Smith, 1 wide bouncer down leg, called wide comfortably on the line. 20 wides now in the innings."
271,"Brathwaite to Smith, FOUR runs short of a length on fifth stump, flashes at it and a thick edge goes well wide of Shai Hope fine of third man to the rope."
272,"Brathwaite to Smith, 1 run fullish length on off, shuffles across and whips through midwicket."
273,"Brathwaite to Coulter-Nile, 2 runs slower ball on off stump on a good length, pulled high over midwicket, not timed well but lands safely between deep square leg and long-on, it brings up Coulter-Nile's maiden ODI fifty!"
274,"Brathwaite to Coulter-Nile, SIX runs tasty buffet bowling! Shin high full toss on middle, Coulter-Nile drives through the line scooping it well over the rope at long-on."
275,"Brathwaite to Coulter-Nile, 1 run good length ball angled into off stump, guided with an open face to third man."
276,"Nurse to Coulter-Nile, FOUR runs shuffles across his stumps, flicks a scoop fine past Hope. Coulter-Nile growing in confidence."
277,"Nurse to Coulter-Nile, 1 wide fuller and quicker down leg, 21st wide of the innings."
278,"Nurse to Coulter-Nile, 1 run dropped! Hetmyer shells it! Quicker ball lands short on middle, flat pull by Coulter-Nile didn't get the elevation to clear Hetmyer at deep midwicket. He comes in 12 yards from the rope and slides on his knees to cushion the take but it ricochets out. His body wasn't balanced as well as it could've been."
279,"Nurse to Smith, 1 run full on off, driven to long-off."
280,"Nurse to Coulter-Nile, 2 runs full and wide, drives in the air wide of long-off for an easy pair."
281,"Nurse to Coulter-Nile, 1 run full on the legs, clipped to deep midwicket."
282,"Nurse to Smith, 1 wide full and spinning past the legs. 22 wides and counting...."
283,"Nurse to Smith, 1 run fullish on fourth stump, Smith charges and checks a push through cover."
284,"Thomas to Smith, FOUR runs full outside off, lofted drive over wide mid-off. Elegant!"
285,"Thomas to Smith, OUT Cottrell with a screamer! No turf trolls eating him up this time at long leg! Fullish length on a fifth stump line. Smith shuffles across once more to flick this high over backward square, Cottrell made an absolute mess of a chance on 26 in an identical slot, this time sprints along the rope 20 yards moving left at full speed and stabs at it with his left hand, knifing it out of the air, then flicks it up before stepping over the rope before reclaiming it after reestablishing himself inside the field of"
286,"Thomas to Coulter-Nile, 1 wide wide yorker, too wide to play at."
287,"Thomas to Coulter-Nile, 1 wide length ball outside off, again just outside the guidelines and evades the drive from Coulter-Nile."
288,"Thomas to Coulter-Nile, 1 run short outside off, flat-batted to long-on."
289,"Thomas to Cummins, no run short on fifth stump, Cummins sways away."
290,"Thomas to Cummins, no run fullish length on fifth stump, Cummins wafts and misses."
291,"Thomas to Cummins, no run yorker on off, dug out back to Thomas."
292,"Cottrell to Coulter-Nile, 1 run full on the legs, flicked to Gayle at short fine leg, swan dive to stop and gets on his knees to soak up the adulation from the crowd."
293,"Cottrell to Cummins, 1 run fullish length angled into off stump, chopped off the back foot to third man."
294,"Cottrell to Coulter-Nile, SIX runs dropped! Very harsh but it did ricochet off Brathwaite's hand at deep square leg and then hit the rope on the full for six. Shortish length on off stump, Coulter-Nile laces a scorching pull toward Brathwaite at deep square leg, just evades his grasp running to his left and sliding at the last moment. After the take that Cottrell just had in the previous over, the fans and teammate's must be wondering why Brathwaite couldn't match him! But it was 10/10 on the degree of difficulty scale."
295,"Cottrell to Coulter-Nile, SIX runs highest score now by a No. 8 in a World Cup! In the slot outside off, drives through the line 15 yards into the stands over long-on."
296,"Cottrell to Coulter-Nile, 1 run short outside off, slapped to long-off."
297,"Cottrell to Cummins, 1 run fullish length outside off, pushed to extra cover, good stop by Nurse moving left to keep it to one."
298,"Brathwaite to Cummins, OUT slower bouncer, Cummins struggles keeping his hands back going to pull, skies it to deep square leg, Cottrell settles under it 10 yards in from the rope. This was 3/10 on the difficulty scale compared to the absurd one-hander he took to dismiss Smith."
299,"Brathwaite to Coulter-Nile, FOUR runs full and very wide, dips the back knee to get under this and carve it over extra cover. Exquisite."
300,"Brathwaite to Coulter-Nile, FOUR runs slower ball lands too short, sits up at 67 mph and scorches a pull between deep midwicket and deep backward square."
301,"Brathwaite to Coulter-Nile, 1 run wide yorker, dug out to long-off."
302,"Brathwaite to Starc, no run bouncer, beaten hooking."
303,"Brathwaite to Starc, no run slower bouncer this time, bottom edges a pull down the leg side collected by Hope."
304,"Thomas to Coulter-Nile, no run wide yorker, inside edge dragged to Gayle at short fine leg."
305,"Thomas to Coulter-Nile, no run full and wide, thick edge driving but it doesn't carry to Hope."
306,"Thomas to Coulter-Nile, 1 run another wide yorker, dug out off the toe to long-off. Coulter-Nile checks the toe of his bat to see if it has 10 more runs in it to take him to a maiden ODI ton."
307,"Thomas to Starc, no run short on the body, goes to pull, off the glove before bouncing short of Hope. Does well to save four."
308,"Thomas to Starc, 2 runs very full on the legs, clipped behind square, relay comes in from long leg running right."
309,"Thomas to Starc, 2 runs full and wide, driven in the air toward Hetmyer at mid-off, he dives right to knock it down but not cleanly enough to prevent a second run. It means Coulter-Nile will be on strike for the next over."
310,"Brathwaite to Coulter-Nile, 2 runs full and wide, Coulter-Nile misses a drive, but Hope fumbles the take. Universe Boss makes a galaxy sprint from short third man to relay back in. He's holding his left hammy now. Given as runs by the umpire instead of byes."
311,"Brathwaite to Coulter-Nile, OUT Coulter-Nile falls four short of breaking the record for a No. 8 in ODIs! It was in the slot outside off, he went for glory trying to clear Holder at wide long-off but got under it just a bit too much. The bat turned on connection too so wasn't timed as well as he wanted. In the air for awhile before coming down to the West Indies captain three yards inside the rope."
312,"Brathwaite to Starc, no run slower bouncer, Starc is early trying to pull at 78 mph."
313,"Brathwaite to Starc, FOUR runs another short ball, this time Starc crunches it sweet through midwicket."
314,"Brathwaite to Starc, no run bouncer on the body, late hooking. No wide called on the line down leg. Ball passed over leg stump."
315,"Brathwaite to Starc, OUT Brathwaite rewarded for pitching it up again, in the slot on off, Starc tried to heave it over Holder at wide long-on but didn't get under it enough and the tallest man on the field has no issues claiming this one roving left a few yards inside the rope at chest height."
316,"In spite of that earlier misjudged chance by Cottrell, he made up for it later with this stunner to finally claim Smith at deep fine leg. Watch Sheldon Cottrell's sensational catch on the boundary. It came after Smith and Alex Carey initially led Australia's fightback to dig out of a major hole at 79 for 5. Watch how Smith and Carey put Australia back in the game (UK, IRE, AUS only)."
317,"2.18 pm Australia end an over short, but a brilliant fightback nonetheless led by Smith and Coulter-Nile. West Indies paid for some inconsistent fielding though. Smith arguably should have been caught at deep fine leg on 26 but Cottrell misjudged the chance and Coulter-Nile was also grassed on a much simpler effort by Hetmyer on 61 at deep midwicket. The wides were also costly too, releasing the pressure after West Indies had Australia under the pump. Can West Indies chase this down? See what our MatchDay studio panel has to say."
318,Gayle and Lewis walk out to open the chase. Starc over the stumps to Gayle with two slips in place.
319,"West Indies were favorites on the UK high street oddsmakers from the fifth wicket through the majority of the rest of the innings, but that Coulter-Nile rearguard has put Australia at 4/5 at the start of this chase to defend 288, for people into that kind of thing...."
320,"Starc to Gayle, 5 wide good length and swinging down leg, it curls back to Carey at head height and he fumbles it all the way to the rope for five wides."
321,"Starc to Gayle, 1 run good length on the legs, clipped behind square."
322,"Starc to Lewis, 1 run good length on the legs again, flicked to long leg. Cut off by Zampa."
323,"Starc to Gayle, no run short of a length on off, no swing, defended on the back foot."
324,"Starc to Gayle, no run short and very wide outside off, left alone, just inside the guidelines."
325,"Starc to Gayle, no run full on the stumps, defended."
326,"Starc to Gayle, no run fullish length on fifth stump, no swing, left alone."
327,"Cummins to Lewis, no run fullish length angled across fourth stump, Lewis shoulders arms."
328,"Cummins to Lewis, no run fullish length on fourth stump again, this time sucked into a flat-footed drive, beats the edge."
329,"Cummins to Lewis, no run overpitched on off, touch of swing in, driven to mid-on."
330,"Cummins to Hope, no run full on the legs, whipped straight to Coulter-Nile at midwicket. Gimme ball and couldn't put it away."
331,"Cummins to Hope, no run stays low and nearly bowled! Good length ball pitching on about fifth stump and angled in, Hope goes back and it doesn't bounce as much as he thought it would at 86 mph, the ball coos into the ear of off stump. No kissing though..."
332,"Starc to Gayle, no run good length on off, defended to cover."
333,"Starc to Gayle, no run nearly a catch! Short and wide, Gayle rocks back to cut, it was in the air for awhile, but Stoinis is a bit too square at cover for the chance, he dives right to knock it down at the very least on the short hop."
334,"Starc to Gayle, no run short outside off on fourth stump, Gayle goes to pull and plays over the top of it."
335,"Starc to Gayle, FOUR runs another one clips the edge but goes safe over Carey! Rip-snorter from Starc! Short ball angled into the body from off stump, Gayle tries to get the hands behind it on the back foot and it climbs sharply , clips the shoulder of the bat and takes off over Carey's leaping effort to the rope."
336,"Starc to Gayle, no run given out but Gayle reviews immediately! Fullish length on fourth stump angled in, Gayle is late driving as there was a definite noise when it passed the stumps... because the ball has in fact shaved off stump. A little peck! The baby smooch! Not a full pucker to dislodge the bails though. Incredible!"
337,"Starc to Gayle, 1 wide short and wide outside off, too wide to play."
338,"Starc to Gayle, no run yorker nails Gayle on the toes and he's given out but Gayle challenges umpire Chris Gaffaney's judgment once more with a review! It was tailing in and hits him on the front pad ricocheting to the back foot, initial impact was showing it was tailing down leg. Sure enough ball-tracking shows the impact was outside leg stump and continuing to go down. Gayle survives again."
339,"Cummins to Hope, no run good length ball defended to point."
340,"Cummins to Hope, 1 run fullish length on middle, clipped to long leg."
341,"Cummins to Gayle, FOUR runs mini charge from Gayle to a full length ball on off, carved over mid-off. Gayle brings up 1000 runs in World Cup matches."
342,"Cummins to Gayle, FOUR runs length ball on middle, Gayle heaves this over midwicket. The crowd roars with delight."
343,"Cummins to Gayle, 2 runs another length ball angled a touch wider on off, heaves across the line again but doesn't time it. More of a top edge that swirls safely over mid-on for a pair."
344,"Cummins to Gayle, FOUR runs short outside off again, Gayle rolls the wrists this time over a pull and creams it wide of mid-on."
345,"Starc to Hope, no run full on the legs, clipped to square leg."
346,"Starc to Hope, no run full and angled across middle and off at 90 mph/146 kph, pushed back down the pitch."
347,"Starc to Hope, 1 wide short and well down leg, Carey does well to save it from being five wides."
348,"Starc to Hope, 1 run full on the legs, clipped to long leg."
349,"Starc to Gayle, 2 runs yorker on leg stump, stabbed out behind square and they come back for an easy pair as deep square leg who was quite fine circles around to relay it in."
350,"Starc to Gayle, OUT stone dead this time around! Starc couldn't pierce Gayle with the yorker on the previous ball but this time around Gayle is late getting the bat down on an 86 mph delivery pitching very full and hitting him low on the shin in front of middle. After waiting 12 seconds while chatting with Hope, Gayle finally calls for the review.... Ball-tracking confirms it was clipping leg-stump on umpire's call. Three strikes (on DRS) and you're out! West Indies retain their review though."
351,"Starc to Pooran, no run fullish length on fourth stump, defended behind point."
352,"Cummins to Hope, no run good length jagging back on middle, Hope cramped for room trying to get this away."
353,"Cummins to Hope, no run full on fourth stump, strong forward stride driving to extra cover."
354,"Cummins to Hope, no run bouncer angled down leg, Hope looks at square leg for the height but it's not called wide on that or on the line."
355,"Cummins to Hope, no run full on off, driven to mid-off, acrobatic stop on the ring."
356,"Cummins to Hope, no run bouncer again, angled at the body, Hope ducks again."
357,"Cummins to Hope, no run short of a length on off, defended into the ground."
358,"Starc to Pooran, FOUR runs overpitched on fifth stump, lovely flourish from Pooran to get off the mark with a sweet drive through the covers."
359,"Starc to Pooran, 2 runs overpitched tailing into middle at 89 mph/144 kph, flicked wide of mid-on, dragged back at the rope to keep it to two."
360,"Starc to Pooran, FOUR runs overpitched and tailing into middle again, Starc continues to search for the yorker at 93 mph but Pooran is up to the task whipping it past Coulter-Nile at square leg in the ring."
361,"Starc to Pooran, no run short of a length on off, defended on the back foot to cover."
362,"Starc to Pooran, no run short of a length on off again, guided with soft hands to backward point."
363,"Starc to Pooran, no run fullish length on off, driven to mid-off."
364,"Coulter-Nile to Hope, no run full on off, driven firmly but straight to extra cover."
365,"Coulter-Nile to Hope, no run short of a length on off, punched off the back foot to Stoinis again in the covers. Diving stop with his right hand."
366,"Coulter-Nile to Hope, 1 run fullish length on off, flicked off the back foot wide of mid-on."
367,"Coulter-Nile to Pooran, no run short angled across off, goes to pull but nubs this into the ground to midwicket."
368,"Coulter-Nile to Pooran, FOUR runs short on off, sits up at 85 mph/136 kph, swatted with disdain over midwicket. Authoritative pull."
369,"Coulter-Nile to Pooran, FOUR runs Coulter-Nile screams 'hit me!' once again with the same length. Short on off, sits up for a punishing pull over wide mid-on."
