,Data
210,"Steyn to Johnson, 1 wide inches away from the legstump, but that's wide enough to be an illegal delivery"
211,"Steyn to Johnson, OUT full ball from Steyn, not much footwork from Johnson as he tried to smear it through the offside, gets a faint edge through to the keeper, big appeal from Boucher, Johnson doesn't wait for the umpire's decision and decides to walk"
212,"Steyn to Hauritz, FOUR runs scorcher of a delivery first up, 151.1 kmph, that was short, Hauritz manages to get his bat in the way, a thin edge goes past the keeper and runs away for four"
213,"Steyn to Hauritz, no run another bouncer, Hauritz hops onto the backfoot and defends, the ball hits bat around face-high, the bottom hand came off as Hauritz defended"
214,"Steyn to Hauritz, 2 runs fuller this time, Hauritz nicks it again, this time thick enough for third man to come around and cut it off"
215,"Steyn to Hauritz, 1 run length ball outside off, 152kmph, Hauritz jabs it towards point for a single and keeps the strike"
216,"Morkel to Hauritz, 1 run Hauritz steers the ball towards point, just as he did in the previous ball, to give Hussey the strike"
217,"Morkel to Hussey, FOUR runs superb from Hussey, full and wide of offstump, but Hussey loves hitting it over midwicket and that's where he hits it"
218,"Morkel to Hussey, no run similar delivery, pitches behind the stump outside off, Hussey was aiming for mid-on to midwicket again but misses the ball"
219,"Morkel to Hussey, no run low full toss again from Morne, Hussey's thrash goes back to the bowler"
220,"Morkel to Hussey, SIX runs Shot! another full toss, was a bit higher this time allowing Hussey to get under it, boy did he did that, it goes twenty rows back over long-on"
221,"Morkel to Hussey, 1 run another full toss, driven forcefully to long-off by Hussey, the single lets him retain the strike"
222,"Botha to Ferguson, 1 run fullish and well outside off, Ferguson plays a paddle sweep for a single"
223,"Botha to Hussey, 1 run length ball on offstump, Hussey gets across his stumps and turns it behind square on the leg side"
224,"Botha to Ferguson, 1 run dabbed in front of point for a single"
225,"Botha to Hussey, no run forcefully driven towards extra cover, a diving de Villiers doesn't give away any runs"
226,"Botha to Hussey, 1 run"
227,"Botha to Ferguson, 1 run played with soft hands towards point, nicely done by Ferguson, that's another single"
228,"Duminy to Ferguson, 1 run quicker one down the legside, Ferguson sweeps it fine for a single"
229,"Duminy to Hussey, 1 run played to fine leg for another single"
230,"Duminy to Ferguson, 2 runs Ferguson gets on the front foot and drives it uppishly towards long-off, placed to the left of the fielder, and they get a couple"
231,"Duminy to Ferguson, no run an ugly, forcing shot which is mistimed back to the bowler"
232,"Duminy to Ferguson, no run driven with more conviction back to the bowler"
233,"Duminy to Ferguson, 1 run overpitched on middle and leg, whipped behind square for a single"
234,"Steyn to Hussey, no run shortish and wide, 146kmph, Hussey tried to crash that past point, doesn't connect, lucky to get away with that one Steyn"
235,"Steyn to Hussey, FOUR runs a bit fuller from Steyn, Hussey moves to the leg side, hits it over cover, Duminy gives chase but can't cut it off"
236,"Steyn to Hussey, 1 run yorker length ball, just outside off, Hussey powers it to extra cover for a single"
237,"Steyn to Hauritz, no run dot ball, shortish, holds it line after pitching just outside off, Hauritz can't get any bat on that one"
238,"Steyn to Hauritz, 1 run short and wide from Steyn, Haurotz throws his bat at it, gets a top edge which balloons towards Ntini at third man, but it lands well short and goes on the bounce to Ntini"
239,"Steyn to Hussey, no run superb yorker, 145kmph, on middle and leg, cramped Hussey for room, and he can only stab it back to the bowler, that means Hauritz will be on strike when the final over starts"
240,"Ntini to Hauritz, FOUR runs slow full toss outside off, seemed to have fooled Hauritz, but he manages to toe end it, it races away fine for a boundary"
241,"Ntini to Hauritz, 1 run this one is on a length, but wide enough for Hauritz to free his arms, he slaps it to the sweeper for a single"
242,"Ntini to Hussey, SIX runs he needn't have bothered, that was a massive six, it was a short of length ball, pitching middle and angling away, Hussey gets on the front foot and gets under that one, absolutely hammered over long-on, even bigger than the previous six"
243,"Ntini to Hussey, 1 run low full toss well outside off, Hussey doesn't care, he's going to smash everything between long-on and midwicket, doesn't get hold of it this time, lobs towards mid-on, Albie dives but can't get there in time"
244,"Ntini to Hauritz, FOUR runs another low full toss, Hauritz slams it down the ground, so straight that the fielder can't get round to cut it off"
245,"Ntini to Hauritz, 2 runs chipped inside-out this time by Hauritz, that fetches him a couple, Hauritz has played a good hand here, 20 off 11 balls"
246,"This is Siddarth Ravindran, with Raju doing the scoring. We'll be back in a bit for the chase."
247,"It's still a pretty good pitch to bat on, and this should be a cracking contest, particularly with Smith v Johnson at the top."
248,"For South Africa, Johan Botha was immaculate again, the quick bowlers were impressive early on but leaked too many at the death."
249,"So Australia finish with a respectable 286. Michael Hussey has had a bit of a rough time lately, but he was back at his best today. There were plenty of cameos as well to help Australia recover from a slow start. Brad Haddin was scratchy but got some valuable runs at the top,"
250,Smith and Amla stride out. Amla to face the first ball from Johnson
251,"Johnson to Amla, no run Full and moves a touch inwards, Amla plays an elegant flick, but straight to square leg, no run"
252,"Johnson to Amla, 1 wide whoah, that was very wide outside off"
253,"Johnson to Amla, no run back of a length, on offstump, Amla gets back and defends solidly towards extra cover"
254,"Johnson to Amla, no run fuller and just a bit of width for Amla, a forceful square drive, doesn't beat Michael Clarke at point, that was 147kmph"
255,"Johnson to Amla, no run good line from Johnson, in the corridor outside off, Amla watchfully shoulders arms to that one"
256,"Johnson to Amla, no run this came back in a long way, Amla didn't have too much of a clue about that, rapped on the pads, that was a touch too high though"
257,"Johnson to Amla, 1 run fullish from Johnson this time, Amla mistimes a drive towards mid-on to get a single and keep the strike"
258,"Bracken to Amla, no run starts off with a ball that angles across Amla, who doesn't offer a shot and watches it through to the keeper"
259,"Bracken to Amla, no run and again, this time closer to the offstump, Amla gets on the front foot but lets it go again"
260,"Bracken to Amla, 1 run shorter from Bracken, Amla quickly hops onto the backfoot and lashes that behind point for a single"
261,"Bracken to Smith, no run back of a length, pitching outside off and goes on with the angle, Smith plays inside the line and is beaten"
262,"Bracken to Smith, 1 run similar line from Bracken, Smith walks across the stumps and nudges it behind square leg for a single"
263,"Bracken to Amla, no run length ball from Bracken, Amla tries to crash it through covers but doesn't beat the field"
264,"Johnson to Smith, 1 run that was a wild delivery, low full toss going down leg, Smith gets some bat on it, guiding it to fine leg for a single"
265,"Johnson to Amla, 1 run this was wide outside off, Amla flashes at it, it flies uppishly towards third man, where the fielder runs across to his right to cut it off"
266,"Johnson to Smith, no run Smith defends it cautiously to the leg side"
267,"Johnson to Smith, FOUR runs tests him with a short ball, Smith isn't worried about the fingers he had broken, he hooks Johnson off the front foot for a boundary"
268,"Johnson to Smith, 1 run fuller on middle and leg, Smith taps it wide of mid-on for a single"
269,"Johnson to Amla, 1 wide this time Johnson strays down the leg side, Amla has a swish at it but doesn't connect, that's deemed a wide"
270,"Johnson to Amla, no run much better from Johnson to end the over, just short of a length, slanting across Amla, who slaps it towards cover"
271,"Bracken to Smith, 1 run fullish and on middle and leg, driven to mid-on by Smith for a single"
272,"Bracken to Amla, FOUR runs length ball on the pads, Amla is on to it in a flash, whips it away to the square leg boundary"
273,"Bracken to Amla, OUT Amla's walked, extraordinary scenes here, it was wide outside off, Amla opened the face to glide it to third man, it goes through to the keeper, who barely appeals, there's a half-hearted shout from first slip as well, Amla didn't wait for the verdi"
274,"Bracken to Gibbs, no run length ball, on offstump, Gibbs gets forward and defends awkwardly"
275,"Bracken to Gibbs, 1 run opens the face and steers the ball to third man, works that one with the angle to get off the mark"
276,"Bracken to Smith, no run cautiously prodded towards cover by Smith, no run there"
277,"Johnson to Gibbs, no run fullish delivery from Johnson, square driven by Gibbs, straight to the fielder at point"
278,"Johnson to Gibbs, no run slower ball from Johnson, 127kmph, Gibbs was initially interested in that one but withdraws his bat at the last moment"
279,"Johnson to Gibbs, no run length ball, angling across Gibbs, he gets forward and defends it towards cover"
280,"Johnson to Gibbs, no run same length, but this time Johnson has it headed for middle and leg, Gibbs had to make a late adjustment to nudge the ball towards square leg"
281,"Johnson to Gibbs, FOUR runs poor ball from Johnson, short and wide, Gibbs says thank you very much and slams it uppishly through point for a boundary"
282,"Johnson to Gibbs, no run Johnson comes back with a peach, just a bit of movement into Gibbs, who offers a half-hearted forward defence, but is beaten"
283,"Bracken to Smith, no run angled into the pads, flicked towards midwicket, straight to the fielder, no run there"
284,"Bracken to Smith, no run full on middle and leg, Smith gets on the front foot and defends back to the bowler"
285,"Bracken to Smith, no run punched towards the covers, that's another dot ball"
286,"Bracken to Smith, FOUR runs Bracken sends it down at 123kmph, Smith wanted to force that past mid-off, gets an outside edge and the ball goes too fine for third man to cut it off"
287,"Bracken to Smith, 2 runs another edge for Smith, this time he wanted to get it towards midwicket, but the ball flies towards extra cover"
288,"Bracken to Smith, 1 run played with more conviction by smith this time, Bracken drops it slightly short, Smith gets on the back foot and nurdles it behind square leg"
289,"Johnson to Smith, no run big appeal for lbw, that was overpitched and hit Smith on the pads, but that was slanting down the legside"
290,"Johnson to Smith, no run driven to mid-off by Smith"
291,"Johnson to Smith, no run a wild heave from Smith, a slow bouncer from Johnson, Smith was through with the shot before the ball arrived"
292,"Johnson to Smith, FOUR runs Johnson searching for the yorker, but ends up as a half-volley on legstump, Smith dispatches it to the square-leg boundary"
293,"Johnson to Smith, no run Johnson shifts his line to outside off, Smith punches that towards covers, doesn't get it past the field"
294,"Johnson to Smith, no run length delivery around offstump, Smith pushes it back past the bowler and mid-off has some fielding to do"
295,"Bracken to Gibbs, no run Gibbs misses out on a legstump half-volley, he tried to whip that to sqaure leg but misses and is hit on the pads"
296,"Bracken to Gibbs, 2 leg byes another legstump ball, shorter this time, Gibbs gets some bat on it and it runs away fine on the leg side , Haddin and Michael Hussey make the long chase to retrieve the ball"
297,"Bracken to Gibbs, FOUR runs bang! smashed over the covers by Gibbs, that was fullish, and he took a big stride and smashed it, it was in the air and didn't beat the cover fielder by much"
298,"Bracken to Gibbs, no run a bit of movement into the batsman for Bracken, pitching about a foot outside off, Gibbs shoulders arms to that one"
299,"Bracken to Gibbs, no run similar ball, just a touch closer to the batsman, and Gibbs decides to offer his front foot defence to that one"
300,"Bracken to Gibbs, no run Bracken keeps pegging away around that offstump, Gibbs leaves that one alone, replays suggest there could have been a faint nick, but there wasn't much of an appeal from the Australians"
301,"Laughlin to Smith, 2 runs shortish ball, and a bit of width, Smith slaps it towards deep backward point for a couple"
302,"Laughlin to Smith, no run slanting across Smith, who gets on the front foot and defends it carefully"
303,"Laughlin to Smith, 1 run pushed to the offside with soft hands for a quick single"
304,"Laughlin to Gibbs, no run Gibbs gets behind the line of that one and defends"
305,"Laughlin to Gibbs, 1 run back of a length, on offstump, Gibbs defends it towards extra cover off the backfoot"
306,"Laughlin to Smith, 1 run walks across the stumps and turns it to square leg for a single to end the over"
307,"Bracken to Smith, FOUR runs overpitched and very wide from Bracken, Smith cracks that through the overs for a boundary, superbly timed by Smith"
308,"Bracken to Smith, no run shimmies down the wicket, whips an outside off delivery towards the leg side, no run though"
309,"Bracken to Smith, no run length ball, and a bit of width, crunched towards short cover by Smith"
310,"Bracken to Smith, 1 wide very wide from Bracken, Smith chases after it but doesn't make contact, the umpire deems it a 'wide'"
311,"Bracken to Smith, 1 run fullish ball again, Smith gets a big stride in and bunts it towards mid-off for a single that brings up South Africa's fifty"
312,"Bracken to Gibbs, no run outside the offstump, Gibbs shuffles across the stumps and defends it back down the pitch"
313,"Bracken to Gibbs, no run slanting across Gibbs, who decides to let that one go through to the keeper"
314,"Laughlin to Smith, no run slower ball, 111.4 kmph, good length, angling across Smith, who goes for the booming drive but doesn't connect"
315,"Laughlin to Smith, 1 run short ball this time, on middle and leg, Smith swivels as he pulls that to fine leg, only a single for a lot of effort"
316,"Laughlin to Gibbs, FOUR runs Shot! that was on a length, Gibbs comes down the track, plays it on the up, an inside out drive over the infield"
317,"Laughlin to Gibbs, 1 run similar delivery, Gibbs gets a thick inside edge towards square leg"
318,"Laughlin to Smith, 1 run shuffles across the stumps and nudges it behind square leg for a single"
319,"Laughlin to Gibbs, no run pitched up, Gibbs was again looking for the big drive, mistimes it towards the fielder at cover"
320,"Bracken to Smith, 1 run wide, length ball, Smith is content to drive away from the body, he slaps it through the covers"
321,"Bracken to Gibbs, 2 runs cheeky from Gibbs, that was lap swept from outside off, it's was running away very fine, Laughlin makes good ground and throws in a dive to keep the batsmen to two"
322,"Bracken to Gibbs, 2 runs tries to mow a short ball to midwicket, he toe ends and it swirls in the air but lands beyond the fielder running back from midwicket"
323,"Bracken to Gibbs, 1 run Gibbs gets a big stride in as drives towards mid-off for a single"
324,"Bracken to Smith, FOUR runs Smith shows Gibbs how to heave the ball toward midwicket, it was back of a length, Smith gets on the front foot, and slams it in front of deep midwicket"
325,"Bracken to Smith, 1 run slower ball from Bracken, deftly played towards third man by Smith, who has raced along to 36 off 34"
326,"Laughlin to Smith, 2 runs Laughlin again starts the over with a slower delivery, 113kmph, Smith looks to drive, gets an outside edge which trickles away fine, fetches Smith two"
327,"Laughlin to Smith, no run Smith starts moving away from the stumps early, Laughlin fires in a yorker which lands just outside off, Smith tries to squeeze that to point, doesn't get any bat on it"
328,"Laughlin to Smith, no run slower ball again, 113kmph, ends up as a high full toss, pushed back to the bowler by Smith"
329,"Laughlin to Smith, 1 run Smith gets forward and opens the face of the bat, steers it to square third man for a single"
330,"Laughlin to Gibbs, no run keeps it around the offstump, played plays it towards point"
331,"Laughlin to Gibbs, 1 run full on middle and leg, Gibbs drives it towards mid-on for a single"
332,"Hopes to Gibbs, no run starts off with a length ball on offstump, Gibbs square drives it forcefully, but placement is poor, straight at the fielder"
333,"Hopes to Gibbs, no run goes for a sweep from outside off, but gets beaten"
334,"Hopes to Gibbs, 1 run shortish from Hopes, a short-arm jab from Gibbs takes the ball behind square leg for a single"
335,"Hopes to Smith, 1 run Hopes keeps it steady, length ball around offstump, Smith plays with soft hands towards mid-off and the batsmen steal a single"
336,"Hopes to Gibbs, 1 run similar ball to Gibbs, he dabs it behind point for a single"
337,"Hopes to Smith, FOUR runs Smith carves it inside out over extra cover for a boundary, again wonderful timing from Smith"
338,"Laughlin to Gibbs, FOUR runs pitched up by Laughlin, Gibbs takes a leaf from Smith's books, beautifully timed cover drive which beats the man to the rope"
339,"Laughlin to Gibbs, FOUR runs this time it's the placement which catches the eye, it was a low full toss on legstump, Gibbs flicks it away to the boundary, bisecting midwicket and square leg"
340,"Laughlin to Gibbs, no run bouncer from Laughlin, Gibbs goes for the pull but doesn't make contact with the ball"
341,"Laughlin to Gibbs, no run defended towards point by Gibbs this time"
342,"Laughlin to Gibbs, 1 run overpitched on middle and leg, Gibbs gets on the front foot and turns it away towards midwicket"
343,"Laughlin to Smith, 1 wide Laughlin grunts as he sends down a bouncer, it's way over Smith's head and wqas down leg side, easy call for the umpire"
344,"Laughlin to Smith, no run slower ball, 110kmph, to end the over, Smith plays it cautiously towards cover"
345,"Hopes to Gibbs, 1 run back of a length and a bit of width, Gibbs stays in his crease and pushes it towards covers for a single"
346,"Hopes to Smith, 1 run much closer to the stumps this time, similar length though, Smith taps it towards mid-on for a single"
347,"Hopes to Gibbs, OUT Gibbs falls, not exactly the best of deliveries, short if a length and outside off, Gibbs throws his bat at that, hits it very well but Michael Clarke at point takes a good diving catch, that's the breakthrough Australia needed"
348,"Hopes to de Villiers, no run"
349,"Hopes to de Villiers, 1 run de Villiers gets off the mark with a flick behind square for a single"
350,"Hopes to Smith, no run length ball on offstump, Smith gets on the front foot and looks to defend, gets an inside edge towards backward square leg"
351,"Johnson to de Villiers, no run starts off with a length ball on off, Smith defends off the backfoot"
352,"Johnson to de Villiers, 1 run slower ball from Johnson, de Villiers turns it towards midwicket for a single"
353,"Johnson to Smith, 1 run fullish and fast, 142.2kmph, nearly managed to get it between bat and pad, Smith gets an inside edge on to his pads"
354,"Johnson to de Villiers, no run holds back the length a bit, outside off, de Villiers strokes it to point"
355,"Johnson to de Villiers, OUT de Villiers goes lbw, Asoka de Silva rules de Villiers out, there was a big inside edge on that one, it was a back of a length delivery, hit his pads in front of middle but there was bat involved before the ball hit pads, de Villiers can't b"
356,"Johnson to Duminy, 1 run full and slanting into the pads, 144kmph, Duminy gets off the mark by nurdling it towards square leg"
357,"Hauritz to Duminy, no run big appeal off the first ball, nicely tossed up, drifts in andd straightens, that was a close call"
358,"Hauritz to Duminy, no run defended watchfully off the front foot"
359,"Hauritz to Duminy, no run"
360,"Hauritz to Duminy, 1 run short and a touch wide, turned awqay from the batsman, cut towards point for a single"
361,"Hauritz to Smith, 1 run Smith walks across the stumps to sweep Hauritz fine, that will fetch him a single"
362,"Hauritz to Duminy, 1 run this time Duminy sweeps, he also picks up a single"
363,"Hopes to Duminy, no run Hopes starts the over with a back of a length ball just outside off, driven off the back foot to mid-on"
364,"Hopes to Duminy, no run lovely shot from Duminy for no runs, smashed straight down the ground and it crashes into the stumps at the non-striker's end"
365,"Hopes to Duminy, no run that ball was pretty close to the body, Duminy decided to go for the cut anyway, doesn't get hold of it"
366,"Hopes to Duminy, no run"
367,"Hopes to Duminy, 1 run opens the face and runs it to third man for a single"
368,"Hopes to Smith, no run good end to a good over, length ball and keeps it tight, just around off, smith defends it down the ground"
369,"Hauritz to Duminy, 1 run looks to turn it to the leg side, gets an edge and the ball squirts away towards point"
370,"Hauritz to Smith, 1 run flatter this time from Hauritz, Smith gets on his knee and slog-sweeps it to midwicket"
371,"Hauritz to Duminy, no run another leading edge for Duminy, this time he comes down the track to on-drive, and the ball balloons towards mid-off"
372,"Hauritz to Duminy, 1 run Duminy stays on the backfoot and cuts it behind point for a single"
373,"Hauritz to Smith, 1 run chopped powerfully past point for a single"
374,"Hauritz to Duminy, no run Duminy waltzes down the track and looks to defend, he is hit on the pad"
375,"Hopes to Smith, no run Hopes keeps pegging away at a good length, this time on middle and leg, smith pushes it towards short midwicket"
376,"Hopes to Smith, no run similar ball, Smith again prods it towards short midwicket, Laughlin does the fielding"
377,"Hopes to Smith, 1 run gives himself room to play the full ball, gets himself a single that brings up his fifty"
378,"Hopes to Duminy, 1 run length ball and Duminy pushes it to mid-on for a single"
379,"Hopes to Smith, 1 run Hopes holds back the length a touch, Smith delicately glides it to third man for a single"
380,"Hopes to Duminy, 1 run short ball on the legstump, a flamboyant pull from Duminy, but the placement isn't very good, straight to man at deep square led and he only gets a single"
381,"Hauritz to Duminy, 1 run Duminy gets a big stride in and sweeps towards fine leg"
382,"Hauritz to Smith, no run defended watchfully off the backfoot by Smith"
383,"Hauritz to Smith, 1 run Smith goes for the sweep again, gets a top edge which loops out of reach of the keeper"
384,"Hauritz to Duminy, 1 run Duminy has also decided to combat Hauritz with the sweep, this time he gets a single"
385,"Hauritz to Smith, no run"
386,"Hauritz to Smith, OUT Smith falls, big wicket for Australia, Hauritz hasn't been afraid to toss the ball up and he gets his reward, Smith was looking to play to the on side, gets a leading edge which results in a simple caught and bowled"
387,"Hopes to Duminy, no run Hopes continues his water torture, the same length, just outside off, Duminy chops it towards points"
388,"Hopes to Duminy, 1 leg bye on the pads this time, Duminy tips it to the leg side and the batsmen steal a single"
389,"Hopes to Boucher, no run Boucher defends watchfully off the backfoot, that was hopes again on a length around off"
390,"Hopes to Boucher, no run and again, no room for the batsmen to work with whatsoever, Boucher stabs it towards point"
391,"Hopes to Boucher, no run this time it a touch wide, Boucher drives away from his body, towards extra cover"
392,"Hopes to Boucher, no run yorker, around offstump, Boucher squeezes it out towards point"
393,"Hauritz to Duminy, no run Duminy tries to sweep a wide outside-off ball, it was too slow for him, he was nearly through with the shot before the ball came on"
394,"Hauritz to Duminy, 1 leg bye fullish on the legs, Duminy misses out on a chance to get some runs, he is struck on the pads outside leg"
395,"Hauritz to Boucher, no run short and turning into the batsman, Boucher plays it towards square leg"
396,"Hauritz to Botha, no run a wristy drive towards mid-on first up from Botha"
397,"Hauritz to Botha, no run Botha walks across the stumps and plays it towards midwicket this time"
398,"Hopes to Duminy, no run driven to mid-on, no run"
399,"Hopes to Duminy, 1 run a bit of width for Duminy he flashes at it, gets it away to third man for a single"
400,"Hopes to Botha, no run bouncer from Hopes, Botha didn't spot it early, he just about managed to evade it"
401,"Hopes to Botha, 1 run dabbed towards point, a bit of confusion in the calling but the batsmen make it safely"
402,"Hopes to Duminy, no run driven back to the bowler by Duminy, no run"
403,"Hopes to Duminy, no run full and on middle and off, Duminy punches it to mid-on this time but there's no run to be had"
404,"Hauritz to Botha, 1 run a touch short from Hauritz, Botha gets on the backfoot and gets it away to square leg"
405,"Hauritz to Duminy, 2 runs Duminy sweeps towards midwicket for a couple"
406,"Hauritz to Duminy, no run full ball, nicely flighted, duminy is hit on the pads, hawkeye says that would have spun to hit offstump, didn't look out to the naked eye though"
407,"Hauritz to Duminy, no run"
408,"Hauritz to Duminy, no run"
409,"Hauritz to Duminy, 2 runs cut away to deep point for a couple of runs, another good over from Hauritz"
410,"Hopes to Botha, FOUR runs lovely straight drive from Botha, he took it on the up and timed it beautifully, straight down the ground for four"
