,Data
0,"Dilshan to Wade, no run flat on a good length outside off, Wade lets it go"
1,"Dilshan to Wade, 2 runs fuller length on off stump, Wade drives towards cover where Tharanga fumbles"
2,"Dilshan to Wade, no run defended on the leg side"
3,"Dilshan to Wade, no run Wade tries to turn the ball towards leg but gets a leading edge on the off side"
4,"Dilshan to Wade, FOUR runs shot, the length was a bit short outside off, Wade went back and punched it through the gap at point"
5,"Dilshan to Wade, no run Warner strides forward and blocks"
6,"Kulasekara to Warner, 1 run good length around off stump, Warner opens the face to play behind point and runs"
7,"Kulasekara to Wade, no run good length and straight, Wade moves across his crease and defends on the leg side"
8,"Kulasekara to Wade, 2 byes a sloppy start in the field from Sri Lanka, Sangakkara fails to collect cleanly as he dives to his right after the batsman let it go. The bounce was low, though, it didn't carry to Sanga"
9,"Kulasekara to Wade, FOUR runs short and wide outside off stump, Wade uses the room to hit the ball hard through cover off the back foot"
10,"Kulasekara to Wade, 2 leg byes Kulasekara appeals for lbw after hitting Wade on the pad but that might have pitched outside leg stump"
11,"Kulasekara to Wade, no run good length outside off, Wade lets it pass"
12,"Dilshan to Warner, no run played off the back foot on the leg side"
13,"Dilshan to Warner, 1 run played between midwicket and square leg from deep in the crease"
14,"Dilshan to Wade, no run defended on the front foot"
15,"Dilshan to Wade, no run bowled flat and into the left-hand batsman from round the wicket, defended on the front foot"
16,"Dilshan to Wade, no run the quicker ball, Wade has to hurry and block on the back foot"
17,"Dilshan to Wade, 1 run pushed off the front foot towards mid-off for a single"
18,"Malinga to Wade, 1 run short of a length on leg and middle, Wade turns it off his hips towards square and calls Warner through"
19,"Malinga to Warner, no run good length on middle stump, Warner plays on the leg side without moving his feet that much"
20,"Malinga to Warner, no run short of a length with width outside off, Warner cracks it off the back foot, but doesn't beat cover"
21,"Malinga to Warner, 1 run short of a length and wide once again, Warner stays back and cuts towards third man"
22,"Malinga to Wade, 2 runs more sloppiness from Sri Lanka, Wade played the ball off the back foot behind point and ran an easy single, but Dilshan felt the need to throw at the stumps at the batsman's end even though Warner was well in his crease. He hit the stumps and then conceded an overthrow"
23,"Malinga to Wade, no run defended on the off side"
24,"Dilshan to Warner, 1 run forced off the back foot through midwicket for a single"
25,"Dilshan to Wade, OUT bowled him! Dilshan's been skidding his balls through to the batsman, and Wade tried to pull this one when it wasn't that short, he missed and Dilshan hit off stump"
26,"Dilshan to Watson, no run played off the back foot towards square leg"
27,"Dilshan to Watson, no run defended on the off side"
28,"Dilshan to Watson, no run Watson moves forward and blocks"
29,"Dilshan to Watson, 1 run Watson steps out, takes the ball on the full, and drives to long-on"
30,"Malinga to Watson, no run short of a length outside off stump, Watson cuts off the back foot to point"
31,"Malinga to Watson, no run length ball outside off stump, Watson moves forward and plays towards point"
32,"Malinga to Watson, no run Watson pushes forward at another length ball and Dilshan fields at point, and then he throws at the bowler's end"
33,"Malinga to Watson, no run good length and much straighter, Watson gets behind the line and defends"
34,"Malinga to Watson, no run Watson gets on to the front foot and defends a good length ball on the off side once again"
35,"Malinga to Watson, no run yes he can, bowls a good length ball outside off, Watson tries to force it through cover and plays from his crease. He gets a thick bottom edge into the ground and towards Sanga"
36,"Dilshan to Warner, no run Warner strides forward and defends towards cover"
37,"Dilshan to Warner, 1 run played towards long off for a single"
38,"Dilshan to Watson, 3 runs width outside off stump, Watson waits and cuts late, sending the ball speeding towards the third man boundary, Malinga chases and pulls it back in just before the rope"
39,"Dilshan to Warner, no run Warner goes back and cuts the ball from in front of his stumps to the fielder at point"
40,"Dilshan to Warner, no run punched towards mid off but Dilshan dives to his right to make the save"
41,"Dilshan to Warner, no run Warner moves back and across and plays towards square leg"
42,"Malinga to Watson, 1 run short of a length outside off, Watson opens the face to steer towards third man, the fielder at a wide slip dives to his right and makes a half stop"
43,"Malinga to Warner, no run Warner stays in his crease and punches the ball hard towards cover, can't beat the infield"
44,"Malinga to Warner, no run good length on middle stump, Warner stays in his crease and defends towards point"
45,"Malinga to Warner, no run Warner stays on the back foot and defends a good length delivery towards the off, Malinga is skidding them through on middle stump"
46,"Malinga to Warner, no run that was a slower ball and Warner had to wait to play it. He pushed it back to the bowler, he was trying to hit through the off side"
47,"Malinga to Warner, no run defended back to the bowler once again"
48,"Kulasekara to Watson, no run good length outside off stump, Watson strides forward and defends"
49,"Kulasekara to Watson, 2 runs the length is good but the line is outside off, Watson cuts towards third man where a fumble from Malinga allows the second"
50,"Kulasekara to Watson, 2 runs fuller length but the line is outside off once again, allowing Watson to cut towards third man"
51,"Kulasekara to Watson, no run Watson cuts, but this time to Dilshan at point"
52,"Kulasekara to Watson, 1 run played off the pads on the front foot towards square leg"
53,"Kulasekara to Warner, 1 run Warner stays back to a fuller ball and pushes towards mid-on for a single"
54,"Maharoof to Warner, no run good length and straight, played on the off side from the crease"
55,"Maharoof to Warner, no run pushed back to the bowler on the back foot"
56,"Maharoof to Warner, FOUR runs that's in the air but it's cleared the fielder! Maharoof bowled a full, slower ball and Warner got on the front foot and spooned the drive flat over the head of the leaping fielder at extra cover"
57,"Maharoof to Warner, 1 run played towards mid on for a single"
58,"Maharoof to Watson, no run pushed off the back foot towards cover"
59,"Maharoof to Watson, no run another slower ball, Watson defends on the front foot towards the off side"
60,"Dilshan to Warner, no run pushed towards the fielder at short midwicket"
61,"Dilshan to Warner, 2 runs Warner strides forward and drives towards long-off, and what have Sri Lanka done? Another overthrow. Kulasekara threw on the half-volley to Sanga, who didn't collect because of awkward bounce, and there was no one backing up"
62,"Dilshan to Warner, 1 run driven through cover for a single"
63,"Dilshan to Watson, no run played off the pads towards square leg"
64,"Dilshan to Watson, 1 run pushed off the back foot towards long off"
65,"Dilshan to Warner, 1 run Warner goes back and cuts from off stump towards deep point"
66,"Maharoof to Warner, no run good length on middle and off, Warner stays in his crease and defends towards the leg side"
67,"Maharoof to Warner, 1 run Warner's spooned another drive over the head of the fielder at extra cover, this time the fielder at mid-off runs to his right to field the ball"
68,"Maharoof to Watson, no run short of a length and straight, Watson gets behind the line and blocks"
69,"Maharoof to Watson, no run tight line and length from Maharoof, around off stump, Watson defends on the front foot"
70,"Maharoof to Watson, no run dropped, Sri Lanka's shoddy fielding continues. Watson cut the ball hard off the front foot but it flew straight to Dilshan at point at a comfortable height. He got both hands to it but couldn't hold on. By Dilshan's standards, that's a sitter. He was moving towards his left and seemed to be off balance as the ball hit"
71,"Maharoof to Watson, no run Watson mis-times the off-drive against a good length ball"
72,"Dilshan to Warner, 1 run played off the back foot on the leg side"
73,"Dilshan to Watson, no run played back to the bowler"
74,"Dilshan to Watson, 1 run driven off the front foot to long off"
75,"Dilshan to Warner, no run Warner tries to drive a flighted ball and gets an inside edge on to the pad"
76,"Dilshan to Warner, no run Warner drives firmly and straight, Dilshan dives to his left to save runs"
77,"Dilshan to Warner, 1 run driven on the front foot through cover"
78,"Maharoof to Warner, 1 run Warner plays the front-foot drive and hits the length ball through cover"
79,"Maharoof to Watson, no run Watson tries to defend from his crease but the ball bounces a bit more and takes the inside edge past the stumps"
80,"Maharoof to Watson, no run defended on the off side, that was a slower ball"
81,"Maharoof to Watson, no run short of a length outside off stump, Watson throws his bat at it, aiming to hit the ball through point. The ball came slowly off the surface and beat the bat"
82,"Maharoof to Watson, 2 runs dropped again, by Herath at long-off. The fielder had been pushed back to long-off, and Watson played the lofted drive. Herath once again mis-judged the catch by running in too far, he then had to back pedal to get under it. In the previous game he managed to take a blinder off Wade after an initial misjudgment, this t"
83,"Maharoof to Watson, no run Watson pulls but gets an inside edge on to the body"
84,"Dilshan to Warner, no run defended on the off side"
85,"Dilshan to Warner, 1 run driven through cover for a single"
86,"Dilshan to Watson, 1 run played down the ground for one"
87,"Dilshan to Warner, no run defended on the off side"
88,"Dilshan to Warner, 3 runs played off the pads behind square"
89,"Dilshan to Watson, no run Watson forces the ball towards midwicket"
90,"Maharoof to Warner, OUT Watson's been run out! He dived full length into the crease but has still been caught short by Maharoof's direct hit. Dilshan and Herath will be very relieved men, after they both dropped Watson. Warner pushed the ball on the leg side and ran a quick single, Maharoof sprinted to his left, picked up, turned around, and thr"
91,"Maharoof to Clarke, no run defended on the off side from the crease"
92,"Maharoof to Clarke, 1 run Clarke gets an inside edge towards fine leg for a single"
93,"Maharoof to Warner, 1 run played through midwicket for one more"
94,"Maharoof to Clarke, no run defended on the front foot towards cover"
95,"Maharoof to Clarke, no run length ball outside off, Clarke plays it towards point"
96,"Kulasekara to Warner, no run pushed off the back foot towards cover point, that was good length and straight"
97,"Kulasekara to Warner, 1 run good length but the line is on the pads, Warner plays it through square"
98,"Kulasekara to Clarke, no run Clarke strides a long way out of his crease and defends back to the bowler"
99,"Kulasekara to Clarke, no run Clarke strides on to the front foot and drives to cover point"
100,"Kulasekara to Clarke, 1 run the slower ball at 104kph on middle stump, played off the pads towards square"
101,"Kulasekara to Warner, no run played back to the bowler on the front foot"
102,"Maharoof to Clarke, 1 run length ball on middle and leg, Clarke nudges the ball off his pads through square"
103,"Maharoof to Warner, 1 run Warner drives a slower ball from his crease towards long off"
104,"Maharoof to Clarke, 1 run Clarke drives a full delivery firmly off the front foot but Mahela dives to his right at mid-off to stop the ball, saved three runs"
105,"Maharoof to Warner, no run played off the back foot towards cover"
106,"Maharoof to Warner, SIX runs Warner's smashed it! He wound up and swung hard at a length ball on the front foot, clearing the wide long-on boundary comfortably. That's a long boundary at Adelaide Oval and Warner hit the ball into the stands. That was measured at 99 metres. A monster of a hit."
107,"Maharoof to Warner, 1 run played off the pads towards midwicket"
108,"Kulasekara to Warner, 1 run Warner goes on the back foot and taps the ball towards cover"
109,"Kulasekara to Clarke, 3 runs Clarke gets on to the front foot by taking two steps out and then drives into the gap on the deep cover boundary"
110,"Kulasekara to Warner, no run defended on the leg side"
111,"Kulasekara to Warner, 1 run Warner moves back and across and plays the ball through square leg"
112,"Kulasekara to Clarke, no run a loud appeal for lbw after Clarke misses the pull. The ball was slower and Clarke moved across his stumps to play the shot. The impact was a bit high, on the box"
113,"Kulasekara to Clarke, 1 wide that's too full and down leg side"
114,"Kulasekara to Clarke, 1 run Clarke strides forward and drives to mid-off, fluent shot, Clarke's moving nicely in his crease, coming forward to cope with the slowness of the pitch"
115,"Malinga to Clarke, no run good length and straight, defended back to the bowler"
116,"Malinga to Clarke, 2 runs Clarke drives straight, Malinga tries to field but gets only finger tips on the ball"
117,"Malinga to Clarke, no run Clarke cuts hard off the front foot but Dilshan dives to his left to save runs"
118,"Malinga to Clarke, no run short of a length outside off, Clarke plays off the back foot towards point"
119,"Malinga to Clarke, 1 run short of a length outside off, Clarke taps it into the gap in front of point and runs, Dilshan picks up and throws at the bowler's end. He misses but I think Clarke was safe even if there was a direct hit"
120,"Malinga to Warner, FOUR runs Malinga ends the bowling Powerplay with a loose full toss outside off, Warner stays in his crease and hits it through the gap at cover"
121,"Herath to Clarke, no run nudged towards midwicket on the front foot"
122,"Herath to Clarke, 1 run Clarke comes forward and drives to long-on"
123,"Herath to Warner, no run Warner pushes off the front foot towards point"
124,"Herath to Warner, no run Warner gets forward and plays to backward point again"
125,"Herath to Warner, no run Warner tries to drive one that slants across him and is beaten"
126,"Herath to Warner, no run driven firmly back to the bowler, Herath slips a little as he fields, and is a little slow in getting to his feet"
127,"Dilshan to Clarke, 1 run Dilshan returns and gets an outside edge from Clarke, as the batsman was trying to play on the leg side, the ball went towards third man"
128,"Dilshan to Warner, no run bowled slowly to Warner, who plays from the crease on the leg side"
129,"Dilshan to Warner, 1 run tossed up into the left-hander, Warner drives towards long-on"
130,"Dilshan to Clarke, 1 run Clarke once again gets a thick outside edge on the off side, he was looking to play straight"
131,"Dilshan to Warner, no run Warner steps forward and drives back to the bowler"
132,"Dilshan to Warner, 1 run tossed up with width outside off, Warner reaches out and drives through cover"
133,"Herath to Warner, 1 run bowled flat outside off stump, Warner stays in his crease and punches to long off"
134,"Herath to Clarke, 1 run Clarke moves across his crease to a fuller ball and works it off his pads behind square"
135,"Herath to Warner, 1 run Warner drives the ball towards long off, Herath tries to intercept but it's too far away from him"
136,"Herath to Clarke, 1 run Clarke steps out of his crease to take the ball as it pitches and plays through midwicket"
137,"Herath to Warner, 1 run Warner stays in his crease and plays through cover point, five singles in five balls"
138,"Herath to Clarke, no run Sangakkara appeals for lbw after Clarke skips out of his crease to whip through midwicket and misses. He was a long, long way out of his crease"
139,"Dilshan to Warner, 1 run Warner moves back and across and works the single through midwicket"
140,"Dilshan to Clarke, 2 runs Clarke plays the ball behind point and runs two to third man"
141,"Dilshan to Clarke, no run played back to the bowler"
142,"Dilshan to Clarke, 1 run Clarke goes back and plays the ball off his pads through midwicket"
143,"Dilshan to Warner, no run Warner stays in his crease and cuts to Malinga at backward point"
144,"Dilshan to Warner, 1 run Warner retains strike by punching through the off side"
145,"Herath to Warner, 1 run full ball on leg and middle, Warner brings up Australia's 100 with a drive to long on"
146,"Herath to Clarke, 1 run Clarke steps out of his crease and drives to long-off"
147,"Herath to Warner, 1 run Warner strides out and drives along the ground to long-off"
148,"Herath to Clarke, 1 run full ball on the pads, Clarke clips it around the corner"
149,"Herath to Warner, no run defended on the front foot, Herath strides to his right and fields"
150,"Herath to Warner, 1 run Warner waits for a flighted ball and drives on the front foot towards mid-off"
151,"Dilshan to Warner, 1 run cut off the back foot towards cover point, he reaches his half-century. A more sedate and composed one today, after that aggressive century at the Gabba. Valuable nonetheless on this slow surface."
152,"Dilshan to Clarke, 1 run Clarke steps out, gets to the pitch of the ball, and drives to long off to bring up the 50 partnership"
153,"Dilshan to Warner, no run quicker ball on off and middle, defended from the crease"
154,"Dilshan to Warner, no run punched off the back foot towards extra cover"
155,"Dilshan to Warner, 2 runs that's full and on the pads, Warner turns if behind square and there's more silliness from Sri Lanka in the field. Sangakkara was chasing the ball, and Kulasekara was running in from the deep and there was a small collision between the two. Wonder how Jayawardene's blood pressure is today."
156,"Dilshan to Warner, no run defended towards cover"
157,"Herath to Clarke, no run Clarke steps out of his crease and plays to midwicket"
158,"Herath to Clarke, no run Clarke steps out to turn towards square and gets hit on the pad"
159,"Herath to Clarke, 2 runs Clarke steps out again and makes contact this time, playing the ball off his pads towards long leg"
160,"Herath to Clarke, 1 run Clarke comes out of his crease, gets to the pitch of the ball, and clips through midwicket"
161,"Herath to Warner, no run Warner leans towards the off from his crease and plays to midwicket"
162,"Herath to Warner, 1 run Warner plays to midwicket again, and this time he places it wide of the diving fielder"
163,"Kulasekara to Warner, no run good length and straight, defended on the off side"
164,"Kulasekara to Warner, 1 run Warner stays in his crease and pushes the ball towards long on"
165,"Kulasekara to Clarke, 1 run Clarke steps out to a length ball and punches past the bowler towards long on"
166,"Kulasekara to Warner, no run full length and straight, Warner comes forward and drives, Kulasekara moves to his left to field"
167,"Kulasekara to Warner, 1 run short of a length angling across the left-hander, Warner plays from his crease, hitting the ball uppishly through cover point"
168,"Kulasekara to Clarke, FOUR runs short ball, and Clarke is quick while playing the short-arm pull, lofting it into the gap on the deep square boundary"
169,"Herath to Warner, no run Warner stays in his crease and pushes the ball to midwicket"
170,"Herath to Warner, 1 run fuller ball on leg stump, Warner plays towards long on for a single"
171,"Herath to Clarke, 1 run Clarke takes two steps out and turns the ball off his pads behind square"
172,"Herath to Warner, no run a loud appeal for lbw after Warner stays in his crease and misses the turn to square leg, that pitched outside leg stump"
173,"Herath to Warner, 1 run played from the crease towards extra cover"
174,"Herath to Clarke, 1 run tossed up on middle stump, Clarke uses the angle into him to push the ball through midwicket off the front foot"
175,"Kulasekara to Clarke, 1 run played off the front foot towards wide long on"
176,"Kulasekara to Warner, 2 runs length ball angling across Warner, he slogs across the line and mis-hits the ball behind square, he was aiming more towards midwicket"
177,"Kulasekara to Warner, no run driven off the front foot towards point"
178,"Kulasekara to Warner, no run Warner plays a forceful shot towards point where Kapugedara dives to his left and saves runs"
179,"Kulasekara to Warner, no run punched towards mid-on from the crease"
180,"Kulasekara to Warner, 1 run a full toss on off stump, Warner drives to long off for a single"
181,"Herath to Warner, 1 run full ball on middle stump, Warner clips the ball towards wide long on"
182,"Herath to Clarke, 1 run played off the pads through midwicket for a single"
183,"Herath to Warner, no run played back to the bowler from the crease"
184,"Herath to Warner, no run pushed towards Kapugedera at extra cover"
185,"Herath to Warner, 1 run short of a length with width outside off, cut off the back foot through point"
186,"Herath to Clarke, 1 wide that's down leg side and a wide"
187,"Herath to Clarke, 1 run Clarke plays off the front foot towards long-on"
188,"Malinga to Clarke, 2 runs full ball outside off stump from over the wicket, Clarke steps out and drives through midwicket, they run two before the fielder from long on can prevent it"
189,"Malinga to Clarke, 1 run pushed through midwicket once again"
190,"Malinga to Warner, 1 run full and straight from Malinga, Warner stays in his crease and plays towards midwicket"
191,"Malinga to Clarke, 1 leg bye length ball on the pads, Clarke misses the glance and runs a leg bye towards square leg"
192,"Malinga to Warner, FOUR runs that's too far down leg side, a rubbish line with fine leg in the circle, Warner moves across his stumps and glances past the fielder to collect four"
193,"Malinga to Warner, 1 run length ball around off stump, Warner pushes from his crease towards mid-off to score the 10th run off the first batting Powerplay over"
194,"Maharoof to Warner, no run a full delivery outside off stump, driven firmly but straight to cover"
195,"Maharoof to Warner, 2 runs short of a length angling across the left-hand batsman, Warner stays in his crease and punches through the gap at cover"
196,"Maharoof to Warner, 1 run a slower ball, which Warner drives to mid-off and challenges the fielder. He beats the throw at the bowler's end, the fielder missed anyway. Warner hobbled a little after completing that run, probably a little sore after that groin injury"
197,"Maharoof to Clarke, 1 run played off the pads towards deep square leg"
198,"Maharoof to Warner, FOUR runs a length ball outside off, it was the slower one but Warner had room to drive, and drive he did, hitting hit hard through the gap at cover, there's no fielder in the deep"
199,"Maharoof to Warner, 1 run in the blockhole this time, Warner digs it out towards mid-off for a single"
200,"Malinga to Warner, 1 run in the air, but safe! Warner tries to pull a short ball but gets a top edge that falls short and wide of the fielder at mid-on"
201,"Malinga to Clarke, no run good length around off stump, Clarke stays in his crease and blocks"
202,"Malinga to Clarke, 1 run the length's not bad on off stump, Clarke moves forward and a little across to drive the ball towards long-on"
203,"Malinga to Warner, 1 run shoddy work from Malinga, Warner played the ball back to the bowler and Malinga failed to stop it cleanly, he reacted as though he got a touch on the ball before it very close to the stumps at the non-striker's end, with Clarke out of his crease. He should have fielded it cleanly in the first place"
204,"Malinga to Clarke, no run defended on the off side"
205,"Malinga to Clarke, 2 runs Clarke whips the ball off his pads towards deep midwicket"
206,"Kulasekara to Warner, 1 run a straight full toss, Warner drives to long off and calls for two, he won't get the second"
207,"Kulasekara to Clarke, FOUR runs a full ball on middle and leg, Clarke moves forward and towards the off side, taking the ball on the full and flicking it into the gap on the backward square leg boundary"
208,"Kulasekara to Clarke, 2 runs another full ball on the pads, Clarke clips it along the ground to deep square leg"
209,"Kulasekara to Clarke, 3 runs Clarke gets to his half-century by tapping a length ball off his pads towards fine leg, a horrible line from Kulasekara in this over. Clarke's adjusted beautifully to the slowness of this surface, he assessed it in no time at all."
210,"Kulasekara to Warner, 1 run hit down the ground to long off for a single"
211,"Kulasekara to Clarke, 1 run Clarke drives off the front foot towards long on"
212,"Malinga to Clarke, 1 run a length ball around off, Clarke moves across and pulls the ball flat towards deep square leg"
213,"Malinga to Warner, no run driven off the front foot towards cover"
214,"Malinga to Warner, no run Warner jumps back and taps the ball towards the off side"
215,"Malinga to Warner, no run Malinga gets the ball to lift off a good length and move across Warner, who stayed in his crease and tried to waft, he was beaten"
216,"Malinga to Warner, no run played off the back foot towards cover"
217,"Malinga to Warner, no run Warner gets a bit of a leading edge as he was trying to turn the ball towards square, Malinga runs to his right to pick up the ball. Malinga began the batting Powerplay by conceding 10 in an over, he's ended it by conceding one. Australia scored 37 in the five-over block"
218,"Herath to Clarke, no run tight line and Clarke plays it straight back"
219,"Herath to Clarke, 1 run goes down the track and flicks him to the leg side"
220,"Herath to Warner, 1 run Warner uses his feet too and gets a single to long-on"
