,Data
0,"Herath to Hussey, no run doesn't turn in as much as expected, gets a soft outside edge. No slip in place"
1,"Herath to Hussey, 1 run comes down the track to take this on the full, gets a single wide of mid-on"
2,"Herath to Khawaja, no run again gets to see a big gap between Khawaja's bat and pad, hits the inside half of the bat"
3,"Herath to Khawaja, no run closer to off now, plays this one more comfortably"
4,"Herath to Khawaja, 1 run leading edge, dies right into the ground. Closes the face to this outside off. Looking very uncertain"
5,"Herath to Hussey, no run forward in solid defence, is Hussey"
6,"Randiv to Khawaja, no run and gets an edge first ball. Pitches middle and leg, turns away, Khawaja closes the face, but the edge dies in front of slip"
7,"Randiv to Khawaja, no run defended towards midwicket"
8,"Randiv to Khawaja, 1 run swept away along the ground, gets a single"
9,"Randiv to Hussey, no run nicely tossed up, pitches middle and off, defended"
10,"Randiv to Hussey, no run another forward-defensive, towards cover"
11,"Randiv to Hussey, no run flighted outside off, Hussey pushes forward and defends"
12,"Herath to Khawaja, no run sharp turn, Khawaja stays back to defend this to midwicket"
13,"Herath to Khawaja, no run comes forward this time to block this length ball"
14,"Herath to Khawaja, no run this pitches just short of a length, outside off, turning in, defended with soft hands"
15,"Herath to Khawaja, 1 run flatter, pushed with an open face, gets a single"
16,"Herath to Hussey, no run floated across him, defended to off"
17,"Herath to Hussey, no run another one slides across him, Hussey covers the turn with the pad, and shoulders arms"
18,"Randiv to Khawaja, no run full offbreak, middle and off, defended to leg"
19,"Randiv to Khawaja, no run full again, defended to cover"
20,"Randiv to Khawaja, no run pushed to cover now, slightly more forceful in this defensive shot"
21,"Randiv to Khawaja, no run sharp offbreak, pitches middle and off, and breaks away. Defended with soft hands"
22,"Randiv to Khawaja, no run too full, easy for Khawaja to smother the turn"
23,"Randiv to Khawaja, 1 run slower through the air, shorter too, pushed wide of point for one"
24,"Lakmal to Khawaja, no run Big shout first up. They are going for the review for the inside edge. This is short of a length, looks like it will angle across, but holds its line slightly, and Khawaja punches away from the body. There is a sound as it passes the bat, although the replays don't conclusively prove there is an inside edge onto the pad and then through to P Jayawardene. More drama. This is a bit of a farce real"
25,"Lakmal to Khawaja, no run full outside off, defended to cover"
26,"Lakmal to Khawaja, no run length ball, angling across, pushed to cover"
27,"Lakmal to Khawaja, no run full and straight, pushed back to the bowler"
28,"Lakmal to Khawaja, 3 runs a touch too straight, and it's whipped away off the pads for three. Already signs that Khawaja prefers pace to spin"
29,"Lakmal to Hussey, 1 run length ball on the pads, he works this wide of mid-on for one"
30,"Randiv to Hussey, 1 run clipped off the pads for one"
31,"Randiv to Khawaja, no run flighted outside off, defended to cover"
32,"Randiv to Khawaja, no run this one doesn't turn in, Khawaja gets an inside edge towards square leg"
33,"Randiv to Khawaja, no run flighted outside off, slight turn away, defended"
34,"Randiv to Khawaja, no run more turn, but Khawaja doesn't play at this one, sees it safely through to PJ"
35,"Randiv to Khawaja, 1 run pushed with an open face, gets a single wide of point"
36,"Lakmal to Khawaja, 1 run Khawaja presses forward, pushes this to mid-off, runs through for one, Dilshan swoops on this, tries an underarm flick, his momentum carries him into a collision with Khawaja, who is now down on the ground"
37,"Lakmal to Hussey, no run a hint of swing back in for Hussey, who gets the bat down in time"
38,"Lakmal to Hussey, no run nice cover-drive by Hussey to this one angling across him. Finds extra cover, though"
39,"Lakmal to Hussey, no run slower ball, Hussey delays the shot, pushes this towards cover"
40,"Lakmal to Hussey, no run length ball, outside off, pushed to mid-off"
41,"Lakmal to Hussey, no run bouncer, sways away from its line"
42,"Randiv to Khawaja, no run no turn, this one slips down the leg side"
43,"Randiv to Khawaja, no run offbreak now, pitches outside off, left alone"
44,"Randiv to Khawaja, no run another sharp offbreak, defended off the back foot"
45,"Randiv to Khawaja, 2 runs full on the pads, clipped away for a single"
46,"Randiv to Khawaja, no run quicker delivery, goes for the cut, not short enough to be cut, but he manages to keep this down"
47,"Randiv to Khawaja, no run flighted around middle and off, defended off the front foot"
48,"Lakmal to Hussey, no run length ball, on the pads, pushed to mid-on"
49,"Lakmal to Hussey, FOUR runs slower offcutter, nicely played with an open face, steered away really, between slips and gully, for the first boundary in 83 balls"
50,"Lakmal to Hussey, 1 run length ball, on the pads, worked around the corner for one"
51,"Lakmal to Khawaja, no run full, middle and off, pushed back to the bowler"
52,"Lakmal to Khawaja, 1 run tip and run here, this one doesn't go too far off the pitch, towards midwicket, and they charge through"
53,"Lakmal to Hussey, no run short of a length, middle and leg, defended off the back foot"
54,"Randiv to Khawaja, no run offbreak starts well outside off, left alone"
55,"Randiv to Khawaja, 1 run swept powerfully, along the ground, gets a single"
56,"Randiv to Hussey, no run big shout for lbw, this is the arm ball, beats the inside edge, but it has hit him outside the line of off"
57,"Randiv to Hussey, no run flighted outside off, defended with an open face"
58,"Randiv to Hussey, no run pushes right forward to smother the turn"
59,"Randiv to Hussey, 2 runs flat, into the pads, Hussey transfers the weight back, guides this towards fine leg for a couple"
60,"Lakmal to Khawaja, 2 runs bouncer, pulled away from outside off, hit into the ground, through midwicket for two"
61,"Lakmal to Khawaja, no run another short ball, outside off, Khawaja sways from the line of the ball"
62,"Lakmal to Khawaja, no run full, some late swing away from him, gets an edge into the ground, and then through towards slips. Falls well short of them too"
63,"Lakmal to Khawaja, 2 runs pulled away again, from chest-high, and keeps it down too, gets a couple"
64,"Lakmal to Khawaja, no run short of a length, around off, pushed to mid-off"
65,"Lakmal to Khawaja, no run offcutter, pitches just outside leg, is defended in front of off"
66,"Welegedara to Hussey, FOUR runs short and wide, and Hussey welcomes this with a steer through the vacant third man region"
67,"Welegedara to Hussey, no run fuller, wide of off, left alone"
68,"Welegedara to Hussey, no run full, a hint of late swing in towards Hussey, who pushes this to mid-off"
69,"Welegedara to Hussey, 3 runs and this one swings in late again, almost squeezing through, hits the inside half of the bat, past midwicket, for three runs"
70,"Welegedara to Khawaja, 1 run more late swing, Khawaja is a bit more loose than Hussey, gets an inside edge onto the the pad. Sneaks in the single"
71,"Welegedara to Hussey, no run yorker, this is surely reversing here. Big shout for lbw. Umpire Dar says not out. Dilshan challenges the call. Me, I would rarely question Dar. This is full, swinging in late, pitches in front of middle, hits him in front of leg, and would have missed the leg stump, so the original decision stays. Umpire Taufel, who is doing commentary right now, immediately made out from Dar's mannerisms th"
72,"Dilshan to Khawaja, no run sharp offbreak, pitches just outside off, beats the tentative Khawaja"
73,"Dilshan to Khawaja, no run right forward to push this to cover"
74,"Dilshan to Khawaja, 1 run quick flat offbreak, gets an edge, which dies right away, and goes past slip for one"
75,"Dilshan to Hussey, no run arm ball, around off, Hussey is right back to defend"
76,"Dilshan to Hussey, no run full and flat, defended back to the bowler"
77,"Dilshan to Hussey, no run slower through the air, Hussey defends off the front foot"
78,"Welegedara to Khawaja, no run swing for Welegedara again, Khawaja shoulders arms, but this one doesn't swing in enough"
79,"Welegedara to Khawaja, OUT Reverse swing! Timber! Khawaja's tentative stay ends. He has always shown the bowlers a tempting gap between bat and pad, and this time Welegedara sneaks through it. This is just short of a yorker length, Khawaja drives away from the body, and the late swing squeezes in to hit the stumps"
80,"Welegedara to Haddin, no run angled away, easy for Haddin to leave it be"
81,"Welegedara to Haddin, no run pitches middle and leg, swings away towards of, defended towards cover"
82,"Welegedara to Haddin, no run Beaten! Pitches middle and off, just short of a length, seams away, beats the hanging bat"
83,"Welegedara to Haddin, no run slower offcutter, Haddin is caught pushing in front of his body, it falls short of short extra cover, though"
84,"Dilshan to Hussey, no run full offbreak, pushed back to the bowler"
85,"Dilshan to Hussey, no run short outside off, pushed to cover"
86,"Dilshan to Hussey, no run short again, stays low, Hussey keeps this out"
87,"Dilshan to Hussey, 1 run charges at him, pushes this to mid-off, and keeps going through for a single"
88,"Dilshan to Haddin, FOUR runs Haddin edges first ball of spin! Doesn't turn in as much as he expects it to, ends up playing inside the line, the edge goes between keeper and slip. Didn't carry as far as slip, though"
89,"Dilshan to Haddin, no run turning into the pads, defended to leg"
90,"Welegedara to Hussey, 2 runs Hussey covers the swing, opens the face, guides it through the vacant point region, and comes back for two"
91,"Welegedara to Hussey, FOUR runs looks for the swinging yorker, it goes wrong, and Hussey clips this low full toss through midwicket. Typical Hussey. Waits for slight errors from the bowling side, and capitalises"
92,"Welegedara to Hussey, no run pitched on a length, swinging in late, defended off the front foot"
93,"Welegedara to Hussey, 2 runs this is the one that goes straight through, Hussey reaches out and pushes with an open face for another couple"
94,"Welegedara to Hussey, no run covers the swing well, pushes this to mid-off"
95,"Welegedara to Hussey, no run this is better, swinging in late, just short of a yorker length, Hussey plays it late, towards midwicket"
96,"Dilshan to Haddin, 1 run sharp offbreak, helped around the corner for one"
97,"Dilshan to Hussey, no run tossed up around middle and leg, turning towards off, defended off the front foot"
98,"Dilshan to Hussey, no run teasing flat delivery outside off, looks for the cut but decides against it eventually"
99,"Dilshan to Hussey, no run right forward to smother the turn here"
100,"Dilshan to Hussey, no run tossed up outside leg, Hussey opens the stance up a bit and defends"
101,"Dilshan to Hussey, no run middle and leg again, Hussey closes the face early, but the leading edge falls short of Dilshan"
102,"Welegedara to Haddin, FOUR runs lovely extra cover drive. This is pitched on a length, wide outside off, Haddin is on a knee, and drives it through extra cover. All along the ground"
103,"Welegedara to Haddin, no run this is closer to off, and Haddin leaves it be"
104,"Welegedara to Haddin, no run full, middle and leg, moving towards off, defended back"
105,"Welegedara to Haddin, no run short of a length, swinging away, pushed to cover"
106,"Welegedara to Haddin, no run short of a length, defended with an angled bat"
107,"Welegedara to Haddin, 1 run similar delivery, but Haddin places this to the right of point, and rushes through for a single"
108,"Dilshan to Haddin, no run flat offbreak, into the pads, defended"
109,"Dilshan to Haddin, no run another quick offbreak, turned to midwicket"
110,"Dilshan to Haddin, no run goes deep into the crease to block this flat delivery outside off"
111,"Dilshan to Haddin, 1 run full, on the pads, pushed to long-on"
112,"Dilshan to Hussey, no run Hussey is forward to defend this to point"
113,"Dilshan to Hussey, 1 run short, on the pads, placed for a single wide of midwicket"
114,"Welegedara to Hussey, 1 run pushed to mid-off and charges through for a single. Hussey has alternated the strike superbly"
115,"Welegedara to Haddin, no run full, around off, defended with an open face"
116,"Welegedara to Haddin, no run short of a length, kicks off again, hits Haddin's fingers, but the ball doesn't lob up"
117,"Welegedara to Haddin, 1 run more good running, tips this towards cover, and rushes through for one"
118,"Welegedara to Hussey, no run full and wide, slight shape back in, driven to extra cover"
119,"Welegedara to Hussey, no run full and swinging in, but he seems tired now - this is 126ks, pushed to mid-off"
120,"Herath to Haddin, no run tossed up just outside off, Haddin shoulders arms and watches it turn away"
121,"Herath to Haddin, no run Haddin is forward to defend this length ball outside off"
122,"Herath to Haddin, no run tossed up, slightly wide, left alone"
123,"Herath to Haddin, no run this is the straighter one, less air, Haddin goes back to defend"
124,"Herath to Haddin, no run slight flight, and Haddin is quick to press forward. Defends this back"
125,"Herath to Haddin, no run another forward-defensive, this time towards cover"
126,"Randiv to Hussey, no run flighted outside off, defended to silly point"
127,"Randiv to Hussey, no run Hussey leave the crease, is beaten in the flight, pushes to silly point, and rushes back into the crease"
128,"Randiv to Hussey, 1 run only slightly short, and he is quick to go back and place it past point for one"
129,"Randiv to Haddin, no run Lovely bowling. You could see the extra revs on this. Pitched outside off, turned back, through the gap, hit the knee roll. Extra bounce saved an lbw here"
130,"Randiv to Haddin, no run flighted outside off, defended to cover"
131,"Randiv to Haddin, no run flatter, quicker, stays back and plays this back to the bowler"
132,"Herath to Hussey, no run turning in towards off, defended"
133,"Herath to Hussey, 1 run swept away for a single"
134,"Herath to Haddin, no run Haddin presses half-forward to defend this"
135,"Herath to Haddin, no run huge turn, Warnesque, pitches outside leg, beats the bat, hits the back pad in front of off. Sri Lanka are excited about a catch to gully, but it hasn't hit bat"
136,"Herath to Haddin, no run smothers the spin after pressing forward"
137,"Herath to Haddin, no run flighted outside off, left alone"
138,"Randiv to Hussey, no run flighted around middle and leg, defended"
139,"Randiv to Hussey, no run Hussey gives him the charge, gets to the pitch of the ball, pushes to cover"
140,"Randiv to Hussey, no run slightly shorter, and Hussey is right back to defend"
141,"Randiv to Hussey, no run stretches well forward to this flighted delivery and defends"
142,"Randiv to Hussey, no run pitches outside leg, covers the turn, plays it back to the bowler"
143,"Randiv to Hussey, FOUR runs a hard-working yet pretty unobtrusive sort of fifty on a tough pitch. This is flighted around middle an doff, he comes forward and punches this between mid-off and the bowler. Michael Clarke and others applaud from the balcony"
144,"Herath to Haddin, 1 run full, on the pads, worked wide of midwicket for one"
145,"Herath to Hussey, no run flighted outside off, driven to extra cover"
146,"Herath to Hussey, no run pushes at this one with bat and pad close together, defends towards cover"
147,"Herath to Hussey, no run Close! Looks to sweep this from outside off, plays the wrong line, the ball turns in sharply, misses the off stump not by much"
148,"Herath to Hussey, no run another flighted delivery, Hussey resists all temptation and defends"
149,"Herath to Hussey, no run lovely bowling, pushed through, 94ks, Hussey is taken by surprise, is late into it, is beaten, and is hit on the knee roll when deep in the crease. Huge shout obviously, but they are not getting any lbws from Kettleborough"
150,"Randiv to Haddin, SIX runs lovely straight drive. Beautiful swing of the arms after taking half a step down the track. Right over the bowler's head"
151,"Randiv to Haddin, no run flighted outside off, this time Haddin defends"
152,"Randiv to Haddin, FOUR runs more elegant batting from Haddin. Comes forward again, and swings his arms through it rather than trying to hit it hard. Clears mid-on with ease"
153,"Randiv to Haddin, no run driven along the ground, towards extra cover"
154,"Randiv to Haddin, 1 run Nearly there! Sharp offbreak, Haddin pushes at it in front of his body, gets an inside edge that bisects forward and backward short legs"
155,"Randiv to Hussey, no run tossed up around middle and leg, defended towards mid-off"
156,"Herath to Haddin, no run full outside off, defended back to Herath"
157,"Herath to Haddin, no run slower through the air, middle and leg, turning towards off, Haddin defends off the back foot"
158,"Herath to Haddin, no run this one keeps drifting in, Haddin plays it late, back to the bowler"
159,"Herath to Haddin, no run flighted outside off, Haddin doesn't play at it"
160,"Herath to Haddin, no run low-arm this time, it turns big too, but it is pitched well outside off, and he doesn't play at it"
161,"Herath to Haddin, no run flat, accurate, defended off the back foot"
162,"Randiv to Hussey, SIX runs another top shot from Hussey. Charges at Randiv, goes inside out over mid-off for the second six of the series. He was so close to the pitch of the ball the turn couldn't have bothered him"
163,"Randiv to Hussey, 1 run placed wide of mid-on for one"
164,"Randiv to Haddin, OUT Sharp offbreak, sharp catch! This is quick, turning in sharply, Haddin turns it around the corner... around the corner is Mathews at backward short leg who takes a smart low catch in front of him"
165,"Randiv to Johnson, no run this one doesn't turn in, pitches middle and leg, goes with the arm, beats him, hits him on the pad, but would have slid down the leg side"
166,"Randiv to Johnson, no run sharp turn and bounce outside off, Jayawardene is a jumping jack while collecting this"
167,"Randiv to Johnson, no run flighted outside off, Johnson gets forward and defends"
168,"Herath to Hussey, no run swept hard, into the shoulder of Paranavitana at forward short leg"
169,"Herath to Hussey, 1 run defended with an open face, gets a single to vacant point region"
170,"Herath to Johnson, no run floated outside off, left alone, not much turn"
171,"Herath to Johnson, no run nicely flighted, gets him driving away from the body, gets the inside edge, towards mid-on"
172,"Herath to Johnson, no run teasingly slow outside off, Johnson shoulders arms"
173,"Herath to Johnson, no run quicker, closer to off, defended"
174,"Randiv to Hussey, 1 run comes down the track and pushes this to long-off for one"
175,"Randiv to Johnson, no run beats him with an offbreak just outside off. Johnson's bat stays inside the line"
176,"Randiv to Johnson, no run sharp turn and bounce, beats the outside edge. Chest-high for PJ"
177,"Randiv to Johnson, no run this time left alone outside off"
178,"Randiv to Johnson, no run dip, turn and bounce. Pitches on a length, in front of off, turns away, and bounces over the stumps"
179,"Randiv to Johnson, no run this is a touch too straight, and Johnson defends off the front foot"
180,"Herath to Hussey, no run full and straight, pushed to mid-on"
181,"Herath to Hussey, 1 run sharp turn here, but this is short, and Hussey goes deep into the crease to help this around the corner"
182,"Herath to Johnson, no run more flight, drift and turn, Johnson goes to drive away from the body, against the turn, gets an inside edge because of the turn"
183,"Herath to Johnson, no run stays back this time, but it kicks off towards the rib region"
184,"Herath to Johnson, no run defended off the front foot, but not very convincingly, as this too kicks off from a length"
185,"Herath to Johnson, no run pushed away from the body, but off the middle of the bat, towards mid-off"
186,"Randiv to Hussey, no run Hussey pushes forward and defends this back to Randiv"
187,"Randiv to Hussey, no run flighted on middle and leg, Hussey defends this back to him"
188,"Randiv to Hussey, no run comes down the track, right to the pitch of the ball, drives it back to Randiv"
189,"Randiv to Hussey, no run tossed up outside off, spins away, Hussey plays with soft hands and an open face. Short third man is sharp, though"
190,"Randiv to Hussey, no run Edged and well short. Lovely bowling, pitches middle and off, turns away, Hussey's hands are soft, the edge is soft, and Mahela takes it on a half-volley at first slip"
191,"Randiv to Hussey, no run quicker, defended towards cover"
192,"Herath to Johnson, no run this is the carrom ball, pitches middle and leg, holds its line, hits Johnson in front of middle and leg. Kettleborough says no, and replays show a faint edge on the way"
193,"Herath to Johnson, 2 runs driven uppishly, not in control, but finds the gap in the covers"
194,"Herath to Johnson, 1 run flat, short, placed past point for one"
195,"Herath to Hussey, no run on the back foot to defend this one"
196,"Herath to Hussey, 1 run sweeps this along the ground for one"
197,"Herath to Johnson, no run flighted outside off, Johnson is well forward to defend"
198,"Randiv to Hussey, no run driven with the turn, can't beat extra cover"
199,"Randiv to Hussey, FOUR runs the calculating genius of Hussey, plays the rare aerial sweep shot, but in front of square, for four through midwicket"
200,"Randiv to Hussey, no run slower through the air, defends off the front foot"
201,"Randiv to Hussey, 1 run lovely running, just tips and runs to cover, and of all the places Sri Lanka is the toughest place to keep taking sharp singles all day long"
202,"Randiv to Johnson, no run slightly short of a length, defended with an open face"
203,"Randiv to Johnson, 2 runs Johnson's patience ends. He goes for the slog-sweep, gets a thick top edge over the slips"
204,"Herath to Hussey, no run quick, full, 93ks Hussey adjusts well, bringing the bat down in time"
205,"Herath to Hussey, 2 runs helped towards fine leg for a couple"
206,"Herath to Hussey, 1 run guides this past point for one"
207,"Herath to Johnson, 2 runs flighted outside off, driven against the turn, middle of the bat, along the ground, gets a couple"
208,"Herath to Johnson, 1 run drifting into the pads, helped away into the leg side"
209,"Herath to Hussey, no run floated across him, defended off the back foot"
210,"Randiv to Johnson, no run turn and bounce again, beats the outside edge as Johnson looks to defend"
211,"Randiv to Johnson, no run big appeal for a catch at the wicket. There is sharp turn and bounce, but there is also daylight between bat and pad. The shout more in hope than conviction. Can't fool Mr Dar"
212,"Randiv to Johnson, 2 runs too straight, worked into the leg side for two"
213,"Randiv to Johnson, 2 byes Where did this come from? Pitched on a length, just outside off, and explodes, chest high, and even PJ can't collect this"
214,"Randiv to Johnson, no run and he misses the edge again! This is flighted again, pitches on a length, in front of off, and with a puff of dust, kicks off. PJ does well this time to collect it"
215,"Randiv to Johnson, FOUR runs poor delivery to end the over, and Johnson is alert enough to crash this short delivery through the covers for four"
216,"Lakmal to Hussey, 1 run starts with a full ball on the pads, and is picked away for a single"
217,"Lakmal to Johnson, no run angled across Johnson, left alone"
218,"Lakmal to Johnson, no run short of a length, pitched outside leg, hits Johnson's pads in front of middle. Rightly given not out"
219,"Lakmal to Johnson, OUT soft soft dismissal after many much more menacing deliveries! This is short and wide, going wider, but Johnson goes for the pull as opposed to the cut, and gets a faint bottom edge through to PJ. It was so innocuous the slips didn't even realise he had edged it!"
220,"Lakmal to Harris, no run shortish, widish, Harris leaves it be"
221,"Lakmal to Harris, no run good thinking, tries to slip in the yorker, off-stump line, Harris keeps it out, though"
222,"Randiv to Hussey, 1 run Hussey keeps nudging and deflecting. this time he stretches forward and drops this towards point for a single"
223,"Randiv to Harris, no run this one turns in sharply, Harris plays towards the short legs, but bisects them"
224,"Randiv to Harris, 1 run uppishly played, but between forward short leg and short midwicket"
225,"Randiv to Hussey, no run sharp turn and bounce, but this is pitched outside off, and he doesn't play at it"
226,"Randiv to Hussey, no run presses right forward to defend this to cover"
227,"Randiv to Hussey, no run slower offbreak, short to, Hussey covers the stumps, and shoulders arms"
228,"Lakmal to Harris, OUT Finally they get an lbw out of Kettleborough. This takes a long internal deliberation, though. This is short outside off, Harris doesn't offer a shot, the ball seams back in sharply, and hits him just under the knee roll, just outside off. Because he was not playing a shot, the point of impact was irrelevant. To me, it looked like it would have the the top of off. Kettleborough takes his time before"
229,"Lakmal to Copeland, FOUR runs gets a nice juicy full toss on the pads, and he glances it fine for an easy boundary. Sri Lanka is a very welcoming country, Trent"
230,"Lakmal to Copeland, no run back of a length, defended to leg"
231,"Lakmal to Copeland, no run length ball, pushed to cover"
232,"Lakmal to Copeland, no run full and wide, left alone harmlessly"
233,"Lakmal to Copeland, no run another harmless wide delivery, watches it through to PJ"
234,"Randiv to Hussey, no run pitched up outside off, left alone to turn away"
