,Data
424,"Lyon to NT Paranavitana, no run slowish one outside off, he lets it go"
425,"Lyon to NT Paranavitana, no run flighted full now, he keeps it out off the front foot"
426,"Lyon to NT Paranavitana, no run keeps low now, Para is caught in the crease to a length ball and jabs it towards point"
427,"Copeland to Thilan Samaraweera, no run lumbers in and bowls one around 122 kph some way outside off, gentle, harmless, left alone"
428,"Copeland to Thilan Samaraweera, no run 123.9 kph but lot more zip on it, better direction too, heading for off stump, draws him out and has him defending"
429,"Copeland to Thilan Samaraweera, no run Thilan lets length ball go outside off"
430,"Copeland to Thilan Samaraweera, no run steady and close to off, Thilan reaches out and smothers it"
431,"Copeland to Thilan Samaraweera, 1 run comes in from outside off, Thilan is well forward and gets the push past short extra cover"
432,"Copeland to NT Paranavitana, no run angles it fullish on middle, and he works it towards midwicket"
433,"Lyon to Thilan Samaraweera, no run shortish one turning in from outside off, he goes back and cuts but cannot find the gap"
434,"Lyon to Thilan Samaraweera, no run lovely delivery, tossed up, drifting away a shade, and turning in, he goes for the push away from the body, and gets it off the inner half of the bat to the bowler"
435,"Lyon to Thilan Samaraweera, no run pushed down the track off the front foot"
436,"Lyon to Thilan Samaraweera, no run turns in sharply and he shuffles to keep it down in front of short leg"
437,"Lyon to Thilan Samaraweera, no run padding up well outside off, struck on the flap and Australia clear their throats, umpire Dar is unmoved"
438,"Lyon to Thilan Samaraweera, FOUR runs he has been bowling too many of these shortish ones, Thilan puts this one away through cover off the back foot"
439,"Copeland to NT Paranavitana, 1 run nudged to long leg off the pads"
440,"Copeland to Thilan Samaraweera, no run moving in from a length outside off, he gets behind the line to block"
441,"Copeland to Thilan Samaraweera, no run drives solidly but there is not much width and he finds mid off"
442,"Copeland to Thilan Samaraweera, no run worked from the crease in front of square leg"
443,"Copeland to Thilan Samaraweera, 2 runs worked on the leg side for a couple"
444,"Copeland to Thilan Samaraweera, no run curls in from outside off, left alone though"
445,"Lyon to NT Paranavitana, no run goes forward and smothers a tossed up ball"
446,"Lyon to NT Paranavitana, no run turning away from a fuller length on middle, defended off the front foot"
447,"Lyon to NT Paranavitana, no run whoa, this one kicks, spits, bounces from a length, can't do anything with those, especially if you are caught on the back foot"
448,"Lyon to NT Paranavitana, no run pushed off the front foot"
449,"Lyon to NT Paranavitana, no run oh boy, how has that missed off stump, but that aside, it is a brave leave from Para, it was angled in and tossed up full around off, straightened and headed for Para's bat but he got it out of the way in the end, Haddin could not believe that it missed off"
450,"Lyon to NT Paranavitana, 1 run uses his feet finally to the spinner, gets down and clips him towards mid on for a single"
451,"Johnson to NT Paranavitana, (no ball) Mitch strikes first ball after lunch, or does he, umpire Kettleborough thinks for a moment and slowly raises the finger, Para shuffled well across the stumps looking to flick a length ball off middle and leg, was there some bat before he took it on the pad, Sri Lanka go for the review, but wait, Mitch seems to have overstepped, don't bother about inside edges and stuff, go back to"
452,"Johnson to Thilan Samaraweera, no run Mitch lets the bouncer rip in anger but it goes down the leg side and Thilan goes under it immediately"
453,"Johnson to Thilan Samaraweera, no run banged in short of a length, Thilan stands tall in the crease, gets behind it and defends"
454,"Johnson to Thilan Samaraweera, no run slung full and across the right-hander, he decides to have a go at it, misses"
455,"Johnson to Thilan Samaraweera, no run whoa, hurled full, too full, too wide outside off, and Thilan has nothing to do with it"
456,"Johnson to Thilan Samaraweera, no run beats him outside off with a 137.8 kph full delivery that he tries to squeeze away but cannot connect"
457,"Johnson to Thilan Samaraweera, no run bowled fuller on the stumps, Thilan keeps it out with a straight bat"
458,"Copeland to NT Paranavitana, no run moves away a touch in the air but too far outside off to make any impact"
459,"Copeland to NT Paranavitana, no run goes fuller and on off stump, Para gets forward and pushes on the leg side"
460,"Copeland to NT Paranavitana, no run around that off stump again, Para shuffles across and blocks"
461,"Copeland to NT Paranavitana, no run still fuller and straight with the push to Watson at short and straight mid off"
462,"Copeland to NT Paranavitana, FOUR runs outside edge as he presses forward, but there is a mile between Clarke at wide slip and Haddin and the ball manages to find that gap"
463,"Copeland to NT Paranavitana, no run holding its line a touch outside off stump, but Para has it covered and leaves"
464,"Johnson to Thilan Samaraweera, no run sharp bouncer from Mitch, he has been rather fired up after that reviewed no-ball, Thilan just about crouches under it"
465,"Johnson to Thilan Samaraweera, no run reaches forward and pushes a fuller delivery back to the bowler"
466,"Johnson to Thilan Samaraweera, no run stretches forward to one bowled wider outside off and pushes to cover"
467,"Johnson to Thilan Samaraweera, 2 runs tries to hurry him with a pacy short of a length ball climbing in to the body, but Thilan shuffles across and works it past short leg"
468,"Johnson to Thilan Samaraweera, 2 runs opens the face and gets a fullish one behind point"
469,"Johnson to Thilan Samaraweera, 3 runs again he shuffles and tucks a shortish one through midwicket, they really need to get a move on and Thilan is looking positive"
470,"Copeland to Thilan Samaraweera, no run pushed off the back foot on the off side from a length"
471,"Copeland to Thilan Samaraweera, no run finds bounce from a length but Thilan sees it and allows it to thud in to Haddin's gloves"
472,"Copeland to Thilan Samaraweera, no run gets forward and across and solidly blocks another one close to off stump"
473,"Copeland to Thilan Samaraweera, no run some way outside off stump as Copeland does what he has been doing all day, Thilan leaves"
474,"Copeland to Thilan Samaraweera, no run more width outside off stump but Thilan refuses to go after it"
475,"Copeland to Thilan Samaraweera, no run pushes away from the body from the crease, finds short cover"
476,"Johnson to NT Paranavitana, no run goes for the leg stump with a full delivery slanted in, looked to be going down the leg side"
477,"Johnson to NT Paranavitana, 1 run gets front pad a long way across, manages to get bat down in time to defend off an inside edge towards square leg"
478,"Johnson to Thilan Samaraweera, no run Thilan is searching for scoring opportunities, reaches out and pushes with an open face, gets it to cover"
479,"Johnson to Thilan Samaraweera, 1 run finds the gap and pinches a tight single now wide of extra cover, could have been tighter had the throw found the stumps at the non-striker's"
480,"Johnson to NT Paranavitana, no run Para continues to block, keeps out another one around off stump"
481,"Johnson to NT Paranavitana, no run too wide outside off to elicit anything other than a leave from Para"
482,"Copeland to Thilan Samaraweera, no run Copeland hovering outside off stump, Thilan gets forward and pushes with an open face towards point"
483,"Copeland to Thilan Samaraweera, 1 run comes in with the angle and he picks it behind square leg"
484,"Copeland to NT Paranavitana, 1 run bowled full and on the pads to the left-hander, clipped through square leg"
485,"Copeland to Thilan Samaraweera, no run moving away but from too far outside off, left alone"
486,"Copeland to Thilan Samaraweera, no run better, fuller and closer to off, Thilan well forward in defence"
487,"Copeland to Thilan Samaraweera, no run reaches out and drives a full delivery, finds short extra cover"
488,"Johnson to NT Paranavitana, no run starts the over with a decent length delivery that forces Para to push forward quickly in solid defence"
489,"Johnson to NT Paranavitana, no run bowls it fuller but also wider outside off stump, Para takes a look and shoulders arms"
490,"Johnson to NT Paranavitana, 2 runs fine shot, Para goes down the ground with a well-timed push off a fullish one, it gathers pace and mid on has to put in a slide to stop it after a sharp little chase"
491,"Johnson to NT Paranavitana, no run left alone outside off as it is banged in short of a length"
492,"Johnson to NT Paranavitana, (no ball) goes full with more effort outside off, finds lots of bounce from that length, but also oversteps"
493,"Johnson to NT Paranavitana, no run nice firm push from Para, stretches towards a fullish one but Ponting is in the way at short extra cover"
494,"Johnson to NT Paranavitana, 2 runs goes full for the stumps but Para uses the angle to push it down the ground, short midwicket goes after it, there is no mid on, and pulls it back"
495,"Lyon to Thilan Samaraweera, no run finds some sharp turn but from a shortish length, Thilan goes back and nudges on the leg side"
496,"Lyon to Thilan Samaraweera, no run that keeps low, it was shortish again and spun in, but Thilan ended up swinging the attempted cut over the ball, and missed"
497,"Lyon to Thilan Samaraweera, no run connects this time but straight to the man at cover"
498,"Lyon to Thilan Samaraweera, no run bowled fuller, and Thilan gets forward to block it"
499,"Lyon to Thilan Samaraweera, no run more blocking outside off from Thilan, perhaps they could do with a silly point"
500,"Lyon to Thilan Samaraweera, 3 runs invites the drive with a full delivery and finds Thilan eagerly accepting it with a stretch towards it and a caress past extra cover"
501,"Watson to Thilan Samaraweera, 2 runs angled in on the pads and he flicks uppishly through square leg"
502,"Watson to Thilan Samaraweera, no run Watson is getting some inward movement in the air straight away, Thilan gets a leading edge towards cover as he tries to work him on the leg side"
503,"Watson to Thilan Samaraweera, no run another one zips in a long way, Thilan is hurried in to a defensive jab outside off"
504,"Watson to Thilan Samaraweera, FOUR runs digs it in short, but with the angle on the pads, thilan shuffles to tickle it just past a diving Haddin"
505,"Watson to Thilan Samaraweera, no run Australia appeal for leg before but Thilan was struck well outside the line of off as he presses forward to one that came back in again, looked to be a bit of bat too"
506,"Watson to Thilan Samaraweera, no run he is wary of that inward movement and is playing off the back foot now, pushed back to the bowler"
507,"Lyon to NT Paranavitana, 1 run tossed up full but on leg and clipped in front of square"
508,"Lyon to Thilan Samaraweera, 1 run well played Thilan, down the track, takes it on the full and eases it to long on"
509,"Lyon to NT Paranavitana, no run tossed up from round the stumps, close to off, and he smothers it off the front foot as it turns away"
510,"Lyon to NT Paranavitana, no run angled in full from wide of the crease and pushed with the turn towards point"
511,"Lyon to NT Paranavitana, no run across and down the track outside off, but finds that he can only defend it away"
512,"Lyon to NT Paranavitana, no run floated up too full and too wide outside off, left alone"
513,"Watson to HAPW, no run shapes in predictably from Watson, but Prasanna is well forward in defence to keep it out on the off side"
514,"Watson to HAPW, no run nips in outside off stump, Pras pulls bat out of the line in the end"
515,"Watson to HAPW, no run that has come in a very long way, Pras chose to leave it as he saw it well outside off, but it tailed in and wasn't too far from off stump"
516,"Watson to Angelo Mathews, no run goes for the full delivery, Angelo digs it out calmly"
517,"Lyon to NT Paranavitana, no run he plays a length ball off the back foot, it bounces and turns away but he is able to push it away"
518,"Lyon to NT Paranavitana, 1 run fired in fullish, he goes down and sweeps from around off to deep square leg"
519,"Lyon to Angelo Mathews, no run turns in sharply and bounces after drifting away, inside edge as he presses forward, towards short leg"
520,"Lyon to Angelo Mathews, no run defended down the track"
521,"Lyon to Angelo Mathews, no run tossed up ball, and he gets forward to push firmly to the bowler"
522,"Lyon to Angelo Mathews, no run blocked towards short leg"
523,"Watson to NT Paranavitana, no run slants it in full on the stumps, he works it towards short midwicket"
524,"Watson to NT Paranavitana, no run that almost sneaked through, at 137 kph too, darted in on a length with the angle, and Para keeps it out with an inside edge"
525,"Watson to NT Paranavitana, no run reaches away from the body and pushes a fuller one to cover"
526,"Watson to NT Paranavitana, OUT Watson continues to strike the pads, this time it is Para who has to depart, three wickets in three overs, end of Para's prolonged vigil, it kept low as it came in with the angle from round the stumps, he was caught in the crease and almost fell over as he missed the work on the leg side, that would have hit leg stump as Sri Lanka find on the review, two reviews against umpire Kettleborough"
527,"Watson to Randiv, 1 run goes for the stumps with a fuller incoming delivery, Randiv manages to work it behind square leg"
528,"Watson to Angelo Mathews, no run short ball now from Watson, Angel gets head out of the way and allows it to go past"
529,"Lyon to Randiv, no run tries to push towards cover but it turns in sharply to go in the air towards Lyon who stops it with a dive"
530,"Lyon to Randiv, FOUR runs offspinner takes on offspinner, Randiv sees a tossed up ball and swings it over midwicket with the turn"
531,"Lyon to Randiv, no run goes for the slog sweep this time, from outside off, misses and is hit on the body"
532,"Lyon to Randiv, no run and then he plays a very careful forward defensive with soft hands that smothers the ball near the bat"
533,"Lyon to Randiv, no run pushed back to the bowler off the front foot"
534,"Lyon to Randiv, no run super fielding from Copeland at backward square leg, it was swept with the turn from middle and leg but he lunged to his left, stopped it and fired in the throw to Haddin"
535,"Watson to Angelo Mathews, no run comes down the track to counter the incoming delivery, and tucks it towards midwicket"
536,"Watson to Angelo Mathews, 1 run clipped with the inward angle off the pads through square leg"
537,"Watson to Randiv, 1 run takes a step down the track and pushes solidly wide of extra cover for a single"
538,"Watson to Angelo Mathews, no run low full toss around off stump, Angelo pushes it back down the track, Watto gets a hand to it and takes all the pace off it"
539,"Watson to Angelo Mathews, no run gets front leg out of the way to work an incoming fullish one towards midwicket"
540,"Watson to Angelo Mathews, no run hurries in from a length, he keeps it out with an angled bat"
541,"Lyon to Randiv, 1 run tossed up ball worked with the turn past midwicket"
542,"Lyon to Angelo Mathews, 2 runs deep midwicket saves the boundary with a tumbling stop to his right, it is Copeland again, Angelo had split the gap with a well-timed sweep"
543,"Lyon to Angelo Mathews, no run pushed on the off side"
544,"Lyon to Angelo Mathews, no run flighted very full, smothered down the track"
545,"Lyon to Angelo Mathews, 1 run short, flat and hurrying in, he goes back and slaps it towards cover"
546,"Lyon to Randiv, no run pushes away from the body, and the ball turns in and goes down the track off the inner part of the blade"
547,"Watson to Angelo Mathews, no run hangs in the crease and guides with an open face to point"
548,"Watson to Angelo Mathews, no run jagging back in all the time from Watson, he uncertainly pushes it off an inside edge on the leg side"
549,"Watson to Angelo Mathews, 1 run dug in shortish, he gets on top to punch wide of extra cover to bring up the 100"
550,"Watson to Randiv, no run gets outside the crease and works towards midwicket"
551,"Watson to Randiv, no run width outside off, but the movement means Randiv mistimes the push to mid off"
552,"Watson to Randiv, no run guided to point from the crease, a touch short from Watto"
553,"Lyon to Herath, no run takes off and through Haddin's gloves outside off as Lyon finds bounce from a length, Herath leaves"
554,"Lyon to Lakmal, 1 run worked in the air just past short leg for a single"
555,"Lyon to Randiv, no run pushed off the front foot on the off side"
556,"Lyon to Randiv, 1 run down the track and eases with the turn to long on, keeps strike"
557,"Watson to Randiv, no run quietly defends one coming in off the front foot"
558,"Watson to Randiv, no run fuller and coming in as usual, he keeps it out with a forward defensive"
559,"Watson to Randiv, 1 run just a bit of width outside off and he squeezes it behind point"
560,"Watson to Lakmal, no run still fuller, he as late in getting forward but eventually got the front foot out a shade and managed to push it away as it tailed in"
561,"Watson to Lakmal, no run goes after a pitched up delivery that moves in a long way, inside edge that Haddin cannot stop cleanly"
562,"Watson to Lakmal, no run survives, keeps out a length ball with a straight bat"
563,"Lyon to Welegedara, no run gets forward and keeps out a turning length ball"
564,"Lyon to Welegedara, 1 run nudged with the turn past forward short leg"
565,"Lyon to Lakmal, 1 run charges down the track and heaves down to long on"
566,"Lyon to Welegedara, no run turn and bounce, was there a bit of glove on that, far away from short leg though"
567,"On Test debut, a proud Nathan Lyon leads Australia off the field with the ball in his hands. No fight at all from Sri Lanka, they were always under pressure after Dilshan's needless bravado early on. Australia doing everything right, seamers not giving anything away in terms of width or driving length, spinner coming in superbly on a helpful pitch, and allrounder proving his value with deadly reverse swing. Fielding backing up"
568,Innings Start
569,"Cricnazi: ""wonder how many the two teams would've managed had warne and muralidharan bowled on this track!!"""
