,Data
0,"New Zealand have won the toss and elected to bat first. Brendon McCullum will open the batting and keep wicket, Cumming comes into the NZ side for Jeetan Patel while the Australian team is unchanged."
1,"Bracken to McCullum, no run nudges it out to Hussey"
2,"Bracken to McCullum, no run Just outside the off stump. Guptill pushes it back and Bracken fields in his follow through"
3,"Bracken to McCullum, no run Fires in a quicker ball, defended to leg side"
4,"Bracken to McCullum, 3 runs flicked to backward square leg. Hilfenhaus misfields and the batsmen manage three out of what should have been a dot ball"
5,"Bracken to Guptill, no run leaves a lifting ball outside off stump"
6,"Bracken to Guptill, no run Slower ball angled across the batsman. Defends on the offside"
7,"Hilfenhaus to McCullum, 1 run"
8,"Hilfenhaus to Guptill, no run Shorter ball, defends awkwardly"
9,"Hilfenhaus to Guptill, no run angled down leg turned off the hip."
10,"Hilfenhaus to Guptill, no run Squared up and defended on offside"
11,"Hilfenhaus to Guptill, no run nudged to mid on"
12,"Hilfenhaus to Guptill, 1 run Guptil gets on the back foot and pushes into the covers. Hopes slides across put they're through for a quick single"
13,"Bracken to Guptill, no run Guided to backward point, no run there"
14,"Bracken to Guptill, no run pushes wide of off stump. No shot offered"
15,"Bracken to Guptill, no run pushed wide of off stump again"
16,"Bracken to Guptill, no run pushed to point. David Hussey rushes in to field"
17,"Bracken to Guptill, 2 runs rocks onto the back foot and drives through the covers. Clarke has to work hard to chase the ball down before the boundary"
18,"Bracken to Guptill, no run Drives at the ball and fielded at forward point"
19,"Hilfenhaus to McCullum, 2 runs Charges and plays backward of pint. flicked to the stumps and they take an overthrow"
20,"Hilfenhaus to McCullum, 1 run edged to third man"
21,"Hilfenhaus to Guptill, no run defended a rising ball into covers"
22,"Hilfenhaus to Guptill, no run driven to mid on"
23,"Hilfenhaus to Guptill, no run cross bat smash to point"
24,"Hilfenhaus to Guptill, no run attempts to flick it down to backward square leg but can't get the ball away"
25,"Bracken to McCullum, no run Turned off the but this time fielded cleanly at backward square leg"
26,"Bracken to McCullum, 1 run On the front foot, pushed into the covers where Mike Hussey fields"
27,"Bracken to Guptill, no run Leaves one outside off stump angled across him"
28,"Bracken to Guptill, no run Full delivery and drives. Bracken jumps high to field in his follow through"
29,"Bracken to Guptill, no run Pitched up and square drives. Ponting does well to cut it off and fires it back at Haddin who does some acrobatics with the return"
30,"Bracken to Guptill, no run Gets forward and defends"
31,"Hilfenhaus to McCullum, no run On the backfoot and angled to Ponting at point"
32,"Hilfenhaus to McCullum, no run Backfoot defence to extra cover where Hopes fields well"
33,"Hilfenhaus to McCullum, 1 run Short of a length and played just forward of point where Ponting fields"
34,"Hilfenhaus to Guptill, no run Pitched up, Pushed to Clarke at mid off"
35,"Hilfenhaus to Guptill, 2 runs Pitched on middle and leg and played through mid wicket"
36,"Hilfenhaus to Guptill, no run On the backfoot and played in the air to backward point. Falls short of Ponting"
37,"Bracken to McCullum, 2 runs Backfoot and steers it wide of Ponting at point"
38,"Bracken to McCullum, no run A slower ball, onto the front foot and played to Mike Hussey at mid wicket"
39,"Bracken to McCullum, no run Gets back and attempts to steer to third man, risky shot"
40,"Bracken to McCullum, 1 run gets forward and drops the ball at his feet and runs. Memories of Dean Jones there"
41,"Bracken to Guptill, no run left outside off stump"
42,"Bracken to Guptill, no run played to point"
43,"Hilfenhaus to McCullum, no run wide, down leg side"
44,"Hilfenhaus to McCullum, 1 run pushed to mid wicket for a single"
45,"Hilfenhaus to Guptill, 1 run angled down leg side and just gets an edge to it down to backward square leg"
46,"Hilfenhaus to McCullum, 2 runs forward and drives through point"
47,"Hilfenhaus to McCullum, no run wide outside off stump and McCullum smashes the ball straight to Ponting at point. That flew off the bat"
48,"Hilfenhaus to McCullum, no run Drives on the up, but straight to Hussey in the covers, just can't get it through the field"
49,"Bracken to Guptill, no run Over the wicket and the batsman is on the front foot and defending"
50,"Bracken to Guptill, no run Bracken charges in and its defended on the offside"
51,"Bracken to Guptill, 2 runs Strays on to leg stump and flicked off the pads to backward square leg. 12th man Voges fields in the deep"
52,"Bracken to Guptill, no run Over the wicket and Guptil defends on onside"
53,"Bracken to Guptill, no run Drives in the air, falls short of the mid off fieldsman"
54,"Bracken to Guptill, SIX runs Opens the shoulders and its gone miles over long on"
55,"Johnson to McCullum, no run McCullum drives into covers. Clarke does the fielding"
56,"Johnson to McCullum, no run Forward and defends to Hussey at short cover"
57,"Johnson to McCullum, 1 run guided to third man. Hilfenhaus fields"
58,"Johnson to Guptill, no run shorter ball defended down. Johnson fields"
59,"Johnson to Guptill, no run Defends into covers. Hussey fields again"
60,"Johnson to Guptill, 2 runs Puched through the covers. Hopes chases, pauses and throws but they are home"
61,"Bracken to McCullum, no run on line with the stump, giving no freedom whatsoever to McCullum to free his arms. He just manages to defend it on the off side"
62,"Bracken to McCullum, 1 run good length delivery outside the off stump. McCullum runs the ball down to third man for a single"
63,"Bracken to Guptill, no run short outside the off stump. Guptill, can't clear the field on the off side as he cuts it straight to the point fielder"
64,"Bracken to Guptill, no run fuller outside the off stump, Guptill comes forward and presents the full face of the bat"
65,"Bracken to Guptill, no run good length delivery outside the off stump, Guptill gets his bat down in an arc but can't manage to beat the fielder positioned at short cover"
66,"Bracken to Guptill, no run fuller on the leg stump, cramps Guptill up for room. Guptill, just manages to squeeze it to midwicket"
67,"Johnson to McCullum, no run outside the off stump, McCullum gets onto the backfoot and defends"
68,"Johnson to McCullum, 1 run short outside the off stump, McCullum gets onto the backfoot and allows the ball to come onto the bat as he steals a single"
69,"Johnson to Guptill, FOUR runs short on the middle stump, almost rushing onto Guptill as he looks to pull it away but does not manage to get any bat on it as the ball hits the helmet on it's way to the boundary. A Mistake there as they are awarded as runs"
70,"Johnson to Guptill, no run"
71,"Johnson to Guptill, no run outside the off stump, Guptill flashes his bat at it and is beaten"
72,"Johnson to Guptill, no run outside the off stump again. This time Guptill decides to play it closer to the body as he attempts to run it down to third man but the late swing beats him again"
73,"Hopes to McCullum, no run good length delivery outside the off stump to begin with as McCullum shuffles across and works it to midwicket"
74,"Hopes to McCullum, 1 run short outside the off stump as he sees McCullum come charging down the track. McCullum pushes it to point and sets off for a single"
75,"Hopes to Guptill, no run outside the off stump yet again as Guptill presents the full face of the bat in defense"
76,"Hopes to Guptill, 2 runs on the leg stump, Guptill works it away to long leg for a couple"
77,"Hopes to Guptill, no run outside the off stump, Guptill comes forward and defends"
78,"Hopes to Guptill, no run fuller outside the off stump. Guptill drives but can't clear trhe fielder at short cover again"
79,"Johnson to McCullum, 1 run outside the off stump, McCullum opens the face of the bat and runs the ball to cover for a single"
80,"Johnson to Guptill, no run outside the off stump, Guptill defends convincingly yet again but that is not what he should be doing"
81,"Johnson to Guptill, no run outside the off stump, Guptill opens the face of the bat to run the ball down to point"
82,"Johnson to Guptill, FOUR runs finally Guptill manages to find the gap on the off side as he thrashes an over-pitched delivery to cover boundary. Thats his first boundary on the off-side"
83,"Johnson to Guptill, 1 wide wide outside the off stump"
84,"Johnson to Guptill, no run"
85,"Johnson to Guptill, 1 run good length delivery outside the off stump. Guptill drives but gets a thick outside edge to third man for a single"
86,"Hopes to Guptill, no run fuller outside the off stump. Guptill, comes onto the frontfoot and drives it to mid-off"
87,"Hopes to Guptill, 1 run outside the off stump, Guptill pushes it to mid-on and runs across for a single"
88,"Hopes to McCullum, 1 run on the middle stump and cutting in. McCullum closes the face of the bat and pushes it to midwicket for a single. He brings up the fifty with that single"
89,"Hopes to Guptill, 1 run"
90,"Hopes to McCullum, no run outside the off stump, McCullum pushes it to point"
91,"Hopes to McCullum, no run good length delivery outside the off stump. McCullum comes charging down the track and changes his mind at the last moment as he pushes it to point"
92,"Johnson to Guptill, 2 runs good length delivery outside the off stump, Guptill, gets a thick outside edge to the right of third man for a couple"
93,"Johnson to Guptill, 1 run short on the leg stump. Guptill, stands tall and plays it down with soft hands on the leg side for a single"
94,"Johnson to McCullum, 1 leg bye short on the leg stump, McCullum looks to pull it away but is struck on the pads as he runs across for a leg-bye"
95,"Johnson to Guptill, FOUR runs fuller outside the off stump, Guptill, gets under the delivery easily as he chips it over mid-off for a boundary"
96,"Johnson to Guptill, no run short length delivery outside the off stump, Guptill plays it to cover off the backfoot"
97,"Johnson to Guptill, 1 run short on the off and middle. Guptill, gets onto the backfoot and plays it to the vacant area on the leg side to pick a single"
98,"Clarke to Guptill, no run fuller outside the off stump to begin with. Guptill pushes it back to the bowler"
99,"Clarke to Guptill, no run on the middle stump, Guptill pushes it to midwicket"
100,"Clarke to Guptill, no run arm ball on the middle stump, Guptill, plays it with soft hands back to the bowler"
101,"Clarke to Guptill, no run arm ball again. Guptill is struck on the pads this time around"
102,"Clarke to Guptill, 1 run short on the middle stump, Guptill pushes it to long-on for a single"
103,"Clarke to McCullum, no run fuller and faster on the middle stump, McCulum stands tall and pushes it back to the bowler"
104,"Johnson to Guptill, 2 runs outside the off stump. Guptill, runs it down to third man for a couple"
105,"Johnson to Guptill, FOUR runs short and wide outside the off stump, Guptill cuts it but gets a top edge that flies over the point fielder for a boundary"
106,"Johnson to Guptill, 1 run outside the off stump, pushes it to point for a single"
107,"Johnson to McCullum, 1 run good length delivery on the middle stump, McCullum jumps around in the crease and pushes it to square leg for a single"
108,"Johnson to Guptill, OUT gone! Johnson pitches one short on the middle and leg stump this time around and hurries Guptill into the stroke. He manages to get some wood on the ball as he pulls it straight into the hands of Bracken, positioned at fine-leg exactly for this"
109,"Johnson to Fulton, no run outside the off stump, Fulton moves across and defends it to the leg side"
110,"Clarke to McCullum, no run good lenght delivery on the off stump. McCullum looks to defend it but gets an inside edge to square leg"
111,"Clarke to McCullum, no run comes down the track and defends"
112,"Clarke to McCullum, no run outside the off stump, McCullum comes down the track and defends it"
113,"Clarke to McCullum, 2 runs short outside the off stump, McCullum cuts it late to deep point for a couple"
114,"Clarke to McCullum, no run fuller delivery on the middle stump, McCullum comes down the track and defends it again"
115,"Clarke to McCullum, 1 run on the leg stump, McCullum turns it to fine leg for a single"
116,"Hopes to McCullum, no run outside the off stump, McCullum comes forward and defends it back to the bowler"
117,"Hopes to McCullum, 3 runs outside the off stump and fuller too as McCullum beats Clarke at mid-off to fetch three runs for himself"
118,"Hopes to Fulton, 2 runs fuller outside the off stump, Fulton drives it wide off the bowler to long-on for a couple"
119,"Hopes to Fulton, no run outside the off stump, Fulton comes forward and pushes it to the off side"
120,"Hopes to Fulton, 1 run good length delivery on the middle stump, Fulton turns it to midwicket for a single"
121,"Hopes to McCullum, no run outside the off stump, McCullum tries to run it down but cant clear the fielder at short third man"
122,"Clarke to Fulton, 1 run outside the off stump, Fulton comes forward and pushes it to mid-off for a single"
123,"Clarke to McCullum, no run outside the off stump, McCullum pushes it to the off side"
124,"Clarke to McCullum, 1 run on the leg stump, McCullum sweeps it away to fine leg for a single"
125,"Clarke to Fulton, no run on the middle stump and an arm ball as Fulton adjusts late and defends it back onto the pitch"
126,"Clarke to Fulton, 1 run arm ball on the middle stump, Fulton drives it to cover for a single"
127,"Clarke to McCullum, 1 run drives it to cover for another single"
128,"Hopes to McCullum, 1 run good length delivery on the pads as McCullum turns it to fine-leg for a single"
129,"Hopes to Fulton, no run good length delivery outside the off stump, Fulton defends it to cover"
130,"Hopes to Fulton, no run fuller on the off stump, Fulton, looks to work it away on the leg side but gets an outside edge to short third man"
131,"Hopes to Fulton, OUT one more! Fulton falls now as he does not manage to keep the ball down as he plays an intended drive on the off side to Bracken at mid-on and Kiwis slip further now"
132,"Hopes to McCullum, 1 run fuller on the middle stump, McCullum pushes it to midwicket for a single"
133,"Hopes to Taylor, no run on the leg stump, Taylor pushes it to the short cover fielder"
134,"Clarke to McCullum, no run fuller length delivery on the middle stump, McCullum drives it back to the bowler"
135,"Clarke to McCullum, 1 run on the leg stump, McCullum moves across and sweeps it to short fine leg for a single"
136,"Clarke to Taylor, no run outside the off stump, Taylor comes forward and defends it to cover"
137,"Clarke to Taylor, 1 run on the leg stump, Taylor pushes it to long-on for a single"
138,"Clarke to McCullum, no run outside the off stump, McCullum drives it to mid-off"
139,"Clarke to McCullum, OUT timber! McCullum is beaten by the arm ball on the run. He comes down the track in an attempt to loft it away but is beaten by the arm ball pitching on the middle stump and finds his leg stump displaced. This is even more bad news as two wickets fall in two overs"
140,"Hopes to Taylor, no run on the middle and off stump line, Taylor pushes forward and defends it away towards cover"
141,"Hopes to Taylor, no run similar line and length and Taylor is happy presenting the full face of the bat and watching the ball roll away silently"
142,"Hopes to Taylor, no run bit fuller but once again the line is good, Taylor, give the situation, I guess, taps it away on the off side"
143,"Hopes to Taylor, 1 run placed wide of the fielder at cover, easy single"
144,"Hopes to Elliott, no run another harmless delivery, watchfully defended"
145,"Hopes to Elliott, no run punched off the back-foot to the point region"
146,"Clarke to Taylor, 1 run drifting onto middle and leg, Taylor waits for the ball to turn and then works it away well in front of square leg for a single"
147,"Clarke to Elliott, no run quicker delivery outside the off stump, driven straight to the man at cover"
148,"Clarke to Elliott, no run angled in from outside the off stump, defended down on the leg side"
149,"Clarke to Elliott, no run worked away off the back-foot"
150,"Clarke to Elliott, 1 run slightly short, Elliott stays back and punches it away wide of the fielder at cover"
151,"Clarke to Taylor, 1 run another easy single on the off side"
152,"Hopes to Taylor, no run good length delivery outside the off stump, Taylor lines it up but the drive finds the fielder at mid-off"
153,"Hopes to Taylor, 1 run surprise bouncer and it nearly did the trick. Taylor goes for the pull instinctively and the ball balloons up towards backward square. Hussey runs in towards his left but fails it get there on time"
154,"Hopes to Elliott, 1 run worked away on the leg side for an easy single"
155,"Hopes to Taylor, no run Hopes keeps it tight outside the off stump, defended"
156,"Hopes to Taylor, no run fuller length delivery and that's driven straight to Ponting at short cover"
157,"Hopes to Taylor, no run good length delivery outside the off stump, Taylor runs it away behind point but fails to get it past the fielder. Another good over from Hopes comes to an end"
158,"Clarke to Elliott, no run starts off with a skidder and that is played away towards midwicket"
159,"Clarke to Elliott, no run goes for the drive but not a well timed shot and the ball rolls away off the inner half of the bat"
160,"Clarke to Elliott, no run driven off the front-foot, straight to the fielder at cover"
161,"Clarke to Elliott, 1 run driven square on the off side, just enough room and they scamper through for a single"
162,"Clarke to Taylor, 2 runs short and angling in, Taylor rocks back and cuts it past the fielder at point"
163,"Clarke to Taylor, no run on the middle and off stump line, punched straight back to the fielder"
164,"Hilfenhaus to Elliott, 1 run good length outside the off stump, Elliot shuffles across and runs it down to third man for a single"
165,"Hilfenhaus to Taylor, no run outside the off stump, Taylor tries to run it down to third man but gets an inside edge back onto the pitch"
166,"Hilfenhaus to Taylor, no run outside the off stump, drives it back to the bowler"
167,"Hilfenhaus to Taylor, no run outside the off stump, Taylor looks to slog it away on the leg side but gets a leading edge to cover"
168,"Hilfenhaus to Taylor, 1 run"
169,"Hilfenhaus to Elliott, 2 runs short outside the off stump and Elliot cuts it to deep point for a couple"
170,"Clarke to Taylor, 1 run fuller on the leg and middle, Taylor comes down the track and pushes it to long-on for a single and it brings the hundred up"
171,"Clarke to Elliott, 1 run good length delivery on the off stump, Elliot stands tall and drives it to sweeper cover for a single"
172,"Clarke to Taylor, no run fuller on the off stump, Taylor pushes it to the leg side"
173,"Clarke to Taylor, 1 run fuller outside the off stump, Taylor pushes it to sweeper cover for a single"
174,"Clarke to Elliott, 1 run outside the off stump, Elliot square drives it to deep point for a single"
175,"Clarke to Taylor, 1 run outside the off stump, Taylor pushes it to the right of the point fielder for a single"
176,"White to Taylor, no run begins with a good leg break outside the off stump. Taylor watches it right into the gloves of Haddin"
177,"White to Taylor, no run outside the off stump, Taylor comes forward and defends it"
178,"White to Taylor, SIX runs a googly gone terribly wrong as he flights it a lot more and Taylor picks it as he knocks the leather out of the ball in sending it soaring over fine leg for a six"
179,"White to Taylor, no run outside the off stump, Taylor comes forward and pushes it back to the bowler"
180,"White to Taylor, 1 run short outside the off stump, Taylor, cuts it to deep point for a single"
181,"White to Elliott, 1 run fuller on the leg stump. Invitation for Elliot to sweep and sweep he does for a single"
182,"Clarke to Elliott, no run short outside the off stump, Elliot looks to cut it away and is beaten"
183,"Clarke to Elliott, 1 run and pushes it to covers for a single"
184,"Clarke to Taylor, no run good length delivery on the off stump. Taylor drives it back to the bowler"
185,"Clarke to Taylor, no run outside the off stump, Taylor drives it back to the bowler"
186,"Clarke to Taylor, no run on the middle stump, Taylor drives it to short mid-on, where Ponting is doing the duties"
187,"Clarke to Taylor, 1 run short outside the off stump, Taylor cuts it to point for a single"
188,"White to Taylor, 1 run fuller on the off stump, Taylor drives it to long-on for a single"
189,"White to Elliott, FOUR runs fuller outside the off stump, Elliot smashes it to cover for a boundary"
190,"White to Elliott, 2 runs drives it to sweeper cover for a couple"
191,"White to Elliott, FOUR runs now he lets loose a slog sweep as he propels it to midwicket for a boundary"
192,"White to Elliott, 1 run on the leg stump, Elliot pushes it to midwicket for a single"
193,"White to Taylor, FOUR runs outside the off stump, Taylor cuts it past the point fielder and Hussey, drags it back in but not before he touches the ropes and Taylor too helps himself to a boundary. White was taken to task there as he conceded 16 runs off the over"
194,"Hopes to Elliott, 2 runs good length delivery outside the off stump, Elliot drives it wide of the long-off fielder for a couple"
195,"Hopes to Elliott, 1 run outside the off stump, Elliot runs it down to third man for a single"
196,"Hopes to Taylor, FOUR runs short outside the off stump, Taylor slog sweeps it to midwicket for a boundary and now they are revving it up"
197,"Hopes to Taylor, 1 run inside edge to deep square leg for a single"
198,"Hopes to Elliott, no run cut to point"
199,"Hopes to Elliott, no run outside the off stump, comes forward and defends it to midwicket"
200,"Johnson to Taylor, no run outside the off stump, Taylor comes forward and drives it to midwicket"
201,"Johnson to Taylor, no run outside the off stump, Taylor, is looking to drive it away on the off side but is beaten by the delivery cutting away"
202,"Johnson to Taylor, 1 run fuller delivery on the middle stump. Taylor, drives it to mid-on for a single"
203,"Johnson to Elliott, 2 runs short and wide outside the off stump. Elliot, moves across and cuts it to the left of Hilfenhaus to fetch himself a couple"
204,"Johnson to Elliott, no run Elliot shuffles across before the ball is bowled and Johnson notices it as he pitches it short on the middle and leg. Elliot lets it go"
205,"Johnson to Elliott, OUT short on the middle stump. Elliot does the pre-meditated shuffle and swats it in the gap between fine-leg and sweeper on the leg side. David Hussey, covers a lot of ground as he takes a good catch. It was more of a good catch from Hussey than a poor shot from El"
206,"Hopes to Cumming, no run outside the off stump, comes forward and defends it to point"
207,"Hopes to Cumming, no run defends it to cover point yet again"
208,"Hopes to Cumming, no run short ball outside the off stump, Cumming gets an outside edge to cover"
209,"Hopes to Cumming, no run good length outside the off stump, Cumming comes forward and drives it back to the bowler"
210,"Hopes to Cumming, no run short outside the off stump, Cumming sways out of the harm's way pretty easily"
211,"Hopes to Cumming, OUT gone! Cumming just manages to chip it to mid-off, where Johnson takes a straight-forward catch. It means Cumming has fluffed his chances in his first ODI in four years. Australia are in the driver's seat now"
212,"Johnson to Taylor, no run drives it to mid-off"
213,"Johnson to Taylor, 1 run looks to defend it on the frontfoot and gets an outside edge to third man for a single"
214,"Johnson to Broom, no run outside the off stump, Broom comes forward and pushes it to short mid-off"
215,"Johnson to Broom, no run outside the off stump. Broom shoulders arms to the delivery"
216,"Johnson to Broom, no run good length delivery on the middle stump. Broom comes forward and closes the face of the bat as he pushes it to midwicket"
217,"Johnson to Broom, no run on the middle stump, Broom, stands tall and pushes it to the leg side"
218,"Hopes to Taylor, 1 run fuller outside the off stump. Taylor drives it over a leaping Hopes for a single"
219,"Hopes to Broom, no run good length delivery on the middle stump. Broom comes forward and pushes it to midwicket"
220,"Hopes to Broom, no run outside the off stump and short in length. Broom, gets onto the backfoot and pushes it to point"
221,"Hopes to Broom, 1 run fuller in length on the middle stump. Broom, works it away to midwicket to get off the mark"
222,"Hopes to Taylor, 1 run good length delivery outside the off stump, Taylor plays it with soft hands to point and runs across for a single"
223,"Hopes to Broom, no run short outside the off stump. Broom looks to get the upper cut going but the bounce defeats the purpose"
224,"Hilfenhaus to Taylor, no run outside the off stump, Taylor looks to play it with soft hands but the ball rushes into him as he defends it back onto the pitch"
225,"Hilfenhaus to Taylor, 1 run short outside the off stump, Taylor cuts it to point, where Ponting does the fielding and throws the stumps down at the bowlers end. He ends up conceding a single as the ball is deflected off the stumps"
226,"Hilfenhaus to Broom, no run looks to run it down to third man but first slip does the fielding"
227,"Hilfenhaus to Broom, 1 wide high above the batsman's head and it is called a wide"
228,"Hilfenhaus to Broom, 1 run"
229,"Hilfenhaus to Taylor, 2 runs full on the middle stump, Taylor works it away to deep midwicket and runs quickly for a couple"
