,Data
370,"Cummins to Hope, no run fullish length on off, chipped to mid-on."
371,"Cummins to Hope, no run short of a length on off stump, clipped off the hips to square leg."
372,"Cummins to Hope, no run fullish length ball, Hope takes a step forward to heave over mid-on, inside edge caroms into the box. Hope grimaces with a wobbly shuffle toward point. He'll be feeling that for the next few overs..."
373,"Cummins to Hope, no run good length ball on middle stump, Hope shuffles across to clip to square leg."
374,"Cummins to Hope, no run bouncer, clears him ducking easily."
375,"Cummins to Hope, no run full on off, almost yorker length, stabbed out to point."
376,"Coulter-Nile to Pooran, no run full on off, defended down the pitch."
377,"Coulter-Nile to Pooran, no run short of a length on off, Pooran fights it off with his hands chopping it down behind the stumps."
378,"Coulter-Nile to Pooran, no run good length on the legs, clipped to midwicket."
379,"Coulter-Nile to Pooran, 1 run short on off, pulled along the ground to deep midwicket."
380,"Coulter-Nile to Hope, 2 runs fullish on middle, flicked off the back foot through midwicket."
381,"Coulter-Nile to Hope, 1 run edge! Short of a length from Coulter-Nile clips Hope's back foot poke, it flies wide of slip to third man."
382,"Cummins to Hope, no run short of a length into the body, defended to short midwicket."
383,"Cummins to Hope, no run short on the stumps, defended to point."
384,"Cummins to Hope, 1 wide bouncer, wide called on height."
385,"Cummins to Hope, 1 wide bouncer again, another wide called."
386,"Cummins to Hope, no run short on the body this time, Hope uncomfortable trying to pull, can't get it away."
387,"Cummins to Hope, no run short on off, Cummins is giving Hope a real working over here. Hops back looking skiddish here trying to bat it down into the ground."
388,"Cummins to Hope, 1 wide short of a length and angled way, way down leg."
389,"Cummins to Hope, no run short of a length on off, defended behind point."
390,"Cummins to Hope, 1 run short on off stump, extra bounce as this one pings Hope on the gloves before the ball flutters into the off side. He survives a testing over from Cummins."
391,"Maxwell to Hope, 1 run full on the legs, clipped through square leg."
392,"Maxwell to Pooran, FOUR runs short outside off, plenty of time for Pooran to rock back, cuts in front of point. Zampa sweeping on the cover rope tries to slap it back in vain."
393,"Maxwell to Pooran, 3 runs full angled into middle stump this time, driven firmly through cover, this time Zampa has to track 25 yards to his left to cut it off, saving the fourth run."
394,"Maxwell to Hope, 1 run flighted on leg stump at 57 mph, clipped to deep midwicket."
395,"Maxwell to Pooran, 1 run short on fourth stump, punched off the back foot to cover sweeper."
396,"Maxwell to Hope, no run short outside off on fifth stump, slapped to extra cover."
397,"Coulter-Nile to Pooran, 1 run good length on the legs, clipped through midwicket."
398,"Coulter-Nile to Hope, 1 run the short ball attack on Hope continues. Bounced and goes to hook Coulter-Nile, gloves it and the ball balloons over vacant short fine leg."
399,"Coulter-Nile to Pooran, 1 run good length on off, punched off the back foot to cover sweeper."
400,"Coulter-Nile to Hope, no run good length ball on fifth stump, defended to backward point."
401,"Coulter-Nile to Hope, no run bouncer again to Hope, beaten trying to hook at 84 mph. He's not shown much sign of seeing this off with confidence."
402,"Coulter-Nile to Hope, 1 run short on the body, a bit more convincing this time around with the pull and keeps his wrists rolling over it along the ground to square leg."
403,"Maxwell to Hope, no run full on the legs, goes to sweep and is late, hit on the pads but pitching outside leg results in a stifled appeal from Maxwell."
404,"Maxwell to Hope, no run fullish length on leg stump, goes back to clip to midwicket."
405,"Maxwell to Hope, 1 run short on the stumps, punched to mid-off."
406,"Maxwell to Pooran, no run full and driven to cover."
407,"Maxwell to Pooran, 1 run short of a length outside off, punched to the cover sweeper."
408,"Maxwell to Hope, 1 run short on leg stump, Hope backs away to carve through the off side to the sweeper."
409,"Coulter-Nile to Hope, 1 run short of a length on off, punched off the back foot to cover sweeper."
410,"Coulter-Nile to Pooran, no run full on off stump, Pooran onto the front foot to push to cover."
411,"Coulter-Nile to Pooran, no run full on the legs, misses a flick, goes off the pads down leg side, diving stop by Carey saves four leg byes."
412,"Coulter-Nile to Pooran, no run fullish length on fifth stump, Pooran tries to flat bat this over mid-on but the ball doesn't come on, goes under to Carey."
413,"Coulter-Nile to Pooran, 1 run good length on fourth stump, punched off the back foot wide of backward point to third man fielding very square on the rope."
414,"Coulter-Nile to Hope, 1 run short on the stumps, pulls it into the ground to square leg, slight misfield to allow the run."
415,"Zampa to Hope, 1 leg bye drifting in leg, it comes off pad and runs behind square for a leg bye"
416,"Zampa to Pooran, no run very full, this drifts a long way and yorks him outside off, he misses"
417,"Zampa to Pooran, no run A review for a run out at the non striker's end. This was driven firmly back at the bowler, Zampa reached down to his right, got a touch and it went onto the stumps but Hope was back comfortably. It is not out."
418,"Zampa to Pooran, 1 run dropped at cover! Barely a chance to Maxwell. He saved four really. This was cracked hard to Maxwell's right, he dives and knocks it down with the right hand and it runs away for a single"
419,"Zampa to Hope, no run good length, he chops it into the pitch and it bounces up, Carey knocks it onto the stumps but Hope is back"
420,"Zampa to Hope, no run quicker, drifting in, he defends into the off side"
421,"Stoinis to Pooran, no run 128kph, good length on middle, he defends back to the bowler"
422,"Stoinis to Pooran, SIX runs hooked fine off the top edge for six! This was a well directed bouncer, he hooked but got a top edge, fine leg is square and it carried all the way for six"
423,"Stoinis to Pooran, no run good length, top of off, he defends into the off side"
424,"Stoinis to Pooran, 1 run 131kph, good length fourth stump line, he pushes this through point to the sweeper"
425,"Stoinis to Hope, 1 run shorter bouncer, 129kph, he pulls with control from in front of eyes to deep square"
426,"Stoinis to Pooran, no run 133kph, bouncer, it's reasonably high, calls for a wide from the crowd but the umpires ignore them"
427,"Zampa to Hope, no run drifting into leg, 88kph, leg break, he defends towards midwicket"
428,"Zampa to Hope, no run tossed high and wide of off, he mistimes a drive to cover"
429,"Zampa to Hope, no run low full toss, he yorks himself, digging it out to cover"
430,"Zampa to Hope, no run drifting into middle and off, he defends into the off side"
431,"Zampa to Hope, FOUR runs cracked off the back foot through cover! Seized the length quickly. It was fractionally short and he is back in a flash, giving room and punching this past Smith at cover and away to the rope"
432,"Zampa to Hope, 1 run low full toss, he drives firmly to long off"
433,"Stoinis to Hope, no run fuller length angled into off, he drives off a thick inside edge to mid on"
434,"Stoinis to Hope, no run 132kph, low full toss, he drives off the toe end of the bat to mid off"
435,"Stoinis to Hope, 1 run 133kph, good length, top of middle, he's caught on the crease but whips it fine to fine leg, it was awkward but effective"
436,"Stoinis to Pooran, no run 132kph, back of a length, on leg, he defends this towards midwicket"
437,"Stoinis to Pooran, 1 run back of a length on the hip, he tucks this behind square"
438,"Stoinis to Hope, FOUR runs pulled wide of fine leg! Chest high short ball is easy pickings for Hope. He rolls the wrists and gets it in the gap between fine leg and deep square"
439,"Zampa to Hetmyer, 1 run shorter length, on leg, he's back and working this through square leg"
440,"Zampa to Hope, no run wrong un, he's back and tucking this fine from middle stump"
441,"Zampa to Hope, 1 run he's back and pulling a ball that isn't that short, he mistimes it through square leg to the sweeper"
442,"Zampa to Hetmyer, no run beaten by a brilliant wrong un. It was beautifully flighted and it spun past the groping edge"
443,"Zampa to Hetmyer, 1 run tossed up, he drives firmly along the deck to long off"
444,"Starc to Hetmyer, no run fast full toss on off, he's back and defending"
445,"Starc to Hetmyer, 4 leg byes 146kph, attempted yorker, tails down leg and comes off the pads and runs fine! Carey nearly reached it but it was too quick"
446,"Starc to Hetmyer, no run 137kph, bouncer, he ducks and falls backwards! That was a sharp bouncer"
447,"Starc to Hetmyer, 1 run 134kph, climbing into the ribcage, he rides the bounce, works it behind square"
448,"Starc to Hope, 1 wide 143kph bouncer sprayed down the leg side"
449,"Starc to Hope, no run 146kph, full on leg stump, he clips it neatly to midwicket"
450,"Starc to Hope, no run 137kph, back of a length, he defends off the sticker from the crease, knocking it down"
451,"Zampa to Hetmyer, no run top spinner, outside off, he strides forward to defend into the off side"
452,"Zampa to Hetmyer, no run shorter wide of off, he's back and cutting straight to backward point"
453,"Zampa to Hetmyer, no run wrong un on middle, he defends on the front foot"
454,"Zampa to Hetmyer, 2 runs drifting outside off, a half-volley, he cracks a cover drive straight of the sweeper on the rope to pick up two"
455,"Zampa to Hetmyer, no run flatter on middle, he's back and pushing this straight of midwicket, there is probably one there but they turn it down"
456,"Zampa to Hetmyer, 1 run flatter leg break, he's back and punching to long on"
457,"Starc to Hetmyer, no run 140kph, fuller and tailing into middle and leg, he clips this neatly but straight to midwicket"
458,"Starc to Hetmyer, no run 138kph, good length, well wide of off, he's happy to let this go through to the keeper"
459,"Starc to Hetmyer, FOUR runs powerful pull shot! Wow! 142kph bouncer, he stood up, got on top of the bounce and smashed it through midwicket along the ground like a tracer bullet"
460,"Starc to Hetmyer, no run half-volley outside off, he cracks a drive firmly straight to mid off"
461,"Starc to Hetmyer, no run 140kph, short and wide, he cuts but picks out backward point"
462,"Starc to Hetmyer, 1 run attempted yorker, 146kph, turns into a full toss on middle, he clips this behind square to the sweeper"
463,"Zampa to Hetmyer, 1 run shorter length, he's back and pulling firmly to deep midwicket"
464,"Zampa to Hope, FOUR runs juicy full toss and he is smashed through square leg! A genuine freebie and he flat batted it forward of square to the short boundary"
465,"Zampa to Hope, no run tossed up outside off, he drives straight to cover"
466,"Zampa to Hope, no run drifting into middle, he defends with bat onto pad, Australia appeal for LBW, but it's not out and they don't review"
467,"Zampa to Hope, FOUR runs drag down, cracked in the air just past midwicket and Coulter-Nile misfields on the rope at long on! That was smoked but Coulter-Nile will be disappointed he allowed four."
468,"Zampa to Hope, 1 run shorter and slower, he's back and pulling this straighter to long on"
469,"Coulter-Nile to Hope, 1 run 132kph, back of a length, he stands up and punches off the back foot to deep cover-point"
470,"Coulter-Nile to Hetmyer, 1 run short ball, he pulls this powerfully behind square but straight to the sweeper"
471,"Coulter-Nile to Hope, 1 run another short one, 134kph, he pulls along the ground to deep square leg"
472,"Coulter-Nile to Hetmyer, no run 133kph, back of a length, he's taken on the thigh guard and it drops into the off side"
473,"Coulter-Nile to Hetmyer, FOUR runs pull shot smashed in front of square! Another bouncer, he stayed leg side and swung hard and smacked it forward of square to the short boundary!"
474,"Coulter-Nile to Hetmyer, no run good length, top of off, he pushes this towards mid off with minimal footwork"
475,"Zampa to Hope, no run full and drifting into off, he yorks himself, dragging a drive to midwicket"
476,"Zampa to Hope, 1 run he slices a drive wide of cover and it runs to the sweeper in the deep"
477,"Zampa to Hetmyer, no run beaten by a big spinning wrong un. He didn't pick this as he stretched forward to defend"
478,"Zampa to Hetmyer, no run full on leg stump, he drives back to the bowler"
479,"Zampa to Hetmyer, no run play and miss at a shorter wrong un. He tried to cut this but was beaten by the bounce"
480,"Zampa to Hetmyer, FOUR runs hammers a sweep behind square! Too full on leg and in the arc, didn't matter if he couldn't pick the wrong un, he got down on one knee and clubbed it along the ground behind square"
481,"Coulter-Nile to Hope, no run back of a length, he pulls from outside off, straight to midwicket"
482,"Coulter-Nile to Hope, FOUR runs angled down leg and he glances fine for four! Bad ball from Coulter-Nile. Easy enough to just glance it fine with the angle and the pace"
483,"Coulter-Nile to Hope, FOUR runs glorious cover drive on the rise! Not a half volley, he strides out and drives sumptuously through cover with superb timing"
484,"Coulter-Nile to Hope, no run bouncer, wide of off, he ducks down under it"
485,"Coulter-Nile to Hope, 2 runs 138kph, short ball, he pulls without too much timing forward of square but into the gap and it's a decent chase for the sweeper"
486,"Coulter-Nile to Hope, 1 run 133kph, short ball, he cracks a pull along the ground to the sweeper"
487,"Maxwell to Hope, no run tossed up on leg and he defends"
488,"Maxwell to Hope, no run tossed up on off, he drives back to the bowler"
489,"Maxwell to Hope, 1 run shorter length, he's back and punching back to the bowler"
490,"Maxwell to Holder, 1 run drifting across the right hander, he reaches out and pushes this through point to the sweeper"
491,"Maxwell to Hope, no run flatter on middle, he pushes this back to the bowler"
492,"Zampa to Holder, FOUR runs cut behind point and it races away! Just a hint of width and slightly short, he thrashes it past short third man and the sweeper at deep point can't cut it off"
493,"Zampa to Holder, 1 run tossed up leg break, he drives firmly inside out through cover-point to the sweeper in the deep"
494,"Zampa to Hope, no run top spinner, he's back and defending covering off stump"
495,"Zampa to Hope, 2 runs full and driven hard straight of long on, Khawaja gets around and makes a diving save on the rope, he saves two"
496,"Zampa to Hope, 1 run tossed up outside off, he square drives through point to the sweeper"
497,"Zampa to Holder, 1 run full toss, he drives along the ground to long on"
498,"Maxwell to Holder, no run flatter on middle, he's defending from the crease to midwicket"
499,"Maxwell to Holder, no run flatter but gets some over spin to kick up, he is forced to defend"
500,"Maxwell to Holder, no run on leg stump, he works this to midwicket but can't beat the man in the circle"
501,"Maxwell to Holder, no run full on middle, he tucks this to midwicket again and Smith cuts it off"
502,"Maxwell to Holder, no run Huge LBW appeal and given! Holder reviews. From around the wicket, this was tossed up, Holder went to sweep. It looked to pitch in line. No bat involved. Ball tracking says pitching just outside leg! Decision is overturned! It looked in line live. It was millimetres outside. Great review"
503,"Maxwell to Holder, no run tossed up, he drives firmly to mid off"
504,"Cummins to Hope, 1 run 132kph, good length, fifth stump line, he defends with soft hands to the gap at cover-point"
505,"Cummins to Holder, FOUR runs pulled over deep midwicket! Landed just short of the rope! Fractionally short, he was back in a flash and picking this up and depositing it over midwicket powerfully."
506,"Cummins to Holder, 1 run shorter into the hip, he's back and across, glancing this to fine leg"
507,"Cummins to Hope, no run short ball, 132kph, he tried to pull but got it off the toe of the bat towards mid on"
508,"Cummins to Hope, no run off cutter, 125kph, it bounces a touch, he defends from the crease"
509,"Cummins to Hope, 1 run 134kph, back of a length, he's back and running this to third man"
510,"Maxwell to Hope, 2 runs angled across, a touch of width, he's back and placing this cut behind point very nicely for a couple"
511,"Maxwell to Hope, no run flatter on off, he's back and forcing towards long on but Maxwell cuts it off"
512,"Maxwell to Hope, no run quicker outside off, he gives room to cut but mistimes it"
513,"Maxwell to Hope, no run very full, he yorks himself, working it to midwicket"
514,"Maxwell to Hope, 2 runs shorter length, it sits up and he punches this past cover for two to the sweeper"
515,"Maxwell to Hope, 2 runs tossed outside leg, he paddles fine off the edge and it runs away for a couple"
516,"Cummins to Holder, no run good length outside off, he's forward and pushing off a thick inside edge"
517,"Cummins to Holder, 1 run pulled in the air for a long time but it falls just short of Starc on the rope! He was looking into the sun so may not have been able to pick up the trajectory early"
518,"Cummins to Hope, no run beaten by a back of a length ball outside off, he tried to open the face and run to third man"
519,"Cummins to Hope, no run good length, top of off, he defends from the crease"
520,"Cummins to Hope, FOUR runs pulled fine for four off the gloves! It was a short ball, down leg, he pulled of the gloves, it flies fine and Lyon, on as a sub, misfields diving on the rope"
521,"Cummins to Hope, no run another bouncer, he tries to pull but is beaten by extra bounce"
522,"Maxwell to Holder, FOUR runs edged through a vacant slip! It was flatter and shorter wide of off, he cuts but gets a thick outside edge that runs away to third man"
523,"Maxwell to Holder, FOUR runs drifting wide of off, and driven beautifully through cover-point! The placement and timing with lovely hands was something to behold."
524,"Maxwell to Holder, 1 run tossed up, he drives down the ground to long on"
525,"Maxwell to Hope, no run shorter length, he's back and punching to mid off"
526,"Maxwell to Hope, 1 run shorter length, he's back and cutting to deep cover-point"
527,"Maxwell to Holder, no run tossed up outside off, he pushes on the front foot to cover"
528,"Cummins to Hope, no run good length ball on off, driven to mid-off."
529,"Cummins to Hope, 1 run short of a length on off, guided with an open face to third man."
530,"Cummins to Holder, 1 run short of a length on the hips, tucked into the leg side by Holder. We're now under 100 for the West Indies to win..."
531,"Cummins to Hope, no run good length on off stump at 81 mph, kept out on the back foot by Hope."
532,"Cummins to Hope, no run fullish length on off, driven firmly to mid-off."
533,"Zampa to Holder, no run full on off, defended on the front foot."
534,"Zampa to Holder, no run slightly short on off, punched to cover off the back foot."
535,"Zampa to Holder, no run floated into the legs, goes to sweep and after a very very long appeal, given out! If Holder had the Maxwell lbw overturned you can bet he was gonna go to DRS on this and after a chat with Russell he does. He's hit fairly low on the back leg bending forward missing the sweep. Impact was barely in line with leg stump and once again this is overturned. It didn't look promising live and umpire Palliyaguruge has this overturned, missing leg stump comfortably. Both umpires are having a shocker today."
536,"Zampa to Holder, no run full on off, driven to cover."
537,"Zampa to Holder, 1 run short on middle, Holder goes back to flick through the leg side."
538,"Zampa to Russell, no run quicker ball flat on middle, Russell sees it safely off the back foot."
539,"Starc to Holder, no run full on off, defended."
540,"Starc to Holder, no run fullish length pitching on off and angling across, Holder goes back and it beats the edge."
541,"Starc to Holder, no run overpitched outside off, Holder with little footwork driving and beaten again."
542,"Starc to Holder, SIX runs short ball, top-edged for six! Starc confused Holder with a change of pace on the body at 129 kph/80 mph, went to pull and it clips the top edge and sails over Carey, 7 yards over the rope at long leg."
543,"Starc to Holder, no run bouncer on the legs, Holder ducks under."
544,"Starc to Holder, 1 run very full, attempted yorker after the bouncer but not full enough, driven down the pitch and mid-on cuts it off."
545,"Zampa to Holder, 1 run full and wide outside off on sixth stump line, driven firmly to the cover sweeper."
546,"Zampa to Russell, SIX runs lift-off for Dre Russ! Floated full on off, Russell winds up and scorches this into the stands a good 20 rows back over long-on into the second tier."
547,"Zampa to Russell, no run quicker ball zipped in short and flat at 62 mph, blocked back off the back foot."
548,"Zampa to Russell, FOUR runs flighted again full on leg stump, Russell takes a half step back to clear the front leg and slams this flat into the rope flush in front of the sightscreen. Umpire changes his call to a four after help from TV replays, to more groans from the pro-West Indies crowd. Maybe fractionally short hopped the padding."
549,"Zampa to Russell, no run low full toss pushed back to Zampa."
550,"Zampa to Russell, 1 run floated on the legs full pitching outside leg, Russell steps away to make room and scuffs a drive to long-on."
551,"Starc to Russell, no run full on fourth stump, Russell backs away and misses a booming heave with his head falling away. Holder comes down the pitch to have a chat and rein him back in."
552,"Starc to Russell, no run Russell steps away from leg again and Starc follows him with a short ball on the body, cramped for room he misses a pull ducking his head. Whatever Holder said didn't seem to have much impact on Russell's approach."
553,"Starc to Russell, 2 leg byes Russell backs away from leg and Starc follows him too far down leg, misses a pull off his hips, clips the thigh down to long leg, sliding stop by Coulter-Nile at the rope saves it from being four leg byes."
554,"Starc to Russell, FOUR runs fighting fire with fire! Attempted yorker tailing away from Russell backing away from the stumps, it was heading straight for middle but Russell drills it past mid-off for a boundary."
555,"Starc to Russell, OUT Russell's fiery cameo ended by Starc! And a brilliant take by Maxwell too! Russell continues backing away from leg stump for a mow over midwicket, Starc targets leg stump and Russell gets a leading edge skier over point. Maxwell runs out from the circle taking this over the shoulder a third of the way to the rope. Sensational grab, 8/10 on degree of difficulty but it was bog standard for Maxwell. Whatever Holder said to Russell at the start of the over to have him rein in his aggression failed to produ"
556,"Starc to Holder, 1 run good length on the legs, clipped through square leg."
557,"Coulter-Nile to Holder, no run fullish length on fifth stump, misses a flat-footed waft."
558,"Coulter-Nile to Holder, no run short of a length into the ribs, misses a short-arm pull."
559,"Coulter-Nile to Holder, no run good length on off, defended."
560,"Coulter-Nile to Holder, no run fullish length on off, defended on the back foot."
561,"Coulter-Nile to Holder, FOUR runs length ball angling into off, heaved over midwicket with power."
562,"Coulter-Nile to Holder, no run fullish length outside off on sixth stump line, tame flat-footed waft by Holder beats the edge."
563,"Zampa to Brathwaite, 1 run short on the legs, chipped very nervously over midwicket to long-on."
564,"Zampa to Holder, FOUR runs floated full outside off, firm drive by Holder screeches past Smith at short extra cover and beats long-off to the rope."
565,"Zampa to Holder, no run full, almost yorker length on sixth stump, Holder plays over the top with a drive."
566,"Zampa to Holder, no run good length on fourth stump, straightens and Holder defends to extra cover."
567,"Zampa to Holder, FOUR runs full on fourth stump, Holder prods tentatively and an edge goes through vacant slip before racing away!"
568,"Zampa to Holder, no run full on fifth stump, Holder reaches forward with a good stride and pokes a thick edge to backward point."
569,"Coulter-Nile to Brathwaite, no run good length ball angled in from off stump, Brathwaite jams his bat down belatedly and the ball skids off the ground and bounces over the stumps. Hands on head from Coulter-Nile."
570,"Coulter-Nile to Brathwaite, no run so close! Good length ball on off, Brathwaite swats across the line, leading edge flutters just above Coulter-Nile's leaping effort. Fingertips!"
571,"Coulter-Nile to Brathwaite, 1 run full on off, guided behind point."
572,"Coulter-Nile to Holder, 1 run full outside off, Holder drives and gets another thick edge through vacant slip. Finch with conservative captaincy and the ball is cut off at the third man rope."
573,"Coulter-Nile to Brathwaite, no run good length ball, Brathwaite hops back to defend this off middle stump to point."
574,"Coulter-Nile to Brathwaite, no run fullish length on fifth stump, Brathwaite hops across the stumps to defend, struck on the pads but well outside the line of off stump."
575,"Cummins to Holder, no run nearly another drag on! Good length ball angled into off stump, little footwork and a poke produces an inside edge lodged in between his feet."
576,"Cummins to Holder, 1 run short offcutter on the legs at 73 mph, pulled comfortably to long leg."
577,"Cummins to Brathwaite, no run another bouncer, this time full speed at 83 mph, fought off behind point."
