,Data
235,"Randiv to Hussey, 1 run slightly short, Hussey rocks back and cuts, doesn't farm the strike"
236,"Randiv to Copeland, no run sharp offbreak, padded away safely, the bounce means he couldn't have been lbw"
237,"Randiv to Copeland, no run more turn and bounce, and he lets this one hits his thigh pad"
238,"Randiv to Copeland, FOUR runs sweeps and sweeps effectively. Difficult shot for a tall man, but he sees this is close enough to him, and goes for it. Keeps it along the ground"
239,"Randiv to Copeland, no run overpitched around off, defended to cover"
240,"Lakmal to Hussey, no run Lakmal is short of a length, middle and leg, Hussey is solid as ever"
241,"Lakmal to Hussey, 1 run fuller, but too straight, and he has worked it away into the leg side for one"
242,"Lakmal to Copeland, FOUR runs Copeland is hitting boundary after boundary! Short of a length, into the pads, nicely flicked away past square leg. Specialist batsmen would be proud of this"
243,"Lakmal to Copeland, no run short outside off, he lets PJ do the collecting"
244,"Lakmal to Copeland, no run full, outside off, driven handsomely, can't beat extra cover"
245,"Lakmal to Copeland, no run floated wide outside off, Copeland doesn't play at it"
246,"Randiv to Hussey, no run tossed up outside off, there is turn and bounce, but Hussey doesn't play at it"
247,"Randiv to Hussey, no run flatter, outside off, Hussey defends with an open face"
248,"Randiv to Hussey, 1 run short of a length, gets on his toes, and punches this for a single to sweeper-cover"
249,"Randiv to Copeland, no run drift, dip, turn, bounce, too good, because this turns back in through the bat-pad gap, misses the edge, and bounces over the stumps"
250,"Randiv to Copeland, no run overspinner, middle and off, doesn't turn, Copeland defends"
251,"Randiv to Copeland, OUT Sharp turn, simple bat-pad catch. This is flighted, draws Copeland forward, who looks to play this to leg, is not close to the pitch of the ball, gets an inside edge onto the pad, and an easy catch accrues for short leg"
252,"Lakmal to Hussey, no run low full toss, Hussey flicks this to mid-on"
253,"Lakmal to Hussey, no run Hussey charges at him and drives him straight down the ground... into the stumps at the non-striker's end"
254,"Lakmal to Hussey, no run low full toss again, driven back to Lakmal"
255,"Lakmal to Hussey, 1 run length ball, on the pads, clipped away for one, happy to give the No. 11 two balls to survive"
256,"Lakmal to Lyon, no run nice yorker first up for the debutant. Swings in late, towards off, Lyon keeps this out"
257,"Lakmal to Lyon, no run Lyon is well for ward to push this length ball to point"
258,"Randiv to Hussey, SIX runs Has Welegedara pulled off a special catch? No he hasn't! This is a six! Hussey comes down the ground, chips this inside out towards long-off, Welegedara back-pedals and takes a good catch, only for his heel to step on the skirting. He claims the catch, though, but replays prove him wrong. Peter Siddle kept gesturing, asking them to stay and wait for the replays"
259,"Randiv to Hussey, no run flat delivery, Hussey deep in the crease to defend"
260,"Randiv to Hussey, no run another flat delivery, defended again"
261,"Randiv to Hussey, 1 run and he takes a single with two balls to go. Drops this into the vastly vacant cover region for one"
262,"Randiv to Lyon, no run flighted outside off, Lyon is well forward to defend"
263,"Randiv to Lyon, no run sharp offbreak again, but Lyon defends this towards short leg"
264,"Lakmal to Hussey, no run length ball on the pads, Hussey turns down the single"
265,"Lakmal to Hussey, no run driven to long-off, but refuses the single again"
266,"Lakmal to Hussey, no run driven to long-off, and he turns down another single"
267,"Lakmal to Hussey, 1 run and Hussey takes the single off the fourth ball again, worked away off the pads"
268,"Lakmal to Lyon, no run full toss, driven to long-off"
269,"Lakmal to Lyon, no run and he gets another yorker, which he ably keeps out"
270,"Randiv to Hussey, no run Short and wide, cut away, turns down the single"
271,"Randiv to Hussey, no run cut away again, keeps the strike again"
272,"Randiv to Hussey, no run jumps out of the crease, beaten in the flight, thrusts his pad forward"
273,"Randiv to Hussey, SIX runs Hussey's gem continues! Hits a six off the fourth ball of this over. Gives him the charge again, makes room, and lofts over long-on. Enters the 90s. Ponting applauds from the balcony"
274,"Randiv to Hussey, 1 run and Hussey reverse-paddles this to take the single. He is clearly out-thinking Sri Lanka here"
275,"Randiv to Lyon, no run tossed up outside off, left alone, turns back a long way, but not enough"
276,"Dilshan to Hussey, 2 leg byes sharp offbreak, pitches middle and off, beats the sweep, hits the pad, but would never had hit the stumps. Hussey takes two leg-byes"
277,"Dilshan to Hussey, FOUR runs and in the meantime, Hussey keeps going on. This is too straight and too full, Hussey sweeps this fine, beats long leg, is now one shot away from a hundred"
278,"Dilshan to Hussey, no run long hop, pulled away, turns down the single"
279,"Dilshan to Hussey, OUT Given leg-before! Again it's the straighter ball from an offspinner that has done the damage here. This pitched outside off, Hussey defended, playing for the spin, the ball went on with the arm, hit the pad, right in front of off. Kettleborough took his time, then raised the finger. Hussey reviewed it just in case. Replays say there is no just in case here"
280,"Nevertheless a superb innings from Hussey. The Sri Lankans congratulte him as he walks off. Michael Clarke applauds from the balcony. Despite Hussey's superb 95, though, Sri Lanka will be pleased to have restricted Australia to 273 after losing the toss. They will have one over to bat today. Generally, though, they wouldn't want to bat last on this wicket. Which means they will want a huge first-innings lead"
281,The umpires think the light has gone bad enough to make the Sri Lanka batsmen head off without having to face what could have been a testing over. That will be it from us for today. This is Sidharth Monga signing off on behalf of Cricinfo. Join us tomorrow for the second day's action
282,"Harris to Sangakkara, no run Harris bangs the ball in, couldn't me more different than Copeland who 'releases' it, left alone as it bounces outside off from back of a length"
283,"Harris to Sangakkara, no run another leave outside the off stump"
284,"Harris to Sangakkara, no run Ponting is lurking close by on the off side for that drive in the air, but Sanga keeps it along the ground as he pushes forward"
285,"Harris to Sangakkara, no run this one does not get up much at all outside off, Sanga watches it go past him, that will continue to be a worry for batsmen on this pitch, you cannot trust the bounce"
286,"Harris to Sangakkara, no run straightish one played out towards midwicket"
287,"Harris to Sangakkara, no run eep, now he goes flailing at a very full and widish one outside off, fortunately he does not get anything on it"
288,"Copeland to NT Paranavitana, no run Copeland on target again, close to off stump, hurls it in on a length, left alone"
289,"Copeland to NT Paranavitana, no run tighter line still, ending right on that off stump, pushed away on the off side"
290,"Copeland to NT Paranavitana, no run just outside the off stump now, talk about settling in on a line, Para gets to it and defends"
291,"Copeland to NT Paranavitana, no run now a leave to one not far from off stump"
292,"Copeland to NT Paranavitana, no run takes a step out and lets a length ball go across him outside off"
293,"Copeland to NT Paranavitana, no run now he finds some bounce as this one hangs in the air for a bit longer, lands on a length and kicks up outside off, fine leave in the end"
294,"Harris to Sangakkara, no run 136.5 kph from Harris, but he spotted the line early and allowed it go past him outside off"
295,"Harris to Sangakkara, no run makes him play with a much fuller length on the stumps, Sanga gets behind it and pushes down the track"
296,"Harris to Sangakkara, no run much fuller and going across, Sanga is a touch late on it in getting forward, but manages to push towards mid off"
297,"Harris to Sangakkara, no run touch wider outside off stump and he leaves it right away"
298,"Harris to Sangakkara, no run gets it to move away a shade from around middle and leg, but touch shortish and he is able to shuffle across, get in line and push it away"
299,"Harris to Sangakkara, no run fuller delivery produces the edge, not driving length, not short too, he is caught on the crease as it zips across from around leg, but the thick edge carries along the ground towards backward point"
300,"Copeland to NT Paranavitana, no run Copeland goes full outside off stump, gets it to zip after pitching close to off, he gets forward with a bit of an open face to run it away, but it goes towards gully"
301,"Copeland to NT Paranavitana, no run left alone from a length outside off"
302,"Copeland to NT Paranavitana, no run 126 kph and too much outside off to interest him"
303,"Copeland to NT Paranavitana, no run smartly forward and smothers a length ball on the off side"
304,"Copeland to NT Paranavitana, 1 run full delivery driven past the man close in towards extra cover"
305,"Copeland to Sangakkara, no run slants it across the left-hander who takes a step out and watches it go, tight lines these, mighty tight"
306,"Harris to NT Paranavitana, no run 138.7 kph from Harris, hurries him in to a forward push towards covers"
307,"Harris to NT Paranavitana, no run well bowled, hurrying on from a length on off stump, he defends bat and pad close together"
308,"Harris to NT Paranavitana, no run the bouncer, surprises the batsman as it rears up at him, goes just over his head as he goes under"
309,"Harris to NT Paranavitana, 4 leg byes they havent given much till now, this one is a gift though, going down the pads and he gets enough on it to tickle it past Haddin"
310,"Harris to NT Paranavitana, no run superb leave from Para, close to the off stump on the angle, bouncing too, he shuffles across, and lets it go, couple of inches away from the body"
311,"Harris to NT Paranavitana, no run solid push off the front foot, straight to mid off"
312,"Copeland to Sangakkara, 1 run goes around middle and leg and Sanga picks him in front of square leg"
313,"Copeland to NT Paranavitana, no run gets forward to a full delivery outside off stump and allows it to past"
314,"Copeland to NT Paranavitana, no run Copeland looks like he could be bowling this line all day, around that off stump, Para leaves wisely"
315,"Copeland to NT Paranavitana, no run touch fuller, makes him go forward, head on top of ball, crouching low to defend"
316,"Copeland to NT Paranavitana, 1 run opens the face to a full one to run the drive past the man at very short cover"
317,"Copeland to Sangakkara, 1 run Ponting got one of these yesterday, it seemed to stop on him off a fullish length as he looked to push on the on side, just managed to clear midwicket, puff of dust as it pitched"
318,"Johnson to Sangakkara, no run fires it full and down the leg side first up"
319,"Johnson to Sangakkara, no run Johnson could be a handful on this track with the old ball I think, he sings it full now on middle, and has Sanga pushing it back down the track"
320,"Johnson to Sangakkara, 1 run a bit more on the angle from over the stumps, and Sanga pushes the fullish one between the bowler and mid on who does well to run across and cut it off"
321,"Johnson to NT Paranavitana, no run straightish one bouncing from a length, but a bit outside off, left alone"
322,"Johnson to NT Paranavitana, no run fuller on offnow, has him pushing down the track"
323,"Johnson to NT Paranavitana, no run 141 kph, in this heat, Johnson giving it a rip, getting it to hold its line outside off, he gets forward and runs it to gully"
324,"Copeland to Sangakkara, no run good leave from Sanga, he shuffled across, saw this one leaving him close to off and flagged it through"
325,"Copeland to Sangakkara, no run another good leave from Sanga, Copeland persevering outside off at 124.1 kph, won't bother many with that pace though, but it's that line, much like Praveen Kumar for India, who also gets a lot of swing"
326,"Copeland to Sangakkara, no run left alone as it bounces outside the off stump"
327,"Copeland to Sangakkara, no run slowish delivery, arrives on a length on off stump, he crouches low to block"
328,"Copeland to Sangakkara, no run right on the fourth stump, he pushes forward and defends on the off side"
329,"Copeland to Sangakkara, no run left alone this time, Haddin takes it snappily standing up"
330,"Johnson to NT Paranavitana, no run 141.9 kph from Mitch, but a touch far outside off to make him fiddle with it, remember, he is not Dilshan"
331,"Johnson to NT Paranavitana, no run good bouncer, Johnson bangs it in at 145.5 kph, he sways out of the line alright, but Haddin has to leap in the air to take it"
332,"Johnson to NT Paranavitana, no run yipe, Mitch goes off target on this one, lots of shoulder takes it way outside off from back of a length"
333,"Johnson to NT Paranavitana, no run that's the line, close to that off stump, from short of a length, has him pushing with an open face towards point"
334,"Johnson to NT Paranavitana, no run the full delivery now, not a bad one to bowl now and then, Para pushes it back to Mitch"
335,"Johnson to NT Paranavitana, no run just a bit of away movement as he slings it widish outside off stump, left alone"
336,"Copeland to Sangakkara, no run 123.4 kph around that off stump, he allows it to go past"
337,"Copeland to Sangakkara, no run continues to test their patience with that accurate line around off stump, Sanga leaves"
338,"Copeland to Sangakkara, no run straightish around middle and leg, Sanga gets behind the line and pushes towards midwicket"
339,"Copeland to Sangakkara, no run whoa, this one keeps a bit low, shouldn"
340,"Copeland to Sangakkara, no run pushed away on the off side from a length"
341,"Copeland to Sangakkara, 1 run they have made 14 in almost 12 overs and now they want a tight single, well well, it was tucked in front of square leg who raced in, dived forward but there was not much in the underarm lob to Haddin and Para had managed to sneak in by the time Haddin got the bails off"
342,"Johnson to Sangakkara, 1 run plonked in front of point and Sanga gets across for the single, they will need more of this"
343,"Johnson to NT Paranavitana, no run eek, Johnson lets it rip full and it bounces down the leg side after it passes the batsman"
344,"Johnson to NT Paranavitana, no run now he hurls it wide outside the off stump, giving Haddin a tough time at the moment, that's about it"
345,"Johnson to NT Paranavitana, no run and out of nowhere, he lets loose one on target, on off stump, and has him carefully defending off the front foot"
346,"Johnson to NT Paranavitana, no run another tight delivery, good return from Mitch in this over, another defensive push"
347,"Johnson to NT Paranavitana, no run the flowing drive, there have been very few of those, Ponting is around, when is he not, at covers to stop it easily"
348,"Copeland to Sangakkara, no run gets beside the line, stays in the crease and pushes a back of a length ball on the off side"
349,"Copeland to Sangakkara, FOUR runs that has been put away, Sanga gets width from Copeland, a rarity, and eagerly goes after it, getting the slash well over the slips"
350,"Copeland to Sangakkara, no run reverts to the line close to off stump, and Sanga takes a step out to leave it"
351,"Copeland to Sangakkara, no run fuller, he leans out and pushes to covers"
352,"Copeland to Sangakkara, no run that man at straight short mid off comes in to play as Sanga reaches out to push a fullish one to his right"
353,"Copeland to Sangakkara, no run on middle now, he shuffles and plays it towards midwicket"
354,"Johnson to NT Paranavitana, no run too short, too wide outside off, Para has nothing to do with it"
355,"Johnson to NT Paranavitana, no run hurls it fullish on off stump, moves in a shade if at all, Para is right forward in defence"
356,"Johnson to NT Paranavitana, FOUR runs outside edge, but no luck for Mitch, as it runs Clarke at second slip, Para did not get fully forward and pushed the length ball with an open face, fortunately wide of Clarke"
357,"Johnson to NT Paranavitana, no run now he gives him the pact bouncer, Para goes down safely underneath"
358,"Johnson to NT Paranavitana, no run there for the drive, full outside off, but Para checks his shot, taking a hand off the bat handle as he pushes at it"
359,"Johnson to NT Paranavitana, no run solidly forward in defence to a length ball close to off stump"
360,"Lyon to Sangakkara, OUT he has struck first ball, would you believe it! he has got Kumar Sangakkara, of all men, what a first Test wicket to have, off your first ball, flight from round the wicket, grip, turn, bounce, Sanga hangs out the bat away from the body, with a bit of an open face, Clarke snaps it up low with a lunge to his left at slip, superb catch, aye, aye, this is an attack being led by the debutants at the m"
361,"Lyon to Mahela Jayawardene, no run turn and bounce from over the wicket, but going down leg as it kicks, Mahela withdraws the bat"
362,"Lyon to Mahela Jayawardene, FOUR runs Mahela gets going with a lunge forward to a fuller one and a sweep that beats the man at deep square leg by a mile"
363,"Lyon to Mahela Jayawardene, FOUR runs and another boundary, welcome to Test cricket, the full circle for Lyon in the opening over, Mahela reaches out to a tossed up ball and caresses it through extra cover"
364,"Lyon to Mahela Jayawardene, no run turning in from well outside off, bounce too, he goes back and defends"
365,"Lyon to Mahela Jayawardene, no run tossed up too wide outside off, but it turns in hungrily, bounces a lot, but Mahela had it covered and shoulders arms"
366,"Johnson to NT Paranavitana, no run left alone outside off from a length"
367,"Johnson to NT Paranavitana, FOUR runs crack! Para sees width from Mitch outside off, sets himself up and cracks it behind point"
368,"Johnson to NT Paranavitana, no run fuller delivery, has him watchfully forward in smothering defence"
369,"Johnson to NT Paranavitana, no run pushed away towards covers off a length, Mitch seeming to regain his line, or have I spoken too soon?"
370,"Johnson to NT Paranavitana, no run right away, he goes wide outside off from back of a length next ball, grr"
371,"Johnson to NT Paranavitana, no run 138.3 kph and fired in near the blockhole, he could be deadly with this length as the ball gets older, Para manages to keep it out"
372,"Lyon to Mahela Jayawardene, no run troubles Mahela as this one bounces from outside off and hits him on the body as he gets forward"
373,"Lyon to Mahela Jayawardene, no run more bounce, that has taken off, Mahela pads it away off the flap some way outside off"
374,"Lyon to Mahela Jayawardene, no run shortish, flat, outside off, Mahela slaps it to point"
375,"Lyon to Mahela Jayawardene, no run pushed through fuller, takes a bit of pad on its way to Haddin who cannot collect cleanly"
376,"Lyon to Mahela Jayawardene, no run pushed away on the off side"
377,"Lyon to Mahela Jayawardene, no run flighted very full and very wide outside off, bit of drift away from Mahela who stretches the pad out as much as possible and, er, pads it away"
378,"Harris to NT Paranavitana, no run and beats Para outside off stump from back of a length, holding its line some way outside off, he goes pushing at it from the crease, misses and thwacks bat on the pad in frustration"
379,"Harris to NT Paranavitana, no run angled in on on off stump, pushed off the front foot"
380,"Harris to NT Paranavitana, no run another one hurled fullish with the angle, he gets behind the line and blocks"
381,"Harris to NT Paranavitana, no run well left, dangerous to go prodding outside off with the angle from round the stumps, close to off from short of a length"
382,"Harris to NT Paranavitana, 2 runs had to happen, overdoes that angle from round the stumps, and he picks him through square leg off the pads"
383,"Harris to NT Paranavitana, no run good delivery, bowls it fuller around off stump, but Para safely pushes it away towards covers"
384,"Lyon to Mahela Jayawardene, no run shortish delivery turning in and bouncing, slowly though, and he goes back to defend"
385,"Lyon to Mahela Jayawardene, no run this one grips a touch more and turns sharply in to Mahela who pads it away to short leg"
386,"Lyon to Mahela Jayawardene, no run that was close, got forward and nudged a fullish one with the turn low in the air just past short leg"
387,"Lyon to Mahela Jayawardene, no run goes right back in the crease to keep out a turning delivery"
388,"Lyon to Mahela Jayawardene, no run he is using the pads a lot, and Australia are appealing as he keeps another one turning in from outside off without use of the bat, umpire Dar is not interested"
389,"Lyon to Mahela Jayawardene, 1 run hit away in to the leg side, there is a man around deep midwicket and he keeps them to one"
390,"Harris to Mahela Jayawardene, no run gets forward and nudges one slanted in, towards square leg"
391,"Harris to Mahela Jayawardene, no run 137.7 kph from Harris, Mahela is solidly forward and blocks a length ball without any fuss"
392,"Harris to Mahela Jayawardene, no run outside edge, but it drops just short of Haddin diving to his right, Mahela hanging his bat at one keeping low and leaving him outside off, but it died in front of Haddin who got a glove behind it"
393,"Harris to Mahela Jayawardene, no run better from Mahela, gets behind the line to defend off the front foot"
394,"Harris to Mahela Jayawardene, no run fuller one slanted in on the stumps, he shuffles and finds short midwicket with the flick"
395,"Harris to Mahela Jayawardene, no run another one angled in from wide of the crease, Mahela keeps it out with a solid push"
396,"Lyon to NT Paranavitana, 1 run too short, too wide and cut away off the back foot, there is a sweeper cover in place already, ho hum"
397,"Lyon to Mahela Jayawardene, no run fuller outside off and Mahela pads it away off the thigh pad on the leg side"
398,"Lyon to Mahela Jayawardene, 1 run squeezes a full and flighted one wide of cover for a single"
399,"Lyon to NT Paranavitana, no run this one went straight on with the angle, explosion of dust outside off as it pitched, left alone"
400,"Lyon to NT Paranavitana, no run pushed off the front foot on the off side"
401,"Lyon to NT Paranavitana, no run comes down the track, as he sees it tossed up, but it dips on him and he gets a thick edge towards point"
402,"Harris to Mahela Jayawardene, no run holds its line fullish outside off stump but Mahela has it covered and defends, Australia's seamers have not given anything away, this is superb discipline"
403,"Harris to Mahela Jayawardene, 1 run gets the single off an inside edge that rolls through square leg, went forward to a length ball with a very angled bat"
404,"Harris to NT Paranavitana, no run pushed down the track off a length"
405,"Harris to NT Paranavitana, 1 run goes full for the stumps but Para digs it out down towards mid on"
406,"Harris to Mahela Jayawardene, 1 wide bouncer from Harris but touch far outside off to trouble Mahela"
407,"Harris to Mahela Jayawardene, no run this one is right on target though, rising from back of a length, hurrying for Mahela's gloves but he hops and sways out of the line, just about"
408,"Harris to Mahela Jayawardene, no run solid forward block to see off another tight over"
409,"Lyon to NT Paranavitana, OUT Mahela is run out, what an absolute waste of a big wicket, shortish from round the stumps and slapped towards point off the back foot, they go for the single, but the fielder gets to the ball and lobs it off balance to Haddin who still manages to catch Mahela short of his ground, guess who it was, it was Copeland, and even if Mahela would have made it, Para could have been in trouble as he st"
410,"Lyon to Thilan Samaraweera, no run pushed down the track off the back foot"
411,"Lyon to Thilan Samaraweera, no run throws it up full and it goes straight on outside off, left alone"
412,"Lyon to Thilan Samaraweera, no run was there a bit of bat on that, Haddin was interested as Thilan got in to a tangle, it bounced on him from outside off, and looped up off his body"
413,"Lyon to Thilan Samaraweera, no run getting him to drive against the turn, good stuff from Lyon, Thilan lunges out and finds mid off"
414,"Lyon to Thilan Samaraweera, no run blocks a turning ball outside off"
415,"Harris to NT Paranavitana, no run beats the outside edge, Harris hurls it on a length with the angle from round the stumps, draws him forward and he ends up pushing inside the line"
416,"Harris to NT Paranavitana, no run solidly pushes on the off side this time"
417,"Harris to NT Paranavitana, 1 run opens the face to run a length ball wide of point, gets to the other end, well done"
418,"Harris to Thilan Samaraweera, no run Thilan does not get fully forward, opens the face as he reaches out to run the ball past gully, the man there saves runs with a dive"
419,"Harris to Thilan Samaraweera, no run shortish one pushed off the back foot towards extra cover, hardly anything to feast on for the batsman, they are on a forced diet"
420,"Harris to Thilan Samaraweera, no run and Harris lets Thilan know who is on top at the moment with a sharp bouncer dug in outside off stump"
421,"Lyon to NT Paranavitana, no run this should have been put away, short and wide of off, slapped straight to point, Para has not come out of his shell, he has been in it all day"
422,"Lyon to NT Paranavitana, no run guided off the back foot towards slip"
423,"Lyon to NT Paranavitana, no run reaches out to defend a length delivery"
