,Data
209,"Parnell to Marsh, OUT now Marsh is sent packing! This one is on a length - pretty straight forward delivery - and Marsh pushes at it a bit tentatively.. It gets a thick inside edge and knocks the middle stump back"
210,"Parnell to Faulkner, no run swings it away from a short of length, squares up the batsman, it flies past the outside edge"
211,"Parnell to Faulkner, 1 run he gets off the mark with a quick single to mid-on, could have been in trouble had this hit"
212,"Parnell to Haddin, no run he waits on the back foot and defends this length delivery to the off side"
213,"Phangiso to Faulkner, no run tossed up and slower, the batsman comes forward and defends"
214,"Phangiso to Faulkner, 1 run drifting on to the pads, the batsman dabs it to midwicket for a single"
215,"Phangiso to Haddin, no run he goes back in the crease and defends the floated delivery to midwicket"
216,"Phangiso to Haddin, 1 run dropped, by AB? yes, you don't see that often. The batsman went for a cross-batted slog and hit it straight to him at midwicket - a simple chest-high chance - but he can't close his palms around that. He took a stinger to dismissed Hughes"
217,"Phangiso to Faulkner, 1 run comes forward and pushes this softly to cover for a single"
218,"Phangiso to Haddin, 1 run they pick up another single to the off side with a calm dab"
219,"Steyn to Haddin, OUT you can't keep him away! This one is fired in to the stumps and Haddin gets smacked on the back pad.. that was hitting middle and leg. Not massive reverse, but it just tails in enough to get a wicket.. At his pace, it's always a tricky delivery to play"
220,"Steyn to Johnson, no run angled across the batsman, who stays in the crease as he tries to defend this fuller delivery, it whistles past the outside edge"
221,"Steyn to Johnson, 1 run outside edge this time, this flies flat to third man"
222,"Steyn to Faulkner, no run fuller delivery on off stump, Faulkner watches it carefully and defends"
223,"Steyn to Faulkner, no run fuller outside off, Faulkner comes forward and pushes it of mid-off"
224,"Steyn to Faulkner, no run length delivery on off, the batsman is wary of those inswingers, but this one comes in straight, defended to cover"
225,"Morkel to Johnson, no run angled across the left-hander, Johnson shoulders arms"
226,"Morkel to Johnson, 1 run squares up the batsman with a length delivery, Johnson gets an outside edge down to third man"
227,"Morkel to Faulkner, no run back of length delivery on the stumps, the batsman defends it to the off side"
228,"Morkel to Faulkner, 1 run he comes forward and pushes it past the diving cover point fielder for a single to the deep"
229,"Morkel to Johnson, FOUR runs clean swish of the bat! This was fuller and Johnson moves to the leg side, making just enough room to hammer it over mid-off"
230,"Morkel to Johnson, OUT superb catch at the boundary from Phangiso! To be fair to Johnson, he got a good amount of bat on that.. he flicked it off the middle stump and this would have been a six on some grounds.. but this is a long boundary.. Phangiso, at deep square leg, has to back-pedal and manages to hold on"
231,"Steyn to Starc, 1 wide this one slides past the outside edge as the batsman looks to drive.. called a wide, a tad harshly"
232,"Steyn to Starc, no run angles this one away from the left-hander, Starc leaves it alone"
233,"Steyn to Starc, no run comes forward and defends the length delivery to the off side"
234,"Steyn to Starc, no run swing and a miss, the batsman wants to go downtown with that shot but it zips past the outside edge"
235,"Steyn to Starc, no run this one swings back in to the left-hander, who leaves it alone thinking it was going away, just misses the off stump"
236,"Steyn to Starc, no run he clips this length delivery off his pads, cannot beat the man at square leg"
237,"Steyn to Starc, no run length delivery on off, the batsman punches it to cover"
238,"Morkel to Faulkner, no run length delivery on off, the batsman comes forward and defends it to the leg side"
239,"Morkel to Faulkner, 1 run he leans into this fuller delivery and drives it comfortably to deep cover"
240,"Morkel to Starc, 1 run he punches this on the up to pick up a single to mid off"
241,"Morkel to Faulkner, (no ball) angled in to the right-hander, the batsman defends it off the back foot.. He has overstepped though"
242,"Morkel to Faulkner, 1 run it's a slower bouncer, Faulkner drags it to deep midwicket with a laboured pull"
243,"Morkel to Starc, no run length delivery on the stumps, Starc comes forward and defends"
244,"Morkel to Starc, 1 run back of length outside off, the batsman defends it to the off side and a misfield allows one run. Australia touch the 150 marker"
245,"Steyn to Starc, no run that is quick! It swings away and fizzes past the outside edge"
246,"Steyn to Starc, no run another one slides past the outside edge. Starc is not holding back his drives, but he is sitting on the passenger seat at the moment"
247,"Steyn to Starc, no run slightly short of length, the batsman defends it to the off side"
248,"Steyn to Starc, no run short ball outside off, Starch is a little late on the shot and underedges it to the keeper"
249,"Steyn to Starc, 1 run he pushes this into the covers to get to the other end"
250,"Steyn to Faulkner, no run he fires a fuller delivery on the stumps, Faulkner can only push it to mid-off. No respite"
251,"Tahir to Starc, no run long hop on the stumps but Starc is in survival mode, defends it down the pitch"
252,"Tahir to Starc, 1 run he leans forward and drives the tossed up delivery down to long off"
253,"Tahir to Faulkner, no run sees the googly early and nudges it to short fine leg, but the fielder charges in and prevents the single"
254,"Tahir to Faulkner, 1 run he dabs it through midwicket for a single to the deep"
255,"Tahir to Starc, no run he bowls the googly but this is too full, allows the batsman to cover the spin, and kill it, bury it in the pitch"
256,"Tahir to Starc, 1 run bowls the slider on off, the batsman nudges it through square leg for a single"
257,"Parnell to Starc, no run length delivery outside off, the batsman leaves it alone. There was a hint of inward movement on that"
258,"Parnell to Starc, 2 runs short and wide, easily steered through backward point for a couple of runs to third man"
259,"Parnell to Starc, 1 run there is enough width this time, Starc crashes it to deep cover for a single"
260,"Parnell to Faulkner, 1 run they want a quick single to cover point, but Faulkner has to turn back as Faf charges in from point.. The throw is not being backed up, and they get the single anyway"
261,"Parnell to Starc, no run sharp bouncer! Starc was getting sucked into it but gets his head out of the way right at the last moment"
262,"Parnell to Starc, 1 run length delivery wide outside off, punched on the up to deep cover"
263,"Tahir to Starc, no run driven in the air but just lands short of Duminy at cover"
264,"Tahir to Starc, no run quicker delivery on the stumps, the batsman defended down the pitch"
265,"Tahir to Starc, no run it's the googles..spins the other way, beating the outside edge"
266,"Tahir to Starc, SIX runs long handle comes handy! Starc gets under this flighted delivery and smashes it over the cow corner"
267,"Tahir to Starc, no run swings across the line but this is not full enough, bounces over his bat and hits the keeper on the chest"
268,"Tahir to Starc, 1 run full and quick outside off, the batsman slices it to deep point for a single"
269,"Parnell to Starc, no run length delivery outside off, the batsman can only slice it to point"
270,"Parnell to Starc, no run he comes forward to defend but punches this in the air almost all the way to mid off"
271,"Parnell to Starc, no run he looks to push this through point but cannot beat the fielder"
272,"Parnell to Starc, no run looks to cut this down to third man but plays inside the line, beaten"
273,"Parnell to Starc, 1 run he comes forward and pulls this off the front foot to deep midwicket for a couple. Not much pace from Parnell there, easily dealt with"
274,"Parnell to Faulkner, no run bouncer down the leg side, but Russell Tiffin lets the bowler off the hook, he thinks it's fine"
275,"Phangiso to Starc, 1 leg bye how has he survived that one! That spun in from outside off and hit the batsman who was stuck on the crease.. was it turning down leg? Maybe"
276,"Phangiso to Faulkner, 1 run flatter delivery on the stumps, the batsman dabs it to the leg side for a single"
277,"Phangiso to Starc, no run sliding down the leg side but the batsman paddles it to short fine leg"
278,"Phangiso to Starc, no run fuller delivery on the stumps, the batsman digs it out to the off"
279,"Phangiso to Starc, SIX runs useful hitting! Starc is being the thorn for South Africa here, swings hard and clears the rope over long on.. Australia are making something out of this"
280,"Phangiso to Starc, no run looks to hit across the line, the batsman gets hit on the pads"
281,"Steyn to Faulkner, 2 runs fires it full on the stumps, the batsman flicks it through midwicket for a single"
282,"Steyn to Faulkner, 2 runs nearly a catch at slip! But that travelled quickly to him and was going over.. Faulkner makes room and flashes hard, Amla does well to get a hand to it actually"
283,"Steyn to Faulkner, no run makes room and swings down the line, makes no connection though"
284,"Steyn to Faulkner, FOUR runs Whoaa.. Fa U L K N E R!! He goes long.. Charges down the pitch, Steyn chases him but he still swings across the line and clears the rope at cow corner.. only just.. but Australia are loving these late hits. The umpires want to be sure if that cleared the ropes.. it's given a four"
285,"Steyn to Faulkner, FOUR runs second boundary now! Faulkner is turning it on, he moves to the leg side and drills this fuller delivery through extra cover for four more"
286,"Steyn to Faulkner, 1 leg bye fired on the blockhole, the batsman digs it out to the leg side for a quick single"
287,"Morkel to Faulkner, 2 runs sharp bouncer, the batsman pulls it without timing to vacant wide mid-on and they get back for a couple.. It was off the toe of the bat"
288,"Morkel to Faulkner, FOUR runs he has cleared the mid-off fielder! Faulkner was saving himself for this assault, makes room and slices it over the infield.. Not much timing, but that would do"
289,"Morkel to Faulkner, 2 runs he comes forward and wallop's this length delivery to the cow corner for a couple of runs"
290,"Morkel to Faulkner, 1 wide he sees the batsman charging and pushes it wide, a bit too wide.."
291,"Morkel to Faulkner, 1 run gets a high full toss which he outside edge down to third man! The bowler is lucky, that could have gone anywhere.. Faulkner was intent on sending it outside the ground"
292,"Morkel to Starc, no run looks to pull but this is a slower bouncer! That hits the batsman's rib cage."
293,"Morkel to Starc, 4 byes this beats everyone! It was a good slower ball and beats the batsman's swing, but it drops short of de Kock, who is not able to bring his body behind it. Australia breach the 200-mark. Excellent stuff from these two"
294,"Parnell to Faulkner, 2 runs bowls on the pads as the batsman tries to make room, but Faulkner smartly flicks it through backward square leg"
295,"Parnell to Faulkner, no run good slower delivery this one! The batsman reaches out as this is wide, but can only underedge it to the keeper"
296,"Parnell to Faulkner, no run bowls a sharp bouncer now! Faulkner fends it in the air down the pitch.. a few meters away from Parnell. The bowler gets to the ball and fires a throw at the non-striker's"
297,"Parnell to Faulkner, 1 run he makes room and punches it to extra cover for a single"
298,"Parnell to Starc, 3 runs he clears his front leg and hammers the short delivery over extra cover for three runs to the deep. These runs are hurting SA"
299,"Parnell to Faulkner, FOUR runs down the leg side and Faulkner just has to get some bat on it, he flicks it past the short fine leg fielder for yet another boundary. Parnell was expecting him to make room, but Faulkner was still this time"
300,"Morkel to Starc, no run slower delivery, the batsman swings his bat but meets thin air"
301,"Morkel to Starc, 1 run he gets cramped for room as Morkel targets the ribs, the batsman takes off for a single. Morne gets to the ball and wants to hit the stumps, but holds it back. Starc was in the way and Morkel has been wary of throwing all day"
302,"Morkel to Faulkner, 2 runs fires it in the blockhole but the batsmen take a couple to long off, that was hit straight down the ground"
303,"Morkel to Faulkner, OUT he moves to the leg side to hit it over the top but Faulkner has holed out at long on"
304,"Morkel to Starc, 2 runs he shuffles across to the off side and drags the length ball to wide long on for a couple"
305,"Morkel to Starc, no run swing and a miss, but Australia have done well"
306,"A 71-run stand between Mitchell Starc and James Faulkner has lifted Australia from the dungeons and have given them a total to fight. Fifty runs came off the last five overs as SA lost the control they had exerted through 80% of the innings. Dale Steyn was fantastic: he struck with the new ball, then shook Australia's"
307,That was a short break. Boks are leading over the Wallabies 23-14.. Here comes Mitch Johnson
308,"Johnson to Amla, no run gets some inward shape outside off, the batsman punches it to cover off the front foot"
309,"Johnson to Amla, no run quicker delivery outside off, the batsman allows it to go through.. That had some zip in it"
310,"Johnson to Amla, no run targets the body with a short one, Amla sways away from the line"
311,"Johnson to Amla, no run looks to punch this fuller delivery through off without getting his feet forward, ends up inside edging it to mid-on"
312,"Johnson to Amla, FOUR runs this is beautifully punched down the ground for a boundary! Johnson is serving them full and rightly so, but Amla brings his bat down in time and punches it straight past the non-striker"
313,"Johnson to Amla, no run looks to drive it through cover, but doesn't get much timing, pushes it to mid-off"
314,"Maxwell to de Kock, no run pushed through on off stump, the batsman defends it down the pitch"
315,"Maxwell to de Kock, 2 runs much slower but wider outside off, the batsman comes forward and punches it through point for a couple of runs"
316,"Maxwell to de Kock, FOUR runs outside edge! QdK is lured into a booming drive but gets a thick outside edge wide of the lone slip, it runs down to the boundary"
317,"Maxwell to de Kock, 1 run fuller on the stumps, he comes forward and eases it down to long off"
318,"Maxwell to Amla, 1 run quicker delivery on the stumps, Amla nudges it past midwicket for a single"
319,"Maxwell to de Kock, no run lots of air on off stump, the batsman pushes it to cover"
320,"Johnson to Amla, 2 runs he stands tall and punches this length delivery through wide mid-off for a couple of runs, it looks just like a defensive push, but it is aimed at the gap"
321,"Johnson to Amla, no run not much feet movement, but Amla drives it with a lot of timing, straight to the fielder at mid-off though"
322,"Johnson to Amla, no run pushes this one wide outside off, it's just inside the marker. The umpire gives it a good look but decides against calling it a wide"
323,"Johnson to Amla, no run he comes forward and punches the length delivery down to mid-off"
324,"Johnson to Amla, no run he walks way over to the off side and drives the fuller delivery with a lot of timing, finds the man at cover.. He exposed all three stumps there.."
325,"Johnson to Amla, no run looks to pull one that is not short enough, it grazes the thigh pad before rolling to the second slip fielder"
326,"Maxwell to de Kock, no run full toss is eased towards cover, should have found the gap there"
327,"Maxwell to de Kock, OUT he would have loved to found the gap this time, Quinton de Kock has fallen early once more, he skips over near the pitch of the ball and looks to clobber the ball over the leg side, a leading edge sends the ball looping towards Bailey at cover, Maxwell gets de Kock again"
328,"Maxwell to Amla, 3 runs full ball outside off, Amla is his usual elegant self, pushes that past cover for three"
329,"Maxwell to du Plessis, no run the man in form, Faf du Plessis, drives this back towards the bowler"
330,"Maxwell to du Plessis, no run outside off and that is left alone"
331,"Maxwell to du Plessis, 1 run eased towards long-on for a single"
332,"Johnson to du Plessis, 1 run thick outside edge there, Australia need this wicket early, bounces short and wide of a diving Steve Smith in the cordon"
333,"Johnson to Amla, no run left alone outside off"
334,"Johnson to Amla, no run mistimed drive back towards the bowler"
335,"Johnson to Amla, 1 run short of length ball, Amla jumps to get on top of the bounce of that one, guides the ball towards third man, nicely done by Amla there"
336,"Johnson to du Plessis, no run pitched up and that is driven towards mid-off, Johnson has his hands on his head as though he was expecting a wicket there, but Faf pretty much middled it"
337,"Johnson to du Plessis, no run full and outside off, Faf watches it through to the keeper"
338,"Marsh to Amla, 2 runs width on offer, Amla slashes the ball towards cover, Smith dives but he can't make a clean stop"
339,"Marsh to Amla, no run outside off from Mitchell Marsh, Amla happy to leave"
340,"Marsh to Amla, no run on a length and heading for off stump, defended down the track"
341,"Marsh to Amla, 1 run Marsh gets the outside edge, Amla not in control as he looksto push down the ground, the ball stays low though and goes past backward point"
342,"Marsh to du Plessis, no run defended down the track by Faf"
343,"Marsh to du Plessis, FOUR runs what a hit from Faf, makes a touch of room and punches that back of a length ball through cover for four, played that on the up, well wide of the fielder"
344,"Starc to Amla, no run Mitch Starc takes over from Mitch Johnson, his first ball is defended down the track"
345,"Starc to Amla, 3 runs full and a touch of width, Amla pounces on that one, lashing it through cover, but the timing is not there, the ball slows down near the rope and the batsmen take three"
346,"Starc to du Plessis, no run defended towards the off side by Faf"
347,"Starc to du Plessis, no run driven towards cover by Faf, he can't place it in the gap though"
348,"Starc to du Plessis, 1 wide fires this down the leg side, he will have to re-bowl this one"
349,"Starc to du Plessis, no run defends this one to the off side"
350,"Starc to du Plessis, 1 run full and on middle stump, dug out towards mid-on, that was a very tight single, 'yes, yes, yes' Faf called after playing the shot, Amla responded immediately, else he would have been caught short by that direct hit, they ponder taking an overthrow but there isn't time"
351,"Marsh to du Plessis, no run full ball outside off, defended solidly to the off side"
352,"Marsh to du Plessis, FOUR runs Marsh drops it short, he doesn't have the pace to drop it short, especially against Faf in this form, Faf swats this to the square-leg boundary"
353,"Marsh to du Plessis, 3 runs this time it is fuller, but still Faf gets three as he launches this over the off side, skips down the track and sends it over cover, can't time it properly so the fielder can drag it back as it nears the rope"
354,"Marsh to Amla, 2 runs full and on the pads, clipped towards deep square-leg for two more, South Africa scoring plenty"
355,"Marsh to Amla, 1 run pitched up and on the pads, nudged towards deep midwicket"
356,"Marsh to du Plessis, 1 run tuck towards midwicket for one more, 11 off the over, too many leg-side deliveries from Marsh there"
357,"Starc to du Plessis, 1 run steers this one towards third man for an ambled single"
358,"Starc to Amla, no run Amla surprised as the ball cuts away from Starc, Amla ends up playing inside the line as he looks to drive through off"
359,"Starc to Amla, no run middles it this time, a pitched-up delivery is crisply struck towards cover, but straight at cover"
360,"Starc to Amla, FOUR runs top cricket this, short ball at the body, superbly directed, Amla arched his back seemingly wanting to get out of the way initially, but he has the time to just dab this one towards third man for four, a diving Marsh can't cut it off"
361,"Starc to Amla, 1 run tapped towards square leg this time"
362,"Starc to du Plessis, no run full and on the stump, defended to the off side"
363,"Marsh to Amla, no run balls stays a touch lower than Amla expects, he has to adjust late, the ball was moving away a bit as well, Amla opens the face as he defends towards cover"
364,"Marsh to Amla, no run length ball heading for off stump, blocked back down the track"
365,"Marsh to Amla, no run a touch shorter, keeps it tight around off stump, Amla blocks this to the off side"
366,"Marsh to Amla, no run big lbw shout but that was definitely too high and possibly heading down the leg side, Amla was looking to work this length ball towards square leg, hit high on the pad, the ball rolls towards point"
367,"Marsh to Amla, no run length ball is crisply driven towards mid-off by Amla"
368,"Marsh to Amla, 1 run full and on the pads, clipped down towards fine leg"
369,"Faulkner to Amla, 1 run full and on the pads, tucked towards midwicket, played it in the air"
370,"Faulkner to du Plessis, 1 run length ball on middle and off, driven towards long-off for a single, South Africa having it too easy here, Australia need some Johnson magic"
371,"Faulkner to Amla, no run length ball from Faulkner, pushed back towards the bowler"
372,"Faulkner to Amla, 1 run on the pads, tucked behind square leg for another single"
373,"Faulkner to du Plessis, 1 run run-out? short of length ball outside off, Faf defends it towards cover point, another tight single attempted, direct hit from Maxwell, is Amla gone this time? Australia think so, but he has made it in, just in, Maxwell had to move a few yards to his left to collect the ball, provi"
374,"Faulkner to Amla, 1 run drops the ball towards backward point, another quick single, less risky than the previous one"
375,"Lyon to Amla, no run length ball from Lyon,round the wicket, turns in towards the pads, defended"
376,"Lyon to Amla, no run tossed this one outside off, bit of air as well, punched towards extra cover"
377,"Lyon to Amla, 2 runs length ball on the stumps, Amla is quickly out of the crease and whips it flamboyantly towards midwicket, good running there"
378,"Lyon to Amla, no run once more Amla takes a few strides down the track, tucks this towards mid-on, a diving stop from the bowler Lyon"
379,"Lyon to Amla, 1 run fuller and on the pads, easy to deflect that towards square leg for a single"
380,"Lyon to du Plessis, 1 run Faf gets on one knee and scoops this one towards short fine leg"
381,"Faulkner to du Plessis, SIX runs Faf does what he has been doing all series, whacking the ball where he pleases, he skips down the pitch to get near the ball and effortlessly sends that soaring to the wide long-on boundary, 50 stand comes up, just missed the cameraman there by a yard"
382,"Faulkner to du Plessis, no run slower one and that is defended towards midwicket"
383,"Faulkner to du Plessis, 1 run off the leading edge as Faf is squared up, the ball dribbles towards cover for a single"
384,"Faulkner to Amla, no run full ball is defends towards cover"
385,"Faulkner to Amla, 1 run full ball is helped towards short fine leg for a single"
386,"Faulkner to du Plessis, no run short of length ball heading towards middle and leg, defended towards point"
387,"Lyon to Amla, no run spinning in from round the wicket, Amla stays back as he defends"
388,"Lyon to Amla, 1 run comes down the pitch this time and wristily works it towards square leg"
389,"Lyon to du Plessis, no run ooh, for a change not off the middle of the bat from Faf, he was charging down the track and looking to whack that over mid-on, the ball turns plenty and nearly sneaked past, an edge, low on the bat says Faf"
390,"Lyon to du Plessis, 1 run tucked towards midwicket, plenty of spin here for Lyon"
391,"Lyon to Amla, 2 runs flicked uppishly past Bailey at square leg"
392,"Lyon to Amla, no run not the most elegant of strokes, Amla doesn't time it too well either as he slaps the ball towards mid-off"
393,"Johnson to du Plessis, 1 run his first ball is punched towards cover for a single"
394,"Johnson to Amla, 1 run short of a length, just outside off, Amla gets off his feet to get on top of the bounce, expertly controlled as he sends the ball towards third man"
395,"Johnson to du Plessis, 1 run length ball is driven towards cover for a single"
396,"Johnson to Amla, 1 run fired in towards the pads from round the wicket, eased towards midwicket for a single"
397,"Johnson to du Plessis, FOUR runs flings this down the leg side, easy for Faf to guide this along to fine leg for four"
398,"Johnson to du Plessis, no run short of a length ball and just outside off, stabbed towards backward point, straight at Maxwell"
399,"Lyon to Amla, no run full and on the pads, clipped to square leg"
400,"Lyon to Amla, 1 run length ball is eased towards midwicket for a single"
401,"Lyon to du Plessis, 1 run goes for the scoop once more, not off the middle of the bat, the ball lobs up but lands safely near short fine leg"
402,"Lyon to Amla, no run more spin for Lyon, Amla looks to defend off the front foot, thick inside edge to the leg side"
403,"Lyon to Amla, no run on the pads once more, Amla charges out once more, tucks this to square leg"
404,"Lyon to Amla, 1 run another edge, this one was the closest to a wicket, Amla was going to thrash that through the cover, bottom edge sends the ball past the stumps and the keeper, Lyon can't believe his luck"
