,Data
412,"Watson to Dilshan, 1 run pushed with soft hands in front of point for a quick single, this is the highest opening stand of the series"
413,"Watson to Mahela Jayawardene, 1 run short of a length outside off stump, dabbed off the back foot towards third man"
414,"Christian to Mahela Jayawardene, SIX runs this is some shot! Jayawardene moves towards the off side, gets down on one knee, and sweeps the ball flat over the deep backward square leg boundary"
415,"Christian to Mahela Jayawardene, 1 run short and wide outside off stump, cut hard towards the backward point boundary where Pattinson makes a diving save, poor running from Dilshan, he assumed it was four"
416,"Christian to Dilshan, 1 run driven off the front foot through extra cover"
417,"Christian to Mahela Jayawardene, 1 run Jayawardene dabs the ball towards third man"
418,"Christian to Dilshan, 1 run played off the back foot through square leg, Sri Lanka reach 150 far quicker than expected"
419,"Christian to Mahela Jayawardene, no run played off the pads towards midwicket, where the fielder fumbles but not very badly"
420,"Watson to Dilshan, FOUR runs Dilshan charges Watson again and swings hard at a length ball, getting a thick outside edge wide of the wicketkeeper to the third man boundary"
421,"Watson to Dilshan, no run played from the crease towards point"
422,"Watson to Dilshan, no run that's a bit too close to cut but Dilshan tries to anyway and is beaten"
423,"Watson to Dilshan, no run played of the back foot towards point"
424,"Watson to Dilshan, 1 run width offered outside off stump, cut late towards third man"
425,"Watson to Mahela Jayawardene, no run defended on the off side"
426,"Christian to Dilshan, no run Dilshan cuts but can't beat point, Wade is standing up to the stumps"
427,"Christian to Dilshan, no run full and straight, on off stump, driven firmly to the fielder at cover"
428,"Christian to Dilshan, 1 run that's quite a full ball but Dilshan cuts it past point towards third man"
429,"Christian to Mahela Jayawardene, FOUR runs full ball, the line is quite straight, Jayawadene lines it up and swings hard, lofting the ball flat over the fielder at mid-on"
430,"Christian to Mahela Jayawardene, no run short of a length around off stump, Jayawardene defends on the back foot"
431,"Christian to Mahela Jayawardene, 1 run a full toss on middle stump, Jayawardene drives wide of mid-on, the fielder scampers to his right and dives full length to save runs"
432,"Watson to Mahela Jayawardene, 1 run Jayawardene moves forward and drives through cover"
433,"Watson to Dilshan, no run defended back to the bowler"
434,"Watson to Dilshan, FOUR runs Dilshan's blazed that through cover, hitting it from the crease with a lot of power, the length was on the shorter side and the line was outside off"
435,"Watson to Dilshan, no run a huge appeal for a caught behind, I heard an edge there, I thought? There was a huge edge, a massive deflection off the cut and Wade did superbly to catch it standing up to the stumps. Asad Rauf didn't see it"
436,"Watson to Dilshan, no run driven towards cover from the crease"
437,"Watson to Dilshan, 3 runs a length ball outside off and Dilshan dabs it fine past the keeper, Doherty dives on the third man boundary to save runs, they've done a lot of that today"
438,"Pattinson to Dilshan, 1 wide a full ball on the pads, Wade dives to his left to collect"
439,"Pattinson to Dilshan, 1 run full delivery outside off, driven from the crease towards deep cover"
440,"Pattinson to Mahela Jayawardene, no run defended towards the leg side from the crease"
441,"Pattinson to Mahela Jayawardene, no run Jayawardene edges the attempted cut, but it's a bottom edge so the ball dies and bounces well in front of the wicketkeeper"
442,"Pattinson to Mahela Jayawardene, no run he was trying to drive on the off side but the ball goes towards midwicket"
443,"Pattinson to Mahela Jayawardene, no run short of a length outside off, played towards the off side on the back foot"
444,"Pattinson to Mahela Jayawardene, 1 run short ball, hit flat and with power towards the fielder on the deep midwicket boundary"
445,"Watson to Mahela Jayawardene, FOUR runs Jayawardene launches a length ball into the gap between deep midwicket and long-on, he was on the front foot and made contact with a full swing of the bat"
446,"Watson to Mahela Jayawardene, no run defended towards point from the crease"
447,"Watson to Mahela Jayawardene, no run good length and straight, Jayawardene stays in his crease and defends"
448,"Watson to Mahela Jayawardene, 1 run cut off the back foot towards the fielder on the sweeper boundary"
449,"Watson to Dilshan, 1 run Dilshan opens the face late to play towards third man"
450,"Watson to Mahela Jayawardene, 1 run driven off the front foot through cover"
451,"Pattinson to Sangakkara, no run punched off the middle of the bat to mid-off"
452,"Pattinson to Sangakkara, no run driven off the front foot towards mid-on"
453,"Pattinson to Sangakkara, no run good length and straight, Sangakkara stays in his crease and defends"
454,"Pattinson to Sangakkara, no run Sangakkara tries to drive through the off side but gets an inside edge towards the bowler"
455,"Pattinson to Sangakkara, no run defended from the crease towards cover"
456,"Doherty to Dilshan, 1 run driven off the front foot through cover"
457,"Doherty to Sangakkara, no run Sangakkara strides forward and drives to cover"
458,"Doherty to Sangakkara, 1 run he steps out this time and drives towards long-on"
459,"Doherty to Dilshan, no run Dilshan reaches out on the front foot and defends to cover"
460,"Doherty to Dilshan, 1 run Dilshan steps out and pushes towards long-on"
461,"Doherty to Sangakkara, 1 leg bye Sanga moves towards the off side and nudges the ball off his pads behind square"
462,"Pattinson to Sangakkara, 1 run played towards the fielder on the deep point boundary"
463,"Pattinson to Dilshan, no run Pattinson pitches on a good length and brings the ball into the right-hander, Dilshan defends back to the bowler"
464,"Pattinson to Dilshan, 2 runs Dilshan steers towards third man and gets a thick-ish edge, Doherty runs to his left and fields"
465,"Pattinson to Dilshan, no run played off the back foot towards point"
466,"Pattinson to Dilshan, no run Dilshan stays in his crease and plays towards midwicket"
467,"Pattinson to Dilshan, 1 wide short of a length down leg side, Wade leaps to his left and saves four runs with a one-gloved take"
468,"Pattinson to Dilshan, 1 run worked off the pads through square leg"
469,"Doherty to Dilshan, 1 run played through midwicket for one more"
470,"Doherty to Sangakkara, no run Sanga moves forward and across to nudge towards midwicket"
471,"Doherty to Sangakkara, 1 run Sanga steps out and forces the ball through midwicket, they wait a moment until the ball beats the diving fielder and then continue running"
472,"Doherty to Sangakkara, no run nudged off the pads on the front foot on the leg side"
473,"Doherty to Sangakkara, 1 run Sanga whips the ball off his pads through square leg"
474,"Pattinson to Sangakkara, 1 run Sangakkara moves across his stumps and flicks the ball off his pads through square"
475,"Pattinson to Dilshan, 1 run Dilshan stays on the back foot and opens the face to steer a short of a length ball towards third man"
476,"Pattinson to Sangakkara, 1 run Sanga strides forward and drives towards extra cover, he wanted a run but was sent back by Dilshan, the throw at the keeper's end is a needless one and it concedes an overthrow"
477,"Pattinson to Dilshan, 1 run played off the pads through square leg, it's all rather tepid out there at the moment"
478,"Pattinson to Sangakkara, no run Sangakkara moves across and work a short of a length ball towards the fielder at square leg"
479,"Pattinson to Sangakkara, no run driven from the crease towards mid-off"
480,"Doherty to Dilshan, 1 run driven off the front foot to long-on"
481,"Doherty to Sangakkara, 1 run played to long-on once again, by the left-hand batsman this time"
482,"Doherty to Dilshan, 1 run Dilshan cuts into the gap at point"
483,"Doherty to Sangakkara, no run driven low and in the air towards short cover, but falls well short of the fielder"
484,"Doherty to Sangakkara, no run played towards midwicket"
485,"Doherty to Sangakkara, no run Sanga goes deep into his crease and nudges towards midwicket"
486,"McKay to Dilshan, no run what happened there? It was the slower ball and it kicked off the pitch at Dilshan, who tried to close the face too early. He got an edge off the shoulder of the bat into his neck"
487,"McKay to Dilshan, no run driven with power towards cover"
488,"McKay to Dilshan, 3 runs Dilshan glances the ball off his pads towards fine leg, giving Watson some work to do"
489,"McKay to Sangakkara, no run pushed off the front foot towards cover point"
490,"McKay to Sangakkara, 2 runs worked off the pads behind square leg, the ball's been placed into the gap so the two is on"
491,"McKay to Sangakkara, no run cut off the back foot towards point"
492,"Doherty to Dilshan, no run defended off the front foot on the off side, Doherty ambles across to field"
493,"Doherty to Dilshan, 2 runs pulled with power to the square leg boundary, Hussey slides and saves the four, Dilshan thinks he's got his century, but he's on 98, he's taken his helmet off and raised his bat, even Sanga went up and congratulated him, I think the scoreboard says he's on 100"
494,"Doherty to Dilshan, no run cut off the back foot to point"
495,"Doherty to Dilshan, 2 runs Dilshan inside edges past his stumps, he was trying to cut but the ball went to fine leg, he gets his century now, but he's already celebrated. No reaction this time from him. That's quite funny"
496,"Doherty to Dilshan, no run defended on the front foot"
497,"Doherty to Dilshan, FOUR runs Dilshan cuts and beats the fielder at point and collects four more, and it's time for the batting Powerplay"
498,"McKay to Sangakkara, no run Sanga tries to drive straight but gets an edge towards point"
499,"McKay to Sangakkara, 2 runs Sanga drives the full ball straight past McKay, who takes some pace off the ball, the fielders at mid-on and mid-off converge on the ball and both miss it"
500,"McKay to Sangakkara, 1 run a short of a length slower ball outside off, Sanga mis-hits it on the off side"
501,"McKay to Dilshan, 1 run Dilshan nudges the slower ball off the back foot close to the keeper and sets off for the single"
502,"McKay to Sangakkara, 1 run Sanga plays an elegant drive to mid-on for a single"
503,"McKay to Dilshan, no run Dilshan charges but gets beaten by a sower ball outside off stump, he didn't even play a shot"
504,"Lee to Sangakkara, no run full ball around off stump, Sanga moves forward and drives towards cover"
505,"Lee to Sangakkara, no run Sangakkara pushes at a length ball from his crease and gets an inside edge on to his body, the ball drops near his feet and Lee runs to it quickly"
506,"Lee to Sangakkara, 2 runs a bit too straight from Lee, Sangakkara stays back and glances the ball towards long leg"
507,"Lee to Sangakkara, no run defended back to the bowler"
508,"Lee to Sangakkara, 2 runs Sangakkara works the ball off his pads to the fielder at fine leg"
509,"Lee to Sangakkara, FOUR runs too full on the pads, Sangakkara helps it along to the fine leg boundary by glancing past the fielder in the circle"
510,"McKay to Dilshan, no run the slower ball kicks off the pitch again and gives Dilshan some trouble as he tries to play on the leg side, he took his right hand of the bat and shook it"
511,"McKay to Dilshan, no run a huge appeal for lbw after another slower ball beats Dilshan's attempt at glancing towards midwicket, that hit him on the back pad and is very close, that looked out, McKay looks gutted at the umpire's not-out decision"
512,"McKay to Dilshan, 1 run Dilshan once again takes his right hand off the bat as he glances behind square, it was another slower ball"
513,"McKay to Sangakkara, FOUR runs Sangakkara rocks back and brings up the 50 partnership with a fierce pull to the deep midwicket boundary, he hit that from outside off stump"
514,"McKay to Sangakkara, no run played off the back foot towards point"
515,"McKay to Sangakkara, FOUR runs Sangakkara charges McKay and throws his bat at a short of a length delivery, carving it over the infield at point towards the vacant boundary"
516,"Lee to Dilshan, no run Dilshan stays in his crease and drives to extra cover"
517,"Lee to Chandimal, no run Lee delivers a superb yorker first up, swinging into the right-hander, Chandimal is up for it though and defends confidently"
518,"Lee to Chandimal, no run this time he tries to cut a ball that is too close to him and rather quick, he gets beaten outside off stump"
519,"Lee to Chandimal, no run Chandimal stays in his crease and defends a length ball on the off side"
520,"Lee to Chandimal, no run Chandimal moves forward and drives to cover, Lee bowls a wicket maiden during the batting Powerplay"
521,"McKay to Sangakkara, 1 run Sangakkara moves forward and across, using the angle into him from round the wicket to tuck off his pads through square leg"
522,"McKay to Chandimal, no run a slower ball outside off, Chandimal cuts too early and is beaten"
523,"McKay to Chandimal, FOUR runs he's blasted this off the front foot through extra cover, it was a length ball outside off and Chandimal did not hold back, swinging his bat extremely hard"
524,"McKay to Chandimal, 2 runs this time he gets an inside edge on to the pad and the ball ricochets towards third man"
525,"McKay to Chandimal, no run Chandimal dabs the ball on the front foot towards midwicket"
526,"McKay to Chandimal, 1 run Chandimal cuts between point and cover for a single"
527,"Lee to Chandimal, no run that is a quick bouncer outside off stump, Chandimal tries to slash it but is beaten"
528,"Lee to Chandimal, FOUR runs too full outside off, Chandimal walks into a lovely cover drive, placing the ball through the gap and timing it well enough to reach the boundary"
529,"Lee to Chandimal, 1 run Lee pitches on off and finishes around middle, Chandimal turns the ball off his pads through square"
530,"Lee to Sangakkara, 1 run Sanga uses the angle into him from round the wicket to nudge towards square"
531,"Lee to Chandimal, 1 run short of a length delivery outside off, Chandimal dabs close on the off side and the batsmen sprint the single"
532,"Lee to Sangakkara, 1 run a full ball outside off, dug out on the off side for a single, Sri Lanka reach 250"
533,"Pattinson to Sangakkara, no run short of a length angling into the left-hander, Sanga defends towards the bowler"
534,"Pattinson to Sangakkara, 1 run played off the back foot with soft hands behind point"
535,"Pattinson to Chandimal, 1 run Wade fires the throw in at the bowler's end after Chandimal dabbed a short of a length ball close on the off side, Chandimal would have been safe even if there was a direct hit"
536,"Pattinson to Sangakkara, 2 runs played with an open face towards third man"
537,"Pattinson to Sangakkara, no run Sangakkara moves across his crease and plays on the leg side"
538,"Pattinson to Sangakkara, 1 run Sangakkara moves towards the line of the ball outside off and steers towards third man"
539,"Lee to Sangakkara, no run short of a length ball, Sangakkara misses the pull and gets hit on the body, Chandimal begins to run and then turns back"
540,"Lee to Sangakkara, 1 run he moves across his crease to clip a full ball off his pads towards the fielder at long leg"
541,"Lee to Chandimal, 1 run Chandimal rises to meet a ball that lifts awkwardly on him and tucks it off his body towards fine leg, I wonder how someone like Suresh Raina would have played that ball"
542,"Lee to Sangakkara, no run that's much too wide outside off for Sanga to be pulling, he gets beaten"
543,"Lee to Sangakkara, FOUR runs Sangakkara charges Lee and hits him in the air past the fielder at mid-on to the boundary"
544,"Lee to Sangakkara, 1 run a low full toss outside off, Sanga drives through cover point"
545,"Pattinson to Sangakkara, no run Sangakkara works the ball in front of square"
546,"Pattinson to Sangakkara, 1 run short of a length ball outside off, Sangakkara uses the angle into him to pull between midwicket and mid-on, he didn't time it properly, hit it with the toe of the bat"
547,"Pattinson to Chandimal, 1 run played off the hips towards square leg for a single"
548,"Pattinson to Sangakkara, (no ball) 2 runs Sangakkara backed away to make room and hit towards the off side, he got an inside edge towards fine leg, Pattinson had overstepped once again, so a free hit coming up"
549,"Pattinson to Sangakkara, 1 run short of a length outside off, Sangakkara hits it hard off the back foot but can't beat the fielder on the cover boundary"
550,"Pattinson to Chandimal, 1 run short of a length at the body from over the wicket, Chandimal once again copes with the bounce and fends down on the leg side"
551,"Pattinson to Sangakkara, 1 run a full delivery outside off, Sangakkara drives in front of point for a single"
552,"Watson to Sangakkara, no run a full and straight delivery, Sangakkara drives from the crease but can't beat cover"
553,"Watson to Sangakkara, FOUR runs Sangakkara gives Sri Lanka victory and gets to his half-century with a powerful swing to the deep midwicket boundary, the best of three finals are level at 1-1 with the decider on Thursday"
554,"So the CB Series finals is level at 1-1, with the decider on Thursday. Do join us for that game. That's all I've got for you today, thank you for all your emails. Cheers."
555,The presentation is imminent ...
556,"""ROAR!!!"" says Dinusha."
557,"9.30 pm As far as chases of substantial totals go, this is as strong as they come. Sri Lanka, through a poor performance in the field, were faced with a target of 272 and they've gunned it down with eight wickets in hand and 34 balls to spare. It's been a memorable performance from Jayawardene, Dilshan and the rest. Dilshan is the obvious choice for Ma"
558,Sri Lanka won by 8 wickets (with 34 balls remaining)
559,"Player of the match is Tillakaratne Dilshan, SL"
