,Data
434,"Southee to Hussey, 1 run full on the middle and leg. Hussey, whips it to midwicket for a single"
435,"Southee to Haddin, no run fuller in length outside the off stump. Haddin, comes down the track and drives it to cover"
436,"Southee to Haddin, no run fuller on the off stump. Haddin, mistimes the drive as it falls well short of the fielder at mid-on"
437,"Vettori to Hussey, 1 run"
438,"Vettori to Haddin, 1 run on the middle stump, Haddin, comes down the ground and chips it to deep midwicket for a single"
439,"Vettori to Hussey, 1 run fuller on the middle stump, Hussey, pushes it to midwicket for a single"
440,"Vettori to Haddin, no run good length outside the off stump. Haddin, drives it to cover"
441,"Vettori to Haddin, no run good length on the middle stump. Haddin, pushes it to mid-on"
442,"Vettori to Haddin, no run fuller length delivery on the off stump. Hadin, comes forward and drives it back to the bowler"
443,"Elliott to Hussey, no run short outside the off stump. Hussey, lets it pass to the keeper"
444,"Elliott to Hussey, 1 run short outside the off stump. Hussey, cuts it to deep point for a single"
445,"Elliott to Haddin, no run short outside the off stump. Haddin, comes down the track and looks to cut it away but is, beaten"
446,"Elliott to Haddin, 1 run fuller on the leg stump, Haddin, pushes it to midwicket for a single"
447,"Elliott to Hussey, no run on the leg stump. Hussey, pushes it to midwicket"
448,"Elliott to Hussey, 1 leg bye off the pads to midwicket for a leg-bye"
449,"Vettori to Hussey, 1 run on the off stump, Hussey, gets onto the backfoot and whips it to deep square leg for a single"
450,"Vettori to Haddin, no run good length delivery outside the off stump, Haddin, comes forward and defends it"
451,"Vettori to Haddin, 1 run short outside the off stump. Haddin, cuts it to deep point for a single"
452,"Vettori to Hussey, no run fuller outside the off stump. Hussey comes forward and defends it back to the bowler"
453,"Vettori to Hussey, no run short outside the off stump, Hussey, cuts it to cover"
454,"Vettori to Hussey, 1 run fuller on the middle stump, Hussey, pushes it to midwicket for a single"
455,"Elliott to Hussey, no run outside the off stump and left alone"
456,"Elliott to Hussey, no run slower delivery on the middle stump. Hussey, inside edges it onto his pads"
457,"Elliott to Hussey, 1 run, OUT short outside the off stump. Hussey, cuts it to deep point and Haddin, wants a couple. Hussey, initially responds and shouts a loud no as Haddin is on the run. Haddin has to run back and he is not quick enough to beat Cumming's throw. Kiwis are right on to"
458,"Elliott to Hussey, no run comes forward and defends"
459,"Elliott to Hussey, no run outside the off stump, Michael, comes forward and pushes it to cover"
460,"Elliott to Hussey, no run outside the off stump and short in length. Michael, cuts it to point"
461,"Vettori to Hussey, 1 run short outside the off stump. David, cuts it to deep point for a single"
462,"Vettori to Hussey, FOUR runs fuller outside the off stump. Michael gets going with a square drive and gets a boundary for his efforts"
463,"Vettori to Hussey, 1 run outside the off stump, Michael, comes forward and pushes it to the off-side for a single"
464,"Vettori to Hussey, 1 run fuller outside the off stump, David, drives it to long-off for a single"
465,"Vettori to Hussey, no run on the good length outside the off stump. Michael, is looking to defend it but gets an outside edge to short third man"
466,"Vettori to Hussey, no run outside the off stump, Michael, comes forward and defends it to cover"
467,"Elliott to Hussey, no run short delivery outside the off stump. David, shoulders arms to the delivery"
468,"Elliott to Hussey, 1 run fuller on the leg stump, David, turns it to deep square leg for a single"
469,"Elliott to Hussey, no run outside the off stump, Michael, drives it back to the bowler"
470,"Elliott to Hussey, no run on the leg stump, Michael, plays it away on the leg side"
471,"Elliott to Hussey, 1 wide short and it sails over the head of Michael comfortably and is called a wide"
472,"Elliott to Hussey, no run outside the off stump, comes forward and plays it to the off-side with soft hands"
473,"Elliott to Hussey, no run"
474,"Vettori to Hussey, 1 run"
475,"Vettori to Hussey, 2 runs dropped! Guptill does exceptionally well to reach to the pull shot by Michael but does not hold onto the delivery"
476,"Vettori to Hussey, no run left alone outside the off stump"
477,"Vettori to Hussey, no run"
478,"Vettori to Hussey, SIX runs short on the off stump. Michael rocks back and pulls it away over midwicket for a six"
479,"Vettori to Hussey, no run outside the off stump, Michael comes forward and defends"
480,"Elliott to Hussey, 1 run outside the off stump. David comes forward and drives it to cover"
481,"Elliott to Hussey, 1 run short and wide outside the off stump. Michael cuts it but a good team work by the fielders at point and backward point prevents anything more a single"
482,"Elliott to Hussey, no run outside the off stump, David comes forward and defends it"
483,"Elliott to Hussey, 1 run outside the off stump. David pushes it to cover and sets off for a single"
484,"Elliott to Hussey, 1 run"
485,"Elliott to Hussey, 1 run outside the off stump. David drives it to sweeper cover for another single to retain the strike"
486,"Vettori to Hussey, 1 run fuller on the off stump, David comes forward and pushes it to long-on for a single"
487,"Vettori to Hussey, 1 run good length delivery on the leg stump. Michael, pushes it to midwicket for a single"
488,"Vettori to Hussey, 2 runs fuller on the leg stump, David sweeps it to fine-leg for a couple"
489,"Vettori to Hussey, no run outside the off stump. David, comes forward and pushes it to cover"
490,"Vettori to Hussey, no run fuller length delivery outside the off stump, David, drives it to cover"
491,"Vettori to Hussey, 2 runs fuller on the middle and leg. David, turns it to the right of fine-leg for a couple"
492,"O'Brien to Hussey, no run outside the off stump, Michael, comes forward and defends"
493,"O'Brien to Hussey, 1 run on the leg stump, Michael turns it away to fine-leg for a single"
494,"O'Brien to Hussey, no run good length delivery outside the off stump, David swings and misses"
495,"O'Brien to Hussey, no run outside the off stump, David comes forward and drives it to cover"
496,"O'Brien to Hussey, no run outside the off stump and short in length. David lets it go to the keeper"
497,"O'Brien to Hussey, no run short outside the off stump, David cuts it to point, who does well to stop it"
498,"Elliott to Hussey, 1 run good length delivery drifting onto the pads. Michael pushes it to mid-on and runs across for a single"
499,"Elliott to Hussey, 1 run on the leg stump and short in length. David, pulls it to deep midwicket for a single"
500,"Elliott to Hussey, 1 run outside the off stump. Michael, pushes it wide of the point fielder for a single"
501,"Elliott to Hussey, no run short on the off stump. David comes forward and defends it back onto the pitch"
502,"Elliott to Hussey, no run defends on the frontfoot yet again"
503,"Elliott to Hussey, 2 runs fuller on the middle stump. David turns it to the left of fine-leg and is quick enough to come back for a couple"
504,"O'Brien to Hussey, 1 run short outside the off stump. Michael allows the ball to come onto the bat as he runs it down to third man for a single"
505,"O'Brien to Hussey, no run short and 136 kmph. David comfortably ducks under it"
506,"O'Brien to Hussey, 1 run short outside the off stump. David, cuts it to deep point for a single"
507,"O'Brien to Hussey, FOUR runs short outside the off stump. Invitation enough for Michael to rock back and pull it away past a sloppy mid-on fielder for a boundary"
508,"O'Brien to Hussey, 1 run fuller on the leg stump, Michael turns it to fine-leg for a single"
509,"O'Brien to Hussey, no run full outside the off stump. David drives it straight to the cover fielder"
510,"Elliott to Hussey, 1 run good length delivery outside the off stump and the left-handed Hussey punches it down to long-off for an easy single"
511,"Elliott to Hussey, no run punched away by the right handed Hussey to the mid-off region, no room for a single there"
512,"Elliott to Hussey, 1 run slower delivery on the middle and leg stump line, D Hussey leans forward and plays it down to long-off for a single"
513,"Elliott to Hussey, 1 run short and that's pulled away to deep backward square leg for a single"
514,"Elliott to Hussey, 1 run lofted down to long-on, 98 off 97 now."
515,"Elliott to Hussey, 2 runs bowled from round the stumps and angled into the left-hander. Hussey stays back and clips it down to fine leg for a brace. No problems with running between the wickets there, poetic"
516,"Mills to Hussey, no run good length delivery outside the off stump, hint of away movement ? could be just me. David Hussey leaves it through to the keeper"
517,"Mills to Hussey, no run fuller length delivery and that's played down to mid-on"
518,"Mills to Hussey, no run good length delivery, not much width and the ball was angled into the right-hander. Hussey gets behind the line and drives it down to mid-off but fails to get it past the fielder there"
519,"Mills to Hussey, no run nice little leg cutter and Hussey finds the man at cover. That is four dot balls in a row"
520,"Mills to Hussey, no run make that five, another line and length delivery - no width offered and David drives it straight back to the bowler"
521,"Mills to Hussey, no run maiden! short and wide outside the off stump and David cuts it straight to the fielder at point. End of an excellent over"
522,"Vettori to Hussey, 1 run worked away with the spin to the square leg region"
523,"Vettori to Hussey, 2 runs punched off the back-foot to deep point and that brings up the 50 partnership"
524,"Vettori to Hussey, no run full and on the pads, Hussey finds the man at mid-on"
525,"Vettori to Hussey, 1 run driven wide of the cover fielder"
526,"Vettori to Hussey, no run quicker delivery outside the off stump and that is left through to the keeper"
527,"Vettori to Hussey, 1 run pulled away to deep midwicket, easy single to end the over"
528,"Mills to Hussey, FOUR runs good length delivery outside the off stump, Mike Hussey leans forward and slices it past the diving fielder at backward point. Excellent timing and the placement was spot on"
529,"Mills to Hussey, no run worked away in front of point"
530,"Mills to Hussey, 2 runs width offered outside the off stump and that's driven to deep cover for a single. Fielder in the deep moved across quickly and cut off the second run"
531,"Mills to Hussey, 1 run driven of the back-foot to the point region, bit of a misfield and they scamper through for a single"
532,"Mills to Hussey, 1 run worked away wide of the man at midwicket and yet another easy single is added to the total. That's the way to go - keep it simple for now and wait for the PowerPlay"
533,"Mills to Hussey, no run played to mid-on"
534,"Vettori to Hussey, no run tosses it up a little more and David works it, just falling short of the fielder at midwicket"
535,"Vettori to Hussey, 1 run outside the off stump, David comes forward and drives it to mid-off for a single"
536,"Vettori to Hussey, no run comes forward and drives it to cover"
537,"Vettori to Hussey, 1 run short outside the off stump, Michael drives it to sweeper cover for a single"
538,"Vettori to Hussey, no run outside the off stump, David comes forward and defends it"
539,"Vettori to Hussey, FOUR runs David goes inside out as he lofts it over extra-cover for a boundary and he also gets to his half-century with that shot"
540,"Elliott to Hussey, 1 run good length delivery outside the off stump. Michael turns it away to midwicket and runs across for a single"
541,"Elliott to Hussey, no run good length delivery on the off stump. David tries to emulate what Michael did but can't beat the fielder at mid-on"
542,"Elliott to Hussey, 3 runs good length delivery on the middle stump. David whips it to fine-leg for three runs"
543,"Elliott to Hussey, no run short on the middle stump. Michael, ducks under it"
544,"Elliott to Hussey, FOUR runs short outside the off stump. Michael, pulls it to deep midwicket where Cumming is probably unsighted and drops the catch. To add to the pain he concedes a boundary"
545,"Elliott to Hussey, 3 wide wide outside the off stump and McCullum fumbles with it,conceding three byes"
546,"Elliott to Hussey, 1 run pushes it to deep point for a single"
547,"Vettori to Hussey, 1 run fuller on the off stump, Michael pushes it to deep square leg for a single"
548,"Vettori to Hussey, no run outside the off stump, David comes forward and defends"
549,"Vettori to Hussey, 2 runs fuller on the middle stump. David turns it away to fine-leg for a couple"
550,"Vettori to Hussey, no run outside the off stump. David, looks to turn it away but gets an inside edge back onto the pitch"
551,"Vettori to Hussey, 1 run outside the off stump, drives it to long off for a single"
552,"Vettori to Hussey, 1 run fuller on the leg stump, Michael, drives it to long-on for a single"
553,"Elliott to Hussey, 1 run short outside the off stump. Michael pulls it with a flat bat to deep midwicket for a single"
554,"Elliott to Hussey, 1 run good length delivery outside the off stump. David, runs it down to third man for a single"
555,"Elliott to Hussey, no run fuller on the middle stump. Michael, drives it straight to mid-on fielder"
556,"Elliott to Hussey, no run on the leg stump, Michael pushes it to mid-on again"
557,"Elliott to Hussey, 1 run fuller outside the off stump. Michael, comes forward and drives it to long-off for a single"
558,"Elliott to Hussey, 2 runs on the leg stump. David turns it to the right of fine-leg for a couple"
559,"Southee to Hussey, 2 runs fuller outside the off stump. Michael drives it to deep extra cover for a couple. What's more he gets to his half-century with that shot"
560,"Southee to Hussey, 1 run fuller outside the off stump, Michael drives it to extra cover for a single"
561,"Southee to Hussey, 1 run fuller length delivery on the off stump. David drives it to long-on for a single"
562,"Southee to Hussey, no run outside the off stump, comes forward and defends"
563,"Southee to Hussey, no run outside the off stump. Michael, looks to cut it away but is beaten"
564,"Southee to Hussey, no run fuller length delivery outside the off stump. Michael, drives it to cover"
565,"O'Brien to Hussey, FOUR runs full outside the off stump. David opens the face of the bat at the last moment to run it down to third man for a boundary"
566,"O'Brien to Hussey, no run outside the off stump and fuller in length. David, drives it to mid-off"
567,"O'Brien to Hussey, FOUR runs fuller in length outside the off stump. David chips it over mid-off for a boundary and now they are getting a tab on the proceedings"
568,"O'Brien to Hussey, no run"
569,"O'Brien to Hussey, 3 runs fuller outside the off stump. David chips it over the infield on the off-side field for three runs"
570,"O'Brien to Hussey, 2 runs fuller on the leg stump. Michael, turns it to fine-leg and comes back for a well-run couple"
571,"Southee to Hussey, FOUR runs fuller outside the off stump. David moves away and smashes it past the extra cover fielder for a boundary"
572,"Southee to Hussey, 1 run fuller on the leg stump. David drives it to mid-on and sets off for a quick single"
573,"Southee to Hussey, 1 run Michael comes down the track in a pre-meditated mode.Southee, bangs it short and he pulls it away to midwicket for a single"
574,"Southee to Hussey, no run"
575,"Southee to Hussey, 1 run fuller on the leg stump. Right-handed Hussey pushes it to mid-on for a single"
576,"Southee to Hussey, 1 run outside the off stump. Hussey comes onto the frontfoot and drives it to long-off for a single"
577,"O'Brien to Hussey, 1 run fuller outside the off stump. Michael drives it to deep extra cover for a single"
578,"O'Brien to Ferguson, 1 run outside the off stump. Ferguson drives it to sweeper cover for a single and gets off the mark"
579,"O'Brien to Hussey, 1 run full-toss on the off stump. Hussey drives it to long-off for a single"
580,"O'Brien to Ferguson, 1 run good length delivery outside the off stump. Ferguson pushes it to cover and sets off for a quick single. Umpire Davis wants to refer the decision to third umpire even though Ferguson is well in"
581,"O'Brien to Hussey, 1 run short delivery on the leg stump. Hussey, pushes it to the leg side and runs across for a quick single"
582,"Southee to Hussey, 1 run outside the off stump. Hussey, drives it to extra cover for a single"
583,"Southee to Ferguson, no run good length delivery outside the off stump. Ferguson looks to cut it away but is beaten by the cut"
584,"Southee to Ferguson, 1 run short outside the off stump. Ferguson gets the cut shot right and gets a single"
585,"Southee to Hussey, 3 runs full-toss on the leg stump. Hussey turns it away to fine-leg for three runs"
586,"Southee to Ferguson, 1 run short outside the off stump. Ferguson cuts it to sweeper cover for a single"
587,"Southee to Hussey, 1 run fuller on the leg stump. Hussey pushes it to Vettori at mid-on and sets off for a quick single. It was made possible by the fact that Vettori fumbled"
588,"Elliott to Hussey, 2 runs full-toss on the off stump. Hussey, pushes it to the left of long-on fielder and runs across for a couple"
589,"Elliott to Hussey, 1 run on the middle stump. Hussey, pushes it to deep midwicket for a single"
590,"Elliott to Ferguson, no run outside the off stump. Ferguson is hit on the back leg and that would have gone onto hit the stumps. Umpire Davis does not want to give it"
591,"Elliott to Ferguson, 1 run fuller on the off stump. Ferguson, pushes it to midwicket for a single"
592,"Elliott to Hussey, 1 run fuller outside the off stump. Hussey, drives it to mid-off for a single"
593,"Elliott to Ferguson, FOUR runs fuller outside the off stump. Ferguson, drives it past the diving mid-off fielder for a boundary. No justice left in the world as Ferguson was plumb in front three deliveries back"
594,"Southee to Hussey, no run outside off, Hussey comes forward and defends"
595,"Southee to Hussey, no run fuller on the leg stump. Hussey, pushes it to midwicket"
596,"Southee to Hussey, 1 run fuller outside the off stump. Hussey, drives it to mid-off for a single"
597,"Southee to Ferguson, no run short outside the off stump. Ferguson looks to pull it away but gets a leading edge to mid-off"
598,"Southee to Ferguson, no run full outside the off stump. Ferguson's bat hits the ground and the fielders go up in appeal but these can't be given"
599,"Southee to Ferguson, FOUR runs fuller on the middle stump. Ferguson, elegantly flicks it to deep midwicket for a boundary"
600,"Mills to Hussey, no run fuller on the off stump. Hussey, drives it to mid-on"
601,"Mills to Hussey, SIX runs full toss on the off stump. Hussey, lofts it high over mid-on and it bounces on the ropes. Thus Hussey finishes the match off in style"
602,"Join us on Friday for the decider in Brisbane. Till then, good night from all of us at Cricinfo"
603,David Hussey is the Man of the match and he admits he was nervous after the Haddin dismissal. He is thankful that his brother calmed the nerves and allowed him a free hand.
604,Ponting is happy that his bowlers did a good job in restricting the Kiwi batsmen bar the batting Powerplay and is pretty appreciative of Michael Hussey and Michael Clarke.
605,Michael Hussey compliments Ferguson for his coolness under pressure and also compliments his brother on his good knock.
606,"After the dismissal of Haddin, it seemed that the Kiwis had the upper hand but the partnership between the Hussey brothers dashed all the hopes of a victory and it will be all down to the final match in Brisbane on Friday. Hold on for a few minutes for the presentation"
607,Hussey brothers make sure that the series goes to Brisbane with everything to play for. They were helped in good part by Haddin too
608,Australia won by 6 wickets (with 10 balls remaining)
609,"Player of the match is David Hussey, AUS"
