,Data
411,"Hopes to Botha, no run Hopes keeps it on a length, pegs away at offstump, driven back to the bowler"
412,"Hopes to Botha, 1 wide bouncer down the leg side, Botha goes for the pull but misses"
413,"Hopes to Botha, 1 run full and wide, mistimed towards extra cover by Botha, the batsmen steal a quick single"
414,"Hopes to Morkel, no run goes for the pull but mishits it towards point"
415,"Hopes to Morkel, 1 run pushed off the front foot towards cover for a single"
416,"Hauritz to Morkel, no run tossed up on a length and thats driven back toward Hauritz"
417,"Hauritz to Morkel, FOUR runs there's a positive stroke, he picks the wide delivery and drives superbly into the gap in the covers and the sweeper cannot cut it off"
418,"Hauritz to Morkel, no run tossed up, gets some dip, pushed off the front foot to cover"
419,"Hauritz to Morkel, 1 run short ball, he gets back and cuts it out to the sweeper"
420,"Hauritz to Botha, 1 run pitches on the stumps, tucked away towards the fielder"
421,"Hauritz to Morkel, no run flighted just outside off stump and he defends it to point"
422,"Johnson to Botha, no run pitched up outside off stump, no shot offered by Botha"
423,"Johnson to Botha, OUT ripping short delivery gets Botha! Johnson steams in and bangs in a brute of a short one that fairly kicks up off the track and though an airborne Botha rears his head out of harm's way he cannot drop the hands in time and the ball kisses his glov"
424,"Johnson to Morkel, no run very full outside off stump, Morne drives and misses"
425,"Johnson to Morkel, 1 run pitches outside leg stump and he flicks it past square leg"
426,"Johnson to Morkel, 1 run pitches on a tight line and he dabs it away for one"
427,"Johnson to Morkel, no run slided down leg stump, brushes the pads to Haddin"
428,"Hauritz to Morkel, no run slow delivery, drifts down leg stump, watchfully patted back"
429,"Hauritz to Morkel, no run wide of off stump and turning away, no shot offered"
430,"Hauritz to Morkel, no run quicker one on the stumps and he pushes it to the off side"
431,"Hauritz to Morkel, no run flights it on a length, off stump or thereabouts, and Albie defends"
432,"Hauritz to Morkel, 1 run fuller, flatter, and clipped out to the man at deep midwicket"
433,"Hauritz to Morkel, no run pitches outside off stump, he goes back and dabs it past point"
434,"Johnson to Morkel, no run back of a length and outside off, Albie swings and he misses"
435,"Johnson to Morkel, 1 run much closer to the stumps, Albie dabs it towards point for a single"
436,"Johnson to Morkel, no run slips in the bouncer, very short, goes past shoulder high for the 6'6"" Morne"
437,"Johnson to Morkel, no run a bit fuller this time, and it's Morne turn to swing and miss"
438,"Johnson to Morkel, no run slower ball this time, 128kmph, on a length and heading for offstump, Morne defends cautiously"
439,"Johnson to Morkel, no run back to usual speed, 144.1kmph, Morne tries to clip it off his legs, misses and is hit on the pads"
440,"Hauritz to Morkel, 1 run Albie stays on the backfoot and deftly places it wide of the slip for a single"
441,"Hauritz to Morkel, 1 run too short from Hauritz, Morne rocks back and hits it to mid-on"
442,"Hauritz to Morkel, no run defended back down the pitch by Albie off the backfoot"
443,"Hauritz to Morkel, FOUR runs very short from Hauritz, Albie capitalises, swings it hard over wide mid-on for a boundary"
444,"Hauritz to Steyn, 1 run a wristy shot takes an outside off ball towards midwicket"
445,"Laughlin to Steyn, OUT starts off yet another of his overs with a slower ball, full ball and pretty wide, Steyn was onto his shot early, checks and can only spoon it to Michael Hussey at short cover, that's Laughlin's first wicket in ODIs"
446,"Laughlin to Ntini, no run short ball, well outside off, Ntini leaves that one alone"
447,"Laughlin to Ntini, no run another slower ball, fuller this time, Ntini defends off the front foot"
448,"Laughlin to Ntini, no run back of a length, offstump line, another exhibition of Makhaya Ntini's front-foot defence"
449,"Laughlin to Ntini, no run Laughlin fires in the bouncer, Ntini manages to get out of the way"
450,"Laughlin to Ntini, 2 runs fullsih ball just outside off, Ntini carves it through covers for a couple"
451,"Hauritz to Morkel, OUT this match is over, Australia have walloped South Africa by 141 runs, another flighted delivery from Hauritz, very full, Morne tries to slam it over mid-on, doesn't quite get hold of it, it goes high and gives Laughlin at mid-on a catch , Hauritz"
452,"This is Siddarth Ravindran signing off, thanks to everyone for your mails. See you on Sunday."
453,So the trend of the results following the same pattern as in the series in Australia continues. Join us to see whether it extends to Sunday's game in Centurion as well.
454,Both captains say the timing of the Powerplays is proving to be a bit of a headache.
455,"Ponting also says the wickets was slower than he expected, and is full of praise for Hauritz."
456,"Australia had also struggled initially when they batted but they managed to string together a bunch of partnerships, something South Africa were unable to do. Australia bowled well but a number of South African wickets were soft dismissals In hindsight, Boucher at No. 6 seems"
457,"South Africa have received an absolute hiding here, the introduction of Nathan Hauritz completely transformed the game. None of the batsmen were really comfortable against him, who was unafraid to toss the ball up and got the rewards. James Hopes also did a sterling support j"
458,Australia won by 141 runs
459,"Player of the match is Michael Hussey, AUS"
