,Data
502,"Lakmal to Siddle, no run edged and dropped short of third slip, Siddle hung his bat out, outside edge goes low to Dilshan"
503,"Lakmal to Siddle, no run good length delivery shapes away from him"
504,"Lakmal to Siddle, no run fullish in length outside off and he comes across and leaves it alone to the keeper"
505,"Dilshan to Wade, no run spins away sharply, he lunges forward and across and the ball beats him"
506,"Dilshan to Wade, 1 run short outside off and he cuts to sweeper cover"
507,"Dilshan to Siddle, 1 run slower through the air and he dabs it to the off side"
508,"Dilshan to Wade, no run tossed up and fuller, he plonks forward and defends"
509,"Dilshan to Wade, no run tossed up and he comes forward and defends"
510,"Dilshan to Wade, no run and Wade stays on the back foot and negotiates it safely and it's stumps"
511,"Lakmal to Siddle, no run Eranga lands it on a fullish length on the off stump and he defends"
512,"Lakmal to Siddle, FOUR runs a boundary straightaway! Half volley on the off stump and he pushes it away down the track and timed it well enough, beats the fielder who chases and dives at the straight boundary"
513,"Lakmal to Siddle, no run this one comes back in and hits his pads, rolls to the on side"
514,"Lakmal to Siddle, no run keeps it outside the off stump and he leaves it alone"
515,"Lakmal to Siddle, no run length delivery and he stays back and defends"
516,"Lakmal to Siddle, no run fullish in length outside off and he comes across and leaves it alone"
517,"Herath to Wade, no run confusion in the calling, he pushed it towards point and Siddle set off for some reason, there was no run, had to hurry back"
518,"Herath to Wade, 1 run tossed up on middle and he knocks it to the on side"
519,"Herath to Siddle, no run tossed up and slower, he comes forward and knocks it to the off side"
520,"Herath to Siddle, no run tossed up and he comes forward and defends"
521,"Herath to Siddle, 1 run stabs at it and he takes a single to the off side"
522,"Herath to Wade, 2 runs Wade slogs and it's in the air and well we're not sure if Samaraweera dropped it at deep midwicket, he dived, Wade gets his fifty. It didn't carry to the fielder"
523,"Lakmal to Siddle, no run"
524,"Lakmal to Siddle, FOUR runs lovely shot, this was shotish outside off and wide enough for him to cut, sliced him wide of backward point"
525,"Lakmal to Siddle, 5 runs overthrows! He knocked it to the on side and set off, it was a quick single and the throw from mid-on to the bowler's stumps was wide and nobody to back up, four bonus runs"
526,"Lakmal to Wade, 1 run on the pads and he knocks it down to fine leg"
527,"Lakmal to Siddle, no run angles it across and full and Siddle doesn't offer a shot"
528,"Lakmal to Siddle, no run lands outside leg, skids and hits his pads, half hearted appeal"
529,"Herath to Wade, no run stays back at the crease and defends"
530,"Herath to Wade, 2 runs he paddles this one, low full toss and down to fine leg"
531,"Herath to Wade, no run spins and hits the pads but that was missing leg"
532,"Herath to Wade, 2 runs direct hit!. Drops it to the off side and sets off for a quick single, the fielder had one stump to aim at and Siddle was just in, they take an extra run off the deflection"
533,"Herath to Wade, no run he pushes it down to cover"
534,"Herath to Wade, no run tossed up and he comes forward and defends"
535,"Lakmal to Siddle, no run fullish in length outside the off stump and he leaves it alone"
536,"Lakmal to Siddle, no run keeps it fuller outside the off stump and he comes forward and defends"
537,"Lakmal to Siddle, 1 run pushes it down to backward point and takes a single"
538,"Lakmal to Wade, 2 runs punches it just wide of cover and sets off quickly, puts pressure on the fielder in the deep by taking the second"
539,"Lakmal to Wade, no run stays tall and he defends to the off side"
540,"Lakmal to Wade, FOUR runs lovely shot! This was on a good length and angled across and he stays beside the line and times the punch beautifully past point"
541,"Herath to Siddle, no run fuller delivery and he comes forward and defends"
542,"Herath to Siddle, no run goes for the slog and misses! Just past the off stump"
543,"Herath to Siddle, no run tossed up and he gets forward and defends"
544,"Herath to Siddle, no run quicker delivery and he plonks forward and defends"
545,"Herath to Siddle, 1 run quicker one on the pads and he tries to slog, mistimes it to the on side"
546,"Herath to Wade, 1 run makes room and cuts him towards point"
547,"Pradeep to Wade, 1 run punches it down towards point and takes a single"
548,"Pradeep to Siddle, no run good length outside off and he pushes it to the off side"
549,"Pradeep to Siddle, no run this was fuller and Siddle gets forward and pushes it on the walk down to mid-off"
550,"Pradeep to Siddle, no run moves away from him and he punches it towards mid-off"
551,"Pradeep to Siddle, no run he strays down the leg side and he tries to flick it away"
552,"Pradeep to Siddle, no run there's an appeal for a caught behind down the leg side and he's been given not out and SL are reviewing it. Siddle tried to flick it to fine leg and there was a sound but replays show that it flicked the pad. SL have used up their reviews. It wasn't a very confident shout really, even Siddle shook his head after"
553,"Herath to Wade, no run tossed up and he comes forward and defends"
554,"Herath to Wade, no run appeal for an lbw! Tossed up from round the wicket, Wade tries to sweep, lands on middle and off and doesn't turn, the ball tracker shows it would have shaved off stump, no more reviews for SL"
555,"Herath to Wade, 1 run stays back and he cuts him wide of point"
556,"Herath to Siddle, 1 run clips it to midwicket and he sets off, Wade has to hurry, he times his dive well"
557,"Herath to Wade, no run tossed up and he comes forward and defends"
558,"Herath to Wade, no run spins it back in and he gets an inside edge"
559,"Pradeep to Siddle, no run"
560,"Pradeep to Siddle, no run 137.6 kph, this was fuller outside off and he drives stylishly but straight to cover"
561,"Pradeep to Siddle, 1 run 138.1 kph, fuller on off and middle and he tucks it straight to mid-on, this pitch seems to have flattened out"
562,"Pradeep to Wade, no run this one took off! Pradeep got a few to beat the bat yesterday and this one landed on the channel outside off and nearly clipped Wade's glove"
563,"Pradeep to Wade, no run fullish angling across the left-hander and he defends to the off side"
564,"Pradeep to Wade, 2 runs drifts on the pads and he tucks it away down to square leg"
565,"Herath to Siddle, 1 run comes forward and drops it towards cover and sets off, the throw to the keeper was a bit wide"
566,"Herath to Wade, no run flatter delivery and he plonks forward and defends"
567,"Herath to Wade, 1 run flatter delivery outside off and he pushes it wide of point"
568,"Herath to Siddle, no run flatter and skids through and it beats him"
569,"Herath to Siddle, 3 runs edged and drops short of Mahela at slip! Tossed up and Siddle was tentative on the prod, looked like it fell to Mahela's left"
570,"Herath to Wade, no run tossed up and he comes forward and defends"
571,"Pradeep to Siddle, no run keeps it on a good length outside off and it comes back in and he leaves it alone"
572,"Pradeep to Siddle, no run smashed off the front foot but straight to Samaraweera at short cover, on the first bounce, a few got a bit excited"
573,"Pradeep to Siddle, no run lands it outside off and he safely leaves it alone"
574,"Pradeep to Siddle, no run fullish in length outside off and he drives him down to mid-off"
575,"Pradeep to Starc, no run fullish in length on middle and off and neatly punched down to mid-on"
576,"Herath to Wade, 1 run fullish on the pads and flicked to midwicket"
577,"Herath to Starc, no run comes well forward and pushes it back to the bowler"
578,"Herath to Starc, 2 runs first signs of aggression from Starc, slogs him fine to deep midwicket"
579,"Herath to Lyon, no run tossed up and he comes well forward and pushes it to the off side"
580,"Herath to Lyon, no run tossed up and he pushes this down to mid-on"
581,"Pradeep to Wade, 1 run comes well forward and he steers him wide of point"
582,"Pradeep to Lyon, no run strays down the leg side and he tries to flick it and Chandimal tumbles to his left to collect"
583,"Pradeep to Lyon, no run gets forward and defends this to the off side"
584,"Pradeep to Lyon, no run bangs it in short and he bends to evade the bouncer"
585,"Pradeep to Lyon, FOUR runs Lyon picks up his first boundary and it was a neat cover drive, half volley outside off and nicely driven through the gap"
586,"Pradeep to Lyon, no run fires that on the stumps and he comes forward and defends and it's drinks"
587,"Herath to Wade, no run tossed up and he comes forward and clips it towards midwicket"
588,"Herath to Wade, 1 run continues round the wicket to the left-hander, comes forward and steers it to the off side"
589,"Herath to Lyon, no run slides down leg and clips his pads, appeal from the bowler"
590,"Herath to Lyon, no run that was chipped in the air and it dropped well short of mid-on"
591,"Herath to Bird, no run drifts it inwards and he gets a thick inside edge to the pads"
592,"Pradeep to Wade, no run fires that full outside off and he drives to sweeper cover, Wade farms the strike"
593,"Pradeep to Bird, 1 leg bye swings it on the pads and he clips it off his legs just wide of short leg, not off the mark yet"
594,"Pradeep to Wade, FOUR runs shot! Three men in the deep on the off side and he finds the gap, it was full and he drives it high in the air and down to extra cover"
595,"Pradeep to Wade, no run this one bounces a bit more and Wade tries to cut but he misses"
596,"Pradeep to Wade, FOUR runs the field's up and he pierces the gap! Just uses the pace and angle to glide it past gully"
597,"Herath to Bird, no run tossed up and it clips his pads"
598,"Herath to Bird, no run gets cheers from the crowds as he gets forward and defends"
599,"Herath to Bird, no run fuller delivery and he pushes it to the off side"
600,"Herath to Bird, no run drifts in and he defends solidly again"
601,"Herath to Bird, no run comes forward and dives to the off side"
602,"Herath to Bird, 2 runs and he's off the mark in Tests with a punched drive off the front foot past the covers"
603,"Pradeep to Wade, no run fires that full and wide and he gets forward and spanks it to deep point, no single"
604,"Pradeep to Wade, FOUR runs take that! Field spread on the off side, he leans forward to a full delivery and spanks that on the front foot over extra cover"
605,"Pradeep to Wade, 2 runs places this well, he crashes this one on the front foot and places it wide of long-off, knew straightaway it was two"
606,"Pradeep to Wade, 2 runs swings and gets an inside edge towards fine leg, rushes the first run and completes the second"
607,"Pradeep to Wade, 1 run squirts out a full delivery wide of point and walks the single, over to Bird"
608,"Pradeep to Bird, FOUR runs was thinking of two but he gets four! Swings it in on the pads and he clips it nonchalantly wide of midwicket, timed it really well"
609,"Herath to Wade, no run tossed up and he swings this one to long-on"
610,"Herath to Wade, no run makes room and bashes it down the ground to long-off"
611,"Herath to Wade, 2 runs fires that full and flat, he makes room and carves it down to third man, into the 90s"
612,"Herath to Wade, 1 run slogs and it goes on the first bounce to deep midwicket"
613,"Herath to Bird, no run drifts in and he safely defends it"
614,"Herath to Bird, no run flatter delivery and he comes well forward and defends"
615,"Lakmal to Wade, no run teases him with width and Wade goes for a wild slash and misses"
616,"Lakmal to Wade, FOUR runs almost went all the way! This was full outside off and Wade gives it a thrash off the front foot, just short of the rope at wide long-off, the fielders there don't deter him"
617,"Lakmal to Wade, 2 runs slogs and mistimes it to the on side and he hurries the second run"
618,"Lakmal to Wade, FOUR runs he gets there! First Test ton in Australia for Wade! He's finding the gaps superbly today, it was full and wide outside off, made room and smashed it past the gap at deep cover, he knew soon that it was going for a four and ran across the pitch and stretched out his arms. He was absolutely delighted, a must-watch"
619,"Lakmal to Wade, no run pokes at one outside off and misses"
620,"Lakmal to Wade, 1 run Dropped at fine leg! This was short and he went for the hook and it swirled towards fine leg where the fielder got under it and spilled it"
621,And Australia have declared. Australia have a lead of 138. SL will be disappointed they couldn't roll them over this morning for less. Now they will bat out about 15 minutes till lunch.
622,Innings Start
623,"Australia are out. Nope, no Hussey! Starts off with spin"
