,Data
169,"Khan to Ponting, no run back of a length and across Punter, who stays behind it and defends to the off side."
170,"Khan to Ponting, 1 leg bye hmm, Ponting shuffles right across and nudges a leg stump ball behind square for one. That was heading for the furniture. Australia have a 100."
171,"Khan to Cowan, no run wobbles away from a length outside off stump, and Cowan shoulders arms."
172,"Khan to Cowan, no run fuller length to Cowan now, he leans out and defends to cover."
173,"Khan to Cowan, no run one of those sneaky Zaheer variations. Haven't seen a replay, but it seemed to be a legcutter that straightened from a full length. Cowan dealt with it well as he defended off the front foot to the off side."
174,"Khan to Cowan, 1 run and well run now. Zaheer probes away on a full length, and Cowan turns it to midwicket for a single."
175,"Yadav to Cowan, no run full length from over the stumps, Cowan pushes it down the track off the front foot."
176,"Yadav to Cowan, FOUR runs he's opening up now! And just as well, after doing the hard work before lunch. Short of a length outside off, not much width at all, and Cowan once again manages to impart power on a hack close to the body. Very Hussey-esque and gets him four behind point."
177,"Yadav to Cowan, no run short of a length on the stumps, Cowan squares up well and defends."
178,"Yadav to Cowan, no run pitched up well outside off, Cowan lets it go to the keeper."
179,"Yadav to Cowan, 2 runs that potion is sure helping. Cowan plants another full ball into the covers. For a habitual leaver, he doesn't necessarily get close to the pitch of the ball when he drives, but he knows what lengths to go after."
180,"Yadav to Cowan, no run through him with a quick yorker! Cowan blinks away in befuddlement after missing the line completely. The ball missed his inner edge and his stumps. if only Yadav had got that on line with the stumps ..."
181,"Khan to Ponting, no run pitched well up to Ponting from over the stumps, defended off the front foot."
182,"Khan to Ponting, no run that kept low, much too low for the pull. Did Ponting just misread the length? Wasn't very short and sneaked in under the bat to hit the thigh and head towards the slips."
183,"Khan to Ponting, no run punchy from Ponting, gets forward and middles it off the full face into the covers."
184,"Khan to Ponting, no run angled across wide of off stump, Ponting hops and skips before shouldering arms."
185,"Khan to Ponting, no run similar ball, Ponting gets across and leaves assuredly."
186,"Khan to Ponting, 1 run he's decided to pull everything today. Another one guided well to deep square leg for one."
187,"Yadav to Ponting, no run sheer pace. Full and fast on the stumps and Ponting is late coming down on it. He gets it away to the off side."
188,"Yadav to Ponting, no run full again, draws Ponting forward into a lunging push into the off side."
189,"Yadav to Ponting, 3 runs the moment it is half short, Ponting pounces on it. This wagonwheel will make for interesting reading. Through midwicket now for a triad."
190,"Yadav to Cowan, 1 run good ball, catches Cowan in-between forward and back. He inner edges onto his boot and takes a single."
191,"Yadav to Ponting, no run angled in at pace, Ponting shuffles into line and defends to the leg side."
192,"Yadav to Ponting, FOUR runs whipped in the air but safely away. Ponting's always tended to fall over while playing the flick and this ball was angling in particularly sharply. He played it in the air, to the left of the diving man at midwicket and the ball rocketed along to the fence."
193,"Khan to Cowan, no run full length stuff outside Cowan's off stump, he leans across and leaves."
194,"Khan to Cowan, no run Zaheer wobbles one away from a length, and Cowan lets it go again."
195,"Khan to Cowan, no run three in three outside off, and another leave."
196,"Khan to Cowan, no run back of a length outside off, Cowan holds the bat away from harm's way."
197,"Khan to Cowan, no run that snapped back in from a length, Cowan shoulders arms as it came in."
198,"Khan to Cowan, 1 run on the middle and leg line to end the over, Cowan tucks it around to square leg for a single. Zaheer's been average after that first spell."
199,"Ashwin to Cowan, no run curls in from round the stumps and straightens to cramp Cowan even as he looks to cut. Dangerous choice of stroke to one that's not spinning much."
200,"Ashwin to Cowan, no run fuller, Cowan leans out and defends off the front foot."
201,"Ashwin to Cowan, no run draws him out of the crease with flight, and beats him in the trajectory. Cowan is forced to drive from away from the body towards mid-off."
202,"Ashwin to Cowan, no run stays back in the crease and defends watchfully as Ashwin gets some rip."
203,"Ashwin to Cowan, no run another forcing cut to a short ball on middle and off. Ashwin sends it down without much tweak, and Cowan can't resist that shot."
204,"Ashwin to Cowan, no run tossed up dolly outside off to end the over, Cowan lets it go as it spins big, but it was too far outside off. Interesting, very interesting over from Ashwin."
205,"Khan to Ponting, 2 runs Zaheer slants one across to Ponting, who leans into it like a well-oiled machine and slides it off the face through point."
206,"Khan to Ponting, no run too wide of off stump to start off, Ponting isn't bothered."
207,"Khan to Ponting, no run that seamed away from a length, Ponting lets it go."
208,"Khan to Ponting, no run full ball on off stump, Ponting leans forward to defend."
209,"Khan to Ponting, no run Ponting gets nicely across and defends to the leg side of the pitch."
210,"Khan to Ponting, 2 leg byes slow loopy bouncer, too slow for Ponting to time the pull and he gets it away off the pad for freebies."
211,"Ashwin to Cowan, 2 runs Cowan works Ashwin with the angle to the leg side for a couple."
212,"Ashwin to Cowan, no run that spins away from a length and is defended."
213,"Ashwin to Cowan, no run quicker through the air, Cowan isn't quite sure where that went, but keeps it away."
214,"Ashwin to Cowan, no run"
215,"Ashwin to Cowan, 3 runs too short. Inconsistent from Ashwin. Cowan hacks him through point for three."
216,"Ashwin to Ponting, 1 run short again to Ponting now and he pulls it square for a single."
217,"Sharma to Ponting, no run starts with a short and wide ball outside off. Ponting stays out of the way."
218,"Sharma to Ponting, FOUR runs hops and steer! Ponting rises onto the toes to get atop a short ball and waves it away with the assuredness of a symphony conductor. The ball dances away his tunes, through the cover-point area this time."
219,"Sharma to Ponting, 1 run that jagged in, Ponting left himself prone after lunging across exaggeratedly, and ended up poking it off the pad to the leg side for one."
220,"Sharma to Cowan, 1 run nipped into Cowan's pads, he nudges it square for a single."
221,"Sharma to Ponting, no run good length ball on off stump, Ponting leans out and defends solidly."
222,"Sharma to Ponting, 1 run attacks the stumps from wide of the stumps, Ponting tucks it behind square to move to 49. Ominous for the visitors, this! Ponting relishes them when he's in form, and he's getting there slowly."
223,"Ashwin to Ponting, no run floater from Ashwin, Ponting stays behind it and defends."
224,"Ashwin to Ponting, 3 runs fifty for Ponting, doesn't come in the most graceful fashion, but it will do. Tossed up on the stumps, he tries to lever it over midwicket and miscues it to send it squarer than he'd have wanted. But he gets three and gets a standing ovation. Well played!"
225,"Ashwin to Cowan, no run spins away from middle and off, Cowan defends to the off side with the turn."
226,"Ashwin to Cowan, no run fuller ball, Cowan props the front foot forward and defends."
227,"Ashwin to Cowan, no run tossed up on the stumps, Cowan defends."
228,"Ashwin to Cowan, 1 run too short and too wide. A case of Harbahajanitis for Ashwin here - utter inconsistency of lines and lengths. Cowan hacks it in front of square for a single."
229,"Sharma to Cowan, no run pitched up outside off, defended solidly off the front foot."
230,"Sharma to Cowan, no run back of a length outside off, not enough in it to suck Cowan into a false stroke."
231,"Sharma to Cowan, 1 run back of a length and angled into the pads, Cowan works it behind square nicely for a single."
232,"Sharma to Ponting, no run hits the pads as he shoulders arms! Big appeal, but surely wasn't doing enough to hit the stumps. Landed well outside off and jagged in, Ponting hopped outside the line and was struck outside off, but that doesn't matter since he wasn't playing a shot. The ball was missing the"
233,"Sharma to Ponting, no run that straightened from a length, Ponting adjusted and defended to the off side from the crease."
234,"Sharma to Ponting, no run fuller to end the over, Australia well on top now. Ponting defends off the front foot."
235,"Ashwin to Cowan, no run Ashwin slips down Cowan's leg side now."
236,"Ashwin to Cowan, no run well bowled, spin away from middle and leg after drawing Cowan forward. Outside edge runs away through point."
237,"Ashwin to Cowan, 1 run fired in on the pads, Cowan turns it with the angle past Gambhir at backward square leg."
238,"Ashwin to Ponting, no run turning in from short of a length, Ponting defends."
239,"Ashwin to Ponting, no run tossed up over the eye line and it dips on Ponting, who defends without a worry."
240,"Ashwin to Ponting, no run that one held its line and bounced extra. One of Ashwin's tricks. Ponting was taken by surprise after shaping to play with the turn."
241,"Sharma to Cowan, no run pitched up to Cowan, who unfurls the high elbow as he cover-drives to cover."
242,"Sharma to Cowan, 1 run short and wide outside off, Cowan forces it away through gully for a single to the deep."
243,"Sharma to Ponting, no run pitched up on the stumps, Ponting punches with the angle to a clumsy Zaheer at mid-on, who does enough to stop a single."
244,"Sharma to Ponting, no run short of a length outside off, Ponting stands tall and cracks it square straight to point."
245,"Sharma to Ponting, no run pitched up on the stumps, Ponting drives it back right out of the screws. Ishant does really well to put the right hand out and stop it."
246,"Sharma to Ponting, 1 run blocks with ultra-soft hands and this time Zaheer has no chance. A single pinched from under India's noses."
247,"Ashwin to Ponting, no run not much turn, Ashwin zips it straight off and length and Ponting defends."
248,"Ashwin to Ponting, 1 run too much turn now, defended with the angle to square leg for one."
249,"Ashwin to Cowan, no run tossed up deliciously on leg and turning away. Cowan leaves, and it spins past off stump."
250,"Ashwin to Cowan, no run The skidder, it held its line after landing on off and middle, even came back in a touch. Cowan didn't know what it was doing. Inside edged onto the boot."
251,"Ashwin to Cowan, 2 runs two good balls, followed by a release ball. Cowan nurdles through square leg for a couple."
252,"Ashwin to Cowan, no run turn and bounce away from the left hander. Cowan was born knowing where his off stump is."
253,"Sharma to Ponting, 1 run full toss on the toes, Ponting flicks to deep square leg. These two have added 100, and how!"
254,"Sharma to Cowan, no run full ball wide of off stump and Cowan leaves,."
255,"Sharma to Cowan, 1 run Cowan's gifted his 50th run on debut! He's played beautifully. Back of a length and a touch of nip away, he dabs it to the vacant off side field and trots across."
256,"Sharma to Ponting, no run edged, short of point. Ponting nearly nailed by a monster legcutter. It landed back of a length and absolutely took off as Ponting pressed forward. It kissed the glove as Ponting pressed forward, jumped on to hit his shoulder and ballooned to point. Gambhir was too far back to"
257,"Sharma to Ponting, 1 run on the pads, Ponting tucks it with the angle for a single."
258,"Sharma to Cowan, no run Cowan presses the front foot outside the line of off stump as he defends. He's hit on the pad but outside the line of off."
259,"Ashwin to Ponting, 2 runs Ashwin's radar is firmly in the Off mode. Another offbreak lands on middle and spins away to allow Ponting a sweep for a couple."
260,"Ashwin to Ponting, no run better, gets it outside off and spins it in. Ponting defends."
261,"Ashwin to Ponting, no run the quicker one that doesn't turn. Ponting covers the line and defends."
262,"Ashwin to Ponting, 1 run tossed up on the stumps, Ponting lunges across and sweeps well to the deep for a single."
263,"Ashwin to Cowan, no run loopy ball outside leg and turns towards off. Cowan defends off the front foot."
264,"Ashwin to Cowan, no run flight to end the over, Cowan dead bats."
265,"Yadav to Pattinson, no run short of a length on off stump, Pattinson defends down the track."
266,"Yadav to Pattinson, 1 run well played. Length ball angled across Pattinson, who drops it to point for one. Over to Lyon."
267,"Yadav to Lyon, FOUR runs Spots a carrom-ball in the previous over, and now flicks a full ball with a flourish. Why is he at No. 11 again? Over-pitched and sprayed down the leg side, Lyon wrists it away superbly for four."
268,"Yadav to Lyon, no run full length ball on off stump, Lyon defends confidently off the front foot."
269,"Yadav to Lyon, no run wide of off stump now, holds its line from a length and Lyon lets it go."
270,"Yadav to Lyon, no run good leave. Umesh plugs away just outside off and Lyon drags the bat inside the line."
271,"Ashwin to Pattinson, no run tossed up and drifting in, Pattinson defends as it drifts in."
272,"Ashwin to Pattinson, no run shorter and big spin away from off stump, Pattinson jabs it away."
273,"Ashwin to Pattinson, no run too short, Pattinson hacks it but finds cover."
274,"Ashwin to Pattinson, no run another short ball, Pattinson works it around towards short leg."
275,"Ashwin to Pattinson, no run fuller this time, gets Pattinson forward and he defends it back to the bowler."
276,"Ashwin to Pattinson, no run well fielded. Pattinson works that back down the track with strong wrists, but Ashwin dives to stop the single and keep him away from the strike."
277,"Sharma to Ponting, 1 run Ponting does the smart thing by getting to the non-striker's end against his nemesis. Back of a length on the stumps, jabbed to the off side, sprint."
278,"Sharma to Cowan, no run slams the bouncer down too short and slipping down the leg side. Cowan ducks under."
279,"Sharma to Cowan, no run leading edge, safe. Not the first time Cowan's closed the face early. Ishant slants it down the leg side, it was there for the flick, but Cowan was too soon into the shot, and popped the ball towards mid-off."
280,"Sharma to Cowan, no run more like it, skips inside the line and tucks a length ball to the leg side."
281,"Sharma to Cowan, no run shortens the length and gets some seam away from Cowan, who adjusts and guides with an angled face to the off side."
282,"Sharma to Cowan, no run Ishant is in the middle of an intense spell here. Ends the over with a zipper than angles in and bends away as if on a charm. Cowan didn't look like he was going to get bat on it, and Dhoni had to move away quickly to pouch it."
283,"Ashwin to Ponting, no run skimmer from Ashwin that skids along, Ponting defends from the crease."
284,"Ashwin to Ponting, no run tossed up and coming in towards off, Ponting lunges and defends."
285,"Ashwin to Ponting, 1 run too many freebies from Ashwin. Another one on the pads, Ponting works it behind square for one."
286,"Ashwin to Cowan, no run length ball, jumps and spins away from Cowan who leaves."
287,"Ashwin to Cowan, no run tossed further up, draws Cowan forward and he defends to the off side."
288,"Ashwin to Cowan, 1 run pitches outside leg again, Cowan easily works it square for a single."
289,"Khan to Lyon, 1 run slow and full on off stump, Lyon scrambles a single to mid-off to relinquish strike."
290,"Khan to Pattinson, no run squares him up with one that jags away politely. Pattinson ends up fending it off the outer half towards gully."
291,"Khan to Pattinson, 1 run gets the single now, opening the face and dabbing to the off side."
292,"Khan to Lyon, no run this one went the other way, Lyon has a smile after failing to lay bat on it. Zaheer is too good for these two at the moment."
293,"Khan to Lyon, no run top over, this. Ends with one that snips in off a length, Lyon was playing for the straighter one and ended up inner edging onto the pads and past the stumps."
294,"Ashwin to Pattinson, FOUR runs tossed up and swung away! Pattinson is making a good impression here, plonks the front foot across and lashes it over the leg side."
295,"Ashwin to Pattinson, 1 run short from Ashwin now, he's dropped a few of them short in this innings. Pattinson whips it into Gambhir at square leg, but he is ok."
296,"Ashwin to Lyon, no run flight yo Lyon, he presses well forward to defend it."
297,"Ashwin to Lyon, 1 run Lyon pulls out the sweep and gets a single through backward square leg."
298,"Ashwin to Pattinson, 1 run tossed up outside off now, Pattinson drives wide of mid-off for a single."
299,"Ashwin to Lyon, OUT Ashwin's bowled Lyon round the legs and Australia are bowled out. Quite a strange dismissal. It was fired in full on off stump, Lyon got drastically across and looked to sweep. He missed, and Ashwin pegged back off stump. All out for 333, triple Nelson ends the innings."
300,"Harbhajan's best figures ever in Australia were 3-101. It took Ashwin one innings to better that, and he wasn't even at his best. Meanwhile, splendid spell from Zaheer. Umesh and Ishant weren't at their best today, though."
301,"Considering they were 214 for 6 at one stage, Australia will be happy with this score. Considering they were 286 for 6 at one stage, India won't be dissatisfied either. An edgy little period ahead of India before lunch, but don't expect that to affect Sehwag's approach."
302,"Right, Gambhir takes guard and Sehwag trots to the non-striker's end. The former's first Test in this country. The last time the latter was here at the G, he pulverised an audacious 195. This should intrigue. Three slips, short leg and a gully. Over the stumps is Pattinson."
303,"Pattinson to Gambhir, no run length ball on off stump, Gambhir, as is his wont, drops to the off side and immediately looks for a single. Not to be had. He is a strange judge of a single."
304,"Pattinson to Gambhir, no run pacy bouncer, but far too short. Gambhir ducks into it."
305,"Pattinson to Gambhir, no run super tentative from Gambhir. Expecting another short ball, his front foot goes nowhere to a full length ball, and he pokes well away from the body. Inside edge runs to the leg side."
306,"Pattinson to Gambhir, no run angled across well wide of off stump, easy leave for Gambhir."
307,"Pattinson to Gambhir, no run similar ball angled across, closer to off stump this time - good pace, but not much movement for Pattinson. Another leave."
308,"Pattinson to Gambhir, no run another good length ball to end the over, Gambhir defends to the off side and takes three steps for the single before returning to his lair."
309,"Hilfenhaus to Sehwag, 2 runs Sehwag says Hello Australia by scooping his first ball over mid-off. Full ball wide of off stump, seaming away, and not really coming on. Sehwag's feet stay where they are, and his arms swish through the line. He hits the ball low on the bat, and does enough to go over mid-o"
310,"Hilfenhaus to Sehwag, 1 run back of a length, on the hips and nudged behind square in more conventional style."
311,"Hilfenhaus to Gambhir, 1 run Gambhir gets that sneaky single away now, dabbing a length ball in front of point and scuttling across before Warner can get there."
312,"Hilfenhaus to Sehwag, no run beaten outside off by Hilfy's stock away seamer. Comes from in front of the stumps, lands on off and goes away, past Sehwag's loose waft."
313,"Hilfenhaus to Sehwag, no run stays on the crease and lets a back of length ball go through to the keeper."
314,"Hilfenhaus to Sehwag, no run goes fishing again with an angled face, as Hilfy seams it away off the straight. Sehwag's beaten twice and goes over the top once in his first over. Vintage Sehwag."
315,"Pattinson to Gambhir, 1 run short ball on the hips and played really well. Gambhir hops and fends fine to beat the man crouching at short leg and they get a single."
316,"Pattinson to Sehwag, no run Sehwag tries to hit Pattinson into the ocean. Full length ball, quite wide of off stump and Sehwag just heaves from where he stands. Play and a miss!"
317,"Pattinson to Sehwag, no run over-pitched on the toes, Sehwag times the on-drive quite well but finds mid-on."
318,"Pattinson to Sehwag, 1 run short of a length, a shot of sanity from Sehwag. He dabs towards cover-point and gets a single."
319,"Pattinson to Gambhir, no run Pattinson nips one into Gambhir from back of a length. Gambhir's feet are still not moving and he inner edges onto the pads."
320,"Pattinson to Gambhir, no run that held its line as it angled across, Gambhir kept the bat out of the way. India have negotiated the passage to Lunch without breach."
321,"Hilfenhaus to Sehwag, no run monster ball! Swung in with the angle and then seamed away crazily, Sehwag knew he wasn't going to cover the line and held the bat inside the line. Good decision."
322,"Hilfenhaus to Sehwag, 1 run he's away after lunch, quietly pushing a length ball on middle to leg to the off side for a single."
323,"Hilfenhaus to Gambhir, no run Hilfy straightens one from a length outside Gambhir's off stump. He leaves."
324,"Hilfenhaus to Gambhir, no run pitched up well wide of off stump, invites the drive. Gambhir's had this tendency to drive loosely since the West Indies series. He goes for this and misses."
325,"Hilfenhaus to Gambhir, no run better, lets the ball go outside off as Hilfy probes away on a length."
326,"Hilfenhaus to Gambhir, no run beaten by a subtle offcutter. Lands on off and cuts away past Gambhir's tentative prod. Good start from Hifenhaus after the break."
327,"Pattinson to Sehwag, no run length ball on off stump, Sehwag opens the face as he hangs on the crease and defends to the off side."
328,"Pattinson to Sehwag, 2 runs yorker tried on the stumps, very full and fast on middle and leg, but Sehwag jams down on it well and gets it away square."
329,"Pattinson to Sehwag, no run beaten outside off. Sehwag goes back and looks to defend to the off side as Pattinson straightens one down the straight. He was playing down the wrong line."
330,"Pattinson to Sehwag, FOUR runs typical Sehwag. Played several of these on-the-up flays the last time he was at the G. Pitched up and going away from well wide of off stump. Sehwag's feet are rooted to where they were and crashes it through the line through the covers."
331,"Pattinson to Sehwag, 1 run in the air, past Hussey at gully. It wasn't an edge. Sehwag intentionally plays the steer in the air, and Hussey flies away to his right to intercept the rocket. He can't hold it though. That's a chance! He is standing much behind the usual gully position. Got both hands to it"
332,"Hilfenhaus to Sehwag, 1 run full length on off stump, Sehwag drives past mid-off for one."
333,"Hilfenhaus to Gambhir, no run full length on off stump, Gambhir leans across to the line and defends to the off side."
334,"Hilfenhaus to Gambhir, no run poor shot from Gambhir, needlessly chases a wide ball though the slips are packed with fielders. Play and a miss."
335,"Hilfenhaus to Gambhir, no run shorter and straighter, Gambhir gets inside the line and tucks it square."
336,"Hilfenhaus to Gambhir, 1 run straightens towards middle and leg, Gambhir nudges round the corner for a single."
337,"Hilfenhaus to Sehwag, (no ball) length ball straightens towards the pads, Sehwag works it to the square leg area. No-ball it is."
338,"Hilfenhaus to Sehwag, 1 run goes too straight this time, Sehwag whips behind square and gets a single to the deep."
339,"Pattinson to Sehwag, no run zippy! 146 kph on a speedy bumper, Sehwag arches back and sways out of the way as it buzzes through at pace just outside off stump."
340,"Pattinson to Sehwag, no run back of a length, Sehwag is on the back foot immediately to defend towards point."
341,"Pattinson to Sehwag, 2 runs whoa, I almost jinxed him there. Full ball on leg stump line, Sehwag looks to work it to the leg side but gets a thick outside edge that lobs up over the midwicket area."
342,"Pattinson to Sehwag, 1 run gets the whip away now, controlled and down to the ground for a single."
343,"Pattinson to Gambhir, no run full ball on off stump, Gambhir defends to the off side."
344,"Pattinson to Gambhir, no run pitched up again, Gambhir plays it back down the pitch."
345,"Hilfenhaus to Sehwag, no run bouncer, Sehwag quickly ducks under it."
346,"Hilfenhaus to Sehwag, 1 run ooh, inside edge. The feet are nowhere. Is Sehwag still disgruntled? That missed the stumps."
347,"Hilfenhaus to Gambhir, no run"
348,"Hilfenhaus to Gambhir, no run fuller length and angling away, Gambhir opens the face and steers square."
349,"Hilfenhaus to Gambhir, OUT heat at one end, the wicket comes at the other. Gambhir once again perishes to an indiscretion outside the off stump. Top bowling from Hilfenhaus, but aided by an average shot too. Short of a length, at least a foot and a half outside off stump to start with. The ball then sea"
350,"Hilfenhaus to Dravid, no run welcomed to the crease by a peach. It was a mirror image of the ball that got Gambhir, but closer to off stump, forcing the batsman to play. Dravid tried to cover the line but it nipped away devilishly to beat the edge."
351,"Pattinson to Sehwag, 1 run well played. Sehwag is beaten by the movement, but softens the grip to ensure it goes down and past the slips. There's a third man in place, so the damage is minimal."
