,Data
443,"Khan to Lee, no run back of a length ball, Lee plays it back to the bowler, Zaheer doesn't manage to pick it up put motions as if he is going to throw down the stumps. Lee has a chuckle about it"
444,"Khan to Lee, 1 run driven firmly to mid-on, the batsmen decide to go for the single, Tendulkar's shies at the stumps but the batsmen weren't in danger of being running out"
445,"Sharma to Lee, no run Ishant bangs it in short, Lee takes his eyes off teh ball and is struck on the back, Ishant glares at him, Lee is unfazed by it"
446,"Sharma to Lee, no run fuller length delivery on the off, Lee pushes it to cover"
447,"Sharma to Lee, no run another bouncer from Ishant, Lee tries to force it to the off but the ball trickles to the bowler, more glares from Ishant"
448,"Sharma to Lee, no run short of a length, just outside off, Lee gets well out of the way of that one"
449,"Sharma to Lee, no run again outside off and Lee isn't interested in that one, he lets it through to the keeper"
450,"Sharma to Lee, 2 runs gets on the back foot nad punches it to sweeper cover for a couple"
451,"Khan to Watson, no run length ball on off, Watson offers the full face of the bat as he defends it towards mid-off"
452,"Khan to Watson, no run wider this time, Watson tries to force it past mid-off but the timing was awry"
453,"Khan to Watson, no run better timing this time from Watson but straight to the fielder at mid-off"
454,"Khan to Watson, no run another good looking drive from Watson, placement wasn't very good again, straight to the fielder at extra cover"
455,"Khan to Watson, 1 run much closer to the body, played with soft hands towards point, single taken"
456,"Khan to Lee, no run back of a length on middle and leg, Lee mistimes it back to the bowler"
457,"Sharma to Watson, 1 run again probing away around the off stump, driven back to Ishant, who can't collect it cleanly and it rolls away towards mid-on"
458,"Sharma to Lee, no run similar delivery from Ishant, Lee punches it hard towards cover off the front foot"
459,"Sharma to Lee, no run shorter this time, on off stump, Lee gets a thick inside edge and the ball trickles away in front of square on the leg side"
460,"Sharma to Lee, no run Ishant brings out the slower delivery, misdirected, well outside off, Lee goes for the drive but doesn't connect"
461,"Sharma to Lee, no run dug in short by Ishant, Lee ducks under that comfortably"
462,"Sharma to Lee, no run slower ball again, 106 kmph, better direction this time, Lee picked it up though and he plays it back to the bowler"
463,"Khan to Watson, 1 run length ball on off, Watson plays it with soft hands towards point, easy single"
464,"Khan to Lee, no run short ball, wide outside off, Lee gets an under-edge and it bounces before going to Dhoni"
465,"Khan to Lee, no run fuller ball on middle and leg this time, Lee blocks it back to the bowler"
466,"Khan to Lee, no run similar delivery, Lee lifts his back foot as he flicks it towards mid-on"
467,"Khan to Lee, no run on middle stump, good length, Lee defends confidently off the front foot"
468,"Khan to Lee, no run bouncer on leg stump, didn't get up as high as Lee expected and he is forced to duck awkwardly, nearly loses his balance there"
469,"Sharma to Watson, 1 run back of a length, Watson plays it to backward point for a single"
470,"Sharma to Lee, FOUR runs great shot from Lee, overpitched on middle and leg and Lee drives it back down the ground and holds the follow through for the photographers"
471,"Sharma to Lee, no run punched to mid-off, straight to the fielder"
472,"Sharma to Lee, no run back of a length, angling in after pitching on middle and off, Lee blocks it towards mid-on"
473,"Sharma to Lee, no run short of length, outside off, swing and a miss from Lee"
474,"Sharma to Lee, no run very short, just outside off, 120kmph, Lee wanted to smash that one through the off but gets a bottom edge and the ball rolls back to the bowler"
475,"Khan to Watson, no run good length on middle and off, Watson defends to the side"
476,"Khan to Watson, no run well outside off, Watson shoulders arms"
477,"Khan to Watson, no run Watson gets behind the line of the ball and defends stoutly"
478,"Khan to Watson, 1 run Watson looks to work that one towards point, gets an inside edge and the ball trickles towards square leg"
479,"Khan to Lee, no run yorker length delivery, Lee manages to dig that one out"
480,"Khan to Lee, 1 run Lee gets on the front foot and pushes it to cover for a single"
481,"Sharma to Lee, no run Ishant keeps it short of a length, on off, Watson taps it towards off"
482,"Sharma to Lee, 1 run on middle and leg this time, Lee nudges it away towards midwicket for a single"
483,"Sharma to Watson, FOUR runs Whack! short ball outside off, Watson smashes it to the midwicket boundary."
484,"Sharma to Watson, no run better t\length from Ishant, Watson gets on the back foot and pushes it to cover"
485,"Sharma to Watson, no run outside off, good length, Watson watches that through to the keeper"
486,"Sharma to Watson, no run a touch closer to off but not close enough to tempt Watson into playing that"
487,"Harbhajan to Lee, 2 runs tossed up, overpitched, Lee comes down a couple of paces and pushes it past mid-off"
488,"Harbhajan to Lee, no run length ball, pitching just outside off, big stride in as Lee defends"
489,"Harbhajan to Lee, no run Lee wasn't very convincing defended that, it turned a lot after pitching well outside off, gets an inside edge but no alarms"
490,"Harbhajan to Lee, no run uses his feet and defends"
491,"Harbhajan to Lee, no run big stride in as he blocks it to short leg"
492,"Harbhajan to Lee, no run tapped to silly mid-on"
493,"Khan to Watson, no run nice, tight line from Zaheer, Watson pushes it towards mid-off"
494,"Khan to Watson, no run length ball on off, confidently defended by Watson"
495,"Khan to Watson, no run overpitched and some width provided, Watson goes for the drive but doesn't time it and it rolls along to mid-off"
496,"Khan to Watson, no run shorter but wide again, Watson cuts it towards cover point"
497,"Khan to Watson, no run short ball well down the leg side, Watson thought about the pull but didn't go for it"
498,"Khan to Watson, no run Fires in the bouncer, much better direction, flies over Watson's head"
499,"Harbhajan to Johnson, no run fires in a flat delivery, 108 kmph, Johnson gets on the front foot and defends"
500,"Harbhajan to Johnson, no run tossed up this time, pitching on middle and Johnson blocks it off the front foot"
501,"Harbhajan to Johnson, no run slightly overpitched, not much turn on that one, Johnson taps it back to the bowler"
502,"Harbhajan to Johnson, no run flighted delivery, Johnson is beaten as that one held it line after pitching on middle"
503,"Harbhajan to Johnson, no run Johnson shows the full face of the bat as he blocks it"
504,"Mishra to Watson, no run length delivery, pitched on off, didn't turn much, Watson defends it to the bowler"
505,"Mishra to Watson, 1 run shorter and a bit wide, Watson rocks on to the back foot and punches it to the left of mid-off"
506,"Mishra to Johnson, 2 runs down the leg side to the left hander, who glances it for a couple"
507,"Mishra to Johnson, no run flighted delivery, pitching outside off, well left by Johnson"
508,"Mishra to Johnson, no run defended solidly by Johnson"
509,"Mishra to Johnson, no run more defence, this time to the leg side"
510,"Harbhajan to Watson, 2 runs length delivery, pitching just outside off, Watson opens the face to guide it towards third man"
511,"Harbhajan to Watson, no run nice loop for Harbhajan, Watson waits and defends off the back foot"
512,"Harbhajan to Watson, no run Watson shoulders arm to that one as it wide outside off"
513,"Harbhajan to Watson, no run defended back down the ground"
514,"Harbhajan to Watson, no run Watson comes down the track and defends it back to the bowler"
515,"Harbhajan to Watson, 4 leg byes fired in down the leg side, hits Watson's and races away fine for a boundary"
516,"Mishra to Johnson, no run round the wicket to the left hander, spins inwards as he shoulders arms"
517,"Mishra to Johnson, no run flighted outside off, he gets well forward and defends"
518,"Mishra to Johnson, no run flighted on off and middle, he gets forward and defends"
519,"Mishra to Johnson, no run tossed on middle, he gets forward on the walk and pushes it to midwicket"
520,"Mishra to Johnson, no run comes over the wicket, gives it more air, he pushes it to mid-on"
521,"Mishra to Johnson, no run slower through the air, he gets well forward and smothers the spin"
522,"Harbhajan to Watson, no run pitches a little wide outside off, not much turn as he shoulders arms"
523,"Harbhajan to Watson, 1 run good turn from the rough outside off, he picks it with the turn and works it to the on side, that's the 250"
524,"Harbhajan to Johnson, 1 run flatter through the air, he opens the face of the bat and glides it to short third man and takes a quick single"
525,"Harbhajan to Watson, no run floated on middle and leg, he pushes it to mid-on"
526,"Harbhajan to Watson, 1 run walks down the pitch and pushes a full delivery down to midwicket"
527,"Harbhajan to Johnson, no run comes round the wicket, the ball just goes through straight to Dhoni, Watson has the strike"
528,"Mishra to Watson, no run quick through the air, Watson gets well forward and the ball trickles to the on side"
529,"Mishra to Watson, no run steps down the track, checks his stroke and pushes it back to the bowler"
530,"Mishra to Watson, 1 run this was flatter and wider outside off, he rocks back and cuts to deep point"
531,"Mishra to Johnson, no run flighted on middle and off, he gets wel forward and defends"
532,"Mishra to Johnson, no run stays a bit on the backfoot, waits for the turn and tucks it to the on side"
533,"Mishra to Johnson, no run this one beats him, the wrong 'un, pokes his bat out to defend"
534,"Harbhajan to Watson, no run flighted slowly on off and middle, he gets back and defends"
535,"Harbhajan to Watson, no run quicker through the air, angled in towards middle and leg, he defends"
536,"Harbhajan to Watson, no run more flight this time and the angle is more to the off stump, pushes it back to the bowler"
537,"Harbhajan to Watson, no run slower through the air, he stays on the back foot and defend"
538,"Harbhajan to Watson, FOUR runs pushed in flatter and quicker, it sits up as a half tracker for Watson and he gets into the position for the pull early and smashes it past square leg"
539,"Harbhajan to Watson, no run gives it more air, pitches on middle and leg, he stays back and defends"
540,"Mishra to Johnson, no run flighted outside off, driven to the off side"
541,"Mishra to Johnson, no run flighted outside off, he drives firmly to the covers"
542,"Mishra to Johnson, no run comes round the wicket, lands on a full length on middle and off, he defends"
543,"Mishra to Johnson, no run not much turn, he closes the face of the bat as he defends"
544,"Mishra to Johnson, no run flighted outside off, defended uppishly to the silly point region"
545,"Mishra to Johnson, no run short and wide outside off, he waits on it, rocks back and cuts hard and strikes Laxman flush on the shin"
546,"Harbhajan to Watson, FOUR runs flighted outside off, he gives him the charge and crashes a full delivery wide of mid-off, lovely shot"
547,"Harbhajan to Watson, no run flighted on off and middle, he gets forward and defends"
548,"Harbhajan to Watson, no run slower through the air, he gets forward and nearly inside edges onto the pads"
549,"Harbhajan to Watson, no run flighted just a little wide outside off, gets well forward and taps it away"
550,"Harbhajan to Watson, no run slower through the air, gets a half stride forward and defends"
551,"Harbhajan to Watson, 1 run takes a few paces forward and pushes it wide of mid-off for a single"
552,"Mishra to Watson, no run flighted outside off, he gets forward and defends"
553,"Mishra to Siddle, no run defends very close to the his pad and gets a thin inside edge"
554,"Mishra to Siddle, no run this one keeps low and turns, Siddle was all at sea on the forward defence"
555,"Mishra to Siddle, no run a big spinning googly, pitches on middle and turns sharply past the back of Siddle"
556,"Mishra to Siddle, no run lunges forward to defend and there appears to be an edge onto his pads, close shout for leg before and Mishra appeals confidently, not sure about the edge"
557,"Harbhajan to Johnson, no run flighted outside off, he gets forward and defends to the off side"
558,"Harbhajan to Johnson, no run slower through the air, goes through straight and beats the bat"
559,"Harbhajan to Johnson, no run flighted outside off, gets forward and smothers the turn"
560,"Harbhajan to Johnson, no run Johnson shoulders arms outside off, the ball goes through straight"
561,"Harbhajan to Johnson, SIX runs into the crowd! Harbhajan tempts him with flight and he obliges by waltzing down the track and banging it over the region of long-on"
562,"Harbhajan to Johnson, no run shuffles across his stumps and turns it to the on side"
563,"Mishra to Siddle, no run straighter, flatter one pitching on off, Siddle gets behind the line and defends"
564,"Mishra to Siddle, no run Siddle tries to work it through the leg side, gets a leading edge towards the bowler"
565,"Mishra to Siddle, no run big legspinner, Siddle gets on the front foot, looks to dives but is comprehensively beaten"
566,"To nobody's surprise, India have decided to not enforce the follow-on."
567,Mishra becomes the sixth India bowler to take a five-for on debut and India now have a 201-run cushion.
568,Innings Start
569,"Short mid-off for Hayden, short cover too"
