,Data
221,"Herath to Clarke, 1 run plays from the crease to square leg"
222,"Herath to Warner, no run Warner tucks it to square leg, the batsmen think about the single but after already being involved in a run out Warner calls no"
223,"Herath to Warner, 1 run played to long-on"
224,"Maharoof to Warner, no run short of a length outside off, Warner steers the ball towards point where Dilshan dives to his left and makes the save"
225,"Maharoof to Warner, 1 run a slower ball on leg and middle, that looked like the off cutter, Warner moves back and turns the ball through square"
226,"Maharoof to Clarke, 1 run Clarke moves forward and across to force the ball through square leg with a controlled pull"
227,"Maharoof to Warner, 1 run a full ball on off stump, Warner drives towards long off for a single"
228,"Maharoof to Clarke, 1 run Clarke moves forward and across and swings his bat across his front pad, hitting the ball from off stump behind square"
229,"Maharoof to Warner, 1 run Warner pushes forward and tries to drive, he gets a thick outside edge that goes behind point"
230,"Herath to Warner, no run Warner leans forward and drives the ball to cover"
231,"Herath to Warner, no run Warner goes back and tries to force the ball through midwicket, it keeps a bit low and he gets an inside edge on to the pad"
232,"Herath to Warner, 1 run driven to long off for one more"
233,"Herath to Clarke, 1 run Clarke steps out of his crease and plays through midwicket"
234,"Herath to Warner, 1 run a flat ball on the stumps, Warner stays back and forces it towards long on"
235,"Herath to Clarke, 1 run Clarke turns the ball off his pads behind square"
236,"Maharoof to Clarke, 1 run Clarke moves forward and tries to swing across the line, he gets an inside edge on to the body"
237,"Maharoof to Warner, no run a full ball in the blockhole, Warner digs it out towards the off side"
238,"Maharoof to Warner, no run Sangakkara throws the ball up in the air in celebration and Maharoof appeals confidently, but the umpire is unmoved. Warner tried to squeeze a full ball through the off side and was beaten. I think the bat hit the ground there, and missed the ball completely"
239,"Maharoof to Warner, 1 run played off the back foot through the off side"
240,"Maharoof to Clarke, FOUR runs Clarke's been trying to do this for a while now, moving forward and towards the off just a little, to create room to whip the ball off his hips to the long leg boundary"
241,"Maharoof to Clarke, 1 run full ball on the pads, flicked through midwicket for a single"
242,"Herath to Clarke, 3 runs what a shot that is, Clarke began to try and paddle the ball to fine leg, and then opened the face to reverse paddle the full toss through third man. He assumed it was going for four though and didn't run initially, Malinga gave chase and pulled it in, sloppy cricket from Clarke after a superb hundred"
243,"Herath to Hussey, FOUR runs Hussey plays the reverse paddle this time and places it past the fielder at short third man, he's timed it well enough to reach the boundary"
244,"Herath to Hussey, 1 run played on the off side for a single"
245,"Herath to Clarke, SIX runs tremendous batting, tremendous. Clarke lines up Herath and slams him over the midwicket boundary with a massive swing of the bat on the front foot"
246,"Herath to Clarke, 1 run played through point for a single"
247,"Herath to Hussey, 1 run Hussey works a full toss off his pads in front of square leg"
248,"Malinga to Hussey, OUT bowled him! Hussey comes out of his crease and towards the leg side, trying to drive through the off. Malinga beats him with a full and fast ball and hits the stumps"
249,"Malinga to Hussey, 1 run one in the blockhole on off stump, Hussey tries to squeeze it out on the off side and gets an inside edge on the leg"
250,"Malinga to Clarke, 1 run Clarke stays in his crease and lofts a full ball on the bounce to long-on"
251,"Malinga to Hussey, no run a full ball outside off, played towards point"
252,"Malinga to Hussey, 1 run another yorker from Malinga, Hussey manages to play it towards mid-off"
253,"Malinga to Clarke, 1 run Clarke moves forward and outside off before opening the face to steer a full ball towards backward point"
254,"Herath to Clarke, no run Herath bowls one into the blockhole, Clarke digs it out on the off side"
255,"Herath to Clarke, SIX runs shot! Clarke reaches forward, gets down on one knee and swings hard, slog-sweeping a short ball over the deep square leg boundary"
256,"Herath to Clarke, 2 runs another drop, the Sri Lankan fielding nightmare continues. Clarke goes inside out and lofts the ball over extra cover, Kulasekara runs to his left from long off and has to catch it on the move, he gets two hands to it but drops it as he falls to the turf"
257,"Herath to Clarke, 1 run whipped off the pads to deep midwicket"
258,"Herath to Warner, 1 run played down the ground for a single"
259,"Herath to Clarke, no run he tried to play it on the leg side but got a leading edge towards point"
260,"Maharoof to Warner, no run a full ball on off stump, driven from the crease towards point"
261,"Maharoof to Warner, 2 runs a full toss outside off stump, Warner drives from his crease through cover to move into the 90s, Australia pass 200 as well"
262,"Maharoof to Warner, 1 run full and straight, driven to long on from the crease"
263,"Maharoof to Clarke, no run Clarke tries to move across the crease and let the ball go as it angles into him, he misjudged the line and was hit on the pad"
264,"Maharoof to Clarke, 1 run a full ball swinging into the right-hander, Clarke drives towards mid-off, the fielder from extra cover runs to his right but fails to reach the ball, he might have blinded the fielder at mid-off though, who fumbled to allow the single. Sri Lanka have been absent minded in the field today, woozy thinking"
265,"Maharoof to Warner, 2 runs a full ball outside off, driven through cover"
266,"Kulasekara to Clarke, 1 run Clarke waits in his crease and drills a full ball through midwicket"
267,"Kulasekara to Hussey, 2 runs a full toss and Hussey lofts it towards wide long-on"
268,"Kulasekara to Hussey, 1 run in the blockhole, Hussey makes room by moving towards leg and slogs towards long on"
269,"Kulasekara to Clarke, 1 run a full ball on off and middle stump, Clarke makes room and drives to long off"
270,"Kulasekara to Hussey, 1 run dropped again, how many today? Hussey backward away and swung a length ball straight to Herath at midwicket, that was an absolute sitter, shocking fielding from Herath"
271,"Kulasekara to Clarke, OUT and after that bit of sloppiness, Herath produces a direct hit to run out Clarke. Clarke played the ball straight to the fielder at midwicket and set off, he's in discomfort as he runs though and doesn't dive to try and make his crease. Herath's throw has him well short. Clarke's played a terrific innings but is in pain"
272,"Malinga to Christian, no run a full ball outside off, the batsman tries to paddle on the leg side and gets beaten"
273,"Malinga to Christian, 1 run in the blockhole, the batsman swings and gets an inside edge towards square leg"
274,"Malinga to Hussey, 1 run a low full toss, Hussey swings across the line and gets an inside edge into the ground near his boot"
275,"Malinga to Christian, 2 runs a full ball bowled wide outside off stump, Christian throws his bat at it and slices the ball towards Herath at third man"
276,"Malinga to Christian, 1 run Malinga finds the blockhole again, Christian plays it towards midwicket"
277,"Malinga to Hussey, OUT bowled him, Malinga lands another perfect yorker and beats Hussey's slog with the swing into the right-hander, the ball clips leg stump"
278,"5.20 pm Australia have finished with a strong total on a slowish pitch, with Clarke and Warner scoring contrasting centuries. Warner was the slower one, Clarke was quick and quite terrific. Sri Lanka were poor in the field, several fumbles, some overthrows and five dropped catches. They aren't out of this yet though, because Australia could have easily"
279,"Brett Lee will opening the bowling for Australia, from over the wicket."
280,"Sri Lanka's chase is about five minutes away. I wonder if Mahela Jayawardene has cooled off during the innings break, he lost his temper with the umpires when they made a late no-ball call during one very expensive Maharoof over. He and Tillakaratne Dilshan will open the innings ..."
281,"Lee to Mahela Jayawardene, 1 leg bye length ball on the pads, Mahela plays the glance from his crease towards fine leg"
282,"Lee to Dilshan, FOUR runs short and wide outside off stump, Dilshan has a real go at it, flaying his bat hard and carving the ball flat and fast to the point boundary"
283,"Lee to Dilshan, no run Dilshan moves forward and plays the ball back to the bowler"
284,"Lee to Dilshan, 1 wide Lee gets the ball to swing but the line was extremely wide outside off, Dilshan tries to lay into this one as well but can't connect"
285,"Lee to Dilshan, no run much straighter and in the blockhole, Lee's getting the ball to shape away from the right-hander, Dilshan digs it out"
286,"Lee to Dilshan, no run tight line and length close to off stump, Dilshan begins to poke but then pulls his bat away from the ball"
287,"Lee to Dilshan, 1 wide Lee sprays it down leg side this time ... bowling to the left, bowling to the right ..."
288,"Lee to Dilshan, 1 wide another wide ball down leg side, this is a long opening over"
289,"Lee to Dilshan, 4 byes what's happened there? Lee's beaten the bat with a short of a length ball outside off, Dilshan tried to flay it through the offside but missed. The ball swung sharply towards the right after passing the bat and beat Wade's dive to the left"
290,"McKay to Mahela Jayawardene, 1 run short of a length outside off, Jayawardene steers off the back foot towards third man"
291,"McKay to Dilshan, 1 run length ball angling into the right-hander, Dilshan clips it off his pads through square leg"
292,"McKay to Mahela Jayawardene, (no ball) caught behind! But the umpire is checking to see if it's a front-foot no-ball. It is, McKay had overstepped. It was a wide ball outside off and Mahela slashed at it, reaching far away from his body. He got a thick edge through to the keeper. The Australians began to celebrate but the umpire Bruce Oxenford"
293,"McKay to Mahela Jayawardene, no run the free-hit is a slower ball outside off, Jayawardene heaves at it and is beaten"
294,"McKay to Mahela Jayawardene, 1 run steered towards third man for a single"
295,"McKay to Dilshan, 3 runs Dilshan reaches for a short of a length delivery outside off and hits it with the bottom of the bat past the diving fielder at short cover, that was in the air but just out of reach"
296,"McKay to Mahela Jayawardene, no run defended on the front foot on the off side"
297,"Pattinson to Dilshan, FOUR runs edged and four! The ball was full outside off with swing away from the right-hander, Dilshan pushed at it from the crease and edged it wide of the fielder at first slip"
298,"Pattinson to Dilshan, 3 wide whoa, that's sprayed far down leg side, massive swing past the right-hander and Wade does superbly to dive to his left and get some glove on it"
299,"Pattinson to Dilshan, no run Pattinson beats Dilshan's drive with a lovely outswinger on a good length"
300,"Pattinson to Dilshan, no run a huge roar of an appeal for lbw after Dilshan misses the hoick towards square leg, he was right in front of the stumps but height was an issue"
301,"Pattinson to Dilshan, no run played from the crease towards cover"
302,"Pattinson to Dilshan, FOUR runs edged again for four! Dilshan goes after a full ball outside off, aiming for cover point, he gets a thick outside edge that flies wide of David Hussey at second slip. Pattinson is getting the ball to swing away from Dilshan"
303,"Pattinson to Dilshan, no run cut hard off the back foot but Warner makes the save at point"
304,"McKay to Mahela Jayawardene, no run good length outside off stump, Mahela moves forward and punches towards mid-off"
305,"McKay to Mahela Jayawardene, no run Mahela charges McKay and mis-times the pull towards midwicket, the length wasn't short enough"
306,"McKay to Mahela Jayawardene, 1 run fuller length on middle stump, nudged off the pads from the crease towards square leg"
307,"McKay to Dilshan, no run played to the fielder at point"
308,"McKay to Dilshan, no run Dilshan drives a length ball towards mid-off"
309,"McKay to Dilshan, no run short of a length outside off stump, cut off the back foot towards Warner at point"
310,"Pattinson to Mahela Jayawardene, 1 run full length on off stump with some movement away from Mahela, who stays in his crease and plays towards midwicket"
311,"Pattinson to Dilshan, (no ball) Pattinson's overstepped, Dilshan pushed at a length ball outside off and was beaten, quite a big no-ball as well"
312,"Pattinson to Dilshan, 1 run the free-hit is a slower full toss and Dilshan mis-hits the swat towards square leg, the ball goes close on the leg side"
313,"Pattinson to Mahela Jayawardene, FOUR runs shot! Mahela steps out of his crease to the pace of Pattinson and drills a full ball hard past the bowler to the straight boundary, the ball deflected off the bowler"
314,"Pattinson to Mahela Jayawardene, FOUR runs short this time and Mahela sends the ball flat to the square leg boundary with a swivel pull from the crease, one-bounce four"
315,"Pattinson to Mahela Jayawardene, no run played from the crease on the leg side"
316,"Pattinson to Mahela Jayawardene, no run short of a length ball outside off, Mahela dabs it towards slips but doesn't run this time, I think he was run out at the MCG like that"
317,"McKay to Dilshan, no run played to the fielder at short cover"
318,"McKay to Dilshan, 2 runs a full ball outside off, Dilshan drives towards cover from his crease and finds the gap, David Hussey chases and reaches the ball in the nick of time"
319,"McKay to Dilshan, 1 leg bye the Dilscoop or the Starfish? Dilshan got down low and tried to scoop a length ball over his head, fine leg was in the circle. He missed and the ball smacked into his helmet. Dilshan's called for a new helmet."
320,"McKay to Mahela Jayawardene, 1 run Mahela laced the cover drive off the front foot with superb timing but David Hussey leaped to his left at cover to save three runs"
321,"McKay to Dilshan, FOUR runs well Dilshan's tried it again and with success this time. He moves towards the off and scoops the ball past the fielder at short fine leg. He didn't get down as low this time"
322,"McKay to Dilshan, no run he's tried to scoop it again, this time from outside off stump, Dilshan was aiming to hit it towards the keeper's right and was beaten this time. It's quite manic, the cricket at the moment"
323,"Doherty to Mahela Jayawardene, 1 run flat ball fired in at the stumps, Jayawardene cuts towards point"
324,"Doherty to Dilshan, 1 run bowled slower towards middle stump, played towards square leg on the front foot"
325,"Doherty to Mahela Jayawardene, 3 runs width outside off stump, Mahela waits and dabs the ball late towards third man, Warner chases from point"
326,"Doherty to Dilshan, no run played back to the bowler on the front foot"
327,"Doherty to Dilshan, no run pushed off the front foot towards the bowler's right, both batsmen begin to run and then stop, they run again and stop again"
328,"Doherty to Dilshan, 2 runs played along the ground through midwicket for two more"
329,"McKay to Mahela Jayawardene, no run a loopy slow ball out of the back of the hand outside off stump, Mahela mis-times the drive, he was early on the shot"
330,"McKay to Mahela Jayawardene, no run this is quicker and skids through on Mahela, he tries to dab from the crease and inside edges past his stumps to the keeper"
331,"McKay to Mahela Jayawardene, 1 run a full ball outside off, Mahela strides forward and drives but Christian dives to his left at cover to save the boundary"
332,"McKay to Dilshan, no run a length ball outside off stump, hit hard off the back foot to cover, the fielder throws at the bowler's end but misses the stumps, there is back up"
333,"McKay to Dilshan, no run played from the crease towards point"
334,"McKay to Dilshan, 1 run another slower ball outside off stump, Dilshan steers it behind point for a single"
335,"Doherty to Dilshan, 1 run Australia are sloppy in the field now, Warner let a cut go straight through him at point, he couldn't bend properly, perhaps because of his groin?"
336,"Doherty to Mahela Jayawardene, 1 run played towards square leg"
337,"Doherty to Dilshan, no run cut from the crease towards point, Warner fields cleanly this time"
338,"Doherty to Dilshan, 1 run driven to long off for a single"
339,"Doherty to Mahela Jayawardene, no run Mahela moves forward and drives to the fielder at short cover"
340,"Doherty to Mahela Jayawardene, FOUR runs he steps out of his crease and sends the ball over the fielder at mid-on with a full swing of the bat"
341,"McKay to Dilshan, FOUR runs short and wide outside off, Dilshan has room to swing his arms and he does so with power, cutting the ball in the air but behind the fielder at point, he's placed it square enough to beat third man as well"
342,"McKay to Dilshan, 1 run Dilshan stays in his crease and drives a full ball towards wide mid-on"
343,"McKay to Mahela Jayawardene, 1 run a slower ball outside off stump, Mahela waits for it and steers towards third man"
344,"McKay to Dilshan, 1 leg bye another slower ball, Dilshan tries to turn the ball towards the leg side but gets hit on the thigh for a leg bye on the off side"
345,"McKay to Mahela Jayawardene, 1 run Mahela opens the face and steers the ball from outside off stump towards third man"
346,"McKay to Dilshan, no run Dilshan strides forward and drives to Watson at mid-off"
347,"Lee to Mahela Jayawardene, 1 run angled into leg stump and goes off Mahela's pad to square leg. Missed opportunity for Mahela. That was a boundary ball"
348,"Lee to Dilshan, 1 run better line, in the corridor outside off and Dilshan steers it to third man"
349,"Lee to Mahela Jayawardene, 1 run again outside off and Mahela opens the face and plays it to third man"
350,"Lee to Dilshan, 1 run yorker from Lee and Dilshan squeezes it out to mid-on. Pattinson rushes in but the batsnam steal a quick single"
351,"Lee to Mahela Jayawardene, 1 run on the stumps and Mahela flicks it elegantly to deep square leg"
352,"Lee to Dilshan, no run looks for the yorker again but its a low full toss this time and Dilshan drives it to mid-off"
353,"Christian to Mahela Jayawardene, 1 run starts with a ball on a good line outside off, which is steered fine on the off side"
354,"Christian to Dilshan, no run this one is on the stumps and Dilshan defends"
355,"Christian to Dilshan, no run beats the bat outside off. Dilshan beaten by lack of pace more than movement"
356,"Christian to Dilshan, 1 run dicey-looking late cut from Dilshan. That shot entails a lot of risk for just one run"
357,"Christian to Mahela Jayawardene, 1 run on off stump and Mahela pushes it to mid-on for a quick single"
358,"Christian to Dilshan, no run on off stump and Dilshan opens the face but cannot beat point"
359,"Lee to Mahela Jayawardene, no run full on of stump, Mahela drives hard but it's well fielded by Christian at short cover. Nice-looking shot for no runs"
360,"Lee to Mahela Jayawardene, 1 run shortens the length and Mahela steers to third man again. Sri Lanka really peppering that area"
361,"Lee to Dilshan, no run short ball from Lee, Dilshan thinks about the hook but sways away at the last minute. It was outside off so goes harmlessly through to Wade"
362,"Lee to Dilshan, no run slower ball and Dilshan had to make a late adjustment. Deals with it in the end and pushes to point"
363,"Lee to Dilshan, 1 run full again, perhaps searching for the yorker, Dilshan drives it to deep cover point"
364,"Lee to Mahela Jayawardene, no run good length on off and again Mahela looks for the steer to third man, but gets it too square and point cuts it off"
365,"Christian to Dilshan, 1 run a bit of width and Dilshan has a slash but doesn't time it and just gets one to deep cover point"
366,"Christian to Mahela Jayawardene, FOUR runs Mahela goes down the track and slaps it to the leg side. Was not in full control and it was in the air, but it beats short midwicket and goes for four"
367,"Christian to Mahela Jayawardene, 1 run and now he reverts to the steer to third man for a single"
368,"Christian to Dilshan, 1 run and Dilshan repeats the shot. Had to bend down quite low to play it"
369,"Christian to Mahela Jayawardene, 1 run for the umpteenth time, Mahela guides the ball to third man"
370,"Christian to Dilshan, 2 runs this time the steer on the off side goes a bit squarer and the batsmen run two as third man has to run to his right"
371,"Lee to Mahela Jayawardene, no run short of a length and quick outside off, Jayawardene gets beaten while trying to steer towards third man, he walks away to the leg side and berates himself"
372,"Lee to Mahela Jayawardene, no run cut off the back foot towards point"
373,"Lee to Mahela Jayawardene, FOUR runs that's half steered, half outside-edged to the third man boundary, Lee bowled it on a good length outside off, giving Jayawardene some width"
374,"Lee to Mahela Jayawardene, no run a full ball on off stump, Jayawardene drives towards mid-off"
375,"Lee to Mahela Jayawardene, no run short of a length at the body, Jayawardene dabs it close on the off side and wants one, Dilshan does not"
376,"Lee to Mahela Jayawardene, no run banged in short, Jayawardene takes cover by ducking"
377,"Doherty to Dilshan, 2 runs dabbed off the pads through square leg, the fielder needs to run in from the deep so they can take two, Sri Lanka reach 100 in quick time"
378,"Doherty to Dilshan, no run cut from the crease towards backward point"
379,"Doherty to Dilshan, 1 run cut again, a little more forcefully this time through the gap at point"
380,"Doherty to Mahela Jayawardene, 1 run Jayawardene moves across and works the straight ball off his pads behind square"
381,"Doherty to Dilshan, 2 runs that's wide outside off stump, Dilshan cuts again, in front of point, and Pattinson has some running to do on the boundary"
382,"Doherty to Dilshan, 2 runs Dilshan waits in his crease and cuts once again, and there's a mis-field at point"
383,"Hussey to Mahela Jayawardene, 2 runs Jayawardene leans forward and across to paddle the ball towards fine leg"
384,"Hussey to Mahela Jayawardene, 2 runs Jayawardene cuts the ball late and places it behind point, taking on Lee in the deep and completing the second"
385,"Hussey to Mahela Jayawardene, no run dabbed from the crease towards point"
386,"Hussey to Mahela Jayawardene, 1 run played off the front foot towards point for a single, pushed it with soft hands"
387,"Hussey to Dilshan, 1 run driven off the front foot past the diving Hussey towards long-on, Dilshan celebrates a half-century, Jayawardene goes up to shake his hand and pats his helmet"
388,"Hussey to Mahela Jayawardene, 1 wide fired down leg side, much quicker from Hussey"
389,"Hussey to Mahela Jayawardene, 1 run driven off the front foot to long off for one more"
390,"Doherty to Mahela Jayawardene, 1 run Jayawardene plays from the crease towards mid-on for a single"
391,"Doherty to Dilshan, no run Dilshan gets beaten outside off while trying to late cut, Wade doesn't collect cleanly"
392,"Doherty to Dilshan, no run defended back towards the bowler"
393,"Doherty to Dilshan, no run played from the crease towards point"
394,"Doherty to Dilshan, 2 runs a quicker ball on middle stump, turned off the pads behind square"
395,"Doherty to Dilshan, 1 run driven off the back foot through cover point"
396,"Watson to Dilshan, no run good length and very straight, driven from the crease towards extra cover"
397,"Watson to Dilshan, no run played back to the bowler on the front foot, Watson will keep it very straight"
398,"Watson to Dilshan, FOUR runs Dilshan charges Watson's length ball and hammers it between the bowler and mid-off, he hit that with tremendous power and with a full swing of the bat"
399,"Watson to Dilshan, 1 run good length delivery angling into off stump, Dilshan plays from his crease and hits the ball in front of point"
400,"Watson to Mahela Jayawardene, 1 run Jayawardene reaches his half-century with a dab towards third man, he raises his bat to his team-mates"
401,"Watson to Dilshan, no run Dilshan charges and slogs across the line but gets beaten by a short of a length delivery"
402,"Doherty to Mahela Jayawardene, FOUR runs Jayawardene moves towards the off side, gets down on one knee, and creates the room to swing the ball behind square with a powerful sweep"
403,"Doherty to Mahela Jayawardene, 1 run pushed on the off side for a single"
404,"Doherty to Dilshan, 1 run that ball skidded on to Dilshan and it was a bit too full to cut, he hit it from in front of off and middle stump"
405,"Doherty to Mahela Jayawardene, 1 run played towards midwicket for a single"
406,"Doherty to Dilshan, no run driven back to the bowler and Doherty throws it back at the keeper, a rather rash throw"
407,"Doherty to Dilshan, FOUR runs Dilshan goes back and cuts, placing the ball through the small gap between two fielders at point"
408,"Watson to Mahela Jayawardene, 1 run Jayawardene jumps out of his crease to drive a full ball through cover point"
409,"Watson to Dilshan, 1 run full and straight, Dilshan drives from his crease towards mid-on"
410,"Watson to Mahela Jayawardene, 1 run Jayawardene takes one hand off the bat as he swings at a length ball, lobbing it over the infield at midwicket but well short of the fielder in the deep"
411,"Watson to Dilshan, no run Dilshan gets hit on the pad as he tries to turn the ball towards square leg"
