,Data
0,"Johnson to Mahela Jayawardene, 1 run short of a length and he tucks it down to midwicket"
1,"Johnson to Thirimanne, no run more the Johnson we know, digs it in short and on the body, Thirimanne very awkwardly fended it off, took his eyes off the ball, could so easily have got a top edge"
2,"Johnson to Thirimanne, no run short of a length and he pushes it to the off side"
3,"Johnson to Thirimanne, no run comes forward and across and pushes it to the off side"
4,"Johnson to Thirimanne, no run short of a length and angles across him, he steers it to the off side"
5,"Johnson to Thirimanne, no run bangs it in short on the body and he ducks and the ball hits him flush on the shoulder"
6,"Lyon to Mahela Jayawardene, FOUR runs one bounce and four, brave on Lyon to continue to toss it up, chips down the track and carts him over midwicket, top shot"
7,"Lyon to Mahela Jayawardene, no run stays back and clips it with the turn to the on side"
8,"Lyon to Mahela Jayawardene, SIX runs shot of the day so far! Tossed up and he chips down the track and lofts him high and clean over the sightscreen, as straight as straight can get"
9,"Lyon to Mahela Jayawardene, no run comes forward and works it to the on side"
10,"Lyon to Mahela Jayawardene, 1 run gets across and clips it to the on side for a single"
11,"Lyon to Thirimanne, no run tossed up and he gets well forward and defends"
12,"Starc to Mahela Jayawardene, OUT and the bowling change does the trick! Comes over the wicket, lands it outside off, Mahela goes forward and across to drive and gets a thick outside edge at waist height to Clarke at first slip, they check for the no-ball and Starc's heel was just behind the popping crease before he dragged it forward, lega"
13,"Starc to Thilan Samaraweera, no run angles across him and he shoulders arms"
14,"Starc to Thilan Samaraweera, 1 run pushes it towards cover to get off the mark"
15,"Starc to Thirimanne, FOUR runs length delivery, neatly punched down the ground, there's no mid-on so Siddle has to chase from mid-off and he makes a mess of it on the slide near the rope, looks a bit sheepish"
16,"Starc to Thirimanne, no run bangs it in short and he evades the bouncer"
17,"Starc to Thirimanne, 1 wide hits the deck even harder and it's another bouncer, he is penalised for it"
18,"Starc to Thirimanne, no run bowls it fuller and he clips it with the angle to the on side"
19,"Lyon to Thilan Samaraweera, no run tossed up and he comes forward and defends"
20,"Lyon to Thilan Samaraweera, 2 runs tossed up further and Samaraweera plays an airy drive wide of gully, should have been three"
21,"Lyon to Thilan Samaraweera, no run stays behind the line and defends"
22,"Lyon to Thilan Samaraweera, no run flatter delivery and he gets forward and defends"
23,"Lyon to Thilan Samaraweera, no run gives it more air and he comes forward and defends"
24,"Lyon to Thilan Samaraweera, no run comes forward and gets an inside edge to the pads"
25,"Starc to Thirimanne, FOUR runs nicely driven! Starc bowls a friendly half volley outside off and he leans forward and across and drives wide of cover, he hit a few in the air through the off side earlier but was in full control of this one"
26,"Starc to Thirimanne, no run good comebck by Starc as he bowls it short and Thirimanne manages to fend it off...just"
27,"Starc to Thirimanne, 2 runs keeps it short and he punches it wide of backward point for a couple"
28,"Starc to Thirimanne, 1 run gives him width and he steers it wide of point"
29,"Starc to Thilan Samaraweera, 2 runs on the pads and he clicks it in the air over midwicket, didn't look in full control of the shot"
30,"Starc to Thilan Samaraweera, 4 runs loose-cannon moment from Starc! Samaraweera drilled it back to the bowler and was on the walk, Starc gathered and flung it back...missed the target and the keeper Wade - four bonus runs"
31,"Bird to Thirimanne, FOUR runs his driving through the off side is getting better and better! Full and wide outside off and he uses the pace on the ball to steer it wide of point"
32,"Bird to Thirimanne, no run sort of a length and he leaves it alone to the keeper"
33,"Bird to Thirimanne, no run fuller delivery and he pushes it towards the covers"
34,"Bird to Thirimanne, no run drifts on the pads and he tucks it towards midwicket"
35,"Bird to Thirimanne, no run good length on middle and he covers the line to defend"
36,"Bird to Thirimanne, no run angles it across and he watchfully leaves it to the keeper"
37,"Starc to Thilan Samaraweera, no run bit wide of the off stump and he reaches out and steers it to the off side"
38,"Starc to Thilan Samaraweera, no run fuller delivery and he comes across and defends to the off side"
39,"Starc to Thilan Samaraweera, no run little shorter in length and he gets across and defends"
40,"Starc to Thilan Samaraweera, no run fuller and angling inwards and he defends back to the bowler"
41,"Starc to Thilan Samaraweera, 1 run bowls it across and gives him width and he punches it wide of cover for a single"
42,"Starc to Thirimanne, no run keeps it short and the batsman has to negotiate some steep bounce, he reaches out and fends it off"
43,"Bird to Thilan Samaraweera, 1 run starts off the over with a bouncer which Samaraweera swivels and pulls with control down to fine leg"
44,"Bird to Thirimanne, no run angles across him and he stays back and defends"
45,"Bird to Thirimanne, no run gets a nice shape across and Thirimanne watchfully lets it go"
46,"Bird to Thirimanne, no run fullish and angling across and he comes forward and leaves it alone"
47,"Bird to Thirimanne, no run fullish in length outside off and he drives him down to mid-off"
48,"Bird to Thirimanne, 2 runs drifting on the pads and Thirimanne chipped this over midwicket, slightly checked his shot"
49,"Siddle to Thilan Samaraweera, no run hits a good length outside off and he safely leaves it alone to the keeper"
50,"Siddle to Thilan Samaraweera, 1 run just drifts on the pads and he clips him wide of midwicket, Siddle needs to keep it around the off stump"
51,"Siddle to Thirimanne, 3 runs full and angling across and he does well to steer it through the gap at backward point, not enough to reach the rope"
52,"Siddle to Thilan Samaraweera, no run gets some late swing and he comes behind the line and defends"
53,"Siddle to Thilan Samaraweera, no run lands outside the off stump and he safely leaves it alone"
54,"Siddle to Thilan Samaraweera, no run good length on the off stump and he gets across and defends down the track"
55,"Bird to Thirimanne, no run good length outside the off stump and he leaves it alone"
56,"Bird to Thirimanne, no run nearly gives it away! It was outside off and he went for the slash and missed, extra bounce on that one"
57,"Bird to Thirimanne, no run angles across him and he shoulders arms"
58,"Bird to Thirimanne, no run goes back at the crease and defends to the off side"
59,"Bird to Thirimanne, no run angles it across and fuller and he leaves it alone, gets some away movement"
60,"Bird to Thirimanne, no run goes back at the crease and defends down the track"
61,"Siddle to Thilan Samaraweera, no run fullish in length outside off and he pushes it down to cover"
62,"Siddle to Thilan Samaraweera, no run holds the length back slightly and he defends back to the bowler"
63,"Siddle to Thilan Samaraweera, no run fuller in length and he tucks it back to the bowler"
64,"Siddle to Thilan Samaraweera, no run fuller and angling in and he closes the face of the bat and tucks it to the on side"
65,"Siddle to Thilan Samaraweera, no run good length outside off and he comes across and softly defends it"
66,"Siddle to Thilan Samaraweera, OUT trapped in front and Samaraweera was walking, as it so appeared! Siddle gets this one to nip back in off the pitch, Samaraweera was trapped on the back foot, hit plumb in front of middle and leg as he tried to turn it to the on side"
67,"Hussey to Thirimanne, no run on target, outside off and he safely defends"
68,"Hussey to Thirimanne, no run gets it to drift in a bit, safely defended"
69,"Hussey to Thirimanne, 1 run angles it across him and he reaches out and steers it wide of point"
70,"Hussey to Angelo Mathews, no run gets some late inswing and Mathews comes across and defends"
71,"Hussey to Angelo Mathews, no run making the batsman play so that's good, comes across, covers the swing and defends"
72,"Hussey to Angelo Mathews, no run full outside off and he jams it out to mid-off"
73,"Siddle to Thirimanne, no run half volley and neatl driven on the front foot and Hughes does really well at cover to slide and save a certain boundary"
74,"Siddle to Thirimanne, no run comes back in and he stays back and defends"
75,"Siddle to Thirimanne, no run hits a good length outside off and he gets his pad across and leaves it alone"
76,"Siddle to Thirimanne, no run angles it inwards from round the wicket, he comes across and defends"
77,"Siddle to Thirimanne, (no ball) he oversteps the crease, gets across and defends to the on side"
78,"Siddle to Thirimanne, no run goes back at the crease and defends solidly"
79,"Siddle to Thirimanne, no run stays back and defends down the track and we will have one more over before rea"
80,"Hussey to Angelo Mathews, no run stays back at the crease and defends to the on side"
81,"Hussey to Angelo Mathews, no run fuller in length and he softly pushes it to the on side"
82,"Hussey to Angelo Mathews, no run fullish in length and he jams it out towards mid-on"
83,"Hussey to Angelo Mathews, no run shorter in length and he stays back and punches it towards cover"
84,"Hussey to Angelo Mathews, no run"
85,"Hussey to Angelo Mathews, no run sprays that wide outside off and he doesn't touch it, it's tea"
86,"Johnson to Thirimanne, 2 runs full and on the pads and he clips it away down to fine leg"
87,"Johnson to Thirimanne, no run this is a good inswinging yorker, he just about manages to dig it out"
88,"Johnson to Thirimanne, FOUR runs Johnson fails to control the swing, he drifts on the pads and he shuffles and clips it down to fine leg"
89,"Johnson to Thirimanne, no run keeps it full and he defends to the off side"
90,"Johnson to Thirimanne, no run full on the off stump and defended to the covers"
91,"Johnson to Thirimanne, no run keeps it full and straight and he pushes it back to the bowler"
92,"Bird to Angelo Mathews, no run"
93,"Bird to Angelo Mathews, no run fullish delivery angling towards the pads and he clips it down to midwicket"
94,"Bird to Angelo Mathews, no run good length on middle and leg and he works it down to mid-on"
95,"Bird to Angelo Mathews, no run holds the length back and he stays back and defends"
96,"Bird to Angelo Mathews, no run good length on middle and off and he goes back and defends"
97,"Bird to Angelo Mathews, no run gets half forward and softly pushes it back to the bowler"
98,"Johnson to Thirimanne, FOUR runs bang! He drags the length short and Thirimanne swivels and pulls with authority in front of square, big gap there, he was in full control of that"
99,"Johnson to Thirimanne, no run well played, this was kicking up on him off a good length and he went forward and did well to play with soft hands"
100,"Johnson to Thirimanne, 3 runs fifty for Thirimanne and it's always good news for SL when a young player scores a Test fifty, he comes forward to a full delivery and drives wide of cover"
101,"Johnson to Angelo Mathews, no run angles it across him and he defends back to the bowler"
102,"Johnson to Angelo Mathews, no run full and moving away and he defends to the off side"
103,"Johnson to Angelo Mathews, no run gets on the back foot and defends to the off side"
104,"Bird to Thirimanne, 1 run shapes across the left-hander and he angles it down to third man"
105,"Bird to Angelo Mathews, FOUR runs swings it towards the pads and he clips him wide of mid-on and midwicket, the fielder gives chase, slides and nearly cleans up the drinks cart across the rope"
106,"Bird to Angelo Mathews, no run full on the off stump and defended to the covers"
107,"Bird to Angelo Mathews, no run gets across and he pushes it down to mid-off"
108,"Bird to Angelo Mathews, no run drifts inwards and he defends with soft hands towards mid-on"
109,"Bird to Angelo Mathews, 1 run comes in and he clips it with the angle down to fine leg"
110,"Johnson to Angelo Mathews, FOUR runs nicely driven, poor ball, full and wide and slanting across, he had enough width to caress it through the covers"
111,"Johnson to Angelo Mathews, no run angles across and he pushes it down to cover"
112,"Johnson to Angelo Mathews, no run"
113,"Johnson to Angelo Mathews, no run this one swings back in towards the pads and he checks the shot to midwicket"
114,"Johnson to Angelo Mathews, no run hits a good length outside the off stump and Mathews stays back and defends"
115,"Johnson to Angelo Mathews, no run goes back at the crease and softly clips it to the on side"
116,"Lyon to Thirimanne, 1 run clips him down to midwicket"
117,"Lyon to Angelo Mathews, no run flatter delivery and he stays back and defends"
118,"Lyon to Angelo Mathews, no run tossed up and comes forward and defends"
119,"Lyon to Angelo Mathews, no run gives it more air and he plonks forward and defends"
120,"Lyon to Angelo Mathews, no run tossed up and he presses forward and defends"
121,"Lyon to Angelo Mathews, no run comes well forward and he steers it to the off side"
122,"Johnson to Thirimanne, no run fullish delivery on the pads and he drills it to the on side"
123,"Johnson to Thirimanne, no run pitched up and he drives this one down to mid-off"
124,"Johnson to Thirimanne, no run gets forward and across and he pushes it to the covers"
125,"Johnson to Thirimanne, FOUR runs slashed over the slips! Can't call that a chance, it was short and he had some width, put a lot of power behind that slash and it went over Clarke who jumped at first slip"
126,"Johnson to Thirimanne, no run fuller and straighter and he comes forward and defends"
127,"Johnson to Thirimanne, 1 run full on middle and leg and worked down to square leg"
128,"Lyon to Thirimanne, no run tossed up and he comes forward and leaves it alone"
129,"Lyon to Thirimanne, no run tossed up, comes forward and defends"
130,"Lyon to Thirimanne, no run flighted outside off and he pushes it towards cover"
131,"Lyon to Thirimanne, FOUR runs neatly driven! Flighted outside off, gives him width outside off and he stays beside the line, bends and drives square on the off side"
132,"Lyon to Thirimanne, FOUR runs stays on the back foot this time, dropped shorter, he rocks back and across and cuts wide of point, Warner chases but can't cut it off"
133,"Lyon to Thirimanne, no run tossed up and he comes forward and defends"
134,"Starc to Angelo Mathews, FOUR runs his first ball in his previous spell got a wicket, this time it's a boundary. Loosener outside off, full and Mathews went forward and pushes it down the ground wide of mid-off"
135,"Starc to Angelo Mathews, no run left alone to the keeper and this one keeps a touch low, not much of an effort ball"
136,"Starc to Angelo Mathews, no run fullish delivery angling across and he pushes it to mid-off"
137,"Starc to Angelo Mathews, no run good length on middle and leg and he clips him down to midwicket"
138,"Starc to Angelo Mathews, no run short and wide and slapped away and short cover gets in the way, looked like a boundary the moment it left the bat"
139,"Starc to Angelo Mathews, no run fuller and wider and nicely driven off the middle of the bat but straight to mid-off"
140,"Lyon to Thirimanne, no run tossed up, he stays back and cuts him towards cover"
141,"Lyon to Thirimanne, no run gives it more air and he comes forward and drives to mid-off"
142,"Lyon to Thirimanne, no run ouch! Wade's hit on the shoulder, Lyon tossed it up and the batsman was forward, extra bounce, catches the thin edge (Hot Spot) and his Wade flush on the shoulder"
143,"Lyon to Thirimanne, no run tossed up and he drives him down to mid-on"
144,"Lyon to Thirimanne, FOUR runs tossed up and he has some width to work with, he rocks back and stylishly slaps it wide of point"
145,"Lyon to Thirimanne, no run tossed up and he gets well forward and defends"
146,"Starc to Angelo Mathews, no run"
147,"Starc to Angelo Mathews, no run lands it outside off and he shoulders arms, gets a nice angle across"
148,"Starc to Angelo Mathews, no run fuller delivery and he works it down to midwicket"
149,"Starc to Angelo Mathews, no run that was a half volley on the pads which he should have put away, flicked straight to midwicket"
150,"Starc to Angelo Mathews, 2 runs drifts on the leg stump and he shuffles and clips it behind square on the on side"
151,"Starc to Angelo Mathews, no run gives him width and he punches it down to mid-off, Mathews has hit quite a few good shots straight to the fielders"
152,"Lyon to Thirimanne, no run tossed up and he gets forward and defends"
153,"Lyon to Thirimanne, no run turn and bounce, he watchfully leaves it alone"
154,"Lyon to Thirimanne, no run well tossed up and he comes forward and defends"
155,"Lyon to Thirimanne, no run"
156,"Lyon to Thirimanne, SIX runs good use of the feet, Lyon tosses it up and he chips down the track and lofts cleanly over wide long-off, it was just over the rope"
157,"Lyon to Thirimanne, no run tossed up and he gets forward and defends"
158,"Starc to Angelo Mathews, no run"
159,"Starc to Angelo Mathews, OUT Hussey takes his second catch! Once again Starc doesn't take long to strike in a new spell, it was angled across the right-hander, Mathews was forward and across and the edge traveled to Hussey at second slip, in fact he took his eyes off the ball slightly before taking it"
160,"Starc to Chandimal, no run keeps it on the off stump and he comes forward and defends"
161,"Starc to Chandimal, no run bowls him the bouncer and he bends down slightly to evade it"
162,"Starc to Chandimal, FOUR runs shot! It was short and wide outside off, Chandimal wasn't going to let that go, hopped at the crease and slapped it over point"
163,"Starc to Chandimal, no run comes forward and pushes it to mid-off"
164,"Lyon to Thirimanne, no run"
165,"Lyon to Thirimanne, 3 runs tossed up and he goes back and cuts him wide of backward point for three"
166,"Lyon to Chandimal, no run flighted on the off stump and he comes forward and defends"
167,"Lyon to Chandimal, no run gets forward and across and defends"
168,"Lyon to Chandimal, no run full outside off and pushed towards cover"
169,"Lyon to Chandimal, no run quicker one and he pushes it to cover"
170,"Starc to Thirimanne, no run"
171,"Starc to Thirimanne, no run"
172,"Starc to Thirimanne, no run"
173,"Starc to Thirimanne, no run"
174,"Starc to Thirimanne, 1 run"
175,"Starc to Chandimal, no run"
176,"Lyon to Thirimanne, no run tossed up and he comes forward and defends"
177,"Lyon to Thirimanne, 3 runs that was well played in the end, tossed up from round the wicket, it bounces more and he rides the bounce and plays a controlled glide to third man"
178,"Lyon to Chandimal, no run comes forward and pushes it down to mid-off"
179,"Lyon to Chandimal, no run gets well forward and clips it down to midwicket"
180,"Lyon to Chandimal, no run tossed up and he defends back to the bowler"
181,"Lyon to Chandimal, no run"
182,"Siddle to Thirimanne, no run that's a good leave, just leaves the left-hander outside off and he watches it through to the keeper"
183,"Siddle to Thirimanne, no run chipped in the air and it just drops short of mid-on, luckily he checks the shot"
184,"Siddle to Thirimanne, no run"
185,"Siddle to Thirimanne, FOUR runs nicely driven! Fullish in length on middle and off and he drives crisply down the ground and beats mid-off"
186,"Siddle to Thirimanne, FOUR runs back to back fours! Fullish outside the off stump and he comes forward and drives him wide of cover to take him to the 90s"
187,"Siddle to Thirimanne, no run"
188,"Lyon to Chandimal, no run"
189,"Lyon to Chandimal, no run tossed up and he comes forward and defends"
190,"Lyon to Chandimal, no run"
191,"Lyon to Chandimal, FOUR runs he loves giving the spinners the charge! Tossed up and he gets to the pitch if it and launches him over mid-on"
192,"Lyon to Chandimal, FOUR runs gets down to sweep and he fetches that from outside off and places it to fine leg"
193,"Lyon to Chandimal, no run tossed up and he comes forward and knocks it to mid-on"
194,"Siddle to Thirimanne, no run fullish on middle and off and he pushes him down to mid-on"
195,"Siddle to Thirimanne, no run god length on the off stump and he stays back and defends"
196,"Siddle to Thirimanne, 1 run short of a length on middle and leg and he tucks him down to square leg"
197,"Siddle to Chandimal, no run good length outside the off stump and he pushes it softly to the off side"
198,"Siddle to Chandimal, no run good length outside the off stump and he pushes it to the off side"
199,"Siddle to Chandimal, no run moves back in slightly and he comes forward and across and pushes it towards mid-off"
200,"Lyon to Thirimanne, no run tossed up and he comes forward and defends"
201,"Lyon to Thirimanne, no run"
202,"Lyon to Thirimanne, OUT soft dismissal, good catch and Thirimanne has to go for 91! Lyon tossed it up from round the wicket, outside off, Thirimanne couldn't resist going for the uppish driver over cover, he miscued it towards cover point, Warner ran to his right from cover and timed his dive well and took the catch"
203,"Lyon to Chandimal, no run tossed up and he comes forward and pushes it to mid-on"
204,"Lyon to Chandimal, no run tossed up and clipped towards midwicket"
205,"Lyon to Chandimal, FOUR runs tossed up outside off and he has a lot of width to work with, smashes it wide of cover for a boundary"
206,"Siddle to Prasad, no run good length on the off stump and Prasad does well to defend"
207,"Siddle to Prasad, no run drifts towards the pads and he clips it to the on side"
208,"Siddle to Prasad, 2 runs gives him some width and he steers it just wide of gully"
209,"Siddle to Prasad, OUT another poor shot leads to a wicket! This was short on the off stump, Prasad tries to backhand that one over mid-on presumably, goes back at the crease and completely mistimes it, it travels low to mid-on where Starc takes a good low catch falling forward"
210,"Siddle to Herath, no run lands it outside off and he safely leaves it alone"
211,"Siddle to Herath, no run he gets across and gets an inside edge to the pads, short leg is in place"
212,"Lyon to Chandimal, no run tossed up down the leg side, he walks across his stumps and tries to sweep but misses"
213,"Lyon to Chandimal, 1 run stays back and clips it with the turn to the on side"
214,"Lyon to Herath, no run turn and bounce and he stabs at it, keeps the ball down"
215,"Lyon to Herath, no run defends close to the pads and there's a half-hearted appeal"
216,"Lyon to Herath, no run"
217,"Lyon to Herath, FOUR runs this was well played! Tossed up and he didn't have much room to cut, he goes back and slaps it jut wide of point"
218,"Siddle to Chandimal, no run too close to cut and he ends up chopping it down to point"
219,"Siddle to Chandimal, no run fuller and honing in on the off stump and he pushes this one to the bowler"
220,"Siddle to Chandimal, no run overpitched and he pushes this one down to cover"
221,"Siddle to Chandimal, no run short and wide outside off and he cuts to point"
222,"Siddle to Chandimal, no run fullish in length on the off stump and he punches it down to mid-off"
223,"Siddle to Chandimal, no run swing and a miss, this wasn't far from the off stump and the inside edge"
224,"Lyon to Herath, no run tossed up and he comes forward and defends"
225,"Lyon to Herath, no run tries to cut this one and he ends up inside edging to the pad"
226,"Lyon to Herath, no run"
227,"Lyon to Herath, no run tossed up and he gets across and pats it to the off side"
228,"Lyon to Herath, no run cuts and misses, Lyon's keeping them interested with his turn and bounce"
229,"Lyon to Herath, no run fuller delivery and he drills it to the off side"
230,"Starc to Chandimal, no run short of a length outside off and he stays back and defends"
231,"Starc to Chandimal, no run short and angling across him and he cuts him down to gully where Lyon stops it"
232,"Starc to Chandimal, no run stays back at the crease and defends"
233,"Starc to Chandimal, no run this one reared up a bit and Chandimal did well to keep it down"
234,"Starc to Chandimal, 2 leg byes drifts on the pads and he runs it down to fine leg"
235,"Starc to Chandimal, FOUR runs short and he swivels and pulls this one down to deep square leg, really controlled the pull"
236,"Lyon to Herath, 1 run risky run! Herath dropped it towards cover and there was hesitation, Chandimal sprinted and made his ground"
237,"Lyon to Chandimal, no run comes forward to drive and he gets an edge to the pads"
238,"Lyon to Chandimal, 2 runs tossed up and he's not afraid to sweep in front of square"
239,"Lyon to Chandimal, no run"
240,"Lyon to Chandimal, 1 run tossed up and he pushes it to mid-on"
241,"Lyon to Herath, no run spins back in and he shoulders arms"
242,"Starc to Chandimal, OUT Yorker! Troubles the best of them, Starc's making it a habit striking early in a spell, this was angled in beautifully from the off stump, lands on the blockhole, Chandimal wasn't quick enough to get his bat down, crashes between middle and leg"
243,"Starc to Lakmal, no run nips back and he's nearly squared up, manages to get some bat on ball"
244,"Starc to Lakmal, no run Lakmal backs away on seeing the ball pitched short, he then somehow gets some bat behind it"
245,"Starc to Lakmal, no run he backs away to a short ball and he swishes and misses it completely"
246,"Starc to Lakmal, 1 run moves away again and he ends up pushing it wide of cover"
247,"Starc to Herath, no run stays back at the crease and softly pushes it to the covers"
