,Data
210,"White to Dhoni, no run gently flighted outside off stump and he watches it go by"
211,"White to Dhoni, 1 run comes out but mistimes the shot along the ground to mid-on"
212,"White to Khan, no run flights it on a length and he nudges to the off side"
213,"White to Khan, no run well flighted, hint of drift, defended back to White"
214,"White to Khan, no run comes forward and defends this one to the man at point"
215,"White to Khan, no run short and spins in and he cuts off the back foot to point"
216,"Siddle to Dhoni, no run on a length and he runs this to backward point with ease"
217,"Siddle to Dhoni, no run slower ball, fuller in length, caressed to the man at cover"
218,"Siddle to Dhoni, no run tidy stuff and he eases forward to press it back to Siddle"
219,"Siddle to Dhoni, 1 run comes onto the front foot and pushes this into the covers"
220,"Siddle to Khan, no run beaten off a length by one that straightens, Zaheer feels for it"
221,"Siddle to Khan, no run short of a length outside off and he leaves this one be"
222,"White to Dhoni, no run quicker through the air, he stays on the back foot and keeps it away"
223,"White to Dhoni, SIX runs waltzes down the track, makes use of the flight and slams him against the turn over long-off, there were at least three fielders on the deep and he beat all of them"
224,"White to Dhoni, FOUR runs heads up! White pushes this a little flatter but that doesn't stop Dhoni from giving the charge, he smashes it flat and the ball fizzes past White and poor Asad Rauf, was that a bird or a plane?"
225,"White to Dhoni, no run quite a big spinning googly, he defends it away"
226,"White to Dhoni, no run bowls seam up, pushes that flatter and faster, he pushes it back to the bowler"
227,"White to Dhoni, OUT quite unnecessary there, White bowls seam up, Dhoni punches a skiddy delivery to Lee at mid-off and risks the single, Zaheer was always struggling and couldn't beat the throw despite the dive, Haddin whips the bails and Koertzen doesn't call for the third umpire, it was that obvious"
228,"Siddle to Dhoni, no run pushes it to the off side and farms the strike"
229,"Siddle to Dhoni, no run fires in an inswinging yorker on middle and leg and he digs it out to the deep, he refuses the single"
230,"Siddle to Dhoni, no run delivers from wide of the crease, he gets forward and taps it to the deep on the off side, no single again"
231,"Siddle to Dhoni, no run pushes it towards long-off, no run again"
232,"Siddle to Dhoni, no run gets behind the line and quietly defends it away, now he has to take a single off the last ball"
233,"Siddle to Dhoni, OUT was he a little unlucky there? A big inswinger by Siddle, Dhoni moves across his stumps and attempts to work it to the on side for a single, it appears as if he got an inside edge onto his pads, Siddle is confident and Koertzen raises the finger, that may have missed the legstump as well, I need to see another replay of that"
234,"Nevertheless, Dhoni's knock was welcome and this will prop his Test average. He looked to attack and played his natural game. Siddle has done well for himself on debut picking up 3 for 114. All he needs is more helpful conditions. Do join us shortly for the Australian reply."
235,So India finish with 469. We said earlier that if Dhoni comes good India will get somewhere close to 500. They should be happy with this but may be a trifle disappointed at how the innings ended. At least two out of the last four wickets were giveaways.
236,Haddin's the new man in
237,"Khan to Watson, no run Too wide to tempt Watson into playing a shot, he lets it go to the keeper"
238,"Khan to Watson, no run This ball is closer to off, Watson drives firmly to cover, can't find the gap though"
239,"Khan to Watson, no run a touch short on off, Watson gets on the front foot and plays it to backward point"
240,"Khan to Watson, 1 run bouncer but misdirected and not very quick either, that was down the leg side and Watson goes the pull, doesn't quite time it as it runs away towards fine leg"
241,"Khan to Hussey, no run draws Hussey onto the front foot and he defends it to cover"
242,"Khan to Hussey, 1 run shorter this time, and slightly outside off, Hussey steers it towards point where a lazy Sehwag misfields to give away a single"
243,"Sharma to Hussey, no run good length from Ishant, Hussey punches it confidently to point"
244,"Sharma to Hussey, 2 runs just outside off, Hussey opens the face and works it away towards point again, excellent running gets the batsmen two runs"
245,"Sharma to Hussey, 2 runs That's Hussey's fifty, banged in short by Ishant, Hussey pulls it, god placement but it was stopped by Zaheer at the boundary"
246,"Sharma to Hussey, FOUR runs Nearly out! Ishant gets the outside edge from a ball that angle across Hussey, drops short of Dravid at first slip"
247,"Sharma to Haddin, no run length ball on off, kept a touch low, Haddin defends it towards cover"
248,"Khan to Watson, no run attempted yorker results in a waist high full toss, Watson defends it comfortably, Zaheer apologises immediately"
249,"Khan to Watson, no run back of a length delivery, punched firmly by Watson towards mid-off"
250,"Khan to Watson, no run This ball goes across Watson who shoulders arms to it"
251,"Khan to Watson, no run Watson doesn't have to play at that one either as it well wide of off stump"
252,"Khan to Watson, no run better line this time, on off and Watson defends it solidly on the front foot"
253,"Khan to Watson, no run length ball on middle, Watson punches it back to the bowler"
254,"Sharma to Haddin, no run back of a length, stayed low on Haddin, just about managed to defend that one"
255,"Sharma to Haddin, no run Haddin jumps and defends another length ball on off stump"
256,"Sharma to Haddin, no run Good line and length again from Ishant, Haddin punches it to mid-on"
257,"Sharma to Haddin, 2 leg byes full delivery, strays onto leg stump, raps his pads and trickles away behind square"
258,"Sharma to Haddin, no run back of a length, in the channel outside off, Haddin tries to force it down the ground but doesn't time it very well"
259,"Sharma to Haddin, no run some movement into Haddin, stayed a bit low again, Haddin defends"
260,"Khan to Watson, no run Zaheer tries the bouncer, Watson's ducks under it"
261,"Khan to Watson, 1 run bangs it in short again, Watson pulls firmly and square leg umpire Rudi Koertzen can't get out of the way in time. He's doesn't seem hurt though and even manages a chuckle"
262,"Khan to Haddin, no run defended solidly by Haddin"
263,"Khan to Haddin, FOUR runs that was close, Haddin gets an inside edge and it races away just inches past his leg stump"
264,"Khan to Haddin, no run driven firmly to mid-off but doesn't beat the fielder"
265,"Khan to Haddin, 1 run played with soft hands towards point, Haddin sets off straightaway for the single"
266,"Sharma to Haddin, no run Ishant keeps nagging away just outside the off stump, Haddin defends it back to the bowler"
267,"Sharma to Haddin, no run similar delivery, just a hint of away movement, Haddin gets on the front foot and plays it to cover"
268,"Sharma to Haddin, no run Ishant maintains a tight line, Haddin gets behind the line of the delivery and defends"
269,"Sharma to Haddin, no run Ishant brings out the slower delivery, ends up as a full toss, Haddin was a touch surprised by it and can't capitalise on that one"
270,"Sharma to Haddin, 1 run Ishant reverts to a good length on off, Haddin inside-edges it to square leg for a single"
271,"Sharma to Watson, no run full delivery outside off, Watson shoulders arms"
272,"Khan to Haddin, no run good line and length, defended to mid-off"
273,"Khan to Haddin, no run slightly wider this time, Haddin wanted to power it down the ground, timing was awry and it trickles to mid-off"
274,"Khan to Haddin, no run length delivery on off stump, defended solidly by Haddin"
275,"Khan to Haddin, no run A rare loose ball, short and wide, Haddin chases it and slaps it hard but can't beat the cover point fielder"
276,"Khan to Haddin, 1 run short ball and Haddin pulls it, Ishant does the fielding at backward square leg"
277,"Khan to Watson, no run Good leave from Watson, back of a length ball, angling across him, that wasn't too far from off stump"
278,"Harbhajan to Haddin, no run starts off with a length delivery on off, Haddin defends towards the leg side"
279,"Harbhajan to Haddin, no run shorter, bit more flight, gets some turn, Haddin plays it to short leg"
280,"Harbhajan to Haddin, no run similar ball, Haddin defends again to the leg side"
281,"Harbhajan to Haddin, 1 run flighted delivery on the off, turning in, Haddin pushes it to leg"
282,"Harbhajan to Watson, no run Waston gets on the back foot and tries to turn it past the short leg but doesn't beat the man there"
283,"Harbhajan to Watson, no run Big stride in from Watson as he confidently defends"
284,"Khan to Haddin, 1 run full ball, down the leg side, Haddin manages to work it to the right of mid-on, quick single is taken"
285,"Khan to Watson, FOUR runs opened him up with a short of length ball angling across him, gets the outside edge, but doesn't carry to Dhoni and races away behind him and first slip for a boundary"
286,"Khan to Watson, no run Wide outside off and Watson decides to leave that delivery alone"
287,"Khan to Watson, no run Watson shoulders arms again as Zaheer sends it too far outside the off stump to trouble the batsman"
288,"Khan to Watson, no run back of a length, on middle and off this time, Watson defends it back to the bowler"
289,"Khan to Watson, no run Another I'm-not-interested-in-that leave from Watson as Zaheer fires it wide outside off"
290,"Harbhajan to Haddin, no run tossed up, on a length outside off, inside edged towards midwicket"
291,"Harbhajan to Haddin, no run Haddin uses his feet to try unsettle the bowler, but the length was too short and he plays it back to the bowler"
292,"Harbhajan to White, no run White gets on the front foot defends his first ball"
293,"Harbhajan to White, no run A repeat of the previous ball, Harbhajan is flighting his deliveries now and getting it to land on a great length just outside off"
294,"Harbhajan to White, no run plays it to silly point"
295,"Khan to Watson, FOUR runs length ball, not too far outside off, Watson gets on the front foot and square drives it for a boundary. Lot of runs behind point today"
296,"Khan to Watson, no run on middle and leg, pushed firmly to midwicket"
297,"Khan to Watson, no run outside off, and Watson lets that go through to the keeper"
298,"Khan to Watson, no run overpitched delivery, Waston was provided the width and he went after it but the timing was poor and it goes to the fielder at cover"
299,"Khan to Watson, FOUR runs Back of a length, bit of width, Watson opens the face of the bat and guides the ball between the slips for another boundary in the third-man region"
300,"Khan to Watson, no run length ball, inside edge on to the pads, stifled appeal from the bowler"
301,"Harbhajan to White, no run more flight from Harbhajan, White defends off the front foot"
302,"Harbhajan to White, no run similar delivery and the man at short leg is having to do some work as the batsmen keep defending"
303,"Harbhajan to White, no run defence, to the slip this time"
304,"Harbhajan to White, no run fuller ball, on off and middle, White tries to work it away toward square leg, but doesn't quite get hold of it"
305,"Harbhajan to White, no run patted to the leg side this time"
306,"Harbhajan to White, no run Watson punches it to cover, can't the pierce the field"
307,"Mishra to Watson, no run oooh, a legspinner's dream delivery, tossed up, on a length, drawa Watson on the front foot and the big turn beats his front foot defence"
308,"Mishra to Watson, no run outside off, Watson lets that go"
309,"Mishra to Watson, no run driven to cover this time, no run though"
310,"Mishra to Watson, 1 run glanced to backward square leg"
311,"Mishra to White, no run full delivery, getting good dip, White works it away to backward point"
312,"Mishra to White, 1 run gets the outside edge as White looks to defend on the front foot, ball runs away to short third man"
313,"Harbhajan to White, no run White smothers the ball with his front-foot defence"
314,"Harbhajan to White, no run tapped to the short leg fielder this time"
315,"Harbhajan to White, no run Batsmen are being kept quiet here. Watson pushes it to the leg side. You can feel the pressure building"
316,"Harbhajan to White, no run this time he pats it to silly point"
317,"Harbhajan to White, no run blocked back to the bowler"
318,"Harbhajan to White, no run Leg-stump line but White doesn't go for a big shot. He pushes it towards mid-on"
319,"Mishra to Watson, FOUR runs Mishra strays on to the pads and Watson manges to get a bit of bat on it and it runs away fine for a boundary"
320,"Mishra to Watson, no run gets it on middle this time, defended off the back foot"
321,"Mishra to Watson, no run"
322,"Mishra to Watson, 2 runs punched past midwicket, Tendulkar does the retrieving"
323,"Mishra to Watson, no run played back to the bowler"
324,"Mishra to Watson, no run driven to short cover, can't find the gap"
325,"Harbhajan to White, no run on middle and leg, White defends it back to the bowler"
326,"Harbhajan to White, 1 run more flight this time, White drives and it was a bit uppish but wide to the bowler's right"
327,"Harbhajan to Watson, no run played towards the cover"
328,"Harbhajan to Watson, 1 run bog turn from a length outside off, Watson gets on the back foot and turns it square on the leg side"
329,"Harbhajan to White, no run More flighted stuff from Harbhajan, and more front-foot defence from White"
330,"Harbhajan to White, 1 run on middle and leg, White nurdles it past midwicket for a single to retain the strike"
331,"Mishra to White, 2 runs on a length, pitched just outside off, White plays it with soft hands to cover, batsmen go for a quick single, Sehwag attempts to throw stumps down at the batsman's end but misses and concedes an overthrow"
332,"Mishra to Lee, no run Lenght delivery pitching outside off, Lee tries to block off the front foot, gets an outside edge and it runs away towards point"
333,"Mishra to Lee, no run far more solid defence from Lee this time"
334,"Mishra to Lee, no run topspinner from Mishra and Lee wasn't too comfortable dealing with the extra bounce, he inside-edges it on to his pads"
335,"Mishra to Lee, no run pitched outside leg, Lee attempts to sweep, misses completely and is hit in front of the stump, Mishra appeals but that's not out"
336,"Harbhajan to Watson, 1 run tossed up, punched to cover for a quick single"
337,"Harbhajan to Lee, no run another appeal for lbw, tossed up and raps his pads in front of middle and leg, but that would have gone done leg"
338,"Harbhajan to Lee, no run comes down the track this time and looks for the big drive, timing isn't great and the ball goes back to the bowler"
339,"Harbhajan to Lee, 1 run Another looping delivery, swept to backward square leg"
340,"Harbhajan to Watson, no run Watson gets behind the line of that and defends"
341,"Harbhajan to Watson, no run tries to work it to third man"
342,"Mishra to Lee, no run Lee comes down the pitch and punches it to cover"
343,"Mishra to Lee, FOUR runs poor delivery, short ball down the leg side, Lee helps it away fine behind square and it beats Ganguly to the boundary"
344,"Mishra to Lee, no run much better ball, good loop, pitching on middle and leg and spinning away, defended by the batsman"
345,"Mishra to Lee, no run Lee's attempted front foot defence is beaten comprehensively by a big turner"
346,"Mishra to Lee, no run Lee pushes it towards cover, no chance of a single as it goes straight to the fielder"
347,"Mishra to Lee, (no ball) no-ball, a length ball on off, worked away towards point"
348,"Mishra to Lee, no run good length, just outside off, prodded towards point"
349,"Harbhajan to Watson, no run doosra from Harbhajan, Watson was opened up by that one as he tried to defend off the back foot"
350,"Harbhajan to Watson, no run much more convincing from Watson as he taps it to silly point"
351,"Harbhajan to Watson, no run tossed up, just outside off, extra bounce and Watson is hit on the glove but down to the ground, great delivery from Harbhajan"
352,"Harbhajan to Watson, no run defended confidently by Watson"
353,"Harbhajan to Watson, no run punched to mid-on, Watson thought of going for a single but decided against it"
354,"Harbhajan to Watson, no run Flatter, pitching on off, Watson works it to the leg side"
355,"Mishra to Lee, no run flighted delivery on the stumps, Lee drives it to cover"
356,"Mishra to Lee, no run Mishra tosses it up and is overpitched outside off, Lee smashes it straight to point"
357,"Mishra to Lee, no run on off, Lee pushes it down the ground"
358,"Mishra to Lee, no run flighted again, Lee defends solidly"
359,"Mishra to Lee, no run more solid defence from Lee"
360,"Mishra to Lee, no run driven straight to the fielder at mid-off"
361,"Harbhajan to Watson, no run Harbhajan starts well, with a delivery that draws Watson onto the front foot as he defends"
362,"Harbhajan to Watson, no run flighted again, huge turn from outside off, Watson shoulders arms"
363,"Harbhajan to Watson, 1 run Watson pushes it firmly to mid-on"
364,"Harbhajan to Lee, no run on a length, on middle and leg, Lee uses his feet and punches it to mid-on"
365,"Harbhajan to Lee, no run big stride in as Lee defends it to the off side"
366,"Harbhajan to Lee, no run a touch shorter, drifting on to the pads, Lee turns it to square leg"
367,"Mishra to Watson, 1 run overpitched, just outside off, driven to covers"
368,"Mishra to Lee, 2 runs on off again, and Lee punches it down the ground with superb timing, straight past the bowler, Zaheer just about manages to pull it back in"
369,"Mishra to Lee, no run overpitched, on middle and leg this time, Lee gets his front foot out of the way and defends"
370,"Mishra to Lee, no run patted back to the bowler"
371,"Mishra to Lee, no run Stifled appeal from the bowler but that was going down leg after pitching on leg and middle"
372,"Mishra to Lee, no run defended solidly back to the bowler"
373,"Harbhajan to Watson, no run flighted delivery, Waston gets behind the line and defends"
374,"Harbhajan to Watson, no run full ball, just outside off, tapped towards the leg side"
375,"Harbhajan to Watson, no run Watson's hardly getting the ball off the square, mostly solid defence as in this delivery"
376,"Harbhajan to Watson, no run back-foot defence from Watson this time"
377,"Harbhajan to Watson, no run gets a big stride in as he blocks the ball"
378,"Harbhajan to Watson, 2 runs turned to deep square leg for a couple"
379,"Mishra to Lee, 1 run Lee didn't have much of an idea where that went, tossed up and pitched on leg, Lee tried to work it to midwicket but gets the edge and it flies towards point"
380,"Mishra to Watson, 1 run shorter ball, going straight after pitching on middle and leg, Lee punches it towards mid-on"
381,"Mishra to Lee, FOUR runs drops short again, provides width this time, Lee rocks onto the backfoot and crashes through in front of point for four"
382,"Mishra to Lee, no run Mishra responds with a googly, pitching well outside off, defended well by Lee"
383,"Mishra to Lee, no run that kept a touch low as Lee gets right back to defend"
384,"Mishra to Lee, no run gets on the front foot and blocks it"
385,"Harbhajan to Watson, no run pitching on a length, outside off, Watson exhibits his front-foot defence again"
386,"Harbhajan to Watson, no run a bit of extra bounce, Watson gets on the back foot to defend this time"
387,"Harbhajan to Watson, no run patted back to the bowler"
388,"Harbhajan to Watson, no run gets inside the line of the ball and taps it to short leg"
389,"Harbhajan to Watson, no run More solid defence from Watson, getting behind the line"
390,"Harbhajan to Watson, no run played back to the bowler, a maiden from Harbhajan"
391,"Mishra to Lee, no run tossed up, on a length outside off, Lee comes down the track and drives firmly to mid-off"
392,"Mishra to Lee, no run front foot defence this time from Lee"
393,"Mishra to Lee, no run pitching on middle and leg, Lee plays it cautiously back to the bowler"
394,"Mishra to Lee, no run length delivery, pitching on leg, Leestays on the back foot and defends awkwardly"
395,"Mishra to Lee, no run defended back to the bowler again"
396,"Mishra to Lee, no run Lee uses his feet and drives but can't get the ball past Mishra"
397,"Harbhajan to Watson, no run length ball, just outside off, Watson blocks it off the front foot"
398,"Harbhajan to Watson, 4 leg byes sliding down the line this time, raps Watson's pads and run away fine down the leg side for a boundary"
399,"Harbhajan to Watson, no run length ball but Watson stays on the back foot and defends"
400,"Harbhajan to Watson, 1 run again on his legs, Watson nudges it around for a single behind square"
401,"Harbhajan to Lee, no run better line this time, on off, Lee prods it towards cover"
402,"Harbhajan to Lee, no run defended by Lee off the front foot, gets an inside edge and rolls towards short mid-on"
403,"Mishra to Watson, no run defended off the front foot by Watson"
404,"Mishra to Watson, no run length ball outside off, Watson guides it towards point, though of a single but decided against it"
405,"Mishra to Watson, no run defended down to the fielder at short third man"
406,"Mishra to Watson, no run Watson gets right back and shows the full face of the bat to defend a length delivery on middle"
407,"Mishra to Watson, no run more solid defence from Watson"
408,"Mishra to Watson, no run a bit of extra bounce for Mishra, Watson gets an edge when trying to block the ball, there was no silly point to collect that"
409,"Harbhajan to Lee, no run defended confidently to the off side"
410,"Harbhajan to Lee, no run Harbhajan keeps Lee quiet with another ball on a length pitching just outside off"
411,"Harbhajan to Lee, no run Lee gets into a bit of a tangle as he tries to defend that one, inside edge that goes towards short mid-on"
412,"Harbhajan to Lee, no run"
413,"Harbhajan to Lee, no run Lee gets a big stride it and taps it silly point"
414,"Harbhajan to Lee, no run and again, Lee blocks it confidently"
415,"Mishra to Watson, 1 run tossed up, slightly overpitched, Watson comes down the track and works it into the gap through cover"
416,"Mishra to Lee, no run shorter this time, and a bit of width, Lee trie to crack that through covers but couldn't quite get hold of it"
417,"Mishra to Lee, no run flatter delivery, not much turn after pitching just outside off, Lee handles that comfortably, blocking off the front foot"
418,"Mishra to Lee, FOUR runs flighted this time, Lee comes down the track, gets to the pitch and creams it down the ground for a superb boundary"
419,"Mishra to Lee, no run defended off the front foot"
420,"Mishra to Lee, FOUR runs length ball outside off, Lee comes down the track again,and lofts it over mid-off, second boundary in three balls"
421,"Sharma to Watson, no run Watson is hit on the pads off Ishant's first ball, huge appeal from the bowler, pitched just outside off, hit low on the pads within the stumps, umpire might have thought there was an inside edge"
422,"Sharma to Watson, no run full, outside off, driven back to the bowler"
423,"Sharma to Watson, no run length delivery, slightly outside off, defended towards cover"
424,"Sharma to Watson, no run similar delivery from Ishant, Watson works it away towards point"
425,"Sharma to Watson, 2 runs back of a length, on middle and leg, turned towards square leg, superb running fetches the batsmen two, and Watson is now level with his highest Test score"
426,"Sharma to Watson, 1 leg bye Rapped on the pads again, that was sliding down the leg side"
427,"Mishra to Watson, SIX runs a long hop from Mishra, Watson gets his front foot out of the way and clobbers that over midwicket"
428,"Mishra to Watson, no run Watson reverts to watchful front-foot defence"
429,"Mishra to Watson, 1 run pushed down the ground, Waston wants a single and gets it"
430,"Mishra to Lee, no run googly from Mishra, Lee blocks it off the front foot"
431,"Mishra to Lee, no run Lee's gaining confidence here, using his feet and cracks it straight back, Mishra manages to stop it"
432,"Mishra to Lee, no run some turn for Mishra, pitched on middle, Lee gets a thick outside edge and the ball trickles towards backward point"
433,"Sharma to Watson, FOUR runs back of a length and outside off, Watson dispatches that in front of square to bring up his first Test fifty"
434,"Sharma to Watson, no run slower ball from Ishant, 103.1 kmph, but wasn't quite on target, well outside off and Watson leaves that alone"
435,"Sharma to Watson, 1 run back of a length, in the corridor outside off, Watson opens the face of teh bat to guide it to third man where Sachin Tendulkar has some ground to cover before cutting it off"
436,"Sharma to Lee, no run punched firmly to cover point by Lee"
437,"Sharma to Lee, no run short ball, very wide, Lee goes for the cut but doesn't make contact"
438,"Sharma to Lee, no run on off stump, shortish ball, Watson plays it to the right of cover point, thinks of a single but decides against it"
439,"Khan to Watson, 1 run Starts off with a delivery down leg side, Watson turns it away square and Ishant Sharma does the fielding"
440,"Khan to Lee, no run on off stump this time, Lee an inside edge and the ball rolls away behind sqaure on the leg side"
441,"Khan to Lee, FOUR runs What a shot to bring up the fifty partnership. Lee hardly put any effort behind that straight drive, great timing sees it race to the boundary."
442,"Khan to Lee, no run Superb comeback from Zaheer, yorker on leg stump, Lee manages to dig it out towards square leg"
