,Data
248,"Bird to Lakmal, no run Lakmal's playing only one way, he makes room and swishes and misses"
249,"Bird to Lakmal, no run seems determined to give his wicket away, pokes at one moving away and misses"
250,"Bird to Lakmal, 1 run makes room and he slashes and the top edge clears the slips and goes to third man"
251,"Bird to Herath, OUT and that's the end of Herath, he has gone for a big heave and skied the ball to mid-off, Peter Siddle takes a comfortable catch. This could end quickly now for Sri Lanka"
252,"Bird to Lakmal, no run keeps a yorker out nicely"
253,"Bird to Lakmal, no run left alone outside off"
254,"Starc to Pradeep, no run Starc is around the wicket to Pradeep, who awkwardly fends off a short ball"
255,"Starc to Pradeep, no run another short ball and Pradeep is able to duck underneath it"
256,"Starc to Pradeep, no run way down the leg side here. All Starc really needs to do is get it on line and Pradeep may be in trouble"
257,"Starc to Pradeep, no run again, no shot required from Pradeep"
258,"Starc to Pradeep, FOUR runs full and straight and Pradeep has managed not only to keep it out, he has clipped it through midwicket for a boundary! He now has one-quarter of his highest ever first-class score"
259,"Starc to Pradeep, 1 run tries to leave this one alone outside off but the ball runs off his bat behind point"
260,"Bird to Pradeep, no run defended away to the off side"
261,"Bird to Pradeep, no run Bird gets one to move away outside off and Pradeep goes the drive but can't connect"
262,"Bird to Pradeep, no run worked off the hips towards square leg"
263,"Bird to Pradeep, no run that's an old-fashioned tail-ender's heave, he's tried to clear long on but hasn't made contact, the ball sails through to Wade"
264,"Bird to Pradeep, no run beaten again as Pradeep flashes outside off"
265,"Bird to Pradeep, no run again, Bird just can't find the edge and this one beats the bat of Pradeep once more"
266,"Johnson to Mahela Jayawardene, no run sprays that full and wide and Warner does well to slide at backward point and cut that off"
267,"Johnson to Mahela Jayawardene, no run angles it across the right-hander, he's not interested in chasing that"
268,"Johnson to Mahela Jayawardene, no run Johnson switches to a fuller length and still Jayawardene offers no shot"
269,"Johnson to Mahela Jayawardene, no run and expectedly bowls the bouncer, two men in the deep and the batsman ducks"
270,"Johnson to Mahela Jayawardene, no run fullish in length outside the off stump and he goes well across and defends to the off side"
271,"Johnson to Mahela Jayawardene, no run loss of concentration there, he wanted to leave the ball but ended up knocking it on the bounce to slip"
272,"Lyon to Thirimanne, no run comes forward a touch late and defends"
273,"Lyon to Thirimanne, no run gives it a lot of air and he comes forward and defends"
274,"Lyon to Thirimanne, no run flighted outside off and pushed to the covers"
275,"Lyon to Thirimanne, no run gives himself a bit of room to drive past cover but can't squeeze it past the fielder"
276,"Lyon to Thirimanne, no run tossed up and he comes forward and defends"
277,"Lyon to Thirimanne, no run goes for another cover drive and he misses it completely, Lyon teases him in flight"
278,"Starc to Lakmal, no run Starc still coming around the wicket and aims for the stumps, Lakmal backs off and connects, just driving back to the bowler"
279,"Starc to Lakmal, 1 wide bouncer and an extraordinary swipe from Lakmal, who almost plays with a vertical bat above his head as he tries to swat this away - instead it sails through and Wade jumps up to save some byes. But it is called a wide"
280,"Starc to Lakmal, no run Starc comes over the wicket now and Lakmal defends"
281,"Starc to Lakmal, no run another swing and a miss as Starc bounces this one too far over the stumps"
282,"Starc to Lakmal, no run full and wide of off and another one goes through to Wade"
283,"Starc to Lakmal, 1 run full and straight and driven towards mid off, the batsmen take off for a run that perhaps isn't there, but Siddle's throw to the striker's end is off target"
284,"Starc to Pradeep, no run off a thick edge towards point"
285,"Bird to Lakmal, no run banged in short and this one lobs off the shoulder of the bat, but lands safely short of point"
286,"Bird to Lakmal, no run again this one beats the outside edge"
287,"Bird to Lakmal, no run Bird is wondering how this wicket isn't coming - Lakmal goes for a huge heave and this ball almost kisses the off stump as it goes through to Wade. So, so close"
288,"Bird to Lakmal, no run swing and a miss. Again."
289,"Bird to Lakmal, no run much too wide from Bird now, Lakmal does try to swing at this but can't reach it as he's backing away a bit from leg stump"
290,"Bird to Lakmal, no run outside off, keeps low and another one that is not interrupted by bat on its way to Wade"
291,"Johnson to Pradeep, FOUR runs welcome back Mitchell Johnson! Pradeep slams this down the ground to long-on for a boundary!"
292,"Johnson to Pradeep, no run a big swing now from Pradeep and this ball just goes over the top of off stump, and perhaps a fraction wide of it as well"
293,"Johnson to Pradeep, no run full and straight and Pradeep is keeping those ones out, really frustrating the Australians. He drives this one to cover"
294,"Johnson to Pradeep, no run defended now back down the pitch"
295,"Johnson to Pradeep, 3 runs there's the double figures for Pradeep! He doesn't raise the bat though. Drives this one down the ground wide of mid off"
296,"Johnson to Lakmal, 2 runs on the pads now and Lakmal pushes a couple of runs through the leg side"
297,"Bird to Pradeep, FOUR runs Bird goes for the yorker but overpitches and this turns out as a full toss on the pads, Pradeep flicks it through midwicket for a boundary. And that's equalled his highest first-class score."
298,"Bird to Pradeep, 1 run bouncer, tries for the pull but it lobs short of cover, they take a single and that is Nuwan Pradeep's best score in a 41-match first-class career"
299,"Bird to Lakmal, no run pushed away towards point"
300,"Bird to Lakmal, OUT there's the breakthrough at last, Bird finally draws an edge and this one is taken by Michael Hussey at second slip moving to his right. Bird finishes with four wickets and the late finish means Australia won't have to bat tonight"
301,"Thanks for joining us. Plenty to read in the coming hours on this game, starting with the report. Do join us tomorrow and thanks for your company!"
302,"Day 1: That means Australia will start fresh first thing tomorrow morning. A good day for the hosts after winning the toss. Their fast men, barring Johnson, have contributed. Sri Lanka will be disappointed with this considering they had two batsmen who passed fifty and looked set to score more. They will look back at some shots with regret. There"
303,Last ball before tea
304,"Pradeep to Clarke, 1 run hits a good length outside off and he steers it down to point"
305,"Pradeep to Hussey, no run good length outside off and he works it down to point"
306,"Pradeep to Hussey, no run good length on the pads and he tucks it away to the on side"
307,"Pradeep to Hussey, no run 135 kph, lands it outside off and he safely shoulders arms"
308,"Pradeep to Hussey, no run 135 kph, drifts on the pads and he punches it back to the bowler and tells his partner to wait"
309,"Pradeep to Hussey, 3 runs ends the session with a neat cover drive, half volley outside off and he finds the gap, pulled back before the rope"
310,"Dilshan to Hussey, 1 run tossed up and he gets forward and drives to mid-off"
311,"Dilshan to Clarke, no run spins back in and he clips it straight to short leg"
312,"Dilshan to Clarke, no run takes a few paces down the track and defends"
313,"Dilshan to Clarke, no run tossed up and he gets forward and defends"
314,"Dilshan to Clarke, 1 leg bye strays on the pads and he knocks it away to the leg side off the pads"
315,"Dilshan to Hussey, no run gets forward and drives towards the bowler"
316,"Prasad to Clarke, no run gets some late inward movement and he comes well behind the line and defends"
317,"Prasad to Clarke, 1 run he drives a half volley down to sweeper cover for a single"
318,"Prasad to Hussey, no run good length on the middle stump and he pushes it to the on side"
319,"Prasad to Hussey, 2 runs fullish on the off stump and he drives well wide of cover"
320,"Prasad to Hussey, no run fuller in length on the off stump and he drills it back to the bowler"
321,"Prasad to Hussey, 1 run full and wide outside off and he gets forward, drives him to sweeper cover"
322,"Dilshan to Hussey, 1 run tossed up and he drives just wide of one of the two short covers in place for the chipped drive"
323,"Dilshan to Clarke, no run tossed up and he works it towards mid-on"
324,"Dilshan to Clarke, 1 run tossed up and he gets across and drives back to the bowler"
325,"Dilshan to Hussey, no run slower through the air and steered towards point"
326,"Dilshan to Hussey, 1 run shorter outside off and he punches it down to cover"
327,"Dilshan to Clarke, no run down the track and he clips it with the turn back to the bowler"
328,"Prasad to Hussey, no run fullish outside the off stump and he pushes it to the off side"
329,"Prasad to Hussey, 1 run fullish outside the off stump and he drives him wide of cover"
330,"Prasad to Wade, no run bangs in the bouncer and he ducks under it"
331,"Prasad to Wade, 1 wide hits the deck harder and he is penalised for the bouncer"
332,"Prasad to Wade, no run good length outside off and he leaves it alone"
333,"Prasad to Wade, no run bowls it short but it doesn't bounce as much, bends down and evades it"
334,"Dilshan to Clarke, 1 run tossed up and he tucks it towards midwicket"
335,"Dilshan to Wade, no run defends back to the bowler"
336,"Dilshan to Wade, no run flighted on middle and he comes forward and defends"
337,"Dilshan to Wade, no run turn and bounce and Wade defended that very awkwardly"
338,"Dilshan to Wade, 2 runs stays back at the crease and he cuts him down to deep point, sweeper cuts it off"
339,"Dilshan to Wade, no run tossed up and he comes forward and defends"
340,"Prasad to Clarke, 1 run tucked away wide of midwicket and they think of the second run but wisely opt out of it, how many more run outs do we need?"
341,"Prasad to Wade, no run this one keeps a bit low outside off and it sneaks past the edge, Chandimal tumbles as he collects it"
342,"Prasad to Wade, no run angling across him and he taps it towards cover"
343,"Prasad to Wade, no run bangs in the bouncer and he ducks under that one"
344,"Prasad to Wade, no run short of a length and he steers it to the off side"
345,"Prasad to Wade, 1 run hits the deck hard and he swivels and pulls him along the ground to deep square leg"
346,"Dilshan to Wade, 1 run comes well forward and defends to the off side"
347,"Dilshan to Clarke, 1 run flighted a bit more and he changes his mind and knocks it wide of midwicket"
348,"Dilshan to Wade, 2 runs tossed up and he comes forward and drives him wide of cover"
349,"Dilshan to Wade, FOUR runs nicely placed! Tossed up outside off, drops it wide of the off stump and he goes back and cuts him wide of point, wide of the sweeper"
350,"Dilshan to Wade, no run Chance! Drops short of Thirimanne at short leg, he was forward to defend and it went quite quickly to the fielder, he could have caught it if his hands moved quickly to his left"
351,"Dilshan to Wade, 1 run reaches forward and drives wide of cover"
352,"Prasad to Wade, no run this one keeps a bit low and moves away from him"
353,"Prasad to Wade, 1 run fuller delivery and he clips him wide of midwicket"
354,"Prasad to Clarke, no run hits the deck hard and he ducks under that bouncer"
355,"Prasad to Clarke, no run this one nips back in and hits him above the thigh pad, too high, Prasad creating a chance there"
356,"Prasad to Clarke, 1 wide bowls him a bouncer and it's called a wide, marginal call"
357,"Prasad to Clarke, 1 run bangs it in short and he swivels and pulls him down to deep square leg"
358,"Prasad to Wade, no run good length shaping away from him and he steers it to the off side"
359,"Dilshan to Clarke, 1 run works it away with the turn to the on side"
360,"Dilshan to Wade, no run bashes a low full toss back to the bowler"
361,"Dilshan to Wade, no run this was shorter and he made room to cut and missed, that was close"
362,"Dilshan to Wade, no run tossed up outside off and he thrusts his pad forward and blocks it out"
363,"Dilshan to Wade, no run this one drifts in and skids and he manages to punch it away"
364,"Dilshan to Wade, no run tossed up and he comes forward and defends"
365,"Lakmal to Clarke, no run Lakmal bowls it full and wide on the off stump and he drives him down to cover"
366,"Lakmal to Clarke, 1 run fullish in length outside off and he pushes it wide of cover to bring up his fifty - new year, old form"
367,"Lakmal to Wade, no run fuller in length outside off and he stays back and leaves it alone"
368,"Lakmal to Wade, no run fuller delivery and he leaves it alone to the keeper"
369,"Lakmal to Wade, no run comes round the wicket, hits the channel outside the off stump and he leaves it alone"
370,"Lakmal to Wade, no run punched towards cover and Wade wanted the single and Clarke sent him back, not worth the risk"
371,"Herath to Clarke, no run tossed up and he comes forward and defends"
372,"Herath to Clarke, OUT Clarke plays a rash shot and Karunaratne takes a well-judged catch! Tossed up and Clarke decided to play the slog sweep, wasn't in control and the top edge swirled to midwicket, Karunaratne pedaled back, kept his eyes on it and cupped it over his head, was in control as he tumbled"
373,"Herath to Wade, no run flatter delivery and he defends"
374,"Herath to Wade, no run turn this time! Shuffles and the ball drops somewhere close to the stumps"
375,"Herath to Wade, no run gets across and pushes it to the off side"
376,"Herath to Wade, no run flatter delivery and he pushes it to the off side"
377,"Lakmal to Johnson, no run lands it a shade outside off and he safely leaves it alone"
378,"Lakmal to Johnson, no run this one climbs up and Johnson was fending at it, didn't account for the extra bounce, close to the edge"
379,"Lakmal to Johnson, no run angles it across him and he safely leaves it alone"
380,"Lakmal to Johnson, no run comes round the wicket, angles it in ans he stays behind the line and knocks it to the off side"
381,"Lakmal to Johnson, no run on the helmet! Johnson took his eyes off the short ball, he looked to pull but wasn't quick enough, he's fine now"
382,"Lakmal to Johnson, FOUR runs and responds with a four! He was hit on the helmet the ball before, Lakmal erred by bowling a half volley on the pads which he whipped wide of midwicket"
383,"Herath to Wade, no run tossed up and he gets forward and defends"
384,"Herath to Wade, no run leaves this alone to the keeper and it doesn't turn much"
385,"Herath to Wade, no run comes forward and defends in front of middle"
386,"Herath to Wade, no run flatter delivery and he gets forward and defends"
387,"Herath to Wade, 2 runs spins back in and he tucks it with the turn to the on side"
388,"Herath to Wade, 1 run tossed up and he comes forward and clips it to the on side"
389,"Lakmal to Wade, no run lands it outside the off stump and he safely leaves it alone"
390,"Lakmal to Wade, no run fuller in length and he comes forward and defends down the track"
391,"Lakmal to Wade, no run hits a good length outside off and he safely leaves it alone"
392,"Lakmal to Wade, no run fuller in length on the off stump and he comes forward and pushes it to the off side"
393,"Lakmal to Wade, no run lands it outside the off stump and he leaves this alone"
394,"Lakmal to Wade, 1 run fuller in length outside the off stump and he comes across and pushes it to sweeper cover"
395,"Herath to Wade, 1 run tossed up on middle and leg and he drives down the ground to mid-on"
396,"Herath to Johnson, no run tossed up outside off and he safely shoulders arms"
397,"Herath to Johnson, no run tosses it up and he comes forward and defends"
398,"Herath to Johnson, no run gets good drift and he comes forward and defends"
399,"Herath to Johnson, no run"
400,"Herath to Johnson, 1 run quicker delivery and he steers it towards point for a single"
401,"Pradeep to Johnson, no run shapes it across and he stays beside the line and punches it to the off side"
402,"Pradeep to Johnson, 3 runs good length shaping across him and he times the punch well past point"
403,"Pradeep to Wade, no run stays beside the line and he steers him down to gully"
404,"Pradeep to Wade, no run 134.4 kph, seemed quicker than than, the length delivery kicks up outside off"
405,"Pradeep to Wade, no run switches to a fuller length outside off and he comes forward and blocks it out"
406,"Pradeep to Wade, 1 run comes forward and pushes it wide of cover for a single"
407,"Herath to Wade, 3 runs tossed up outside off and he comes forward and he goes back and he plays it to third man"
408,"Herath to Johnson, 1 run tossed up and he clips it wide of midwicket"
409,"Herath to Wade, no run tossed up and he comes forward and defends"
410,"Herath to Wade, 1 run tossed up and he comes forward and pushes it to the off side and he clips it to short leg"
411,"Herath to Johnson, no run"
412,"Herath to Johnson, no run tossed up and he clips it towards midwicket"
413,"Pradeep to Wade, no run stays beside the line and he steers it to the off side"
414,"Pradeep to Wade, no run hits a good length on off and he punches it to the off side"
415,"Pradeep to Wade, (no ball) appeal for a caught behind and he is given not out and Mahela calls for the review. But Pradeep overstepped the crease and Wade survives anyway. No clear evidence of an edge anyway. SL don't lose a review because he overstepped"
416,"Pradeep to Wade, no run stays behind the line and defends"
417,"Pradeep to Wade, no run stays back at the crease and he leaves it alone"
418,"Pradeep to Wade, no run angles across the left-hander and he safely leaves it alone"
419,"Pradeep to Wade, no run angles it across the left-hander and he watchfully leaves it alone"
420,"Herath to Johnson, no run tossed up down the leg side and he fails to tuck it away"
421,"Herath to Johnson, no run comes well forward and drives back to the bowler"
422,"Herath to Johnson, 1 run comes forward and gets an inside edge that goes wide of short leg"
423,"Herath to Wade, no run Dropped by Karunratne at short leg, defends and the inside edge goes fast and through Karunaratne's hands"
424,"Herath to Wade, no run tossed up and he comes forward and defends"
425,"Herath to Wade, no run comes forward and plays it towards cover"
426,"Dilshan to Johnson, no run tossed up on middle and he drives to mid-on"
427,"Dilshan to Johnson, no run"
428,"Dilshan to Johnson, no run tossed up outside off and he leaves it alone"
429,"Dilshan to Johnson, no run flatter delivery and he comes forward and defends"
430,"Dilshan to Johnson, no run comes forward and he pushes it towards cover"
431,"Dilshan to Johnson, no run tossed up outside off and he drives back to the bowler"
432,"Herath to Wade, no run"
433,"Herath to Wade, no run He's been given out caught at short leg and Wade wants to review it. And Wade might be right, and he is! He was forward to defend, spun, hit the top flap of the pad, deflected off the body to Karunaratne, there was evidence that it missed the glove"
434,"Herath to Wade, no run"
435,"Herath to Wade, no run Wade sweeps and ouch (!) Thirimanne comes in the way at short leg!"
436,"Herath to Wade, no run and once again! Thirimanne gets in the way of a full-blooded Wade sweep and this time he's hit on the leg, he shows good courage and comes back to his position"
437,"Herath to Wade, no run tossed up and he drives to cover"
438,"Dilshan to Johnson, no run gets forward and he drives to mid-on"
439,"Dilshan to Johnson, 1 run tossed up and he pushes it down to mid-off"
440,"Dilshan to Wade, no run this was pushed through quicker and he's beaten for turn and bounce, well bowled"
441,"Dilshan to Wade, 1 run pushed through flatter and he rocks back and cuts to sweeper cover"
442,"Dilshan to Johnson, no run comes well forward and he defends to the on side"
443,"Dilshan to Johnson, no run flatter delivery and he checks his drive to cover"
444,"Herath to Wade, 1 run tossed up and he comes well forward and he defends to the off side"
445,"Herath to Johnson, no run this one straightens, he leaves it alone to the keeper"
446,"Herath to Johnson, 1 run lunges forward and he gets a leading edge to the off side"
447,"Herath to Wade, no run flatter delivery and he drives back to the bowler"
448,"Herath to Wade, no run makes room and drives towards cover"
449,"Herath to Wade, 3 runs collision there! He places it to fine leg, Johnson has to hurry for the third and he collides with the keeper and leaps over Chandimal"
450,"Dilshan to Wade, no run this was spun a long way and he reached out and cut to the off side"
451,"Dilshan to Wade, no run"
452,"Dilshan to Wade, no run fuller delivery and he defends to the off side"
453,"Dilshan to Wade, no run quicker delivery and he goes back and defends"
454,"Dilshan to Wade, 1 run on the pads and he flicks it wide of square leg"
455,"Dilshan to Johnson, no run comes well forward and defends"
456,"Herath to Wade, no run tossed up ever so slowly and he drives on the up down to mid-off"
457,"Herath to Wade, no run"
458,"Herath to Wade, 2 runs tossed up and he moves across and paddles him down to fine leg"
459,"Herath to Wade, 2 runs floated outside off and he stays back and punches it wide of cover, nicely timed"
460,"Herath to Wade, 1 run gives it a lot of air and he comes forward and drives to long-on"
461,"Herath to Johnson, no run leaves it alone to the keeper, doesn't spin at all"
462,"Lakmal to Wade, 1 run bowls it full and swing it in, he comes forward and defends"
463,"Lakmal to Johnson, no run lands it outside the off stump and he safely leaves it alone to the keeper"
464,"Lakmal to Johnson, 1 run drifts on the pads and he chips it in the air wide of midwicket"
465,"Lakmal to Wade, no run"
466,"Lakmal to Wade, no run hits a good length outside off and he stays back and punches it wide of point"
467,"Lakmal to Wade, no run angles it across him and he steers it down to point"
468,"Pradeep to Johnson, no run Drops short of first slip! Pradeep unlucky, this was a genuine outside edge and it dropped short of Mathews at first slip, was he too deep?"
469,"Pradeep to Johnson, no run keeps it outside off and he safely leaves it alone"
470,"Pradeep to Siddle, no run lands outside off and he leaves it alone"
471,"Pradeep to Siddle, FOUR runs outside edge! Short of a length outside the off stump, he opens the face and angles it to third man"
472,"Pradeep to Siddle, no run tucks it away off the back foot towards midwicket"
473,"Lakmal to Wade, no run stays beside the line and he awkwardly steers it to the off side"
474,"Lakmal to Wade, no run fuller delivery and he pushes this back to the bowler"
475,"Lakmal to Wade, no run full delivery and he pushes it towards mid-off"
476,"Lakmal to Wade, no run Wade flicks this one down to midwicket"
477,"Lakmal to Wade, no run"
478,"Lakmal to Wade, no run hones in on the off stump and he pushes it towards cover"
479,"Pradeep to Siddle, no run this one keeps low before it reaches the keeper, hard time for Chandimal"
480,"Pradeep to Siddle, 3 runs good length on the pads and he flicks it wide of midwicket for three"
481,"Pradeep to Wade, 1 run stays beside the line and he steers it wide of cover"
482,"Pradeep to Siddle, (no ball) 3 runs swings it on the pads and he clips it to the wide open spaces to deep midwicket, looks like all fielders are on the off side"
483,"Pradeep to Wade, FOUR runs fullish on the pads and he works it away down to deep midwicket, half volley and it was put away"
484,"Pradeep to Wade, no run back of a length and he pushes it towards midwicket"
485,"Pradeep to Wade, no run stays beside the line and steers it to the off side"
486,"Lakmal to Siddle, no run lands it outside off and he safely leaves it alone"
487,"Lakmal to Siddle, no run bangs it in short and he ducks under that"
488,"Lakmal to Siddle, no run fullish in length on the off stump and he pushes it towards mid-off"
489,"Lakmal to Siddle, no run picks it from outside off and whips it away down to midwicket, the short-arm pull"
490,"Lakmal to Siddle, no run lunges forward and across and he's beaten completely"
491,"Lakmal to Siddle, no run fullish in length outside off and he doesn't chase that"
492,"Pradeep to Wade, FOUR runs that's a top shot! Good length delivery moving away, he gets across and times the punch crisply past point, the sweeper fails to cut it off"
493,"Pradeep to Wade, 1 run short of a length and he pushes it past point for a single"
494,"Pradeep to Siddle, no run lands it on a good length outside off and he leaves it alone, good carry to the keeper"
495,"Pradeep to Siddle, (no ball) yet another overstep, at this rate he will emulate Dilhara, defends it on the back foot"
496,"Pradeep to Siddle, 4 leg byes poor delivery, he strays on the pads and he flicks it away wide of the keeper to fine leg, given leg byes but replays showed it clipped his glove first"
497,"Pradeep to Siddle, 1 run good length outside off and he pushes it to the off side"
498,"Pradeep to Wade, 2 runs drifts towards the pads and he works it away behind square on the off side"
499,"Lakmal to Siddle, no run lunges forward and pokes at this delivery that leaves him outside off"
500,"Lakmal to Siddle, no run fuller delivery and he gets on the front foot and defends"
501,"Lakmal to Siddle, FOUR runs he bangs it in short, Siddle swivels and hooks and he gets a top edge that sails over the keeper and down to fine leg"
