,Data
578,"Cummins to Brathwaite, no run good length ball with plenty of width, Brathwaite flashes outside off and is beaten."
579,"Cummins to Brathwaite, no run very full on off stump, Brathwaite tries to whip this through midwicket and a leading edge skittles along the ground to mid-off."
580,"Cummins to Brathwaite, no run bouncer on the stumps, Brathwaite leaps to fight this off with his gloves. Greeted with nervous oooohhs from the crowd."
581,"Coulter-Nile to Holder, no run short ball, goes to pull and is beaten."
582,"Coulter-Nile to Holder, 2 runs good length ball on off, guided well wide of third man on the rope behind point and they come back for an easy two."
583,"Coulter-Nile to Holder, no run slower short ball on off, Holder struggles to keep the hands back, bottom edged pull goes off the thigh."
584,"Coulter-Nile to Holder, 1 run short ball at full pace this time sits up on the off stump line, laces a ferocious pull on one bounce to cow corner, 50 up for Holder at a run a ball. Can he finish off the chase?"
585,"Coulter-Nile to Brathwaite, SIX runs Brathwaite has officially joined the party! Another bouncer, wide outside off, Brathwaite has to drag this a long way to get it over midwicket, but that's pure muscle on the pull and it sails away."
586,"Coulter-Nile to Brathwaite, 1 run good length ball on fourth stump, opens the face to run it to third man."
587,"Cummins to Brathwaite, FOUR runs short on off, Brathwaite goes to pull again, flat bats this over mid-off. Not timed well at all but straight enough to be safe from picking out Finch on the ring."
588,"Cummins to Brathwaite, 2 runs short again, clear plan here, once again doesn't middle it but clears Warner by about 5 yards on the ring at mid-on. Australia sniffing closer here..."
589,"Cummins to Brathwaite, 1 run nearly a runout! At both ends! Fullish length ball driven to mid-on. Warner fields and fires at the non-striker's end, would've been out by 3 yards if it hit but was wide by 2 yards. Cummins fields the miss mid-pitch and throws to Carey, nearly nabs Holder but he's just in by 4 inches. Replay shows Carey knocked the bails off without the ball in his hands."
590,"Cummins to Holder, no run fullish length on off, defended to the off side."
591,"Cummins to Holder, no run bouncer, Holder cramped on the body, fends this off to silly point."
592,"Cummins to Holder, 1 leg bye bouncer on the body, goes off Holder's shoulder to fine leg. Didn't really play a shot but the umpire deems it to be evasive action and a leg bye is given."
593,"Starc to Holder, 1 run fullish length on off, guided off the back foot in front of point."
594,"Starc to Brathwaite, no run good length ball on off, guided to short third man."
595,"Starc to Holder, no run yorker on off stump, dug out off the toe to Starc."
596,"Starc to Holder, no run full toss at knee height wide outside off on sixth stump, Holder fans over the top of it nervously. Fingernails being chewed intensely in the crowd."
597,"Stoinis to Nurse, no run yorker on fourth stump, Nurse plays over the top, ball just misses the off stump."
598,"Stoinis to Nurse, no run bouncer on the body, Nurse turtles his head out of the way."
599,"Stoinis to Nurse, no run now a charge from Nurse. Stoinis saw it coming and pitched it full as Nurse ran down the pitch backing away from leg stump and he swings over the top with his head flying up."
600,"Stoinis to Nurse, 1 run low full toss into the pads, huge lbw shout given not out. Double-noise for sure. Australia decides not to review. And with good reason, inside edge off the pads with the ball taking a carom to point."
601,"Stoinis to Cottrell, 1 run full on the legs, clipped out to long leg."
602,"Stoinis to Nurse, 1 run yorker speared into the legs, dug out to long-on."
603,"Starc to Nurse, no run an absolute meatball of a full toss at thigh height on about sixth stump, Nurse flails wildly and misses badly. Second full toss West Indies have missed out on vs. Starc in the last two overs."
604,"Starc to Nurse, 1 leg bye yorker speared into the legs, misses a flick and the ball ricochets to point."
605,"Starc to Thomas, no run full and beaten."
606,"Starc to Thomas, no run full and defended."
607,"Starc to Thomas, no run yorker barely kept out to deny Starc a sixth to end the match."
608,"Stoinis to Nurse, no run good length ball on the stumps, defended."
609,"Stoinis to Nurse, no run slower ball yorker on off stump at 78 mph, defended."
610,"Stoinis to Nurse, no run full on middle, driven to cow corner, they turn down the single with 33 needed off 9 balls now. They're not exactly swinging for sixes here...."
611,"Stoinis to Nurse, no run full on the stumps, driven back to Stoinis."
612,"Stoinis to Nurse, 1 run short on the stumps, pulled to deep midwicket, sliding effort denies four after a carom from Coulter-Nile to Maxwell."
613,"Stoinis to Thomas, no run full on off, pushed into the off side, again they turn down a single. 32 to get off the final over."
614,"Coulter-Nile to Nurse, no run full on off, driven to long-off."
615,"Coulter-Nile to Nurse, no run short on the body, limp pull goes nowhere."
616,"Coulter-Nile to Nurse, FOUR runs short on the body, fierce pull behind square from Nurse, about 7 balls too late."
617,"Coulter-Nile to Nurse, FOUR runs full otuside off, driven past extra cover and beats the sweeper. Cosmetic adjustments to the final margin being made by Nurse."
618,"Coulter-Nile to Nurse, FOUR runs another short ball on the body, tickles a pull past short fine leg. Makes you wonder why they were content to pat out dot balls and turn down runs last over...."
619,"Coulter-Nile to Nurse, FOUR runs another firm drive to a full ball on off beats mid-off, but it's all in vain."
620,"6.32 Australia leak a series of boundaries at the end there but it matters little. This match was one of the best of the tournament so far, see-sawing back and forth almost from beginning to end. West Indies had Australia under heavy pressure in the first 20 overs but let the pressure go with some costly misses - Smith on 26 and Coulter-Nile on 61. The umpiring in this match left a lot to be desired but West Indies were bailed out numerous times on DRS. The Shimron Hetmyer runout and Andre Russell's regrettable slog vs. Starc were"
621,"West Indies were in a series of winning positions in both innings but couldn't slam the door shut. The defending champions showed their mettle to keep fighting back before coming out on top. Along with the England v Pakistan match, this is right near the top of the heap in terms of the best contest of the tournament so far. Pleasure to have you join us for the ride. For Alex Malcolm, Ranjith and the rest of the scoring team, I'm Peter Della Penna. Make sure to come back tomorrow for live coverage of the showdown in Bristol between"
622,Australia won by 15 runs
623,"Player of the match is Nathan Coulter-Nile, AUS"
