,Data
0,"Morkel to Ponting, 1 run Morkel digs it in short, Haddin gets on his toes and plays it towards backward point"
1,"Morkel to Haddin, 1 run length ball on middle and leg, driven firmly to mid-on, batsmen sprint through for a single"
2,"Morkel to Ponting, 1 run strays on to the pads, length ball, Ponting shuffles across his stumps and whips that away towards the fielder at fine leg"
3,"Morkel to Haddin, FOUR runs ugly-looking shot from Haddin, fetches him four nonetheless, slower ball outside off from Morkel, Haddin gives it the kitchen-sink, the bat turns in his hand as he plays the shot, but it still flies straight down the ground for a boundary"
4,"Morkel to Haddin, 1 run Haddin makes room and plays a shortish ball outside off towards third man for a single to retain the strike"
5,"Morkel to Haddin, 1 run back of a length, on middle stump, Ponting jumps and defends it towards mid-on"
6,"Morkel to Ponting, 1 run similar length, but a touch outside off, Ponting dabs that to third man for a single"
7,"Morkel to Haddin, no run good start from Morkel, ties Haddin down with an offstump ball, pitching just short of a length, Haddin blocks it back to the bowler"
8,"Morkel to Haddin, 1 run Haddin, as he has so often this innings, backs away from the stumps, Albie saw him and followed him, a yorker into the batsman, squeezed out by Haddin, and the batsmen pinch a single"
9,"Morkel to Ponting, 1 run on middle and leg, driven down to long-on by Ponting"
10,"Morkel to Haddin, 1 run full on off, Haddin bunts it down the ground towards mid-on, enough time for the batsmen to hustle through for a single"
11,"Morkel to Haddin, 2 runs Haddin comes down the track and throws his bat at an offstump ball, doesn't get hold of it, only manages to slice it behind point for a couple"
12,"Morkel to Haddin, 1 leg bye comes into the batsmen after pitching short of a length, Haddin doesn't cover for the movement, is hit on the thigh pad"
13,"Morkel to Ponting, no run gets forward and jabs it towards point"
14,"Morkel to Ponting, no run shortish ball on leg stump, Ponting plays it off his hip towards midwicket, placement isn't too god though"
15,"Morkel to Ponting, no run a jaffa from Morne, back of a length again, in the corridor outside off, Ponting fishes for it but is comprehensively beaten"
16,"Morkel to Ponting, 1 run on offstump this time, Ponting plays it with soft hands towards mid-off, the batsmen set off for the run immediately and completely it with time to spare"
17,"Morkel to Ponting, 1 run good length, draws the batsman forward, played towards extra cover for a single"
18,"Morkel to Haddin, (no ball) whoah, Albie completely lost control of that, a no-ball as well, that was way down the legside"
19,"Morkel to Haddin, SIX runs not the best ball to bowl on a free-hit, length on middle stump, Haddin backs away and hammers that towards the sightscreen to bring up the first six of the match"
20,"Morkel to Haddin, 1 wide wide down the leg side this time from Albie"
21,"Morkel to Haddin, 2 runs low full toss this time, Haddin gets it away towards long-on, batsmen decide to come back for two, it's direct hit at the non-striker's end from the boundary, third umpire is called for, but Ponting had made his ground"
22,"Morkel to Haddin, 1 run again Haddin decides to walk down the stumps and towrds the leg side, Albie follows him, flicked to midwicket"
23,"Morkel to Ponting, 1 run Albie keeps it full, this time on off and middle, Ponting drives firmly to long-on"
24,"Morkel to Haddin, FOUR runs Shot! yet again Haddin backs away, Albie doesn't follow him this time, placement is inch perfect on the thrash through the off, bisects cover and extra cover, and that's four"
25,"Morkel to Ponting, no run Morne starts with a pearler, that's a length ball pitching just outside off, Ponting goes for the drive but is beaten"
26,"Morkel to Ponting, no run this time Ponting gets behind the line and blocks it back to the bowler"
27,"Morkel to Ponting, FOUR runs slightly overpitched by Morkel, on middle and leg, Ponting lofts it over mid-on,. timing wasn't particularly good but enough to get it past the fielder and to the boundary"
28,"Morkel to Ponting, OUT shorter from Morne this time, Ponting tries to repeat the shot, miscued again, and this time he doesn't beat the fielder at mid-on, Albie Morkel runs back a few yards to complete the catch, and Ponting's got to go"
29,"Morkel to Hussey, no run shortish and a touch wide, Hussey is content to let that one through to the keeper"
30,"Morkel to Hussey, 1 run length ball on offstump, Hussey gets off the mark with a push wide of extra cover"
31,"Botha to Hussey, FOUR runs starts with a very wide ball, a touch short as well, Hussey steers that into the gap behind point and gets a boundary"
32,"Botha to Hussey, no run fuller, and turned to midwicket by Hussey"
33,"Botha to Hussey, no run on middle and leg, Hussey walks across his stumps, flicks it to midwicket"
34,"Botha to Hussey, 1 run a little short, Hussey gets on the back foot, opens the face to guide it to backward point for a single"
35,"Botha to Haddin, 1 run speared in towards legstump, Haddin nudges it off his pads for a single"
36,"Botha to Hussey, 1 run overpitched outside off, a wristy drive from Hussey has it travelling to long-on"
37,"Morkel to Hussey, 1 run starts the over with a wide ball, Hussey drives that uppishly but in the gap between cover and extra cover"
38,"Morkel to Haddin, no run full on middle and off, Haddin gets behind the line and defends back to the bowler"
39,"Morkel to Haddin, FOUR runs steps towards the leg side, back of a length ball, Haddin flat bats it over the bowler and to his left for a boundary"
40,"Morkel to Haddin, 1 wide attempts a split-finger slower ball, drags it down the leg side, that's a wide"
41,"Morkel to Haddin, no run much better line, on middle and off, fullish ball, Haddin defends cautiously"
42,"Morkel to Haddin, 1 run a bit of room outside off, Haddin guides it down to third man for a single, yet another occasion when he stepped towards leg"
43,"Morkel to Hussey, no run keeps Hussey honest with a length ball on off, the batsmen defends it off the front foot"
44,"Botha to Haddin, no run played to square leg"
45,"Botha to Haddin, no run Botha keeps it on al ength, around middle and off, played back to the bowler"
46,"Botha to Haddin, no run a touch outside off, opnes the face to play it toward backward point"
47,"Botha to Haddin, 1 run driven firmly toward mid-on, too firmly to take a single"
48,"Botha to Hussey, 2 runs Botha drags it a touch short, Hussey sweeps it square, JP Duminy sprints across at midwicket to cut it off"
49,"Botha to Hussey, 1 run full and outside off, good use of the wrists from Hussey, he places it wide of the mid-on fielder for a single"
50,"Morkel to Hussey, no run length ball, on off, Hussey pushes it towards cover"
51,"Morkel to Hussey, no run lovely ball, pitches just outside off, and straightens, Hussey was looking for the drive but is beaten"
52,"Morkel to Hussey, no run on middle stump this time, defended off the backfoot towards cover"
53,"Morkel to Hussey, no run length ball on off, Hussey drive but it's cut off by Gibbs at short cover"
54,"Morkel to Hussey, FOUR runs shortish ball on middle, Hussey goes for the pull, miscued, balloons over Albie Morkel at mid-on, well-timed enough to send it away to the boundary"
55,"Morkel to Hussey, 1 run outside off this time, Hussey glides it down to third man for a single"
56,"Botha to Hussey, 1 run quicker ball, flat and on middle, Hussey gets behind the line and plays it towards mid-on"
57,"Botha to Haddin, no run shorter, Haddin stays on the backfoot and turns it to square leg, no run"
58,"Botha to Haddin, 1 run a bit of a it to this one, outside leg, Haddin sweeps it to get off the strike"
59,"Botha to Hussey, no run defended towards point, no run for Hussey"
60,"Botha to Hussey, 1 run length ball, outside off, Hussey whips it down to long-on"
61,"Botha to Haddin, 1 run fourth single of the over to end it, again it is played to long-on, this time by Haddin"
62,"Morkel to Haddin, no run starts with a full ball on off, punched towards covers"
63,"Morkel to Haddin, no run Albie keeps it full, Haddin drives to mid-off, but too firmly to get a single"
64,"Morkel to Haddin, OUT Horrendous, horrendous mix-up, Hussey's run out, Albie sends down a good yorker, Haddin jabs that towards backward point and took one step before deciding against the run, Hussey was charging down and kept running, both batsmen were nearly at the"
65,"Morkel to Haddin, FOUR runs a little bit of width from Albie, a delicate shot from Haddin, just helps it on it's way over the vacant first slip for a boundary to bring up his fifty"
66,"Morkel to Haddin, 1 run full and straight, driven down to long on"
67,"Morkel to Hussey, no run length ball outside off, driven towards mid-on"
68,"Botha to Haddin, 1 wide down the leg side, and that's a wide"
69,"Botha to Haddin, no run wide outside off, Haddin pads it away"
70,"Botha to Haddin, no run about a foot outside off stump, Haddin stays on the backfoot and glides it to short third man"
71,"Botha to Haddin, no run turned towards midwicket this time, straight to the fielder"
72,"Botha to Haddin, 1 run full toss on legstump, swept behind square for a single"
73,"Botha to Hussey, 1 run, OUT What is going on here? Another run out, full outside off, Hussey stretches and steers it towards third man, Haddin sets off for the second, Hussey's not interested, Albie throws it from the deep to Boucher, Haddin is yards out of his crease"
74,"Botha to Ferguson, no run a bit of turn for Botha, pitched outside off and came sharply into Ferguson who wasn't expecting the spin, misses the ball"
75,"Morkel to Hussey, 2 runs length ball outside off, Hussey goes for the off drive, an inside edge takes it towards midwicket"
76,"Morkel to Hussey, no run slower ball, 116.2kmph, Hussey is surprised by that one, manages to tap it down to the bowler"
77,"Morkel to Hussey, no run a bit of width, an offcutter from Albie, chopped down to backward point"
78,"Morkel to Hussey, 1 wide wide down the leg side"
79,"Morkel to Hussey, no run back of a length, slanting towards middle and leg, Hussey defends off the back foot"
80,"Morkel to Hussey, 1 run another slower offbreak, 113kph, sliced to third man for a single"
81,"Morkel to Ferguson, 1 run length ball outside off, Ferguson walks into a drive, cut off by the sweeper at the boundary"
82,"Botha to Ferguson, no run a touch short, spinning in, Ferguson whips it to midwicket, but doesn't beat the fielder"
83,"Botha to Ferguson, no run again Ferguson gets it away to midwicket, another dot ball"
84,"Botha to Ferguson, no run lot of turn for Botha on this ball, Ferguson misses as he attempts to get it away to the leg side"
85,"Botha to Ferguson, no run defended back to the bowler"
86,"Botha to Ferguson, no run firmly driven by Ferguson, but Botha gets across to his right to cut it off"
87,"Botha to Ferguson, 1 run finally he gets a run, punched to long-on for a single which helps him retain the strike"
88,"Morkel to Ferguson, no run Ferguson tries to cut that one from Albie, gets a bottom edge which trickles towards cover"
89,"Morkel to Ferguson, no run"
90,"Morkel to Ferguson, 1 run full on middle and leg, Ferguson walks across his stumps and gets it away to midwicket"
91,"Morkel to Hussey, no run Albie's sending down a lot of slower balls here, 110kmph, overpitched on the pads, Hussey taps it back to the bowler"
92,"Morkel to Hussey, 2 runs another slower ball, this is slightly shorter, Hussey works it behind square, pushes for the second and gets it comfortably"
93,"Morkel to Hussey, no run wide outside off, goes for a backfoot drive, which ends up at gully"
94,"Botha to Ferguson, 1 run pitches well outside off and turns in, Ferguson flat bats it powerfully to the long-off fielder"
95,"Botha to Hussey, 1 run full and pitching on off, Hussey gets on the backfoot to whip it toward mid-on"
96,"Botha to Ferguson, no run wide outside off, umpire might have thought about calling that calling that one but decides against it"
97,"Botha to Ferguson, no run sweeps it to square leg, no run for Ferguson"
98,"Botha to Ferguson, no run"
99,"Botha to Ferguson, no run Botha goves it a bit of air, Ferguson plays it fine down the leg side, Hussey called for the single, but the batsmen decide not go for it"
100,"Botha to Ferguson, 1 run quicker delivery from Botha, clipped off the batsman's toes behind square for a single, brings up Australia's 150"
101,"Botha to Hussey, 1 run tossed up, but sliding down leg, Hussey works it to square leg for a single"
102,"Botha to Ferguson, no run the doosra from Botha, Ferguson wanted to play it to leg, but gets a leading edge which lands safely"
103,"Botha to Ferguson, no run flighted delivery, defended back to the bowler"
104,"Botha to Ferguson, no run on a length on middle, turned to mid-on, no run"
105,"Botha to Ferguson, 1 run driven firmly, mid-on has to run to his left to cut that one off"
106,"Duminy to Ferguson, 1 run Duminy flights it, lands on middle and off, easily turned to midwicket for a single"
107,"Duminy to Hussey, no run Hussey stays on the backfoot and chops it towards point, no run"
108,"Duminy to Hussey, no run driven by Hussey, Duminy gets across to his right to cut if off"
109,"Duminy to Hussey, no run driven to short cover this time, another dot ball, good over so far from Duminy"
110,"Duminy to Hussey, 1 run gets a single this time, carted towards long-on"
111,"Duminy to Ferguson, 1 wide wide down the leg side"
112,"Duminy to Ferguson, 1 run punched to long-on for another single"
113,"Steyn to Ferguson, no run short of a length delivery, outside off, no shot offered by Ferguson"
114,"Steyn to Ferguson, FOUR runs wonderful shot from Ferguson, it wasn't particularly short but Ferguson gets on the backfoot and cuts that powerfully, wide of Duminy at point and the sweeper can't cut if off either"
115,"Steyn to Ferguson, no run good length delivery, defended watchfully by Ferguson"
116,"Steyn to Ferguson, no run back of a length, on offstump, Ferguson defends that towards the covers"
117,"Steyn to Ferguson, no run short ball from Steyn, Ferguson sways out of the way"
118,"Steyn to Ferguson, 1 leg bye slower ball from Steyn to end the over, 126kmh (he's been operating in the mid 140s this over), Ferguson looks to nudge it to the leg side, misses the ball and is rapped on the pads outside off"
119,"Duminy to Ferguson, no run tossed up by Duminy, on middle and leg, Ferguson goes for the sweep, hit on the pads, no run"
120,"Duminy to Ferguson, FOUR runs lovely drive from Ferguson, gets on the front foot and lashes that through the covers"
121,"Duminy to Ferguson, 1 run"
122,"Duminy to Hussey, no run shorter from duminy, Hussey stays on the backfoot and pushes it towards mid-off"
123,"Duminy to Hussey, 2 runs glanced very fine by Hussey, the batsmen sprint through for two"
124,"Duminy to Hussey, no run punched confidently by Hussey, but straight to de Villiers at short cover"
125,"Steyn to Ferguson, OUT Steyn strikes, short and pretty wide, Ferguson slashes at it, gets a top edge which flies to Johan Botha at third man, Botha back pedals a few steps to complete that catch, making sure that he doesn't cross the boundary"
126,"Steyn to Hussey, 1 wide another bounce from Steyn, Hussey ducks under it, it was down the leg side and the umpire deems it a wide"
127,"Steyn to Hussey, no run much fuller and outside off, Hussey dabs it to backward point, straight to the fielder"
128,"Steyn to Hussey, no run pitches on off and carries on with the angle, Hussey shoulders arms to that one"
129,"Steyn to Hussey, FOUR runs easy pickings for Hussey, Steyn strays onto the pads, tickled fine for a boundary"
130,"Steyn to Hussey, 1 run reverts to his offstump line, nicely glided down to third man for a single"
131,"Steyn to Hopes, no run a bit wide, Hopes throws his bat at it, firmly hit but placement isn't too good, doesn't beat the man at point"
132,"Botha to Hussey, 1 run nicely tossed up by Botha, full, driven down to long-on by Hussey"
133,"Botha to Hopes, 1 run drags it short this time, Hopes gets off the mark with a flat batted shot to long-on"
134,"Botha to Hussey, 1 run gives it some air again, overpitched on legstump, Hussey works it behind square on the leg side"
135,"Botha to Hopes, no run much quicker from Botha, pushed off the backfoot to extra cover"
136,"Botha to Hopes, 1 run on middle and leg, whipped to midwicket by Hopes"
137,"Botha to Hussey, 1 run he continues to toss it up to the left-hander from around the wicket, Hussey drills it along the ground to the fielder at long-on"
138,"Ntini to Hussey, no run starts with a shortish ball, defended with an angled bat by Hussey, the ball bounces at his feet and nearly rolls onto the stumps"
139,"Ntini to Hussey, no run similar length, just outside off, Hussey gets on the back foot and jabs it to backward point"
140,"Ntini to Hussey, 1 run short and quite wide, lashed to the sweeper at the boundary by Hussey"
141,"Ntini to Hopes, no run bowled from very wide of the crease, angling into Hopes, it was a short ball, Hopes gets behind the line and defends"
142,"Ntini to Hopes, 1 run much fuller, just outside off, Hopes gets on the front foot and drives down to long-off"
143,"Ntini to Hussey, 1 run sharp single from the batsmen, Ntini again bowled from very wide of the crease, Hussey gets an inside edge onto the pad"
144,"Botha to Hussey, no run overpitched on legstump, Hussey goes for the sweep, doesn't connect with the ball"
145,"Botha to Hussey, 1 run closes the face of the bat to get it away to square leg"
146,"Botha to Hopes, 1 run Hopes backs away to make room, and dabs that towards point"
147,"Botha to Hussey, no run fullish on middle, driven to the fielder at mid-off"
148,"Botha to Hussey, 1 run low full toss on offstump, Hussey gets on the front foot and powers it to long-on"
149,"Botha to Hopes, 1 run nudged in front of square leg for a single to end Botha's spell"
150,"Ntini to Hopes, no run length ball that was slanting towards middle and leg, Hopes gets across and punches it towards mid-on"
151,"Ntini to Hopes, FOUR runs Lovely timing from Hopes, same length from Ntini as the previous ball, but it was around offstump this time, Hopes punched it straight down the ground, hardly any power in the shot but the ball raced away"
152,"Ntini to Hopes, no run Hopes backs away and stabs the ball towards point,no run"
153,"Ntini to Hopes, FOUR runs ooh! nearly caught behind, Hopes was going for the straight drive but got an outside edge which flew just wide of Boucher"
154,"Ntini to Hopes, no run half-volley on legstump, Hopes can't capitalise on it, his whip goes straight to the fielder"
155,"Ntini to Hopes, 1 run short of a length outside off, jabbed towards short cover, a quick single is pinched"
156,"Morkel to Hopes, no run very full, Hopes finds the mid wicket fielder on the flick"
157,"Morkel to Hopes, no run full ball, Hopes turns it to mid-on"
158,"Morkel to Hopes, no run on offstump, Hopes carves it behind point, but goes straight to the fielder"
159,"Morkel to Hopes, 1 run length ball on middle and off, driven to mid-on for a single"
160,"Morkel to Hussey, 1 run another length ball from Albie, Hussey punches it towards long-on for another single"
161,"Morkel to Hopes, no run and finishes the over with a length ball just outside off, Hopes goes for the drive but gets an inside edge onto his pad"
162,"Morkel to Hussey, no run he's on target straight away, back of a length, on middle and leg, Hussey is pinned to his back foot and he taps it back to the bowler"
163,"Morkel to Hussey, no run more towards the offstump this time, driven towards cover by Hussey, another dot ball"
164,"Morkel to Hussey, 1 run Hussey stays on the backfoot and plays it behind point with soft hands, 'Yes' he calls immediately, and they're through for a single"
165,"Morkel to Hopes, no run again a good length, Hopes steers it towards point but no run"
166,"Morkel to Hopes, FOUR runs short and wide, gets the treatment, Hopes throws his bat at that one, and Amla, the sweeper, had no chance of cutting that off"
167,"Morkel to Hopes, no run this time Hopes plays it towards extra cover, too firmly to get a single"
168,"Morkel to Hussey, 2 runs overpitched outside off, Hussey lashes that towards extra cover, Botha makes a great dive to take the pace off the ball, they still get a couple"
169,"Morkel to Hopes, 1 run steady stuff from Albie here, Hopes pushes this one down to long-off for a single"
170,"Morkel to Hussey, 1 run fuller on the pads, Hussey gets across and guides it to square leg"
171,"Morkel to Hopes, 1 run lovely yorker from Albie, dug out towards point, a tight single is stolen"
172,"Morkel to Hussey, 1 run low full toss on offstump, Hussey dismisses it towards long-off, only a single to end the over"
173,"Morkel to Hussey, no run Morne gets some steepling bounce, 141 kmph, wasn't particularly short, but it bounced much more than Hussey expected, it sails through to the keeper"
174,"Morkel to Hussey, 1 run fuller, Hussey tips it towards mid-on to get off the strike"
175,"Morkel to Hopes, 2 runs Morne drags it a bit short, Hopes goes for the pull, not particularly well-timed, Ntini has enough time to come across and cut it off on the square leg boundary"
176,"Morkel to Hopes, 1 run similar length from Morne, firmly struck by Hopes, in front of square this time, but only a single"
177,"Morkel to Hussey, 1 run pitched up this time, Hussey was looking to drive to the on side, gets an inside edge onto his pads"
178,"Morkel to Hopes, 1 run shorter to Hopes, well outside off, Hopes throws his bat at it, the ball speeds away behind square for a single"
179,"Ntini to Hopes, 1 run short and outside off again, Hopes cuts that with a flourish, third man is able to cut that one off"
180,"Ntini to Hussey, 1 run Hussey was coming down the track, Ntini pitched it shorter, Hussey runs it down to third man for a single"
181,"Ntini to Hopes, FOUR runs a length ball, and width is provided, Hopes cashes in, thrashes it through the covers for a boundary"
182,"Ntini to Hopes, FOUR runs Ntini goes for the yorker, ends up as a low full toss on legstump, Hopes gets across and guides it to the fine leg boundary, wonderful from Hopes"
183,"Ntini to Hopes, 1 run length ball and close to offstump, Hopes punches it towards extra cover for a single"
184,"Ntini to Hussey, 1 run yorker on middle stump, Hussey was looking to give the charge, he jabs it into the ground and towards the offside for a single"
185,"Steyn to Hussey, 1 run starts with a 146kmph short of length ball, it was close to offstump but Hussey managed to get inside it and dab it to third man to reach his half-century"
186,"Steyn to Hopes, 1 run length and outside off, Hopes carves it to the sweeper for a single"
187,"Steyn to Hussey, 2 runs Hussey stays on the backfoot and nudges a length ball behind point, he pushes Hopes into coming for a second"
188,"Steyn to Hussey, 1 run the angle is allowing Hussey to just open the face of the bat and run it towards third man,"
189,"Steyn to Hopes, 1 run wide outside off, Hopes strikes it well, it races across the outfield, but doesn't beat the sweeper"
190,"Steyn to Hussey, no run yorker on middle and off, 142kmph, Hussey manages to squeeze it back to the bowler"
191,"Morkel to Hopes, 1 run slower back-of-a-length ball, outside off, Hopes again plays it out to the sweeper for a single"
192,"Morkel to Hussey, 1 run Hussey looks to back away, Morne follows him, Hussey tips it at his feet and sets off for the single, superb running there"
193,"Morkel to Hopes, OUT Hopes is gone, he saw that the fine leg was up, so he walked across the stumps to pick up a middle stump ball and tried to chip it over fine leg, it looked pretty flamboyant but he didn't get enough on it, and Dale Steyn takes a simple catch to end"
194,"Morkel to Johnson, 1 run shortish and on the pads, Johnson dabs it square for a single to get off the mark"
195,"Morkel to Hussey, FOUR runs overpitched and wide, Hussey backs away and carves that behind point for a boundary, wonderful placement that"
196,"Morkel to Hussey, 1 run this one is pitched up, Hussey punches it towards long-off, again he wants the second but the batsmen decide against it"
197,"Morkel to Hussey, 1 run hit with conviction by Hussey, Albie tests him with the bouncer, pulled to midwicket for a single"
198,"Morkel to Ferguson, no run watchfully plays a fullish ball towards mid-off"
199,"Morkel to Ferguson, no run nearly a yorker, on offstump, dug out to short cover"
200,"Morkel to Ferguson, 1 run slower ball from Albie, not too well timed a drive from Ferguson, but gets the placement right for a single"
201,"Morkel to Hussey, FOUR runs short ball again from Albie, that's wasn't too quick either, 117kmph, Hussey crashes that through midwicket for a boundary"
202,"Morkel to Hussey, 1 run a bit of width, Hussey stays on the back foot and jabs it towards backward point for a single"
203,"Duminy to Hussey, 2 runs starts off with a full ball that is mistimed to long-on, so poorly timed that they can get two"
204,"Duminy to Hussey, no run watchfully defended off the front foot to the bowler"
205,"Duminy to Hussey, no run Duminy's giving it a lot of air here, on middle and leg, Hussey dabs it back down the ground"
206,"Duminy to Hussey, no run flatter, nearly a yorker, defended off the front foot"
207,"Duminy to Hussey, FOUR runs flighted this time, Hussey crunches it through covers for a boundary, superb shot that"
208,"Duminy to Hussey, no run Duminy does away with the flight, fires it in towards the base of legstump, Hussey manages to keep it out"
209,"Steyn to Hussey, 1 run Steyn sends down a shortish ball, Hussey steers that towards covers for a single"
